exp=reflexive-matrix_reflexive=0-matrix_antecedent=1-refl1=themselves-refl2=herself-precede=0	0		These drivers who approached herself visit a girl.
exp=reflexive-matrix_reflexive=0-matrix_antecedent=1-refl1=herself-refl2=themselves-precede=1	1		Every gal that does forget herself is kissing some customers.
exp=reflexive-matrix_reflexive=0-matrix_antecedent=1-refl1=herself-refl2=themselves-precede=0	0		Every gal that does forget themselves is kissing some customers.
exp=reflexive-matrix_reflexive=0-matrix_antecedent=1-refl1=themselves-refl2=herself-precede=1	1		All teachers that will love themselves dislike the gal.
exp=reflexive-matrix_reflexive=0-matrix_antecedent=1-refl1=themselves-refl2=herself-precede=0	0		All teachers that will love herself dislike the gal.
exp=reflexive-matrix_reflexive=0-matrix_antecedent=1-refl1=herself-refl2=themselves-precede=1	1		A girl who might return to herself hasn't approached a lot of guests.
exp=reflexive-matrix_reflexive=0-matrix_antecedent=1-refl1=herself-refl2=themselves-precede=0	0		A girl who might return to themselves hasn't approached a lot of guests.
exp=reflexive-matrix_reflexive=0-matrix_antecedent=1-refl1=himself-refl2=themselves-precede=1	1		This boy who isn't investigating himself had kissed many adults.
exp=reflexive-matrix_reflexive=0-matrix_antecedent=1-refl1=himself-refl2=themselves-precede=0	0		This boy who isn't investigating themselves had kissed many adults.
exp=reflexive-matrix_reflexive=0-matrix_antecedent=1-refl1=themselves-refl2=itself-precede=1	1		Some actors who investigate themselves dislike some library.
exp=reflexive-matrix_reflexive=0-matrix_antecedent=1-refl1=themselves-refl2=itself-precede=0	0		Some actors who investigate itself dislike some library.
exp=reflexive-matrix_reflexive=0-matrix_antecedent=1-refl1=themselves-refl2=herself-precede=1	1		Some doctors that will criticize themselves attack the actress.
exp=reflexive-matrix_reflexive=0-matrix_antecedent=1-refl1=themselves-refl2=herself-precede=0	0		Some doctors that will criticize herself attack the actress.
exp=reflexive-matrix_reflexive=0-matrix_antecedent=1-refl1=themselves-refl2=herself-precede=1	1		These pedestrians that return to themselves help that waitress.
exp=reflexive-matrix_reflexive=0-matrix_antecedent=1-refl1=themselves-refl2=herself-precede=0	0		These pedestrians that return to herself help that waitress.
exp=reflexive-matrix_reflexive=0-matrix_antecedent=1-refl1=herself-refl2=themselves-precede=1	1		That gal that knew herself couldn't help some patients.
exp=reflexive-matrix_reflexive=0-matrix_antecedent=1-refl1=herself-refl2=themselves-precede=0	0		That gal that knew themselves couldn't help some patients.
exp=reflexive-matrix_reflexive=0-matrix_antecedent=1-refl1=themselves-refl2=herself-precede=1	1		The guys that were returning to themselves kiss that waitress.
exp=reflexive-matrix_reflexive=0-matrix_antecedent=1-refl1=themselves-refl2=herself-precede=0	0		The guys that were returning to herself kiss that waitress.
exp=reflexive-matrix_reflexive=0-matrix_antecedent=1-refl1=themselves-refl2=herself-precede=1	1		Many customers who forgot themselves should hate this woman.
exp=reflexive-matrix_reflexive=0-matrix_antecedent=1-refl1=themselves-refl2=herself-precede=0	0		Many customers who forgot herself should hate this woman.
exp=reflexive-matrix_reflexive=0-matrix_antecedent=1-refl1=themselves-refl2=herself-precede=1	1		Many teenagers who haven't respected themselves won't describe that lady.
exp=reflexive-matrix_reflexive=0-matrix_antecedent=1-refl1=themselves-refl2=herself-precede=0	0		Many teenagers who haven't respected herself won't describe that lady.
exp=reflexive-matrix_reflexive=0-matrix_antecedent=1-refl1=herself-refl2=themselves-precede=1	1		The woman who was kissing herself attacked all customers.
exp=reflexive-matrix_reflexive=0-matrix_antecedent=1-refl1=herself-refl2=themselves-precede=0	0		The woman who was kissing themselves attacked all customers.
exp=reflexive-matrix_reflexive=0-matrix_antecedent=1-refl1=herself-refl2=themselves-precede=1	1		A lady that criticizes herself praises many girls.
exp=reflexive-matrix_reflexive=0-matrix_antecedent=1-refl1=herself-refl2=themselves-precede=0	0		A lady that criticizes themselves praises many girls.
exp=reflexive-matrix_reflexive=0-matrix_antecedent=1-refl1=herself-refl2=themselves-precede=1	1		Some lady that is discussing herself did approach some teachers.
exp=reflexive-matrix_reflexive=0-matrix_antecedent=1-refl1=herself-refl2=themselves-precede=0	0		Some lady that is discussing themselves did approach some teachers.
exp=reflexive-matrix_reflexive=0-matrix_antecedent=1-refl1=herself-refl2=themselves-precede=1	1		The lady who might approach herself approached some women.
exp=reflexive-matrix_reflexive=0-matrix_antecedent=1-refl1=herself-refl2=themselves-precede=0	0		The lady who might approach themselves approached some women.
exp=reflexive-matrix_reflexive=0-matrix_antecedent=1-refl1=themselves-refl2=itself-precede=1	1		All actors who love themselves discussed that public park.
exp=reflexive-matrix_reflexive=0-matrix_antecedent=1-refl1=themselves-refl2=itself-precede=0	0		All actors who love itself discussed that public park.
exp=reflexive-matrix_reflexive=0-matrix_antecedent=1-refl1=themselves-refl2=himself-precede=1	1		Many boys that haven't seen themselves might return to every man.
exp=reflexive-matrix_reflexive=0-matrix_antecedent=1-refl1=themselves-refl2=himself-precede=0	0		Many boys that haven't seen himself might return to every man.
exp=reflexive-matrix_reflexive=0-matrix_antecedent=1-refl1=himself-refl2=themselves-precede=1	1		This guy who shouldn't investigate himself listened to waitresses.
exp=reflexive-matrix_reflexive=0-matrix_antecedent=1-refl1=himself-refl2=themselves-precede=0	0		This guy who shouldn't investigate themselves listened to waitresses.
exp=reflexive-matrix_reflexive=0-matrix_antecedent=1-refl1=herself-refl2=themselves-precede=1	1		That lady that insults herself watched a lot of men.
exp=reflexive-matrix_reflexive=0-matrix_antecedent=1-refl1=herself-refl2=themselves-precede=0	0		That lady that insults themselves watched a lot of men.
exp=reflexive-matrix_reflexive=0-matrix_antecedent=1-refl1=themselves-refl2=herself-precede=1	1		The stories that didn't describe themselves can resemble that gal.
exp=reflexive-matrix_reflexive=0-matrix_antecedent=1-refl1=themselves-refl2=herself-precede=0	0		The stories that didn't describe herself can resemble that gal.
exp=reflexive-matrix_reflexive=0-matrix_antecedent=1-refl1=themselves-refl2=itself-precede=1	1		A lot of teenagers that praise themselves had talked about some cafe .
exp=reflexive-matrix_reflexive=0-matrix_antecedent=1-refl1=themselves-refl2=itself-precede=0	0		A lot of teenagers that praise itself had talked about some cafe .
exp=reflexive-matrix_reflexive=0-matrix_antecedent=1-refl1=themselves-refl2=herself-precede=1	1		Some actresses who dislike themselves hate some woman.
exp=reflexive-matrix_reflexive=0-matrix_antecedent=1-refl1=themselves-refl2=herself-precede=0	0		Some actresses who dislike herself hate some woman.
exp=reflexive-matrix_reflexive=0-matrix_antecedent=1-refl1=themselves-refl2=himself-precede=1	1		All drivers that hate themselves hadn't cared for this man.
exp=reflexive-matrix_reflexive=0-matrix_antecedent=1-refl1=themselves-refl2=himself-precede=0	0		All drivers that hate himself hadn't cared for this man.
exp=reflexive-matrix_reflexive=0-matrix_antecedent=1-refl1=themselves-refl2=itself-precede=1	1		Many guys that aren't listening to themselves didn't dislike a newspaper article.
exp=reflexive-matrix_reflexive=0-matrix_antecedent=1-refl1=themselves-refl2=itself-precede=0	0		Many guys that aren't listening to itself didn't dislike a newspaper article.
exp=reflexive-matrix_reflexive=0-matrix_antecedent=1-refl1=themselves-refl2=herself-precede=1	1		Many waiters that flee from themselves are referencing this girl.
exp=reflexive-matrix_reflexive=0-matrix_antecedent=1-refl1=themselves-refl2=herself-precede=0	0		Many waiters that flee from herself are referencing this girl.
exp=reflexive-matrix_reflexive=0-matrix_antecedent=1-refl1=themselves-refl2=itself-precede=1	1		Some girls who weren't kissing themselves loved a documentary.
exp=reflexive-matrix_reflexive=0-matrix_antecedent=1-refl1=themselves-refl2=itself-precede=0	0		Some girls who weren't kissing itself loved a documentary.
exp=reflexive-matrix_reflexive=0-matrix_antecedent=1-refl1=themselves-refl2=himself-precede=1	1		All boys who discuss themselves have criticized a guy.
exp=reflexive-matrix_reflexive=0-matrix_antecedent=1-refl1=themselves-refl2=himself-precede=0	0		All boys who discuss himself have criticized a guy.
exp=reflexive-matrix_reflexive=0-matrix_antecedent=1-refl1=himself-refl2=themselves-precede=1	1		That boy that hadn't visited himself is helping all drivers.
exp=reflexive-matrix_reflexive=0-matrix_antecedent=1-refl1=himself-refl2=themselves-precede=0	0		That boy that hadn't visited themselves is helping all drivers.
exp=reflexive-matrix_reflexive=0-matrix_antecedent=1-refl1=itself-refl2=themselves-precede=1	1		This bank that resembles itself doesn't resemble these libraries.
exp=reflexive-matrix_reflexive=0-matrix_antecedent=1-refl1=itself-refl2=themselves-precede=0	0		This bank that resembles themselves doesn't resemble these libraries.
exp=reflexive-matrix_reflexive=0-matrix_antecedent=1-refl1=themselves-refl2=herself-precede=1	1		The women that didn't watch themselves observe this lady.
exp=reflexive-matrix_reflexive=0-matrix_antecedent=1-refl1=themselves-refl2=herself-precede=0	0		The women that didn't watch herself observe this lady.
exp=reflexive-matrix_reflexive=0-matrix_antecedent=1-refl1=themselves-refl2=itself-precede=1	1		The boys who love themselves aren't returning to every cafe .
exp=reflexive-matrix_reflexive=0-matrix_antecedent=1-refl1=themselves-refl2=itself-precede=0	0		The boys who love itself aren't returning to every cafe .
exp=reflexive-matrix_reflexive=0-matrix_antecedent=1-refl1=itself-refl2=themselves-precede=1	1		Some commentary that wasn't insulting itself described the guests.
exp=reflexive-matrix_reflexive=0-matrix_antecedent=1-refl1=itself-refl2=themselves-precede=0	0		Some commentary that wasn't insulting themselves described the guests.
exp=reflexive-matrix_reflexive=0-matrix_antecedent=1-refl1=themselves-refl2=itself-precede=1	1		Some humans who investigate themselves discussed that hospital.
exp=reflexive-matrix_reflexive=0-matrix_antecedent=1-refl1=themselves-refl2=itself-precede=0	0		Some humans who investigate itself discussed that hospital.
exp=reflexive-matrix_reflexive=0-matrix_antecedent=1-refl1=themselves-refl2=herself-precede=1	1		Some teenagers that visit themselves haven't talked about every waitress.
exp=reflexive-matrix_reflexive=0-matrix_antecedent=1-refl1=themselves-refl2=herself-precede=0	0		Some teenagers that visit herself haven't talked about every waitress.
exp=reflexive-matrix_reflexive=0-matrix_antecedent=1-refl1=herself-refl2=themselves-precede=1	1		That gal who knew herself can't criticize teachers.
exp=reflexive-matrix_reflexive=0-matrix_antecedent=1-refl1=herself-refl2=themselves-precede=0	0		That gal who knew themselves can't criticize teachers.
exp=reflexive-matrix_reflexive=0-matrix_antecedent=1-refl1=themselves-refl2=herself-precede=1	1		Boys that wouldn't visit themselves couldn't approach a waitress.
exp=reflexive-matrix_reflexive=0-matrix_antecedent=1-refl1=themselves-refl2=herself-precede=0	0		Boys that wouldn't visit herself couldn't approach a waitress.
exp=reflexive-matrix_reflexive=0-matrix_antecedent=1-refl1=themselves-refl2=itself-precede=1	1		Many students who see themselves hadn't seen every dish.
exp=reflexive-matrix_reflexive=0-matrix_antecedent=1-refl1=themselves-refl2=itself-precede=0	0		Many students who see itself hadn't seen every dish.
exp=reflexive-matrix_reflexive=0-matrix_antecedent=1-refl1=themselves-refl2=itself-precede=1	1		Some doctors that talk about themselves praise an commentary.
exp=reflexive-matrix_reflexive=0-matrix_antecedent=1-refl1=themselves-refl2=itself-precede=0	0		Some doctors that talk about itself praise an commentary.
exp=reflexive-matrix_reflexive=0-matrix_antecedent=1-refl1=themselves-refl2=itself-precede=1	1		A lot of actresses that are talking to themselves wouldn't describe this play.
exp=reflexive-matrix_reflexive=0-matrix_antecedent=1-refl1=themselves-refl2=itself-precede=0	0		A lot of actresses that are talking to itself wouldn't describe this play.
exp=reflexive-matrix_reflexive=0-matrix_antecedent=1-refl1=herself-refl2=themselves-precede=1	1		Every girl that has described herself isn't leaving all guys.
exp=reflexive-matrix_reflexive=0-matrix_antecedent=1-refl1=herself-refl2=themselves-precede=0	0		Every girl that has described themselves isn't leaving all guys.
exp=reflexive-matrix_reflexive=0-matrix_antecedent=1-refl1=herself-refl2=itself-precede=1	1		This gal that wasn't hugging herself admired that book.
exp=reflexive-matrix_reflexive=0-matrix_antecedent=1-refl1=herself-refl2=itself-precede=0	0		This gal that wasn't hugging itself admired that book.
exp=reflexive-matrix_reflexive=0-matrix_antecedent=1-refl1=themselves-refl2=herself-precede=1	1		The gals that weren't helping themselves weren't kissing some girl.
exp=reflexive-matrix_reflexive=0-matrix_antecedent=1-refl1=themselves-refl2=herself-precede=0	0		The gals that weren't helping herself weren't kissing some girl.
exp=reflexive-matrix_reflexive=0-matrix_antecedent=1-refl1=themselves-refl2=herself-precede=1	1		The guys who insult themselves should kiss this gal.
exp=reflexive-matrix_reflexive=0-matrix_antecedent=1-refl1=themselves-refl2=herself-precede=0	0		The guys who insult herself should kiss this gal.
exp=reflexive-matrix_reflexive=0-matrix_antecedent=1-refl1=themselves-refl2=itself-precede=1	1		These guys that praised themselves didn't dislike some bank.
exp=reflexive-matrix_reflexive=0-matrix_antecedent=1-refl1=themselves-refl2=itself-precede=0	0		These guys that praised itself didn't dislike some bank.
exp=reflexive-matrix_reflexive=0-matrix_antecedent=1-refl1=themselves-refl2=herself-precede=1	1		A lot of doctors who don't observe themselves could investigate the actress.
exp=reflexive-matrix_reflexive=0-matrix_antecedent=1-refl1=themselves-refl2=herself-precede=0	0		A lot of doctors who don't observe herself could investigate the actress.
exp=reflexive-matrix_reflexive=0-matrix_antecedent=1-refl1=themselves-refl2=himself-precede=1	1		The adults who do hug themselves hate every boy.
exp=reflexive-matrix_reflexive=0-matrix_antecedent=1-refl1=themselves-refl2=himself-precede=0	0		The adults who do hug himself hate every boy.
exp=reflexive-matrix_reflexive=0-matrix_antecedent=1-refl1=themselves-refl2=herself-precede=1	1		All doctors that like themselves had known the lady.
exp=reflexive-matrix_reflexive=0-matrix_antecedent=1-refl1=themselves-refl2=herself-precede=0	0		All doctors that like herself had known the lady.
exp=reflexive-matrix_reflexive=0-matrix_antecedent=1-refl1=themselves-refl2=itself-precede=1	1		Teenagers who can't kiss themselves wouldn't escape from some mall.
exp=reflexive-matrix_reflexive=0-matrix_antecedent=1-refl1=themselves-refl2=itself-precede=0	0		Teenagers who can't kiss itself wouldn't escape from some mall.
exp=reflexive-matrix_reflexive=0-matrix_antecedent=1-refl1=themselves-refl2=itself-precede=1	1		These doctors that liked themselves haven't insulted the movie.
exp=reflexive-matrix_reflexive=0-matrix_antecedent=1-refl1=themselves-refl2=itself-precede=0	0		These doctors that liked itself haven't insulted the movie.
exp=reflexive-matrix_reflexive=0-matrix_antecedent=1-refl1=itself-refl2=themselves-precede=1	1		An commentary that wouldn't talk about itself describes a lot of schools.
exp=reflexive-matrix_reflexive=0-matrix_antecedent=1-refl1=itself-refl2=themselves-precede=0	0		An commentary that wouldn't talk about themselves describes a lot of schools.
exp=reflexive-matrix_reflexive=0-matrix_antecedent=1-refl1=themselves-refl2=itself-precede=1	1		All students who shouldn't listen to themselves aren't visiting some college campus.
exp=reflexive-matrix_reflexive=0-matrix_antecedent=1-refl1=themselves-refl2=itself-precede=0	0		All students who shouldn't listen to itself aren't visiting some college campus.
exp=reflexive-matrix_reflexive=0-matrix_antecedent=1-refl1=themselves-refl2=itself-precede=1	1		All reports that have criticized themselves can describe some public park.
exp=reflexive-matrix_reflexive=0-matrix_antecedent=1-refl1=themselves-refl2=itself-precede=0	0		All reports that have criticized itself can describe some public park.
exp=reflexive-matrix_reflexive=0-matrix_antecedent=1-refl1=themselves-refl2=himself-precede=1	1		Many waiters who were visiting themselves admired the boy.
exp=reflexive-matrix_reflexive=0-matrix_antecedent=1-refl1=themselves-refl2=himself-precede=0	0		Many waiters who were visiting himself admired the boy.
exp=reflexive-matrix_reflexive=0-matrix_antecedent=1-refl1=themselves-refl2=itself-precede=1	1		Many doctors that did listen to themselves are leaving that restaurant.
exp=reflexive-matrix_reflexive=0-matrix_antecedent=1-refl1=themselves-refl2=itself-precede=0	0		Many doctors that did listen to itself are leaving that restaurant.
exp=reflexive-matrix_reflexive=0-matrix_antecedent=1-refl1=himself-refl2=herself-precede=1	1		This guy who criticizes himself isn't working with this actress.
exp=reflexive-matrix_reflexive=0-matrix_antecedent=1-refl1=himself-refl2=herself-precede=0	0		This guy who criticizes herself isn't working with this actress.
exp=reflexive-matrix_reflexive=0-matrix_antecedent=1-refl1=herself-refl2=themselves-precede=1	1		This lady who admired herself wasn't watching some cashiers.
exp=reflexive-matrix_reflexive=0-matrix_antecedent=1-refl1=herself-refl2=themselves-precede=0	0		This lady who admired themselves wasn't watching some cashiers.
exp=reflexive-matrix_reflexive=0-matrix_antecedent=1-refl1=themselves-refl2=itself-precede=1	1		A lot of adults who have observed themselves wouldn't insult that movie theater.
exp=reflexive-matrix_reflexive=0-matrix_antecedent=1-refl1=themselves-refl2=itself-precede=0	0		A lot of adults who have observed itself wouldn't insult that movie theater.
exp=reflexive-matrix_reflexive=0-matrix_antecedent=1-refl1=itself-refl2=themselves-precede=1	1		The plate that resembled itself can't resemble women.
exp=reflexive-matrix_reflexive=0-matrix_antecedent=1-refl1=itself-refl2=themselves-precede=0	0		The plate that resembled themselves can't resemble women.
exp=reflexive-matrix_reflexive=0-matrix_antecedent=1-refl1=itself-refl2=themselves-precede=1	1		Some story that references itself hadn't insulted some people.
exp=reflexive-matrix_reflexive=0-matrix_antecedent=1-refl1=itself-refl2=themselves-precede=0	0		Some story that references themselves hadn't insulted some people.
exp=reflexive-matrix_reflexive=0-matrix_antecedent=1-refl1=themselves-refl2=himself-precede=1	1		Teenagers that flee from themselves were kissing some man.
exp=reflexive-matrix_reflexive=0-matrix_antecedent=1-refl1=themselves-refl2=himself-precede=0	0		Teenagers that flee from himself were kissing some man.
exp=reflexive-matrix_reflexive=0-matrix_antecedent=1-refl1=themselves-refl2=herself-precede=1	1		Some waitresses who are criticizing themselves attack every actress.
exp=reflexive-matrix_reflexive=0-matrix_antecedent=1-refl1=themselves-refl2=herself-precede=0	0		Some waitresses who are criticizing herself attack every actress.
exp=reflexive-matrix_reflexive=0-matrix_antecedent=1-refl1=themselves-refl2=herself-precede=1	1		The adults who remember themselves will hate that girl.
exp=reflexive-matrix_reflexive=0-matrix_antecedent=1-refl1=themselves-refl2=herself-precede=0	0		The adults who remember herself will hate that girl.
exp=reflexive-matrix_reflexive=0-matrix_antecedent=1-refl1=themselves-refl2=himself-precede=1	1		Waitresses who won't approach themselves talk to the guy.
exp=reflexive-matrix_reflexive=0-matrix_antecedent=1-refl1=themselves-refl2=himself-precede=0	0		Waitresses who won't approach himself talk to the guy.
exp=reflexive-matrix_reflexive=0-matrix_antecedent=1-refl1=herself-refl2=himself-precede=1	1		This lady who won't escape from herself wasn't describing some man.
exp=reflexive-matrix_reflexive=0-matrix_antecedent=1-refl1=herself-refl2=himself-precede=0	0		This lady who won't escape from himself wasn't describing some man.
exp=reflexive-matrix_reflexive=0-matrix_antecedent=1-refl1=herself-refl2=itself-precede=1	1		A lady that loved herself praises some report.
exp=reflexive-matrix_reflexive=0-matrix_antecedent=1-refl1=herself-refl2=itself-precede=0	0		A lady that loved itself praises some report.
exp=reflexive-matrix_reflexive=0-matrix_antecedent=1-refl1=themselves-refl2=itself-precede=1	1		Many humans that cared for themselves reference this essay.
exp=reflexive-matrix_reflexive=0-matrix_antecedent=1-refl1=themselves-refl2=itself-precede=0	0		Many humans that cared for itself reference this essay.
exp=reflexive-matrix_reflexive=0-matrix_antecedent=1-refl1=themselves-refl2=itself-precede=1	1		All waitresses who hadn't approached themselves might insult some art gallery.
exp=reflexive-matrix_reflexive=0-matrix_antecedent=1-refl1=themselves-refl2=itself-precede=0	0		All waitresses who hadn't approached itself might insult some art gallery.
exp=reflexive-matrix_reflexive=0-matrix_antecedent=1-refl1=themselves-refl2=itself-precede=1	1		Some waiters who forget themselves aren't criticizing every school.
exp=reflexive-matrix_reflexive=0-matrix_antecedent=1-refl1=themselves-refl2=itself-precede=0	0		Some waiters who forget itself aren't criticizing every school.
exp=reflexive-matrix_reflexive=0-matrix_antecedent=1-refl1=themselves-refl2=itself-precede=1	1		These guys that escape from themselves love an essay.
exp=reflexive-matrix_reflexive=0-matrix_antecedent=1-refl1=themselves-refl2=itself-precede=0	0		These guys that escape from itself love an essay.
exp=reflexive-matrix_reflexive=0-matrix_antecedent=1-refl1=themselves-refl2=itself-precede=1	1		The humans that talk to themselves discuss every grocery store.
exp=reflexive-matrix_reflexive=0-matrix_antecedent=1-refl1=themselves-refl2=itself-precede=0	0		The humans that talk to itself discuss every grocery store.
exp=reflexive-matrix_reflexive=0-matrix_antecedent=1-refl1=themselves-refl2=himself-precede=1	1		Doctors who won't visit themselves fled from a boy.
exp=reflexive-matrix_reflexive=0-matrix_antecedent=1-refl1=themselves-refl2=himself-precede=0	0		Doctors who won't visit himself fled from a boy.
exp=reflexive-matrix_reflexive=0-matrix_antecedent=1-refl1=itself-refl2=himself-precede=1	1		That movie that discusses itself is criticizing this boy.
exp=reflexive-matrix_reflexive=0-matrix_antecedent=1-refl1=itself-refl2=himself-precede=0	0		That movie that discusses himself is criticizing this boy.
exp=reflexive-matrix_reflexive=0-matrix_antecedent=1-refl1=themselves-refl2=herself-precede=1	1		Many children that did talk about themselves hadn't approached that actress.
exp=reflexive-matrix_reflexive=0-matrix_antecedent=1-refl1=themselves-refl2=herself-precede=0	0		Many children that did talk about herself hadn't approached that actress.
exp=reflexive-matrix_reflexive=0-matrix_antecedent=1-refl1=themselves-refl2=itself-precede=1	1		These teenagers who watch themselves flee from that mall.
exp=reflexive-matrix_reflexive=0-matrix_antecedent=1-refl1=themselves-refl2=itself-precede=0	0		These teenagers who watch itself flee from that mall.
exp=reflexive-matrix_reflexive=0-matrix_antecedent=1-refl1=themselves-refl2=itself-precede=1	1		Boys that help themselves didn't insult this bank.
exp=reflexive-matrix_reflexive=0-matrix_antecedent=1-refl1=themselves-refl2=itself-precede=0	0		Boys that help itself didn't insult this bank.
exp=reflexive-matrix_reflexive=0-matrix_antecedent=1-refl1=themselves-refl2=itself-precede=1	1		The drivers that approach themselves admire every report.
exp=reflexive-matrix_reflexive=0-matrix_antecedent=1-refl1=themselves-refl2=itself-precede=0	0		The drivers that approach itself admire every report.
exp=reflexive-matrix_reflexive=0-matrix_antecedent=1-refl1=themselves-refl2=herself-precede=1	1		Some patients that haven't talked about themselves cared for every gal.
exp=reflexive-matrix_reflexive=0-matrix_antecedent=1-refl1=themselves-refl2=herself-precede=0	0		Some patients that haven't talked about herself cared for every gal.
exp=reflexive-matrix_reflexive=0-matrix_antecedent=1-refl1=themselves-refl2=itself-precede=1	1		Customers who hadn't watched themselves do resemble that hair.
exp=reflexive-matrix_reflexive=0-matrix_antecedent=1-refl1=themselves-refl2=itself-precede=0	0		Customers who hadn't watched itself do resemble that hair.
exp=reflexive-matrix_reflexive=0-matrix_antecedent=1-refl1=themselves-refl2=himself-precede=1	1		These pedestrians who should reference themselves were talking to a boy.
exp=reflexive-matrix_reflexive=0-matrix_antecedent=1-refl1=themselves-refl2=himself-precede=0	0		These pedestrians who should reference himself were talking to a boy.
exp=reflexive-matrix_reflexive=0-matrix_antecedent=1-refl1=themselves-refl2=itself-precede=1	1		These waiters that watched themselves have referenced this movie.
exp=reflexive-matrix_reflexive=0-matrix_antecedent=1-refl1=themselves-refl2=itself-precede=0	0		These waiters that watched itself have referenced this movie.
exp=reflexive-matrix_reflexive=0-matrix_antecedent=1-refl1=themselves-refl2=herself-precede=1	1		Actors that had hated themselves attacked every lady.
exp=reflexive-matrix_reflexive=0-matrix_antecedent=1-refl1=themselves-refl2=herself-precede=0	0		Actors that had hated herself attacked every lady.
