exp=reflexive-matrix_reflexive=0-matrix_antecedent=1-refl1=themselves-refl2=herself-precede=0	0		These teachers that didn't listen to herself weren't investigating some woman.
exp=reflexive-matrix_reflexive=0-matrix_antecedent=1-refl1=themselves-refl2=herself-precede=1	1		These guys who see themselves aren't working with the girl.
exp=reflexive-matrix_reflexive=0-matrix_antecedent=1-refl1=themselves-refl2=herself-precede=0	0		These guys who see herself aren't working with the girl.
exp=reflexive-matrix_reflexive=0-matrix_antecedent=1-refl1=themselves-refl2=itself-precede=1	1		Many essays that weren't referencing themselves talked about the movie.
exp=reflexive-matrix_reflexive=0-matrix_antecedent=1-refl1=themselves-refl2=itself-precede=0	0		Many essays that weren't referencing itself talked about the movie.
exp=reflexive-matrix_reflexive=0-matrix_antecedent=1-refl1=themselves-refl2=itself-precede=1	1		The customers that approach themselves have fled from this college campus.
exp=reflexive-matrix_reflexive=0-matrix_antecedent=1-refl1=themselves-refl2=itself-precede=0	0		The customers that approach itself have fled from this college campus.
exp=reflexive-matrix_reflexive=0-matrix_antecedent=1-refl1=themselves-refl2=herself-precede=1	1		The boys who had talked to themselves talked to the woman.
exp=reflexive-matrix_reflexive=0-matrix_antecedent=1-refl1=themselves-refl2=herself-precede=0	0		The boys who had talked to herself talked to the woman.
exp=reflexive-matrix_reflexive=0-matrix_antecedent=1-refl1=themselves-refl2=himself-precede=1	1		The students who had seen themselves hadn't attacked the boy.
exp=reflexive-matrix_reflexive=0-matrix_antecedent=1-refl1=themselves-refl2=himself-precede=0	0		The students who had seen himself hadn't attacked the boy.
exp=reflexive-matrix_reflexive=0-matrix_antecedent=1-refl1=themselves-refl2=itself-precede=1	1		A lot of guys who can't talk to themselves haven't investigated every cafe .
exp=reflexive-matrix_reflexive=0-matrix_antecedent=1-refl1=themselves-refl2=itself-precede=0	0		A lot of guys who can't talk to itself haven't investigated every cafe .
exp=reflexive-matrix_reflexive=0-matrix_antecedent=1-refl1=herself-refl2=themselves-precede=1	1		That actress who would observe herself won't talk about the teenagers.
exp=reflexive-matrix_reflexive=0-matrix_antecedent=1-refl1=herself-refl2=themselves-precede=0	0		That actress who would observe themselves won't talk about the teenagers.
exp=reflexive-matrix_reflexive=0-matrix_antecedent=1-refl1=themselves-refl2=himself-precede=1	1		Many boys that could work with themselves hugged this boy.
exp=reflexive-matrix_reflexive=0-matrix_antecedent=1-refl1=themselves-refl2=himself-precede=0	0		Many boys that could work with himself hugged this boy.
exp=reflexive-matrix_reflexive=0-matrix_antecedent=1-refl1=themselves-refl2=itself-precede=1	1		The girls that described themselves aren't admiring this car.
exp=reflexive-matrix_reflexive=0-matrix_antecedent=1-refl1=themselves-refl2=itself-precede=0	0		The girls that described itself aren't admiring this car.
exp=reflexive-matrix_reflexive=0-matrix_antecedent=1-refl1=themselves-refl2=herself-precede=1	1		Some people that helped themselves observed the girl.
exp=reflexive-matrix_reflexive=0-matrix_antecedent=1-refl1=themselves-refl2=herself-precede=0	0		Some people that helped herself observed the girl.
exp=reflexive-matrix_reflexive=0-matrix_antecedent=1-refl1=themselves-refl2=himself-precede=1	1		These guys who hug themselves won't insult some man.
exp=reflexive-matrix_reflexive=0-matrix_antecedent=1-refl1=themselves-refl2=himself-precede=0	0		These guys who hug himself won't insult some man.
exp=reflexive-matrix_reflexive=0-matrix_antecedent=1-refl1=herself-refl2=themselves-precede=1	1		Some girl that discusses herself had kissed waiters.
exp=reflexive-matrix_reflexive=0-matrix_antecedent=1-refl1=herself-refl2=themselves-precede=0	0		Some girl that discusses themselves had kissed waiters.
exp=reflexive-matrix_reflexive=0-matrix_antecedent=1-refl1=themselves-refl2=herself-precede=1	1		Some teachers that will flee from themselves can observe some lady.
exp=reflexive-matrix_reflexive=0-matrix_antecedent=1-refl1=themselves-refl2=herself-precede=0	0		Some teachers that will flee from herself can observe some lady.
exp=reflexive-matrix_reflexive=0-matrix_antecedent=1-refl1=themselves-refl2=itself-precede=1	1		Some students who watched themselves can't investigate that art gallery.
exp=reflexive-matrix_reflexive=0-matrix_antecedent=1-refl1=themselves-refl2=itself-precede=0	0		Some students who watched itself can't investigate that art gallery.
exp=reflexive-matrix_reflexive=0-matrix_antecedent=1-refl1=themselves-refl2=himself-precede=1	1		Women that haven't helped themselves should admire this guy.
exp=reflexive-matrix_reflexive=0-matrix_antecedent=1-refl1=themselves-refl2=himself-precede=0	0		Women that haven't helped himself should admire this guy.
exp=reflexive-matrix_reflexive=0-matrix_antecedent=1-refl1=herself-refl2=themselves-precede=1	1		Some gal who fled from herself knew the humans.
exp=reflexive-matrix_reflexive=0-matrix_antecedent=1-refl1=herself-refl2=themselves-precede=0	0		Some gal who fled from themselves knew the humans.
exp=reflexive-matrix_reflexive=0-matrix_antecedent=1-refl1=herself-refl2=himself-precede=1	1		The waitress that observed herself has praised a boy.
exp=reflexive-matrix_reflexive=0-matrix_antecedent=1-refl1=herself-refl2=himself-precede=0	0		The waitress that observed himself has praised a boy.
exp=reflexive-matrix_reflexive=0-matrix_antecedent=1-refl1=themselves-refl2=herself-precede=1	1		A lot of humans that kiss themselves kissed that lady.
exp=reflexive-matrix_reflexive=0-matrix_antecedent=1-refl1=themselves-refl2=herself-precede=0	0		A lot of humans that kiss herself kissed that lady.
exp=reflexive-matrix_reflexive=0-matrix_antecedent=1-refl1=themselves-refl2=itself-precede=1	1		Many men that have cared for themselves have insulted a movie.
exp=reflexive-matrix_reflexive=0-matrix_antecedent=1-refl1=themselves-refl2=itself-precede=0	0		Many men that have cared for itself have insulted a movie.
exp=reflexive-matrix_reflexive=0-matrix_antecedent=1-refl1=themselves-refl2=herself-precede=1	1		Some actresses that criticize themselves didn't know an actress.
exp=reflexive-matrix_reflexive=0-matrix_antecedent=1-refl1=themselves-refl2=herself-precede=0	0		Some actresses that criticize herself didn't know an actress.
exp=reflexive-matrix_reflexive=0-matrix_antecedent=1-refl1=herself-refl2=itself-precede=1	1		This girl that hasn't kissed herself hasn't forgotten an essay.
exp=reflexive-matrix_reflexive=0-matrix_antecedent=1-refl1=herself-refl2=itself-precede=0	0		This girl that hasn't kissed itself hasn't forgotten an essay.
exp=reflexive-matrix_reflexive=0-matrix_antecedent=1-refl1=themselves-refl2=itself-precede=1	1		The movies that hadn't referenced themselves haven't insulted that restaurant.
exp=reflexive-matrix_reflexive=0-matrix_antecedent=1-refl1=themselves-refl2=itself-precede=0	0		The movies that hadn't referenced itself haven't insulted that restaurant.
exp=reflexive-matrix_reflexive=0-matrix_antecedent=1-refl1=themselves-refl2=herself-precede=1	1		All customers who loved themselves reference that lady.
exp=reflexive-matrix_reflexive=0-matrix_antecedent=1-refl1=themselves-refl2=herself-precede=0	0		All customers who loved herself reference that lady.
exp=reflexive-matrix_reflexive=0-matrix_antecedent=1-refl1=itself-refl2=themselves-precede=1	1		The play that referenced itself will discuss a lot of schools.
exp=reflexive-matrix_reflexive=0-matrix_antecedent=1-refl1=itself-refl2=themselves-precede=0	0		The play that referenced themselves will discuss a lot of schools.
exp=reflexive-matrix_reflexive=0-matrix_antecedent=1-refl1=themselves-refl2=itself-precede=1	1		Many men who flee from themselves criticize that hospital.
exp=reflexive-matrix_reflexive=0-matrix_antecedent=1-refl1=themselves-refl2=itself-precede=0	0		Many men who flee from itself criticize that hospital.
exp=reflexive-matrix_reflexive=0-matrix_antecedent=1-refl1=herself-refl2=itself-precede=1	1		Some gal who doesn't attack herself wasn't talking about every newspaper article.
exp=reflexive-matrix_reflexive=0-matrix_antecedent=1-refl1=herself-refl2=itself-precede=0	0		Some gal who doesn't attack itself wasn't talking about every newspaper article.
exp=reflexive-matrix_reflexive=0-matrix_antecedent=1-refl1=themselves-refl2=himself-precede=1	1		Girls who were talking about themselves returned to some guy.
exp=reflexive-matrix_reflexive=0-matrix_antecedent=1-refl1=themselves-refl2=himself-precede=0	0		Girls who were talking about himself returned to some guy.
exp=reflexive-matrix_reflexive=0-matrix_antecedent=1-refl1=themselves-refl2=itself-precede=1	1		All people that insulted themselves do insult every high school.
exp=reflexive-matrix_reflexive=0-matrix_antecedent=1-refl1=themselves-refl2=itself-precede=0	0		All people that insulted itself do insult every high school.
exp=reflexive-matrix_reflexive=0-matrix_antecedent=1-refl1=themselves-refl2=herself-precede=1	1		A lot of boys that weren't listening to themselves weren't approaching some gal.
exp=reflexive-matrix_reflexive=0-matrix_antecedent=1-refl1=themselves-refl2=herself-precede=0	0		A lot of boys that weren't listening to herself weren't approaching some gal.
exp=reflexive-matrix_reflexive=0-matrix_antecedent=1-refl1=themselves-refl2=itself-precede=1	1		The students that love themselves were talking about the movie.
exp=reflexive-matrix_reflexive=0-matrix_antecedent=1-refl1=themselves-refl2=itself-precede=0	0		The students that love itself were talking about the movie.
exp=reflexive-matrix_reflexive=0-matrix_antecedent=1-refl1=themselves-refl2=herself-precede=1	1		The ladies who were talking to themselves aren't observing a gal.
exp=reflexive-matrix_reflexive=0-matrix_antecedent=1-refl1=themselves-refl2=herself-precede=0	0		The ladies who were talking to herself aren't observing a gal.
exp=reflexive-matrix_reflexive=0-matrix_antecedent=1-refl1=themselves-refl2=itself-precede=1	1		These students who should talk about themselves are praising some play.
exp=reflexive-matrix_reflexive=0-matrix_antecedent=1-refl1=themselves-refl2=itself-precede=0	0		These students who should talk about itself are praising some play.
exp=reflexive-matrix_reflexive=0-matrix_antecedent=1-refl1=itself-refl2=themselves-precede=1	1		This newspaper article that criticizes itself hasn't praised a lot of cashiers.
exp=reflexive-matrix_reflexive=0-matrix_antecedent=1-refl1=itself-refl2=themselves-precede=0	0		This newspaper article that criticizes themselves hasn't praised a lot of cashiers.
exp=reflexive-matrix_reflexive=0-matrix_antecedent=1-refl1=themselves-refl2=herself-precede=1	1		These customers who care for themselves were observing that woman.
exp=reflexive-matrix_reflexive=0-matrix_antecedent=1-refl1=themselves-refl2=herself-precede=0	0		These customers who care for herself were observing that woman.
exp=reflexive-matrix_reflexive=0-matrix_antecedent=1-refl1=themselves-refl2=himself-precede=1	1		The boys that escape from themselves listen to some boy.
exp=reflexive-matrix_reflexive=0-matrix_antecedent=1-refl1=themselves-refl2=himself-precede=0	0		The boys that escape from himself listen to some boy.
exp=reflexive-matrix_reflexive=0-matrix_antecedent=1-refl1=themselves-refl2=itself-precede=1	1		The guests who hugged themselves liked some newspaper article.
exp=reflexive-matrix_reflexive=0-matrix_antecedent=1-refl1=themselves-refl2=itself-precede=0	0		The guests who hugged itself liked some newspaper article.
exp=reflexive-matrix_reflexive=0-matrix_antecedent=1-refl1=themselves-refl2=himself-precede=1	1		Some guests who hugged themselves insulted some boy.
exp=reflexive-matrix_reflexive=0-matrix_antecedent=1-refl1=themselves-refl2=himself-precede=0	0		Some guests who hugged himself insulted some boy.
exp=reflexive-matrix_reflexive=0-matrix_antecedent=1-refl1=themselves-refl2=herself-precede=1	1		Some ladies who hadn't helped themselves have listened to that actress.
exp=reflexive-matrix_reflexive=0-matrix_antecedent=1-refl1=themselves-refl2=herself-precede=0	0		Some ladies who hadn't helped herself have listened to that actress.
exp=reflexive-matrix_reflexive=0-matrix_antecedent=1-refl1=themselves-refl2=itself-precede=1	1		The cups that resemble themselves will resemble every newspaper article.
exp=reflexive-matrix_reflexive=0-matrix_antecedent=1-refl1=themselves-refl2=itself-precede=0	0		The cups that resemble itself will resemble every newspaper article.
exp=reflexive-matrix_reflexive=0-matrix_antecedent=1-refl1=themselves-refl2=itself-precede=1	1		Some gals who praise themselves are escaping from the school.
exp=reflexive-matrix_reflexive=0-matrix_antecedent=1-refl1=themselves-refl2=itself-precede=0	0		Some gals who praise itself are escaping from the school.
exp=reflexive-matrix_reflexive=0-matrix_antecedent=1-refl1=themselves-refl2=herself-precede=1	1		Some actors that didn't describe themselves might help this waitress.
exp=reflexive-matrix_reflexive=0-matrix_antecedent=1-refl1=themselves-refl2=herself-precede=0	0		Some actors that didn't describe herself might help this waitress.
exp=reflexive-matrix_reflexive=0-matrix_antecedent=1-refl1=themselves-refl2=itself-precede=1	1		The boys who had discussed themselves praise this book.
exp=reflexive-matrix_reflexive=0-matrix_antecedent=1-refl1=themselves-refl2=itself-precede=0	0		The boys who had discussed itself praise this book.
exp=reflexive-matrix_reflexive=0-matrix_antecedent=1-refl1=themselves-refl2=herself-precede=1	1		The waiters that dislike themselves care for the woman.
exp=reflexive-matrix_reflexive=0-matrix_antecedent=1-refl1=themselves-refl2=herself-precede=0	0		The waiters that dislike herself care for the woman.
exp=reflexive-matrix_reflexive=0-matrix_antecedent=1-refl1=themselves-refl2=itself-precede=1	1		Many ladies who haven't forgotten themselves haven't seen a rug.
exp=reflexive-matrix_reflexive=0-matrix_antecedent=1-refl1=themselves-refl2=itself-precede=0	0		Many ladies who haven't forgotten itself haven't seen a rug.
exp=reflexive-matrix_reflexive=0-matrix_antecedent=1-refl1=himself-refl2=themselves-precede=1	1		Every man who hasn't talked to himself attacked these pedestrians.
exp=reflexive-matrix_reflexive=0-matrix_antecedent=1-refl1=himself-refl2=themselves-precede=0	0		Every man who hasn't talked to themselves attacked these pedestrians.
exp=reflexive-matrix_reflexive=0-matrix_antecedent=1-refl1=themselves-refl2=itself-precede=1	1		These students who were leaving themselves hadn't returned to that grocery store.
exp=reflexive-matrix_reflexive=0-matrix_antecedent=1-refl1=themselves-refl2=itself-precede=0	0		These students who were leaving itself hadn't returned to that grocery store.
exp=reflexive-matrix_reflexive=0-matrix_antecedent=1-refl1=themselves-refl2=itself-precede=1	1		All guys who couldn't reference themselves escape from every college campus.
exp=reflexive-matrix_reflexive=0-matrix_antecedent=1-refl1=themselves-refl2=itself-precede=0	0		All guys who couldn't reference itself escape from every college campus.
exp=reflexive-matrix_reflexive=0-matrix_antecedent=1-refl1=themselves-refl2=herself-precede=1	1		These doctors who leave themselves weren't investigating every gal.
exp=reflexive-matrix_reflexive=0-matrix_antecedent=1-refl1=themselves-refl2=herself-precede=0	0		These doctors who leave herself weren't investigating every gal.
exp=reflexive-matrix_reflexive=0-matrix_antecedent=1-refl1=themselves-refl2=itself-precede=1	1		A lot of cashiers who talk to themselves hadn't investigated the cafe .
exp=reflexive-matrix_reflexive=0-matrix_antecedent=1-refl1=themselves-refl2=itself-precede=0	0		A lot of cashiers who talk to itself hadn't investigated the cafe .
exp=reflexive-matrix_reflexive=0-matrix_antecedent=1-refl1=themselves-refl2=herself-precede=1	1		Some waitresses that weren't escaping from themselves have hated this lady.
exp=reflexive-matrix_reflexive=0-matrix_antecedent=1-refl1=themselves-refl2=herself-precede=0	0		Some waitresses that weren't escaping from herself have hated this lady.
exp=reflexive-matrix_reflexive=0-matrix_antecedent=1-refl1=themselves-refl2=herself-precede=1	1		All adults that didn't work with themselves hugged some waitress.
exp=reflexive-matrix_reflexive=0-matrix_antecedent=1-refl1=themselves-refl2=herself-precede=0	0		All adults that didn't work with herself hugged some waitress.
exp=reflexive-matrix_reflexive=0-matrix_antecedent=1-refl1=themselves-refl2=herself-precede=1	1		Some women that were admiring themselves aren't escaping from that gal.
exp=reflexive-matrix_reflexive=0-matrix_antecedent=1-refl1=themselves-refl2=herself-precede=0	0		Some women that were admiring herself aren't escaping from that gal.
exp=reflexive-matrix_reflexive=0-matrix_antecedent=1-refl1=himself-refl2=themselves-precede=1	1		Every man who didn't discuss himself hadn't investigated art galleries.
exp=reflexive-matrix_reflexive=0-matrix_antecedent=1-refl1=himself-refl2=themselves-precede=0	0		Every man who didn't discuss themselves hadn't investigated art galleries.
exp=reflexive-matrix_reflexive=0-matrix_antecedent=1-refl1=itself-refl2=themselves-precede=1	1		The commentary that talks about itself can resemble all drivers.
exp=reflexive-matrix_reflexive=0-matrix_antecedent=1-refl1=itself-refl2=themselves-precede=0	0		The commentary that talks about themselves can resemble all drivers.
exp=reflexive-matrix_reflexive=0-matrix_antecedent=1-refl1=themselves-refl2=itself-precede=1	1		Humans that work with themselves disliked the essay.
exp=reflexive-matrix_reflexive=0-matrix_antecedent=1-refl1=themselves-refl2=itself-precede=0	0		Humans that work with itself disliked the essay.
exp=reflexive-matrix_reflexive=0-matrix_antecedent=1-refl1=themselves-refl2=himself-precede=1	1		A lot of teachers that insulted themselves fled from some boy.
exp=reflexive-matrix_reflexive=0-matrix_antecedent=1-refl1=themselves-refl2=himself-precede=0	0		A lot of teachers that insulted himself fled from some boy.
exp=reflexive-matrix_reflexive=0-matrix_antecedent=1-refl1=themselves-refl2=himself-precede=1	1		A lot of teenagers that were observing themselves listen to some boy.
exp=reflexive-matrix_reflexive=0-matrix_antecedent=1-refl1=themselves-refl2=himself-precede=0	0		A lot of teenagers that were observing himself listen to some boy.
exp=reflexive-matrix_reflexive=0-matrix_antecedent=1-refl1=themselves-refl2=himself-precede=1	1		These women who know themselves hadn't watched this man.
exp=reflexive-matrix_reflexive=0-matrix_antecedent=1-refl1=themselves-refl2=himself-precede=0	0		These women who know himself hadn't watched this man.
exp=reflexive-matrix_reflexive=0-matrix_antecedent=1-refl1=themselves-refl2=herself-precede=1	1		Girls that had praised themselves didn't like some girl.
exp=reflexive-matrix_reflexive=0-matrix_antecedent=1-refl1=themselves-refl2=herself-precede=0	0		Girls that had praised herself didn't like some girl.
exp=reflexive-matrix_reflexive=0-matrix_antecedent=1-refl1=themselves-refl2=herself-precede=1	1		The children who were referencing themselves watched the gal.
exp=reflexive-matrix_reflexive=0-matrix_antecedent=1-refl1=themselves-refl2=herself-precede=0	0		The children who were referencing herself watched the gal.
exp=reflexive-matrix_reflexive=0-matrix_antecedent=1-refl1=themselves-refl2=herself-precede=1	1		Guests who approach themselves can't observe a gal.
exp=reflexive-matrix_reflexive=0-matrix_antecedent=1-refl1=themselves-refl2=herself-precede=0	0		Guests who approach herself can't observe a gal.
exp=reflexive-matrix_reflexive=0-matrix_antecedent=1-refl1=themselves-refl2=herself-precede=1	1		All cashiers that love themselves approached that woman.
exp=reflexive-matrix_reflexive=0-matrix_antecedent=1-refl1=themselves-refl2=herself-precede=0	0		All cashiers that love herself approached that woman.
exp=reflexive-matrix_reflexive=0-matrix_antecedent=1-refl1=themselves-refl2=itself-precede=1	1		Teachers who admired themselves do escape from every museum.
exp=reflexive-matrix_reflexive=0-matrix_antecedent=1-refl1=themselves-refl2=itself-precede=0	0		Teachers who admired itself do escape from every museum.
exp=reflexive-matrix_reflexive=0-matrix_antecedent=1-refl1=themselves-refl2=itself-precede=1	1		Some patients that hadn't loved themselves had criticized some restaurant.
exp=reflexive-matrix_reflexive=0-matrix_antecedent=1-refl1=themselves-refl2=itself-precede=0	0		Some patients that hadn't loved itself had criticized some restaurant.
exp=reflexive-matrix_reflexive=0-matrix_antecedent=1-refl1=themselves-refl2=herself-precede=1	1		Some humans that aren't working with themselves are admiring every waitress.
exp=reflexive-matrix_reflexive=0-matrix_antecedent=1-refl1=themselves-refl2=herself-precede=0	0		Some humans that aren't working with herself are admiring every waitress.
exp=reflexive-matrix_reflexive=0-matrix_antecedent=1-refl1=themselves-refl2=herself-precede=1	1		All adults that investigated themselves hadn't admired every gal.
exp=reflexive-matrix_reflexive=0-matrix_antecedent=1-refl1=themselves-refl2=herself-precede=0	0		All adults that investigated herself hadn't admired every gal.
exp=reflexive-matrix_reflexive=0-matrix_antecedent=1-refl1=themselves-refl2=itself-precede=1	1		All children that approached themselves saw a chair.
exp=reflexive-matrix_reflexive=0-matrix_antecedent=1-refl1=themselves-refl2=itself-precede=0	0		All children that approached itself saw a chair.
exp=reflexive-matrix_reflexive=0-matrix_antecedent=1-refl1=themselves-refl2=himself-precede=1	1		The women who had kissed themselves did kiss the guy.
exp=reflexive-matrix_reflexive=0-matrix_antecedent=1-refl1=themselves-refl2=himself-precede=0	0		The women who had kissed himself did kiss the guy.
exp=reflexive-matrix_reflexive=0-matrix_antecedent=1-refl1=themselves-refl2=himself-precede=1	1		All men who can describe themselves knew some boy.
exp=reflexive-matrix_reflexive=0-matrix_antecedent=1-refl1=themselves-refl2=himself-precede=0	0		All men who can describe himself knew some boy.
exp=reflexive-matrix_reflexive=0-matrix_antecedent=1-refl1=himself-refl2=themselves-precede=1	1		The boy who can't return to himself has disliked documentaries.
exp=reflexive-matrix_reflexive=0-matrix_antecedent=1-refl1=himself-refl2=themselves-precede=0	0		The boy who can't return to themselves has disliked documentaries.
exp=reflexive-matrix_reflexive=0-matrix_antecedent=1-refl1=himself-refl2=themselves-precede=1	1		A boy who disliked himself isn't helping gals.
exp=reflexive-matrix_reflexive=0-matrix_antecedent=1-refl1=himself-refl2=themselves-precede=0	0		A boy who disliked themselves isn't helping gals.
exp=reflexive-matrix_reflexive=0-matrix_antecedent=1-refl1=themselves-refl2=itself-precede=1	1		Many ladies who worked with themselves had praised every commentary.
exp=reflexive-matrix_reflexive=0-matrix_antecedent=1-refl1=themselves-refl2=itself-precede=0	0		Many ladies who worked with itself had praised every commentary.
exp=reflexive-matrix_reflexive=0-matrix_antecedent=1-refl1=herself-refl2=itself-precede=1	1		Some lady that knew herself praised the movie.
exp=reflexive-matrix_reflexive=0-matrix_antecedent=1-refl1=herself-refl2=itself-precede=0	0		Some lady that knew itself praised the movie.
exp=reflexive-matrix_reflexive=0-matrix_antecedent=1-refl1=themselves-refl2=himself-precede=1	1		Many boys who are praising themselves flee from this man.
exp=reflexive-matrix_reflexive=0-matrix_antecedent=1-refl1=themselves-refl2=himself-precede=0	0		Many boys who are praising himself flee from this man.
exp=reflexive-matrix_reflexive=0-matrix_antecedent=1-refl1=herself-refl2=themselves-precede=1	1		The gal who criticizes herself might forget children.
exp=reflexive-matrix_reflexive=0-matrix_antecedent=1-refl1=herself-refl2=themselves-precede=0	0		The gal who criticizes themselves might forget children.
exp=reflexive-matrix_reflexive=0-matrix_antecedent=1-refl1=themselves-refl2=himself-precede=1	1		All students who haven't respected themselves can't love that boy.
exp=reflexive-matrix_reflexive=0-matrix_antecedent=1-refl1=themselves-refl2=himself-precede=0	0		All students who haven't respected himself can't love that boy.
exp=reflexive-matrix_reflexive=0-matrix_antecedent=1-refl1=themselves-refl2=itself-precede=1	1		A lot of humans that had listened to themselves can't hate every story.
exp=reflexive-matrix_reflexive=0-matrix_antecedent=1-refl1=themselves-refl2=itself-precede=0	0		A lot of humans that had listened to itself can't hate every story.
exp=reflexive-matrix_reflexive=0-matrix_antecedent=1-refl1=themselves-refl2=itself-precede=1	1		The students who fled from themselves praised this report.
exp=reflexive-matrix_reflexive=0-matrix_antecedent=1-refl1=themselves-refl2=itself-precede=0	0		The students who fled from itself praised this report.
exp=reflexive-matrix_reflexive=0-matrix_antecedent=1-refl1=herself-refl2=themselves-precede=1	1		That waitress who talks about herself is escaping from these boys.
exp=reflexive-matrix_reflexive=0-matrix_antecedent=1-refl1=herself-refl2=themselves-precede=0	0		That waitress who talks about themselves is escaping from these boys.
exp=reflexive-matrix_reflexive=0-matrix_antecedent=1-refl1=themselves-refl2=herself-precede=1	1		Many waiters who aren't hugging themselves hate a gal.
exp=reflexive-matrix_reflexive=0-matrix_antecedent=1-refl1=themselves-refl2=herself-precede=0	0		Many waiters who aren't hugging herself hate a gal.
exp=reflexive-matrix_reflexive=0-matrix_antecedent=1-refl1=themselves-refl2=itself-precede=1	1		All waitresses that kiss themselves loved the movie.
exp=reflexive-matrix_reflexive=0-matrix_antecedent=1-refl1=themselves-refl2=itself-precede=0	0		All waitresses that kiss itself loved the movie.
