exp=reflexive-matrix_reflexive=0-matrix_antecedent=1-refl1=themselves-refl2=himself-precede=1	1		Many cashiers who hate themselves aren't leaving this guy.
exp=reflexive-matrix_reflexive=0-matrix_antecedent=1-refl1=themselves-refl2=himself-precede=0	0		Many cashiers who hate himself aren't leaving this guy.
exp=reflexive-matrix_reflexive=0-matrix_antecedent=1-refl1=herself-refl2=itself-precede=1	1		Every lady that discusses herself left the cafe .
exp=reflexive-matrix_reflexive=0-matrix_antecedent=1-refl1=herself-refl2=itself-precede=0	0		Every lady that discusses itself left the cafe .
exp=reflexive-matrix_reflexive=0-matrix_antecedent=1-refl1=herself-refl2=themselves-precede=1	1		That waitress that shouldn't kiss herself had remembered the hospitals.
exp=reflexive-matrix_reflexive=0-matrix_antecedent=1-refl1=herself-refl2=themselves-precede=0	0		That waitress that shouldn't kiss themselves had remembered the hospitals.
exp=reflexive-matrix_reflexive=0-matrix_antecedent=1-refl1=herself-refl2=themselves-precede=1	1		This woman that hasn't fled from herself knew teachers.
exp=reflexive-matrix_reflexive=0-matrix_antecedent=1-refl1=herself-refl2=themselves-precede=0	0		This woman that hasn't fled from themselves knew teachers.
exp=reflexive-matrix_reflexive=0-matrix_antecedent=1-refl1=herself-refl2=themselves-precede=1	1		An actress who hasn't talked about herself can't dislike some guests.
exp=reflexive-matrix_reflexive=0-matrix_antecedent=1-refl1=herself-refl2=themselves-precede=0	0		An actress who hasn't talked about themselves can't dislike some guests.
exp=reflexive-matrix_reflexive=0-matrix_antecedent=1-refl1=themselves-refl2=itself-precede=1	1		Some teenagers that are referencing themselves hadn't criticized some documentary.
exp=reflexive-matrix_reflexive=0-matrix_antecedent=1-refl1=themselves-refl2=itself-precede=0	0		Some teenagers that are referencing itself hadn't criticized some documentary.
exp=reflexive-matrix_reflexive=0-matrix_antecedent=1-refl1=themselves-refl2=itself-precede=1	1		Movies that talk about themselves aren't insulting that museum.
exp=reflexive-matrix_reflexive=0-matrix_antecedent=1-refl1=themselves-refl2=itself-precede=0	0		Movies that talk about itself aren't insulting that museum.
exp=reflexive-matrix_reflexive=0-matrix_antecedent=1-refl1=itself-refl2=themselves-precede=1	1		A book that references itself resembled the hospitals.
exp=reflexive-matrix_reflexive=0-matrix_antecedent=1-refl1=itself-refl2=themselves-precede=0	0		A book that references themselves resembled the hospitals.
exp=reflexive-matrix_reflexive=0-matrix_antecedent=1-refl1=themselves-refl2=itself-precede=1	1		These pedestrians who watch themselves admired this book.
exp=reflexive-matrix_reflexive=0-matrix_antecedent=1-refl1=themselves-refl2=itself-precede=0	0		These pedestrians who watch itself admired this book.
exp=reflexive-matrix_reflexive=0-matrix_antecedent=1-refl1=themselves-refl2=himself-precede=1	1		The guys that have described themselves talked to this guy.
exp=reflexive-matrix_reflexive=0-matrix_antecedent=1-refl1=themselves-refl2=himself-precede=0	0		The guys that have described himself talked to this guy.
exp=reflexive-matrix_reflexive=0-matrix_antecedent=1-refl1=themselves-refl2=himself-precede=1	1		These people that hadn't discussed themselves investigated some guy.
exp=reflexive-matrix_reflexive=0-matrix_antecedent=1-refl1=themselves-refl2=himself-precede=0	0		These people that hadn't discussed himself investigated some guy.
exp=reflexive-matrix_reflexive=0-matrix_antecedent=1-refl1=themselves-refl2=herself-precede=1	1		A lot of customers that aren't fleeing from themselves weren't listening to the girl.
exp=reflexive-matrix_reflexive=0-matrix_antecedent=1-refl1=themselves-refl2=herself-precede=0	0		A lot of customers that aren't fleeing from herself weren't listening to the girl.
exp=reflexive-matrix_reflexive=0-matrix_antecedent=1-refl1=himself-refl2=themselves-precede=1	1		Some boy that kissed himself listened to some patients.
exp=reflexive-matrix_reflexive=0-matrix_antecedent=1-refl1=himself-refl2=themselves-precede=0	0		Some boy that kissed themselves listened to some patients.
exp=reflexive-matrix_reflexive=0-matrix_antecedent=1-refl1=herself-refl2=themselves-precede=1	1		Some lady who hadn't disliked herself couldn't approach many students.
exp=reflexive-matrix_reflexive=0-matrix_antecedent=1-refl1=herself-refl2=themselves-precede=0	0		Some lady who hadn't disliked themselves couldn't approach many students.
exp=reflexive-matrix_reflexive=0-matrix_antecedent=1-refl1=themselves-refl2=herself-precede=1	1		Some teenagers who forget themselves forgot a waitress.
exp=reflexive-matrix_reflexive=0-matrix_antecedent=1-refl1=themselves-refl2=herself-precede=0	0		Some teenagers who forget herself forgot a waitress.
exp=reflexive-matrix_reflexive=0-matrix_antecedent=1-refl1=themselves-refl2=himself-precede=1	1		A lot of cashiers who weren't referencing themselves criticize that boy.
exp=reflexive-matrix_reflexive=0-matrix_antecedent=1-refl1=themselves-refl2=himself-precede=0	0		A lot of cashiers who weren't referencing himself criticize that boy.
exp=reflexive-matrix_reflexive=0-matrix_antecedent=1-refl1=themselves-refl2=herself-precede=1	1		All humans who saw themselves admired this woman.
exp=reflexive-matrix_reflexive=0-matrix_antecedent=1-refl1=themselves-refl2=herself-precede=0	0		All humans who saw herself admired this woman.
exp=reflexive-matrix_reflexive=0-matrix_antecedent=1-refl1=themselves-refl2=himself-precede=1	1		All adults who work with themselves aren't hugging a man.
exp=reflexive-matrix_reflexive=0-matrix_antecedent=1-refl1=themselves-refl2=himself-precede=0	0		All adults who work with himself aren't hugging a man.
exp=reflexive-matrix_reflexive=0-matrix_antecedent=1-refl1=themselves-refl2=herself-precede=1	1		These guests that weren't referencing themselves attacked that lady.
exp=reflexive-matrix_reflexive=0-matrix_antecedent=1-refl1=themselves-refl2=herself-precede=0	0		These guests that weren't referencing herself attacked that lady.
exp=reflexive-matrix_reflexive=0-matrix_antecedent=1-refl1=themselves-refl2=herself-precede=1	1		All girls who admired themselves hated this actress.
exp=reflexive-matrix_reflexive=0-matrix_antecedent=1-refl1=themselves-refl2=herself-precede=0	0		All girls who admired herself hated this actress.
exp=reflexive-matrix_reflexive=0-matrix_antecedent=1-refl1=themselves-refl2=herself-precede=1	1		Waiters that attacked themselves return to a gal.
exp=reflexive-matrix_reflexive=0-matrix_antecedent=1-refl1=themselves-refl2=herself-precede=0	0		Waiters that attacked herself return to a gal.
exp=reflexive-matrix_reflexive=0-matrix_antecedent=1-refl1=themselves-refl2=herself-precede=1	1		These guys that loved themselves haven't hugged this woman.
exp=reflexive-matrix_reflexive=0-matrix_antecedent=1-refl1=themselves-refl2=herself-precede=0	0		These guys that loved herself haven't hugged this woman.
exp=reflexive-matrix_reflexive=0-matrix_antecedent=1-refl1=themselves-refl2=herself-precede=1	1		All actors that talked to themselves haven't escaped from that waitress.
exp=reflexive-matrix_reflexive=0-matrix_antecedent=1-refl1=themselves-refl2=herself-precede=0	0		All actors that talked to herself haven't escaped from that waitress.
exp=reflexive-matrix_reflexive=0-matrix_antecedent=1-refl1=themselves-refl2=herself-precede=1	1		A lot of adults who praise themselves have watched every waitress.
exp=reflexive-matrix_reflexive=0-matrix_antecedent=1-refl1=themselves-refl2=herself-precede=0	0		A lot of adults who praise herself have watched every waitress.
exp=reflexive-matrix_reflexive=0-matrix_antecedent=1-refl1=themselves-refl2=itself-precede=1	1		These men who should leave themselves respected some cafe .
exp=reflexive-matrix_reflexive=0-matrix_antecedent=1-refl1=themselves-refl2=itself-precede=0	0		These men who should leave itself respected some cafe .
exp=reflexive-matrix_reflexive=0-matrix_antecedent=1-refl1=itself-refl2=themselves-precede=1	1		Every newspaper article that insults itself has talked about the grocery stores.
exp=reflexive-matrix_reflexive=0-matrix_antecedent=1-refl1=itself-refl2=themselves-precede=0	0		Every newspaper article that insults themselves has talked about the grocery stores.
exp=reflexive-matrix_reflexive=0-matrix_antecedent=1-refl1=themselves-refl2=herself-precede=1	1		These actresses who see themselves did approach every waitress.
exp=reflexive-matrix_reflexive=0-matrix_antecedent=1-refl1=themselves-refl2=herself-precede=0	0		These actresses who see herself did approach every waitress.
exp=reflexive-matrix_reflexive=0-matrix_antecedent=1-refl1=themselves-refl2=herself-precede=1	1		Many teenagers that had talked about themselves remember a waitress.
exp=reflexive-matrix_reflexive=0-matrix_antecedent=1-refl1=themselves-refl2=herself-precede=0	0		Many teenagers that had talked about herself remember a waitress.
exp=reflexive-matrix_reflexive=0-matrix_antecedent=1-refl1=themselves-refl2=herself-precede=1	1		Some teenagers who kiss themselves work with every waitress.
exp=reflexive-matrix_reflexive=0-matrix_antecedent=1-refl1=themselves-refl2=herself-precede=0	0		Some teenagers who kiss herself work with every waitress.
exp=reflexive-matrix_reflexive=0-matrix_antecedent=1-refl1=themselves-refl2=itself-precede=1	1		Many doctors that loved themselves did remember the public park.
exp=reflexive-matrix_reflexive=0-matrix_antecedent=1-refl1=themselves-refl2=itself-precede=0	0		Many doctors that loved itself did remember the public park.
exp=reflexive-matrix_reflexive=0-matrix_antecedent=1-refl1=themselves-refl2=herself-precede=1	1		All humans that hated themselves referenced a woman.
exp=reflexive-matrix_reflexive=0-matrix_antecedent=1-refl1=themselves-refl2=herself-precede=0	0		All humans that hated herself referenced a woman.
exp=reflexive-matrix_reflexive=0-matrix_antecedent=1-refl1=themselves-refl2=itself-precede=1	1		The adults that weren't helping themselves have loved the documentary.
exp=reflexive-matrix_reflexive=0-matrix_antecedent=1-refl1=themselves-refl2=itself-precede=0	0		The adults that weren't helping itself have loved the documentary.
exp=reflexive-matrix_reflexive=0-matrix_antecedent=1-refl1=itself-refl2=themselves-precede=1	1		Every documentary that references itself would praise many women.
exp=reflexive-matrix_reflexive=0-matrix_antecedent=1-refl1=itself-refl2=themselves-precede=0	0		Every documentary that references themselves would praise many women.
exp=reflexive-matrix_reflexive=0-matrix_antecedent=1-refl1=themselves-refl2=herself-precede=1	1		A lot of humans that leave themselves kissed a girl.
exp=reflexive-matrix_reflexive=0-matrix_antecedent=1-refl1=themselves-refl2=herself-precede=0	0		A lot of humans that leave herself kissed a girl.
exp=reflexive-matrix_reflexive=0-matrix_antecedent=1-refl1=itself-refl2=themselves-precede=1	1		This chair that resembled itself resembles all guests.
exp=reflexive-matrix_reflexive=0-matrix_antecedent=1-refl1=itself-refl2=themselves-precede=0	0		This chair that resembled themselves resembles all guests.
exp=reflexive-matrix_reflexive=0-matrix_antecedent=1-refl1=themselves-refl2=itself-precede=1	1		Many actors who admired themselves escape from that grocery store.
exp=reflexive-matrix_reflexive=0-matrix_antecedent=1-refl1=themselves-refl2=itself-precede=0	0		Many actors who admired itself escape from that grocery store.
exp=reflexive-matrix_reflexive=0-matrix_antecedent=1-refl1=themselves-refl2=herself-precede=1	1		These boys who do know themselves were talking to some lady.
exp=reflexive-matrix_reflexive=0-matrix_antecedent=1-refl1=themselves-refl2=herself-precede=0	0		These boys who do know herself were talking to some lady.
exp=reflexive-matrix_reflexive=0-matrix_antecedent=1-refl1=herself-refl2=itself-precede=1	1		Every actress that might admire herself was talking about the public park.
exp=reflexive-matrix_reflexive=0-matrix_antecedent=1-refl1=herself-refl2=itself-precede=0	0		Every actress that might admire itself was talking about the public park.
exp=reflexive-matrix_reflexive=0-matrix_antecedent=1-refl1=themselves-refl2=himself-precede=1	1		All people who don't observe themselves help a boy.
exp=reflexive-matrix_reflexive=0-matrix_antecedent=1-refl1=themselves-refl2=himself-precede=0	0		All people who don't observe himself help a boy.
exp=reflexive-matrix_reflexive=0-matrix_antecedent=1-refl1=themselves-refl2=herself-precede=1	1		Some customers who saw themselves could care for some lady.
exp=reflexive-matrix_reflexive=0-matrix_antecedent=1-refl1=themselves-refl2=herself-precede=0	0		Some customers who saw herself could care for some lady.
exp=reflexive-matrix_reflexive=0-matrix_antecedent=1-refl1=themselves-refl2=himself-precede=1	1		The girls that had listened to themselves insulted that guy.
exp=reflexive-matrix_reflexive=0-matrix_antecedent=1-refl1=themselves-refl2=himself-precede=0	0		The girls that had listened to himself insulted that guy.
exp=reflexive-matrix_reflexive=0-matrix_antecedent=1-refl1=themselves-refl2=herself-precede=1	1		Women that know themselves approach some lady.
exp=reflexive-matrix_reflexive=0-matrix_antecedent=1-refl1=themselves-refl2=herself-precede=0	0		Women that know herself approach some lady.
exp=reflexive-matrix_reflexive=0-matrix_antecedent=1-refl1=herself-refl2=themselves-precede=1	1		The actress that escaped from herself isn't approaching the waiters.
exp=reflexive-matrix_reflexive=0-matrix_antecedent=1-refl1=herself-refl2=themselves-precede=0	0		The actress that escaped from themselves isn't approaching the waiters.
exp=reflexive-matrix_reflexive=0-matrix_antecedent=1-refl1=themselves-refl2=itself-precede=1	1		Some men that haven't discussed themselves weren't leaving every public park.
exp=reflexive-matrix_reflexive=0-matrix_antecedent=1-refl1=themselves-refl2=itself-precede=0	0		Some men that haven't discussed itself weren't leaving every public park.
exp=reflexive-matrix_reflexive=0-matrix_antecedent=1-refl1=themselves-refl2=itself-precede=1	1		These ladies that were helping themselves talk about that school.
exp=reflexive-matrix_reflexive=0-matrix_antecedent=1-refl1=themselves-refl2=itself-precede=0	0		These ladies that were helping itself talk about that school.
exp=reflexive-matrix_reflexive=0-matrix_antecedent=1-refl1=themselves-refl2=himself-precede=1	1		Many men that love themselves had escaped from the man.
exp=reflexive-matrix_reflexive=0-matrix_antecedent=1-refl1=themselves-refl2=himself-precede=0	0		Many men that love himself had escaped from the man.
exp=reflexive-matrix_reflexive=0-matrix_antecedent=1-refl1=herself-refl2=themselves-precede=1	1		Some lady who talks about herself had listened to a lot of cashiers.
exp=reflexive-matrix_reflexive=0-matrix_antecedent=1-refl1=herself-refl2=themselves-precede=0	0		Some lady who talks about themselves had listened to a lot of cashiers.
exp=reflexive-matrix_reflexive=0-matrix_antecedent=1-refl1=themselves-refl2=itself-precede=1	1		Some actors that investigated themselves don't discuss an essay.
exp=reflexive-matrix_reflexive=0-matrix_antecedent=1-refl1=themselves-refl2=itself-precede=0	0		Some actors that investigated itself don't discuss an essay.
exp=reflexive-matrix_reflexive=0-matrix_antecedent=1-refl1=themselves-refl2=himself-precede=1	1		These teenagers who kissed themselves were leaving that guy.
exp=reflexive-matrix_reflexive=0-matrix_antecedent=1-refl1=themselves-refl2=himself-precede=0	0		These teenagers who kissed himself were leaving that guy.
exp=reflexive-matrix_reflexive=0-matrix_antecedent=1-refl1=themselves-refl2=himself-precede=1	1		The people who care for themselves couldn't investigate some boy.
exp=reflexive-matrix_reflexive=0-matrix_antecedent=1-refl1=themselves-refl2=himself-precede=0	0		The people who care for himself couldn't investigate some boy.
exp=reflexive-matrix_reflexive=0-matrix_antecedent=1-refl1=herself-refl2=itself-precede=1	1		The actress that couldn't like herself hadn't hated the newspaper article.
exp=reflexive-matrix_reflexive=0-matrix_antecedent=1-refl1=herself-refl2=itself-precede=0	0		The actress that couldn't like itself hadn't hated the newspaper article.
exp=reflexive-matrix_reflexive=0-matrix_antecedent=1-refl1=themselves-refl2=herself-precede=1	1		The adults that are insulting themselves aren't observing this girl.
exp=reflexive-matrix_reflexive=0-matrix_antecedent=1-refl1=themselves-refl2=herself-precede=0	0		The adults that are insulting herself aren't observing this girl.
exp=reflexive-matrix_reflexive=0-matrix_antecedent=1-refl1=themselves-refl2=himself-precede=1	1		The customers who cared for themselves admired the man.
exp=reflexive-matrix_reflexive=0-matrix_antecedent=1-refl1=themselves-refl2=himself-precede=0	0		The customers who cared for himself admired the man.
exp=reflexive-matrix_reflexive=0-matrix_antecedent=1-refl1=themselves-refl2=herself-precede=1	1		Some waitresses that investigated themselves haven't known every gal.
exp=reflexive-matrix_reflexive=0-matrix_antecedent=1-refl1=themselves-refl2=herself-precede=0	0		Some waitresses that investigated herself haven't known every gal.
exp=reflexive-matrix_reflexive=0-matrix_antecedent=1-refl1=himself-refl2=themselves-precede=1	1		This guy that might kiss himself had described these cashiers.
exp=reflexive-matrix_reflexive=0-matrix_antecedent=1-refl1=himself-refl2=themselves-precede=0	0		This guy that might kiss themselves had described these cashiers.
exp=reflexive-matrix_reflexive=0-matrix_antecedent=1-refl1=themselves-refl2=itself-precede=1	1		The gals that returned to themselves hate this essay.
exp=reflexive-matrix_reflexive=0-matrix_antecedent=1-refl1=themselves-refl2=itself-precede=0	0		The gals that returned to itself hate this essay.
exp=reflexive-matrix_reflexive=0-matrix_antecedent=1-refl1=themselves-refl2=herself-precede=1	1		Some children who didn't like themselves admired some woman.
exp=reflexive-matrix_reflexive=0-matrix_antecedent=1-refl1=themselves-refl2=herself-precede=0	0		Some children who didn't like herself admired some woman.
exp=reflexive-matrix_reflexive=0-matrix_antecedent=1-refl1=themselves-refl2=itself-precede=1	1		All guys who fled from themselves will return to this grocery store.
exp=reflexive-matrix_reflexive=0-matrix_antecedent=1-refl1=themselves-refl2=itself-precede=0	0		All guys who fled from itself will return to this grocery store.
exp=reflexive-matrix_reflexive=0-matrix_antecedent=1-refl1=themselves-refl2=itself-precede=1	1		All men that can watch themselves hadn't remembered the library.
exp=reflexive-matrix_reflexive=0-matrix_antecedent=1-refl1=themselves-refl2=itself-precede=0	0		All men that can watch itself hadn't remembered the library.
exp=reflexive-matrix_reflexive=0-matrix_antecedent=1-refl1=themselves-refl2=herself-precede=1	1		Teachers that have known themselves can't see that gal.
exp=reflexive-matrix_reflexive=0-matrix_antecedent=1-refl1=themselves-refl2=herself-precede=0	0		Teachers that have known herself can't see that gal.
exp=reflexive-matrix_reflexive=0-matrix_antecedent=1-refl1=themselves-refl2=itself-precede=1	1		All guests that describe themselves remember the grocery store.
exp=reflexive-matrix_reflexive=0-matrix_antecedent=1-refl1=themselves-refl2=itself-precede=0	0		All guests that describe itself remember the grocery store.
exp=reflexive-matrix_reflexive=0-matrix_antecedent=1-refl1=himself-refl2=themselves-precede=1	1		Every boy that can investigate himself discussed all pedestrians.
exp=reflexive-matrix_reflexive=0-matrix_antecedent=1-refl1=himself-refl2=themselves-precede=0	0		Every boy that can investigate themselves discussed all pedestrians.
exp=reflexive-matrix_reflexive=0-matrix_antecedent=1-refl1=herself-refl2=themselves-precede=1	1		The woman who would attack herself had talked about these reports.
exp=reflexive-matrix_reflexive=0-matrix_antecedent=1-refl1=herself-refl2=themselves-precede=0	0		The woman who would attack themselves had talked about these reports.
exp=reflexive-matrix_reflexive=0-matrix_antecedent=1-refl1=themselves-refl2=herself-precede=1	1		Children that don't admire themselves aren't attacking a woman.
exp=reflexive-matrix_reflexive=0-matrix_antecedent=1-refl1=themselves-refl2=herself-precede=0	0		Children that don't admire herself aren't attacking a woman.
exp=reflexive-matrix_reflexive=0-matrix_antecedent=1-refl1=themselves-refl2=itself-precede=1	1		Many ladies who criticize themselves were leaving some grocery store.
exp=reflexive-matrix_reflexive=0-matrix_antecedent=1-refl1=themselves-refl2=itself-precede=0	0		Many ladies who criticize itself were leaving some grocery store.
exp=reflexive-matrix_reflexive=0-matrix_antecedent=1-refl1=themselves-refl2=itself-precede=1	1		Guests that don't like themselves have fled from that high school.
exp=reflexive-matrix_reflexive=0-matrix_antecedent=1-refl1=themselves-refl2=itself-precede=0	0		Guests that don't like itself have fled from that high school.
exp=reflexive-matrix_reflexive=0-matrix_antecedent=1-refl1=himself-refl2=themselves-precede=1	1		This man that did investigate himself isn't attacking many men.
exp=reflexive-matrix_reflexive=0-matrix_antecedent=1-refl1=himself-refl2=themselves-precede=0	0		This man that did investigate themselves isn't attacking many men.
exp=reflexive-matrix_reflexive=0-matrix_antecedent=1-refl1=themselves-refl2=itself-precede=1	1		The actors that knew themselves talked about the movie.
exp=reflexive-matrix_reflexive=0-matrix_antecedent=1-refl1=themselves-refl2=itself-precede=0	0		The actors that knew itself talked about the movie.
exp=reflexive-matrix_reflexive=0-matrix_antecedent=1-refl1=themselves-refl2=himself-precede=1	1		All girls who kiss themselves helped this man.
exp=reflexive-matrix_reflexive=0-matrix_antecedent=1-refl1=themselves-refl2=himself-precede=0	0		All girls who kiss himself helped this man.
exp=reflexive-matrix_reflexive=0-matrix_antecedent=1-refl1=themselves-refl2=itself-precede=1	1		Some waiters that hadn't worked with themselves hadn't fled from some grocery store.
exp=reflexive-matrix_reflexive=0-matrix_antecedent=1-refl1=themselves-refl2=itself-precede=0	0		Some waiters that hadn't worked with itself hadn't fled from some grocery store.
exp=reflexive-matrix_reflexive=0-matrix_antecedent=1-refl1=themselves-refl2=itself-precede=1	1		These students that wouldn't admire themselves hadn't described every documentary.
exp=reflexive-matrix_reflexive=0-matrix_antecedent=1-refl1=themselves-refl2=itself-precede=0	0		These students that wouldn't admire itself hadn't described every documentary.
exp=reflexive-matrix_reflexive=0-matrix_antecedent=1-refl1=herself-refl2=themselves-precede=1	1		A woman that insults herself attacked the girls.
exp=reflexive-matrix_reflexive=0-matrix_antecedent=1-refl1=herself-refl2=themselves-precede=0	0		A woman that insults themselves attacked the girls.
exp=reflexive-matrix_reflexive=0-matrix_antecedent=1-refl1=themselves-refl2=itself-precede=1	1		A lot of ladies who disliked themselves are criticizing that movie theater.
exp=reflexive-matrix_reflexive=0-matrix_antecedent=1-refl1=themselves-refl2=itself-precede=0	0		A lot of ladies who disliked itself are criticizing that movie theater.
exp=reflexive-matrix_reflexive=0-matrix_antecedent=1-refl1=themselves-refl2=himself-precede=1	1		A lot of waitresses who dislike themselves hugged this man.
exp=reflexive-matrix_reflexive=0-matrix_antecedent=1-refl1=themselves-refl2=himself-precede=0	0		A lot of waitresses who dislike himself hugged this man.
exp=reflexive-matrix_reflexive=0-matrix_antecedent=1-refl1=themselves-refl2=itself-precede=1	1		All cashiers who couldn't hug themselves had returned to the cafe .
exp=reflexive-matrix_reflexive=0-matrix_antecedent=1-refl1=themselves-refl2=itself-precede=0	0		All cashiers who couldn't hug itself had returned to the cafe .
exp=reflexive-matrix_reflexive=0-matrix_antecedent=1-refl1=herself-refl2=themselves-precede=1	1		This woman who talks about herself can kiss these doctors.
exp=reflexive-matrix_reflexive=0-matrix_antecedent=1-refl1=herself-refl2=themselves-precede=0	0		This woman who talks about themselves can kiss these doctors.
exp=reflexive-matrix_reflexive=0-matrix_antecedent=1-refl1=themselves-refl2=itself-precede=1	1		These pedestrians that see themselves left every grocery store.
exp=reflexive-matrix_reflexive=0-matrix_antecedent=1-refl1=themselves-refl2=itself-precede=0	0		These pedestrians that see itself left every grocery store.
exp=reflexive-matrix_reflexive=0-matrix_antecedent=1-refl1=themselves-refl2=herself-precede=1	1		Doctors that describe themselves aren't approaching that waitress.
exp=reflexive-matrix_reflexive=0-matrix_antecedent=1-refl1=themselves-refl2=herself-precede=0	0		Doctors that describe herself aren't approaching that waitress.
exp=reflexive-matrix_reflexive=0-matrix_antecedent=1-refl1=themselves-refl2=herself-precede=1	1		All people who haven't insulted themselves work with the gal.
exp=reflexive-matrix_reflexive=0-matrix_antecedent=1-refl1=themselves-refl2=herself-precede=0	0		All people who haven't insulted herself work with the gal.
exp=reflexive-matrix_reflexive=0-matrix_antecedent=1-refl1=themselves-refl2=itself-precede=1	1		All waitresses that shouldn't praise themselves describe that report.
exp=reflexive-matrix_reflexive=0-matrix_antecedent=1-refl1=themselves-refl2=itself-precede=0	0		All waitresses that shouldn't praise itself describe that report.
exp=reflexive-matrix_reflexive=0-matrix_antecedent=1-refl1=themselves-refl2=himself-precede=1	1		A lot of men that haven't listened to themselves hate this boy.
exp=reflexive-matrix_reflexive=0-matrix_antecedent=1-refl1=themselves-refl2=himself-precede=0	0		A lot of men that haven't listened to himself hate this boy.
exp=reflexive-matrix_reflexive=0-matrix_antecedent=1-refl1=themselves-refl2=itself-precede=1	1		The children that watch themselves escaped from the restaurant.
