exp=reflexive-matrix_reflexive=0-matrix_antecedent=1-refl1=themselves-refl2=herself-precede=0	0		All women that aren't leaving herself talk to a lady.
exp=reflexive-matrix_reflexive=0-matrix_antecedent=1-refl1=themselves-refl2=herself-precede=1	1		A lot of actresses that are talking to themselves had loved some actress.
exp=reflexive-matrix_reflexive=0-matrix_antecedent=1-refl1=themselves-refl2=herself-precede=0	0		A lot of actresses that are talking to herself had loved some actress.
exp=reflexive-matrix_reflexive=0-matrix_antecedent=1-refl1=himself-refl2=themselves-precede=1	1		A boy who observed himself was watching these men.
exp=reflexive-matrix_reflexive=0-matrix_antecedent=1-refl1=himself-refl2=themselves-precede=0	0		A boy who observed themselves was watching these men.
exp=reflexive-matrix_reflexive=0-matrix_antecedent=1-refl1=themselves-refl2=itself-precede=1	1		Guests who aren't approaching themselves weren't referencing an commentary.
exp=reflexive-matrix_reflexive=0-matrix_antecedent=1-refl1=themselves-refl2=itself-precede=0	0		Guests who aren't approaching itself weren't referencing an commentary.
exp=reflexive-matrix_reflexive=0-matrix_antecedent=1-refl1=themselves-refl2=himself-precede=1	1		Some adults that have talked to themselves describe a guy.
exp=reflexive-matrix_reflexive=0-matrix_antecedent=1-refl1=themselves-refl2=himself-precede=0	0		Some adults that have talked to himself describe a guy.
exp=reflexive-matrix_reflexive=0-matrix_antecedent=1-refl1=itself-refl2=themselves-precede=1	1		An essay that described itself was discussing these public parks.
exp=reflexive-matrix_reflexive=0-matrix_antecedent=1-refl1=itself-refl2=themselves-precede=0	0		An essay that described themselves was discussing these public parks.
exp=reflexive-matrix_reflexive=0-matrix_antecedent=1-refl1=themselves-refl2=herself-precede=1	1		A lot of women who fled from themselves might remember the lady.
exp=reflexive-matrix_reflexive=0-matrix_antecedent=1-refl1=themselves-refl2=herself-precede=0	0		A lot of women who fled from herself might remember the lady.
exp=reflexive-matrix_reflexive=0-matrix_antecedent=1-refl1=themselves-refl2=itself-precede=1	1		A lot of commentaries that shouldn't insult themselves can't discuss some play.
exp=reflexive-matrix_reflexive=0-matrix_antecedent=1-refl1=themselves-refl2=itself-precede=0	0		A lot of commentaries that shouldn't insult itself can't discuss some play.
exp=reflexive-matrix_reflexive=0-matrix_antecedent=1-refl1=themselves-refl2=herself-precede=1	1		These people that hug themselves aren't watching some woman.
exp=reflexive-matrix_reflexive=0-matrix_antecedent=1-refl1=themselves-refl2=herself-precede=0	0		These people that hug herself aren't watching some woman.
exp=reflexive-matrix_reflexive=0-matrix_antecedent=1-refl1=itself-refl2=themselves-precede=1	1		Every report that criticizes itself won't criticize many public parks.
exp=reflexive-matrix_reflexive=0-matrix_antecedent=1-refl1=itself-refl2=themselves-precede=0	0		Every report that criticizes themselves won't criticize many public parks.
exp=reflexive-matrix_reflexive=0-matrix_antecedent=1-refl1=themselves-refl2=itself-precede=1	1		Rugs that do resemble themselves resemble that dish.
exp=reflexive-matrix_reflexive=0-matrix_antecedent=1-refl1=themselves-refl2=itself-precede=0	0		Rugs that do resemble itself resemble that dish.
exp=reflexive-matrix_reflexive=0-matrix_antecedent=1-refl1=herself-refl2=themselves-precede=1	1		That waitress that didn't help herself had admired all humans.
exp=reflexive-matrix_reflexive=0-matrix_antecedent=1-refl1=herself-refl2=themselves-precede=0	0		That waitress that didn't help themselves had admired all humans.
exp=reflexive-matrix_reflexive=0-matrix_antecedent=1-refl1=themselves-refl2=himself-precede=1	1		Gals who aren't leaving themselves know every guy.
exp=reflexive-matrix_reflexive=0-matrix_antecedent=1-refl1=themselves-refl2=himself-precede=0	0		Gals who aren't leaving himself know every guy.
exp=reflexive-matrix_reflexive=0-matrix_antecedent=1-refl1=themselves-refl2=himself-precede=1	1		Many gals who weren't working with themselves help some boy.
exp=reflexive-matrix_reflexive=0-matrix_antecedent=1-refl1=themselves-refl2=himself-precede=0	0		Many gals who weren't working with himself help some boy.
exp=reflexive-matrix_reflexive=0-matrix_antecedent=1-refl1=themselves-refl2=itself-precede=1	1		These humans who weren't helping themselves weren't insulting a movie.
exp=reflexive-matrix_reflexive=0-matrix_antecedent=1-refl1=themselves-refl2=itself-precede=0	0		These humans who weren't helping itself weren't insulting a movie.
exp=reflexive-matrix_reflexive=0-matrix_antecedent=1-refl1=themselves-refl2=itself-precede=1	1		All gals that loved themselves hadn't forgotten some movie.
exp=reflexive-matrix_reflexive=0-matrix_antecedent=1-refl1=themselves-refl2=itself-precede=0	0		All gals that loved itself hadn't forgotten some movie.
exp=reflexive-matrix_reflexive=0-matrix_antecedent=1-refl1=themselves-refl2=herself-precede=1	1		Customers who hugged themselves hadn't helped every waitress.
exp=reflexive-matrix_reflexive=0-matrix_antecedent=1-refl1=themselves-refl2=herself-precede=0	0		Customers who hugged herself hadn't helped every waitress.
exp=reflexive-matrix_reflexive=0-matrix_antecedent=1-refl1=herself-refl2=themselves-precede=1	1		The gal who insults herself did visit all humans.
exp=reflexive-matrix_reflexive=0-matrix_antecedent=1-refl1=herself-refl2=themselves-precede=0	0		The gal who insults themselves did visit all humans.
exp=reflexive-matrix_reflexive=0-matrix_antecedent=1-refl1=themselves-refl2=itself-precede=1	1		A lot of gals that escape from themselves had discussed some movie.
exp=reflexive-matrix_reflexive=0-matrix_antecedent=1-refl1=themselves-refl2=itself-precede=0	0		A lot of gals that escape from itself had discussed some movie.
exp=reflexive-matrix_reflexive=0-matrix_antecedent=1-refl1=themselves-refl2=itself-precede=1	1		Women that hadn't approached themselves aren't admiring some book.
exp=reflexive-matrix_reflexive=0-matrix_antecedent=1-refl1=themselves-refl2=itself-precede=0	0		Women that hadn't approached itself aren't admiring some book.
exp=reflexive-matrix_reflexive=0-matrix_antecedent=1-refl1=itself-refl2=herself-precede=1	1		Every newspaper article that describes itself referenced the gal.
exp=reflexive-matrix_reflexive=0-matrix_antecedent=1-refl1=itself-refl2=herself-precede=0	0		Every newspaper article that describes herself referenced the gal.
exp=reflexive-matrix_reflexive=0-matrix_antecedent=1-refl1=themselves-refl2=itself-precede=1	1		Some boys that shouldn't forget themselves were describing that documentary.
exp=reflexive-matrix_reflexive=0-matrix_antecedent=1-refl1=themselves-refl2=itself-precede=0	0		Some boys that shouldn't forget itself were describing that documentary.
exp=reflexive-matrix_reflexive=0-matrix_antecedent=1-refl1=themselves-refl2=itself-precede=1	1		Some waiters who saw themselves have visited that college campus.
exp=reflexive-matrix_reflexive=0-matrix_antecedent=1-refl1=themselves-refl2=itself-precede=0	0		Some waiters who saw itself have visited that college campus.
exp=reflexive-matrix_reflexive=0-matrix_antecedent=1-refl1=itself-refl2=themselves-precede=1	1		This newspaper article that criticizes itself insulted some reports.
exp=reflexive-matrix_reflexive=0-matrix_antecedent=1-refl1=itself-refl2=themselves-precede=0	0		This newspaper article that criticizes themselves insulted some reports.
exp=reflexive-matrix_reflexive=0-matrix_antecedent=1-refl1=herself-refl2=himself-precede=1	1		The girl that shouldn't like herself left a boy.
exp=reflexive-matrix_reflexive=0-matrix_antecedent=1-refl1=herself-refl2=himself-precede=0	0		The girl that shouldn't like himself left a boy.
exp=reflexive-matrix_reflexive=0-matrix_antecedent=1-refl1=themselves-refl2=herself-precede=1	1		The women who hadn't disliked themselves have discussed a waitress.
exp=reflexive-matrix_reflexive=0-matrix_antecedent=1-refl1=themselves-refl2=herself-precede=0	0		The women who hadn't disliked herself have discussed a waitress.
exp=reflexive-matrix_reflexive=0-matrix_antecedent=1-refl1=themselves-refl2=himself-precede=1	1		The children that hadn't worked with themselves hadn't kissed every boy.
exp=reflexive-matrix_reflexive=0-matrix_antecedent=1-refl1=themselves-refl2=himself-precede=0	0		The children that hadn't worked with himself hadn't kissed every boy.
exp=reflexive-matrix_reflexive=0-matrix_antecedent=1-refl1=themselves-refl2=itself-precede=1	1		These teachers that observe themselves didn't return to the school.
exp=reflexive-matrix_reflexive=0-matrix_antecedent=1-refl1=themselves-refl2=itself-precede=0	0		These teachers that observe itself didn't return to the school.
exp=reflexive-matrix_reflexive=0-matrix_antecedent=1-refl1=himself-refl2=herself-precede=1	1		A guy who visited himself wasn't leaving every actress.
exp=reflexive-matrix_reflexive=0-matrix_antecedent=1-refl1=himself-refl2=herself-precede=0	0		A guy who visited herself wasn't leaving every actress.
exp=reflexive-matrix_reflexive=0-matrix_antecedent=1-refl1=itself-refl2=themselves-precede=1	1		Every documentary that references itself does discuss doctors.
exp=reflexive-matrix_reflexive=0-matrix_antecedent=1-refl1=itself-refl2=themselves-precede=0	0		Every documentary that references themselves does discuss doctors.
exp=reflexive-matrix_reflexive=0-matrix_antecedent=1-refl1=themselves-refl2=itself-precede=1	1		The actors that remember themselves shouldn't resemble that fork.
exp=reflexive-matrix_reflexive=0-matrix_antecedent=1-refl1=themselves-refl2=itself-precede=0	0		The actors that remember itself shouldn't resemble that fork.
exp=reflexive-matrix_reflexive=0-matrix_antecedent=1-refl1=themselves-refl2=itself-precede=1	1		These pedestrians who hadn't investigated themselves referenced every book.
exp=reflexive-matrix_reflexive=0-matrix_antecedent=1-refl1=themselves-refl2=itself-precede=0	0		These pedestrians who hadn't investigated itself referenced every book.
exp=reflexive-matrix_reflexive=0-matrix_antecedent=1-refl1=herself-refl2=themselves-precede=1	1		A gal that does see herself was referencing some adults.
exp=reflexive-matrix_reflexive=0-matrix_antecedent=1-refl1=herself-refl2=themselves-precede=0	0		A gal that does see themselves was referencing some adults.
exp=reflexive-matrix_reflexive=0-matrix_antecedent=1-refl1=themselves-refl2=itself-precede=1	1		These patients that couldn't escape from themselves admired some glass.
exp=reflexive-matrix_reflexive=0-matrix_antecedent=1-refl1=themselves-refl2=itself-precede=0	0		These patients that couldn't escape from itself admired some glass.
exp=reflexive-matrix_reflexive=0-matrix_antecedent=1-refl1=themselves-refl2=itself-precede=1	1		A lot of cashiers that don't dislike themselves had visited the mall.
exp=reflexive-matrix_reflexive=0-matrix_antecedent=1-refl1=themselves-refl2=itself-precede=0	0		A lot of cashiers that don't dislike itself had visited the mall.
exp=reflexive-matrix_reflexive=0-matrix_antecedent=1-refl1=themselves-refl2=himself-precede=1	1		Some waitresses who returned to themselves had observed this boy.
exp=reflexive-matrix_reflexive=0-matrix_antecedent=1-refl1=themselves-refl2=himself-precede=0	0		Some waitresses who returned to himself had observed this boy.
exp=reflexive-matrix_reflexive=0-matrix_antecedent=1-refl1=themselves-refl2=herself-precede=1	1		These women that haven't admired themselves had known that gal.
exp=reflexive-matrix_reflexive=0-matrix_antecedent=1-refl1=themselves-refl2=herself-precede=0	0		These women that haven't admired herself had known that gal.
exp=reflexive-matrix_reflexive=0-matrix_antecedent=1-refl1=themselves-refl2=himself-precede=1	1		Doctors who weren't talking to themselves discussed this guy.
exp=reflexive-matrix_reflexive=0-matrix_antecedent=1-refl1=themselves-refl2=himself-precede=0	0		Doctors who weren't talking to himself discussed this guy.
exp=reflexive-matrix_reflexive=0-matrix_antecedent=1-refl1=themselves-refl2=itself-precede=1	1		These girls that didn't leave themselves were visiting the bank.
exp=reflexive-matrix_reflexive=0-matrix_antecedent=1-refl1=themselves-refl2=itself-precede=0	0		These girls that didn't leave itself were visiting the bank.
exp=reflexive-matrix_reflexive=0-matrix_antecedent=1-refl1=itself-refl2=themselves-precede=1	1		The movie that resembled itself referenced a lot of commentaries.
exp=reflexive-matrix_reflexive=0-matrix_antecedent=1-refl1=itself-refl2=themselves-precede=0	0		The movie that resembled themselves referenced a lot of commentaries.
exp=reflexive-matrix_reflexive=0-matrix_antecedent=1-refl1=themselves-refl2=herself-precede=1	1		The doctors who did kiss themselves hated that actress.
exp=reflexive-matrix_reflexive=0-matrix_antecedent=1-refl1=themselves-refl2=herself-precede=0	0		The doctors who did kiss herself hated that actress.
exp=reflexive-matrix_reflexive=0-matrix_antecedent=1-refl1=themselves-refl2=herself-precede=1	1		The pedestrians that aren't talking about themselves worked with every woman.
exp=reflexive-matrix_reflexive=0-matrix_antecedent=1-refl1=themselves-refl2=herself-precede=0	0		The pedestrians that aren't talking about herself worked with every woman.
exp=reflexive-matrix_reflexive=0-matrix_antecedent=1-refl1=themselves-refl2=itself-precede=1	1		The cashiers who would help themselves hadn't seen the car.
exp=reflexive-matrix_reflexive=0-matrix_antecedent=1-refl1=themselves-refl2=itself-precede=0	0		The cashiers who would help itself hadn't seen the car.
exp=reflexive-matrix_reflexive=0-matrix_antecedent=1-refl1=herself-refl2=themselves-precede=1	1		Some gal who can escape from herself wasn't investigating some libraries.
exp=reflexive-matrix_reflexive=0-matrix_antecedent=1-refl1=herself-refl2=themselves-precede=0	0		Some gal who can escape from themselves wasn't investigating some libraries.
exp=reflexive-matrix_reflexive=0-matrix_antecedent=1-refl1=themselves-refl2=itself-precede=1	1		Some teachers that hadn't known themselves saw some scarf.
exp=reflexive-matrix_reflexive=0-matrix_antecedent=1-refl1=themselves-refl2=itself-precede=0	0		Some teachers that hadn't known itself saw some scarf.
exp=reflexive-matrix_reflexive=0-matrix_antecedent=1-refl1=themselves-refl2=himself-precede=1	1		The guys who forget themselves observed that man.
exp=reflexive-matrix_reflexive=0-matrix_antecedent=1-refl1=themselves-refl2=himself-precede=0	0		The guys who forget himself observed that man.
exp=reflexive-matrix_reflexive=0-matrix_antecedent=1-refl1=themselves-refl2=herself-precede=1	1		The drivers who praise themselves kissed that lady.
exp=reflexive-matrix_reflexive=0-matrix_antecedent=1-refl1=themselves-refl2=herself-precede=0	0		The drivers who praise herself kissed that lady.
exp=reflexive-matrix_reflexive=0-matrix_antecedent=1-refl1=themselves-refl2=itself-precede=1	1		Many adults that admire themselves hate that documentary.
exp=reflexive-matrix_reflexive=0-matrix_antecedent=1-refl1=themselves-refl2=itself-precede=0	0		Many adults that admire itself hate that documentary.
exp=reflexive-matrix_reflexive=0-matrix_antecedent=1-refl1=himself-refl2=themselves-precede=1	1		A boy that isn't helping himself has admired actors.
exp=reflexive-matrix_reflexive=0-matrix_antecedent=1-refl1=himself-refl2=themselves-precede=0	0		A boy that isn't helping themselves has admired actors.
exp=reflexive-matrix_reflexive=0-matrix_antecedent=1-refl1=themselves-refl2=itself-precede=1	1		A lot of adults that kiss themselves don't love this book.
exp=reflexive-matrix_reflexive=0-matrix_antecedent=1-refl1=themselves-refl2=itself-precede=0	0		A lot of adults that kiss itself don't love this book.
exp=reflexive-matrix_reflexive=0-matrix_antecedent=1-refl1=themselves-refl2=himself-precede=1	1		Many pedestrians who talk to themselves haven't investigated this guy.
exp=reflexive-matrix_reflexive=0-matrix_antecedent=1-refl1=themselves-refl2=himself-precede=0	0		Many pedestrians who talk to himself haven't investigated this guy.
exp=reflexive-matrix_reflexive=0-matrix_antecedent=1-refl1=himself-refl2=themselves-precede=1	1		Some man that does talk about himself couldn't kiss these doctors.
exp=reflexive-matrix_reflexive=0-matrix_antecedent=1-refl1=himself-refl2=themselves-precede=0	0		Some man that does talk about themselves couldn't kiss these doctors.
exp=reflexive-matrix_reflexive=0-matrix_antecedent=1-refl1=themselves-refl2=itself-precede=1	1		Actors who might hug themselves had praised that documentary.
exp=reflexive-matrix_reflexive=0-matrix_antecedent=1-refl1=themselves-refl2=itself-precede=0	0		Actors who might hug itself had praised that documentary.
exp=reflexive-matrix_reflexive=0-matrix_antecedent=1-refl1=herself-refl2=himself-precede=1	1		Some girl who fled from herself did listen to this guy.
exp=reflexive-matrix_reflexive=0-matrix_antecedent=1-refl1=herself-refl2=himself-precede=0	0		Some girl who fled from himself did listen to this guy.
exp=reflexive-matrix_reflexive=0-matrix_antecedent=1-refl1=itself-refl2=themselves-precede=1	1		That hat that resembles itself resembled ladies.
exp=reflexive-matrix_reflexive=0-matrix_antecedent=1-refl1=itself-refl2=themselves-precede=0	0		That hat that resembles themselves resembled ladies.
exp=reflexive-matrix_reflexive=0-matrix_antecedent=1-refl1=themselves-refl2=himself-precede=1	1		A lot of patients that didn't admire themselves have attacked some guy.
exp=reflexive-matrix_reflexive=0-matrix_antecedent=1-refl1=themselves-refl2=himself-precede=0	0		A lot of patients that didn't admire himself have attacked some guy.
exp=reflexive-matrix_reflexive=0-matrix_antecedent=1-refl1=themselves-refl2=herself-precede=1	1		All gals that won't listen to themselves couldn't kiss the waitress.
exp=reflexive-matrix_reflexive=0-matrix_antecedent=1-refl1=themselves-refl2=herself-precede=0	0		All gals that won't listen to herself couldn't kiss the waitress.
exp=reflexive-matrix_reflexive=0-matrix_antecedent=1-refl1=themselves-refl2=itself-precede=1	1		Some cashiers that fled from themselves admired some hat.
exp=reflexive-matrix_reflexive=0-matrix_antecedent=1-refl1=themselves-refl2=itself-precede=0	0		Some cashiers that fled from itself admired some hat.
exp=reflexive-matrix_reflexive=0-matrix_antecedent=1-refl1=themselves-refl2=herself-precede=1	1		Many guests that liked themselves had investigated the waitress.
exp=reflexive-matrix_reflexive=0-matrix_antecedent=1-refl1=themselves-refl2=herself-precede=0	0		Many guests that liked herself had investigated the waitress.
exp=reflexive-matrix_reflexive=0-matrix_antecedent=1-refl1=themselves-refl2=itself-precede=1	1		The ladies who return to themselves can resemble a documentary.
exp=reflexive-matrix_reflexive=0-matrix_antecedent=1-refl1=themselves-refl2=itself-precede=0	0		The ladies who return to itself can resemble a documentary.
exp=reflexive-matrix_reflexive=0-matrix_antecedent=1-refl1=herself-refl2=themselves-precede=1	1		This woman who can't like herself might know these teachers.
exp=reflexive-matrix_reflexive=0-matrix_antecedent=1-refl1=herself-refl2=themselves-precede=0	0		This woman who can't like themselves might know these teachers.
exp=reflexive-matrix_reflexive=0-matrix_antecedent=1-refl1=themselves-refl2=herself-precede=1	1		Men who care for themselves fled from that woman.
exp=reflexive-matrix_reflexive=0-matrix_antecedent=1-refl1=themselves-refl2=herself-precede=0	0		Men who care for herself fled from that woman.
exp=reflexive-matrix_reflexive=0-matrix_antecedent=1-refl1=themselves-refl2=herself-precede=1	1		The teachers that disliked themselves worked with some waitress.
exp=reflexive-matrix_reflexive=0-matrix_antecedent=1-refl1=themselves-refl2=herself-precede=0	0		The teachers that disliked herself worked with some waitress.
exp=reflexive-matrix_reflexive=0-matrix_antecedent=1-refl1=themselves-refl2=itself-precede=1	1		Many women who won't help themselves had left this bank.
exp=reflexive-matrix_reflexive=0-matrix_antecedent=1-refl1=themselves-refl2=itself-precede=0	0		Many women who won't help itself had left this bank.
exp=reflexive-matrix_reflexive=0-matrix_antecedent=1-refl1=themselves-refl2=itself-precede=1	1		Adults who shouldn't love themselves reference some movie.
exp=reflexive-matrix_reflexive=0-matrix_antecedent=1-refl1=themselves-refl2=itself-precede=0	0		Adults who shouldn't love itself reference some movie.
exp=reflexive-matrix_reflexive=0-matrix_antecedent=1-refl1=themselves-refl2=itself-precede=1	1		Many women that couldn't see themselves are insulting the play.
exp=reflexive-matrix_reflexive=0-matrix_antecedent=1-refl1=themselves-refl2=itself-precede=0	0		Many women that couldn't see itself are insulting the play.
exp=reflexive-matrix_reflexive=0-matrix_antecedent=1-refl1=themselves-refl2=himself-precede=1	1		Some teachers that had escaped from themselves talk to the man.
exp=reflexive-matrix_reflexive=0-matrix_antecedent=1-refl1=themselves-refl2=himself-precede=0	0		Some teachers that had escaped from himself talk to the man.
exp=reflexive-matrix_reflexive=0-matrix_antecedent=1-refl1=themselves-refl2=herself-precede=1	1		All humans who hadn't insulted themselves don't escape from this actress.
exp=reflexive-matrix_reflexive=0-matrix_antecedent=1-refl1=themselves-refl2=herself-precede=0	0		All humans who hadn't insulted herself don't escape from this actress.
exp=reflexive-matrix_reflexive=0-matrix_antecedent=1-refl1=herself-refl2=themselves-precede=1	1		Every lady that was talking to herself could return to patients.
exp=reflexive-matrix_reflexive=0-matrix_antecedent=1-refl1=herself-refl2=themselves-precede=0	0		Every lady that was talking to themselves could return to patients.
exp=reflexive-matrix_reflexive=0-matrix_antecedent=1-refl1=themselves-refl2=itself-precede=1	1		Many doctors that forget themselves might criticize that art gallery.
exp=reflexive-matrix_reflexive=0-matrix_antecedent=1-refl1=themselves-refl2=itself-precede=0	0		Many doctors that forget itself might criticize that art gallery.
exp=reflexive-matrix_reflexive=0-matrix_antecedent=1-refl1=themselves-refl2=itself-precede=1	1		Actors that talked about themselves would investigate every hospital.
exp=reflexive-matrix_reflexive=0-matrix_antecedent=1-refl1=themselves-refl2=itself-precede=0	0		Actors that talked about itself would investigate every hospital.
exp=reflexive-matrix_reflexive=0-matrix_antecedent=1-refl1=themselves-refl2=herself-precede=1	1		All guests who had remembered themselves left the woman.
exp=reflexive-matrix_reflexive=0-matrix_antecedent=1-refl1=themselves-refl2=herself-precede=0	0		All guests who had remembered herself left the woman.
exp=reflexive-matrix_reflexive=0-matrix_antecedent=1-refl1=themselves-refl2=himself-precede=1	1		The cashiers that were visiting themselves talk to that guy.
exp=reflexive-matrix_reflexive=0-matrix_antecedent=1-refl1=themselves-refl2=himself-precede=0	0		The cashiers that were visiting himself talk to that guy.
exp=reflexive-matrix_reflexive=0-matrix_antecedent=1-refl1=themselves-refl2=himself-precede=1	1		Some waitresses that couldn't respect themselves haven't referenced the guy.
exp=reflexive-matrix_reflexive=0-matrix_antecedent=1-refl1=themselves-refl2=himself-precede=0	0		Some waitresses that couldn't respect himself haven't referenced the guy.
exp=reflexive-matrix_reflexive=0-matrix_antecedent=1-refl1=themselves-refl2=itself-precede=1	1		Books that resemble themselves won't discuss the story.
exp=reflexive-matrix_reflexive=0-matrix_antecedent=1-refl1=themselves-refl2=itself-precede=0	0		Books that resemble itself won't discuss the story.
exp=reflexive-matrix_reflexive=0-matrix_antecedent=1-refl1=themselves-refl2=herself-precede=1	1		Actors that might return to themselves love the girl.
exp=reflexive-matrix_reflexive=0-matrix_antecedent=1-refl1=themselves-refl2=herself-precede=0	0		Actors that might return to herself love the girl.
exp=reflexive-matrix_reflexive=0-matrix_antecedent=1-refl1=themselves-refl2=herself-precede=1	1		The teachers that didn't hate themselves help some girl.
exp=reflexive-matrix_reflexive=0-matrix_antecedent=1-refl1=themselves-refl2=herself-precede=0	0		The teachers that didn't hate herself help some girl.
exp=reflexive-matrix_reflexive=0-matrix_antecedent=1-refl1=themselves-refl2=herself-precede=1	1		These waiters that don't talk to themselves are kissing some girl.
exp=reflexive-matrix_reflexive=0-matrix_antecedent=1-refl1=themselves-refl2=herself-precede=0	0		These waiters that don't talk to herself are kissing some girl.
exp=reflexive-matrix_reflexive=0-matrix_antecedent=1-refl1=themselves-refl2=himself-precede=1	1		These cashiers who can't know themselves haven't helped this guy.
exp=reflexive-matrix_reflexive=0-matrix_antecedent=1-refl1=themselves-refl2=himself-precede=0	0		These cashiers who can't know himself haven't helped this guy.
exp=reflexive-matrix_reflexive=0-matrix_antecedent=1-refl1=themselves-refl2=himself-precede=1	1		These pedestrians that haven't visited themselves watch some guy.
exp=reflexive-matrix_reflexive=0-matrix_antecedent=1-refl1=themselves-refl2=himself-precede=0	0		These pedestrians that haven't visited himself watch some guy.
exp=reflexive-matrix_reflexive=0-matrix_antecedent=1-refl1=themselves-refl2=himself-precede=1	1		The teachers that hadn't criticized themselves listened to this boy.
exp=reflexive-matrix_reflexive=0-matrix_antecedent=1-refl1=themselves-refl2=himself-precede=0	0		The teachers that hadn't criticized himself listened to this boy.
exp=reflexive-matrix_reflexive=0-matrix_antecedent=1-refl1=themselves-refl2=himself-precede=1	1		A lot of gals who know themselves shouldn't know every man.
exp=reflexive-matrix_reflexive=0-matrix_antecedent=1-refl1=themselves-refl2=himself-precede=0	0		A lot of gals who know himself shouldn't know every man.
