experiment=NPI-env=conditional-npi=ever-crucial_item=while-licensor=0-scope=1-npi_present=1	0		while the man ever scanning the newspaper articles , the man can concur .
experiment=NPI-env=conditional-npi=ever-crucial_item=while-licensor=0-scope=0-npi_present=1	0		ever while the man scanning the newspaper articles , the man can concur .
experiment=NPI-env=conditional-npi=ever-crucial_item=while-licensor=0-scope=0-npi_present=0	0		never while the man scanning the newspaper articles , the man can concur .
experiment=NPI-env=conditional-npi=ever-crucial_item=if-licensor=1-scope=1-npi_present=1	1		if a person ever sell the cars , a person could read .
experiment=NPI-env=conditional-npi=ever-crucial_item=if-licensor=1-scope=0-npi_present=1	0		ever if a person sell the cars , a person could read .
experiment=NPI-env=conditional-npi=ever-crucial_item=if-licensor=1-scope=0-npi_present=0	0		never if a person sell the cars , a person could read .
experiment=NPI-env=conditional-npi=ever-crucial_item=while-licensor=0-scope=1-npi_present=1	0		while a person ever sell the cars , a person could read .
experiment=NPI-env=conditional-npi=ever-crucial_item=if-licensor=1-scope=1-npi_present=1	1		if the women ever dislike the alumni , the women will practice .
experiment=NPI-env=conditional-npi=ever-crucial_item=if-licensor=1-scope=1-npi_present=0	1		if the women never dislike the alumni , the women will practice .
experiment=NPI-env=conditional-npi=ever-crucial_item=if-licensor=1-scope=1-npi_present=1	1		if a lady ever explore the movie theaters , a lady might grin .
experiment=NPI-env=conditional-npi=ever-crucial_item=while-licensor=0-scope=1-npi_present=1	0		while a lady ever explore the movie theaters , a lady might grin .
experiment=NPI-env=conditional-npi=ever-crucial_item=while-licensor=0-scope=1-npi_present=0	1		while a lady never explore the movie theaters , a lady might grin .
experiment=NPI-env=conditional-npi=ever-crucial_item=if-licensor=1-scope=0-npi_present=1	0		ever if the humans worked with the sheep , the humans might slump over .
experiment=NPI-env=conditional-npi=ever-crucial_item=while-licensor=0-scope=1-npi_present=0	1		while the humans never worked with the sheep , the humans might slump over .
experiment=NPI-env=conditional-npi=ever-crucial_item=while-licensor=0-scope=0-npi_present=1	0		ever while the humans worked with the sheep , the humans might slump over .
experiment=NPI-env=conditional-npi=ever-crucial_item=while-licensor=0-scope=0-npi_present=0	0		never while the humans worked with the sheep , the humans might slump over .
experiment=NPI-env=conditional-npi=ever-crucial_item=if-licensor=1-scope=0-npi_present=1	0		ever if the waiters attacked the children , the waiters might practice .
experiment=NPI-env=conditional-npi=ever-crucial_item=if-licensor=1-scope=0-npi_present=0	0		never if the waiters attacked the children , the waiters might practice .
experiment=NPI-env=conditional-npi=ever-crucial_item=while-licensor=0-scope=1-npi_present=0	1		while the waiters never attacked the children , the waiters might practice .
experiment=NPI-env=conditional-npi=ever-crucial_item=while-licensor=0-scope=0-npi_present=0	0		never while the waiters attacked the children , the waiters might practice .
experiment=NPI-env=conditional-npi=ever-crucial_item=if-licensor=1-scope=1-npi_present=1	1		if the teacher ever hates the drivers , the teacher can sit down .
experiment=NPI-env=conditional-npi=ever-crucial_item=while-licensor=0-scope=1-npi_present=0	1		while the teacher never hates the drivers , the teacher can sit down .
experiment=NPI-env=conditional-npi=ever-crucial_item=if-licensor=1-scope=1-npi_present=0	1		if a guy never sells the brochures , a guy would examine movies .
experiment=NPI-env=conditional-npi=ever-crucial_item=if-licensor=1-scope=0-npi_present=1	0		ever if a guy sells the brochures , a guy would examine movies .
experiment=NPI-env=conditional-npi=ever-crucial_item=while-licensor=0-scope=1-npi_present=1	0		while a guy ever sells the brochures , a guy would examine movies .
experiment=NPI-env=conditional-npi=ever-crucial_item=while-licensor=0-scope=1-npi_present=0	1		while a guy never sells the brochures , a guy would examine movies .
experiment=NPI-env=conditional-npi=ever-crucial_item=if-licensor=1-scope=0-npi_present=1	0		ever if the actress escaping from the adults , the actress can talk .
experiment=NPI-env=conditional-npi=ever-crucial_item=while-licensor=0-scope=1-npi_present=0	1		while the actress never escaping from the adults , the actress can talk .
experiment=NPI-env=conditional-npi=ever-crucial_item=while-licensor=0-scope=0-npi_present=1	0		ever while the actress escaping from the adults , the actress can talk .
experiment=NPI-env=conditional-npi=ever-crucial_item=if-licensor=1-scope=1-npi_present=1	1		if a man ever brought the gloves , a man might clean cars .
experiment=NPI-env=conditional-npi=ever-crucial_item=if-licensor=1-scope=1-npi_present=0	1		if a person never respect the fish , a person might skate around museums .
experiment=NPI-env=conditional-npi=ever-crucial_item=if-licensor=1-scope=0-npi_present=1	0		ever if a person respect the fish , a person might skate around museums .
experiment=NPI-env=conditional-npi=ever-crucial_item=if-licensor=1-scope=0-npi_present=0	0		never if a person respect the fish , a person might skate around museums .
experiment=NPI-env=conditional-npi=ever-crucial_item=while-licensor=0-scope=0-npi_present=1	0		ever while a person respect the fish , a person might skate around museums .
experiment=NPI-env=conditional-npi=ever-crucial_item=while-licensor=0-scope=1-npi_present=1	0		while the teachers ever wearing the glasses , the teachers would sell reports .
experiment=NPI-env=conditional-npi=ever-crucial_item=while-licensor=0-scope=1-npi_present=0	1		while the teachers never wearing the glasses , the teachers would sell reports .
experiment=NPI-env=conditional-npi=ever-crucial_item=while-licensor=0-scope=0-npi_present=1	0		ever while the teachers wearing the glasses , the teachers would sell reports .
experiment=NPI-env=conditional-npi=ever-crucial_item=if-licensor=1-scope=1-npi_present=1	1		if the doctors ever scanning the commentaries , the doctors should love actors .
experiment=NPI-env=conditional-npi=ever-crucial_item=while-licensor=0-scope=1-npi_present=1	0		while the doctors ever scanning the commentaries , the doctors should love actors .
experiment=NPI-env=conditional-npi=ever-crucial_item=while-licensor=0-scope=1-npi_present=0	1		while the doctors never scanning the commentaries , the doctors should love actors .
experiment=NPI-env=conditional-npi=ever-crucial_item=while-licensor=0-scope=0-npi_present=1	0		ever while the doctors scanning the commentaries , the doctors should love actors .
experiment=NPI-env=conditional-npi=ever-crucial_item=while-licensor=0-scope=1-npi_present=0	1		while the pedestrians never explore the malls , the pedestrians might win .
experiment=NPI-env=conditional-npi=ever-crucial_item=while-licensor=0-scope=0-npi_present=1	0		ever while the pedestrians explore the malls , the pedestrians might win .
experiment=NPI-env=conditional-npi=ever-crucial_item=while-licensor=0-scope=1-npi_present=1	0		while the actors ever breaking the plates , the actors could conspire .
experiment=NPI-env=conditional-npi=ever-crucial_item=while-licensor=0-scope=0-npi_present=0	0		never while the actors breaking the plates , the actors could conspire .
experiment=NPI-env=conditional-npi=ever-crucial_item=if-licensor=1-scope=1-npi_present=1	1		if a guy ever passed the cafes , a guy should hug humans .
experiment=NPI-env=conditional-npi=ever-crucial_item=if-licensor=1-scope=1-npi_present=0	1		if a guy never passed the cafes , a guy should hug humans .
experiment=NPI-env=conditional-npi=ever-crucial_item=if-licensor=1-scope=0-npi_present=0	0		never if a guy passed the cafes , a guy should hug humans .
experiment=NPI-env=conditional-npi=ever-crucial_item=while-licensor=0-scope=1-npi_present=0	1		while a guy never passed the cafes , a guy should hug humans .
experiment=NPI-env=conditional-npi=ever-crucial_item=while-licensor=0-scope=0-npi_present=1	0		ever while a guy passed the cafes , a guy should hug humans .
experiment=NPI-env=conditional-npi=ever-crucial_item=if-licensor=1-scope=1-npi_present=0	1		if a cashier never dislike the sheep , a cashier can spin around .
experiment=NPI-env=conditional-npi=ever-crucial_item=if-licensor=1-scope=0-npi_present=0	0		never if a cashier dislike the sheep , a cashier can spin around .
experiment=NPI-env=conditional-npi=ever-crucial_item=while-licensor=0-scope=0-npi_present=1	0		ever while the adult describes the banks , the adult should listen to children .
experiment=NPI-env=conditional-npi=ever-crucial_item=while-licensor=0-scope=0-npi_present=1	0		ever while the students watched the drivers , the students should die .
experiment=NPI-env=conditional-npi=ever-crucial_item=while-licensor=0-scope=0-npi_present=0	0		never while the students watched the drivers , the students should die .
experiment=NPI-env=conditional-npi=ever-crucial_item=if-licensor=1-scope=1-npi_present=0	1		if a guest never listened to the guys , a guest could cheer .
experiment=NPI-env=conditional-npi=ever-crucial_item=if-licensor=1-scope=1-npi_present=1	1		if the gal ever bringing the rugs , the gal will forfeit .
experiment=NPI-env=conditional-npi=ever-crucial_item=if-licensor=1-scope=1-npi_present=0	1		if the gal never bringing the rugs , the gal will forfeit .
experiment=NPI-env=conditional-npi=ever-crucial_item=if-licensor=1-scope=0-npi_present=1	0		ever if the gal bringing the rugs , the gal will forfeit .
experiment=NPI-env=conditional-npi=ever-crucial_item=while-licensor=0-scope=1-npi_present=1	0		while the gal ever bringing the rugs , the gal will forfeit .
experiment=NPI-env=conditional-npi=ever-crucial_item=if-licensor=1-scope=1-npi_present=1	1		if the driver ever visits the museums , the driver would wear glasses .
experiment=NPI-env=conditional-npi=ever-crucial_item=if-licensor=1-scope=0-npi_present=1	0		ever if the driver visits the museums , the driver would wear glasses .
experiment=NPI-env=conditional-npi=ever-crucial_item=while-licensor=0-scope=0-npi_present=1	0		ever while the driver visits the museums , the driver would wear glasses .
experiment=NPI-env=conditional-npi=ever-crucial_item=if-licensor=1-scope=0-npi_present=1	0		ever if the teacher known the cashiers , the teacher might negotiate .
experiment=NPI-env=conditional-npi=ever-crucial_item=if-licensor=1-scope=1-npi_present=0	1		if a waiter never criticizing the restaurants , a waiter would blink .
experiment=NPI-env=conditional-npi=ever-crucial_item=if-licensor=1-scope=0-npi_present=0	0		never if a waiter criticizing the restaurants , a waiter would blink .
experiment=NPI-env=conditional-npi=ever-crucial_item=while-licensor=0-scope=1-npi_present=0	1		while a waiter never criticizing the restaurants , a waiter would blink .
experiment=NPI-env=conditional-npi=ever-crucial_item=if-licensor=1-scope=1-npi_present=1	1		if the woman ever returned to the women , the woman might mutter .
experiment=NPI-env=conditional-npi=ever-crucial_item=if-licensor=1-scope=0-npi_present=1	0		ever if the woman returned to the women , the woman might mutter .
experiment=NPI-env=conditional-npi=ever-crucial_item=if-licensor=1-scope=0-npi_present=0	0		never if the woman returned to the women , the woman might mutter .
experiment=NPI-env=conditional-npi=ever-crucial_item=if-licensor=1-scope=1-npi_present=1	1		if a boy ever visited the guests , a boy can boast .
experiment=NPI-env=conditional-npi=ever-crucial_item=if-licensor=1-scope=1-npi_present=0	1		if a boy never visited the guests , a boy can boast .
experiment=NPI-env=conditional-npi=ever-crucial_item=while-licensor=0-scope=1-npi_present=1	0		while a boy ever visited the guests , a boy can boast .
experiment=NPI-env=conditional-npi=ever-crucial_item=while-licensor=0-scope=0-npi_present=1	0		ever while a boy visited the guests , a boy can boast .
experiment=NPI-env=conditional-npi=ever-crucial_item=if-licensor=1-scope=1-npi_present=1	1		if the patient ever left the waitresses , the patient can talk about movie theaters .
experiment=NPI-env=conditional-npi=ever-crucial_item=if-licensor=1-scope=1-npi_present=0	1		if the patient never left the waitresses , the patient can talk about movie theaters .
experiment=NPI-env=conditional-npi=ever-crucial_item=if-licensor=1-scope=0-npi_present=0	0		never if the patient left the waitresses , the patient can talk about movie theaters .
experiment=NPI-env=conditional-npi=ever-crucial_item=if-licensor=1-scope=0-npi_present=1	0		ever if the actresses clean the books , the actresses will stretch .
experiment=NPI-env=conditional-npi=ever-crucial_item=while-licensor=0-scope=1-npi_present=0	1		while the actresses never clean the books , the actresses will stretch .
experiment=NPI-env=conditional-npi=ever-crucial_item=if-licensor=1-scope=1-npi_present=0	1		if the teacher never walked through the banks , the teacher can be at grocery stores .
experiment=NPI-env=conditional-npi=ever-crucial_item=if-licensor=1-scope=0-npi_present=0	0		never if the teacher walked through the banks , the teacher can be at grocery stores .
experiment=NPI-env=conditional-npi=ever-crucial_item=while-licensor=0-scope=1-npi_present=0	1		while the teacher never walked through the banks , the teacher can be at grocery stores .
experiment=NPI-env=conditional-npi=ever-crucial_item=if-licensor=1-scope=1-npi_present=1	1		if the adults ever broken the books , the adults will kiss .
experiment=NPI-env=conditional-npi=ever-crucial_item=if-licensor=1-scope=0-npi_present=1	0		ever if the adults broken the books , the adults will kiss .
experiment=NPI-env=conditional-npi=ever-crucial_item=while-licensor=0-scope=1-npi_present=0	1		while the adults never broken the books , the adults will kiss .
experiment=NPI-env=conditional-npi=ever-crucial_item=while-licensor=0-scope=0-npi_present=1	0		ever while the adults broken the books , the adults will kiss .
experiment=NPI-env=conditional-npi=ever-crucial_item=if-licensor=1-scope=0-npi_present=0	0		never if the adult examined the movies , the adult might break glasses .
experiment=NPI-env=conditional-npi=ever-crucial_item=while-licensor=0-scope=1-npi_present=1	0		while the adult ever examined the movies , the adult might break glasses .
experiment=NPI-env=conditional-npi=ever-crucial_item=while-licensor=0-scope=0-npi_present=1	0		ever while the adult examined the movies , the adult might break glasses .
experiment=NPI-env=conditional-npi=ever-crucial_item=if-licensor=1-scope=1-npi_present=1	1		if the men ever bought the brochures , the men could drink .
experiment=NPI-env=conditional-npi=ever-crucial_item=if-licensor=1-scope=1-npi_present=0	1		if the human never escapes from the grocery stores , the human might go to public parks .
experiment=NPI-env=conditional-npi=ever-crucial_item=if-licensor=1-scope=0-npi_present=0	0		never if the human escapes from the grocery stores , the human might go to public parks .
experiment=NPI-env=conditional-npi=ever-crucial_item=while-licensor=0-scope=1-npi_present=1	0		while the human ever escapes from the grocery stores , the human might go to public parks .
experiment=NPI-env=conditional-npi=ever-crucial_item=while-licensor=0-scope=1-npi_present=0	1		while the human never escapes from the grocery stores , the human might go to public parks .
experiment=NPI-env=conditional-npi=ever-crucial_item=if-licensor=1-scope=1-npi_present=1	1		if the waitresses ever talking to the deer , the waitresses might succeed .
experiment=NPI-env=conditional-npi=ever-crucial_item=if-licensor=1-scope=0-npi_present=1	0		ever if the waitresses talking to the deer , the waitresses might succeed .
experiment=NPI-env=conditional-npi=ever-crucial_item=if-licensor=1-scope=1-npi_present=1	1		if a man ever boycotts the public parks , a man would go fishing .
experiment=NPI-env=conditional-npi=ever-crucial_item=if-licensor=1-scope=0-npi_present=1	0		ever if a man boycotts the public parks , a man would go fishing .
experiment=NPI-env=conditional-npi=ever-crucial_item=if-licensor=1-scope=0-npi_present=0	0		never if a man boycotts the public parks , a man would go fishing .
experiment=NPI-env=conditional-npi=ever-crucial_item=while-licensor=0-scope=0-npi_present=0	0		never while a man boycotts the public parks , a man would go fishing .
experiment=NPI-env=conditional-npi=ever-crucial_item=if-licensor=1-scope=1-npi_present=1	1		if the boys ever like the ladies , the boys would approve .
experiment=NPI-env=conditional-npi=ever-crucial_item=if-licensor=1-scope=1-npi_present=0	1		if the boys never like the ladies , the boys would approve .
experiment=NPI-env=conditional-npi=ever-crucial_item=if-licensor=1-scope=0-npi_present=1	0		ever if the boys like the ladies , the boys would approve .
experiment=NPI-env=conditional-npi=ever-crucial_item=while-licensor=0-scope=0-npi_present=1	0		ever while the boys like the ladies , the boys would approve .
experiment=NPI-env=conditional-npi=ever-crucial_item=if-licensor=1-scope=0-npi_present=1	0		ever if a customer loves the documentaries , a customer might shrug .
experiment=NPI-env=conditional-npi=ever-crucial_item=if-licensor=1-scope=0-npi_present=0	0		never if a customer loves the documentaries , a customer might shrug .
experiment=NPI-env=conditional-npi=ever-crucial_item=while-licensor=0-scope=1-npi_present=0	1		while the lady never has the cars , the lady could respond .
experiment=NPI-env=conditional-npi=ever-crucial_item=while-licensor=0-scope=0-npi_present=1	0		ever while the lady has the cars , the lady could respond .
experiment=NPI-env=conditional-npi=ever-crucial_item=while-licensor=0-scope=0-npi_present=0	0		never while the lady has the cars , the lady could respond .
experiment=NPI-env=conditional-npi=ever-crucial_item=if-licensor=1-scope=1-npi_present=1	1		if the actor ever exited the grocery stores , the actor might work with teenagers .
experiment=NPI-env=conditional-npi=ever-crucial_item=if-licensor=1-scope=0-npi_present=1	0		ever if the actor exited the grocery stores , the actor might work with teenagers .
experiment=NPI-env=conditional-npi=ever-crucial_item=if-licensor=1-scope=0-npi_present=1	0		ever if the driver lifting the gloves , the driver could worry .
experiment=NPI-env=conditional-npi=ever-crucial_item=while-licensor=0-scope=0-npi_present=1	0		ever while the driver lifting the gloves , the driver could worry .
experiment=NPI-env=conditional-npi=ever-crucial_item=if-licensor=1-scope=1-npi_present=0	1		if the drivers never drop by the art galleries , the drivers will clean dishes .
experiment=NPI-env=conditional-npi=ever-crucial_item=if-licensor=1-scope=0-npi_present=0	0		never if the drivers drop by the art galleries , the drivers will clean dishes .
experiment=NPI-env=conditional-npi=ever-crucial_item=if-licensor=1-scope=0-npi_present=1	0		ever if the actors investigating the libraries , the actors can reply .
experiment=NPI-env=conditional-npi=ever-crucial_item=if-licensor=1-scope=0-npi_present=0	0		never if the people exit the banks , the people would win .
experiment=NPI-env=conditional-npi=ever-crucial_item=while-licensor=0-scope=1-npi_present=1	0		while the people ever exit the banks , the people would win .
experiment=NPI-env=conditional-npi=ever-crucial_item=while-licensor=0-scope=0-npi_present=0	0		never while the people exit the banks , the people would win .
experiment=NPI-env=conditional-npi=ever-crucial_item=if-licensor=1-scope=1-npi_present=1	1		if a man ever criticizing the alumni , a man can observe actors .
experiment=NPI-env=conditional-npi=ever-crucial_item=if-licensor=1-scope=0-npi_present=1	0		ever if a man criticizing the alumni , a man can observe actors .
experiment=NPI-env=conditional-npi=ever-crucial_item=if-licensor=1-scope=0-npi_present=0	0		never if a man criticizing the alumni , a man can observe actors .
experiment=NPI-env=conditional-npi=ever-crucial_item=while-licensor=0-scope=1-npi_present=1	0		while a man ever criticizing the alumni , a man can observe actors .
experiment=NPI-env=conditional-npi=ever-crucial_item=while-licensor=0-scope=1-npi_present=0	1		while a man never criticizing the alumni , a man can observe actors .
experiment=NPI-env=conditional-npi=ever-crucial_item=if-licensor=1-scope=1-npi_present=1	1		if the guy ever fled from the grocery stores , the guy could run around malls .
experiment=NPI-env=conditional-npi=ever-crucial_item=if-licensor=1-scope=1-npi_present=0	1		if the guy never fled from the grocery stores , the guy could run around malls .
experiment=NPI-env=conditional-npi=ever-crucial_item=while-licensor=0-scope=1-npi_present=1	0		while the guy ever fled from the grocery stores , the guy could run around malls .
experiment=NPI-env=conditional-npi=ever-crucial_item=while-licensor=0-scope=1-npi_present=0	1		while the guy never fled from the grocery stores , the guy could run around malls .
experiment=NPI-env=conditional-npi=ever-crucial_item=while-licensor=0-scope=0-npi_present=1	0		ever while the guy fled from the grocery stores , the guy could run around malls .
experiment=NPI-env=conditional-npi=ever-crucial_item=if-licensor=1-scope=0-npi_present=1	0		ever if the gals listening to the customers , the gals can flee from doctors .
experiment=NPI-env=conditional-npi=ever-crucial_item=while-licensor=0-scope=0-npi_present=1	0		ever while the gals listening to the customers , the gals can flee from doctors .
experiment=NPI-env=conditional-npi=ever-crucial_item=if-licensor=1-scope=1-npi_present=1	1		if the gal ever be at the malls , the gal can talk about grocery stores .
experiment=NPI-env=conditional-npi=ever-crucial_item=if-licensor=1-scope=0-npi_present=1	0		ever if the gal be at the malls , the gal can talk about grocery stores .
experiment=NPI-env=conditional-npi=ever-crucial_item=if-licensor=1-scope=0-npi_present=0	0		never if the gal be at the malls , the gal can talk about grocery stores .
experiment=NPI-env=conditional-npi=ever-crucial_item=while-licensor=0-scope=1-npi_present=1	0		while the gal ever be at the malls , the gal can talk about grocery stores .
experiment=NPI-env=conditional-npi=ever-crucial_item=while-licensor=0-scope=1-npi_present=0	1		while the gal never be at the malls , the gal can talk about grocery stores .
experiment=NPI-env=conditional-npi=ever-crucial_item=while-licensor=0-scope=0-npi_present=1	0		ever while the gal be at the malls , the gal can talk about grocery stores .
experiment=NPI-env=conditional-npi=ever-crucial_item=if-licensor=1-scope=0-npi_present=0	0		never if the actresses kissing the guys , the actresses should forget mice .
experiment=NPI-env=conditional-npi=ever-crucial_item=while-licensor=0-scope=0-npi_present=0	0		never while the actresses kissing the guys , the actresses should forget mice .
experiment=NPI-env=conditional-npi=ever-crucial_item=if-licensor=1-scope=1-npi_present=1	1		if the human ever praised the pedestrians , the human will answer .
experiment=NPI-env=conditional-npi=ever-crucial_item=if-licensor=1-scope=1-npi_present=0	1		if the human never praised the pedestrians , the human will answer .
experiment=NPI-env=conditional-npi=ever-crucial_item=if-licensor=1-scope=0-npi_present=0	0		never if the human praised the pedestrians , the human will answer .
experiment=NPI-env=conditional-npi=ever-crucial_item=if-licensor=1-scope=1-npi_present=1	1		if the cashiers ever love the brochures , the cashiers can write hard .
experiment=NPI-env=conditional-npi=ever-crucial_item=while-licensor=0-scope=0-npi_present=0	0		never while the cashiers love the brochures , the cashiers can write hard .
experiment=NPI-env=conditional-npi=ever-crucial_item=if-licensor=1-scope=1-npi_present=0	1		if the humans never escape from the restaurants , the humans can write hard .
experiment=NPI-env=conditional-npi=ever-crucial_item=if-licensor=1-scope=0-npi_present=1	0		ever if the humans escape from the restaurants , the humans can write hard .
experiment=NPI-env=conditional-npi=ever-crucial_item=while-licensor=0-scope=0-npi_present=1	0		ever while the humans escape from the restaurants , the humans can write hard .
experiment=NPI-env=conditional-npi=ever-crucial_item=while-licensor=0-scope=0-npi_present=0	0		never while the humans escape from the restaurants , the humans can write hard .
experiment=NPI-env=conditional-npi=ever-crucial_item=if-licensor=1-scope=1-npi_present=1	1		if a child ever touring the libraries , a child can investigate high schools .
experiment=NPI-env=conditional-npi=ever-crucial_item=while-licensor=0-scope=0-npi_present=1	0		ever while a child touring the libraries , a child can investigate high schools .
experiment=NPI-env=conditional-npi=ever-crucial_item=if-licensor=1-scope=1-npi_present=0	1		if the guests never respected the waitresses , the guests will bike to schools .
experiment=NPI-env=conditional-npi=ever-crucial_item=if-licensor=1-scope=0-npi_present=1	0		ever if the guests respected the waitresses , the guests will bike to schools .
experiment=NPI-env=conditional-npi=ever-crucial_item=if-licensor=1-scope=1-npi_present=1	1		if the lady ever breaking the dishes , the lady will have newspaper articles .
experiment=NPI-env=conditional-npi=ever-crucial_item=if-licensor=1-scope=1-npi_present=0	1		if the lady never breaking the dishes , the lady will have newspaper articles .
experiment=NPI-env=conditional-npi=ever-crucial_item=if-licensor=1-scope=0-npi_present=0	0		never if the lady breaking the dishes , the lady will have newspaper articles .
experiment=NPI-env=conditional-npi=ever-crucial_item=while-licensor=0-scope=1-npi_present=1	0		while the lady ever breaking the dishes , the lady will have newspaper articles .
experiment=NPI-env=conditional-npi=ever-crucial_item=while-licensor=0-scope=1-npi_present=0	1		while the lady never breaking the dishes , the lady will have newspaper articles .
