experiment=NPI-env=adverbs-npi=ever-crucial_item=seldom-licensor=1-scope=1-npi_present=0	1		the waitress seldom also says that the women had scanned the report .
experiment=NPI-env=adverbs-npi=ever-crucial_item=often-licensor=0-scope=1-npi_present=0	1		the teacher often also thought that the boys spun around .
experiment=NPI-env=adverbs-npi=ever-crucial_item=scarcely-licensor=1-scope=1-npi_present=0	1		the teacher scarcely also thought that the boys spun around .
experiment=NPI-env=adverbs-npi=ever-crucial_item=scarcely-licensor=1-scope=0-npi_present=0	1		the teacher scarcely thought that the boys also spun around .
experiment=NPI-env=adverbs-npi=ever-crucial_item=always-licensor=0-scope=0-npi_present=1	0		the doctors always say that a boy had ever yelled .
experiment=NPI-env=adverbs-npi=ever-crucial_item=seldom-licensor=1-scope=1-npi_present=0	1		the doctors seldom also say that a boy had yelled .
experiment=NPI-env=adverbs-npi=ever-crucial_item=seldom-licensor=1-scope=0-npi_present=1	0		the doctors seldom say that a boy had ever yelled .
experiment=NPI-env=adverbs-npi=ever-crucial_item=often-licensor=0-scope=0-npi_present=1	0		the people often imagine that the people ever examined the pamphlets .
experiment=NPI-env=adverbs-npi=ever-crucial_item=hardly-licensor=1-scope=1-npi_present=0	1		the people hardly also imagine that the people examined the pamphlets .
experiment=NPI-env=adverbs-npi=ever-crucial_item=scarcely-licensor=1-scope=0-npi_present=1	0		a pedestrian scarcely explains that a boy should ever shrug .
experiment=NPI-env=adverbs-npi=ever-crucial_item=often-licensor=0-scope=1-npi_present=1	0		the boy often ever thought that the guys pass the cafes .
experiment=NPI-env=adverbs-npi=ever-crucial_item=often-licensor=0-scope=1-npi_present=0	1		the boy often also thought that the guys pass the cafes .
experiment=NPI-env=adverbs-npi=ever-crucial_item=always-licensor=0-scope=0-npi_present=0	1		the cashiers always thought that the students had also boasted .
experiment=NPI-env=adverbs-npi=ever-crucial_item=hardly-licensor=1-scope=0-npi_present=1	0		the cashiers hardly thought that the students had ever boasted .
experiment=NPI-env=adverbs-npi=ever-crucial_item=sometimes-licensor=0-scope=1-npi_present=1	0		the student sometimes ever says that the child spins around .
experiment=NPI-env=adverbs-npi=ever-crucial_item=sometimes-licensor=0-scope=0-npi_present=1	0		the student sometimes says that the child ever spins around .
experiment=NPI-env=adverbs-npi=ever-crucial_item=often-licensor=0-scope=1-npi_present=1	0		a patient often ever imagines that a boy talks about the art galleries .
experiment=NPI-env=adverbs-npi=ever-crucial_item=rarely-licensor=1-scope=0-npi_present=1	0		a patient rarely imagines that a boy ever talks about the art galleries .
experiment=NPI-env=adverbs-npi=ever-crucial_item=rarely-licensor=1-scope=0-npi_present=0	1		a patient rarely imagines that a boy also talks about the art galleries .
experiment=NPI-env=adverbs-npi=ever-crucial_item=barely-licensor=1-scope=0-npi_present=1	0		an actress barely thinks that the woman ever slumped over .
experiment=NPI-env=adverbs-npi=ever-crucial_item=barely-licensor=1-scope=1-npi_present=1	1		a customer barely ever said that a patient chuckled .
experiment=NPI-env=adverbs-npi=ever-crucial_item=barely-licensor=1-scope=0-npi_present=1	0		a customer barely said that a patient ever chuckled .
experiment=NPI-env=adverbs-npi=ever-crucial_item=barely-licensor=1-scope=0-npi_present=0	1		a customer barely said that a patient also chuckled .
experiment=NPI-env=adverbs-npi=ever-crucial_item=often-licensor=0-scope=0-npi_present=1	0		the guys often say that the teenagers ever describe the child .
experiment=NPI-env=adverbs-npi=ever-crucial_item=seldom-licensor=1-scope=0-npi_present=0	1		the guys seldom say that the teenagers also describe the child .
experiment=NPI-env=adverbs-npi=ever-crucial_item=sometimes-licensor=0-scope=1-npi_present=0	1		a human sometimes also explained that a boy exited the banks .
experiment=NPI-env=adverbs-npi=ever-crucial_item=sometimes-licensor=0-scope=0-npi_present=0	1		a human sometimes explained that a boy also exited the banks .
experiment=NPI-env=adverbs-npi=ever-crucial_item=hardly-licensor=1-scope=1-npi_present=1	1		a human hardly ever explained that a boy exited the banks .
experiment=NPI-env=adverbs-npi=ever-crucial_item=hardly-licensor=1-scope=0-npi_present=0	1		a human hardly explained that a boy also exited the banks .
experiment=NPI-env=adverbs-npi=ever-crucial_item=always-licensor=0-scope=1-npi_present=1	0		the children always ever explain that the teenager wept .
experiment=NPI-env=adverbs-npi=ever-crucial_item=always-licensor=0-scope=0-npi_present=0	1		the children always explain that the teenager also wept .
experiment=NPI-env=adverbs-npi=ever-crucial_item=barely-licensor=1-scope=1-npi_present=0	1		the children barely also explain that the teenager wept .
experiment=NPI-env=adverbs-npi=ever-crucial_item=often-licensor=0-scope=1-npi_present=0	1		the actor often also explained that a man would speak up .
experiment=NPI-env=adverbs-npi=ever-crucial_item=scarcely-licensor=1-scope=1-npi_present=0	1		the actor scarcely also explained that a man would speak up .
experiment=NPI-env=adverbs-npi=ever-crucial_item=sometimes-licensor=0-scope=1-npi_present=0	1		the boy sometimes also explained that a boy might walk through the schools .
experiment=NPI-env=adverbs-npi=ever-crucial_item=sometimes-licensor=0-scope=0-npi_present=1	0		the boy sometimes explained that a boy might ever walk through the schools .
experiment=NPI-env=adverbs-npi=ever-crucial_item=rarely-licensor=1-scope=1-npi_present=1	1		the boy rarely ever explained that a boy might walk through the schools .
experiment=NPI-env=adverbs-npi=ever-crucial_item=rarely-licensor=1-scope=1-npi_present=0	1		the boy rarely also explained that a boy might walk through the schools .
experiment=NPI-env=adverbs-npi=ever-crucial_item=always-licensor=0-scope=1-npi_present=0	1		a driver always also said that the actresses succeed .
experiment=NPI-env=adverbs-npi=ever-crucial_item=scarcely-licensor=1-scope=0-npi_present=1	0		a driver scarcely said that the actresses ever succeed .
experiment=NPI-env=adverbs-npi=ever-crucial_item=rarely-licensor=1-scope=0-npi_present=0	1		the drivers rarely think that the men had also conspired .
experiment=NPI-env=adverbs-npi=ever-crucial_item=always-licensor=0-scope=1-npi_present=1	0		the actor always ever explains that the man goes fishing .
experiment=NPI-env=adverbs-npi=ever-crucial_item=always-licensor=0-scope=1-npi_present=0	1		the actor always also explains that the man goes fishing .
experiment=NPI-env=adverbs-npi=ever-crucial_item=always-licensor=0-scope=0-npi_present=0	1		the actor always explains that the man also goes fishing .
experiment=NPI-env=adverbs-npi=ever-crucial_item=seldom-licensor=1-scope=0-npi_present=0	1		the actor seldom explains that the man also goes fishing .
experiment=NPI-env=adverbs-npi=ever-crucial_item=always-licensor=0-scope=0-npi_present=0	1		the patients always imagine that the patients also fight .
experiment=NPI-env=adverbs-npi=ever-crucial_item=scarcely-licensor=1-scope=0-npi_present=0	1		the patients scarcely imagine that the patients also fight .
experiment=NPI-env=adverbs-npi=any-crucial_item=rarely-licensor=1-scope=0-npi_present=0	1		the women who had rarely loved commentaries drop by the college campuses .
experiment=NPI-env=adverbs-npi=any-crucial_item=always-licensor=0-scope=1-npi_present=1	0		the student who has always ran around any grocery stores has brought glasses .
experiment=NPI-env=adverbs-npi=any-crucial_item=always-licensor=0-scope=1-npi_present=0	1		the student who has always ran around the grocery stores has brought glasses .
experiment=NPI-env=adverbs-npi=any-crucial_item=always-licensor=0-scope=0-npi_present=0	1		the student who has always ran around grocery stores has brought the glasses .
experiment=NPI-env=adverbs-npi=any-crucial_item=scarcely-licensor=1-scope=1-npi_present=1	1		the student who has scarcely ran around any grocery stores has brought glasses .
experiment=NPI-env=adverbs-npi=any-crucial_item=scarcely-licensor=1-scope=1-npi_present=0	1		the student who has scarcely ran around the grocery stores has brought glasses .
experiment=NPI-env=adverbs-npi=any-crucial_item=often-licensor=0-scope=1-npi_present=1	0		the actresses who often went to any grocery stores watch boys .
experiment=NPI-env=adverbs-npi=any-crucial_item=rarely-licensor=1-scope=1-npi_present=0	1		the actresses who rarely went to the grocery stores watch boys .
experiment=NPI-env=adverbs-npi=any-crucial_item=rarely-licensor=1-scope=0-npi_present=0	1		the actresses who rarely went to grocery stores watch the boys .
experiment=NPI-env=adverbs-npi=any-crucial_item=often-licensor=0-scope=1-npi_present=1	0		the waiters who often drop by any museums have criticized fish .
experiment=NPI-env=adverbs-npi=any-crucial_item=scarcely-licensor=1-scope=0-npi_present=0	1		the waiters who scarcely drop by museums have criticized the fish .
experiment=NPI-env=adverbs-npi=any-crucial_item=scarcely-licensor=1-scope=0-npi_present=1	0		the actress who scarcely leaves college campuses has examined any brochures .
experiment=NPI-env=adverbs-npi=any-crucial_item=sometimes-licensor=0-scope=0-npi_present=0	1		the cashier who has sometimes attacked people has skated around the grocery stores .
experiment=NPI-env=adverbs-npi=any-crucial_item=seldom-licensor=1-scope=0-npi_present=1	0		the cashier who has seldom attacked people has skated around any grocery stores .
experiment=NPI-env=adverbs-npi=any-crucial_item=sometimes-licensor=0-scope=1-npi_present=1	0		the boys who had sometimes arrived at any college campuses praised children .
experiment=NPI-env=adverbs-npi=any-crucial_item=sometimes-licensor=0-scope=0-npi_present=0	1		the boys who had sometimes arrived at college campuses praised the children .
experiment=NPI-env=adverbs-npi=any-crucial_item=rarely-licensor=1-scope=1-npi_present=0	1		the boys who had rarely arrived at the college campuses praised children .
experiment=NPI-env=adverbs-npi=any-crucial_item=rarely-licensor=1-scope=0-npi_present=1	0		the boys who had rarely arrived at college campuses praised any children .
experiment=NPI-env=adverbs-npi=any-crucial_item=always-licensor=0-scope=1-npi_present=0	1		the actresses who always walked through the museums insult documentaries .
experiment=NPI-env=adverbs-npi=any-crucial_item=rarely-licensor=1-scope=0-npi_present=1	0		the actresses who rarely walked through museums insult any documentaries .
experiment=NPI-env=adverbs-npi=any-crucial_item=rarely-licensor=1-scope=0-npi_present=0	1		the actresses who rarely walked through museums insult the documentaries .
experiment=NPI-env=adverbs-npi=any-crucial_item=barely-licensor=1-scope=1-npi_present=1	1		the child who barely wore any shoes knew teachers .
experiment=NPI-env=adverbs-npi=any-crucial_item=barely-licensor=1-scope=1-npi_present=0	1		the child who barely wore the shoes knew teachers .
experiment=NPI-env=adverbs-npi=any-crucial_item=barely-licensor=1-scope=0-npi_present=1	0		the child who barely wore shoes knew any teachers .
experiment=NPI-env=adverbs-npi=any-crucial_item=always-licensor=0-scope=1-npi_present=1	0		the ladies who can always see any cups could insult girls .
experiment=NPI-env=adverbs-npi=any-crucial_item=always-licensor=0-scope=0-npi_present=1	0		the ladies who can always see cups could insult any girls .
experiment=NPI-env=adverbs-npi=any-crucial_item=always-licensor=0-scope=0-npi_present=0	1		the ladies who can always see cups could insult the girls .
experiment=NPI-env=adverbs-npi=any-crucial_item=hardly-licensor=1-scope=1-npi_present=0	1		the ladies who can hardly see the cups could insult girls .
experiment=NPI-env=adverbs-npi=any-crucial_item=hardly-licensor=1-scope=0-npi_present=1	0		the ladies who can hardly see cups could insult any girls .
experiment=NPI-env=adverbs-npi=any-crucial_item=hardly-licensor=1-scope=0-npi_present=0	1		the ladies who can hardly see cups could insult the girls .
experiment=NPI-env=adverbs-npi=any-crucial_item=always-licensor=0-scope=1-npi_present=1	0		a lady who always criticizes any libraries skates around museums .
experiment=NPI-env=adverbs-npi=any-crucial_item=always-licensor=0-scope=0-npi_present=1	0		a lady who always criticizes libraries skates around any museums .
experiment=NPI-env=adverbs-npi=any-crucial_item=hardly-licensor=1-scope=1-npi_present=1	1		a lady who hardly criticizes any libraries skates around museums .
experiment=NPI-env=adverbs-npi=any-crucial_item=hardly-licensor=1-scope=1-npi_present=0	1		a lady who hardly criticizes the libraries skates around museums .
experiment=NPI-env=adverbs-npi=any-crucial_item=often-licensor=0-scope=0-npi_present=1	0		the gals who would often attack girls have approached any alumni .
experiment=NPI-env=adverbs-npi=any-crucial_item=hardly-licensor=1-scope=0-npi_present=1	0		the gals who would hardly attack girls have approached any alumni .
experiment=NPI-env=adverbs-npi=any-crucial_item=always-licensor=0-scope=0-npi_present=1	0		the man who could always clean glasses could go to any movie theaters .
experiment=NPI-env=adverbs-npi=any-crucial_item=barely-licensor=1-scope=0-npi_present=1	0		the man who could barely clean glasses could go to any movie theaters .
experiment=NPI-env=adverbs-npi=any-crucial_item=barely-licensor=1-scope=0-npi_present=0	1		the man who could barely clean glasses could go to the movie theaters .
experiment=NPI-env=adverbs-npi=any-crucial_item=sometimes-licensor=0-scope=1-npi_present=1	0		a guy who sometimes buys any brochures had left children .
experiment=NPI-env=adverbs-npi=any-crucial_item=sometimes-licensor=0-scope=1-npi_present=0	1		a guy who sometimes buys the brochures had left children .
experiment=NPI-env=adverbs-npi=any-crucial_item=scarcely-licensor=1-scope=1-npi_present=1	1		a guy who scarcely buys any brochures had left children .
experiment=NPI-env=adverbs-npi=any-crucial_item=always-licensor=0-scope=0-npi_present=1	0		the doctor who had always loved ladies would skate around any high schools .
experiment=NPI-env=adverbs-npi=any-crucial_item=always-licensor=0-scope=0-npi_present=1	0		the ladies who always return to sheep drop by any art galleries .
experiment=NPI-env=adverbs-npi=any-crucial_item=always-licensor=0-scope=0-npi_present=0	1		the ladies who always return to sheep drop by the art galleries .
experiment=NPI-env=adverbs-npi=any-crucial_item=rarely-licensor=1-scope=1-npi_present=0	1		the ladies who rarely return to the sheep drop by art galleries .
experiment=NPI-env=adverbs-npi=any-crucial_item=rarely-licensor=1-scope=0-npi_present=1	0		the ladies who rarely return to sheep drop by any art galleries .
experiment=NPI-env=adverbs-npi=any-crucial_item=sometimes-licensor=0-scope=1-npi_present=0	1		the children who sometimes visited the lice have escaped from cashiers .
experiment=NPI-env=adverbs-npi=any-crucial_item=seldom-licensor=1-scope=0-npi_present=0	1		the children who seldom visited lice have escaped from the cashiers .
experiment=NPI-env=adverbs-npi=any-crucial_item=often-licensor=0-scope=1-npi_present=1	0		a customer who often helped any drivers tours restaurants .
experiment=NPI-env=adverbs-npi=any-crucial_item=sometimes-licensor=0-scope=0-npi_present=0	1		the doctor who would sometimes arrive at banks would love the men .
experiment=NPI-env=adverbs-npi=any-crucial_item=seldom-licensor=1-scope=1-npi_present=0	1		the doctor who would seldom arrive at the banks would love men .
experiment=NPI-env=adverbs-npi=any-crucial_item=always-licensor=0-scope=0-npi_present=0	1		a child who always praises sheep can love the guests .
experiment=NPI-env=adverbs-npi=any-crucial_item=sometimes-licensor=0-scope=0-npi_present=1	0		a guest who sometimes admires gals drove to any public parks .
experiment=NPI-env=adverbs-npi=any-crucial_item=sometimes-licensor=0-scope=0-npi_present=0	1		a guest who sometimes admires gals drove to the public parks .
experiment=NPI-env=adverbs-npi=any-crucial_item=barely-licensor=1-scope=1-npi_present=1	1		a guest who barely admires any gals drove to public parks .
experiment=NPI-env=adverbs-npi=any-crucial_item=barely-licensor=1-scope=1-npi_present=0	1		a guest who barely admires the gals drove to public parks .
experiment=NPI-env=adverbs-npi=any-crucial_item=hardly-licensor=1-scope=1-npi_present=0	1		the child who has hardly returned to the libraries might flee from malls .
experiment=NPI-env=adverbs-npi=any-crucial_item=seldom-licensor=1-scope=1-npi_present=0	1		a man who seldom did praise the geese had gone to banks .
experiment=NPI-env=adverbs-npi=any-crucial_item=often-licensor=0-scope=0-npi_present=0	1		the adult who often has pamphlets had the plates .
experiment=NPI-env=adverbs-npi=any-crucial_item=hardly-licensor=1-scope=1-npi_present=0	1		the adult who hardly has the pamphlets had plates .
experiment=NPI-env=adverbs-npi=any-crucial_item=hardly-licensor=1-scope=0-npi_present=0	1		the adult who hardly has pamphlets had the plates .
experiment=NPI-env=adverbs-npi=any-crucial_item=always-licensor=0-scope=1-npi_present=1	0		the teacher who always knows any boys knows oxen .
experiment=NPI-env=adverbs-npi=any-crucial_item=rarely-licensor=1-scope=0-npi_present=1	0		the teacher who rarely knows boys knows any oxen .
experiment=NPI-env=adverbs-npi=any-crucial_item=often-licensor=0-scope=1-npi_present=1	0		a student who often approaches any patients could listen to fish .
experiment=NPI-env=adverbs-npi=any-crucial_item=often-licensor=0-scope=1-npi_present=0	1		a student who often approaches the patients could listen to fish .
experiment=NPI-env=adverbs-npi=any-crucial_item=often-licensor=0-scope=0-npi_present=0	1		a student who often approaches patients could listen to the fish .
experiment=NPI-env=adverbs-npi=any-crucial_item=barely-licensor=1-scope=0-npi_present=0	1		a student who barely approaches patients could listen to the fish .
experiment=NPI-env=adverbs-npi=any-crucial_item=often-licensor=0-scope=1-npi_present=0	1		the waitresses who had often left the children explored hospitals .
experiment=NPI-env=adverbs-npi=any-crucial_item=rarely-licensor=1-scope=1-npi_present=1	1		the waitresses who had rarely left any children explored hospitals .
experiment=NPI-env=adverbs-npi=any-crucial_item=rarely-licensor=1-scope=0-npi_present=1	0		the waitresses who had rarely left children explored any hospitals .
experiment=NPI-env=adverbs-npi=any-crucial_item=rarely-licensor=1-scope=0-npi_present=0	1		the waitresses who had rarely left children explored the hospitals .
experiment=NPI-env=adverbs-npi=any-crucial_item=often-licensor=0-scope=1-npi_present=1	0		the adult who often cares for any waitresses had explored malls .
experiment=NPI-env=adverbs-npi=any-crucial_item=often-licensor=0-scope=1-npi_present=0	1		the adult who often cares for the waitresses had explored malls .
experiment=NPI-env=adverbs-npi=any-crucial_item=often-licensor=0-scope=0-npi_present=1	0		the adult who often cares for waitresses had explored any malls .
experiment=NPI-env=adverbs-npi=any-crucial_item=seldom-licensor=1-scope=1-npi_present=0	1		the adult who seldom cares for the waitresses had explored malls .
experiment=NPI-env=adverbs-npi=any-crucial_item=seldom-licensor=1-scope=0-npi_present=1	0		the adult who seldom cares for waitresses had explored any malls .
experiment=NPI-env=adverbs-npi=any-crucial_item=sometimes-licensor=0-scope=0-npi_present=1	0		the adults who would sometimes talk to girls have described any restaurants .
experiment=NPI-env=adverbs-npi=any-crucial_item=rarely-licensor=1-scope=1-npi_present=1	1		the adults who would rarely talk to any girls have described restaurants .
experiment=NPI-env=adverbs-npi=any-crucial_item=rarely-licensor=1-scope=1-npi_present=0	1		the adults who would rarely talk to the girls have described restaurants .
experiment=NPI-env=adverbs-npi=any-crucial_item=sometimes-licensor=0-scope=0-npi_present=1	0		a doctor who sometimes forgets girls bikes to any banks .
experiment=NPI-env=adverbs-npi=any-crucial_item=seldom-licensor=1-scope=1-npi_present=0	1		a doctor who seldom forgets the girls bikes to banks .
experiment=NPI-env=adverbs-npi=any-crucial_item=always-licensor=0-scope=0-npi_present=0	1		the waitresses who always attacked drivers boycott the schools .
experiment=NPI-env=adverbs-npi=any-crucial_item=barely-licensor=1-scope=0-npi_present=0	1		the waitresses who barely attacked drivers boycott the schools .
experiment=NPI-env=adverbs-npi=any-crucial_item=often-licensor=0-scope=1-npi_present=1	0		an adult who often skates around any museums listened to sheep .
experiment=NPI-env=adverbs-npi=any-crucial_item=often-licensor=0-scope=1-npi_present=0	1		an adult who often skates around the museums listened to sheep .
experiment=NPI-env=adverbs-npi=any-crucial_item=often-licensor=0-scope=0-npi_present=0	1		an adult who often skates around museums listened to the sheep .
experiment=NPI-env=adverbs-npi=any-crucial_item=seldom-licensor=1-scope=1-npi_present=1	1		an adult who seldom skates around any museums listened to sheep .
experiment=NPI-env=adverbs-npi=any-crucial_item=sometimes-licensor=0-scope=1-npi_present=1	0		the drivers who sometimes investigated any banks should like pants .
experiment=NPI-env=adverbs-npi=any-crucial_item=sometimes-licensor=0-scope=0-npi_present=0	1		the drivers who sometimes investigated banks should like the pants .
experiment=NPI-env=adverbs-npi=any-crucial_item=barely-licensor=1-scope=0-npi_present=1	0		an actor who barely helps alumni has taken any couches .
experiment=NPI-env=adverbs-npi=any-crucial_item=always-licensor=0-scope=1-npi_present=1	0		a doctor who might always talk to any ladies has bought pants .
experiment=NPI-env=adverbs-npi=any-crucial_item=rarely-licensor=1-scope=1-npi_present=0	1		a doctor who might rarely talk to the ladies has bought pants .
experiment=NPI-env=adverbs-npi=any-crucial_item=rarely-licensor=1-scope=0-npi_present=1	0		a doctor who might rarely talk to ladies has bought any pants .
experiment=NPI-env=adverbs-npi=any-crucial_item=always-licensor=0-scope=1-npi_present=1	0		a person who had always left any libraries might like girls .
experiment=NPI-env=adverbs-npi=any-crucial_item=always-licensor=0-scope=0-npi_present=0	1		a person who had always left libraries might like the girls .
experiment=NPI-env=adverbs-npi=any-crucial_item=hardly-licensor=1-scope=1-npi_present=0	1		a person who had hardly left the libraries might like girls .
experiment=NPI-env=adverbs-npi=any-crucial_item=barely-licensor=1-scope=1-npi_present=0	1		the actors who barely skate around the schools might hug people .
experiment=NPI-env=adverbs-npi=any-crucial_item=always-licensor=0-scope=1-npi_present=1	0		the children who might always talk to any mice criticize children .
experiment=NPI-env=adverbs-npi=any-crucial_item=barely-licensor=1-scope=1-npi_present=0	1		the children who might barely talk to the mice criticize children .
experiment=NPI-env=adverbs-npi=any-crucial_item=barely-licensor=1-scope=0-npi_present=1	0		the children who might barely talk to mice criticize any children .
experiment=NPI-env=adverbs-npi=any-crucial_item=sometimes-licensor=0-scope=0-npi_present=0	1		the doctor who had sometimes talked about women resembled the cashiers .
experiment=NPI-env=adverbs-npi=any-crucial_item=scarcely-licensor=1-scope=1-npi_present=0	1		the doctor who had scarcely talked about the women resembled cashiers .
experiment=NPI-env=adverbs-npi=any-crucial_item=scarcely-licensor=1-scope=0-npi_present=0	1		the doctor who had scarcely talked about women resembled the cashiers .
experiment=NPI-env=adverbs-npi=any-crucial_item=rarely-licensor=1-scope=1-npi_present=0	1		the children who rarely observe the children should watch cashiers .
experiment=NPI-env=adverbs-npi=any-crucial_item=always-licensor=0-scope=1-npi_present=1	0		a boy who has always talked about any hospitals watched doctors .
experiment=NPI-env=adverbs-npi=any-crucial_item=always-licensor=0-scope=0-npi_present=0	1		a boy who has always talked about hospitals watched the doctors .
experiment=NPI-env=adverbs-npi=any-crucial_item=always-licensor=0-scope=1-npi_present=1	0		the lady who always criticizes any malls had listened to mice .
experiment=NPI-env=adverbs-npi=any-crucial_item=rarely-licensor=1-scope=0-npi_present=1	0		the lady who rarely criticizes malls had listened to any mice .
experiment=NPI-env=adverbs-npi=any-crucial_item=often-licensor=0-scope=0-npi_present=0	1		the patients who often biked to high schools had escaped from the pedestrians .
experiment=NPI-env=adverbs-npi=any-crucial_item=scarcely-licensor=1-scope=0-npi_present=0	1		the patients who scarcely biked to high schools had escaped from the pedestrians .
experiment=NPI-env=adverbs-npi=any-crucial_item=always-licensor=0-scope=1-npi_present=1	0		an adult who always listened to any sheep can discuss hospitals .
experiment=NPI-env=adverbs-npi=any-crucial_item=always-licensor=0-scope=0-npi_present=1	0		an adult who always listened to sheep can discuss any hospitals .
experiment=NPI-env=adverbs-npi=any-crucial_item=always-licensor=0-scope=0-npi_present=0	1		an adult who always listened to sheep can discuss the hospitals .
experiment=NPI-env=adverbs-npi=any-crucial_item=seldom-licensor=1-scope=1-npi_present=1	1		an adult who seldom listened to any sheep can discuss hospitals .
experiment=NPI-env=adverbs-npi=any-crucial_item=seldom-licensor=1-scope=1-npi_present=0	1		an adult who seldom listened to the sheep can discuss hospitals .
experiment=NPI-env=adverbs-npi=any-crucial_item=often-licensor=0-scope=1-npi_present=0	1		the pedestrians who often did praise the gals examine pamphlets .
experiment=NPI-env=adverbs-npi=any-crucial_item=often-licensor=0-scope=0-npi_present=1	0		the pedestrians who often did praise gals examine any pamphlets .
