experiment=NPI-env=only-npi=any-crucial_item=_-licensor=0-scope=0-npi_present=0	1		some customer also attacked the actors .
experiment=NPI-env=only-npi=yet-crucial_item=_-licensor=0-scope=1-npi_present=1	0		the humans also escape from the women at all this week .
experiment=NPI-env=only-npi=yet-crucial_item=_-licensor=0-scope=1-npi_present=0	1		the humans also escape from the women appropriately this week .
experiment=NPI-env=only-npi=yet-crucial_item=_-licensor=0-scope=0-npi_present=1	0		the humans escape from the women at all also this week .
experiment=NPI-env=only-npi=yet-crucial_item=_-licensor=1-scope=1-npi_present=1	1		only the teenagers had cleaned the glasses at all this year .
experiment=NPI-env=only-npi=yet-crucial_item=_-licensor=0-scope=0-npi_present=1	0		the teenagers had cleaned the glasses at all also this year .
experiment=NPI-env=only-npi=yet-crucial_item=_-licensor=1-scope=0-npi_present=0	1		the man has walked through the public parks happily only this week .
experiment=NPI-env=only-npi=yet-crucial_item=_-licensor=0-scope=0-npi_present=1	0		the man has walked through the public parks at all also this week .
experiment=NPI-env=only-npi=yet-crucial_item=_-licensor=1-scope=0-npi_present=1	0		a customer explores the banks at all only today .
experiment=NPI-env=only-npi=yet-crucial_item=_-licensor=1-scope=0-npi_present=0	1		a customer explores the banks happily only today .
experiment=NPI-env=only-npi=yet-crucial_item=_-licensor=0-scope=0-npi_present=0	1		a customer explores the banks happily also today .
experiment=NPI-env=only-npi=yet-crucial_item=_-licensor=1-scope=0-npi_present=0	1		a waitress respected the humans appropriately only today .
experiment=NPI-env=only-npi=yet-crucial_item=_-licensor=0-scope=1-npi_present=1	0		a waitress also respected the humans at all today .
experiment=NPI-env=only-npi=yet-crucial_item=_-licensor=0-scope=1-npi_present=0	1		a waitress also respected the humans appropriately today .
experiment=NPI-env=only-npi=yet-crucial_item=_-licensor=0-scope=0-npi_present=1	0		a waitress respected the humans at all also today .
experiment=NPI-env=only-npi=yet-crucial_item=_-licensor=0-scope=0-npi_present=0	1		a waitress respected the humans appropriately also today .
experiment=NPI-env=only-npi=yet-crucial_item=_-licensor=1-scope=0-npi_present=1	0		the guy might lift the rugs at all only sometimes .
experiment=NPI-env=only-npi=yet-crucial_item=_-licensor=0-scope=0-npi_present=1	0		the guy might lift the rugs at all also sometimes .
experiment=NPI-env=only-npi=yet-crucial_item=_-licensor=1-scope=1-npi_present=0	1		only a driver can talk about the adults happily this year .
experiment=NPI-env=only-npi=yet-crucial_item=_-licensor=0-scope=1-npi_present=1	0		a driver can also talk about the adults at all this year .
experiment=NPI-env=only-npi=yet-crucial_item=_-licensor=0-scope=1-npi_present=0	1		a driver can also talk about the adults happily this year .
experiment=NPI-env=only-npi=yet-crucial_item=_-licensor=1-scope=1-npi_present=1	1		only the children explored the high schools at all sometimes .
experiment=NPI-env=only-npi=yet-crucial_item=_-licensor=0-scope=1-npi_present=1	0		the children also explored the high schools at all sometimes .
experiment=NPI-env=only-npi=yet-crucial_item=_-licensor=0-scope=0-npi_present=1	0		the children explored the high schools at all also sometimes .
experiment=NPI-env=only-npi=yet-crucial_item=_-licensor=0-scope=0-npi_present=0	1		the children explored the high schools inappropriately also sometimes .
experiment=NPI-env=only-npi=yet-crucial_item=_-licensor=0-scope=1-npi_present=1	0		the driver also admired the guys at all sometimes .
experiment=NPI-env=only-npi=yet-crucial_item=_-licensor=0-scope=0-npi_present=0	1		the driver admired the guys inappropriately also sometimes .
experiment=NPI-env=only-npi=yet-crucial_item=_-licensor=1-scope=1-npi_present=1	1		only the woman could go to the museums at all today .
experiment=NPI-env=only-npi=yet-crucial_item=_-licensor=0-scope=1-npi_present=0	1		the woman could also go to the museums inappropriately today .
experiment=NPI-env=only-npi=yet-crucial_item=_-licensor=0-scope=0-npi_present=1	0		the woman could go to the museums at all also today .
experiment=NPI-env=only-npi=yet-crucial_item=_-licensor=0-scope=0-npi_present=0	1		the woman could go to the museums inappropriately also today .
experiment=NPI-env=only-npi=yet-crucial_item=_-licensor=1-scope=1-npi_present=1	1		only the doctors know the actors at all this year .
experiment=NPI-env=only-npi=yet-crucial_item=_-licensor=0-scope=1-npi_present=0	1		the doctors also know the actors happily this year .
experiment=NPI-env=only-npi=yet-crucial_item=_-licensor=0-scope=0-npi_present=1	0		the doctors know the actors at all also this year .
experiment=NPI-env=only-npi=yet-crucial_item=_-licensor=1-scope=1-npi_present=1	1		only the guys had seen the shoes at all this week .
experiment=NPI-env=only-npi=yet-crucial_item=_-licensor=1-scope=1-npi_present=0	1		only the guys had seen the shoes angrily this week .
experiment=NPI-env=only-npi=yet-crucial_item=_-licensor=1-scope=0-npi_present=0	1		the guys had seen the shoes angrily only this week .
experiment=NPI-env=only-npi=yet-crucial_item=_-licensor=0-scope=1-npi_present=1	0		the guys had also seen the shoes at all this week .
experiment=NPI-env=only-npi=yet-crucial_item=_-licensor=0-scope=1-npi_present=0	1		the guys had also seen the shoes angrily this week .
experiment=NPI-env=only-npi=yet-crucial_item=_-licensor=0-scope=0-npi_present=0	1		the guys had seen the shoes angrily also this week .
experiment=NPI-env=only-npi=yet-crucial_item=_-licensor=1-scope=1-npi_present=0	1		only a customer talked to the gals appropriately today .
experiment=NPI-env=only-npi=yet-crucial_item=_-licensor=1-scope=0-npi_present=1	0		a customer talked to the gals at all only today .
experiment=NPI-env=only-npi=yet-crucial_item=_-licensor=0-scope=1-npi_present=0	1		a customer also talked to the gals appropriately today .
experiment=NPI-env=only-npi=yet-crucial_item=_-licensor=0-scope=0-npi_present=0	1		a customer talked to the gals appropriately also today .
experiment=NPI-env=only-npi=yet-crucial_item=_-licensor=1-scope=1-npi_present=1	1		only a child bikes to the cafes at all this year .
experiment=NPI-env=only-npi=yet-crucial_item=_-licensor=1-scope=1-npi_present=1	1		only a cashier bought the shoes at all sometimes .
experiment=NPI-env=only-npi=yet-crucial_item=_-licensor=1-scope=1-npi_present=0	1		only a cashier bought the shoes angrily sometimes .
experiment=NPI-env=only-npi=yet-crucial_item=_-licensor=0-scope=1-npi_present=1	0		a cashier also bought the shoes at all sometimes .
experiment=NPI-env=only-npi=yet-crucial_item=_-licensor=1-scope=1-npi_present=0	1		only the teenagers broke the chairs appropriately this week .
experiment=NPI-env=only-npi=yet-crucial_item=_-licensor=1-scope=0-npi_present=0	1		the teenagers broke the chairs appropriately only this week .
experiment=NPI-env=only-npi=yet-crucial_item=_-licensor=0-scope=1-npi_present=1	0		the teenagers also broke the chairs at all this week .
experiment=NPI-env=only-npi=yet-crucial_item=_-licensor=0-scope=1-npi_present=0	1		the teenagers also broke the chairs appropriately this week .
experiment=NPI-env=only-npi=yet-crucial_item=_-licensor=0-scope=0-npi_present=1	0		the teenagers broke the chairs at all also this week .
experiment=NPI-env=only-npi=yet-crucial_item=_-licensor=0-scope=1-npi_present=1	0		the ladies also disliked the teenagers at all sometimes .
experiment=NPI-env=only-npi=yet-crucial_item=_-licensor=0-scope=0-npi_present=0	1		the ladies disliked the teenagers appropriately also sometimes .
experiment=NPI-env=only-npi=yet-crucial_item=_-licensor=1-scope=1-npi_present=0	1		only a patient talks to the customers inappropriately sometimes .
experiment=NPI-env=only-npi=yet-crucial_item=_-licensor=0-scope=0-npi_present=1	0		a patient talks to the customers at all also sometimes .
experiment=NPI-env=only-npi=yet-crucial_item=_-licensor=1-scope=1-npi_present=1	1		only a human listens to the doctors at all this year .
experiment=NPI-env=only-npi=yet-crucial_item=_-licensor=1-scope=0-npi_present=1	0		a human listens to the doctors at all only this year .
experiment=NPI-env=only-npi=yet-crucial_item=_-licensor=0-scope=0-npi_present=1	0		a human listens to the doctors at all also this year .
experiment=NPI-env=only-npi=yet-crucial_item=_-licensor=1-scope=0-npi_present=0	1		the pedestrians boycott the malls happily only this week .
experiment=NPI-env=only-npi=yet-crucial_item=_-licensor=0-scope=1-npi_present=1	0		the pedestrians also boycott the malls at all this week .
experiment=NPI-env=only-npi=yet-crucial_item=_-licensor=0-scope=0-npi_present=0	1		the cashiers had worn the gloves angrily also sometimes .
experiment=NPI-env=only-npi=yet-crucial_item=_-licensor=1-scope=1-npi_present=1	1		only a lady brought the couches at all sometimes .
experiment=NPI-env=only-npi=yet-crucial_item=_-licensor=1-scope=1-npi_present=0	1		only a lady brought the couches inappropriately sometimes .
experiment=NPI-env=only-npi=yet-crucial_item=_-licensor=0-scope=1-npi_present=0	1		a lady also brought the couches inappropriately sometimes .
experiment=NPI-env=only-npi=yet-crucial_item=_-licensor=0-scope=0-npi_present=1	0		the waitress does escape from the adults at all also sometimes .
experiment=NPI-env=only-npi=yet-crucial_item=_-licensor=0-scope=0-npi_present=0	1		the waitress does escape from the adults happily also sometimes .
experiment=NPI-env=only-npi=yet-crucial_item=_-licensor=1-scope=1-npi_present=1	1		only the adults will investigate the teenagers at all today .
experiment=NPI-env=only-npi=yet-crucial_item=_-licensor=1-scope=0-npi_present=1	0		the adults will investigate the teenagers at all only today .
experiment=NPI-env=only-npi=yet-crucial_item=_-licensor=0-scope=1-npi_present=1	0		the adults will also investigate the teenagers at all today .
experiment=NPI-env=only-npi=yet-crucial_item=_-licensor=0-scope=1-npi_present=0	1		the adults will also investigate the teenagers angrily today .
experiment=NPI-env=only-npi=yet-crucial_item=_-licensor=0-scope=0-npi_present=0	1		the adults will investigate the teenagers angrily also today .
experiment=NPI-env=only-npi=yet-crucial_item=_-licensor=1-scope=1-npi_present=1	1		only a customer had remembered the customers at all this week .
experiment=NPI-env=only-npi=yet-crucial_item=_-licensor=1-scope=1-npi_present=0	1		only a customer had remembered the customers happily this week .
experiment=NPI-env=only-npi=yet-crucial_item=_-licensor=1-scope=0-npi_present=1	0		a pedestrian had skated around the banks at all only this year .
experiment=NPI-env=only-npi=yet-crucial_item=_-licensor=1-scope=0-npi_present=0	1		a pedestrian had skated around the banks appropriately only this year .
experiment=NPI-env=only-npi=yet-crucial_item=_-licensor=0-scope=1-npi_present=1	0		a pedestrian had also skated around the banks at all this year .
experiment=NPI-env=only-npi=yet-crucial_item=_-licensor=0-scope=1-npi_present=0	1		a pedestrian had also skated around the banks appropriately this year .
experiment=NPI-env=only-npi=yet-crucial_item=_-licensor=1-scope=1-npi_present=0	1		only the boys praise the cashiers inappropriately today .
experiment=NPI-env=only-npi=yet-crucial_item=_-licensor=1-scope=0-npi_present=0	1		the boys praise the cashiers inappropriately only today .
experiment=NPI-env=only-npi=yet-crucial_item=_-licensor=0-scope=1-npi_present=1	0		the boys also praise the cashiers at all today .
experiment=NPI-env=only-npi=yet-crucial_item=_-licensor=0-scope=1-npi_present=0	1		the boys also praise the cashiers inappropriately today .
experiment=NPI-env=only-npi=yet-crucial_item=_-licensor=0-scope=0-npi_present=1	0		the boys praise the cashiers at all also today .
experiment=NPI-env=only-npi=yet-crucial_item=_-licensor=1-scope=0-npi_present=0	1		a pedestrian took the pants angrily only sometimes .
experiment=NPI-env=only-npi=yet-crucial_item=_-licensor=0-scope=1-npi_present=1	0		a pedestrian also took the pants at all sometimes .
experiment=NPI-env=only-npi=yet-crucial_item=_-licensor=1-scope=1-npi_present=1	1		only the girls had ran around the cafes at all this week .
experiment=NPI-env=only-npi=yet-crucial_item=_-licensor=0-scope=1-npi_present=1	0		the girls had also ran around the cafes at all this week .
experiment=NPI-env=only-npi=yet-crucial_item=_-licensor=0-scope=0-npi_present=1	0		the girls had ran around the cafes at all also this week .
experiment=NPI-env=only-npi=yet-crucial_item=_-licensor=0-scope=0-npi_present=0	1		the girls had ran around the cafes appropriately also this week .
experiment=NPI-env=only-npi=yet-crucial_item=_-licensor=1-scope=1-npi_present=0	1		only the women talked about the students appropriately today .
experiment=NPI-env=only-npi=yet-crucial_item=_-licensor=0-scope=0-npi_present=0	1		the women talked about the students appropriately also today .
experiment=NPI-env=only-npi=yet-crucial_item=_-licensor=1-scope=1-npi_present=1	1		only the boys remember the grocery stores at all today .
experiment=NPI-env=only-npi=yet-crucial_item=_-licensor=1-scope=0-npi_present=0	1		the boys remember the grocery stores happily only today .
experiment=NPI-env=only-npi=yet-crucial_item=_-licensor=1-scope=1-npi_present=0	1		only the doctors did have the chairs inappropriately today .
experiment=NPI-env=only-npi=yet-crucial_item=_-licensor=0-scope=0-npi_present=1	0		the doctors did have the chairs at all also today .
experiment=NPI-env=only-npi=yet-crucial_item=_-licensor=1-scope=1-npi_present=0	1		only the people did watch the people angrily today .
experiment=NPI-env=only-npi=yet-crucial_item=_-licensor=1-scope=0-npi_present=1	0		the people did watch the people at all only today .
experiment=NPI-env=only-npi=yet-crucial_item=_-licensor=0-scope=0-npi_present=1	0		the people did watch the people at all also today .
experiment=NPI-env=only-npi=yet-crucial_item=_-licensor=0-scope=0-npi_present=0	1		the people did watch the people angrily also today .
experiment=NPI-env=only-npi=yet-crucial_item=_-licensor=1-scope=0-npi_present=1	0		an actor listens to the ladies at all only today .
experiment=NPI-env=only-npi=yet-crucial_item=_-licensor=1-scope=0-npi_present=1	0		the adults scan the newspaper articles at all only this week .
experiment=NPI-env=only-npi=yet-crucial_item=_-licensor=1-scope=1-npi_present=0	1		only the patients did reference the guys happily this week .
experiment=NPI-env=only-npi=yet-crucial_item=_-licensor=1-scope=0-npi_present=1	0		the patients did reference the guys at all only this week .
experiment=NPI-env=only-npi=yet-crucial_item=_-licensor=1-scope=0-npi_present=0	1		the patients did reference the guys happily only this week .
experiment=NPI-env=only-npi=yet-crucial_item=_-licensor=1-scope=1-npi_present=1	1		only the guy can bike to the grocery stores at all this year .
experiment=NPI-env=only-npi=yet-crucial_item=_-licensor=1-scope=0-npi_present=1	0		the guy can bike to the grocery stores at all only this year .
experiment=NPI-env=only-npi=yet-crucial_item=_-licensor=1-scope=0-npi_present=0	1		the guy can bike to the grocery stores inappropriately only this year .
experiment=NPI-env=only-npi=yet-crucial_item=_-licensor=0-scope=0-npi_present=0	1		the guy can bike to the grocery stores inappropriately also this year .
experiment=NPI-env=only-npi=yet-crucial_item=_-licensor=1-scope=0-npi_present=1	0		the humans had attacked the waiters at all only sometimes .
experiment=NPI-env=only-npi=yet-crucial_item=_-licensor=0-scope=0-npi_present=1	0		the humans had attacked the waiters at all also sometimes .
experiment=NPI-env=only-npi=yet-crucial_item=_-licensor=1-scope=1-npi_present=0	1		only the waiter observed the gals appropriately sometimes .
experiment=NPI-env=only-npi=yet-crucial_item=_-licensor=0-scope=0-npi_present=1	0		the waiter observed the gals at all also sometimes .
experiment=NPI-env=only-npi=yet-crucial_item=_-licensor=0-scope=0-npi_present=0	1		the waiter observed the gals appropriately also sometimes .
experiment=NPI-env=only-npi=yet-crucial_item=_-licensor=1-scope=1-npi_present=0	1		only the doctors remember the movies appropriately today .
experiment=NPI-env=only-npi=yet-crucial_item=_-licensor=0-scope=1-npi_present=0	1		the doctors also remember the movies appropriately today .
experiment=NPI-env=only-npi=yet-crucial_item=_-licensor=0-scope=0-npi_present=0	1		the doctors remember the movies appropriately also today .
experiment=NPI-env=only-npi=yet-crucial_item=_-licensor=1-scope=1-npi_present=0	1		only the drivers should examine the plays angrily today .
experiment=NPI-env=only-npi=yet-crucial_item=_-licensor=0-scope=0-npi_present=1	0		the drivers should examine the plays at all also today .
experiment=NPI-env=only-npi=yet-crucial_item=_-licensor=0-scope=0-npi_present=0	1		the drivers should examine the plays angrily also today .
experiment=NPI-env=only-npi=yet-crucial_item=_-licensor=0-scope=1-npi_present=1	0		the people will also drop by the art galleries at all this week .
experiment=NPI-env=only-npi=yet-crucial_item=_-licensor=1-scope=1-npi_present=1	1		only the guys could arrive at the libraries at all this week .
experiment=NPI-env=only-npi=yet-crucial_item=_-licensor=1-scope=1-npi_present=0	1		only the guys could arrive at the libraries angrily this week .
experiment=NPI-env=only-npi=yet-crucial_item=_-licensor=1-scope=0-npi_present=1	0		the guys could arrive at the libraries at all only this week .
experiment=NPI-env=only-npi=yet-crucial_item=_-licensor=1-scope=0-npi_present=0	1		the guys could arrive at the libraries angrily only this week .
experiment=NPI-env=only-npi=yet-crucial_item=_-licensor=0-scope=1-npi_present=1	0		the guys could also arrive at the libraries at all this week .
experiment=NPI-env=only-npi=yet-crucial_item=_-licensor=0-scope=1-npi_present=0	1		the guys could also arrive at the libraries angrily this week .
experiment=NPI-env=only-npi=yet-crucial_item=_-licensor=0-scope=0-npi_present=1	0		the guys could arrive at the libraries at all also this week .
experiment=NPI-env=only-npi=yet-crucial_item=_-licensor=1-scope=0-npi_present=0	1		the pedestrian should bring the plates angrily only this week .
experiment=NPI-env=only-npi=yet-crucial_item=_-licensor=0-scope=1-npi_present=1	0		the pedestrian should also bring the plates at all this week .
experiment=NPI-env=only-npi=yet-crucial_item=_-licensor=0-scope=0-npi_present=1	0		the pedestrian should bring the plates at all also this week .
experiment=NPI-env=only-npi=yet-crucial_item=_-licensor=1-scope=1-npi_present=0	1		only the boys watch the pedestrians happily sometimes .
experiment=NPI-env=only-npi=yet-crucial_item=_-licensor=1-scope=0-npi_present=1	0		the boys watch the pedestrians at all only sometimes .
experiment=NPI-env=only-npi=yet-crucial_item=_-licensor=0-scope=0-npi_present=1	0		the boys watch the pedestrians at all also sometimes .
experiment=NPI-env=only-npi=yet-crucial_item=_-licensor=1-scope=0-npi_present=1	0		the actresses helped the patients at all only sometimes .
experiment=NPI-env=only-npi=yet-crucial_item=_-licensor=1-scope=0-npi_present=0	1		the actresses helped the patients appropriately only sometimes .
experiment=NPI-env=only-npi=yet-crucial_item=_-licensor=0-scope=1-npi_present=1	0		the actresses also helped the patients at all sometimes .
experiment=NPI-env=only-npi=yet-crucial_item=_-licensor=1-scope=1-npi_present=1	1		only the patients did be at the public parks at all this year .
experiment=NPI-env=only-npi=yet-crucial_item=_-licensor=1-scope=0-npi_present=0	1		the patients did be at the public parks happily only this year .
experiment=NPI-env=only-npi=yet-crucial_item=_-licensor=0-scope=1-npi_present=0	1		the patients did also be at the public parks happily this year .
experiment=NPI-env=only-npi=yet-crucial_item=_-licensor=0-scope=0-npi_present=0	1		the patients did be at the public parks happily also this year .
experiment=NPI-env=only-npi=yet-crucial_item=_-licensor=1-scope=0-npi_present=0	1		the children should scan the commentaries inappropriately only sometimes .
experiment=NPI-env=only-npi=yet-crucial_item=_-licensor=0-scope=1-npi_present=1	0		the children should also scan the commentaries at all sometimes .
experiment=NPI-env=only-npi=yet-crucial_item=_-licensor=0-scope=0-npi_present=1	0		the children should scan the commentaries at all also sometimes .
experiment=NPI-env=only-npi=yet-crucial_item=_-licensor=1-scope=1-npi_present=1	1		only a teacher has criticized the doctors at all sometimes .
experiment=NPI-env=only-npi=yet-crucial_item=_-licensor=1-scope=0-npi_present=1	0		a teacher has criticized the doctors at all only sometimes .
experiment=NPI-env=only-npi=yet-crucial_item=_-licensor=1-scope=1-npi_present=0	1		only the girls exited the movie theaters appropriately today .
experiment=NPI-env=only-npi=yet-crucial_item=_-licensor=1-scope=0-npi_present=1	0		the girls exited the movie theaters at all only today .
experiment=NPI-env=only-npi=yet-crucial_item=_-licensor=1-scope=0-npi_present=0	1		the girls exited the movie theaters appropriately only today .
experiment=NPI-env=only-npi=yet-crucial_item=_-licensor=0-scope=1-npi_present=0	1		the girls also exited the movie theaters appropriately today .
experiment=NPI-env=only-npi=yet-crucial_item=_-licensor=1-scope=0-npi_present=0	1		a guy ran around the college campuses angrily only today .
experiment=NPI-env=only-npi=yet-crucial_item=_-licensor=0-scope=1-npi_present=0	1		a guy also ran around the college campuses angrily today .
experiment=NPI-env=only-npi=yet-crucial_item=_-licensor=1-scope=0-npi_present=1	0		a guy lifts the plates at all only this week .
experiment=NPI-env=only-npi=yet-crucial_item=_-licensor=0-scope=1-npi_present=1	0		a guy also lifts the plates at all this week .
experiment=NPI-env=only-npi=yet-crucial_item=_-licensor=0-scope=1-npi_present=0	1		a guy also lifts the plates inappropriately this week .
experiment=NPI-env=only-npi=yet-crucial_item=_-licensor=0-scope=0-npi_present=1	0		a guy lifts the plates at all also this week .
experiment=NPI-env=only-npi=yet-crucial_item=_-licensor=1-scope=0-npi_present=0	1		the women will help the guys happily only today .
experiment=NPI-env=only-npi=yet-crucial_item=_-licensor=0-scope=0-npi_present=1	0		the women will help the guys at all also today .
experiment=NPI-env=only-npi=yet-crucial_item=_-licensor=1-scope=1-npi_present=1	1		only the adults could discuss the customers at all sometimes .
experiment=NPI-env=only-npi=yet-crucial_item=_-licensor=0-scope=1-npi_present=1	0		the adults could also discuss the customers at all sometimes .
experiment=NPI-env=only-npi=yet-crucial_item=_-licensor=0-scope=1-npi_present=0	1		the adults could also discuss the customers appropriately sometimes .
experiment=NPI-env=only-npi=yet-crucial_item=_-licensor=0-scope=0-npi_present=0	1		the adults could discuss the customers appropriately also sometimes .
experiment=NPI-env=only-npi=yet-crucial_item=_-licensor=1-scope=1-npi_present=1	1		only a driver had passed the public parks at all sometimes .
experiment=NPI-env=only-npi=yet-crucial_item=_-licensor=1-scope=1-npi_present=1	1		only the women leave the museums at all this week .
experiment=NPI-env=only-npi=yet-crucial_item=_-licensor=0-scope=0-npi_present=0	1		the women leave the museums appropriately also this week .
experiment=NPI-env=only-npi=yet-crucial_item=_-licensor=0-scope=0-npi_present=1	0		the girls can skate around the grocery stores at all also this year .
experiment=NPI-env=only-npi=yet-crucial_item=_-licensor=0-scope=0-npi_present=0	1		the girls can skate around the grocery stores happily also this year .
experiment=NPI-env=only-npi=yet-crucial_item=_-licensor=1-scope=1-npi_present=0	1		only the pedestrians arrive at the museums appropriately this year .
experiment=NPI-env=only-npi=yet-crucial_item=_-licensor=1-scope=0-npi_present=1	0		the pedestrians arrive at the museums at all only this year .
experiment=NPI-env=only-npi=yet-crucial_item=_-licensor=1-scope=1-npi_present=0	1		only the child has discussed the cafes happily today .
experiment=NPI-env=only-npi=yet-crucial_item=_-licensor=1-scope=0-npi_present=1	0		the child has discussed the cafes at all only today .
experiment=NPI-env=only-npi=yet-crucial_item=_-licensor=0-scope=0-npi_present=1	0		the child has discussed the cafes at all also today .
experiment=NPI-env=only-npi=yet-crucial_item=_-licensor=1-scope=1-npi_present=1	1		only a patient should have the dishes at all sometimes .
experiment=NPI-env=only-npi=yet-crucial_item=_-licensor=1-scope=0-npi_present=1	0		a patient should have the dishes at all only sometimes .
experiment=NPI-env=only-npi=yet-crucial_item=_-licensor=0-scope=1-npi_present=0	1		a patient should also have the dishes appropriately sometimes .
experiment=NPI-env=only-npi=yet-crucial_item=_-licensor=0-scope=0-npi_present=1	0		a patient should have the dishes at all also sometimes .
experiment=NPI-env=only-npi=yet-crucial_item=_-licensor=1-scope=1-npi_present=0	1		only a cashier had loved the humans happily today .
experiment=NPI-env=only-npi=yet-crucial_item=_-licensor=1-scope=0-npi_present=1	0		a cashier had loved the humans at all only today .
experiment=NPI-env=only-npi=yet-crucial_item=_-licensor=1-scope=0-npi_present=0	1		a cashier had loved the humans happily only today .
experiment=NPI-env=only-npi=yet-crucial_item=_-licensor=0-scope=1-npi_present=1	0		a cashier had also loved the humans at all today .
experiment=NPI-env=only-npi=yet-crucial_item=_-licensor=0-scope=1-npi_present=0	1		a cashier had also loved the humans happily today .
experiment=NPI-env=only-npi=yet-crucial_item=_-licensor=0-scope=0-npi_present=0	1		a cashier had loved the humans happily also today .
experiment=NPI-env=only-npi=yet-crucial_item=_-licensor=1-scope=1-npi_present=1	1		only a boy discussed the college campuses at all sometimes .
