experiment=NPI-env=superlative-npi=ever-crucial_item=old-licensor=0-scope=0-npi_present=0	1		the adult also references the old teacher that the lady had cared for .
experiment=NPI-env=superlative-npi=ever-crucial_item=old-licensor=1-scope=0-npi_present=1	0		the adult ever references the oldest teacher that the lady had cared for .
experiment=NPI-env=superlative-npi=ever-crucial_item=old-licensor=1-scope=0-npi_present=1	0		the customers have ever criticized the oldest girls that the actress has respected .
experiment=NPI-env=superlative-npi=ever-crucial_item=good-licensor=1-scope=0-npi_present=1	0		the customer had ever seen the best forks that the guy has sold .
experiment=NPI-env=superlative-npi=ever-crucial_item=cheap-licensor=1-scope=1-npi_present=1	1		the drivers had passed the cheapest hospital that the doctors had ever returned to .
experiment=NPI-env=superlative-npi=ever-crucial_item=long-licensor=0-scope=1-npi_present=1	0		the child has sold the long books that the play had ever referenced .
experiment=NPI-env=superlative-npi=ever-crucial_item=long-licensor=0-scope=0-npi_present=1	0		the child has ever sold the long books that the play had referenced .
experiment=NPI-env=superlative-npi=ever-crucial_item=long-licensor=0-scope=0-npi_present=0	1		the child has also sold the long books that the play had referenced .
experiment=NPI-env=superlative-npi=ever-crucial_item=long-licensor=1-scope=0-npi_present=0	1		the child has also sold the longest books that the play had referenced .
experiment=NPI-env=superlative-npi=ever-crucial_item=important-licensor=0-scope=0-npi_present=1	0		the students ever resemble the important museum that the children have visited .
experiment=NPI-env=superlative-npi=ever-crucial_item=important-licensor=1-scope=1-npi_present=1	1		the students resemble the most important museum that the children have ever visited .
experiment=NPI-env=superlative-npi=ever-crucial_item=important-licensor=1-scope=1-npi_present=0	1		the students resemble the most important museum that the children have also visited .
experiment=NPI-env=superlative-npi=ever-crucial_item=cheap-licensor=1-scope=1-npi_present=0	1		the girls broke the cheapest chairs that the patients have also taken .
experiment=NPI-env=superlative-npi=ever-crucial_item=fast-licensor=0-scope=1-npi_present=0	1		a cashier had visited the fast boy that the adults had also cared for .
experiment=NPI-env=superlative-npi=ever-crucial_item=fast-licensor=1-scope=1-npi_present=0	1		a cashier had visited the fastest boy that the adults had also cared for .
experiment=NPI-env=superlative-npi=ever-crucial_item=fast-licensor=1-scope=0-npi_present=0	1		a cashier had also visited the fastest boy that the adults had cared for .
experiment=NPI-env=superlative-npi=ever-crucial_item=nice-licensor=0-scope=1-npi_present=0	1		the guests hugged the nice patient that the boy had also approached .
experiment=NPI-env=superlative-npi=ever-crucial_item=nice-licensor=0-scope=0-npi_present=1	0		the guests ever hugged the nice patient that the boy had approached .
experiment=NPI-env=superlative-npi=ever-crucial_item=nice-licensor=1-scope=0-npi_present=1	0		the guests ever hugged the nicest patient that the boy had approached .
experiment=NPI-env=superlative-npi=ever-crucial_item=fast-licensor=0-scope=0-npi_present=0	1		the doctors had also described the fast teachers that the cashier has watched .
experiment=NPI-env=superlative-npi=ever-crucial_item=fast-licensor=1-scope=0-npi_present=1	0		the doctors had ever described the fastest teachers that the cashier has watched .
experiment=NPI-env=superlative-npi=ever-crucial_item=popular-licensor=0-scope=1-npi_present=0	1		the person had described the popular public park that the actress has also disliked .
experiment=NPI-env=superlative-npi=ever-crucial_item=popular-licensor=1-scope=1-npi_present=1	1		the person had described the most popular public park that the actress has ever disliked .
experiment=NPI-env=superlative-npi=ever-crucial_item=popular-licensor=1-scope=0-npi_present=0	1		the person had also described the most popular public park that the actress has disliked .
experiment=NPI-env=superlative-npi=ever-crucial_item=small-licensor=0-scope=1-npi_present=0	1		a child visited the small waitresses that the pedestrians have also kissed .
experiment=NPI-env=superlative-npi=ever-crucial_item=small-licensor=1-scope=1-npi_present=1	1		a child visited the smallest waitresses that the pedestrians have ever kissed .
experiment=NPI-env=superlative-npi=ever-crucial_item=small-licensor=1-scope=0-npi_present=1	0		a child ever visited the smallest waitresses that the pedestrians have kissed .
experiment=NPI-env=superlative-npi=ever-crucial_item=small-licensor=1-scope=0-npi_present=0	1		a child also visited the smallest waitresses that the pedestrians have kissed .
experiment=NPI-env=superlative-npi=ever-crucial_item=bad-licensor=0-scope=0-npi_present=1	0		a person could ever buy the bad dishes that the guy has admired .
experiment=NPI-env=superlative-npi=ever-crucial_item=bad-licensor=1-scope=1-npi_present=1	1		a person could buy the worst dishes that the guy has ever admired .
experiment=NPI-env=superlative-npi=ever-crucial_item=bad-licensor=1-scope=1-npi_present=0	1		a person could buy the worst dishes that the guy has also admired .
experiment=NPI-env=superlative-npi=ever-crucial_item=new-licensor=0-scope=0-npi_present=1	0		the lady ever cleans the new dishes that the doctor has cleaned .
experiment=NPI-env=superlative-npi=ever-crucial_item=new-licensor=1-scope=1-npi_present=1	1		the lady cleans the newest dishes that the doctor has ever cleaned .
experiment=NPI-env=superlative-npi=ever-crucial_item=fast-licensor=0-scope=1-npi_present=0	1		the students kissed the fast boys that the girl had also returned to .
experiment=NPI-env=superlative-npi=ever-crucial_item=important-licensor=0-scope=0-npi_present=0	1		the patient also helps the important students that the adult had criticized .
experiment=NPI-env=superlative-npi=ever-crucial_item=important-licensor=1-scope=1-npi_present=1	1		the patient helps the most important students that the adult had ever criticized .
experiment=NPI-env=superlative-npi=ever-crucial_item=important-licensor=1-scope=0-npi_present=1	0		the patient ever helps the most important students that the adult had criticized .
experiment=NPI-env=superlative-npi=ever-crucial_item=important-licensor=1-scope=0-npi_present=0	1		the patient also helps the most important students that the adult had criticized .
experiment=NPI-env=superlative-npi=ever-crucial_item=serious-licensor=0-scope=1-npi_present=1	0		the teenager disliked the serious ladies that the boy had ever investigated .
experiment=NPI-env=superlative-npi=ever-crucial_item=serious-licensor=0-scope=0-npi_present=1	0		the teenager ever disliked the serious ladies that the boy had investigated .
experiment=NPI-env=superlative-npi=ever-crucial_item=happy-licensor=1-scope=1-npi_present=0	1		the teachers should visit the happiest driver that the human had also escaped from .
experiment=NPI-env=superlative-npi=ever-crucial_item=happy-licensor=1-scope=0-npi_present=1	0		the teachers should ever visit the happiest driver that the human had escaped from .
experiment=NPI-env=superlative-npi=ever-crucial_item=young-licensor=0-scope=0-npi_present=0	1		the pedestrians also escaped from the young waitresses that the boys have talked to .
experiment=NPI-env=superlative-npi=ever-crucial_item=young-licensor=1-scope=0-npi_present=0	1		the pedestrians also escaped from the youngest waitresses that the boys have talked to .
experiment=NPI-env=superlative-npi=ever-crucial_item=bad-licensor=1-scope=1-npi_present=1	1		the person has described the worst hospital that the men had ever insulted .
experiment=NPI-env=superlative-npi=ever-crucial_item=bad-licensor=1-scope=1-npi_present=0	1		the person has described the worst hospital that the men had also insulted .
experiment=NPI-env=superlative-npi=ever-crucial_item=bad-licensor=1-scope=0-npi_present=1	0		the person has ever described the worst hospital that the men had insulted .
experiment=NPI-env=superlative-npi=ever-crucial_item=bad-licensor=1-scope=0-npi_present=0	1		the person has also described the worst hospital that the men had insulted .
experiment=NPI-env=superlative-npi=ever-crucial_item=nice-licensor=0-scope=1-npi_present=1	0		the adult saw the nice waiters that the cashier had ever discussed .
experiment=NPI-env=superlative-npi=ever-crucial_item=nice-licensor=0-scope=1-npi_present=0	1		the adult saw the nice waiters that the cashier had also discussed .
experiment=NPI-env=superlative-npi=ever-crucial_item=nice-licensor=1-scope=1-npi_present=1	1		the adult saw the nicest waiters that the cashier had ever discussed .
experiment=NPI-env=superlative-npi=ever-crucial_item=nice-licensor=1-scope=1-npi_present=0	1		the adult saw the nicest waiters that the cashier had also discussed .
experiment=NPI-env=superlative-npi=ever-crucial_item=big-licensor=1-scope=1-npi_present=1	1		the teenager described the biggest people that the driver has ever praised .
experiment=NPI-env=superlative-npi=ever-crucial_item=big-licensor=1-scope=1-npi_present=0	1		the teenager described the biggest people that the driver has also praised .
experiment=NPI-env=superlative-npi=ever-crucial_item=big-licensor=1-scope=0-npi_present=0	1		the teenager also described the biggest people that the driver has praised .
experiment=NPI-env=only-npi=ever-crucial_item=_-licensor=1-scope=0-npi_present=1	0		a customer had ever lifted only the plates .
experiment=NPI-env=only-npi=ever-crucial_item=_-licensor=0-scope=1-npi_present=0	1		a customer had also often lifted the plates .
experiment=NPI-env=only-npi=ever-crucial_item=_-licensor=1-scope=1-npi_present=1	1		only the teenager had ever watched the teenagers .
experiment=NPI-env=only-npi=ever-crucial_item=_-licensor=1-scope=0-npi_present=1	0		the teenager had ever watched only the teenagers .
experiment=NPI-env=only-npi=ever-crucial_item=_-licensor=0-scope=1-npi_present=1	0		the teenager had also ever watched the teenagers .
experiment=NPI-env=only-npi=ever-crucial_item=_-licensor=0-scope=0-npi_present=0	1		the teenager had often also watched the teenagers .
experiment=NPI-env=only-npi=ever-crucial_item=_-licensor=1-scope=1-npi_present=0	1		only the patient might sometimes love the children .
experiment=NPI-env=only-npi=ever-crucial_item=_-licensor=1-scope=0-npi_present=0	1		the patient might sometimes love only the children .
experiment=NPI-env=only-npi=ever-crucial_item=_-licensor=0-scope=1-npi_present=0	1		the patient might also sometimes love the children .
experiment=NPI-env=only-npi=ever-crucial_item=_-licensor=0-scope=1-npi_present=1	0		the adult also ever discusses the drivers .
experiment=NPI-env=only-npi=ever-crucial_item=_-licensor=0-scope=0-npi_present=0	1		the adult sometimes also discusses the drivers .
experiment=NPI-env=only-npi=ever-crucial_item=_-licensor=1-scope=1-npi_present=1	1		only the student ever cleans the plates .
experiment=NPI-env=only-npi=ever-crucial_item=_-licensor=1-scope=0-npi_present=1	0		the student ever cleans only the plates .
experiment=NPI-env=only-npi=ever-crucial_item=_-licensor=0-scope=1-npi_present=1	0		the student also ever cleans the plates .
experiment=NPI-env=only-npi=ever-crucial_item=_-licensor=0-scope=0-npi_present=1	0		the student ever also cleans the plates .
experiment=NPI-env=only-npi=ever-crucial_item=_-licensor=1-scope=1-npi_present=1	1		only the humans ever passed the high schools .
experiment=NPI-env=only-npi=ever-crucial_item=_-licensor=1-scope=0-npi_present=1	0		the humans ever passed only the high schools .
experiment=NPI-env=only-npi=ever-crucial_item=_-licensor=1-scope=0-npi_present=0	1		the humans often passed only the high schools .
experiment=NPI-env=only-npi=ever-crucial_item=_-licensor=1-scope=1-npi_present=0	1		only the customer has now forgotten the doctors .
experiment=NPI-env=only-npi=ever-crucial_item=_-licensor=1-scope=1-npi_present=1	1		only a gal does ever pass the college campuses .
experiment=NPI-env=only-npi=ever-crucial_item=_-licensor=1-scope=1-npi_present=0	1		only a gal does always pass the college campuses .
experiment=NPI-env=only-npi=ever-crucial_item=_-licensor=1-scope=0-npi_present=1	0		a gal does ever pass only the college campuses .
experiment=NPI-env=only-npi=ever-crucial_item=_-licensor=0-scope=0-npi_present=0	1		a gal does always also pass the college campuses .
experiment=NPI-env=only-npi=ever-crucial_item=_-licensor=1-scope=1-npi_present=1	1		only the doctors ever been at the college campuses .
experiment=NPI-env=only-npi=ever-crucial_item=_-licensor=1-scope=0-npi_present=1	0		the doctors ever been at only the college campuses .
experiment=NPI-env=only-npi=ever-crucial_item=_-licensor=1-scope=0-npi_present=0	1		the doctors sometimes been at only the college campuses .
experiment=NPI-env=only-npi=ever-crucial_item=_-licensor=0-scope=1-npi_present=1	0		the doctors also ever been at the college campuses .
experiment=NPI-env=only-npi=ever-crucial_item=_-licensor=0-scope=0-npi_present=1	0		the people do ever also examine the books .
experiment=NPI-env=only-npi=ever-crucial_item=_-licensor=0-scope=0-npi_present=0	1		the people do now also examine the books .
experiment=NPI-env=only-npi=ever-crucial_item=_-licensor=0-scope=0-npi_present=1	0		the pedestrian ever also remembers the grocery stores .
experiment=NPI-env=only-npi=ever-crucial_item=_-licensor=1-scope=0-npi_present=1	0		the patients have ever hugged only the teenagers .
experiment=NPI-env=only-npi=ever-crucial_item=_-licensor=0-scope=1-npi_present=0	1		the patients have also sometimes hugged the teenagers .
experiment=NPI-env=only-npi=ever-crucial_item=_-licensor=0-scope=0-npi_present=1	0		the patients have ever also hugged the teenagers .
experiment=NPI-env=only-npi=ever-crucial_item=_-licensor=1-scope=1-npi_present=0	1		only the girls have sometimes kissed the girls .
experiment=NPI-env=only-npi=ever-crucial_item=_-licensor=0-scope=1-npi_present=1	0		the girls have also ever kissed the girls .
experiment=NPI-env=only-npi=ever-crucial_item=_-licensor=0-scope=1-npi_present=0	1		the girls have also sometimes kissed the girls .
experiment=NPI-env=only-npi=ever-crucial_item=_-licensor=0-scope=0-npi_present=1	0		the girls have ever also kissed the girls .
experiment=NPI-env=only-npi=ever-crucial_item=_-licensor=1-scope=1-npi_present=1	1		only the waitresses have ever observed the gals .
experiment=NPI-env=only-npi=ever-crucial_item=_-licensor=0-scope=1-npi_present=1	0		the waitresses have also ever observed the gals .
experiment=NPI-env=only-npi=ever-crucial_item=_-licensor=0-scope=1-npi_present=0	1		the waitresses have also now observed the gals .
experiment=NPI-env=only-npi=ever-crucial_item=_-licensor=1-scope=1-npi_present=1	1		only a girl ever loves the gals .
experiment=NPI-env=only-npi=ever-crucial_item=_-licensor=1-scope=1-npi_present=1	1		only the customer had ever passed the schools .
experiment=NPI-env=only-npi=ever-crucial_item=_-licensor=1-scope=1-npi_present=0	1		only the customer had often passed the schools .
experiment=NPI-env=only-npi=ever-crucial_item=_-licensor=0-scope=1-npi_present=0	1		the customer had also often passed the schools .
experiment=NPI-env=only-npi=ever-crucial_item=_-licensor=0-scope=0-npi_present=0	1		the customer had often also passed the schools .
experiment=NPI-env=only-npi=ever-crucial_item=_-licensor=1-scope=1-npi_present=1	1		only a doctor had ever dropped by the restaurants .
experiment=NPI-env=only-npi=ever-crucial_item=_-licensor=1-scope=1-npi_present=0	1		only a doctor had often dropped by the restaurants .
experiment=NPI-env=only-npi=ever-crucial_item=_-licensor=1-scope=0-npi_present=1	0		a doctor had ever dropped by only the restaurants .
experiment=NPI-env=only-npi=ever-crucial_item=_-licensor=1-scope=0-npi_present=1	0		the boy ever talks about only the college campuses .
experiment=NPI-env=only-npi=ever-crucial_item=_-licensor=0-scope=0-npi_present=1	0		the boy ever also talks about the college campuses .
experiment=NPI-env=only-npi=ever-crucial_item=_-licensor=0-scope=0-npi_present=0	1		the actors often also loved the teachers .
experiment=NPI-env=only-npi=ever-crucial_item=_-licensor=1-scope=1-npi_present=1	1		only the girls had ever loved the actresses .
experiment=NPI-env=only-npi=ever-crucial_item=_-licensor=1-scope=1-npi_present=0	1		only the girls had always loved the actresses .
experiment=NPI-env=only-npi=ever-crucial_item=_-licensor=1-scope=0-npi_present=0	1		the girls had always loved only the actresses .
experiment=NPI-env=only-npi=ever-crucial_item=_-licensor=0-scope=1-npi_present=0	1		the girls had also always loved the actresses .
experiment=NPI-env=only-npi=ever-crucial_item=_-licensor=1-scope=0-npi_present=1	0		a woman had ever toured only the restaurants .
experiment=NPI-env=only-npi=ever-crucial_item=_-licensor=0-scope=0-npi_present=0	1		a woman had sometimes also toured the restaurants .
experiment=NPI-env=only-npi=ever-crucial_item=_-licensor=1-scope=1-npi_present=1	1		only the adult ever drove to the grocery stores .
experiment=NPI-env=only-npi=ever-crucial_item=_-licensor=0-scope=0-npi_present=1	0		the adult ever also drove to the grocery stores .
experiment=NPI-env=only-npi=ever-crucial_item=_-licensor=1-scope=1-npi_present=1	1		only the cashiers could ever watch the waitresses .
experiment=NPI-env=only-npi=ever-crucial_item=_-licensor=1-scope=0-npi_present=1	0		the cashiers could ever watch only the waitresses .
experiment=NPI-env=only-npi=ever-crucial_item=_-licensor=0-scope=1-npi_present=1	0		the cashiers could also ever watch the waitresses .
experiment=NPI-env=only-npi=ever-crucial_item=_-licensor=0-scope=1-npi_present=0	1		the cashiers could also often watch the waitresses .
experiment=NPI-env=only-npi=ever-crucial_item=_-licensor=0-scope=0-npi_present=0	1		a guest could now also have the books .
experiment=NPI-env=only-npi=ever-crucial_item=_-licensor=1-scope=1-npi_present=0	1		only a man often listened to the guys .
experiment=NPI-env=only-npi=ever-crucial_item=_-licensor=1-scope=0-npi_present=0	1		a man often listened to only the guys .
experiment=NPI-env=only-npi=ever-crucial_item=_-licensor=0-scope=1-npi_present=1	0		a man also ever listened to the guys .
experiment=NPI-env=only-npi=ever-crucial_item=_-licensor=0-scope=0-npi_present=1	0		a man ever also listened to the guys .
experiment=NPI-env=only-npi=ever-crucial_item=_-licensor=1-scope=1-npi_present=1	1		only a guy ever describes the actors .
experiment=NPI-env=only-npi=ever-crucial_item=_-licensor=0-scope=1-npi_present=1	0		a guy also ever describes the actors .
experiment=NPI-env=only-npi=ever-crucial_item=_-licensor=1-scope=1-npi_present=1	1		only the humans might ever attack the teachers .
experiment=NPI-env=only-npi=ever-crucial_item=_-licensor=1-scope=0-npi_present=1	0		the humans might ever attack only the teachers .
experiment=NPI-env=only-npi=ever-crucial_item=_-licensor=0-scope=1-npi_present=1	0		the humans might also ever attack the teachers .
experiment=NPI-env=only-npi=ever-crucial_item=_-licensor=0-scope=1-npi_present=0	1		the humans might also now attack the teachers .
experiment=NPI-env=only-npi=ever-crucial_item=_-licensor=0-scope=0-npi_present=0	1		the humans might now also attack the teachers .
experiment=NPI-env=only-npi=ever-crucial_item=_-licensor=0-scope=1-npi_present=1	0		a person also ever attacked the people .
experiment=NPI-env=only-npi=ever-crucial_item=_-licensor=0-scope=1-npi_present=0	1		a person also always attacked the people .
experiment=NPI-env=only-npi=ever-crucial_item=_-licensor=1-scope=1-npi_present=1	1		only the teenagers ever discuss the museums .
experiment=NPI-env=only-npi=ever-crucial_item=_-licensor=1-scope=0-npi_present=0	1		the teenagers always discuss only the museums .
experiment=NPI-env=only-npi=ever-crucial_item=_-licensor=0-scope=0-npi_present=0	1		the teenagers always also discuss the museums .
experiment=NPI-env=only-npi=ever-crucial_item=_-licensor=1-scope=0-npi_present=0	1		the teacher now escapes from only the pedestrians .
experiment=NPI-env=only-npi=ever-crucial_item=_-licensor=0-scope=0-npi_present=1	0		the teacher ever also escapes from the pedestrians .
experiment=NPI-env=only-npi=ever-crucial_item=_-licensor=0-scope=0-npi_present=0	1		the teacher now also escapes from the pedestrians .
experiment=NPI-env=only-npi=ever-crucial_item=_-licensor=1-scope=1-npi_present=1	1		only the boys do ever flee from the people .
experiment=NPI-env=only-npi=ever-crucial_item=_-licensor=1-scope=0-npi_present=0	1		the boys do often flee from only the people .
experiment=NPI-env=only-npi=ever-crucial_item=_-licensor=0-scope=0-npi_present=1	0		the boys do ever also flee from the people .
experiment=NPI-env=only-npi=ever-crucial_item=_-licensor=1-scope=0-npi_present=0	1		the people could always drop by only the libraries .
experiment=NPI-env=only-npi=ever-crucial_item=_-licensor=1-scope=0-npi_present=1	0		the child had ever sold only the reports .
experiment=NPI-env=only-npi=ever-crucial_item=_-licensor=0-scope=0-npi_present=1	0		the child had ever also sold the reports .
experiment=NPI-env=only-npi=ever-crucial_item=_-licensor=0-scope=0-npi_present=0	1		the child had now also sold the reports .
experiment=NPI-env=only-npi=ever-crucial_item=_-licensor=1-scope=1-npi_present=0	1		only the actor sometimes exits the libraries .
experiment=NPI-env=only-npi=ever-crucial_item=_-licensor=0-scope=1-npi_present=1	0		the actor also ever exits the libraries .
experiment=NPI-env=only-npi=ever-crucial_item=_-licensor=1-scope=0-npi_present=0	1		the cashiers now exited only the high schools .
experiment=NPI-env=only-npi=ever-crucial_item=_-licensor=0-scope=0-npi_present=0	1		the cashiers now also exited the high schools .
experiment=NPI-env=only-npi=ever-crucial_item=_-licensor=1-scope=1-npi_present=1	1		only the girls ever attacked the gals .
experiment=NPI-env=only-npi=ever-crucial_item=_-licensor=0-scope=1-npi_present=1	0		the girls also ever attacked the gals .
experiment=NPI-env=only-npi=ever-crucial_item=_-licensor=1-scope=1-npi_present=1	1		only the person would ever reference the movies .
experiment=NPI-env=only-npi=ever-crucial_item=_-licensor=0-scope=1-npi_present=1	0		the person would also ever reference the movies .
experiment=NPI-env=only-npi=ever-crucial_item=_-licensor=0-scope=0-npi_present=0	1		the person would sometimes also reference the movies .
experiment=NPI-env=only-npi=ever-crucial_item=_-licensor=1-scope=1-npi_present=1	1		only the actors ever helped the children .
experiment=NPI-env=only-npi=ever-crucial_item=_-licensor=1-scope=1-npi_present=0	1		only the actors often helped the children .
experiment=NPI-env=only-npi=ever-crucial_item=_-licensor=1-scope=0-npi_present=1	0		the actors ever helped only the children .
experiment=NPI-env=only-npi=ever-crucial_item=_-licensor=0-scope=1-npi_present=1	0		the actors also ever helped the children .
experiment=NPI-env=only-npi=ever-crucial_item=_-licensor=0-scope=1-npi_present=0	1		the actors also often helped the children .
experiment=NPI-env=only-npi=ever-crucial_item=_-licensor=0-scope=0-npi_present=1	0		the actors ever also helped the children .
experiment=NPI-env=only-npi=ever-crucial_item=_-licensor=1-scope=1-npi_present=0	1		only the waiters sometimes insulted the waitresses .
experiment=NPI-env=only-npi=ever-crucial_item=_-licensor=1-scope=0-npi_present=1	0		the waiters ever insulted only the waitresses .
experiment=NPI-env=only-npi=ever-crucial_item=_-licensor=1-scope=0-npi_present=1	0		the men ever respect only the boys .
experiment=NPI-env=only-npi=ever-crucial_item=_-licensor=1-scope=0-npi_present=1	0		the teachers do ever talk about only the guys .
experiment=NPI-env=only-npi=ever-crucial_item=_-licensor=1-scope=0-npi_present=0	1		the teachers do sometimes talk about only the guys .
experiment=NPI-env=only-npi=ever-crucial_item=_-licensor=0-scope=0-npi_present=1	0		the teachers do ever also talk about the guys .
experiment=NPI-env=only-npi=ever-crucial_item=_-licensor=0-scope=0-npi_present=1	0		the teenagers ever also had the newspaper articles .
experiment=NPI-env=only-npi=ever-crucial_item=_-licensor=0-scope=0-npi_present=0	1		the teenagers always also had the newspaper articles .
experiment=NPI-env=only-npi=ever-crucial_item=_-licensor=1-scope=1-npi_present=0	1		only the students sometimes listen to the gals .
experiment=NPI-env=only-npi=ever-crucial_item=_-licensor=1-scope=0-npi_present=0	1		the students sometimes listen to only the gals .
experiment=NPI-env=only-npi=ever-crucial_item=_-licensor=1-scope=1-npi_present=0	1		only the guests might now bring the forks .
experiment=NPI-env=only-npi=ever-crucial_item=_-licensor=1-scope=0-npi_present=1	0		the guests might ever bring only the forks .
experiment=NPI-env=only-npi=ever-crucial_item=_-licensor=1-scope=0-npi_present=0	1		the guests might now bring only the forks .
experiment=NPI-env=only-npi=ever-crucial_item=_-licensor=0-scope=1-npi_present=0	1		the guests might also now bring the forks .
experiment=NPI-env=only-npi=ever-crucial_item=_-licensor=0-scope=1-npi_present=0	1		the boys also now insulted the public parks .
experiment=NPI-env=only-npi=ever-crucial_item=_-licensor=1-scope=0-npi_present=1	0		an adult ever runs around only the art galleries .
experiment=NPI-env=only-npi=ever-crucial_item=_-licensor=0-scope=1-npi_present=1	0		an adult also ever runs around the art galleries .
experiment=NPI-env=only-npi=ever-crucial_item=_-licensor=0-scope=1-npi_present=0	1		an adult also often runs around the art galleries .
experiment=NPI-env=only-npi=ever-crucial_item=_-licensor=0-scope=0-npi_present=0	1		an adult often also runs around the art galleries .
experiment=NPI-env=only-npi=ever-crucial_item=_-licensor=1-scope=0-npi_present=1	0		the women ever remembered only the drivers .
