experiment=NPI-env=only-npi=yet-crucial_item=_-licensor=0-scope=1-npi_present=1	0		the adults will also investigate the teenagers at all today .
experiment=NPI-env=only-npi=yet-crucial_item=_-licensor=0-scope=1-npi_present=0	1		the adults will also investigate the teenagers angrily today .
experiment=NPI-env=only-npi=yet-crucial_item=_-licensor=0-scope=0-npi_present=1	0		the adults will investigate the teenagers at all also today .
experiment=NPI-env=only-npi=yet-crucial_item=_-licensor=0-scope=0-npi_present=0	1		the adults will investigate the teenagers angrily also today .
experiment=NPI-env=only-npi=yet-crucial_item=_-licensor=1-scope=1-npi_present=1	1		only a guy knows the boys at all today .
experiment=NPI-env=only-npi=yet-crucial_item=_-licensor=1-scope=1-npi_present=0	1		only a guy knows the boys inappropriately today .
experiment=NPI-env=only-npi=yet-crucial_item=_-licensor=1-scope=0-npi_present=1	0		a guy knows the boys at all only today .
experiment=NPI-env=only-npi=yet-crucial_item=_-licensor=1-scope=0-npi_present=0	1		a guy knows the boys inappropriately only today .
experiment=NPI-env=only-npi=yet-crucial_item=_-licensor=0-scope=1-npi_present=1	0		a guy also knows the boys at all today .
experiment=NPI-env=only-npi=yet-crucial_item=_-licensor=0-scope=1-npi_present=0	1		a guy also knows the boys inappropriately today .
experiment=NPI-env=only-npi=yet-crucial_item=_-licensor=0-scope=0-npi_present=1	0		a guy knows the boys at all also today .
experiment=NPI-env=only-npi=yet-crucial_item=_-licensor=0-scope=0-npi_present=0	1		a guy knows the boys inappropriately also today .
experiment=NPI-env=only-npi=yet-crucial_item=_-licensor=1-scope=1-npi_present=1	1		only a customer had remembered the customers at all this week .
experiment=NPI-env=only-npi=yet-crucial_item=_-licensor=1-scope=1-npi_present=0	1		only a customer had remembered the customers happily this week .
experiment=NPI-env=only-npi=yet-crucial_item=_-licensor=1-scope=0-npi_present=1	0		a customer had remembered the customers at all only this week .
experiment=NPI-env=only-npi=yet-crucial_item=_-licensor=1-scope=0-npi_present=0	1		a customer had remembered the customers happily only this week .
experiment=NPI-env=only-npi=yet-crucial_item=_-licensor=0-scope=1-npi_present=1	0		a customer had also remembered the customers at all this week .
experiment=NPI-env=only-npi=yet-crucial_item=_-licensor=0-scope=1-npi_present=0	1		a customer had also remembered the customers happily this week .
experiment=NPI-env=only-npi=yet-crucial_item=_-licensor=0-scope=0-npi_present=1	0		a customer had remembered the customers at all also this week .
experiment=NPI-env=only-npi=yet-crucial_item=_-licensor=0-scope=0-npi_present=0	1		a customer had remembered the customers happily also this week .
experiment=NPI-env=only-npi=yet-crucial_item=_-licensor=1-scope=1-npi_present=1	1		only a pedestrian had skated around the banks at all this year .
experiment=NPI-env=only-npi=yet-crucial_item=_-licensor=1-scope=1-npi_present=0	1		only a pedestrian had skated around the banks appropriately this year .
experiment=NPI-env=only-npi=yet-crucial_item=_-licensor=1-scope=0-npi_present=1	0		a pedestrian had skated around the banks at all only this year .
experiment=NPI-env=only-npi=yet-crucial_item=_-licensor=1-scope=0-npi_present=0	1		a pedestrian had skated around the banks appropriately only this year .
experiment=NPI-env=only-npi=yet-crucial_item=_-licensor=0-scope=1-npi_present=1	0		a pedestrian had also skated around the banks at all this year .
experiment=NPI-env=only-npi=yet-crucial_item=_-licensor=0-scope=1-npi_present=0	1		a pedestrian had also skated around the banks appropriately this year .
experiment=NPI-env=only-npi=yet-crucial_item=_-licensor=0-scope=0-npi_present=1	0		a pedestrian had skated around the banks at all also this year .
experiment=NPI-env=only-npi=yet-crucial_item=_-licensor=0-scope=0-npi_present=0	1		a pedestrian had skated around the banks appropriately also this year .
experiment=NPI-env=only-npi=yet-crucial_item=_-licensor=1-scope=1-npi_present=1	1		only the boys praise the cashiers at all today .
experiment=NPI-env=only-npi=yet-crucial_item=_-licensor=1-scope=1-npi_present=0	1		only the boys praise the cashiers inappropriately today .
experiment=NPI-env=only-npi=yet-crucial_item=_-licensor=1-scope=0-npi_present=1	0		the boys praise the cashiers at all only today .
experiment=NPI-env=only-npi=yet-crucial_item=_-licensor=1-scope=0-npi_present=0	1		the boys praise the cashiers inappropriately only today .
experiment=NPI-env=only-npi=yet-crucial_item=_-licensor=0-scope=1-npi_present=1	0		the boys also praise the cashiers at all today .
experiment=NPI-env=only-npi=yet-crucial_item=_-licensor=0-scope=1-npi_present=0	1		the boys also praise the cashiers inappropriately today .
experiment=NPI-env=only-npi=yet-crucial_item=_-licensor=0-scope=0-npi_present=1	0		the boys praise the cashiers at all also today .
experiment=NPI-env=only-npi=yet-crucial_item=_-licensor=0-scope=0-npi_present=0	1		the boys praise the cashiers inappropriately also today .
experiment=NPI-env=only-npi=yet-crucial_item=_-licensor=1-scope=1-npi_present=1	1		only a pedestrian took the pants at all sometimes .
experiment=NPI-env=only-npi=yet-crucial_item=_-licensor=1-scope=1-npi_present=0	1		only a pedestrian took the pants angrily sometimes .
experiment=NPI-env=only-npi=yet-crucial_item=_-licensor=1-scope=0-npi_present=1	0		a pedestrian took the pants at all only sometimes .
experiment=NPI-env=only-npi=yet-crucial_item=_-licensor=1-scope=0-npi_present=0	1		a pedestrian took the pants angrily only sometimes .
experiment=NPI-env=only-npi=yet-crucial_item=_-licensor=0-scope=1-npi_present=1	0		a pedestrian also took the pants at all sometimes .
experiment=NPI-env=only-npi=yet-crucial_item=_-licensor=0-scope=1-npi_present=0	1		a pedestrian also took the pants angrily sometimes .
experiment=NPI-env=only-npi=yet-crucial_item=_-licensor=0-scope=0-npi_present=1	0		a pedestrian took the pants at all also sometimes .
experiment=NPI-env=only-npi=yet-crucial_item=_-licensor=0-scope=0-npi_present=0	1		a pedestrian took the pants angrily also sometimes .
experiment=NPI-env=only-npi=yet-crucial_item=_-licensor=1-scope=1-npi_present=1	1		only the girls had ran around the cafes at all this week .
experiment=NPI-env=only-npi=yet-crucial_item=_-licensor=1-scope=1-npi_present=0	1		only the girls had ran around the cafes appropriately this week .
experiment=NPI-env=only-npi=yet-crucial_item=_-licensor=1-scope=0-npi_present=1	0		the girls had ran around the cafes at all only this week .
experiment=NPI-env=only-npi=yet-crucial_item=_-licensor=1-scope=0-npi_present=0	1		the girls had ran around the cafes appropriately only this week .
experiment=NPI-env=only-npi=yet-crucial_item=_-licensor=0-scope=1-npi_present=1	0		the girls had also ran around the cafes at all this week .
experiment=NPI-env=only-npi=yet-crucial_item=_-licensor=0-scope=1-npi_present=0	1		the girls had also ran around the cafes appropriately this week .
experiment=NPI-env=only-npi=yet-crucial_item=_-licensor=0-scope=0-npi_present=1	0		the girls had ran around the cafes at all also this week .
experiment=NPI-env=only-npi=yet-crucial_item=_-licensor=0-scope=0-npi_present=0	1		the girls had ran around the cafes appropriately also this week .
experiment=NPI-env=only-npi=yet-crucial_item=_-licensor=1-scope=1-npi_present=1	1		only the women talked about the students at all today .
experiment=NPI-env=only-npi=yet-crucial_item=_-licensor=1-scope=1-npi_present=0	1		only the women talked about the students appropriately today .
experiment=NPI-env=only-npi=yet-crucial_item=_-licensor=1-scope=0-npi_present=1	0		the women talked about the students at all only today .
experiment=NPI-env=only-npi=yet-crucial_item=_-licensor=1-scope=0-npi_present=0	1		the women talked about the students appropriately only today .
experiment=NPI-env=only-npi=yet-crucial_item=_-licensor=0-scope=1-npi_present=1	0		the women also talked about the students at all today .
experiment=NPI-env=only-npi=yet-crucial_item=_-licensor=0-scope=1-npi_present=0	1		the women also talked about the students appropriately today .
experiment=NPI-env=only-npi=yet-crucial_item=_-licensor=0-scope=0-npi_present=1	0		the women talked about the students at all also today .
experiment=NPI-env=only-npi=yet-crucial_item=_-licensor=0-scope=0-npi_present=0	1		the women talked about the students appropriately also today .
experiment=NPI-env=only-npi=yet-crucial_item=_-licensor=1-scope=1-npi_present=1	1		only the boys remember the grocery stores at all today .
experiment=NPI-env=only-npi=yet-crucial_item=_-licensor=1-scope=1-npi_present=0	1		only the boys remember the grocery stores happily today .
experiment=NPI-env=only-npi=yet-crucial_item=_-licensor=1-scope=0-npi_present=1	0		the boys remember the grocery stores at all only today .
experiment=NPI-env=only-npi=yet-crucial_item=_-licensor=1-scope=0-npi_present=0	1		the boys remember the grocery stores happily only today .
experiment=NPI-env=only-npi=yet-crucial_item=_-licensor=0-scope=1-npi_present=1	0		the boys also remember the grocery stores at all today .
experiment=NPI-env=only-npi=yet-crucial_item=_-licensor=0-scope=1-npi_present=0	1		the boys also remember the grocery stores happily today .
experiment=NPI-env=only-npi=yet-crucial_item=_-licensor=0-scope=0-npi_present=1	0		the boys remember the grocery stores at all also today .
experiment=NPI-env=only-npi=yet-crucial_item=_-licensor=0-scope=0-npi_present=0	1		the boys remember the grocery stores happily also today .
experiment=NPI-env=only-npi=yet-crucial_item=_-licensor=1-scope=1-npi_present=1	1		only the doctors did have the chairs at all today .
experiment=NPI-env=only-npi=yet-crucial_item=_-licensor=1-scope=1-npi_present=0	1		only the doctors did have the chairs inappropriately today .
experiment=NPI-env=only-npi=yet-crucial_item=_-licensor=1-scope=0-npi_present=1	0		the doctors did have the chairs at all only today .
experiment=NPI-env=only-npi=yet-crucial_item=_-licensor=1-scope=0-npi_present=0	1		the doctors did have the chairs inappropriately only today .
experiment=NPI-env=only-npi=yet-crucial_item=_-licensor=0-scope=1-npi_present=1	0		the doctors did also have the chairs at all today .
experiment=NPI-env=only-npi=yet-crucial_item=_-licensor=0-scope=1-npi_present=0	1		the doctors did also have the chairs inappropriately today .
experiment=NPI-env=only-npi=yet-crucial_item=_-licensor=0-scope=0-npi_present=1	0		the doctors did have the chairs at all also today .
experiment=NPI-env=only-npi=yet-crucial_item=_-licensor=0-scope=0-npi_present=0	1		the doctors did have the chairs inappropriately also today .
experiment=NPI-env=only-npi=yet-crucial_item=_-licensor=1-scope=1-npi_present=1	1		only the people did watch the people at all today .
experiment=NPI-env=only-npi=yet-crucial_item=_-licensor=1-scope=1-npi_present=0	1		only the people did watch the people angrily today .
experiment=NPI-env=only-npi=yet-crucial_item=_-licensor=1-scope=0-npi_present=1	0		the people did watch the people at all only today .
experiment=NPI-env=only-npi=yet-crucial_item=_-licensor=1-scope=0-npi_present=0	1		the people did watch the people angrily only today .
experiment=NPI-env=only-npi=yet-crucial_item=_-licensor=0-scope=1-npi_present=1	0		the people did also watch the people at all today .
experiment=NPI-env=only-npi=yet-crucial_item=_-licensor=0-scope=1-npi_present=0	1		the people did also watch the people angrily today .
experiment=NPI-env=only-npi=yet-crucial_item=_-licensor=0-scope=0-npi_present=1	0		the people did watch the people at all also today .
experiment=NPI-env=only-npi=yet-crucial_item=_-licensor=0-scope=0-npi_present=0	1		the people did watch the people angrily also today .
experiment=NPI-env=only-npi=yet-crucial_item=_-licensor=1-scope=1-npi_present=1	1		only an actor listens to the ladies at all today .
experiment=NPI-env=only-npi=yet-crucial_item=_-licensor=1-scope=1-npi_present=0	1		only an actor listens to the ladies angrily today .
experiment=NPI-env=only-npi=yet-crucial_item=_-licensor=1-scope=0-npi_present=1	0		an actor listens to the ladies at all only today .
experiment=NPI-env=only-npi=yet-crucial_item=_-licensor=1-scope=0-npi_present=0	1		an actor listens to the ladies angrily only today .
experiment=NPI-env=only-npi=yet-crucial_item=_-licensor=0-scope=1-npi_present=1	0		an actor also listens to the ladies at all today .
experiment=NPI-env=only-npi=yet-crucial_item=_-licensor=0-scope=1-npi_present=0	1		an actor also listens to the ladies angrily today .
experiment=NPI-env=only-npi=yet-crucial_item=_-licensor=0-scope=0-npi_present=1	0		an actor listens to the ladies at all also today .
experiment=NPI-env=only-npi=yet-crucial_item=_-licensor=0-scope=0-npi_present=0	1		an actor listens to the ladies angrily also today .
experiment=NPI-env=only-npi=yet-crucial_item=_-licensor=1-scope=1-npi_present=1	1		only the adults scan the newspaper articles at all this week .
experiment=NPI-env=only-npi=yet-crucial_item=_-licensor=1-scope=1-npi_present=0	1		only the adults scan the newspaper articles appropriately this week .
experiment=NPI-env=only-npi=yet-crucial_item=_-licensor=1-scope=0-npi_present=1	0		the adults scan the newspaper articles at all only this week .
experiment=NPI-env=only-npi=yet-crucial_item=_-licensor=1-scope=0-npi_present=0	1		the adults scan the newspaper articles appropriately only this week .
experiment=NPI-env=only-npi=yet-crucial_item=_-licensor=0-scope=1-npi_present=1	0		the adults also scan the newspaper articles at all this week .
experiment=NPI-env=only-npi=yet-crucial_item=_-licensor=0-scope=1-npi_present=0	1		the adults also scan the newspaper articles appropriately this week .
experiment=NPI-env=only-npi=yet-crucial_item=_-licensor=0-scope=0-npi_present=1	0		the adults scan the newspaper articles at all also this week .
experiment=NPI-env=only-npi=yet-crucial_item=_-licensor=0-scope=0-npi_present=0	1		the adults scan the newspaper articles appropriately also this week .
experiment=NPI-env=only-npi=yet-crucial_item=_-licensor=1-scope=1-npi_present=1	1		only the patients did reference the guys at all this week .
experiment=NPI-env=only-npi=yet-crucial_item=_-licensor=1-scope=1-npi_present=0	1		only the patients did reference the guys happily this week .
experiment=NPI-env=only-npi=yet-crucial_item=_-licensor=1-scope=0-npi_present=1	0		the patients did reference the guys at all only this week .
experiment=NPI-env=only-npi=yet-crucial_item=_-licensor=1-scope=0-npi_present=0	1		the patients did reference the guys happily only this week .
experiment=NPI-env=only-npi=yet-crucial_item=_-licensor=0-scope=1-npi_present=1	0		the patients did also reference the guys at all this week .
experiment=NPI-env=only-npi=yet-crucial_item=_-licensor=0-scope=1-npi_present=0	1		the patients did also reference the guys happily this week .
experiment=NPI-env=only-npi=yet-crucial_item=_-licensor=0-scope=0-npi_present=1	0		the patients did reference the guys at all also this week .
experiment=NPI-env=only-npi=yet-crucial_item=_-licensor=0-scope=0-npi_present=0	1		the patients did reference the guys happily also this week .
experiment=NPI-env=only-npi=yet-crucial_item=_-licensor=1-scope=1-npi_present=1	1		only the guy can bike to the grocery stores at all this year .
experiment=NPI-env=only-npi=yet-crucial_item=_-licensor=1-scope=1-npi_present=0	1		only the guy can bike to the grocery stores inappropriately this year .
experiment=NPI-env=only-npi=yet-crucial_item=_-licensor=1-scope=0-npi_present=1	0		the guy can bike to the grocery stores at all only this year .
experiment=NPI-env=only-npi=yet-crucial_item=_-licensor=1-scope=0-npi_present=0	1		the guy can bike to the grocery stores inappropriately only this year .
experiment=NPI-env=only-npi=yet-crucial_item=_-licensor=0-scope=1-npi_present=1	0		the guy can also bike to the grocery stores at all this year .
experiment=NPI-env=only-npi=yet-crucial_item=_-licensor=0-scope=1-npi_present=0	1		the guy can also bike to the grocery stores inappropriately this year .
experiment=NPI-env=only-npi=yet-crucial_item=_-licensor=0-scope=0-npi_present=1	0		the guy can bike to the grocery stores at all also this year .
experiment=NPI-env=only-npi=yet-crucial_item=_-licensor=0-scope=0-npi_present=0	1		the guy can bike to the grocery stores inappropriately also this year .
experiment=NPI-env=only-npi=yet-crucial_item=_-licensor=1-scope=1-npi_present=1	1		only the humans had attacked the waiters at all sometimes .
experiment=NPI-env=only-npi=yet-crucial_item=_-licensor=1-scope=1-npi_present=0	1		only the humans had attacked the waiters angrily sometimes .
experiment=NPI-env=only-npi=yet-crucial_item=_-licensor=1-scope=0-npi_present=1	0		the humans had attacked the waiters at all only sometimes .
experiment=NPI-env=only-npi=yet-crucial_item=_-licensor=1-scope=0-npi_present=0	1		the humans had attacked the waiters angrily only sometimes .
experiment=NPI-env=only-npi=yet-crucial_item=_-licensor=0-scope=1-npi_present=1	0		the humans had also attacked the waiters at all sometimes .
experiment=NPI-env=only-npi=yet-crucial_item=_-licensor=0-scope=1-npi_present=0	1		the humans had also attacked the waiters angrily sometimes .
experiment=NPI-env=only-npi=yet-crucial_item=_-licensor=0-scope=0-npi_present=1	0		the humans had attacked the waiters at all also sometimes .
experiment=NPI-env=only-npi=yet-crucial_item=_-licensor=0-scope=0-npi_present=0	1		the humans had attacked the waiters angrily also sometimes .
experiment=NPI-env=only-npi=yet-crucial_item=_-licensor=1-scope=1-npi_present=1	1		only the waiter observed the gals at all sometimes .
experiment=NPI-env=only-npi=yet-crucial_item=_-licensor=1-scope=1-npi_present=0	1		only the waiter observed the gals appropriately sometimes .
experiment=NPI-env=only-npi=yet-crucial_item=_-licensor=1-scope=0-npi_present=1	0		the waiter observed the gals at all only sometimes .
experiment=NPI-env=only-npi=yet-crucial_item=_-licensor=1-scope=0-npi_present=0	1		the waiter observed the gals appropriately only sometimes .
experiment=NPI-env=only-npi=yet-crucial_item=_-licensor=0-scope=1-npi_present=1	0		the waiter also observed the gals at all sometimes .
experiment=NPI-env=only-npi=yet-crucial_item=_-licensor=0-scope=1-npi_present=0	1		the waiter also observed the gals appropriately sometimes .
experiment=NPI-env=only-npi=yet-crucial_item=_-licensor=0-scope=0-npi_present=1	0		the waiter observed the gals at all also sometimes .
experiment=NPI-env=only-npi=yet-crucial_item=_-licensor=0-scope=0-npi_present=0	1		the waiter observed the gals appropriately also sometimes .
experiment=NPI-env=only-npi=yet-crucial_item=_-licensor=1-scope=1-npi_present=1	1		only the doctors remember the movies at all today .
experiment=NPI-env=only-npi=yet-crucial_item=_-licensor=1-scope=1-npi_present=0	1		only the doctors remember the movies appropriately today .
experiment=NPI-env=only-npi=yet-crucial_item=_-licensor=1-scope=0-npi_present=1	0		the doctors remember the movies at all only today .
experiment=NPI-env=only-npi=yet-crucial_item=_-licensor=1-scope=0-npi_present=0	1		the doctors remember the movies appropriately only today .
experiment=NPI-env=only-npi=yet-crucial_item=_-licensor=0-scope=1-npi_present=1	0		the doctors also remember the movies at all today .
experiment=NPI-env=only-npi=yet-crucial_item=_-licensor=0-scope=1-npi_present=0	1		the doctors also remember the movies appropriately today .
experiment=NPI-env=only-npi=yet-crucial_item=_-licensor=0-scope=0-npi_present=1	0		the doctors remember the movies at all also today .
experiment=NPI-env=only-npi=yet-crucial_item=_-licensor=0-scope=0-npi_present=0	1		the doctors remember the movies appropriately also today .
experiment=NPI-env=only-npi=yet-crucial_item=_-licensor=1-scope=1-npi_present=1	1		only the drivers should examine the plays at all today .
experiment=NPI-env=only-npi=yet-crucial_item=_-licensor=1-scope=1-npi_present=0	1		only the drivers should examine the plays angrily today .
experiment=NPI-env=only-npi=yet-crucial_item=_-licensor=1-scope=0-npi_present=1	0		the drivers should examine the plays at all only today .
experiment=NPI-env=only-npi=yet-crucial_item=_-licensor=1-scope=0-npi_present=0	1		the drivers should examine the plays angrily only today .
experiment=NPI-env=only-npi=yet-crucial_item=_-licensor=0-scope=1-npi_present=1	0		the drivers should also examine the plays at all today .
experiment=NPI-env=only-npi=yet-crucial_item=_-licensor=0-scope=1-npi_present=0	1		the drivers should also examine the plays angrily today .
experiment=NPI-env=only-npi=yet-crucial_item=_-licensor=0-scope=0-npi_present=1	0		the drivers should examine the plays at all also today .
experiment=NPI-env=only-npi=yet-crucial_item=_-licensor=0-scope=0-npi_present=0	1		the drivers should examine the plays angrily also today .
experiment=NPI-env=only-npi=yet-crucial_item=_-licensor=1-scope=1-npi_present=1	1		only the people will drop by the art galleries at all this week .
experiment=NPI-env=only-npi=yet-crucial_item=_-licensor=1-scope=1-npi_present=0	1		only the people will drop by the art galleries happily this week .
experiment=NPI-env=only-npi=yet-crucial_item=_-licensor=1-scope=0-npi_present=1	0		the people will drop by the art galleries at all only this week .
experiment=NPI-env=only-npi=yet-crucial_item=_-licensor=1-scope=0-npi_present=0	1		the people will drop by the art galleries happily only this week .
experiment=NPI-env=only-npi=yet-crucial_item=_-licensor=0-scope=1-npi_present=1	0		the people will also drop by the art galleries at all this week .
experiment=NPI-env=only-npi=yet-crucial_item=_-licensor=0-scope=1-npi_present=0	1		the people will also drop by the art galleries happily this week .
experiment=NPI-env=only-npi=yet-crucial_item=_-licensor=0-scope=0-npi_present=1	0		the people will drop by the art galleries at all also this week .
experiment=NPI-env=only-npi=yet-crucial_item=_-licensor=0-scope=0-npi_present=0	1		the people will drop by the art galleries happily also this week .
experiment=NPI-env=only-npi=yet-crucial_item=_-licensor=1-scope=1-npi_present=1	1		only the guys could arrive at the libraries at all this week .
experiment=NPI-env=only-npi=yet-crucial_item=_-licensor=1-scope=1-npi_present=0	1		only the guys could arrive at the libraries angrily this week .
experiment=NPI-env=only-npi=yet-crucial_item=_-licensor=1-scope=0-npi_present=1	0		the guys could arrive at the libraries at all only this week .
experiment=NPI-env=only-npi=yet-crucial_item=_-licensor=1-scope=0-npi_present=0	1		the guys could arrive at the libraries angrily only this week .
experiment=NPI-env=only-npi=yet-crucial_item=_-licensor=0-scope=1-npi_present=1	0		the guys could also arrive at the libraries at all this week .
experiment=NPI-env=only-npi=yet-crucial_item=_-licensor=0-scope=1-npi_present=0	1		the guys could also arrive at the libraries angrily this week .
experiment=NPI-env=only-npi=yet-crucial_item=_-licensor=0-scope=0-npi_present=1	0		the guys could arrive at the libraries at all also this week .
experiment=NPI-env=only-npi=yet-crucial_item=_-licensor=0-scope=0-npi_present=0	1		the guys could arrive at the libraries angrily also this week .
experiment=NPI-env=only-npi=yet-crucial_item=_-licensor=1-scope=1-npi_present=1	1		only the pedestrian should bring the plates at all this week .
experiment=NPI-env=only-npi=yet-crucial_item=_-licensor=1-scope=1-npi_present=0	1		only the pedestrian should bring the plates angrily this week .
experiment=NPI-env=only-npi=yet-crucial_item=_-licensor=1-scope=0-npi_present=1	0		the pedestrian should bring the plates at all only this week .
experiment=NPI-env=only-npi=yet-crucial_item=_-licensor=1-scope=0-npi_present=0	1		the pedestrian should bring the plates angrily only this week .
experiment=NPI-env=only-npi=yet-crucial_item=_-licensor=0-scope=1-npi_present=1	0		the pedestrian should also bring the plates at all this week .
experiment=NPI-env=only-npi=yet-crucial_item=_-licensor=0-scope=1-npi_present=0	1		the pedestrian should also bring the plates angrily this week .
experiment=NPI-env=only-npi=yet-crucial_item=_-licensor=0-scope=0-npi_present=1	0		the pedestrian should bring the plates at all also this week .
experiment=NPI-env=only-npi=yet-crucial_item=_-licensor=0-scope=0-npi_present=0	1		the pedestrian should bring the plates angrily also this week .
experiment=NPI-env=only-npi=yet-crucial_item=_-licensor=1-scope=1-npi_present=1	1		only the boys watch the pedestrians at all sometimes .
experiment=NPI-env=only-npi=yet-crucial_item=_-licensor=1-scope=1-npi_present=0	1		only the boys watch the pedestrians happily sometimes .
experiment=NPI-env=only-npi=yet-crucial_item=_-licensor=1-scope=0-npi_present=1	0		the boys watch the pedestrians at all only sometimes .
experiment=NPI-env=only-npi=yet-crucial_item=_-licensor=1-scope=0-npi_present=0	1		the boys watch the pedestrians happily only sometimes .
experiment=NPI-env=only-npi=yet-crucial_item=_-licensor=0-scope=1-npi_present=1	0		the boys also watch the pedestrians at all sometimes .
experiment=NPI-env=only-npi=yet-crucial_item=_-licensor=0-scope=1-npi_present=0	1		the boys also watch the pedestrians happily sometimes .
experiment=NPI-env=only-npi=yet-crucial_item=_-licensor=0-scope=0-npi_present=1	0		the boys watch the pedestrians at all also sometimes .
experiment=NPI-env=only-npi=yet-crucial_item=_-licensor=0-scope=0-npi_present=0	1		the boys watch the pedestrians happily also sometimes .
experiment=NPI-env=only-npi=yet-crucial_item=_-licensor=1-scope=1-npi_present=1	1		only the actresses helped the patients at all sometimes .
experiment=NPI-env=only-npi=yet-crucial_item=_-licensor=1-scope=1-npi_present=0	1		only the actresses helped the patients appropriately sometimes .
