experiment=NPI-env=sentential_negation_biclausal-npi=any-crucial_item=really-licensor=0-scope=1-npi_present=1	0		these girls had really imagined that any art galleries should resemble the person .
experiment=NPI-env=sentential_negation_biclausal-npi=any-crucial_item=really-licensor=0-scope=1-npi_present=0	1		these girls had really imagined that that art galleries should resemble the person .
experiment=NPI-env=sentential_negation_biclausal-npi=any-crucial_item=really-licensor=0-scope=0-npi_present=1	0		any girls had imagined that that art galleries should really resemble the person .
experiment=NPI-env=sentential_negation_biclausal-npi=any-crucial_item=really-licensor=0-scope=0-npi_present=0	1		these girls had imagined that that art galleries should really resemble the person .
experiment=NPI-env=sentential_negation_biclausal-npi=any-crucial_item=not-licensor=1-scope=1-npi_present=1	1		that drivers have not said that any guys are crying .
experiment=NPI-env=sentential_negation_biclausal-npi=any-crucial_item=not-licensor=1-scope=1-npi_present=0	1		that drivers have not said that those guys are crying .
experiment=NPI-env=sentential_negation_biclausal-npi=any-crucial_item=not-licensor=1-scope=0-npi_present=1	0		any drivers have said that those guys are not crying .
experiment=NPI-env=sentential_negation_biclausal-npi=any-crucial_item=not-licensor=1-scope=0-npi_present=0	1		that drivers have said that those guys are not crying .
experiment=NPI-env=sentential_negation_biclausal-npi=any-crucial_item=really-licensor=0-scope=1-npi_present=1	0		that drivers have really said that any guys are crying .
experiment=NPI-env=sentential_negation_biclausal-npi=any-crucial_item=really-licensor=0-scope=1-npi_present=0	1		that drivers have really said that those guys are crying .
experiment=NPI-env=sentential_negation_biclausal-npi=any-crucial_item=really-licensor=0-scope=0-npi_present=1	0		any drivers have said that those guys are really crying .
experiment=NPI-env=sentential_negation_biclausal-npi=any-crucial_item=really-licensor=0-scope=0-npi_present=0	1		that drivers have said that those guys are really crying .
experiment=NPI-env=sentential_negation_biclausal-npi=any-crucial_item=not-licensor=1-scope=1-npi_present=1	1		the patients were not thinking that any women had surrendered .
experiment=NPI-env=sentential_negation_biclausal-npi=any-crucial_item=not-licensor=1-scope=1-npi_present=0	1		the patients were not thinking that these women had surrendered .
experiment=NPI-env=sentential_negation_biclausal-npi=any-crucial_item=not-licensor=1-scope=0-npi_present=1	0		any patients were thinking that these women had not surrendered .
experiment=NPI-env=sentential_negation_biclausal-npi=any-crucial_item=not-licensor=1-scope=0-npi_present=0	1		the patients were thinking that these women had not surrendered .
experiment=NPI-env=sentential_negation_biclausal-npi=any-crucial_item=really-licensor=0-scope=1-npi_present=1	0		the patients were really thinking that any women had surrendered .
experiment=NPI-env=sentential_negation_biclausal-npi=any-crucial_item=really-licensor=0-scope=1-npi_present=0	1		the patients were really thinking that these women had surrendered .
experiment=NPI-env=sentential_negation_biclausal-npi=any-crucial_item=really-licensor=0-scope=0-npi_present=1	0		any patients were thinking that these women had really surrendered .
experiment=NPI-env=sentential_negation_biclausal-npi=any-crucial_item=really-licensor=0-scope=0-npi_present=0	1		the patients were thinking that these women had really surrendered .
experiment=NPI-env=sentential_negation_biclausal-npi=any-crucial_item=not-licensor=1-scope=1-npi_present=1	1		the waitresses were not explaining that any actresses have gone to the high schools .
experiment=NPI-env=sentential_negation_biclausal-npi=any-crucial_item=not-licensor=1-scope=1-npi_present=0	1		the waitresses were not explaining that those actresses have gone to the high schools .
experiment=NPI-env=sentential_negation_biclausal-npi=any-crucial_item=not-licensor=1-scope=0-npi_present=1	0		any waitresses were explaining that those actresses have not gone to the high schools .
experiment=NPI-env=sentential_negation_biclausal-npi=any-crucial_item=not-licensor=1-scope=0-npi_present=0	1		the waitresses were explaining that those actresses have not gone to the high schools .
experiment=NPI-env=sentential_negation_biclausal-npi=any-crucial_item=really-licensor=0-scope=1-npi_present=1	0		the waitresses were really explaining that any actresses have gone to the high schools .
experiment=NPI-env=sentential_negation_biclausal-npi=any-crucial_item=really-licensor=0-scope=1-npi_present=0	1		the waitresses were really explaining that those actresses have gone to the high schools .
experiment=NPI-env=sentential_negation_biclausal-npi=any-crucial_item=really-licensor=0-scope=0-npi_present=1	0		any waitresses were explaining that those actresses have really gone to the high schools .
experiment=NPI-env=sentential_negation_biclausal-npi=any-crucial_item=really-licensor=0-scope=0-npi_present=0	1		the waitresses were explaining that those actresses have really gone to the high schools .
experiment=NPI-env=sentential_negation_biclausal-npi=any-crucial_item=not-licensor=1-scope=1-npi_present=1	1		the gals had not thought that any museums will resemble the hospitals .
experiment=NPI-env=sentential_negation_biclausal-npi=any-crucial_item=not-licensor=1-scope=1-npi_present=0	1		the gals had not thought that the museums will resemble the hospitals .
experiment=NPI-env=sentential_negation_biclausal-npi=any-crucial_item=not-licensor=1-scope=0-npi_present=1	0		any gals had thought that the museums will not resemble the hospitals .
experiment=NPI-env=sentential_negation_biclausal-npi=any-crucial_item=not-licensor=1-scope=0-npi_present=0	1		the gals had thought that the museums will not resemble the hospitals .
experiment=NPI-env=sentential_negation_biclausal-npi=any-crucial_item=really-licensor=0-scope=1-npi_present=1	0		the gals had really thought that any museums will resemble the hospitals .
experiment=NPI-env=sentential_negation_biclausal-npi=any-crucial_item=really-licensor=0-scope=1-npi_present=0	1		the gals had really thought that the museums will resemble the hospitals .
experiment=NPI-env=sentential_negation_biclausal-npi=any-crucial_item=really-licensor=0-scope=0-npi_present=1	0		any gals had thought that the museums will really resemble the hospitals .
experiment=NPI-env=sentential_negation_biclausal-npi=any-crucial_item=really-licensor=0-scope=0-npi_present=0	1		the gals had thought that the museums will really resemble the hospitals .
experiment=NPI-env=sentential_negation_biclausal-npi=any-crucial_item=not-licensor=1-scope=1-npi_present=1	1		that cashiers are not saying that any teachers were boasting .
experiment=NPI-env=sentential_negation_biclausal-npi=any-crucial_item=not-licensor=1-scope=1-npi_present=0	1		that cashiers are not saying that that teachers were boasting .
experiment=NPI-env=sentential_negation_biclausal-npi=any-crucial_item=not-licensor=1-scope=0-npi_present=1	0		any cashiers are saying that that teachers were not boasting .
experiment=NPI-env=sentential_negation_biclausal-npi=any-crucial_item=not-licensor=1-scope=0-npi_present=0	1		that cashiers are saying that that teachers were not boasting .
experiment=NPI-env=sentential_negation_biclausal-npi=any-crucial_item=really-licensor=0-scope=1-npi_present=1	0		that cashiers are really saying that any teachers were boasting .
experiment=NPI-env=sentential_negation_biclausal-npi=any-crucial_item=really-licensor=0-scope=1-npi_present=0	1		that cashiers are really saying that that teachers were boasting .
experiment=NPI-env=sentential_negation_biclausal-npi=any-crucial_item=really-licensor=0-scope=0-npi_present=1	0		any cashiers are saying that that teachers were really boasting .
experiment=NPI-env=sentential_negation_biclausal-npi=any-crucial_item=really-licensor=0-scope=0-npi_present=0	1		that cashiers are saying that that teachers were really boasting .
experiment=NPI-env=sentential_negation_biclausal-npi=any-crucial_item=not-licensor=1-scope=1-npi_present=1	1		that people were not thinking that any actresses are talking about a waitress .
experiment=NPI-env=sentential_negation_biclausal-npi=any-crucial_item=not-licensor=1-scope=1-npi_present=0	1		that people were not thinking that that actresses are talking about a waitress .
experiment=NPI-env=sentential_negation_biclausal-npi=any-crucial_item=not-licensor=1-scope=0-npi_present=1	0		any people were thinking that that actresses are not talking about a waitress .
experiment=NPI-env=sentential_negation_biclausal-npi=any-crucial_item=not-licensor=1-scope=0-npi_present=0	1		that people were thinking that that actresses are not talking about a waitress .
experiment=NPI-env=sentential_negation_biclausal-npi=any-crucial_item=really-licensor=0-scope=1-npi_present=1	0		that people were really thinking that any actresses are talking about a waitress .
experiment=NPI-env=sentential_negation_biclausal-npi=any-crucial_item=really-licensor=0-scope=1-npi_present=0	1		that people were really thinking that that actresses are talking about a waitress .
experiment=NPI-env=sentential_negation_biclausal-npi=any-crucial_item=really-licensor=0-scope=0-npi_present=1	0		any people were thinking that that actresses are really talking about a waitress .
experiment=NPI-env=sentential_negation_biclausal-npi=any-crucial_item=really-licensor=0-scope=0-npi_present=0	1		that people were thinking that that actresses are really talking about a waitress .
experiment=NPI-env=sentential_negation_biclausal-npi=any-crucial_item=not-licensor=1-scope=1-npi_present=1	1		these teachers were not thinking that any girls had murmured .
experiment=NPI-env=sentential_negation_biclausal-npi=any-crucial_item=not-licensor=1-scope=1-npi_present=0	1		these teachers were not thinking that that girls had murmured .
experiment=NPI-env=sentential_negation_biclausal-npi=any-crucial_item=not-licensor=1-scope=0-npi_present=1	0		any teachers were thinking that that girls had not murmured .
experiment=NPI-env=sentential_negation_biclausal-npi=any-crucial_item=not-licensor=1-scope=0-npi_present=0	1		these teachers were thinking that that girls had not murmured .
experiment=NPI-env=sentential_negation_biclausal-npi=any-crucial_item=really-licensor=0-scope=1-npi_present=1	0		these teachers were really thinking that any girls had murmured .
experiment=NPI-env=sentential_negation_biclausal-npi=any-crucial_item=really-licensor=0-scope=1-npi_present=0	1		these teachers were really thinking that that girls had murmured .
experiment=NPI-env=sentential_negation_biclausal-npi=any-crucial_item=really-licensor=0-scope=0-npi_present=1	0		any teachers were thinking that that girls had really murmured .
experiment=NPI-env=sentential_negation_biclausal-npi=any-crucial_item=really-licensor=0-scope=0-npi_present=0	1		these teachers were thinking that that girls had really murmured .
experiment=NPI-env=sentential_negation_biclausal-npi=any-crucial_item=not-licensor=1-scope=1-npi_present=1	1		these teachers should not imagine that any doctors had talked about the actor .
experiment=NPI-env=sentential_negation_biclausal-npi=any-crucial_item=not-licensor=1-scope=1-npi_present=0	1		these teachers should not imagine that these doctors had talked about the actor .
experiment=NPI-env=sentential_negation_biclausal-npi=any-crucial_item=not-licensor=1-scope=0-npi_present=1	0		any teachers should imagine that these doctors had not talked about the actor .
experiment=NPI-env=sentential_negation_biclausal-npi=any-crucial_item=not-licensor=1-scope=0-npi_present=0	1		these teachers should imagine that these doctors had not talked about the actor .
experiment=NPI-env=sentential_negation_biclausal-npi=any-crucial_item=really-licensor=0-scope=1-npi_present=1	0		these teachers should really imagine that any doctors had talked about the actor .
experiment=NPI-env=sentential_negation_biclausal-npi=any-crucial_item=really-licensor=0-scope=1-npi_present=0	1		these teachers should really imagine that these doctors had talked about the actor .
experiment=NPI-env=sentential_negation_biclausal-npi=any-crucial_item=really-licensor=0-scope=0-npi_present=1	0		any teachers should imagine that these doctors had really talked about the actor .
experiment=NPI-env=sentential_negation_biclausal-npi=any-crucial_item=really-licensor=0-scope=0-npi_present=0	1		these teachers should imagine that these doctors had really talked about the actor .
