experiment=NPI-env=adverbs-npi=any-crucial_item=often-licensor=0-scope=1-npi_present=1	0		the customer who will often return to any gals hugged teachers .
experiment=NPI-env=adverbs-npi=any-crucial_item=often-licensor=0-scope=1-npi_present=0	1		the customer who will often return to those gals hugged teachers .
experiment=NPI-env=adverbs-npi=any-crucial_item=often-licensor=0-scope=0-npi_present=1	0		the customer who will often return to gals hugged any teachers .
experiment=NPI-env=adverbs-npi=any-crucial_item=often-licensor=0-scope=0-npi_present=0	1		the customer who will often return to gals hugged those teachers .
experiment=NPI-env=adverbs-npi=any-crucial_item=barely-licensor=1-scope=1-npi_present=1	1		the customer who will barely return to any gals hugged teachers .
experiment=NPI-env=adverbs-npi=any-crucial_item=barely-licensor=1-scope=1-npi_present=0	1		the customer who will barely return to those gals hugged teachers .
experiment=NPI-env=adverbs-npi=any-crucial_item=barely-licensor=1-scope=0-npi_present=1	0		the customer who will barely return to gals hugged any teachers .
experiment=NPI-env=adverbs-npi=any-crucial_item=barely-licensor=1-scope=0-npi_present=0	1		the customer who will barely return to gals hugged those teachers .
experiment=NPI-env=adverbs-npi=any-crucial_item=always-licensor=0-scope=1-npi_present=1	0		the boy who always dislikes any drivers has insulted museums .
experiment=NPI-env=adverbs-npi=any-crucial_item=always-licensor=0-scope=1-npi_present=0	1		the boy who always dislikes these drivers has insulted museums .
experiment=NPI-env=adverbs-npi=any-crucial_item=always-licensor=0-scope=0-npi_present=1	0		the boy who always dislikes drivers has insulted any museums .
experiment=NPI-env=adverbs-npi=any-crucial_item=always-licensor=0-scope=0-npi_present=0	1		the boy who always dislikes drivers has insulted these museums .
experiment=NPI-env=adverbs-npi=any-crucial_item=seldom-licensor=1-scope=1-npi_present=1	1		the boy who seldom dislikes any drivers has insulted museums .
experiment=NPI-env=adverbs-npi=any-crucial_item=seldom-licensor=1-scope=1-npi_present=0	1		the boy who seldom dislikes these drivers has insulted museums .
experiment=NPI-env=adverbs-npi=any-crucial_item=seldom-licensor=1-scope=0-npi_present=1	0		the boy who seldom dislikes drivers has insulted any museums .
experiment=NPI-env=adverbs-npi=any-crucial_item=seldom-licensor=1-scope=0-npi_present=0	1		the boy who seldom dislikes drivers has insulted these museums .
experiment=NPI-env=adverbs-npi=any-crucial_item=always-licensor=0-scope=1-npi_present=1	0		the student who always explores any high schools might remember teachers .
experiment=NPI-env=adverbs-npi=any-crucial_item=always-licensor=0-scope=1-npi_present=0	1		the student who always explores those high schools might remember teachers .
experiment=NPI-env=adverbs-npi=any-crucial_item=always-licensor=0-scope=0-npi_present=1	0		the student who always explores high schools might remember any teachers .
experiment=NPI-env=adverbs-npi=any-crucial_item=always-licensor=0-scope=0-npi_present=0	1		the student who always explores high schools might remember these teachers .
experiment=NPI-env=adverbs-npi=any-crucial_item=hardly-licensor=1-scope=1-npi_present=1	1		the student who hardly explores any high schools might remember teachers .
experiment=NPI-env=adverbs-npi=any-crucial_item=hardly-licensor=1-scope=1-npi_present=0	1		the student who hardly explores those high schools might remember teachers .
experiment=NPI-env=adverbs-npi=any-crucial_item=hardly-licensor=1-scope=0-npi_present=1	0		the student who hardly explores high schools might remember any teachers .
experiment=NPI-env=adverbs-npi=any-crucial_item=hardly-licensor=1-scope=0-npi_present=0	1		the student who hardly explores high schools might remember these teachers .
experiment=NPI-env=adverbs-npi=any-crucial_item=always-licensor=0-scope=1-npi_present=1	0		the pedestrians who might always boycott any libraries escape from waitresses .
experiment=NPI-env=adverbs-npi=any-crucial_item=always-licensor=0-scope=1-npi_present=0	1		the pedestrians who might always boycott these libraries escape from waitresses .
experiment=NPI-env=adverbs-npi=any-crucial_item=always-licensor=0-scope=0-npi_present=1	0		the pedestrians who might always boycott libraries escape from any waitresses .
experiment=NPI-env=adverbs-npi=any-crucial_item=always-licensor=0-scope=0-npi_present=0	1		the pedestrians who might always boycott libraries escape from those waitresses .
experiment=NPI-env=adverbs-npi=any-crucial_item=barely-licensor=1-scope=1-npi_present=1	1		the pedestrians who might barely boycott any libraries escape from waitresses .
experiment=NPI-env=adverbs-npi=any-crucial_item=barely-licensor=1-scope=1-npi_present=0	1		the pedestrians who might barely boycott these libraries escape from waitresses .
experiment=NPI-env=adverbs-npi=any-crucial_item=barely-licensor=1-scope=0-npi_present=1	0		the pedestrians who might barely boycott libraries escape from any waitresses .
experiment=NPI-env=adverbs-npi=any-crucial_item=barely-licensor=1-scope=0-npi_present=0	1		the pedestrians who might barely boycott libraries escape from those waitresses .
experiment=NPI-env=adverbs-npi=any-crucial_item=always-licensor=0-scope=1-npi_present=1	0		the gals who always bought any shoes know boys .
experiment=NPI-env=adverbs-npi=any-crucial_item=always-licensor=0-scope=1-npi_present=0	1		the gals who always bought the shoes know boys .
experiment=NPI-env=adverbs-npi=any-crucial_item=always-licensor=0-scope=0-npi_present=1	0		the gals who always bought shoes know any boys .
experiment=NPI-env=adverbs-npi=any-crucial_item=always-licensor=0-scope=0-npi_present=0	1		the gals who always bought shoes know those boys .
experiment=NPI-env=adverbs-npi=any-crucial_item=hardly-licensor=1-scope=1-npi_present=1	1		the gals who hardly bought any shoes know boys .
experiment=NPI-env=adverbs-npi=any-crucial_item=hardly-licensor=1-scope=1-npi_present=0	1		the gals who hardly bought the shoes know boys .
experiment=NPI-env=adverbs-npi=any-crucial_item=hardly-licensor=1-scope=0-npi_present=1	0		the gals who hardly bought shoes know any boys .
experiment=NPI-env=adverbs-npi=any-crucial_item=hardly-licensor=1-scope=0-npi_present=0	1		the gals who hardly bought shoes know those boys .
experiment=NPI-env=adverbs-npi=any-crucial_item=sometimes-licensor=0-scope=1-npi_present=1	0		the children who sometimes sell any couches wore pants .
experiment=NPI-env=adverbs-npi=any-crucial_item=sometimes-licensor=0-scope=1-npi_present=0	1		the children who sometimes sell the couches wore pants .
experiment=NPI-env=adverbs-npi=any-crucial_item=sometimes-licensor=0-scope=0-npi_present=1	0		the children who sometimes sell couches wore any pants .
experiment=NPI-env=adverbs-npi=any-crucial_item=sometimes-licensor=0-scope=0-npi_present=0	1		the children who sometimes sell couches wore these pants .
experiment=NPI-env=adverbs-npi=any-crucial_item=rarely-licensor=1-scope=1-npi_present=1	1		the children who rarely sell any couches wore pants .
experiment=NPI-env=adverbs-npi=any-crucial_item=rarely-licensor=1-scope=1-npi_present=0	1		the children who rarely sell the couches wore pants .
experiment=NPI-env=adverbs-npi=any-crucial_item=rarely-licensor=1-scope=0-npi_present=1	0		the children who rarely sell couches wore any pants .
experiment=NPI-env=adverbs-npi=any-crucial_item=rarely-licensor=1-scope=0-npi_present=0	1		the children who rarely sell couches wore these pants .
experiment=NPI-env=adverbs-npi=any-crucial_item=often-licensor=0-scope=1-npi_present=1	0		the human who often observes any boys investigated guys .
experiment=NPI-env=adverbs-npi=any-crucial_item=often-licensor=0-scope=1-npi_present=0	1		the human who often observes these boys investigated guys .
experiment=NPI-env=adverbs-npi=any-crucial_item=often-licensor=0-scope=0-npi_present=1	0		the human who often observes boys investigated any guys .
experiment=NPI-env=adverbs-npi=any-crucial_item=often-licensor=0-scope=0-npi_present=0	1		the human who often observes boys investigated those guys .
experiment=NPI-env=adverbs-npi=any-crucial_item=rarely-licensor=1-scope=1-npi_present=1	1		the human who rarely observes any boys investigated guys .
experiment=NPI-env=adverbs-npi=any-crucial_item=rarely-licensor=1-scope=1-npi_present=0	1		the human who rarely observes these boys investigated guys .
experiment=NPI-env=adverbs-npi=any-crucial_item=rarely-licensor=1-scope=0-npi_present=1	0		the human who rarely observes boys investigated any guys .
experiment=NPI-env=adverbs-npi=any-crucial_item=rarely-licensor=1-scope=0-npi_present=0	1		the human who rarely observes boys investigated those guys .
experiment=NPI-env=adverbs-npi=any-crucial_item=always-licensor=0-scope=1-npi_present=1	0		the students who should always admire any ladies lift cups .
experiment=NPI-env=adverbs-npi=any-crucial_item=always-licensor=0-scope=1-npi_present=0	1		the students who should always admire the ladies lift cups .
experiment=NPI-env=adverbs-npi=any-crucial_item=always-licensor=0-scope=0-npi_present=1	0		the students who should always admire ladies lift any cups .
experiment=NPI-env=adverbs-npi=any-crucial_item=always-licensor=0-scope=0-npi_present=0	1		the students who should always admire ladies lift the cups .
experiment=NPI-env=adverbs-npi=any-crucial_item=hardly-licensor=1-scope=1-npi_present=1	1		the students who should hardly admire any ladies lift cups .
experiment=NPI-env=adverbs-npi=any-crucial_item=hardly-licensor=1-scope=1-npi_present=0	1		the students who should hardly admire the ladies lift cups .
experiment=NPI-env=adverbs-npi=any-crucial_item=hardly-licensor=1-scope=0-npi_present=1	0		the students who should hardly admire ladies lift any cups .
experiment=NPI-env=adverbs-npi=any-crucial_item=hardly-licensor=1-scope=0-npi_present=0	1		the students who should hardly admire ladies lift the cups .
experiment=NPI-env=adverbs-npi=any-crucial_item=always-licensor=0-scope=1-npi_present=1	0		the humans who could always go to any malls disliked essays .
experiment=NPI-env=adverbs-npi=any-crucial_item=always-licensor=0-scope=1-npi_present=0	1		the humans who could always go to the malls disliked essays .
experiment=NPI-env=adverbs-npi=any-crucial_item=always-licensor=0-scope=0-npi_present=1	0		the humans who could always go to malls disliked any essays .
experiment=NPI-env=adverbs-npi=any-crucial_item=always-licensor=0-scope=0-npi_present=0	1		the humans who could always go to malls disliked these essays .
experiment=NPI-env=adverbs-npi=any-crucial_item=hardly-licensor=1-scope=1-npi_present=1	1		the humans who could hardly go to any malls disliked essays .
experiment=NPI-env=adverbs-npi=any-crucial_item=hardly-licensor=1-scope=1-npi_present=0	1		the humans who could hardly go to the malls disliked essays .
experiment=NPI-env=adverbs-npi=any-crucial_item=hardly-licensor=1-scope=0-npi_present=1	0		the humans who could hardly go to malls disliked any essays .
experiment=NPI-env=adverbs-npi=any-crucial_item=hardly-licensor=1-scope=0-npi_present=0	1		the humans who could hardly go to malls disliked these essays .
experiment=NPI-env=adverbs-npi=any-crucial_item=often-licensor=0-scope=1-npi_present=1	0		the person who often goes to any schools sold cars .
experiment=NPI-env=adverbs-npi=any-crucial_item=often-licensor=0-scope=1-npi_present=0	1		the person who often goes to those schools sold cars .
experiment=NPI-env=adverbs-npi=any-crucial_item=often-licensor=0-scope=0-npi_present=1	0		the person who often goes to schools sold any cars .
experiment=NPI-env=adverbs-npi=any-crucial_item=often-licensor=0-scope=0-npi_present=0	1		the person who often goes to schools sold these cars .
experiment=NPI-env=adverbs-npi=any-crucial_item=rarely-licensor=1-scope=1-npi_present=1	1		the person who rarely goes to any schools sold cars .
experiment=NPI-env=adverbs-npi=any-crucial_item=rarely-licensor=1-scope=1-npi_present=0	1		the person who rarely goes to those schools sold cars .
experiment=NPI-env=adverbs-npi=any-crucial_item=rarely-licensor=1-scope=0-npi_present=1	0		the person who rarely goes to schools sold any cars .
experiment=NPI-env=adverbs-npi=any-crucial_item=rarely-licensor=1-scope=0-npi_present=0	1		the person who rarely goes to schools sold these cars .
experiment=NPI-env=adverbs-npi=any-crucial_item=sometimes-licensor=0-scope=1-npi_present=1	0		a waiter who had sometimes attacked any ladies disliked gals .
experiment=NPI-env=adverbs-npi=any-crucial_item=sometimes-licensor=0-scope=1-npi_present=0	1		a waiter who had sometimes attacked the ladies disliked gals .
experiment=NPI-env=adverbs-npi=any-crucial_item=sometimes-licensor=0-scope=0-npi_present=1	0		a waiter who had sometimes attacked ladies disliked any gals .
experiment=NPI-env=adverbs-npi=any-crucial_item=sometimes-licensor=0-scope=0-npi_present=0	1		a waiter who had sometimes attacked ladies disliked the gals .
experiment=NPI-env=adverbs-npi=any-crucial_item=rarely-licensor=1-scope=1-npi_present=1	1		a waiter who had rarely attacked any ladies disliked gals .
experiment=NPI-env=adverbs-npi=any-crucial_item=rarely-licensor=1-scope=1-npi_present=0	1		a waiter who had rarely attacked the ladies disliked gals .
experiment=NPI-env=adverbs-npi=any-crucial_item=rarely-licensor=1-scope=0-npi_present=1	0		a waiter who had rarely attacked ladies disliked any gals .
experiment=NPI-env=adverbs-npi=any-crucial_item=rarely-licensor=1-scope=0-npi_present=0	1		a waiter who had rarely attacked ladies disliked the gals .
experiment=NPI-env=adverbs-npi=any-crucial_item=sometimes-licensor=0-scope=1-npi_present=1	0		a gal who should sometimes resemble any gloves fled from teenagers .
experiment=NPI-env=adverbs-npi=any-crucial_item=sometimes-licensor=0-scope=1-npi_present=0	1		a gal who should sometimes resemble those gloves fled from teenagers .
experiment=NPI-env=adverbs-npi=any-crucial_item=sometimes-licensor=0-scope=0-npi_present=1	0		a gal who should sometimes resemble gloves fled from any teenagers .
experiment=NPI-env=adverbs-npi=any-crucial_item=sometimes-licensor=0-scope=0-npi_present=0	1		a gal who should sometimes resemble gloves fled from these teenagers .
experiment=NPI-env=adverbs-npi=any-crucial_item=rarely-licensor=1-scope=1-npi_present=1	1		a gal who should rarely resemble any gloves fled from teenagers .
experiment=NPI-env=adverbs-npi=any-crucial_item=rarely-licensor=1-scope=1-npi_present=0	1		a gal who should rarely resemble those gloves fled from teenagers .
experiment=NPI-env=adverbs-npi=any-crucial_item=rarely-licensor=1-scope=0-npi_present=1	0		a gal who should rarely resemble gloves fled from any teenagers .
experiment=NPI-env=adverbs-npi=any-crucial_item=rarely-licensor=1-scope=0-npi_present=0	1		a gal who should rarely resemble gloves fled from these teenagers .
experiment=NPI-env=adverbs-npi=any-crucial_item=sometimes-licensor=0-scope=1-npi_present=1	0		the children who have sometimes kissed any waitresses kissed actors .
experiment=NPI-env=adverbs-npi=any-crucial_item=sometimes-licensor=0-scope=1-npi_present=0	1		the children who have sometimes kissed the waitresses kissed actors .
experiment=NPI-env=adverbs-npi=any-crucial_item=sometimes-licensor=0-scope=0-npi_present=1	0		the children who have sometimes kissed waitresses kissed any actors .
experiment=NPI-env=adverbs-npi=any-crucial_item=sometimes-licensor=0-scope=0-npi_present=0	1		the children who have sometimes kissed waitresses kissed these actors .
experiment=NPI-env=adverbs-npi=any-crucial_item=scarcely-licensor=1-scope=1-npi_present=1	1		the children who have scarcely kissed any waitresses kissed actors .
experiment=NPI-env=adverbs-npi=any-crucial_item=scarcely-licensor=1-scope=1-npi_present=0	1		the children who have scarcely kissed the waitresses kissed actors .
experiment=NPI-env=adverbs-npi=any-crucial_item=scarcely-licensor=1-scope=0-npi_present=1	0		the children who have scarcely kissed waitresses kissed any actors .
experiment=NPI-env=adverbs-npi=any-crucial_item=scarcely-licensor=1-scope=0-npi_present=0	1		the children who have scarcely kissed waitresses kissed these actors .
experiment=NPI-env=adverbs-npi=any-crucial_item=always-licensor=0-scope=1-npi_present=1	0		the adults who have always worked with any customers could have plates .
experiment=NPI-env=adverbs-npi=any-crucial_item=always-licensor=0-scope=1-npi_present=0	1		the adults who have always worked with those customers could have plates .
experiment=NPI-env=adverbs-npi=any-crucial_item=always-licensor=0-scope=0-npi_present=1	0		the adults who have always worked with customers could have any plates .
experiment=NPI-env=adverbs-npi=any-crucial_item=always-licensor=0-scope=0-npi_present=0	1		the adults who have always worked with customers could have these plates .
experiment=NPI-env=adverbs-npi=any-crucial_item=rarely-licensor=1-scope=1-npi_present=1	1		the adults who have rarely worked with any customers could have plates .
experiment=NPI-env=adverbs-npi=any-crucial_item=rarely-licensor=1-scope=1-npi_present=0	1		the adults who have rarely worked with those customers could have plates .
experiment=NPI-env=adverbs-npi=any-crucial_item=rarely-licensor=1-scope=0-npi_present=1	0		the adults who have rarely worked with customers could have any plates .
experiment=NPI-env=adverbs-npi=any-crucial_item=rarely-licensor=1-scope=0-npi_present=0	1		the adults who have rarely worked with customers could have these plates .
experiment=NPI-env=adverbs-npi=any-crucial_item=always-licensor=0-scope=1-npi_present=1	0		the children who always observed any patients had skated around malls .
experiment=NPI-env=adverbs-npi=any-crucial_item=always-licensor=0-scope=1-npi_present=0	1		the children who always observed the patients had skated around malls .
experiment=NPI-env=adverbs-npi=any-crucial_item=always-licensor=0-scope=0-npi_present=1	0		the children who always observed patients had skated around any malls .
experiment=NPI-env=adverbs-npi=any-crucial_item=always-licensor=0-scope=0-npi_present=0	1		the children who always observed patients had skated around these malls .
experiment=NPI-env=adverbs-npi=any-crucial_item=rarely-licensor=1-scope=1-npi_present=1	1		the children who rarely observed any patients had skated around malls .
experiment=NPI-env=adverbs-npi=any-crucial_item=rarely-licensor=1-scope=1-npi_present=0	1		the children who rarely observed the patients had skated around malls .
experiment=NPI-env=adverbs-npi=any-crucial_item=rarely-licensor=1-scope=0-npi_present=1	0		the children who rarely observed patients had skated around any malls .
experiment=NPI-env=adverbs-npi=any-crucial_item=rarely-licensor=1-scope=0-npi_present=0	1		the children who rarely observed patients had skated around these malls .
experiment=NPI-env=adverbs-npi=any-crucial_item=sometimes-licensor=0-scope=1-npi_present=1	0		the children who sometimes respect any restaurants examined reports .
experiment=NPI-env=adverbs-npi=any-crucial_item=sometimes-licensor=0-scope=1-npi_present=0	1		the children who sometimes respect the restaurants examined reports .
experiment=NPI-env=adverbs-npi=any-crucial_item=sometimes-licensor=0-scope=0-npi_present=1	0		the children who sometimes respect restaurants examined any reports .
experiment=NPI-env=adverbs-npi=any-crucial_item=sometimes-licensor=0-scope=0-npi_present=0	1		the children who sometimes respect restaurants examined those reports .
experiment=NPI-env=adverbs-npi=any-crucial_item=rarely-licensor=1-scope=1-npi_present=1	1		the children who rarely respect any restaurants examined reports .
experiment=NPI-env=adverbs-npi=any-crucial_item=rarely-licensor=1-scope=1-npi_present=0	1		the children who rarely respect the restaurants examined reports .
experiment=NPI-env=adverbs-npi=any-crucial_item=rarely-licensor=1-scope=0-npi_present=1	0		the children who rarely respect restaurants examined any reports .
experiment=NPI-env=adverbs-npi=any-crucial_item=rarely-licensor=1-scope=0-npi_present=0	1		the children who rarely respect restaurants examined those reports .
experiment=NPI-env=adverbs-npi=any-crucial_item=often-licensor=0-scope=1-npi_present=1	0		a cashier who has often admired any teachers should kiss men .
experiment=NPI-env=adverbs-npi=any-crucial_item=often-licensor=0-scope=1-npi_present=0	1		a cashier who has often admired these teachers should kiss men .
experiment=NPI-env=adverbs-npi=any-crucial_item=often-licensor=0-scope=0-npi_present=1	0		a cashier who has often admired teachers should kiss any men .
experiment=NPI-env=adverbs-npi=any-crucial_item=often-licensor=0-scope=0-npi_present=0	1		a cashier who has often admired teachers should kiss the men .
experiment=NPI-env=adverbs-npi=any-crucial_item=seldom-licensor=1-scope=1-npi_present=1	1		a cashier who has seldom admired any teachers should kiss men .
experiment=NPI-env=adverbs-npi=any-crucial_item=seldom-licensor=1-scope=1-npi_present=0	1		a cashier who has seldom admired these teachers should kiss men .
experiment=NPI-env=adverbs-npi=any-crucial_item=seldom-licensor=1-scope=0-npi_present=1	0		a cashier who has seldom admired teachers should kiss any men .
experiment=NPI-env=adverbs-npi=any-crucial_item=seldom-licensor=1-scope=0-npi_present=0	1		a cashier who has seldom admired teachers should kiss the men .
experiment=NPI-env=adverbs-npi=any-crucial_item=often-licensor=0-scope=1-npi_present=1	0		a guy who often does resemble any college campuses flees from hospitals .
experiment=NPI-env=adverbs-npi=any-crucial_item=often-licensor=0-scope=1-npi_present=0	1		a guy who often does resemble the college campuses flees from hospitals .
experiment=NPI-env=adverbs-npi=any-crucial_item=often-licensor=0-scope=0-npi_present=1	0		a guy who often does resemble college campuses flees from any hospitals .
experiment=NPI-env=adverbs-npi=any-crucial_item=often-licensor=0-scope=0-npi_present=0	1		a guy who often does resemble college campuses flees from these hospitals .
experiment=NPI-env=adverbs-npi=any-crucial_item=barely-licensor=1-scope=1-npi_present=1	1		a guy who barely does resemble any college campuses flees from hospitals .
experiment=NPI-env=adverbs-npi=any-crucial_item=barely-licensor=1-scope=1-npi_present=0	1		a guy who barely does resemble the college campuses flees from hospitals .
experiment=NPI-env=adverbs-npi=any-crucial_item=barely-licensor=1-scope=0-npi_present=1	0		a guy who barely does resemble college campuses flees from any hospitals .
experiment=NPI-env=adverbs-npi=any-crucial_item=barely-licensor=1-scope=0-npi_present=0	1		a guy who barely does resemble college campuses flees from these hospitals .
experiment=NPI-env=adverbs-npi=any-crucial_item=often-licensor=0-scope=1-npi_present=1	0		the human who could often have any books references teachers .
experiment=NPI-env=adverbs-npi=any-crucial_item=often-licensor=0-scope=1-npi_present=0	1		the human who could often have those books references teachers .
experiment=NPI-env=adverbs-npi=any-crucial_item=often-licensor=0-scope=0-npi_present=1	0		the human who could often have books references any teachers .
experiment=NPI-env=adverbs-npi=any-crucial_item=often-licensor=0-scope=0-npi_present=0	1		the human who could often have books references these teachers .
experiment=NPI-env=adverbs-npi=any-crucial_item=scarcely-licensor=1-scope=1-npi_present=1	1		the human who could scarcely have any books references teachers .
experiment=NPI-env=adverbs-npi=any-crucial_item=scarcely-licensor=1-scope=1-npi_present=0	1		the human who could scarcely have those books references teachers .
experiment=NPI-env=adverbs-npi=any-crucial_item=scarcely-licensor=1-scope=0-npi_present=1	0		the human who could scarcely have books references any teachers .
experiment=NPI-env=adverbs-npi=any-crucial_item=scarcely-licensor=1-scope=0-npi_present=0	1		the human who could scarcely have books references these teachers .
experiment=NPI-env=adverbs-npi=any-crucial_item=always-licensor=0-scope=1-npi_present=1	0		a teenager who always hated any ladies has gone to restaurants .
experiment=NPI-env=adverbs-npi=any-crucial_item=always-licensor=0-scope=1-npi_present=0	1		a teenager who always hated these ladies has gone to restaurants .
experiment=NPI-env=adverbs-npi=any-crucial_item=always-licensor=0-scope=0-npi_present=1	0		a teenager who always hated ladies has gone to any restaurants .
experiment=NPI-env=adverbs-npi=any-crucial_item=always-licensor=0-scope=0-npi_present=0	1		a teenager who always hated ladies has gone to the restaurants .
experiment=NPI-env=adverbs-npi=any-crucial_item=hardly-licensor=1-scope=1-npi_present=1	1		a teenager who hardly hated any ladies has gone to restaurants .
experiment=NPI-env=adverbs-npi=any-crucial_item=hardly-licensor=1-scope=1-npi_present=0	1		a teenager who hardly hated these ladies has gone to restaurants .
experiment=NPI-env=adverbs-npi=any-crucial_item=hardly-licensor=1-scope=0-npi_present=1	0		a teenager who hardly hated ladies has gone to any restaurants .
experiment=NPI-env=adverbs-npi=any-crucial_item=hardly-licensor=1-scope=0-npi_present=0	1		a teenager who hardly hated ladies has gone to the restaurants .
experiment=NPI-env=adverbs-npi=any-crucial_item=sometimes-licensor=0-scope=1-npi_present=1	0		the gals who sometimes tour any hospitals will exit hospitals .
experiment=NPI-env=adverbs-npi=any-crucial_item=sometimes-licensor=0-scope=1-npi_present=0	1		the gals who sometimes tour the hospitals will exit hospitals .
experiment=NPI-env=adverbs-npi=any-crucial_item=sometimes-licensor=0-scope=0-npi_present=1	0		the gals who sometimes tour hospitals will exit any hospitals .
experiment=NPI-env=adverbs-npi=any-crucial_item=sometimes-licensor=0-scope=0-npi_present=0	1		the gals who sometimes tour hospitals will exit the hospitals .
experiment=NPI-env=adverbs-npi=any-crucial_item=barely-licensor=1-scope=1-npi_present=1	1		the gals who barely tour any hospitals will exit hospitals .
