experiment=NPI-env=adverbs-npi=ever-crucial_item=always-licensor=0-scope=1-npi_present=1	0		a waiter always ever thinks that the actor reacts .
experiment=NPI-env=adverbs-npi=ever-crucial_item=always-licensor=0-scope=1-npi_present=0	1		a waiter always obviously thinks that the actor reacts .
experiment=NPI-env=adverbs-npi=ever-crucial_item=always-licensor=0-scope=0-npi_present=1	0		a waiter always thinks that the actor ever reacts .
experiment=NPI-env=adverbs-npi=ever-crucial_item=always-licensor=0-scope=0-npi_present=0	1		a waiter always thinks that the actor obviously reacts .
experiment=NPI-env=adverbs-npi=ever-crucial_item=seldom-licensor=1-scope=1-npi_present=1	1		a waiter seldom ever thinks that the actor reacts .
experiment=NPI-env=adverbs-npi=ever-crucial_item=seldom-licensor=1-scope=1-npi_present=0	1		a waiter seldom obviously thinks that the actor reacts .
experiment=NPI-env=adverbs-npi=ever-crucial_item=seldom-licensor=1-scope=0-npi_present=1	0		a waiter seldom thinks that the actor ever reacts .
experiment=NPI-env=adverbs-npi=ever-crucial_item=seldom-licensor=1-scope=0-npi_present=0	1		a waiter seldom thinks that the actor obviously reacts .
experiment=NPI-env=adverbs-npi=ever-crucial_item=often-licensor=0-scope=1-npi_present=1	0		an adult often ever thought that the cashiers have wept .
experiment=NPI-env=adverbs-npi=ever-crucial_item=often-licensor=0-scope=1-npi_present=0	1		an adult often obviously thought that the cashiers have wept .
experiment=NPI-env=adverbs-npi=ever-crucial_item=often-licensor=0-scope=0-npi_present=1	0		an adult often thought that the cashiers have ever wept .
experiment=NPI-env=adverbs-npi=ever-crucial_item=often-licensor=0-scope=0-npi_present=0	1		an adult often thought that the cashiers have obviously wept .
experiment=NPI-env=adverbs-npi=ever-crucial_item=barely-licensor=1-scope=1-npi_present=1	1		an adult barely ever thought that the cashiers have wept .
experiment=NPI-env=adverbs-npi=ever-crucial_item=barely-licensor=1-scope=1-npi_present=0	1		an adult barely obviously thought that the cashiers have wept .
experiment=NPI-env=adverbs-npi=ever-crucial_item=barely-licensor=1-scope=0-npi_present=1	0		an adult barely thought that the cashiers have ever wept .
experiment=NPI-env=adverbs-npi=ever-crucial_item=barely-licensor=1-scope=0-npi_present=0	1		an adult barely thought that the cashiers have obviously wept .
experiment=NPI-env=adverbs-npi=ever-crucial_item=sometimes-licensor=0-scope=1-npi_present=1	0		the doctors sometimes ever imagined that the ladies have worried .
experiment=NPI-env=adverbs-npi=ever-crucial_item=sometimes-licensor=0-scope=1-npi_present=0	1		the doctors sometimes often imagined that the ladies have worried .
experiment=NPI-env=adverbs-npi=ever-crucial_item=sometimes-licensor=0-scope=0-npi_present=1	0		the doctors sometimes imagined that the ladies have ever worried .
experiment=NPI-env=adverbs-npi=ever-crucial_item=sometimes-licensor=0-scope=0-npi_present=0	1		the doctors sometimes imagined that the ladies have often worried .
experiment=NPI-env=adverbs-npi=ever-crucial_item=hardly-licensor=1-scope=1-npi_present=1	1		the doctors hardly ever imagined that the ladies have worried .
experiment=NPI-env=adverbs-npi=ever-crucial_item=hardly-licensor=1-scope=1-npi_present=0	1		the doctors hardly often imagined that the ladies have worried .
experiment=NPI-env=adverbs-npi=ever-crucial_item=hardly-licensor=1-scope=0-npi_present=1	0		the doctors hardly imagined that the ladies have ever worried .
experiment=NPI-env=adverbs-npi=ever-crucial_item=hardly-licensor=1-scope=0-npi_present=0	1		the doctors hardly imagined that the ladies have often worried .
experiment=NPI-env=adverbs-npi=ever-crucial_item=always-licensor=0-scope=1-npi_present=1	0		the teenager always ever said that a girl has taken the fork .
experiment=NPI-env=adverbs-npi=ever-crucial_item=always-licensor=0-scope=1-npi_present=0	1		the teenager always fortunately said that a girl has taken the fork .
experiment=NPI-env=adverbs-npi=ever-crucial_item=always-licensor=0-scope=0-npi_present=1	0		the teenager always said that a girl has ever taken the fork .
experiment=NPI-env=adverbs-npi=ever-crucial_item=always-licensor=0-scope=0-npi_present=0	1		the teenager always said that a girl has fortunately taken the fork .
experiment=NPI-env=adverbs-npi=ever-crucial_item=rarely-licensor=1-scope=1-npi_present=1	1		the teenager rarely ever said that a girl has taken the fork .
experiment=NPI-env=adverbs-npi=ever-crucial_item=rarely-licensor=1-scope=1-npi_present=0	1		the teenager rarely fortunately said that a girl has taken the fork .
experiment=NPI-env=adverbs-npi=ever-crucial_item=rarely-licensor=1-scope=0-npi_present=1	0		the teenager rarely said that a girl has ever taken the fork .
experiment=NPI-env=adverbs-npi=ever-crucial_item=rarely-licensor=1-scope=0-npi_present=0	1		the teenager rarely said that a girl has fortunately taken the fork .
experiment=NPI-env=adverbs-npi=ever-crucial_item=sometimes-licensor=0-scope=1-npi_present=1	0		the actors sometimes ever explain that the guests took the fork .
experiment=NPI-env=adverbs-npi=ever-crucial_item=sometimes-licensor=0-scope=1-npi_present=0	1		the actors sometimes often explain that the guests took the fork .
experiment=NPI-env=adverbs-npi=ever-crucial_item=sometimes-licensor=0-scope=0-npi_present=1	0		the actors sometimes explain that the guests ever took the fork .
experiment=NPI-env=adverbs-npi=ever-crucial_item=sometimes-licensor=0-scope=0-npi_present=0	1		the actors sometimes explain that the guests often took the fork .
experiment=NPI-env=adverbs-npi=ever-crucial_item=seldom-licensor=1-scope=1-npi_present=1	1		the actors seldom ever explain that the guests took the fork .
experiment=NPI-env=adverbs-npi=ever-crucial_item=seldom-licensor=1-scope=1-npi_present=0	1		the actors seldom often explain that the guests took the fork .
experiment=NPI-env=adverbs-npi=ever-crucial_item=seldom-licensor=1-scope=0-npi_present=1	0		the actors seldom explain that the guests ever took the fork .
experiment=NPI-env=adverbs-npi=ever-crucial_item=seldom-licensor=1-scope=0-npi_present=0	1		the actors seldom explain that the guests often took the fork .
experiment=NPI-env=adverbs-npi=ever-crucial_item=often-licensor=0-scope=1-npi_present=1	0		the gals often ever said that the actor does break a book .
experiment=NPI-env=adverbs-npi=ever-crucial_item=often-licensor=0-scope=1-npi_present=0	1		the gals often obviously said that the actor does break a book .
experiment=NPI-env=adverbs-npi=ever-crucial_item=often-licensor=0-scope=0-npi_present=1	0		the gals often said that the actor ever does break a book .
experiment=NPI-env=adverbs-npi=ever-crucial_item=often-licensor=0-scope=0-npi_present=0	1		the gals often said that the actor obviously does break a book .
experiment=NPI-env=adverbs-npi=ever-crucial_item=hardly-licensor=1-scope=1-npi_present=1	1		the gals hardly ever said that the actor does break a book .
experiment=NPI-env=adverbs-npi=ever-crucial_item=hardly-licensor=1-scope=1-npi_present=0	1		the gals hardly obviously said that the actor does break a book .
experiment=NPI-env=adverbs-npi=ever-crucial_item=hardly-licensor=1-scope=0-npi_present=1	0		the gals hardly said that the actor ever does break a book .
experiment=NPI-env=adverbs-npi=ever-crucial_item=hardly-licensor=1-scope=0-npi_present=0	1		the gals hardly said that the actor obviously does break a book .
experiment=NPI-env=adverbs-npi=ever-crucial_item=always-licensor=0-scope=1-npi_present=1	0		the waitresses always ever imagine that a teenager talked to a guest .
experiment=NPI-env=adverbs-npi=ever-crucial_item=always-licensor=0-scope=1-npi_present=0	1		the waitresses always often imagine that a teenager talked to a guest .
experiment=NPI-env=adverbs-npi=ever-crucial_item=always-licensor=0-scope=0-npi_present=1	0		the waitresses always imagine that a teenager ever talked to a guest .
experiment=NPI-env=adverbs-npi=ever-crucial_item=always-licensor=0-scope=0-npi_present=0	1		the waitresses always imagine that a teenager often talked to a guest .
experiment=NPI-env=adverbs-npi=ever-crucial_item=seldom-licensor=1-scope=1-npi_present=1	1		the waitresses seldom ever imagine that a teenager talked to a guest .
experiment=NPI-env=adverbs-npi=ever-crucial_item=seldom-licensor=1-scope=1-npi_present=0	1		the waitresses seldom often imagine that a teenager talked to a guest .
experiment=NPI-env=adverbs-npi=ever-crucial_item=seldom-licensor=1-scope=0-npi_present=1	0		the waitresses seldom imagine that a teenager ever talked to a guest .
experiment=NPI-env=adverbs-npi=ever-crucial_item=seldom-licensor=1-scope=0-npi_present=0	1		the waitresses seldom imagine that a teenager often talked to a guest .
experiment=NPI-env=adverbs-npi=ever-crucial_item=often-licensor=0-scope=1-npi_present=1	0		the teenagers often ever say that the students have taken the dishes .
experiment=NPI-env=adverbs-npi=ever-crucial_item=often-licensor=0-scope=1-npi_present=0	1		the teenagers often fortunately say that the students have taken the dishes .
experiment=NPI-env=adverbs-npi=ever-crucial_item=often-licensor=0-scope=0-npi_present=1	0		the teenagers often say that the students have ever taken the dishes .
experiment=NPI-env=adverbs-npi=ever-crucial_item=often-licensor=0-scope=0-npi_present=0	1		the teenagers often say that the students have fortunately taken the dishes .
experiment=NPI-env=adverbs-npi=ever-crucial_item=rarely-licensor=1-scope=1-npi_present=1	1		the teenagers rarely ever say that the students have taken the dishes .
experiment=NPI-env=adverbs-npi=ever-crucial_item=rarely-licensor=1-scope=1-npi_present=0	1		the teenagers rarely fortunately say that the students have taken the dishes .
experiment=NPI-env=adverbs-npi=ever-crucial_item=rarely-licensor=1-scope=0-npi_present=1	0		the teenagers rarely say that the students have ever taken the dishes .
experiment=NPI-env=adverbs-npi=ever-crucial_item=rarely-licensor=1-scope=0-npi_present=0	1		the teenagers rarely say that the students have fortunately taken the dishes .
experiment=NPI-env=adverbs-npi=ever-crucial_item=often-licensor=0-scope=1-npi_present=1	0		the gals often ever imagine that the man might discuss the banks .
experiment=NPI-env=adverbs-npi=ever-crucial_item=often-licensor=0-scope=1-npi_present=0	1		the gals often obviously imagine that the man might discuss the banks .
experiment=NPI-env=adverbs-npi=ever-crucial_item=often-licensor=0-scope=0-npi_present=1	0		the gals often imagine that the man might ever discuss the banks .
experiment=NPI-env=adverbs-npi=ever-crucial_item=often-licensor=0-scope=0-npi_present=0	1		the gals often imagine that the man might obviously discuss the banks .
experiment=NPI-env=adverbs-npi=ever-crucial_item=rarely-licensor=1-scope=1-npi_present=1	1		the gals rarely ever imagine that the man might discuss the banks .
experiment=NPI-env=adverbs-npi=ever-crucial_item=rarely-licensor=1-scope=1-npi_present=0	1		the gals rarely obviously imagine that the man might discuss the banks .
experiment=NPI-env=adverbs-npi=ever-crucial_item=rarely-licensor=1-scope=0-npi_present=1	0		the gals rarely imagine that the man might ever discuss the banks .
experiment=NPI-env=adverbs-npi=ever-crucial_item=rarely-licensor=1-scope=0-npi_present=0	1		the gals rarely imagine that the man might obviously discuss the banks .
experiment=NPI-env=adverbs-npi=ever-crucial_item=often-licensor=0-scope=1-npi_present=1	0		the women often ever imagine that the waiters worked with an adult .
experiment=NPI-env=adverbs-npi=ever-crucial_item=often-licensor=0-scope=1-npi_present=0	1		the women often obviously imagine that the waiters worked with an adult .
experiment=NPI-env=adverbs-npi=ever-crucial_item=often-licensor=0-scope=0-npi_present=1	0		the women often imagine that the waiters ever worked with an adult .
experiment=NPI-env=adverbs-npi=ever-crucial_item=often-licensor=0-scope=0-npi_present=0	1		the women often imagine that the waiters obviously worked with an adult .
experiment=NPI-env=adverbs-npi=ever-crucial_item=rarely-licensor=1-scope=1-npi_present=1	1		the women rarely ever imagine that the waiters worked with an adult .
experiment=NPI-env=adverbs-npi=ever-crucial_item=rarely-licensor=1-scope=1-npi_present=0	1		the women rarely obviously imagine that the waiters worked with an adult .
experiment=NPI-env=adverbs-npi=ever-crucial_item=rarely-licensor=1-scope=0-npi_present=1	0		the women rarely imagine that the waiters ever worked with an adult .
experiment=NPI-env=adverbs-npi=ever-crucial_item=rarely-licensor=1-scope=0-npi_present=0	1		the women rarely imagine that the waiters obviously worked with an adult .
experiment=NPI-env=adverbs-npi=ever-crucial_item=often-licensor=0-scope=1-npi_present=1	0		an actress often ever said that the humans visited the actress .
experiment=NPI-env=adverbs-npi=ever-crucial_item=often-licensor=0-scope=1-npi_present=0	1		an actress often obviously said that the humans visited the actress .
experiment=NPI-env=adverbs-npi=ever-crucial_item=often-licensor=0-scope=0-npi_present=1	0		an actress often said that the humans ever visited the actress .
experiment=NPI-env=adverbs-npi=ever-crucial_item=often-licensor=0-scope=0-npi_present=0	1		an actress often said that the humans obviously visited the actress .
experiment=NPI-env=adverbs-npi=ever-crucial_item=barely-licensor=1-scope=1-npi_present=1	1		an actress barely ever said that the humans visited the actress .
experiment=NPI-env=adverbs-npi=ever-crucial_item=barely-licensor=1-scope=1-npi_present=0	1		an actress barely obviously said that the humans visited the actress .
experiment=NPI-env=adverbs-npi=ever-crucial_item=barely-licensor=1-scope=0-npi_present=1	0		an actress barely said that the humans ever visited the actress .
experiment=NPI-env=adverbs-npi=ever-crucial_item=barely-licensor=1-scope=0-npi_present=0	1		an actress barely said that the humans obviously visited the actress .
experiment=NPI-env=adverbs-npi=ever-crucial_item=always-licensor=0-scope=1-npi_present=1	0		the humans always ever think that the children donate .
experiment=NPI-env=adverbs-npi=ever-crucial_item=always-licensor=0-scope=1-npi_present=0	1		the humans always also think that the children donate .
experiment=NPI-env=adverbs-npi=ever-crucial_item=always-licensor=0-scope=0-npi_present=1	0		the humans always think that the children ever donate .
experiment=NPI-env=adverbs-npi=ever-crucial_item=always-licensor=0-scope=0-npi_present=0	1		the humans always think that the children also donate .
experiment=NPI-env=adverbs-npi=ever-crucial_item=scarcely-licensor=1-scope=1-npi_present=1	1		the humans scarcely ever think that the children donate .
experiment=NPI-env=adverbs-npi=ever-crucial_item=scarcely-licensor=1-scope=1-npi_present=0	1		the humans scarcely also think that the children donate .
experiment=NPI-env=adverbs-npi=ever-crucial_item=scarcely-licensor=1-scope=0-npi_present=1	0		the humans scarcely think that the children ever donate .
experiment=NPI-env=adverbs-npi=ever-crucial_item=scarcely-licensor=1-scope=0-npi_present=0	1		the humans scarcely think that the children also donate .
experiment=NPI-env=adverbs-npi=ever-crucial_item=often-licensor=0-scope=1-npi_present=1	0		the person often ever thought that a pedestrian drives to the hospital .
experiment=NPI-env=adverbs-npi=ever-crucial_item=often-licensor=0-scope=1-npi_present=0	1		the person often also thought that a pedestrian drives to the hospital .
experiment=NPI-env=adverbs-npi=ever-crucial_item=often-licensor=0-scope=0-npi_present=1	0		the person often thought that a pedestrian ever drives to the hospital .
experiment=NPI-env=adverbs-npi=ever-crucial_item=often-licensor=0-scope=0-npi_present=0	1		the person often thought that a pedestrian also drives to the hospital .
experiment=NPI-env=adverbs-npi=ever-crucial_item=scarcely-licensor=1-scope=1-npi_present=1	1		the person scarcely ever thought that a pedestrian drives to the hospital .
experiment=NPI-env=adverbs-npi=ever-crucial_item=scarcely-licensor=1-scope=1-npi_present=0	1		the person scarcely also thought that a pedestrian drives to the hospital .
experiment=NPI-env=adverbs-npi=ever-crucial_item=scarcely-licensor=1-scope=0-npi_present=1	0		the person scarcely thought that a pedestrian ever drives to the hospital .
experiment=NPI-env=adverbs-npi=ever-crucial_item=scarcely-licensor=1-scope=0-npi_present=0	1		the person scarcely thought that a pedestrian also drives to the hospital .
experiment=NPI-env=adverbs-npi=ever-crucial_item=always-licensor=0-scope=1-npi_present=1	0		the doctors always ever think that a driver shouted .
experiment=NPI-env=adverbs-npi=ever-crucial_item=always-licensor=0-scope=1-npi_present=0	1		the doctors always also think that a driver shouted .
experiment=NPI-env=adverbs-npi=ever-crucial_item=always-licensor=0-scope=0-npi_present=1	0		the doctors always think that a driver ever shouted .
experiment=NPI-env=adverbs-npi=ever-crucial_item=always-licensor=0-scope=0-npi_present=0	1		the doctors always think that a driver also shouted .
experiment=NPI-env=adverbs-npi=ever-crucial_item=barely-licensor=1-scope=1-npi_present=1	1		the doctors barely ever think that a driver shouted .
experiment=NPI-env=adverbs-npi=ever-crucial_item=barely-licensor=1-scope=1-npi_present=0	1		the doctors barely also think that a driver shouted .
experiment=NPI-env=adverbs-npi=ever-crucial_item=barely-licensor=1-scope=0-npi_present=1	0		the doctors barely think that a driver ever shouted .
experiment=NPI-env=adverbs-npi=ever-crucial_item=barely-licensor=1-scope=0-npi_present=0	1		the doctors barely think that a driver also shouted .
experiment=NPI-env=adverbs-npi=ever-crucial_item=sometimes-licensor=0-scope=1-npi_present=1	0		the human sometimes ever imagines that the drivers see the waiters .
experiment=NPI-env=adverbs-npi=ever-crucial_item=sometimes-licensor=0-scope=1-npi_present=0	1		the human sometimes obviously imagines that the drivers see the waiters .
experiment=NPI-env=adverbs-npi=ever-crucial_item=sometimes-licensor=0-scope=0-npi_present=1	0		the human sometimes imagines that the drivers ever see the waiters .
experiment=NPI-env=adverbs-npi=ever-crucial_item=sometimes-licensor=0-scope=0-npi_present=0	1		the human sometimes imagines that the drivers obviously see the waiters .
experiment=NPI-env=adverbs-npi=ever-crucial_item=rarely-licensor=1-scope=1-npi_present=1	1		the human rarely ever imagines that the drivers see the waiters .
experiment=NPI-env=adverbs-npi=ever-crucial_item=rarely-licensor=1-scope=1-npi_present=0	1		the human rarely obviously imagines that the drivers see the waiters .
experiment=NPI-env=adverbs-npi=ever-crucial_item=rarely-licensor=1-scope=0-npi_present=1	0		the human rarely imagines that the drivers ever see the waiters .
experiment=NPI-env=adverbs-npi=ever-crucial_item=rarely-licensor=1-scope=0-npi_present=0	1		the human rarely imagines that the drivers obviously see the waiters .
experiment=NPI-env=adverbs-npi=ever-crucial_item=often-licensor=0-scope=1-npi_present=1	0		the girls often ever imagined that a boy has walked through the restaurants .
experiment=NPI-env=adverbs-npi=ever-crucial_item=often-licensor=0-scope=1-npi_present=0	1		the girls often clearly imagined that a boy has walked through the restaurants .
experiment=NPI-env=adverbs-npi=ever-crucial_item=often-licensor=0-scope=0-npi_present=1	0		the girls often imagined that a boy has ever walked through the restaurants .
experiment=NPI-env=adverbs-npi=ever-crucial_item=often-licensor=0-scope=0-npi_present=0	1		the girls often imagined that a boy has clearly walked through the restaurants .
experiment=NPI-env=adverbs-npi=ever-crucial_item=seldom-licensor=1-scope=1-npi_present=1	1		the girls seldom ever imagined that a boy has walked through the restaurants .
experiment=NPI-env=adverbs-npi=ever-crucial_item=seldom-licensor=1-scope=1-npi_present=0	1		the girls seldom clearly imagined that a boy has walked through the restaurants .
experiment=NPI-env=adverbs-npi=ever-crucial_item=seldom-licensor=1-scope=0-npi_present=1	0		the girls seldom imagined that a boy has ever walked through the restaurants .
experiment=NPI-env=adverbs-npi=ever-crucial_item=seldom-licensor=1-scope=0-npi_present=0	1		the girls seldom imagined that a boy has clearly walked through the restaurants .
experiment=NPI-env=adverbs-npi=ever-crucial_item=sometimes-licensor=0-scope=1-npi_present=1	0		the children sometimes ever explain that a waitress hides away .
experiment=NPI-env=adverbs-npi=ever-crucial_item=sometimes-licensor=0-scope=1-npi_present=0	1		the children sometimes also explain that a waitress hides away .
experiment=NPI-env=adverbs-npi=ever-crucial_item=sometimes-licensor=0-scope=0-npi_present=1	0		the children sometimes explain that a waitress ever hides away .
experiment=NPI-env=adverbs-npi=ever-crucial_item=sometimes-licensor=0-scope=0-npi_present=0	1		the children sometimes explain that a waitress also hides away .
experiment=NPI-env=adverbs-npi=ever-crucial_item=scarcely-licensor=1-scope=1-npi_present=1	1		the children scarcely ever explain that a waitress hides away .
experiment=NPI-env=adverbs-npi=ever-crucial_item=scarcely-licensor=1-scope=1-npi_present=0	1		the children scarcely also explain that a waitress hides away .
experiment=NPI-env=adverbs-npi=ever-crucial_item=scarcely-licensor=1-scope=0-npi_present=1	0		the children scarcely explain that a waitress ever hides away .
experiment=NPI-env=adverbs-npi=ever-crucial_item=scarcely-licensor=1-scope=0-npi_present=0	1		the children scarcely explain that a waitress also hides away .
experiment=NPI-env=adverbs-npi=ever-crucial_item=often-licensor=0-scope=1-npi_present=1	0		the adult often ever said that the gals forfeit .
experiment=NPI-env=adverbs-npi=ever-crucial_item=often-licensor=0-scope=1-npi_present=0	1		the adult often fortunately said that the gals forfeit .
experiment=NPI-env=adverbs-npi=ever-crucial_item=often-licensor=0-scope=0-npi_present=1	0		the adult often said that the gals ever forfeit .
experiment=NPI-env=adverbs-npi=ever-crucial_item=often-licensor=0-scope=0-npi_present=0	1		the adult often said that the gals fortunately forfeit .
experiment=NPI-env=adverbs-npi=ever-crucial_item=scarcely-licensor=1-scope=1-npi_present=1	1		the adult scarcely ever said that the gals forfeit .
experiment=NPI-env=adverbs-npi=ever-crucial_item=scarcely-licensor=1-scope=1-npi_present=0	1		the adult scarcely fortunately said that the gals forfeit .
experiment=NPI-env=adverbs-npi=ever-crucial_item=scarcely-licensor=1-scope=0-npi_present=1	0		the adult scarcely said that the gals ever forfeit .
experiment=NPI-env=adverbs-npi=ever-crucial_item=scarcely-licensor=1-scope=0-npi_present=0	1		the adult scarcely said that the gals fortunately forfeit .
experiment=NPI-env=adverbs-npi=ever-crucial_item=often-licensor=0-scope=1-npi_present=1	0		the doctor often ever said that the girls had read .
experiment=NPI-env=adverbs-npi=ever-crucial_item=often-licensor=0-scope=1-npi_present=0	1		the doctor often obviously said that the girls had read .
experiment=NPI-env=adverbs-npi=ever-crucial_item=often-licensor=0-scope=0-npi_present=1	0		the doctor often said that the girls had ever read .
experiment=NPI-env=adverbs-npi=ever-crucial_item=often-licensor=0-scope=0-npi_present=0	1		the doctor often said that the girls had obviously read .
experiment=NPI-env=adverbs-npi=ever-crucial_item=hardly-licensor=1-scope=1-npi_present=1	1		the doctor hardly ever said that the girls had read .
experiment=NPI-env=adverbs-npi=ever-crucial_item=hardly-licensor=1-scope=1-npi_present=0	1		the doctor hardly obviously said that the girls had read .
experiment=NPI-env=adverbs-npi=ever-crucial_item=hardly-licensor=1-scope=0-npi_present=1	0		the doctor hardly said that the girls had ever read .
experiment=NPI-env=adverbs-npi=ever-crucial_item=hardly-licensor=1-scope=0-npi_present=0	1		the doctor hardly said that the girls had obviously read .
experiment=NPI-env=adverbs-npi=ever-crucial_item=sometimes-licensor=0-scope=1-npi_present=1	0		the human sometimes ever said that the people attacked a child .
experiment=NPI-env=adverbs-npi=ever-crucial_item=sometimes-licensor=0-scope=1-npi_present=0	1		the human sometimes clearly said that the people attacked a child .
experiment=NPI-env=adverbs-npi=ever-crucial_item=sometimes-licensor=0-scope=0-npi_present=1	0		the human sometimes said that the people ever attacked a child .
experiment=NPI-env=adverbs-npi=ever-crucial_item=sometimes-licensor=0-scope=0-npi_present=0	1		the human sometimes said that the people clearly attacked a child .
experiment=NPI-env=adverbs-npi=ever-crucial_item=seldom-licensor=1-scope=1-npi_present=1	1		the human seldom ever said that the people attacked a child .
experiment=NPI-env=adverbs-npi=ever-crucial_item=seldom-licensor=1-scope=1-npi_present=0	1		the human seldom clearly said that the people attacked a child .
experiment=NPI-env=adverbs-npi=ever-crucial_item=seldom-licensor=1-scope=0-npi_present=1	0		the human seldom said that the people ever attacked a child .
experiment=NPI-env=adverbs-npi=ever-crucial_item=seldom-licensor=1-scope=0-npi_present=0	1		the human seldom said that the people clearly attacked a child .
experiment=NPI-env=adverbs-npi=ever-crucial_item=always-licensor=0-scope=1-npi_present=1	0		a student always ever thought that the waiter had blinked .
experiment=NPI-env=adverbs-npi=ever-crucial_item=always-licensor=0-scope=1-npi_present=0	1		a student always also thought that the waiter had blinked .
experiment=NPI-env=adverbs-npi=ever-crucial_item=always-licensor=0-scope=0-npi_present=1	0		a student always thought that the waiter had ever blinked .
experiment=NPI-env=adverbs-npi=ever-crucial_item=always-licensor=0-scope=0-npi_present=0	1		a student always thought that the waiter had also blinked .
experiment=NPI-env=adverbs-npi=ever-crucial_item=barely-licensor=1-scope=1-npi_present=1	1		a student barely ever thought that the waiter had blinked .
