experiment=NPI-env=negation-npi=either-crucial_item=no-licensor=1-scope=0-npi_present=1	0		the doctors had thought either that no guests had cleaned a scarf .
experiment=NPI-env=negation-npi=either-crucial_item=no-licensor=1-scope=0-npi_present=0	1		the doctors had thought regularly that no guests had cleaned a scarf .
experiment=NPI-env=determiner_negation_biclausal-npi=either-crucial_item=some-licensor=0-scope=1-npi_present=1	0		Some doctors had thought that the guests had cleaned a scarf either .
experiment=NPI-env=determiner_negation_biclausal-npi=either-crucial_item=some-licensor=0-scope=1-npi_present=0	1		Some doctors had thought that the guests had cleaned a scarf regularly .
experiment=NPI-env=determiner_negation_biclausal-npi=either-crucial_item=some-licensor=0-scope=0-npi_present=1	0		the doctors had thought either that some guests had cleaned a scarf .
experiment=NPI-env=determiner_negation_biclausal-npi=either-crucial_item=some-licensor=0-scope=0-npi_present=0	1		the doctors had thought regularly that some guests had cleaned a scarf .
experiment=NPI-env=negation-npi=either-crucial_item=no-licensor=1-scope=1-npi_present=1	1		no drivers said that the students would like the guys either .
experiment=NPI-env=negation-npi=either-crucial_item=no-licensor=1-scope=1-npi_present=0	1		no drivers said that the students would like the guys on occasion .
experiment=NPI-env=negation-npi=either-crucial_item=no-licensor=1-scope=0-npi_present=1	0		the drivers said either that no students would like the guys .
experiment=NPI-env=negation-npi=either-crucial_item=no-licensor=1-scope=0-npi_present=0	1		the drivers said on occasion that no students would like the guys .
experiment=NPI-env=determiner_negation_biclausal-npi=either-crucial_item=some-licensor=0-scope=1-npi_present=1	0		Some drivers said that the students would like the guys either .
experiment=NPI-env=determiner_negation_biclausal-npi=either-crucial_item=some-licensor=0-scope=1-npi_present=0	1		Some drivers said that the students would like the guys on occasion .
experiment=NPI-env=determiner_negation_biclausal-npi=either-crucial_item=some-licensor=0-scope=0-npi_present=1	0		the drivers said either that some students would like the guys .
experiment=NPI-env=determiner_negation_biclausal-npi=either-crucial_item=some-licensor=0-scope=0-npi_present=0	1		the drivers said on occasion that some students would like the guys .
experiment=NPI-env=negation-npi=either-crucial_item=no-licensor=1-scope=1-npi_present=1	1		no waiters were imagining that an actor forfeited either .
experiment=NPI-env=negation-npi=either-crucial_item=no-licensor=1-scope=1-npi_present=0	1		no waiters were imagining that an actor forfeited as well .
experiment=NPI-env=negation-npi=either-crucial_item=no-licensor=1-scope=0-npi_present=1	0		the waiters were imagining either that no actor forfeited .
experiment=NPI-env=negation-npi=either-crucial_item=no-licensor=1-scope=0-npi_present=0	1		the waiters were imagining as well that no actor forfeited .
experiment=NPI-env=determiner_negation_biclausal-npi=either-crucial_item=some-licensor=0-scope=1-npi_present=1	0		Some waiters were imagining that an actor forfeited either .
experiment=NPI-env=determiner_negation_biclausal-npi=either-crucial_item=some-licensor=0-scope=1-npi_present=0	1		Some waiters were imagining that an actor forfeited as well .
experiment=NPI-env=determiner_negation_biclausal-npi=either-crucial_item=some-licensor=0-scope=0-npi_present=1	0		the waiters were imagining either that some actor forfeited .
experiment=NPI-env=determiner_negation_biclausal-npi=either-crucial_item=some-licensor=0-scope=0-npi_present=0	1		the waiters were imagining as well that some actor forfeited .
experiment=NPI-env=negation-npi=either-crucial_item=no-licensor=1-scope=1-npi_present=1	1		no actors were saying that the humans weep either .
experiment=NPI-env=negation-npi=either-crucial_item=no-licensor=1-scope=1-npi_present=0	1		no actors were saying that the humans weep for a while .
experiment=NPI-env=negation-npi=either-crucial_item=no-licensor=1-scope=0-npi_present=1	0		the actors were saying either that no humans weep .
experiment=NPI-env=negation-npi=either-crucial_item=no-licensor=1-scope=0-npi_present=0	1		the actors were saying for a while that no humans weep .
experiment=NPI-env=determiner_negation_biclausal-npi=either-crucial_item=some-licensor=0-scope=1-npi_present=1	0		Some actors were saying that the humans weep either .
experiment=NPI-env=determiner_negation_biclausal-npi=either-crucial_item=some-licensor=0-scope=1-npi_present=0	1		Some actors were saying that the humans weep for a while .
experiment=NPI-env=determiner_negation_biclausal-npi=either-crucial_item=some-licensor=0-scope=0-npi_present=1	0		the actors were saying either that some humans weep .
experiment=NPI-env=determiner_negation_biclausal-npi=either-crucial_item=some-licensor=0-scope=0-npi_present=0	1		the actors were saying for a while that some humans weep .
experiment=NPI-env=negation-npi=either-crucial_item=no-licensor=1-scope=1-npi_present=1	1		no patients would explain that the cashiers were weeping either .
experiment=NPI-env=negation-npi=either-crucial_item=no-licensor=1-scope=1-npi_present=0	1		no patients would explain that the cashiers were weeping as well .
experiment=NPI-env=negation-npi=either-crucial_item=no-licensor=1-scope=0-npi_present=1	0		the patients would explain either that no cashiers were weeping .
experiment=NPI-env=negation-npi=either-crucial_item=no-licensor=1-scope=0-npi_present=0	1		the patients would explain as well that no cashiers were weeping .
experiment=NPI-env=determiner_negation_biclausal-npi=either-crucial_item=some-licensor=0-scope=1-npi_present=1	0		Some patients would explain that the cashiers were weeping either .
experiment=NPI-env=determiner_negation_biclausal-npi=either-crucial_item=some-licensor=0-scope=1-npi_present=0	1		Some patients would explain that the cashiers were weeping as well .
experiment=NPI-env=determiner_negation_biclausal-npi=either-crucial_item=some-licensor=0-scope=0-npi_present=1	0		the patients would explain either that some cashiers were weeping .
experiment=NPI-env=determiner_negation_biclausal-npi=either-crucial_item=some-licensor=0-scope=0-npi_present=0	1		the patients would explain as well that some cashiers were weeping .
experiment=NPI-env=negation-npi=either-crucial_item=no-licensor=1-scope=1-npi_present=1	1		no boy imagined that the boy goes to the college campuses either .
experiment=NPI-env=negation-npi=either-crucial_item=no-licensor=1-scope=1-npi_present=0	1		no boy imagined that the boy goes to the college campuses on weekends .
experiment=NPI-env=negation-npi=either-crucial_item=no-licensor=1-scope=0-npi_present=1	0		a boy imagined either that no boy goes to the college campuses .
experiment=NPI-env=negation-npi=either-crucial_item=no-licensor=1-scope=0-npi_present=0	1		a boy imagined on weekends that no boy goes to the college campuses .
experiment=NPI-env=determiner_negation_biclausal-npi=either-crucial_item=some-licensor=0-scope=1-npi_present=1	0		Some boy imagined that the boy goes to the college campuses either .
experiment=NPI-env=determiner_negation_biclausal-npi=either-crucial_item=some-licensor=0-scope=1-npi_present=0	1		Some boy imagined that the boy goes to the college campuses on weekends .
experiment=NPI-env=determiner_negation_biclausal-npi=either-crucial_item=some-licensor=0-scope=0-npi_present=1	0		a boy imagined either that some boy goes to the college campuses .
experiment=NPI-env=determiner_negation_biclausal-npi=either-crucial_item=some-licensor=0-scope=0-npi_present=0	1		a boy imagined on weekends that some boy goes to the college campuses .
experiment=NPI-env=negation-npi=either-crucial_item=no-licensor=1-scope=1-npi_present=1	1		no waitresses thought that the waitresses should escape from the malls either .
experiment=NPI-env=negation-npi=either-crucial_item=no-licensor=1-scope=1-npi_present=0	1		no waitresses thought that the waitresses should escape from the malls regularly .
experiment=NPI-env=negation-npi=either-crucial_item=no-licensor=1-scope=0-npi_present=1	0		the waitresses thought either that no waitresses should escape from the malls .
experiment=NPI-env=negation-npi=either-crucial_item=no-licensor=1-scope=0-npi_present=0	1		the waitresses thought regularly that no waitresses should escape from the malls .
experiment=NPI-env=determiner_negation_biclausal-npi=either-crucial_item=some-licensor=0-scope=1-npi_present=1	0		Some waitresses thought that the waitresses should escape from the malls either .
experiment=NPI-env=determiner_negation_biclausal-npi=either-crucial_item=some-licensor=0-scope=1-npi_present=0	1		Some waitresses thought that the waitresses should escape from the malls regularly .
experiment=NPI-env=determiner_negation_biclausal-npi=either-crucial_item=some-licensor=0-scope=0-npi_present=1	0		the waitresses thought either that some waitresses should escape from the malls .
experiment=NPI-env=determiner_negation_biclausal-npi=either-crucial_item=some-licensor=0-scope=0-npi_present=0	1		the waitresses thought regularly that some waitresses should escape from the malls .
experiment=NPI-env=negation-npi=either-crucial_item=no-licensor=1-scope=1-npi_present=1	1		no drivers might imagine that the pedestrian approves either .
experiment=NPI-env=negation-npi=either-crucial_item=no-licensor=1-scope=1-npi_present=0	1		no drivers might imagine that the pedestrian approves on occasion .
experiment=NPI-env=negation-npi=either-crucial_item=no-licensor=1-scope=0-npi_present=1	0		the drivers might imagine either that no pedestrian approves .
experiment=NPI-env=negation-npi=either-crucial_item=no-licensor=1-scope=0-npi_present=0	1		the drivers might imagine on occasion that no pedestrian approves .
experiment=NPI-env=determiner_negation_biclausal-npi=either-crucial_item=some-licensor=0-scope=1-npi_present=1	0		Some drivers might imagine that the pedestrian approves either .
experiment=NPI-env=determiner_negation_biclausal-npi=either-crucial_item=some-licensor=0-scope=1-npi_present=0	1		Some drivers might imagine that the pedestrian approves on occasion .
experiment=NPI-env=determiner_negation_biclausal-npi=either-crucial_item=some-licensor=0-scope=0-npi_present=1	0		the drivers might imagine either that some pedestrian approves .
experiment=NPI-env=determiner_negation_biclausal-npi=either-crucial_item=some-licensor=0-scope=0-npi_present=0	1		the drivers might imagine on occasion that some pedestrian approves .
experiment=NPI-env=negation-npi=either-crucial_item=no-licensor=1-scope=1-npi_present=1	1		no driver has imagined that the teachers joked around either .
experiment=NPI-env=negation-npi=either-crucial_item=no-licensor=1-scope=1-npi_present=0	1		no driver has imagined that the teachers joked around as well .
experiment=NPI-env=negation-npi=either-crucial_item=no-licensor=1-scope=0-npi_present=1	0		the driver has imagined either that no teachers joked around .
experiment=NPI-env=negation-npi=either-crucial_item=no-licensor=1-scope=0-npi_present=0	1		the driver has imagined as well that no teachers joked around .
experiment=NPI-env=determiner_negation_biclausal-npi=either-crucial_item=some-licensor=0-scope=1-npi_present=1	0		Some driver has imagined that the teachers joked around either .
experiment=NPI-env=determiner_negation_biclausal-npi=either-crucial_item=some-licensor=0-scope=1-npi_present=0	1		Some driver has imagined that the teachers joked around as well .
experiment=NPI-env=determiner_negation_biclausal-npi=either-crucial_item=some-licensor=0-scope=0-npi_present=1	0		the driver has imagined either that some teachers joked around .
experiment=NPI-env=determiner_negation_biclausal-npi=either-crucial_item=some-licensor=0-scope=0-npi_present=0	1		the driver has imagined as well that some teachers joked around .
experiment=NPI-env=negation-npi=either-crucial_item=no-licensor=1-scope=1-npi_present=1	1		no actors imagined that a child has hated the stories either .
experiment=NPI-env=negation-npi=either-crucial_item=no-licensor=1-scope=1-npi_present=0	1		no actors imagined that a child has hated the stories on occasion .
experiment=NPI-env=negation-npi=either-crucial_item=no-licensor=1-scope=0-npi_present=1	0		the actors imagined either that no child has hated the stories .
experiment=NPI-env=negation-npi=either-crucial_item=no-licensor=1-scope=0-npi_present=0	1		the actors imagined on occasion that no child has hated the stories .
experiment=NPI-env=determiner_negation_biclausal-npi=either-crucial_item=some-licensor=0-scope=1-npi_present=1	0		Some actors imagined that a child has hated the stories either .
experiment=NPI-env=determiner_negation_biclausal-npi=either-crucial_item=some-licensor=0-scope=1-npi_present=0	1		Some actors imagined that a child has hated the stories on occasion .
experiment=NPI-env=determiner_negation_biclausal-npi=either-crucial_item=some-licensor=0-scope=0-npi_present=1	0		the actors imagined either that some child has hated the stories .
experiment=NPI-env=determiner_negation_biclausal-npi=either-crucial_item=some-licensor=0-scope=0-npi_present=0	1		the actors imagined on occasion that some child has hated the stories .
experiment=NPI-env=negation-npi=either-crucial_item=no-licensor=1-scope=1-npi_present=1	1		no teenagers think that the boys should investigate the humans either .
experiment=NPI-env=negation-npi=either-crucial_item=no-licensor=1-scope=1-npi_present=0	1		no teenagers think that the boys should investigate the humans regularly .
experiment=NPI-env=negation-npi=either-crucial_item=no-licensor=1-scope=0-npi_present=1	0		the teenagers think either that no boys should investigate the humans .
experiment=NPI-env=negation-npi=either-crucial_item=no-licensor=1-scope=0-npi_present=0	1		the teenagers think regularly that no boys should investigate the humans .
experiment=NPI-env=determiner_negation_biclausal-npi=either-crucial_item=some-licensor=0-scope=1-npi_present=1	0		Some teenagers think that the boys should investigate the humans either .
experiment=NPI-env=determiner_negation_biclausal-npi=either-crucial_item=some-licensor=0-scope=1-npi_present=0	1		Some teenagers think that the boys should investigate the humans regularly .
experiment=NPI-env=determiner_negation_biclausal-npi=either-crucial_item=some-licensor=0-scope=0-npi_present=1	0		the teenagers think either that some boys should investigate the humans .
experiment=NPI-env=determiner_negation_biclausal-npi=either-crucial_item=some-licensor=0-scope=0-npi_present=0	1		the teenagers think regularly that some boys should investigate the humans .
experiment=NPI-env=negation-npi=either-crucial_item=no-licensor=1-scope=1-npi_present=1	1		no adults think that the woman murmurs either .
experiment=NPI-env=negation-npi=either-crucial_item=no-licensor=1-scope=1-npi_present=0	1		no adults think that the woman murmurs for a while .
experiment=NPI-env=negation-npi=either-crucial_item=no-licensor=1-scope=0-npi_present=1	0		the adults think either that no woman murmurs .
experiment=NPI-env=negation-npi=either-crucial_item=no-licensor=1-scope=0-npi_present=0	1		the adults think for a while that no woman murmurs .
experiment=NPI-env=determiner_negation_biclausal-npi=either-crucial_item=some-licensor=0-scope=1-npi_present=1	0		Some adults think that the woman murmurs either .
experiment=NPI-env=determiner_negation_biclausal-npi=either-crucial_item=some-licensor=0-scope=1-npi_present=0	1		Some adults think that the woman murmurs for a while .
experiment=NPI-env=determiner_negation_biclausal-npi=either-crucial_item=some-licensor=0-scope=0-npi_present=1	0		the adults think either that some woman murmurs .
experiment=NPI-env=determiner_negation_biclausal-npi=either-crucial_item=some-licensor=0-scope=0-npi_present=0	1		the adults think for a while that some woman murmurs .
experiment=NPI-env=negation-npi=either-crucial_item=no-licensor=1-scope=1-npi_present=1	1		no child thought that a human can bring the books either .
experiment=NPI-env=negation-npi=either-crucial_item=no-licensor=1-scope=1-npi_present=0	1		no child thought that a human can bring the books on weekends .
experiment=NPI-env=negation-npi=either-crucial_item=no-licensor=1-scope=0-npi_present=1	0		the child thought either that no human can bring the books .
experiment=NPI-env=negation-npi=either-crucial_item=no-licensor=1-scope=0-npi_present=0	1		the child thought on weekends that no human can bring the books .
experiment=NPI-env=determiner_negation_biclausal-npi=either-crucial_item=some-licensor=0-scope=1-npi_present=1	0		Some child thought that a human can bring the books either .
experiment=NPI-env=determiner_negation_biclausal-npi=either-crucial_item=some-licensor=0-scope=1-npi_present=0	1		Some child thought that a human can bring the books on weekends .
experiment=NPI-env=determiner_negation_biclausal-npi=either-crucial_item=some-licensor=0-scope=0-npi_present=1	0		the child thought either that some human can bring the books .
experiment=NPI-env=determiner_negation_biclausal-npi=either-crucial_item=some-licensor=0-scope=0-npi_present=0	1		the child thought on weekends that some human can bring the books .
experiment=NPI-env=negation-npi=either-crucial_item=no-licensor=1-scope=1-npi_present=1	1		no student has explained that the cashier baked either .
experiment=NPI-env=negation-npi=either-crucial_item=no-licensor=1-scope=1-npi_present=0	1		no student has explained that the cashier baked as well .
experiment=NPI-env=negation-npi=either-crucial_item=no-licensor=1-scope=0-npi_present=1	0		a student has explained either that no cashier baked .
experiment=NPI-env=negation-npi=either-crucial_item=no-licensor=1-scope=0-npi_present=0	1		a student has explained as well that no cashier baked .
experiment=NPI-env=determiner_negation_biclausal-npi=either-crucial_item=some-licensor=0-scope=1-npi_present=1	0		Some student has explained that the cashier baked either .
experiment=NPI-env=determiner_negation_biclausal-npi=either-crucial_item=some-licensor=0-scope=1-npi_present=0	1		Some student has explained that the cashier baked as well .
experiment=NPI-env=determiner_negation_biclausal-npi=either-crucial_item=some-licensor=0-scope=0-npi_present=1	0		a student has explained either that some cashier baked .
experiment=NPI-env=determiner_negation_biclausal-npi=either-crucial_item=some-licensor=0-scope=0-npi_present=0	1		a student has explained as well that some cashier baked .
experiment=NPI-env=negation-npi=either-crucial_item=no-licensor=1-scope=1-npi_present=1	1		no ladies explained that the student eats either .
experiment=NPI-env=negation-npi=either-crucial_item=no-licensor=1-scope=1-npi_present=0	1		no ladies explained that the student eats for a while .
experiment=NPI-env=negation-npi=either-crucial_item=no-licensor=1-scope=0-npi_present=1	0		the ladies explained either that no student eats .
experiment=NPI-env=negation-npi=either-crucial_item=no-licensor=1-scope=0-npi_present=0	1		the ladies explained for a while that no student eats .
experiment=NPI-env=determiner_negation_biclausal-npi=either-crucial_item=some-licensor=0-scope=1-npi_present=1	0		Some ladies explained that the student eats either .
experiment=NPI-env=determiner_negation_biclausal-npi=either-crucial_item=some-licensor=0-scope=1-npi_present=0	1		Some ladies explained that the student eats for a while .
experiment=NPI-env=determiner_negation_biclausal-npi=either-crucial_item=some-licensor=0-scope=0-npi_present=1	0		the ladies explained either that some student eats .
experiment=NPI-env=determiner_negation_biclausal-npi=either-crucial_item=some-licensor=0-scope=0-npi_present=0	1		the ladies explained for a while that some student eats .
experiment=NPI-env=negation-npi=either-crucial_item=no-licensor=1-scope=1-npi_present=1	1		no child is imagining that the human observed the boys either .
experiment=NPI-env=negation-npi=either-crucial_item=no-licensor=1-scope=1-npi_present=0	1		no child is imagining that the human observed the boys on weekends .
experiment=NPI-env=negation-npi=either-crucial_item=no-licensor=1-scope=0-npi_present=1	0		a child is imagining either that no human observed the boys .
experiment=NPI-env=negation-npi=either-crucial_item=no-licensor=1-scope=0-npi_present=0	1		a child is imagining on weekends that no human observed the boys .
experiment=NPI-env=determiner_negation_biclausal-npi=either-crucial_item=some-licensor=0-scope=1-npi_present=1	0		Some child is imagining that the human observed the boys either .
experiment=NPI-env=determiner_negation_biclausal-npi=either-crucial_item=some-licensor=0-scope=1-npi_present=0	1		Some child is imagining that the human observed the boys on weekends .
experiment=NPI-env=determiner_negation_biclausal-npi=either-crucial_item=some-licensor=0-scope=0-npi_present=1	0		a child is imagining either that some human observed the boys .
experiment=NPI-env=determiner_negation_biclausal-npi=either-crucial_item=some-licensor=0-scope=0-npi_present=0	1		a child is imagining on weekends that some human observed the boys .
experiment=NPI-env=negation-npi=either-crucial_item=no-licensor=1-scope=1-npi_present=1	1		no man imagines that the men are benefiting either .
experiment=NPI-env=negation-npi=either-crucial_item=no-licensor=1-scope=1-npi_present=0	1		no man imagines that the men are benefiting as well .
experiment=NPI-env=negation-npi=either-crucial_item=no-licensor=1-scope=0-npi_present=1	0		a man imagines either that no men are benefiting .
experiment=NPI-env=negation-npi=either-crucial_item=no-licensor=1-scope=0-npi_present=0	1		a man imagines as well that no men are benefiting .
experiment=NPI-env=determiner_negation_biclausal-npi=either-crucial_item=some-licensor=0-scope=1-npi_present=1	0		Some man imagines that the men are benefiting either .
experiment=NPI-env=determiner_negation_biclausal-npi=either-crucial_item=some-licensor=0-scope=1-npi_present=0	1		Some man imagines that the men are benefiting as well .
experiment=NPI-env=determiner_negation_biclausal-npi=either-crucial_item=some-licensor=0-scope=0-npi_present=1	0		a man imagines either that some men are benefiting .
experiment=NPI-env=determiner_negation_biclausal-npi=either-crucial_item=some-licensor=0-scope=0-npi_present=0	1		a man imagines as well that some men are benefiting .
experiment=NPI-env=negation-npi=either-crucial_item=no-licensor=1-scope=1-npi_present=1	1		no doctor says that the waiter spoke up either .
experiment=NPI-env=negation-npi=either-crucial_item=no-licensor=1-scope=1-npi_present=0	1		no doctor says that the waiter spoke up on weekends .
experiment=NPI-env=negation-npi=either-crucial_item=no-licensor=1-scope=0-npi_present=1	0		the doctor says either that no waiter spoke up .
experiment=NPI-env=negation-npi=either-crucial_item=no-licensor=1-scope=0-npi_present=0	1		the doctor says on weekends that no waiter spoke up .
experiment=NPI-env=determiner_negation_biclausal-npi=either-crucial_item=some-licensor=0-scope=1-npi_present=1	0		Some doctor says that the waiter spoke up either .
experiment=NPI-env=determiner_negation_biclausal-npi=either-crucial_item=some-licensor=0-scope=1-npi_present=0	1		Some doctor says that the waiter spoke up on weekends .
experiment=NPI-env=determiner_negation_biclausal-npi=either-crucial_item=some-licensor=0-scope=0-npi_present=1	0		the doctor says either that some waiter spoke up .
experiment=NPI-env=determiner_negation_biclausal-npi=either-crucial_item=some-licensor=0-scope=0-npi_present=0	1		the doctor says on weekends that some waiter spoke up .
experiment=NPI-env=negation-npi=either-crucial_item=no-licensor=1-scope=1-npi_present=1	1		no person explained that the teachers have attacked the customers either .
experiment=NPI-env=negation-npi=either-crucial_item=no-licensor=1-scope=1-npi_present=0	1		no person explained that the teachers have attacked the customers for a while .
experiment=NPI-env=negation-npi=either-crucial_item=no-licensor=1-scope=0-npi_present=1	0		the person explained either that no teachers have attacked the customers .
experiment=NPI-env=negation-npi=either-crucial_item=no-licensor=1-scope=0-npi_present=0	1		the person explained for a while that no teachers have attacked the customers .
experiment=NPI-env=determiner_negation_biclausal-npi=either-crucial_item=some-licensor=0-scope=1-npi_present=1	0		Some person explained that the teachers have attacked the customers either .
experiment=NPI-env=determiner_negation_biclausal-npi=either-crucial_item=some-licensor=0-scope=1-npi_present=0	1		Some person explained that the teachers have attacked the customers for a while .
experiment=NPI-env=determiner_negation_biclausal-npi=either-crucial_item=some-licensor=0-scope=0-npi_present=1	0		the person explained either that some teachers have attacked the customers .
experiment=NPI-env=determiner_negation_biclausal-npi=either-crucial_item=some-licensor=0-scope=0-npi_present=0	1		the person explained for a while that some teachers have attacked the customers .
experiment=NPI-env=negation-npi=either-crucial_item=no-licensor=1-scope=1-npi_present=1	1		no people imagine that the man benefits either .
experiment=NPI-env=negation-npi=either-crucial_item=no-licensor=1-scope=1-npi_present=0	1		no people imagine that the man benefits on weekends .
experiment=NPI-env=negation-npi=either-crucial_item=no-licensor=1-scope=0-npi_present=1	0		the people imagine either that no man benefits .
experiment=NPI-env=negation-npi=either-crucial_item=no-licensor=1-scope=0-npi_present=0	1		the people imagine on weekends that no man benefits .
experiment=NPI-env=determiner_negation_biclausal-npi=either-crucial_item=some-licensor=0-scope=1-npi_present=1	0		Some people imagine that the man benefits either .
experiment=NPI-env=determiner_negation_biclausal-npi=either-crucial_item=some-licensor=0-scope=1-npi_present=0	1		Some people imagine that the man benefits on weekends .
