experiment=NPI_env=quantifier_npi=any_licensor=1_scope=1_npi-present=0	1		few waitresses who liked the cars could sell some plates .
experiment=NPI_env=quantifier_npi=any_licensor=1_scope=1_npi-present=1	1		few waitresses who liked some cars could sell any plates .
experiment=NPI_env=quantifier_npi=any_licensor=1_scope=1_npi-present=0	1		few waitresses who liked some cars could sell the plates .
experiment=NPI_env=quantifier_npi=any_licensor=0_scope=1_npi-present=1	0		a gal who did break any books was working with some waiters .
experiment=NPI_env=quantifier_npi=any_licensor=0_scope=1_npi-present=0	1		a gal who did break the books was working with some waiters .
experiment=NPI_env=quantifier_npi=any_licensor=0_scope=0_npi-present=1	0		a gal who did break books was working with any waiters .
experiment=NPI_env=quantifier_npi=any_licensor=0_scope=0_npi-present=0	1		a gal who did break books was working with the waiters .
experiment=NPI_env=quantifier_npi=any_licensor=0_scope=1_npi-present=1	0		some girls who had seen any cups loved some pedestrians .
experiment=NPI_env=quantifier_npi=any_licensor=0_scope=1_npi-present=0	1		some girls who had seen the cups loved some pedestrians .
experiment=NPI_env=quantifier_npi=any_licensor=0_scope=0_npi-present=1	0		some girls who had seen many cups loved any pedestrians .
experiment=NPI_env=quantifier_npi=any_licensor=0_scope=0_npi-present=0	1		some girls who had seen many cups loved the pedestrians .
experiment=NPI_env=quantifier_npi=any_licensor=1_scope=1_npi-present=1	1		few boys who can clean any forks did like some glasses .
experiment=NPI_env=quantifier_npi=any_licensor=1_scope=1_npi-present=0	1		few boys who can clean the forks did like some glasses .
experiment=NPI_env=quantifier_npi=any_licensor=1_scope=1_npi-present=1	1		few boys who can clean some forks did like any glasses .
experiment=NPI_env=quantifier_npi=any_licensor=1_scope=1_npi-present=0	1		few boys who can clean some forks did like the glasses .
experiment=NPI_env=quantifier_npi=any_licensor=0_scope=1_npi-present=1	0		a lot of gals who have kissed any actors break the couches .
experiment=NPI_env=quantifier_npi=any_licensor=0_scope=1_npi-present=0	1		a lot of gals who have kissed the actors break the couches .
experiment=NPI_env=quantifier_npi=any_licensor=0_scope=0_npi-present=1	0		a lot of gals who have kissed a lot of actors break any couches .
experiment=NPI_env=quantifier_npi=any_licensor=0_scope=0_npi-present=0	1		a lot of gals who have kissed a lot of actors break the couches .
experiment=NPI_env=quantifier_npi=any_licensor=1_scope=1_npi-present=1	1		fewer than three cashiers who cared for any drivers care for guys .
experiment=NPI_env=quantifier_npi=any_licensor=1_scope=1_npi-present=0	1		fewer than three cashiers who cared for the drivers care for guys .
experiment=NPI_env=quantifier_npi=any_licensor=1_scope=1_npi-present=1	1		fewer than three cashiers who cared for some drivers care for any guys .
experiment=NPI_env=quantifier_npi=any_licensor=1_scope=1_npi-present=0	1		fewer than three cashiers who cared for some drivers care for the guys .
experiment=NPI_env=quantifier_npi=any_licensor=0_scope=1_npi-present=1	0		a lot of actors who visit any boys should break a lot of cups .
experiment=NPI_env=quantifier_npi=any_licensor=0_scope=1_npi-present=0	1		a lot of actors who visit the boys should break a lot of cups .
experiment=NPI_env=quantifier_npi=any_licensor=0_scope=0_npi-present=1	0		a lot of actors who visit some boys should break any cups .
experiment=NPI_env=quantifier_npi=any_licensor=0_scope=0_npi-present=0	1		a lot of actors who visit some boys should break the cups .
experiment=NPI_env=quantifier_npi=any_licensor=1_scope=1_npi-present=1	1		no student who could like any students hugs some children .
experiment=NPI_env=quantifier_npi=any_licensor=1_scope=1_npi-present=0	1		no student who could like the students hugs some children .
experiment=NPI_env=quantifier_npi=any_licensor=1_scope=1_npi-present=1	1		no student who could like many students hugs any children .
experiment=NPI_env=quantifier_npi=any_licensor=1_scope=1_npi-present=0	1		no student who could like many students hugs the children .
experiment=NPI_env=quantifier_npi=any_licensor=1_scope=1_npi-present=1	1		every boy who forgets any humans is buying glasses .
experiment=NPI_env=quantifier_npi=any_licensor=1_scope=1_npi-present=0	1		every boy who forgets the humans is buying glasses .
experiment=NPI_env=quantifier_npi=any_licensor=1_scope=0_npi-present=1	0		every boy who forgets a lot of humans is buying any glasses .
experiment=NPI_env=quantifier_npi=any_licensor=1_scope=0_npi-present=0	1		every boy who forgets a lot of humans is buying the glasses .
experiment=NPI_env=quantifier_npi=any_licensor=0_scope=1_npi-present=1	0		the gals who can respect any pedestrians are breaking a lot of forks .
experiment=NPI_env=quantifier_npi=any_licensor=0_scope=1_npi-present=0	1		the gals who can respect the pedestrians are breaking a lot of forks .
experiment=NPI_env=quantifier_npi=any_licensor=0_scope=0_npi-present=1	0		the gals who can respect many pedestrians are breaking any forks .
experiment=NPI_env=quantifier_npi=any_licensor=0_scope=0_npi-present=0	1		the gals who can respect many pedestrians are breaking the forks .
experiment=NPI_env=quantifier_npi=any_licensor=1_scope=1_npi-present=1	1		no guest who was lifting any couches would clean a lot of cars .
experiment=NPI_env=quantifier_npi=any_licensor=1_scope=1_npi-present=0	1		no guest who was lifting the couches would clean a lot of cars .
experiment=NPI_env=quantifier_npi=any_licensor=1_scope=1_npi-present=1	1		no guest who was lifting some couches would clean any cars .
experiment=NPI_env=quantifier_npi=any_licensor=1_scope=1_npi-present=0	1		no guest who was lifting some couches would clean the cars .
experiment=NPI_env=quantifier_npi=any_licensor=0_scope=1_npi-present=1	0		some cashiers who talked to any women are admiring girls .
experiment=NPI_env=quantifier_npi=any_licensor=0_scope=1_npi-present=0	1		some cashiers who talked to the women are admiring girls .
experiment=NPI_env=quantifier_npi=any_licensor=0_scope=0_npi-present=1	0		some cashiers who talked to women are admiring any girls .
experiment=NPI_env=quantifier_npi=any_licensor=0_scope=0_npi-present=0	1		some cashiers who talked to women are admiring the girls .
experiment=NPI_env=quantifier_npi=any_licensor=0_scope=1_npi-present=1	0		some doctor who does hate any actors visits boys .
experiment=NPI_env=quantifier_npi=any_licensor=0_scope=1_npi-present=0	1		some doctor who does hate the actors visits boys .
experiment=NPI_env=quantifier_npi=any_licensor=0_scope=0_npi-present=1	0		some doctor who does hate some actors visits any boys .
experiment=NPI_env=quantifier_npi=any_licensor=0_scope=0_npi-present=0	1		some doctor who does hate some actors visits the boys .
experiment=NPI_env=quantifier_npi=any_licensor=1_scope=1_npi-present=1	1		any women who have worked with any teachers are buying a lot of gloves .
experiment=NPI_env=quantifier_npi=any_licensor=1_scope=1_npi-present=0	1		any women who have worked with the teachers are buying a lot of gloves .
experiment=NPI_env=quantifier_npi=any_licensor=1_scope=0_npi-present=1	0		any women who have worked with teachers are buying any gloves .
experiment=NPI_env=quantifier_npi=any_licensor=1_scope=0_npi-present=0	1		any women who have worked with teachers are buying the gloves .
experiment=NPI_env=quantifier_npi=any_licensor=1_scope=1_npi-present=1	1		fewer than three humans who were wearing any pants kissed some waitresses .
experiment=NPI_env=quantifier_npi=any_licensor=1_scope=1_npi-present=0	1		fewer than three humans who were wearing the pants kissed some waitresses .
experiment=NPI_env=quantifier_npi=any_licensor=1_scope=1_npi-present=1	1		fewer than three humans who were wearing pants kissed any waitresses .
experiment=NPI_env=quantifier_npi=any_licensor=1_scope=1_npi-present=0	1		fewer than three humans who were wearing pants kissed the waitresses .
experiment=NPI_env=quantifier_npi=any_licensor=0_scope=1_npi-present=1	0		the waiter who should work with any pedestrians listened to some guys .
experiment=NPI_env=quantifier_npi=any_licensor=0_scope=1_npi-present=0	1		the waiter who should work with the pedestrians listened to some guys .
experiment=NPI_env=quantifier_npi=any_licensor=0_scope=0_npi-present=1	0		the waiter who should work with more than three pedestrians listened to any guys .
experiment=NPI_env=quantifier_npi=any_licensor=0_scope=0_npi-present=0	1		the waiter who should work with more than three pedestrians listened to the guys .
experiment=NPI_env=quantifier_npi=any_licensor=1_scope=1_npi-present=1	1		no driver who could work with any ladies has lifted many chairs .
experiment=NPI_env=quantifier_npi=any_licensor=1_scope=1_npi-present=0	1		no driver who could work with the ladies has lifted many chairs .
experiment=NPI_env=quantifier_npi=any_licensor=1_scope=1_npi-present=1	1		no driver who could work with many ladies has lifted any chairs .
experiment=NPI_env=quantifier_npi=any_licensor=1_scope=1_npi-present=0	1		no driver who could work with many ladies has lifted the chairs .
experiment=NPI_env=quantifier_npi=any_licensor=0_scope=1_npi-present=1	0		the doctor who hugs any gals has worn a lot of pants .
experiment=NPI_env=quantifier_npi=any_licensor=0_scope=1_npi-present=0	1		the doctor who hugs the gals has worn a lot of pants .
experiment=NPI_env=quantifier_npi=any_licensor=0_scope=0_npi-present=1	0		the doctor who hugs many gals has worn any pants .
experiment=NPI_env=quantifier_npi=any_licensor=0_scope=0_npi-present=0	1		the doctor who hugs many gals has worn the pants .
experiment=NPI_env=quantifier_npi=any_licensor=0_scope=1_npi-present=1	0		more than three waiters who are buying any rugs hate a lot of drivers .
experiment=NPI_env=quantifier_npi=any_licensor=0_scope=1_npi-present=0	1		more than three waiters who are buying the rugs hate a lot of drivers .
experiment=NPI_env=quantifier_npi=any_licensor=0_scope=0_npi-present=1	0		more than three waiters who are buying many rugs hate any drivers .
experiment=NPI_env=quantifier_npi=any_licensor=0_scope=0_npi-present=0	1		more than three waiters who are buying many rugs hate the drivers .
experiment=NPI_env=quantifier_npi=any_licensor=0_scope=1_npi-present=1	0		actors who do have any glasses were hugging some men .
experiment=NPI_env=quantifier_npi=any_licensor=0_scope=1_npi-present=0	1		actors who do have the glasses were hugging some men .
experiment=NPI_env=quantifier_npi=any_licensor=0_scope=0_npi-present=1	0		actors who do have some glasses were hugging any men .
experiment=NPI_env=quantifier_npi=any_licensor=0_scope=0_npi-present=0	1		actors who do have some glasses were hugging the men .
experiment=NPI_env=quantifier_npi=any_licensor=0_scope=1_npi-present=1	0		many men who might respect any men wore some glasses .
experiment=NPI_env=quantifier_npi=any_licensor=0_scope=1_npi-present=0	1		many men who might respect the men wore some glasses .
experiment=NPI_env=quantifier_npi=any_licensor=0_scope=0_npi-present=1	0		many men who might respect men wore any glasses .
experiment=NPI_env=quantifier_npi=any_licensor=0_scope=0_npi-present=0	1		many men who might respect men wore the glasses .
experiment=NPI_env=quantifier_npi=any_licensor=1_scope=1_npi-present=1	1		every patient who should clean any pants is helping more than three cashiers .
experiment=NPI_env=quantifier_npi=any_licensor=1_scope=1_npi-present=0	1		every patient who should clean the pants is helping more than three cashiers .
experiment=NPI_env=quantifier_npi=any_licensor=1_scope=0_npi-present=1	0		every patient who should clean some pants is helping any cashiers .
experiment=NPI_env=quantifier_npi=any_licensor=1_scope=0_npi-present=0	1		every patient who should clean some pants is helping the cashiers .
experiment=NPI_env=quantifier_npi=any_licensor=0_scope=1_npi-present=1	0		many guests who visited any doctors should like more than three drivers .
experiment=NPI_env=quantifier_npi=any_licensor=0_scope=1_npi-present=0	1		many guests who visited the doctors should like more than three drivers .
experiment=NPI_env=quantifier_npi=any_licensor=0_scope=0_npi-present=1	0		many guests who visited the doctors should like any drivers .
experiment=NPI_env=quantifier_npi=any_licensor=0_scope=0_npi-present=0	1		many guests who visited the doctors should like the drivers .
experiment=NPI_env=quantifier_npi=any_licensor=1_scope=1_npi-present=1	1		no women who clean any couches will visit kids .
experiment=NPI_env=quantifier_npi=any_licensor=1_scope=1_npi-present=0	1		no women who clean the couches will visit kids .
experiment=NPI_env=quantifier_npi=any_licensor=1_scope=1_npi-present=1	1		no women who clean many couches will visit any kids .
experiment=NPI_env=quantifier_npi=any_licensor=1_scope=1_npi-present=0	1		no women who clean many couches will visit the kids .
experiment=NPI_env=quantifier_npi=any_licensor=0_scope=1_npi-present=1	0		the actors who admired any gals are selling some glasses .
experiment=NPI_env=quantifier_npi=any_licensor=0_scope=1_npi-present=0	1		the actors who admired the gals are selling some glasses .
experiment=NPI_env=quantifier_npi=any_licensor=0_scope=0_npi-present=1	0		the actors who admired the gals are selling any glasses .
experiment=NPI_env=quantifier_npi=any_licensor=0_scope=0_npi-present=0	1		the actors who admired the gals are selling the glasses .
experiment=NPI_env=quantifier_npi=any_licensor=1_scope=1_npi-present=1	1		few students who kissed any actresses are kissing the boys .
experiment=NPI_env=quantifier_npi=any_licensor=1_scope=1_npi-present=0	1		few students who kissed the actresses are kissing the boys .
experiment=NPI_env=quantifier_npi=any_licensor=1_scope=1_npi-present=1	1		few students who kissed actresses are kissing any boys .
experiment=NPI_env=quantifier_npi=any_licensor=1_scope=1_npi-present=0	1		few students who kissed actresses are kissing the boys .
experiment=NPI_env=quantifier_npi=any_licensor=0_scope=1_npi-present=1	0		the actor who listened to any drivers had remembered a lot of kids .
experiment=NPI_env=quantifier_npi=any_licensor=0_scope=1_npi-present=0	1		the actor who listened to the drivers had remembered a lot of kids .
experiment=NPI_env=quantifier_npi=any_licensor=0_scope=0_npi-present=1	0		the actor who listened to many drivers had remembered any kids .
experiment=NPI_env=quantifier_npi=any_licensor=0_scope=0_npi-present=0	1		the actor who listened to many drivers had remembered the kids .
experiment=NPI_env=quantifier_npi=any_licensor=1_scope=1_npi-present=1	1		few children who attack any men have worn many shoes .
experiment=NPI_env=quantifier_npi=any_licensor=1_scope=1_npi-present=0	1		few children who attack the men have worn many shoes .
experiment=NPI_env=quantifier_npi=any_licensor=1_scope=1_npi-present=1	1		few children who attack some men have worn any shoes .
experiment=NPI_env=quantifier_npi=any_licensor=1_scope=1_npi-present=0	1		few children who attack some men have worn the shoes .
experiment=NPI_env=quantifier_npi=any_licensor=1_scope=1_npi-present=1	1		all kids who did have any cups would hug more than three adults .
experiment=NPI_env=quantifier_npi=any_licensor=1_scope=1_npi-present=0	1		all kids who did have the cups would hug more than three adults .
experiment=NPI_env=quantifier_npi=any_licensor=1_scope=0_npi-present=1	0		all kids who did have the cups would hug any adults .
experiment=NPI_env=quantifier_npi=any_licensor=1_scope=0_npi-present=0	1		all kids who did have the cups would hug the adults .
experiment=NPI_env=quantifier_npi=any_licensor=0_scope=1_npi-present=1	0		a lot of customers who should hug any waitresses can see many dudes .
experiment=NPI_env=quantifier_npi=any_licensor=0_scope=1_npi-present=0	1		a lot of customers who should hug the waitresses can see many dudes .
experiment=NPI_env=quantifier_npi=any_licensor=0_scope=0_npi-present=1	0		a lot of customers who should hug some waitresses can see any dudes .
experiment=NPI_env=quantifier_npi=any_licensor=0_scope=0_npi-present=0	1		a lot of customers who should hug some waitresses can see the dudes .
experiment=NPI_env=quantifier_npi=any_licensor=1_scope=1_npi-present=1	1		no adult who had brought any dishes could care for many women .
experiment=NPI_env=quantifier_npi=any_licensor=1_scope=1_npi-present=0	1		no adult who had brought the dishes could care for many women .
experiment=NPI_env=quantifier_npi=any_licensor=1_scope=1_npi-present=1	1		no adult who had brought some dishes could care for any women .
experiment=NPI_env=quantifier_npi=any_licensor=1_scope=1_npi-present=0	1		no adult who had brought some dishes could care for the women .
experiment=NPI_env=quantifier_npi=any_licensor=1_scope=1_npi-present=1	1		fewer than three cashiers who were buying any glasses worked with many men .
experiment=NPI_env=quantifier_npi=any_licensor=1_scope=1_npi-present=0	1		fewer than three cashiers who were buying the glasses worked with many men .
experiment=NPI_env=quantifier_npi=any_licensor=1_scope=1_npi-present=1	1		fewer than three cashiers who were buying more than three glasses worked with any men .
experiment=NPI_env=quantifier_npi=any_licensor=1_scope=1_npi-present=0	1		fewer than three cashiers who were buying more than three glasses worked with the men .
experiment=NPI_env=quantifier_npi=any_licensor=0_scope=1_npi-present=1	0		more than three people who had brought any rugs have forgotten more than three women .
experiment=NPI_env=quantifier_npi=any_licensor=0_scope=1_npi-present=0	1		more than three people who had brought the rugs have forgotten more than three women .
experiment=NPI_env=quantifier_npi=any_licensor=0_scope=0_npi-present=1	0		more than three people who had brought many rugs have forgotten any women .
experiment=NPI_env=quantifier_npi=any_licensor=0_scope=0_npi-present=0	1		more than three people who had brought many rugs have forgotten the women .
experiment=NPI_env=quantifier_npi=any_licensor=0_scope=1_npi-present=1	0		many people who saw any cars are attacking the pedestrians .
experiment=NPI_env=quantifier_npi=any_licensor=0_scope=1_npi-present=0	1		many people who saw the cars are attacking the pedestrians .
experiment=NPI_env=quantifier_npi=any_licensor=0_scope=0_npi-present=1	0		many people who saw some cars are attacking any pedestrians .
experiment=NPI_env=quantifier_npi=any_licensor=0_scope=0_npi-present=0	1		many people who saw some cars are attacking the pedestrians .
experiment=NPI_env=quantifier_npi=any_licensor=0_scope=1_npi-present=1	0		a human who cleaned any dishes kissed some people .
experiment=NPI_env=quantifier_npi=any_licensor=0_scope=1_npi-present=0	1		a human who cleaned the dishes kissed some people .
experiment=NPI_env=quantifier_npi=any_licensor=0_scope=0_npi-present=1	0		a human who cleaned dishes kissed any people .
experiment=NPI_env=quantifier_npi=any_licensor=0_scope=0_npi-present=0	1		a human who cleaned dishes kissed the people .
experiment=NPI_env=quantifier_npi=any_licensor=0_scope=1_npi-present=1	0		the boy who can visit any ladies does have some forks .
experiment=NPI_env=quantifier_npi=any_licensor=0_scope=1_npi-present=0	1		the boy who can visit the ladies does have some forks .
experiment=NPI_env=quantifier_npi=any_licensor=0_scope=0_npi-present=1	0		the boy who can visit some ladies does have any forks .
experiment=NPI_env=quantifier_npi=any_licensor=0_scope=0_npi-present=0	1		the boy who can visit some ladies does have the forks .
experiment=NPI_env=quantifier_npi=any_licensor=0_scope=1_npi-present=1	0		a guest who wore any shoes had broken many plates .
experiment=NPI_env=quantifier_npi=any_licensor=0_scope=1_npi-present=0	1		a guest who wore the shoes had broken many plates .
experiment=NPI_env=quantifier_npi=any_licensor=0_scope=0_npi-present=1	0		a guest who wore a lot of shoes had broken any plates .
experiment=NPI_env=quantifier_npi=any_licensor=0_scope=0_npi-present=0	1		a guest who wore a lot of shoes had broken the plates .
experiment=NPI_env=quantifier_npi=any_licensor=1_scope=1_npi-present=1	1		no pedestrian who has talked to any adults visited some cashiers .
experiment=NPI_env=quantifier_npi=any_licensor=1_scope=1_npi-present=0	1		no pedestrian who has talked to the adults visited some cashiers .
experiment=NPI_env=quantifier_npi=any_licensor=1_scope=1_npi-present=1	1		no pedestrian who has talked to some adults visited any cashiers .
experiment=NPI_env=quantifier_npi=any_licensor=1_scope=1_npi-present=0	1		no pedestrian who has talked to some adults visited the cashiers .
experiment=NPI_env=quantifier_npi=any_licensor=0_scope=1_npi-present=1	0		boys who have broken any cups were selling a lot of couches .
experiment=NPI_env=quantifier_npi=any_licensor=0_scope=1_npi-present=0	1		boys who have broken the cups were selling a lot of couches .
experiment=NPI_env=quantifier_npi=any_licensor=0_scope=0_npi-present=1	0		boys who have broken cups were selling any couches .
experiment=NPI_env=quantifier_npi=any_licensor=0_scope=0_npi-present=0	1		boys who have broken cups were selling the couches .
experiment=NPI_env=quantifier_npi=any_licensor=1_scope=1_npi-present=1	1		no customer who should attack any adults has known a lot of cashiers .
experiment=NPI_env=quantifier_npi=any_licensor=1_scope=1_npi-present=0	1		no customer who should attack the adults has known a lot of cashiers .
experiment=NPI_env=quantifier_npi=any_licensor=1_scope=1_npi-present=1	1		no customer who should attack some adults has known any cashiers .
experiment=NPI_env=quantifier_npi=any_licensor=1_scope=1_npi-present=0	1		no customer who should attack some adults has known the cashiers .
experiment=NPI_env=quantifier_npi=any_licensor=0_scope=1_npi-present=1	0		more than three cashiers who might see any men have listened to boys .
experiment=NPI_env=quantifier_npi=any_licensor=0_scope=1_npi-present=0	1		more than three cashiers who might see the men have listened to boys .
experiment=NPI_env=quantifier_npi=any_licensor=0_scope=0_npi-present=1	0		more than three cashiers who might see many men have listened to any boys .
experiment=NPI_env=quantifier_npi=any_licensor=0_scope=0_npi-present=0	1		more than three cashiers who might see many men have listened to the boys .
experiment=NPI_env=quantifier_npi=any_licensor=1_scope=1_npi-present=1	1		every man who liked any actresses might work with more than three humans .
experiment=NPI_env=quantifier_npi=any_licensor=1_scope=1_npi-present=0	1		every man who liked the actresses might work with more than three humans .
experiment=NPI_env=quantifier_npi=any_licensor=1_scope=0_npi-present=1	0		every man who liked many actresses might work with any humans .
experiment=NPI_env=quantifier_npi=any_licensor=1_scope=0_npi-present=0	1		every man who liked many actresses might work with the humans .
experiment=NPI_env=quantifier_npi=any_licensor=1_scope=1_npi-present=1	1		no child who hated any guys knows a lot of patients .
experiment=NPI_env=quantifier_npi=any_licensor=1_scope=1_npi-present=0	1		no child who hated the guys knows a lot of patients .
experiment=NPI_env=quantifier_npi=any_licensor=1_scope=1_npi-present=1	1		no child who hated the guys knows any patients .
experiment=NPI_env=quantifier_npi=any_licensor=1_scope=1_npi-present=0	1		no child who hated the guys knows the patients .
experiment=NPI_env=quantifier_npi=any_licensor=1_scope=1_npi-present=1	1		no child who was wearing any shoes did care for a lot of kids .
experiment=NPI_env=quantifier_npi=any_licensor=1_scope=1_npi-present=0	1		no child who was wearing the shoes did care for a lot of kids .
experiment=NPI_env=quantifier_npi=any_licensor=1_scope=1_npi-present=1	1		no child who was wearing shoes did care for any kids .
experiment=NPI_env=quantifier_npi=any_licensor=1_scope=1_npi-present=0	1		no child who was wearing shoes did care for the kids .
experiment=NPI_env=quantifier_npi=any_licensor=1_scope=1_npi-present=1	1		no child who had listened to any ladies visits more than three people .
experiment=NPI_env=quantifier_npi=any_licensor=1_scope=1_npi-present=0	1		no child who had listened to the ladies visits more than three people .
experiment=NPI_env=quantifier_npi=any_licensor=1_scope=1_npi-present=1	1		no child who had listened to a lot of ladies visits any people .
experiment=NPI_env=quantifier_npi=any_licensor=1_scope=1_npi-present=0	1		no child who had listened to a lot of ladies visits the people .
experiment=NPI_env=quantifier_npi=any_licensor=0_scope=1_npi-present=1	0		some driver who would attack any boys was attacking a lot of children .
experiment=NPI_env=quantifier_npi=any_licensor=0_scope=1_npi-present=0	1		some driver who would attack the boys was attacking a lot of children .
experiment=NPI_env=quantifier_npi=any_licensor=0_scope=0_npi-present=1	0		some driver who would attack boys was attacking any children .
experiment=NPI_env=quantifier_npi=any_licensor=0_scope=0_npi-present=0	1		some driver who would attack boys was attacking the children .
experiment=NPI_env=quantifier_npi=any_licensor=0_scope=1_npi-present=1	0		some actors who listen to any women are working with women .
experiment=NPI_env=quantifier_npi=any_licensor=0_scope=1_npi-present=0	1		some actors who listen to the women are working with women .
experiment=NPI_env=quantifier_npi=any_licensor=0_scope=0_npi-present=1	0		some actors who listen to some women are working with any women .
experiment=NPI_env=quantifier_npi=any_licensor=0_scope=0_npi-present=0	1		some actors who listen to some women are working with the women .
experiment=NPI_env=quantifier_npi=any_licensor=0_scope=1_npi-present=1	0		a teacher who helps any doctors did respect waiters .
experiment=NPI_env=quantifier_npi=any_licensor=0_scope=1_npi-present=0	1		a teacher who helps the doctors did respect waiters .
