experiment=NPI_env=quantifier_npi=any_licensor=0_scope=0_npi-present=0	1		some driver who admires some cups should like the couches .
experiment=NPI_env=quantifier_npi=any_licensor=0_scope=1_npi-present=1	0		a lot of humans who would take any dishes have bought forks .
experiment=NPI_env=quantifier_npi=any_licensor=0_scope=1_npi-present=0	1		a lot of humans who would take the dishes have bought forks .
experiment=NPI_env=quantifier_npi=any_licensor=0_scope=0_npi-present=1	0		a lot of humans who would take a lot of dishes have bought any forks .
experiment=NPI_env=quantifier_npi=any_licensor=0_scope=0_npi-present=0	1		a lot of humans who would take a lot of dishes have bought the forks .
experiment=NPI_env=quantifier_npi=any_licensor=0_scope=1_npi-present=1	0		some adults who admire any gloves have sold the couches .
experiment=NPI_env=quantifier_npi=any_licensor=0_scope=1_npi-present=0	1		some adults who admire the gloves have sold the couches .
experiment=NPI_env=quantifier_npi=any_licensor=0_scope=0_npi-present=1	0		some adults who admire the gloves have sold any couches .
experiment=NPI_env=quantifier_npi=any_licensor=0_scope=0_npi-present=0	1		some adults who admire the gloves have sold the couches .
experiment=NPI_env=quantifier_npi=any_licensor=0_scope=1_npi-present=1	0		some teacher who admires any forks wore a lot of pants .
experiment=NPI_env=quantifier_npi=any_licensor=0_scope=1_npi-present=0	1		some teacher who admires the forks wore a lot of pants .
experiment=NPI_env=quantifier_npi=any_licensor=0_scope=0_npi-present=1	0		some teacher who admires the forks wore any pants .
experiment=NPI_env=quantifier_npi=any_licensor=0_scope=0_npi-present=0	1		some teacher who admires the forks wore the pants .
experiment=NPI_env=quantifier_npi=any_licensor=0_scope=1_npi-present=1	0		many dudes who were buying any cups have taken gloves .
experiment=NPI_env=quantifier_npi=any_licensor=0_scope=1_npi-present=0	1		many dudes who were buying the cups have taken gloves .
experiment=NPI_env=quantifier_npi=any_licensor=0_scope=0_npi-present=1	0		many dudes who were buying many cups have taken any gloves .
experiment=NPI_env=quantifier_npi=any_licensor=0_scope=0_npi-present=0	1		many dudes who were buying many cups have taken the gloves .
experiment=NPI_env=quantifier_npi=any_licensor=1_scope=1_npi-present=1	1		few waiters who has any couches wore the glasses .
experiment=NPI_env=quantifier_npi=any_licensor=1_scope=1_npi-present=0	1		few waiters who has the couches wore the glasses .
experiment=NPI_env=quantifier_npi=any_licensor=1_scope=1_npi-present=1	1		few waiters who has couches wore any glasses .
experiment=NPI_env=quantifier_npi=any_licensor=1_scope=1_npi-present=0	1		few waiters who has couches wore the glasses .
experiment=NPI_env=quantifier_npi=any_licensor=1_scope=1_npi-present=1	1		fewer than three children who would buy any books brought many plates .
experiment=NPI_env=quantifier_npi=any_licensor=1_scope=1_npi-present=0	1		fewer than three children who would buy the books brought many plates .
experiment=NPI_env=quantifier_npi=any_licensor=1_scope=1_npi-present=1	1		fewer than three children who would buy a lot of books brought any plates .
experiment=NPI_env=quantifier_npi=any_licensor=1_scope=1_npi-present=0	1		fewer than three children who would buy a lot of books brought the plates .
experiment=NPI_env=quantifier_npi=any_licensor=1_scope=1_npi-present=1	1		no girl who had sold any rugs has lifted a lot of dishes .
experiment=NPI_env=quantifier_npi=any_licensor=1_scope=1_npi-present=0	1		no girl who had sold the rugs has lifted a lot of dishes .
experiment=NPI_env=quantifier_npi=any_licensor=1_scope=1_npi-present=1	1		no girl who had sold a lot of rugs has lifted any dishes .
experiment=NPI_env=quantifier_npi=any_licensor=1_scope=1_npi-present=0	1		no girl who had sold a lot of rugs has lifted the dishes .
experiment=NPI_env=quantifier_npi=any_licensor=1_scope=1_npi-present=1	1		few teachers who might break any glasses can take a lot of couches .
experiment=NPI_env=quantifier_npi=any_licensor=1_scope=1_npi-present=0	1		few teachers who might break the glasses can take a lot of couches .
experiment=NPI_env=quantifier_npi=any_licensor=1_scope=1_npi-present=1	1		few teachers who might break some glasses can take any couches .
experiment=NPI_env=quantifier_npi=any_licensor=1_scope=1_npi-present=0	1		few teachers who might break some glasses can take the couches .
experiment=NPI_env=quantifier_npi=any_licensor=1_scope=1_npi-present=1	1		few cashiers who have lifted any chairs had sold more than three pants .
experiment=NPI_env=quantifier_npi=any_licensor=1_scope=1_npi-present=0	1		few cashiers who have lifted the chairs had sold more than three pants .
experiment=NPI_env=quantifier_npi=any_licensor=1_scope=1_npi-present=1	1		few cashiers who have lifted chairs had sold any pants .
experiment=NPI_env=quantifier_npi=any_licensor=1_scope=1_npi-present=0	1		few cashiers who have lifted chairs had sold the pants .
experiment=NPI_env=quantifier_npi=any_licensor=1_scope=1_npi-present=1	1		all actresses who might buy any glasses took shoes .
experiment=NPI_env=quantifier_npi=any_licensor=1_scope=1_npi-present=0	1		all actresses who might buy the glasses took shoes .
experiment=NPI_env=quantifier_npi=any_licensor=1_scope=0_npi-present=1	0		all actresses who might buy the glasses took any shoes .
experiment=NPI_env=quantifier_npi=any_licensor=1_scope=0_npi-present=0	1		all actresses who might buy the glasses took the shoes .
experiment=NPI_env=quantifier_npi=any_licensor=1_scope=1_npi-present=1	1		all people who bought any plates were lifting a lot of gloves .
experiment=NPI_env=quantifier_npi=any_licensor=1_scope=1_npi-present=0	1		all people who bought the plates were lifting a lot of gloves .
experiment=NPI_env=quantifier_npi=any_licensor=1_scope=0_npi-present=1	0		all people who bought the plates were lifting any gloves .
experiment=NPI_env=quantifier_npi=any_licensor=1_scope=0_npi-present=0	1		all people who bought the plates were lifting the gloves .
experiment=NPI_env=quantifier_npi=any_licensor=0_scope=1_npi-present=1	0		the doctors who saw any forks see books .
experiment=NPI_env=quantifier_npi=any_licensor=0_scope=1_npi-present=0	1		the doctors who saw the forks see books .
experiment=NPI_env=quantifier_npi=any_licensor=0_scope=0_npi-present=1	0		the doctors who saw some forks see any books .
experiment=NPI_env=quantifier_npi=any_licensor=0_scope=0_npi-present=0	1		the doctors who saw some forks see the books .
experiment=NPI_env=quantifier_npi=any_licensor=1_scope=1_npi-present=1	1		every lady who would lift any dishes lifted some rugs .
experiment=NPI_env=quantifier_npi=any_licensor=1_scope=1_npi-present=0	1		every lady who would lift the dishes lifted some rugs .
experiment=NPI_env=quantifier_npi=any_licensor=1_scope=0_npi-present=1	0		every lady who would lift dishes lifted any rugs .
experiment=NPI_env=quantifier_npi=any_licensor=1_scope=0_npi-present=0	1		every lady who would lift dishes lifted the rugs .
experiment=NPI_env=quantifier_npi=any_licensor=1_scope=1_npi-present=1	1		no child who liked any pants had some cars .
experiment=NPI_env=quantifier_npi=any_licensor=1_scope=1_npi-present=0	1		no child who liked the pants had some cars .
experiment=NPI_env=quantifier_npi=any_licensor=1_scope=1_npi-present=1	1		no child who liked some pants had any cars .
experiment=NPI_env=quantifier_npi=any_licensor=1_scope=1_npi-present=0	1		no child who liked some pants had the cars .
experiment=NPI_env=quantifier_npi=any_licensor=1_scope=1_npi-present=1	1		no gal who admired any glasses would admire more than three glasses .
experiment=NPI_env=quantifier_npi=any_licensor=1_scope=1_npi-present=0	1		no gal who admired the glasses would admire more than three glasses .
experiment=NPI_env=quantifier_npi=any_licensor=1_scope=1_npi-present=1	1		no gal who admired a lot of glasses would admire any glasses .
experiment=NPI_env=quantifier_npi=any_licensor=1_scope=1_npi-present=0	1		no gal who admired a lot of glasses would admire the glasses .
experiment=NPI_env=quantifier_npi=any_licensor=0_scope=1_npi-present=1	0		some lady who was bringing any chairs broke many books .
experiment=NPI_env=quantifier_npi=any_licensor=0_scope=1_npi-present=0	1		some lady who was bringing the chairs broke many books .
experiment=NPI_env=quantifier_npi=any_licensor=0_scope=0_npi-present=1	0		some lady who was bringing some chairs broke any books .
experiment=NPI_env=quantifier_npi=any_licensor=0_scope=0_npi-present=0	1		some lady who was bringing some chairs broke the books .
experiment=NPI_env=quantifier_npi=any_licensor=1_scope=1_npi-present=1	1		every waitress who has lifted any glasses should bring many cars .
experiment=NPI_env=quantifier_npi=any_licensor=1_scope=1_npi-present=0	1		every waitress who has lifted the glasses should bring many cars .
experiment=NPI_env=quantifier_npi=any_licensor=1_scope=0_npi-present=1	0		every waitress who has lifted more than three glasses should bring any cars .
experiment=NPI_env=quantifier_npi=any_licensor=1_scope=0_npi-present=0	1		every waitress who has lifted more than three glasses should bring the cars .
experiment=NPI_env=quantifier_npi=any_licensor=0_scope=1_npi-present=1	0		many customers who will bring any chairs buy a lot of couches .
experiment=NPI_env=quantifier_npi=any_licensor=0_scope=1_npi-present=0	1		many customers who will bring the chairs buy a lot of couches .
experiment=NPI_env=quantifier_npi=any_licensor=0_scope=0_npi-present=1	0		many customers who will bring a lot of chairs buy any couches .
experiment=NPI_env=quantifier_npi=any_licensor=0_scope=0_npi-present=0	1		many customers who will bring a lot of chairs buy the couches .
experiment=NPI_env=quantifier_npi=any_licensor=1_scope=1_npi-present=1	1		no child who does take any glasses can buy many plates .
experiment=NPI_env=quantifier_npi=any_licensor=1_scope=1_npi-present=0	1		no child who does take the glasses can buy many plates .
experiment=NPI_env=quantifier_npi=any_licensor=1_scope=1_npi-present=1	1		no child who does take the glasses can buy any plates .
experiment=NPI_env=quantifier_npi=any_licensor=1_scope=1_npi-present=0	1		no child who does take the glasses can buy the plates .
experiment=NPI_env=quantifier_npi=any_licensor=1_scope=1_npi-present=1	1		any women who had admired any dishes lifted forks .
experiment=NPI_env=quantifier_npi=any_licensor=1_scope=1_npi-present=0	1		any women who had admired the dishes lifted forks .
experiment=NPI_env=quantifier_npi=any_licensor=1_scope=0_npi-present=1	0		any women who had admired many dishes lifted any forks .
experiment=NPI_env=quantifier_npi=any_licensor=1_scope=0_npi-present=0	1		any women who had admired many dishes lifted the forks .
experiment=NPI_env=quantifier_npi=any_licensor=0_scope=1_npi-present=1	0		some student who wears any shoes had admired many cups .
experiment=NPI_env=quantifier_npi=any_licensor=0_scope=1_npi-present=0	1		some student who wears the shoes had admired many cups .
experiment=NPI_env=quantifier_npi=any_licensor=0_scope=0_npi-present=1	0		some student who wears the shoes had admired any cups .
experiment=NPI_env=quantifier_npi=any_licensor=0_scope=0_npi-present=0	1		some student who wears the shoes had admired the cups .
experiment=NPI_env=quantifier_npi=any_licensor=1_scope=1_npi-present=1	1		all humans who admire any cars might wear more than three gloves .
experiment=NPI_env=quantifier_npi=any_licensor=1_scope=1_npi-present=0	1		all humans who admire the cars might wear more than three gloves .
experiment=NPI_env=quantifier_npi=any_licensor=1_scope=0_npi-present=1	0		all humans who admire cars might wear any gloves .
experiment=NPI_env=quantifier_npi=any_licensor=1_scope=0_npi-present=0	1		all humans who admire cars might wear the gloves .
experiment=NPI_env=quantifier_npi=any_licensor=1_scope=1_npi-present=1	1		every kid who was admiring any books was wearing some gloves .
experiment=NPI_env=quantifier_npi=any_licensor=1_scope=1_npi-present=0	1		every kid who was admiring the books was wearing some gloves .
experiment=NPI_env=quantifier_npi=any_licensor=1_scope=0_npi-present=1	0		every kid who was admiring books was wearing any gloves .
experiment=NPI_env=quantifier_npi=any_licensor=1_scope=0_npi-present=0	1		every kid who was admiring books was wearing the gloves .
experiment=NPI_env=quantifier_npi=any_licensor=0_scope=1_npi-present=1	0		women who sold any rugs have lifted more than three cups .
experiment=NPI_env=quantifier_npi=any_licensor=0_scope=1_npi-present=0	1		women who sold the rugs have lifted more than three cups .
experiment=NPI_env=quantifier_npi=any_licensor=0_scope=0_npi-present=1	0		women who sold more than three rugs have lifted any cups .
experiment=NPI_env=quantifier_npi=any_licensor=0_scope=0_npi-present=0	1		women who sold more than three rugs have lifted the cups .
experiment=NPI_env=quantifier_npi=any_licensor=0_scope=1_npi-present=1	0		customers who took any chairs had sold a lot of cups .
experiment=NPI_env=quantifier_npi=any_licensor=0_scope=1_npi-present=0	1		customers who took the chairs had sold a lot of cups .
experiment=NPI_env=quantifier_npi=any_licensor=0_scope=0_npi-present=1	0		customers who took the chairs had sold any cups .
experiment=NPI_env=quantifier_npi=any_licensor=0_scope=0_npi-present=0	1		customers who took the chairs had sold the cups .
experiment=NPI_env=quantifier_npi=any_licensor=0_scope=1_npi-present=1	0		the pedestrian who has admired any books bought some dishes .
experiment=NPI_env=quantifier_npi=any_licensor=0_scope=1_npi-present=0	1		the pedestrian who has admired the books bought some dishes .
experiment=NPI_env=quantifier_npi=any_licensor=0_scope=0_npi-present=1	0		the pedestrian who has admired more than three books bought any dishes .
experiment=NPI_env=quantifier_npi=any_licensor=0_scope=0_npi-present=0	1		the pedestrian who has admired more than three books bought the dishes .
experiment=NPI_env=quantifier_npi=any_licensor=1_scope=1_npi-present=1	1		any kids who had worn any shoes wear gloves .
experiment=NPI_env=quantifier_npi=any_licensor=1_scope=1_npi-present=0	1		any kids who had worn the shoes wear gloves .
experiment=NPI_env=quantifier_npi=any_licensor=1_scope=0_npi-present=1	0		any kids who had worn a lot of shoes wear any gloves .
experiment=NPI_env=quantifier_npi=any_licensor=1_scope=0_npi-present=0	1		any kids who had worn a lot of shoes wear the gloves .
experiment=NPI_env=quantifier_npi=any_licensor=1_scope=1_npi-present=1	1		no lady who can clean any rugs had cleaned the cups .
experiment=NPI_env=quantifier_npi=any_licensor=1_scope=1_npi-present=0	1		no lady who can clean the rugs had cleaned the cups .
experiment=NPI_env=quantifier_npi=any_licensor=1_scope=1_npi-present=1	1		no lady who can clean some rugs had cleaned any cups .
experiment=NPI_env=quantifier_npi=any_licensor=1_scope=1_npi-present=0	1		no lady who can clean some rugs had cleaned the cups .
experiment=NPI_env=quantifier_npi=any_licensor=1_scope=1_npi-present=1	1		every teacher who was bringing any dishes is lifting a lot of plates .
experiment=NPI_env=quantifier_npi=any_licensor=1_scope=1_npi-present=0	1		every teacher who was bringing the dishes is lifting a lot of plates .
experiment=NPI_env=quantifier_npi=any_licensor=1_scope=0_npi-present=1	0		every teacher who was bringing some dishes is lifting any plates .
experiment=NPI_env=quantifier_npi=any_licensor=1_scope=0_npi-present=0	1		every teacher who was bringing some dishes is lifting the plates .
experiment=NPI_env=quantifier_npi=any_licensor=0_scope=1_npi-present=1	0		a lot of dudes who like any gloves broke a lot of books .
experiment=NPI_env=quantifier_npi=any_licensor=0_scope=1_npi-present=0	1		a lot of dudes who like the gloves broke a lot of books .
experiment=NPI_env=quantifier_npi=any_licensor=0_scope=0_npi-present=1	0		a lot of dudes who like gloves broke any books .
experiment=NPI_env=quantifier_npi=any_licensor=0_scope=0_npi-present=0	1		a lot of dudes who like gloves broke the books .
experiment=NPI_env=quantifier_npi=any_licensor=1_scope=1_npi-present=1	1		every actress who is cleaning any couches has taken many cups .
experiment=NPI_env=quantifier_npi=any_licensor=1_scope=1_npi-present=0	1		every actress who is cleaning the couches has taken many cups .
experiment=NPI_env=quantifier_npi=any_licensor=1_scope=0_npi-present=1	0		every actress who is cleaning a lot of couches has taken any cups .
experiment=NPI_env=quantifier_npi=any_licensor=1_scope=0_npi-present=0	1		every actress who is cleaning a lot of couches has taken the cups .
experiment=NPI_env=quantifier_npi=any_licensor=1_scope=1_npi-present=1	1		every lady who liked any dishes is selling many glasses .
experiment=NPI_env=quantifier_npi=any_licensor=1_scope=1_npi-present=0	1		every lady who liked the dishes is selling many glasses .
experiment=NPI_env=quantifier_npi=any_licensor=1_scope=0_npi-present=1	0		every lady who liked some dishes is selling any glasses .
experiment=NPI_env=quantifier_npi=any_licensor=1_scope=0_npi-present=0	1		every lady who liked some dishes is selling the glasses .
experiment=NPI_env=quantifier_npi=any_licensor=1_scope=1_npi-present=1	1		few pedestrians who might like any glasses took glasses .
experiment=NPI_env=quantifier_npi=any_licensor=1_scope=1_npi-present=0	1		few pedestrians who might like the glasses took glasses .
experiment=NPI_env=quantifier_npi=any_licensor=1_scope=1_npi-present=1	1		few pedestrians who might like glasses took any glasses .
experiment=NPI_env=quantifier_npi=any_licensor=1_scope=1_npi-present=0	1		few pedestrians who might like glasses took the glasses .
experiment=NPI_env=quantifier_npi=any_licensor=0_scope=1_npi-present=1	0		women who will wear any pants break some couches .
experiment=NPI_env=quantifier_npi=any_licensor=0_scope=1_npi-present=0	1		women who will wear the pants break some couches .
experiment=NPI_env=quantifier_npi=any_licensor=0_scope=0_npi-present=1	0		women who will wear pants break any couches .
experiment=NPI_env=quantifier_npi=any_licensor=0_scope=0_npi-present=0	1		women who will wear pants break the couches .
experiment=NPI_env=quantifier_npi=any_licensor=1_scope=1_npi-present=1	1		any adults who sell any glasses admired a lot of rugs .
experiment=NPI_env=quantifier_npi=any_licensor=1_scope=1_npi-present=0	1		any adults who sell the glasses admired a lot of rugs .
experiment=NPI_env=quantifier_npi=any_licensor=1_scope=0_npi-present=1	0		any adults who sell the glasses admired any rugs .
experiment=NPI_env=quantifier_npi=any_licensor=1_scope=0_npi-present=0	1		any adults who sell the glasses admired the rugs .
experiment=NPI_env=quantifier_npi=any_licensor=1_scope=1_npi-present=1	1		fewer than three girls who wear any glasses are bringing more than three cups .
experiment=NPI_env=quantifier_npi=any_licensor=1_scope=1_npi-present=0	1		fewer than three girls who wear the glasses are bringing more than three cups .
experiment=NPI_env=quantifier_npi=any_licensor=1_scope=1_npi-present=1	1		fewer than three girls who wear glasses are bringing any cups .
experiment=NPI_env=quantifier_npi=any_licensor=1_scope=1_npi-present=0	1		fewer than three girls who wear glasses are bringing the cups .
experiment=NPI_env=quantifier_npi=any_licensor=0_scope=1_npi-present=1	0		the drivers who wore any gloves did have a lot of plates .
experiment=NPI_env=quantifier_npi=any_licensor=0_scope=1_npi-present=0	1		the drivers who wore the gloves did have a lot of plates .
experiment=NPI_env=quantifier_npi=any_licensor=0_scope=0_npi-present=1	0		the drivers who wore a lot of gloves did have any plates .
experiment=NPI_env=quantifier_npi=any_licensor=0_scope=0_npi-present=0	1		the drivers who wore a lot of gloves did have the plates .
experiment=NPI_env=quantifier_npi=any_licensor=1_scope=1_npi-present=1	1		fewer than three guys who had taken any dishes lift many dishes .
experiment=NPI_env=quantifier_npi=any_licensor=1_scope=1_npi-present=0	1		fewer than three guys who had taken the dishes lift many dishes .
experiment=NPI_env=quantifier_npi=any_licensor=1_scope=1_npi-present=1	1		fewer than three guys who had taken the dishes lift any dishes .
experiment=NPI_env=quantifier_npi=any_licensor=1_scope=1_npi-present=0	1		fewer than three guys who had taken the dishes lift the dishes .
experiment=NPI_env=quantifier_npi=any_licensor=1_scope=1_npi-present=1	1		every kid who has taken any shoes had sold some couches .
experiment=NPI_env=quantifier_npi=any_licensor=1_scope=1_npi-present=0	1		every kid who has taken the shoes had sold some couches .
experiment=NPI_env=quantifier_npi=any_licensor=1_scope=0_npi-present=1	0		every kid who has taken a lot of shoes had sold any couches .
experiment=NPI_env=quantifier_npi=any_licensor=1_scope=0_npi-present=0	1		every kid who has taken a lot of shoes had sold the couches .
experiment=NPI_env=quantifier_npi=any_licensor=1_scope=1_npi-present=1	1		few kids who brought any books clean more than three forks .
experiment=NPI_env=quantifier_npi=any_licensor=1_scope=1_npi-present=0	1		few kids who brought the books clean more than three forks .
experiment=NPI_env=quantifier_npi=any_licensor=1_scope=1_npi-present=1	1		few kids who brought many books clean any forks .
experiment=NPI_env=quantifier_npi=any_licensor=1_scope=1_npi-present=0	1		few kids who brought many books clean the forks .
experiment=NPI_env=quantifier_npi=any_licensor=1_scope=1_npi-present=1	1		few waitresses who lift any forks might take many couches .
experiment=NPI_env=quantifier_npi=any_licensor=1_scope=1_npi-present=0	1		few waitresses who lift the forks might take many couches .
experiment=NPI_env=quantifier_npi=any_licensor=1_scope=1_npi-present=1	1		few waitresses who lift the forks might take any couches .
experiment=NPI_env=quantifier_npi=any_licensor=1_scope=1_npi-present=0	1		few waitresses who lift the forks might take the couches .
experiment=NPI_env=quantifier_npi=any_licensor=1_scope=1_npi-present=1	1		few girls who liked any pants has a lot of dishes .
experiment=NPI_env=quantifier_npi=any_licensor=1_scope=1_npi-present=0	1		few girls who liked the pants has a lot of dishes .
experiment=NPI_env=quantifier_npi=any_licensor=1_scope=1_npi-present=1	1		few girls who liked pants has any dishes .
experiment=NPI_env=quantifier_npi=any_licensor=1_scope=1_npi-present=0	1		few girls who liked pants has the dishes .
experiment=NPI_env=quantifier_npi=any_licensor=1_scope=1_npi-present=1	1		no drivers who do have any shoes clean some glasses .
experiment=NPI_env=quantifier_npi=any_licensor=1_scope=1_npi-present=0	1		no drivers who do have the shoes clean some glasses .
experiment=NPI_env=quantifier_npi=any_licensor=1_scope=1_npi-present=1	1		no drivers who do have some shoes clean any glasses .
experiment=NPI_env=quantifier_npi=any_licensor=1_scope=1_npi-present=0	1		no drivers who do have some shoes clean the glasses .
experiment=NPI_env=quantifier_npi=any_licensor=1_scope=1_npi-present=1	1		every human who might like any cups did bring the couches .
experiment=NPI_env=quantifier_npi=any_licensor=1_scope=1_npi-present=0	1		every human who might like the cups did bring the couches .
experiment=NPI_env=quantifier_npi=any_licensor=1_scope=0_npi-present=1	0		every human who might like cups did bring any couches .
experiment=NPI_env=quantifier_npi=any_licensor=1_scope=0_npi-present=0	1		every human who might like cups did bring the couches .
experiment=NPI_env=quantifier_npi=any_licensor=1_scope=1_npi-present=1	1		no actress who would sell any pants could take more than three glasses .
experiment=NPI_env=quantifier_npi=any_licensor=1_scope=1_npi-present=0	1		no actress who would sell the pants could take more than three glasses .
experiment=NPI_env=quantifier_npi=any_licensor=1_scope=1_npi-present=1	1		no actress who would sell more than three pants could take any glasses .
experiment=NPI_env=quantifier_npi=any_licensor=1_scope=1_npi-present=0	1		no actress who would sell more than three pants could take the glasses .
experiment=NPI_env=quantifier_npi=any_licensor=0_scope=1_npi-present=1	0		the boys who like any glasses could admire more than three chairs .
experiment=NPI_env=quantifier_npi=any_licensor=0_scope=1_npi-present=0	1		the boys who like the glasses could admire more than three chairs .
experiment=NPI_env=quantifier_npi=any_licensor=0_scope=0_npi-present=1	0		the boys who like glasses could admire any chairs .
experiment=NPI_env=quantifier_npi=any_licensor=0_scope=0_npi-present=0	1		the boys who like glasses could admire the chairs .
experiment=NPI_env=quantifier_npi=any_licensor=1_scope=1_npi-present=1	1		all gals who like any books were bringing some glasses .
experiment=NPI_env=quantifier_npi=any_licensor=1_scope=1_npi-present=0	1		all gals who like the books were bringing some glasses .
experiment=NPI_env=quantifier_npi=any_licensor=1_scope=0_npi-present=1	0		all gals who like books were bringing any glasses .
experiment=NPI_env=quantifier_npi=any_licensor=1_scope=0_npi-present=0	1		all gals who like books were bringing the glasses .
experiment=NPI_env=quantifier_npi=any_licensor=1_scope=1_npi-present=1	1		every child who had brought any glasses brought more than three plates .
experiment=NPI_env=quantifier_npi=any_licensor=1_scope=1_npi-present=0	1		every child who had brought the glasses brought more than three plates .
experiment=NPI_env=quantifier_npi=any_licensor=1_scope=0_npi-present=1	0		every child who had brought a lot of glasses brought any plates .
experiment=NPI_env=quantifier_npi=any_licensor=1_scope=0_npi-present=0	1		every child who had brought a lot of glasses brought the plates .
experiment=NPI_env=quantifier_npi=any_licensor=1_scope=1_npi-present=1	1		few guests who have bought any books had worn shoes .
experiment=NPI_env=quantifier_npi=any_licensor=1_scope=1_npi-present=0	1		few guests who have bought the books had worn shoes .
