experiment=NPI-env=only-npi=ever-crucial_item=_-licensor=1-scope=1-npi_present=1	1		only the customer has ever returned to the banks .
experiment=NPI-env=only-npi=ever-crucial_item=_-licensor=1-scope=1-npi_present=0	1		only the customer has sometimes returned to the banks .
experiment=NPI-env=only-npi=ever-crucial_item=_-licensor=1-scope=0-npi_present=1	0		the customer has ever returned to only the banks .
experiment=NPI-env=only-npi=ever-crucial_item=_-licensor=1-scope=0-npi_present=0	1		the customer has sometimes returned to only the banks .
experiment=NPI-env=only-npi=ever-crucial_item=_-licensor=0-scope=1-npi_present=1	0		the customer has also ever returned to the banks .
experiment=NPI-env=only-npi=ever-crucial_item=_-licensor=0-scope=1-npi_present=0	1		the customer has also sometimes returned to the banks .
experiment=NPI-env=only-npi=ever-crucial_item=_-licensor=0-scope=0-npi_present=1	0		the customer has ever also returned to the banks .
experiment=NPI-env=only-npi=ever-crucial_item=_-licensor=0-scope=0-npi_present=0	1		the customer has sometimes also returned to the banks .
experiment=NPI-env=only-npi=ever-crucial_item=_-licensor=1-scope=1-npi_present=1	1		only the drivers ever talk to the men .
experiment=NPI-env=only-npi=ever-crucial_item=_-licensor=1-scope=1-npi_present=0	1		only the drivers sometimes talk to the men .
experiment=NPI-env=only-npi=ever-crucial_item=_-licensor=1-scope=0-npi_present=1	0		the drivers ever talk to only the men .
experiment=NPI-env=only-npi=ever-crucial_item=_-licensor=1-scope=0-npi_present=0	1		the drivers sometimes talk to only the men .
experiment=NPI-env=only-npi=ever-crucial_item=_-licensor=0-scope=1-npi_present=1	0		the drivers also ever talk to the men .
experiment=NPI-env=only-npi=ever-crucial_item=_-licensor=0-scope=1-npi_present=0	1		the drivers also sometimes talk to the men .
experiment=NPI-env=only-npi=ever-crucial_item=_-licensor=0-scope=0-npi_present=1	0		the drivers ever also talk to the men .
experiment=NPI-env=only-npi=ever-crucial_item=_-licensor=0-scope=0-npi_present=0	1		the drivers sometimes also talk to the men .
experiment=NPI-env=only-npi=ever-crucial_item=_-licensor=1-scope=1-npi_present=1	1		only the humans might ever care for the cashiers .
experiment=NPI-env=only-npi=ever-crucial_item=_-licensor=1-scope=1-npi_present=0	1		only the humans might always care for the cashiers .
experiment=NPI-env=only-npi=ever-crucial_item=_-licensor=1-scope=0-npi_present=1	0		the humans might ever care for only the cashiers .
experiment=NPI-env=only-npi=ever-crucial_item=_-licensor=1-scope=0-npi_present=0	1		the humans might always care for only the cashiers .
experiment=NPI-env=only-npi=ever-crucial_item=_-licensor=0-scope=1-npi_present=1	0		the humans might also ever care for the cashiers .
experiment=NPI-env=only-npi=ever-crucial_item=_-licensor=0-scope=1-npi_present=0	1		the humans might also always care for the cashiers .
experiment=NPI-env=only-npi=ever-crucial_item=_-licensor=0-scope=0-npi_present=1	0		the humans might ever also care for the cashiers .
experiment=NPI-env=only-npi=ever-crucial_item=_-licensor=0-scope=0-npi_present=0	1		the humans might always also care for the cashiers .
experiment=NPI-env=only-npi=ever-crucial_item=_-licensor=1-scope=1-npi_present=1	1		only an actress can ever tour the cafes .
experiment=NPI-env=only-npi=ever-crucial_item=_-licensor=1-scope=1-npi_present=0	1		only an actress can now tour the cafes .
experiment=NPI-env=only-npi=ever-crucial_item=_-licensor=1-scope=0-npi_present=1	0		an actress can ever tour only the cafes .
experiment=NPI-env=only-npi=ever-crucial_item=_-licensor=1-scope=0-npi_present=0	1		an actress can now tour only the cafes .
experiment=NPI-env=only-npi=ever-crucial_item=_-licensor=0-scope=1-npi_present=1	0		an actress can also ever tour the cafes .
experiment=NPI-env=only-npi=ever-crucial_item=_-licensor=0-scope=1-npi_present=0	1		an actress can also now tour the cafes .
experiment=NPI-env=only-npi=ever-crucial_item=_-licensor=0-scope=0-npi_present=1	0		an actress can ever also tour the cafes .
experiment=NPI-env=only-npi=ever-crucial_item=_-licensor=0-scope=0-npi_present=0	1		an actress can now also tour the cafes .
experiment=NPI-env=only-npi=ever-crucial_item=_-licensor=1-scope=1-npi_present=1	1		only the gals ever cleaned the books .
experiment=NPI-env=only-npi=ever-crucial_item=_-licensor=1-scope=1-npi_present=0	1		only the gals now cleaned the books .
experiment=NPI-env=only-npi=ever-crucial_item=_-licensor=1-scope=0-npi_present=1	0		the gals ever cleaned only the books .
experiment=NPI-env=only-npi=ever-crucial_item=_-licensor=1-scope=0-npi_present=0	1		the gals now cleaned only the books .
experiment=NPI-env=only-npi=ever-crucial_item=_-licensor=0-scope=1-npi_present=1	0		the gals also ever cleaned the books .
experiment=NPI-env=only-npi=ever-crucial_item=_-licensor=0-scope=1-npi_present=0	1		the gals also now cleaned the books .
experiment=NPI-env=only-npi=ever-crucial_item=_-licensor=0-scope=0-npi_present=1	0		the gals ever also cleaned the books .
experiment=NPI-env=only-npi=ever-crucial_item=_-licensor=0-scope=0-npi_present=0	1		the gals now also cleaned the books .
experiment=NPI-env=only-npi=ever-crucial_item=_-licensor=1-scope=1-npi_present=1	1		only the cashier ever works with the pedestrians .
experiment=NPI-env=only-npi=ever-crucial_item=_-licensor=1-scope=1-npi_present=0	1		only the cashier always works with the pedestrians .
experiment=NPI-env=only-npi=ever-crucial_item=_-licensor=1-scope=0-npi_present=1	0		the cashier ever works with only the pedestrians .
experiment=NPI-env=only-npi=ever-crucial_item=_-licensor=1-scope=0-npi_present=0	1		the cashier always works with only the pedestrians .
experiment=NPI-env=only-npi=ever-crucial_item=_-licensor=0-scope=1-npi_present=1	0		the cashier also ever works with the pedestrians .
experiment=NPI-env=only-npi=ever-crucial_item=_-licensor=0-scope=1-npi_present=0	1		the cashier also always works with the pedestrians .
experiment=NPI-env=only-npi=ever-crucial_item=_-licensor=0-scope=0-npi_present=1	0		the cashier ever also works with the pedestrians .
experiment=NPI-env=only-npi=ever-crucial_item=_-licensor=0-scope=0-npi_present=0	1		the cashier always also works with the pedestrians .
experiment=NPI-env=only-npi=ever-crucial_item=_-licensor=1-scope=1-npi_present=1	1		only the adult had ever remembered the commentaries .
experiment=NPI-env=only-npi=ever-crucial_item=_-licensor=1-scope=1-npi_present=0	1		only the adult had often remembered the commentaries .
experiment=NPI-env=only-npi=ever-crucial_item=_-licensor=1-scope=0-npi_present=1	0		the adult had ever remembered only the commentaries .
experiment=NPI-env=only-npi=ever-crucial_item=_-licensor=1-scope=0-npi_present=0	1		the adult had often remembered only the commentaries .
experiment=NPI-env=only-npi=ever-crucial_item=_-licensor=0-scope=1-npi_present=1	0		the adult had also ever remembered the commentaries .
experiment=NPI-env=only-npi=ever-crucial_item=_-licensor=0-scope=1-npi_present=0	1		the adult had also often remembered the commentaries .
experiment=NPI-env=only-npi=ever-crucial_item=_-licensor=0-scope=0-npi_present=1	0		the adult had ever also remembered the commentaries .
experiment=NPI-env=only-npi=ever-crucial_item=_-licensor=0-scope=0-npi_present=0	1		the adult had often also remembered the commentaries .
experiment=NPI-env=only-npi=ever-crucial_item=_-licensor=1-scope=1-npi_present=1	1		only the guests ever listened to the ladies .
experiment=NPI-env=only-npi=ever-crucial_item=_-licensor=1-scope=1-npi_present=0	1		only the guests now listened to the ladies .
experiment=NPI-env=only-npi=ever-crucial_item=_-licensor=1-scope=0-npi_present=1	0		the guests ever listened to only the ladies .
experiment=NPI-env=only-npi=ever-crucial_item=_-licensor=1-scope=0-npi_present=0	1		the guests now listened to only the ladies .
experiment=NPI-env=only-npi=ever-crucial_item=_-licensor=0-scope=1-npi_present=1	0		the guests also ever listened to the ladies .
experiment=NPI-env=only-npi=ever-crucial_item=_-licensor=0-scope=1-npi_present=0	1		the guests also now listened to the ladies .
experiment=NPI-env=only-npi=ever-crucial_item=_-licensor=0-scope=0-npi_present=1	0		the guests ever also listened to the ladies .
experiment=NPI-env=only-npi=ever-crucial_item=_-licensor=0-scope=0-npi_present=0	1		the guests now also listened to the ladies .
experiment=NPI-env=only-npi=ever-crucial_item=_-licensor=1-scope=1-npi_present=1	1		only the teacher ever exits the hospitals .
experiment=NPI-env=only-npi=ever-crucial_item=_-licensor=1-scope=1-npi_present=0	1		only the teacher often exits the hospitals .
experiment=NPI-env=only-npi=ever-crucial_item=_-licensor=1-scope=0-npi_present=1	0		the teacher ever exits only the hospitals .
experiment=NPI-env=only-npi=ever-crucial_item=_-licensor=1-scope=0-npi_present=0	1		the teacher often exits only the hospitals .
experiment=NPI-env=only-npi=ever-crucial_item=_-licensor=0-scope=1-npi_present=1	0		the teacher also ever exits the hospitals .
experiment=NPI-env=only-npi=ever-crucial_item=_-licensor=0-scope=1-npi_present=0	1		the teacher also often exits the hospitals .
experiment=NPI-env=only-npi=ever-crucial_item=_-licensor=0-scope=0-npi_present=1	0		the teacher ever also exits the hospitals .
experiment=NPI-env=only-npi=ever-crucial_item=_-licensor=0-scope=0-npi_present=0	1		the teacher often also exits the hospitals .
experiment=NPI-env=only-npi=ever-crucial_item=_-licensor=1-scope=1-npi_present=1	1		only the student ever exited the restaurants .
experiment=NPI-env=only-npi=ever-crucial_item=_-licensor=1-scope=1-npi_present=0	1		only the student now exited the restaurants .
experiment=NPI-env=only-npi=ever-crucial_item=_-licensor=1-scope=0-npi_present=1	0		the student ever exited only the restaurants .
experiment=NPI-env=only-npi=ever-crucial_item=_-licensor=1-scope=0-npi_present=0	1		the student now exited only the restaurants .
experiment=NPI-env=only-npi=ever-crucial_item=_-licensor=0-scope=1-npi_present=1	0		the student also ever exited the restaurants .
experiment=NPI-env=only-npi=ever-crucial_item=_-licensor=0-scope=1-npi_present=0	1		the student also now exited the restaurants .
experiment=NPI-env=only-npi=ever-crucial_item=_-licensor=0-scope=0-npi_present=1	0		the student ever also exited the restaurants .
experiment=NPI-env=only-npi=ever-crucial_item=_-licensor=0-scope=0-npi_present=0	1		the student now also exited the restaurants .
experiment=NPI-env=only-npi=ever-crucial_item=_-licensor=1-scope=1-npi_present=1	1		only the humans ever talked about the commentaries .
experiment=NPI-env=only-npi=ever-crucial_item=_-licensor=1-scope=1-npi_present=0	1		only the humans often talked about the commentaries .
experiment=NPI-env=only-npi=ever-crucial_item=_-licensor=1-scope=0-npi_present=1	0		the humans ever talked about only the commentaries .
experiment=NPI-env=only-npi=ever-crucial_item=_-licensor=1-scope=0-npi_present=0	1		the humans often talked about only the commentaries .
experiment=NPI-env=only-npi=ever-crucial_item=_-licensor=0-scope=1-npi_present=1	0		the humans also ever talked about the commentaries .
experiment=NPI-env=only-npi=ever-crucial_item=_-licensor=0-scope=1-npi_present=0	1		the humans also often talked about the commentaries .
experiment=NPI-env=only-npi=ever-crucial_item=_-licensor=0-scope=0-npi_present=1	0		the humans ever also talked about the commentaries .
experiment=NPI-env=only-npi=ever-crucial_item=_-licensor=0-scope=0-npi_present=0	1		the humans often also talked about the commentaries .
experiment=NPI-env=only-npi=ever-crucial_item=_-licensor=1-scope=1-npi_present=1	1		only the humans ever know the teachers .
experiment=NPI-env=only-npi=ever-crucial_item=_-licensor=1-scope=1-npi_present=0	1		only the humans now know the teachers .
experiment=NPI-env=only-npi=ever-crucial_item=_-licensor=1-scope=0-npi_present=1	0		the humans ever know only the teachers .
experiment=NPI-env=only-npi=ever-crucial_item=_-licensor=1-scope=0-npi_present=0	1		the humans now know only the teachers .
experiment=NPI-env=only-npi=ever-crucial_item=_-licensor=0-scope=1-npi_present=1	0		the humans also ever know the teachers .
experiment=NPI-env=only-npi=ever-crucial_item=_-licensor=0-scope=1-npi_present=0	1		the humans also now know the teachers .
experiment=NPI-env=only-npi=ever-crucial_item=_-licensor=0-scope=0-npi_present=1	0		the humans ever also know the teachers .
experiment=NPI-env=only-npi=ever-crucial_item=_-licensor=0-scope=0-npi_present=0	1		the humans now also know the teachers .
experiment=NPI-env=only-npi=ever-crucial_item=_-licensor=1-scope=1-npi_present=1	1		only the guests ever escaped from the public parks .
experiment=NPI-env=only-npi=ever-crucial_item=_-licensor=1-scope=1-npi_present=0	1		only the guests often escaped from the public parks .
experiment=NPI-env=only-npi=ever-crucial_item=_-licensor=1-scope=0-npi_present=1	0		the guests ever escaped from only the public parks .
experiment=NPI-env=only-npi=ever-crucial_item=_-licensor=1-scope=0-npi_present=0	1		the guests often escaped from only the public parks .
experiment=NPI-env=only-npi=ever-crucial_item=_-licensor=0-scope=1-npi_present=1	0		the guests also ever escaped from the public parks .
experiment=NPI-env=only-npi=ever-crucial_item=_-licensor=0-scope=1-npi_present=0	1		the guests also often escaped from the public parks .
experiment=NPI-env=only-npi=ever-crucial_item=_-licensor=0-scope=0-npi_present=1	0		the guests ever also escaped from the public parks .
experiment=NPI-env=only-npi=ever-crucial_item=_-licensor=0-scope=0-npi_present=0	1		the guests often also escaped from the public parks .
experiment=NPI-env=only-npi=ever-crucial_item=_-licensor=1-scope=1-npi_present=1	1		only the pedestrian ever listens to the cashiers .
experiment=NPI-env=only-npi=ever-crucial_item=_-licensor=1-scope=1-npi_present=0	1		only the pedestrian often listens to the cashiers .
experiment=NPI-env=only-npi=ever-crucial_item=_-licensor=1-scope=0-npi_present=1	0		the pedestrian ever listens to only the cashiers .
experiment=NPI-env=only-npi=ever-crucial_item=_-licensor=1-scope=0-npi_present=0	1		the pedestrian often listens to only the cashiers .
experiment=NPI-env=only-npi=ever-crucial_item=_-licensor=0-scope=1-npi_present=1	0		the pedestrian also ever listens to the cashiers .
experiment=NPI-env=only-npi=ever-crucial_item=_-licensor=0-scope=1-npi_present=0	1		the pedestrian also often listens to the cashiers .
experiment=NPI-env=only-npi=ever-crucial_item=_-licensor=0-scope=0-npi_present=1	0		the pedestrian ever also listens to the cashiers .
experiment=NPI-env=only-npi=ever-crucial_item=_-licensor=0-scope=0-npi_present=0	1		the pedestrian often also listens to the cashiers .
experiment=NPI-env=only-npi=ever-crucial_item=_-licensor=1-scope=1-npi_present=1	1		only the students might ever praise the stories .
experiment=NPI-env=only-npi=ever-crucial_item=_-licensor=1-scope=1-npi_present=0	1		only the students might always praise the stories .
experiment=NPI-env=only-npi=ever-crucial_item=_-licensor=1-scope=0-npi_present=1	0		the students might ever praise only the stories .
experiment=NPI-env=only-npi=ever-crucial_item=_-licensor=1-scope=0-npi_present=0	1		the students might always praise only the stories .
experiment=NPI-env=only-npi=ever-crucial_item=_-licensor=0-scope=1-npi_present=1	0		the students might also ever praise the stories .
experiment=NPI-env=only-npi=ever-crucial_item=_-licensor=0-scope=1-npi_present=0	1		the students might also always praise the stories .
experiment=NPI-env=only-npi=ever-crucial_item=_-licensor=0-scope=0-npi_present=1	0		the students might ever also praise the stories .
experiment=NPI-env=only-npi=ever-crucial_item=_-licensor=0-scope=0-npi_present=0	1		the students might always also praise the stories .
experiment=NPI-env=only-npi=ever-crucial_item=_-licensor=1-scope=1-npi_present=1	1		only the gal does ever admire the plates .
experiment=NPI-env=only-npi=ever-crucial_item=_-licensor=1-scope=1-npi_present=0	1		only the gal does sometimes admire the plates .
experiment=NPI-env=only-npi=ever-crucial_item=_-licensor=1-scope=0-npi_present=1	0		the gal does ever admire only the plates .
experiment=NPI-env=only-npi=ever-crucial_item=_-licensor=1-scope=0-npi_present=0	1		the gal does sometimes admire only the plates .
experiment=NPI-env=only-npi=ever-crucial_item=_-licensor=0-scope=1-npi_present=1	0		the gal does also ever admire the plates .
experiment=NPI-env=only-npi=ever-crucial_item=_-licensor=0-scope=1-npi_present=0	1		the gal does also sometimes admire the plates .
experiment=NPI-env=only-npi=ever-crucial_item=_-licensor=0-scope=0-npi_present=1	0		the gal does ever also admire the plates .
experiment=NPI-env=only-npi=ever-crucial_item=_-licensor=0-scope=0-npi_present=0	1		the gal does sometimes also admire the plates .
experiment=NPI-env=only-npi=ever-crucial_item=_-licensor=1-scope=1-npi_present=1	1		only the guest had ever respected the malls .
experiment=NPI-env=only-npi=ever-crucial_item=_-licensor=1-scope=1-npi_present=0	1		only the guest had now respected the malls .
experiment=NPI-env=only-npi=ever-crucial_item=_-licensor=1-scope=0-npi_present=1	0		the guest had ever respected only the malls .
experiment=NPI-env=only-npi=ever-crucial_item=_-licensor=1-scope=0-npi_present=0	1		the guest had now respected only the malls .
experiment=NPI-env=only-npi=ever-crucial_item=_-licensor=0-scope=1-npi_present=1	0		the guest had also ever respected the malls .
experiment=NPI-env=only-npi=ever-crucial_item=_-licensor=0-scope=1-npi_present=0	1		the guest had also now respected the malls .
experiment=NPI-env=only-npi=ever-crucial_item=_-licensor=0-scope=0-npi_present=1	0		the guest had ever also respected the malls .
experiment=NPI-env=only-npi=ever-crucial_item=_-licensor=0-scope=0-npi_present=0	1		the guest had now also respected the malls .
experiment=NPI-env=only-npi=ever-crucial_item=_-licensor=1-scope=1-npi_present=1	1		only the cashier does ever clean the books .
experiment=NPI-env=only-npi=ever-crucial_item=_-licensor=1-scope=1-npi_present=0	1		only the cashier does sometimes clean the books .
experiment=NPI-env=only-npi=ever-crucial_item=_-licensor=1-scope=0-npi_present=1	0		the cashier does ever clean only the books .
experiment=NPI-env=only-npi=ever-crucial_item=_-licensor=1-scope=0-npi_present=0	1		the cashier does sometimes clean only the books .
experiment=NPI-env=only-npi=ever-crucial_item=_-licensor=0-scope=1-npi_present=1	0		the cashier does also ever clean the books .
experiment=NPI-env=only-npi=ever-crucial_item=_-licensor=0-scope=1-npi_present=0	1		the cashier does also sometimes clean the books .
experiment=NPI-env=only-npi=ever-crucial_item=_-licensor=0-scope=0-npi_present=1	0		the cashier does ever also clean the books .
experiment=NPI-env=only-npi=ever-crucial_item=_-licensor=0-scope=0-npi_present=0	1		the cashier does sometimes also clean the books .
experiment=NPI-env=only-npi=ever-crucial_item=_-licensor=1-scope=1-npi_present=1	1		only the cashiers ever drove to the libraries .
experiment=NPI-env=only-npi=ever-crucial_item=_-licensor=1-scope=1-npi_present=0	1		only the cashiers always drove to the libraries .
experiment=NPI-env=only-npi=ever-crucial_item=_-licensor=1-scope=0-npi_present=1	0		the cashiers ever drove to only the libraries .
experiment=NPI-env=only-npi=ever-crucial_item=_-licensor=1-scope=0-npi_present=0	1		the cashiers always drove to only the libraries .
experiment=NPI-env=only-npi=ever-crucial_item=_-licensor=0-scope=1-npi_present=1	0		the cashiers also ever drove to the libraries .
experiment=NPI-env=only-npi=ever-crucial_item=_-licensor=0-scope=1-npi_present=0	1		the cashiers also always drove to the libraries .
experiment=NPI-env=only-npi=ever-crucial_item=_-licensor=0-scope=0-npi_present=1	0		the cashiers ever also drove to the libraries .
experiment=NPI-env=only-npi=ever-crucial_item=_-licensor=0-scope=0-npi_present=0	1		the cashiers always also drove to the libraries .
experiment=NPI-env=only-npi=ever-crucial_item=_-licensor=1-scope=1-npi_present=1	1		only an actor could ever hate the students .
experiment=NPI-env=only-npi=ever-crucial_item=_-licensor=1-scope=1-npi_present=0	1		only an actor could sometimes hate the students .
experiment=NPI-env=only-npi=ever-crucial_item=_-licensor=1-scope=0-npi_present=1	0		an actor could ever hate only the students .
experiment=NPI-env=only-npi=ever-crucial_item=_-licensor=1-scope=0-npi_present=0	1		an actor could sometimes hate only the students .
experiment=NPI-env=only-npi=ever-crucial_item=_-licensor=0-scope=1-npi_present=1	0		an actor could also ever hate the students .
experiment=NPI-env=only-npi=ever-crucial_item=_-licensor=0-scope=1-npi_present=0	1		an actor could also sometimes hate the students .
experiment=NPI-env=only-npi=ever-crucial_item=_-licensor=0-scope=0-npi_present=1	0		an actor could ever also hate the students .
experiment=NPI-env=only-npi=ever-crucial_item=_-licensor=0-scope=0-npi_present=0	1		an actor could sometimes also hate the students .
experiment=NPI-env=only-npi=ever-crucial_item=_-licensor=1-scope=1-npi_present=1	1		only the teacher ever passed the art galleries .
experiment=NPI-env=only-npi=ever-crucial_item=_-licensor=1-scope=1-npi_present=0	1		only the teacher always passed the art galleries .
experiment=NPI-env=only-npi=ever-crucial_item=_-licensor=1-scope=0-npi_present=1	0		the teacher ever passed only the art galleries .
experiment=NPI-env=only-npi=ever-crucial_item=_-licensor=1-scope=0-npi_present=0	1		the teacher always passed only the art galleries .
experiment=NPI-env=only-npi=ever-crucial_item=_-licensor=0-scope=1-npi_present=1	0		the teacher also ever passed the art galleries .
experiment=NPI-env=only-npi=ever-crucial_item=_-licensor=0-scope=1-npi_present=0	1		the teacher also always passed the art galleries .
experiment=NPI-env=only-npi=ever-crucial_item=_-licensor=0-scope=0-npi_present=1	0		the teacher ever also passed the art galleries .
experiment=NPI-env=only-npi=ever-crucial_item=_-licensor=0-scope=0-npi_present=0	1		the teacher always also passed the art galleries .
experiment=NPI-env=only-npi=ever-crucial_item=_-licensor=1-scope=1-npi_present=1	1		only the guys ever scan the books .
experiment=NPI-env=only-npi=ever-crucial_item=_-licensor=1-scope=1-npi_present=0	1		only the guys often scan the books .
experiment=NPI-env=only-npi=ever-crucial_item=_-licensor=1-scope=0-npi_present=1	0		the guys ever scan only the books .
experiment=NPI-env=only-npi=ever-crucial_item=_-licensor=1-scope=0-npi_present=0	1		the guys often scan only the books .
experiment=NPI-env=only-npi=ever-crucial_item=_-licensor=0-scope=1-npi_present=1	0		the guys also ever scan the books .
experiment=NPI-env=only-npi=ever-crucial_item=_-licensor=0-scope=1-npi_present=0	1		the guys also often scan the books .
experiment=NPI-env=only-npi=ever-crucial_item=_-licensor=0-scope=0-npi_present=1	0		the guys ever also scan the books .
experiment=NPI-env=only-npi=ever-crucial_item=_-licensor=0-scope=0-npi_present=0	1		the guys often also scan the books .
experiment=NPI-env=only-npi=ever-crucial_item=_-licensor=1-scope=1-npi_present=1	1		only a teenager will ever run around the grocery stores .
experiment=NPI-env=only-npi=ever-crucial_item=_-licensor=1-scope=1-npi_present=0	1		only a teenager will sometimes run around the grocery stores .
experiment=NPI-env=only-npi=ever-crucial_item=_-licensor=1-scope=0-npi_present=1	0		a teenager will ever run around only the grocery stores .
experiment=NPI-env=only-npi=ever-crucial_item=_-licensor=1-scope=0-npi_present=0	1		a teenager will sometimes run around only the grocery stores .
experiment=NPI-env=only-npi=ever-crucial_item=_-licensor=0-scope=1-npi_present=1	0		a teenager will also ever run around the grocery stores .
experiment=NPI-env=only-npi=ever-crucial_item=_-licensor=0-scope=1-npi_present=0	1		a teenager will also sometimes run around the grocery stores .
experiment=NPI-env=only-npi=ever-crucial_item=_-licensor=0-scope=0-npi_present=1	0		a teenager will ever also run around the grocery stores .
experiment=NPI-env=only-npi=ever-crucial_item=_-licensor=0-scope=0-npi_present=0	1		a teenager will sometimes also run around the grocery stores .
experiment=NPI-env=only-npi=ever-crucial_item=_-licensor=1-scope=1-npi_present=1	1		only the guest will ever take the books .
experiment=NPI-env=only-npi=ever-crucial_item=_-licensor=1-scope=1-npi_present=0	1		only the guest will always take the books .
experiment=NPI-env=only-npi=ever-crucial_item=_-licensor=1-scope=0-npi_present=1	0		the guest will ever take only the books .
experiment=NPI-env=only-npi=ever-crucial_item=_-licensor=1-scope=0-npi_present=0	1		the guest will always take only the books .
experiment=NPI-env=only-npi=ever-crucial_item=_-licensor=0-scope=1-npi_present=1	0		the guest will also ever take the books .
experiment=NPI-env=only-npi=ever-crucial_item=_-licensor=0-scope=1-npi_present=0	1		the guest will also always take the books .
experiment=NPI-env=only-npi=ever-crucial_item=_-licensor=0-scope=0-npi_present=1	0		the guest will ever also take the books .
experiment=NPI-env=only-npi=ever-crucial_item=_-licensor=0-scope=0-npi_present=0	1		the guest will always also take the books .
experiment=NPI-env=only-npi=ever-crucial_item=_-licensor=1-scope=1-npi_present=1	1		only the woman had ever cleaned the chairs .
experiment=NPI-env=only-npi=ever-crucial_item=_-licensor=1-scope=1-npi_present=0	1		only the woman had always cleaned the chairs .
experiment=NPI-env=only-npi=ever-crucial_item=_-licensor=1-scope=0-npi_present=1	0		the woman had ever cleaned only the chairs .
experiment=NPI-env=only-npi=ever-crucial_item=_-licensor=1-scope=0-npi_present=0	1		the woman had always cleaned only the chairs .
experiment=NPI-env=only-npi=ever-crucial_item=_-licensor=0-scope=1-npi_present=1	0		the woman had also ever cleaned the chairs .
