experiment=NPI_env=quantifier_npi=any_licensor=0_scope=0_npi-present=1	0		a teacher who helps doctors did respect any waiters .
experiment=NPI_env=quantifier_npi=any_licensor=0_scope=0_npi-present=0	1		a teacher who helps doctors did respect the waiters .
experiment=NPI_env=quantifier_npi=any_licensor=0_scope=1_npi-present=1	0		more than three waiters who had lifted any cups took many plates .
experiment=NPI_env=quantifier_npi=any_licensor=0_scope=1_npi-present=0	1		more than three waiters who had lifted the cups took many plates .
experiment=NPI_env=quantifier_npi=any_licensor=0_scope=0_npi-present=1	0		more than three waiters who had lifted many cups took any plates .
experiment=NPI_env=quantifier_npi=any_licensor=0_scope=0_npi-present=0	1		more than three waiters who had lifted many cups took the plates .
experiment=NPI_env=quantifier_npi=any_licensor=1_scope=1_npi-present=1	1		any waiters who wear any pants do listen to dudes .
experiment=NPI_env=quantifier_npi=any_licensor=1_scope=1_npi-present=0	1		any waiters who wear the pants do listen to dudes .
experiment=NPI_env=quantifier_npi=any_licensor=1_scope=0_npi-present=1	0		any waiters who wear some pants do listen to any dudes .
experiment=NPI_env=quantifier_npi=any_licensor=1_scope=0_npi-present=0	1		any waiters who wear some pants do listen to the dudes .
experiment=NPI_env=quantifier_npi=any_licensor=1_scope=1_npi-present=1	1		no woman who might like any glasses should admire a lot of forks .
experiment=NPI_env=quantifier_npi=any_licensor=1_scope=1_npi-present=0	1		no woman who might like the glasses should admire a lot of forks .
experiment=NPI_env=quantifier_npi=any_licensor=1_scope=1_npi-present=1	1		no woman who might like some glasses should admire any forks .
experiment=NPI_env=quantifier_npi=any_licensor=1_scope=1_npi-present=0	1		no woman who might like some glasses should admire the forks .
experiment=NPI_env=quantifier_npi=any_licensor=0_scope=1_npi-present=1	0		a lot of drivers who have hugged any guests have kissed many drivers .
experiment=NPI_env=quantifier_npi=any_licensor=0_scope=1_npi-present=0	1		a lot of drivers who have hugged the guests have kissed many drivers .
experiment=NPI_env=quantifier_npi=any_licensor=0_scope=0_npi-present=1	0		a lot of drivers who have hugged more than three guests have kissed any drivers .
experiment=NPI_env=quantifier_npi=any_licensor=0_scope=0_npi-present=0	1		a lot of drivers who have hugged more than three guests have kissed the drivers .
experiment=NPI_env=quantifier_npi=any_licensor=0_scope=1_npi-present=1	0		the teacher who loves any doctors respected some drivers .
experiment=NPI_env=quantifier_npi=any_licensor=0_scope=1_npi-present=0	1		the teacher who loves the doctors respected some drivers .
experiment=NPI_env=quantifier_npi=any_licensor=0_scope=0_npi-present=1	0		the teacher who loves a lot of doctors respected any drivers .
experiment=NPI_env=quantifier_npi=any_licensor=0_scope=0_npi-present=0	1		the teacher who loves a lot of doctors respected the drivers .
experiment=NPI_env=quantifier_npi=ever_licensor=0_scope=1_npi-present=1	0		some dudes who ever help some people hug the actors .
experiment=NPI_env=quantifier_npi=ever_licensor=0_scope=1_npi-present=0	1		some dudes who once help some people hug the actors .
experiment=NPI_env=quantifier_npi=ever_licensor=0_scope=0_npi-present=1	0		some dudes who help some people ever hug the actors .
experiment=NPI_env=quantifier_npi=ever_licensor=0_scope=0_npi-present=0	1		some dudes who help some people once hug the actors .
experiment=NPI_env=quantifier_npi=ever_licensor=0_scope=1_npi-present=1	0		women who would ever break couches were bringing the pants .
experiment=NPI_env=quantifier_npi=ever_licensor=0_scope=1_npi-present=0	1		women who would once break couches were bringing the pants .
experiment=NPI_env=quantifier_npi=ever_licensor=0_scope=0_npi-present=1	0		women who would break couches were ever bringing the pants .
experiment=NPI_env=quantifier_npi=ever_licensor=0_scope=0_npi-present=0	1		women who would break couches were once bringing the pants .
experiment=NPI_env=quantifier_npi=ever_licensor=0_scope=1_npi-present=1	0		an actor who ever hated more than three customers has brought a car .
experiment=NPI_env=quantifier_npi=ever_licensor=0_scope=1_npi-present=0	1		an actor who once hated more than three customers has brought a car .
experiment=NPI_env=quantifier_npi=ever_licensor=0_scope=0_npi-present=1	0		an actor who hated more than three customers has ever brought a car .
experiment=NPI_env=quantifier_npi=ever_licensor=0_scope=0_npi-present=0	1		an actor who hated more than three customers has once brought a car .
experiment=NPI_env=quantifier_npi=ever_licensor=1_scope=1_npi-present=1	1		fewer than three actresses who will ever clean many glasses are visiting some guests .
experiment=NPI_env=quantifier_npi=ever_licensor=1_scope=1_npi-present=0	1		fewer than three actresses who will once clean many glasses are visiting some guests .
experiment=NPI_env=quantifier_npi=ever_licensor=1_scope=1_npi-present=1	1		fewer than three actresses who will clean many glasses are ever visiting some guests .
experiment=NPI_env=quantifier_npi=ever_licensor=1_scope=1_npi-present=0	1		fewer than three actresses who will clean many glasses are once visiting some guests .
experiment=NPI_env=quantifier_npi=ever_licensor=1_scope=1_npi-present=1	1		every waiter who ever wears the gloves had worn gloves .
experiment=NPI_env=quantifier_npi=ever_licensor=1_scope=1_npi-present=0	1		every waiter who once wears the gloves had worn gloves .
experiment=NPI_env=quantifier_npi=ever_licensor=1_scope=0_npi-present=1	0		every waiter who wears the gloves had ever worn gloves .
experiment=NPI_env=quantifier_npi=ever_licensor=1_scope=0_npi-present=0	1		every waiter who wears the gloves had once worn gloves .
experiment=NPI_env=quantifier_npi=ever_licensor=0_scope=1_npi-present=1	0		some man who ever bought many forks had a lot of rugs .
experiment=NPI_env=quantifier_npi=ever_licensor=0_scope=1_npi-present=0	1		some man who once bought many forks had a lot of rugs .
experiment=NPI_env=quantifier_npi=ever_licensor=0_scope=0_npi-present=1	0		some man who bought many forks ever had a lot of rugs .
experiment=NPI_env=quantifier_npi=ever_licensor=0_scope=0_npi-present=0	1		some man who bought many forks once had a lot of rugs .
experiment=NPI_env=quantifier_npi=ever_licensor=0_scope=1_npi-present=1	0		some man who should ever buy many glasses has seen some rug .
experiment=NPI_env=quantifier_npi=ever_licensor=0_scope=1_npi-present=0	1		some man who should once buy many glasses has seen some rug .
experiment=NPI_env=quantifier_npi=ever_licensor=0_scope=0_npi-present=1	0		some man who should buy many glasses has ever seen some rug .
experiment=NPI_env=quantifier_npi=ever_licensor=0_scope=0_npi-present=0	1		some man who should buy many glasses has once seen some rug .
experiment=NPI_env=quantifier_npi=ever_licensor=0_scope=1_npi-present=1	0		some adult who might ever lift rugs saw an actress .
experiment=NPI_env=quantifier_npi=ever_licensor=0_scope=1_npi-present=0	1		some adult who might once lift rugs saw an actress .
experiment=NPI_env=quantifier_npi=ever_licensor=0_scope=0_npi-present=1	0		some adult who might lift rugs ever saw an actress .
experiment=NPI_env=quantifier_npi=ever_licensor=0_scope=0_npi-present=0	1		some adult who might lift rugs once saw an actress .
experiment=NPI_env=quantifier_npi=ever_licensor=0_scope=1_npi-present=1	0		the person who ever loved a lot of people liked some waitresses .
experiment=NPI_env=quantifier_npi=ever_licensor=0_scope=1_npi-present=0	1		the person who once loved a lot of people liked some waitresses .
experiment=NPI_env=quantifier_npi=ever_licensor=0_scope=0_npi-present=1	0		the person who loved a lot of people ever liked some waitresses .
experiment=NPI_env=quantifier_npi=ever_licensor=0_scope=0_npi-present=0	1		the person who loved a lot of people once liked some waitresses .
experiment=NPI_env=quantifier_npi=ever_licensor=0_scope=1_npi-present=1	0		a doctor who ever helped the dudes should remember some teacher .
experiment=NPI_env=quantifier_npi=ever_licensor=0_scope=1_npi-present=0	1		a doctor who once helped the dudes should remember some teacher .
experiment=NPI_env=quantifier_npi=ever_licensor=0_scope=0_npi-present=1	0		a doctor who helped the dudes should ever remember some teacher .
experiment=NPI_env=quantifier_npi=ever_licensor=0_scope=0_npi-present=0	1		a doctor who helped the dudes should once remember some teacher .
experiment=NPI_env=quantifier_npi=ever_licensor=1_scope=1_npi-present=1	1		no boy who ever remembers a lot of people lifted many couches .
experiment=NPI_env=quantifier_npi=ever_licensor=1_scope=1_npi-present=0	1		no boy who once remembers a lot of people lifted many couches .
experiment=NPI_env=quantifier_npi=ever_licensor=1_scope=1_npi-present=1	1		no boy who remembers a lot of people ever lifted many couches .
experiment=NPI_env=quantifier_npi=ever_licensor=1_scope=1_npi-present=0	1		no boy who remembers a lot of people once lifted many couches .
experiment=NPI_env=quantifier_npi=ever_licensor=0_scope=1_npi-present=1	0		the dude who will ever love a lot of teachers should dislike a driver .
experiment=NPI_env=quantifier_npi=ever_licensor=0_scope=1_npi-present=0	1		the dude who will once love a lot of teachers should dislike a driver .
experiment=NPI_env=quantifier_npi=ever_licensor=0_scope=0_npi-present=1	0		the dude who will love a lot of teachers should ever dislike a driver .
experiment=NPI_env=quantifier_npi=ever_licensor=0_scope=0_npi-present=0	1		the dude who will love a lot of teachers should once dislike a driver .
experiment=NPI_env=quantifier_npi=ever_licensor=0_scope=1_npi-present=1	0		a man who ever sells cups will buy many dishes .
experiment=NPI_env=quantifier_npi=ever_licensor=0_scope=1_npi-present=0	1		a man who once sells cups will buy many dishes .
experiment=NPI_env=quantifier_npi=ever_licensor=0_scope=0_npi-present=1	0		a man who sells cups will ever buy many dishes .
experiment=NPI_env=quantifier_npi=ever_licensor=0_scope=0_npi-present=0	1		a man who sells cups will once buy many dishes .
experiment=NPI_env=quantifier_npi=ever_licensor=0_scope=1_npi-present=1	0		the waiter who had ever sold the pants visited many teachers .
experiment=NPI_env=quantifier_npi=ever_licensor=0_scope=1_npi-present=0	1		the waiter who had once sold the pants visited many teachers .
experiment=NPI_env=quantifier_npi=ever_licensor=0_scope=0_npi-present=1	0		the waiter who had sold the pants ever visited many teachers .
experiment=NPI_env=quantifier_npi=ever_licensor=0_scope=0_npi-present=0	1		the waiter who had sold the pants once visited many teachers .
experiment=NPI_env=quantifier_npi=ever_licensor=1_scope=1_npi-present=1	1		all women who ever bought a lot of shoes loved more than three students .
experiment=NPI_env=quantifier_npi=ever_licensor=1_scope=1_npi-present=0	1		all women who once bought a lot of shoes loved more than three students .
experiment=NPI_env=quantifier_npi=ever_licensor=1_scope=0_npi-present=1	0		all women who bought a lot of shoes ever loved more than three students .
experiment=NPI_env=quantifier_npi=ever_licensor=1_scope=0_npi-present=0	1		all women who bought a lot of shoes once loved more than three students .
experiment=NPI_env=quantifier_npi=ever_licensor=0_scope=1_npi-present=1	0		some ladies who have ever disliked the humans saw some woman .
experiment=NPI_env=quantifier_npi=ever_licensor=0_scope=1_npi-present=0	1		some ladies who have once disliked the humans saw some woman .
experiment=NPI_env=quantifier_npi=ever_licensor=0_scope=0_npi-present=1	0		some ladies who have disliked the humans ever saw some woman .
experiment=NPI_env=quantifier_npi=ever_licensor=0_scope=0_npi-present=0	1		some ladies who have disliked the humans once saw some woman .
experiment=NPI_env=quantifier_npi=ever_licensor=0_scope=1_npi-present=1	0		more than three adults who ever respected a lot of humans had brought more than three gloves .
experiment=NPI_env=quantifier_npi=ever_licensor=0_scope=1_npi-present=0	1		more than three adults who once respected a lot of humans had brought more than three gloves .
experiment=NPI_env=quantifier_npi=ever_licensor=0_scope=0_npi-present=1	0		more than three adults who respected a lot of humans had ever brought more than three gloves .
experiment=NPI_env=quantifier_npi=ever_licensor=0_scope=0_npi-present=0	1		more than three adults who respected a lot of humans had once brought more than three gloves .
experiment=NPI_env=quantifier_npi=ever_licensor=0_scope=1_npi-present=1	0		some waitresses who ever care for many doctors admired a skirt .
experiment=NPI_env=quantifier_npi=ever_licensor=0_scope=1_npi-present=0	1		some waitresses who once care for many doctors admired a skirt .
experiment=NPI_env=quantifier_npi=ever_licensor=0_scope=0_npi-present=1	0		some waitresses who care for many doctors ever admired a skirt .
experiment=NPI_env=quantifier_npi=ever_licensor=0_scope=0_npi-present=0	1		some waitresses who care for many doctors once admired a skirt .
experiment=NPI_env=quantifier_npi=ever_licensor=0_scope=1_npi-present=1	0		an actor who ever admired some shoes visited customers .
experiment=NPI_env=quantifier_npi=ever_licensor=0_scope=1_npi-present=0	1		an actor who once admired some shoes visited customers .
experiment=NPI_env=quantifier_npi=ever_licensor=0_scope=0_npi-present=1	0		an actor who admired some shoes ever visited customers .
experiment=NPI_env=quantifier_npi=ever_licensor=0_scope=0_npi-present=0	1		an actor who admired some shoes once visited customers .
experiment=NPI_env=quantifier_npi=ever_licensor=1_scope=1_npi-present=1	1		every dude who would ever bring more than three plates admires shoes .
experiment=NPI_env=quantifier_npi=ever_licensor=1_scope=1_npi-present=0	1		every dude who would once bring more than three plates admires shoes .
experiment=NPI_env=quantifier_npi=ever_licensor=1_scope=0_npi-present=1	0		every dude who would bring more than three plates ever admires shoes .
experiment=NPI_env=quantifier_npi=ever_licensor=1_scope=0_npi-present=0	1		every dude who would bring more than three plates once admires shoes .
experiment=NPI_env=quantifier_npi=ever_licensor=0_scope=1_npi-present=1	0		more than three waiters who ever help more than three girls took some rug .
experiment=NPI_env=quantifier_npi=ever_licensor=0_scope=1_npi-present=0	1		more than three waiters who once help more than three girls took some rug .
experiment=NPI_env=quantifier_npi=ever_licensor=0_scope=0_npi-present=1	0		more than three waiters who help more than three girls ever took some rug .
experiment=NPI_env=quantifier_npi=ever_licensor=0_scope=0_npi-present=0	1		more than three waiters who help more than three girls once took some rug .
experiment=NPI_env=quantifier_npi=ever_licensor=0_scope=1_npi-present=1	0		a lady who ever helped many ladies had visited the men .
experiment=NPI_env=quantifier_npi=ever_licensor=0_scope=1_npi-present=0	1		a lady who once helped many ladies had visited the men .
experiment=NPI_env=quantifier_npi=ever_licensor=0_scope=0_npi-present=1	0		a lady who helped many ladies had ever visited the men .
experiment=NPI_env=quantifier_npi=ever_licensor=0_scope=0_npi-present=0	1		a lady who helped many ladies had once visited the men .
experiment=NPI_env=quantifier_npi=ever_licensor=1_scope=1_npi-present=1	1		fewer than three students who have ever seen the gloves hug a man .
experiment=NPI_env=quantifier_npi=ever_licensor=1_scope=1_npi-present=0	1		fewer than three students who have once seen the gloves hug a man .
experiment=NPI_env=quantifier_npi=ever_licensor=1_scope=1_npi-present=1	1		fewer than three students who have seen the gloves ever hug a man .
experiment=NPI_env=quantifier_npi=ever_licensor=1_scope=1_npi-present=0	1		fewer than three students who have seen the gloves once hug a man .
experiment=NPI_env=quantifier_npi=ever_licensor=1_scope=1_npi-present=1	1		no cashier who ever broke some glasses can forget many waiters .
experiment=NPI_env=quantifier_npi=ever_licensor=1_scope=1_npi-present=0	1		no cashier who once broke some glasses can forget many waiters .
experiment=NPI_env=quantifier_npi=ever_licensor=1_scope=1_npi-present=1	1		no cashier who broke some glasses can ever forget many waiters .
experiment=NPI_env=quantifier_npi=ever_licensor=1_scope=1_npi-present=0	1		no cashier who broke some glasses can once forget many waiters .
experiment=NPI_env=quantifier_npi=ever_licensor=0_scope=1_npi-present=1	0		the boys who would ever see some forks disliked some ladies .
experiment=NPI_env=quantifier_npi=ever_licensor=0_scope=1_npi-present=0	1		the boys who would once see some forks disliked some ladies .
experiment=NPI_env=quantifier_npi=ever_licensor=0_scope=0_npi-present=1	0		the boys who would see some forks ever disliked some ladies .
experiment=NPI_env=quantifier_npi=ever_licensor=0_scope=0_npi-present=0	1		the boys who would see some forks once disliked some ladies .
experiment=NPI_env=quantifier_npi=ever_licensor=1_scope=1_npi-present=1	1		every waitress who ever loved some teachers can help cashiers .
experiment=NPI_env=quantifier_npi=ever_licensor=1_scope=1_npi-present=0	1		every waitress who once loved some teachers can help cashiers .
experiment=NPI_env=quantifier_npi=ever_licensor=1_scope=0_npi-present=1	0		every waitress who loved some teachers can ever help cashiers .
experiment=NPI_env=quantifier_npi=ever_licensor=1_scope=0_npi-present=0	1		every waitress who loved some teachers can once help cashiers .
experiment=NPI_env=quantifier_npi=ever_licensor=1_scope=1_npi-present=1	1		fewer than three children who ever remember many actresses have brought more than three shoes .
experiment=NPI_env=quantifier_npi=ever_licensor=1_scope=1_npi-present=0	1		fewer than three children who once remember many actresses have brought more than three shoes .
experiment=NPI_env=quantifier_npi=ever_licensor=1_scope=1_npi-present=1	1		fewer than three children who remember many actresses have ever brought more than three shoes .
experiment=NPI_env=quantifier_npi=ever_licensor=1_scope=1_npi-present=0	1		fewer than three children who remember many actresses have once brought more than three shoes .
experiment=NPI_env=quantifier_npi=ever_licensor=1_scope=1_npi-present=1	1		no waitresses who should ever hug some humans talked to a lot of children .
experiment=NPI_env=quantifier_npi=ever_licensor=1_scope=1_npi-present=0	1		no waitresses who should once hug some humans talked to a lot of children .
experiment=NPI_env=quantifier_npi=ever_licensor=1_scope=1_npi-present=1	1		no waitresses who should hug some humans ever talked to a lot of children .
experiment=NPI_env=quantifier_npi=ever_licensor=1_scope=1_npi-present=0	1		no waitresses who should hug some humans once talked to a lot of children .
experiment=NPI_env=quantifier_npi=ever_licensor=1_scope=1_npi-present=1	1		any guests who can ever break more than three books have hugged many ladies .
experiment=NPI_env=quantifier_npi=ever_licensor=1_scope=1_npi-present=0	1		any guests who can once break more than three books have hugged many ladies .
experiment=NPI_env=quantifier_npi=ever_licensor=1_scope=0_npi-present=1	0		any guests who can break more than three books have ever hugged many ladies .
experiment=NPI_env=quantifier_npi=ever_licensor=1_scope=0_npi-present=0	1		any guests who can break more than three books have once hugged many ladies .
experiment=NPI_env=quantifier_npi=ever_licensor=0_scope=1_npi-present=1	0		a girl who ever respected many dudes would work with the pedestrian .
experiment=NPI_env=quantifier_npi=ever_licensor=0_scope=1_npi-present=0	1		a girl who once respected many dudes would work with the pedestrian .
experiment=NPI_env=quantifier_npi=ever_licensor=0_scope=0_npi-present=1	0		a girl who respected many dudes would ever work with the pedestrian .
experiment=NPI_env=quantifier_npi=ever_licensor=0_scope=0_npi-present=0	1		a girl who respected many dudes would once work with the pedestrian .
experiment=NPI_env=quantifier_npi=ever_licensor=1_scope=1_npi-present=1	1		every waiter who will ever remember a lot of cashiers attacked more than three actors .
experiment=NPI_env=quantifier_npi=ever_licensor=1_scope=1_npi-present=0	1		every waiter who will once remember a lot of cashiers attacked more than three actors .
experiment=NPI_env=quantifier_npi=ever_licensor=1_scope=0_npi-present=1	0		every waiter who will remember a lot of cashiers ever attacked more than three actors .
experiment=NPI_env=quantifier_npi=ever_licensor=1_scope=0_npi-present=0	1		every waiter who will remember a lot of cashiers once attacked more than three actors .
experiment=NPI_env=quantifier_npi=ever_licensor=1_scope=1_npi-present=1	1		no driver who could ever care for some waiters kisses the driver .
experiment=NPI_env=quantifier_npi=ever_licensor=1_scope=1_npi-present=0	1		no driver who could once care for some waiters kisses the driver .
experiment=NPI_env=quantifier_npi=ever_licensor=1_scope=1_npi-present=1	1		no driver who could care for some waiters ever kisses the driver .
experiment=NPI_env=quantifier_npi=ever_licensor=1_scope=1_npi-present=0	1		no driver who could care for some waiters once kisses the driver .
experiment=NPI_env=quantifier_npi=ever_licensor=0_scope=1_npi-present=1	0		some human who did ever love a lot of patients kissed more than three cashiers .
experiment=NPI_env=quantifier_npi=ever_licensor=0_scope=1_npi-present=0	1		some human who did once love a lot of patients kissed more than three cashiers .
experiment=NPI_env=quantifier_npi=ever_licensor=0_scope=0_npi-present=1	0		some human who did love a lot of patients ever kissed more than three cashiers .
experiment=NPI_env=quantifier_npi=ever_licensor=0_scope=0_npi-present=0	1		some human who did love a lot of patients once kissed more than three cashiers .
experiment=NPI_env=quantifier_npi=ever_licensor=0_scope=1_npi-present=1	0		some doctors who have ever disliked some men did take the hat .
experiment=NPI_env=quantifier_npi=ever_licensor=0_scope=1_npi-present=0	1		some doctors who have once disliked some men did take the hat .
experiment=NPI_env=quantifier_npi=ever_licensor=0_scope=0_npi-present=1	0		some doctors who have disliked some men did ever take the hat .
experiment=NPI_env=quantifier_npi=ever_licensor=0_scope=0_npi-present=0	1		some doctors who have disliked some men did once take the hat .
experiment=NPI_env=quantifier_npi=ever_licensor=0_scope=1_npi-present=1	0		the adult who might ever sell the dishes has disliked a patient .
experiment=NPI_env=quantifier_npi=ever_licensor=0_scope=1_npi-present=0	1		the adult who might once sell the dishes has disliked a patient .
experiment=NPI_env=quantifier_npi=ever_licensor=0_scope=0_npi-present=1	0		the adult who might sell the dishes has ever disliked a patient .
experiment=NPI_env=quantifier_npi=ever_licensor=0_scope=0_npi-present=0	1		the adult who might sell the dishes has once disliked a patient .
experiment=NPI_env=quantifier_npi=ever_licensor=1_scope=1_npi-present=1	1		no drivers who ever hated some people did hug the dude .
experiment=NPI_env=quantifier_npi=ever_licensor=1_scope=1_npi-present=0	1		no drivers who once hated some people did hug the dude .
experiment=NPI_env=quantifier_npi=ever_licensor=1_scope=1_npi-present=1	1		no drivers who hated some people did ever hug the dude .
experiment=NPI_env=quantifier_npi=ever_licensor=1_scope=1_npi-present=0	1		no drivers who hated some people did once hug the dude .
experiment=NPI_env=quantifier_npi=ever_licensor=0_scope=1_npi-present=1	0		the girl who would ever lift many cars does love more than three cashiers .
experiment=NPI_env=quantifier_npi=ever_licensor=0_scope=1_npi-present=0	1		the girl who would once lift many cars does love more than three cashiers .
experiment=NPI_env=quantifier_npi=ever_licensor=0_scope=0_npi-present=1	0		the girl who would lift many cars does ever love more than three cashiers .
experiment=NPI_env=quantifier_npi=ever_licensor=0_scope=0_npi-present=0	1		the girl who would lift many cars does once love more than three cashiers .
experiment=NPI_env=quantifier_npi=ever_licensor=0_scope=1_npi-present=1	0		the waiter who has ever hugged more than three girls has cleaned a lot of plates .
experiment=NPI_env=quantifier_npi=ever_licensor=0_scope=1_npi-present=0	1		the waiter who has once hugged more than three girls has cleaned a lot of plates .
experiment=NPI_env=quantifier_npi=ever_licensor=0_scope=0_npi-present=1	0		the waiter who has hugged more than three girls has ever cleaned a lot of plates .
experiment=NPI_env=quantifier_npi=ever_licensor=0_scope=0_npi-present=0	1		the waiter who has hugged more than three girls has once cleaned a lot of plates .
experiment=NPI_env=quantifier_npi=ever_licensor=1_scope=1_npi-present=1	1		no actor who ever hugs people has talked to guys .
experiment=NPI_env=quantifier_npi=ever_licensor=1_scope=1_npi-present=0	1		no actor who once hugs people has talked to guys .
experiment=NPI_env=quantifier_npi=ever_licensor=1_scope=1_npi-present=1	1		no actor who hugs people has ever talked to guys .
experiment=NPI_env=quantifier_npi=ever_licensor=1_scope=1_npi-present=0	1		no actor who hugs people has once talked to guys .
experiment=NPI_env=quantifier_npi=ever_licensor=1_scope=1_npi-present=1	1		any guys who ever bought many rugs were selling some books .
experiment=NPI_env=quantifier_npi=ever_licensor=1_scope=1_npi-present=0	1		any guys who once bought many rugs were selling some books .
experiment=NPI_env=quantifier_npi=ever_licensor=1_scope=0_npi-present=1	0		any guys who bought many rugs were ever selling some books .
experiment=NPI_env=quantifier_npi=ever_licensor=1_scope=0_npi-present=0	1		any guys who bought many rugs were once selling some books .
