experiment=NPI-env=determiner_negation_monoclausal-npi=in years-crucial_item=no-licensor=1-scope=1-npi_present=1	1		no lady had imagined the teachers in years .
experiment=NPI-env=determiner_negation_monoclausal-npi=in years-crucial_item=no-licensor=1-scope=1-npi_present=0	1		no lady had imagined the teachers on weekends .
experiment=NPI-env=determiner_negation_monoclausal-npi=in years-crucial_item=none of the-licensor=1-scope=0-npi_present=1	0		a lady had imagined the teachers in years at no museums .
experiment=NPI-env=determiner_negation_monoclausal-npi=in years-crucial_item=none of the-licensor=1-scope=0-npi_present=0	1		a lady had imagined the teachers on weekends at no museums .
experiment=NPI-env=determiner_negation_monoclausal-npi=in years-crucial_item=some-licensor=0-scope=1-npi_present=1	0		some lady had imagined the teachers in years .
experiment=NPI-env=determiner_negation_monoclausal-npi=in years-crucial_item=some-licensor=0-scope=1-npi_present=0	1		some lady had imagined the teachers on weekends .
experiment=NPI-env=determiner_negation_monoclausal-npi=in years-crucial_item=some-licensor=0-scope=0-npi_present=1	0		a lady had imagined the teachers in years at some museums .
experiment=NPI-env=determiner_negation_monoclausal-npi=in years-crucial_item=some-licensor=0-scope=0-npi_present=0	1		a lady had imagined the teachers on weekends at some museums .
experiment=NPI-env=determiner_negation_monoclausal-npi=either-crucial_item=no-licensor=1-scope=1-npi_present=1	1		no waiter should visit the ladies either .
experiment=NPI-env=determiner_negation_monoclausal-npi=either-crucial_item=no-licensor=1-scope=1-npi_present=0	1		no waiter should visit the ladies on weekends .
experiment=NPI-env=determiner_negation_monoclausal-npi=either-crucial_item=none of the-licensor=1-scope=0-npi_present=1	0		a waiter should visit the ladies either at no museums .
experiment=NPI-env=determiner_negation_monoclausal-npi=either-crucial_item=none of the-licensor=1-scope=0-npi_present=0	1		a waiter should visit the ladies on weekends at no museums .
experiment=NPI-env=determiner_negation_monoclausal-npi=either-crucial_item=some-licensor=0-scope=1-npi_present=1	0		some waiter should visit the ladies either .
experiment=NPI-env=determiner_negation_monoclausal-npi=either-crucial_item=some-licensor=0-scope=1-npi_present=0	1		some waiter should visit the ladies on weekends .
experiment=NPI-env=determiner_negation_monoclausal-npi=either-crucial_item=some-licensor=0-scope=0-npi_present=1	0		a waiter should visit the ladies either at some museums .
experiment=NPI-env=determiner_negation_monoclausal-npi=either-crucial_item=some-licensor=0-scope=0-npi_present=0	1		a waiter should visit the ladies on weekends at some museums .
experiment=NPI-env=determiner_negation_monoclausal-npi=either-crucial_item=no-licensor=1-scope=1-npi_present=1	1		no gal described the doctors either .
experiment=NPI-env=determiner_negation_monoclausal-npi=either-crucial_item=no-licensor=1-scope=1-npi_present=0	1		no gal described the doctors on occasion .
experiment=NPI-env=determiner_negation_monoclausal-npi=either-crucial_item=no-licensor=1-scope=0-npi_present=1	0		a gal described the doctors either at no malls .
experiment=NPI-env=determiner_negation_monoclausal-npi=either-crucial_item=no-licensor=1-scope=0-npi_present=0	1		a gal described the doctors on occasion at no malls .
experiment=NPI-env=determiner_negation_monoclausal-npi=either-crucial_item=some-licensor=0-scope=1-npi_present=1	0		some gal described the doctors either .
experiment=NPI-env=determiner_negation_monoclausal-npi=either-crucial_item=some-licensor=0-scope=1-npi_present=0	1		some gal described the doctors on occasion .
experiment=NPI-env=determiner_negation_monoclausal-npi=either-crucial_item=some-licensor=0-scope=0-npi_present=1	0		a gal described the doctors either at some malls .
experiment=NPI-env=determiner_negation_monoclausal-npi=either-crucial_item=some-licensor=0-scope=0-npi_present=0	1		a gal described the doctors on occasion at some malls .
experiment=NPI-env=determiner_negation_monoclausal-npi=either-crucial_item=no-licensor=1-scope=1-npi_present=1	1		no guests are being at the banks either .
experiment=NPI-env=determiner_negation_monoclausal-npi=either-crucial_item=no-licensor=1-scope=1-npi_present=0	1		no guests are being at the banks on occasion .
experiment=NPI-env=determiner_negation_monoclausal-npi=either-crucial_item=none of the-licensor=1-scope=0-npi_present=1	0		the guests are being at the banks either at no public parks .
experiment=NPI-env=determiner_negation_monoclausal-npi=either-crucial_item=none of the-licensor=1-scope=0-npi_present=0	1		the guests are being at the banks on occasion at no public parks .
experiment=NPI-env=determiner_negation_monoclausal-npi=either-crucial_item=some-licensor=0-scope=1-npi_present=1	0		some guests are being at the banks either .
experiment=NPI-env=determiner_negation_monoclausal-npi=either-crucial_item=some-licensor=0-scope=1-npi_present=0	1		some guests are being at the banks on occasion .
experiment=NPI-env=determiner_negation_monoclausal-npi=either-crucial_item=some-licensor=0-scope=0-npi_present=1	0		the guests are being at the banks either at some public parks .
experiment=NPI-env=determiner_negation_monoclausal-npi=either-crucial_item=some-licensor=0-scope=0-npi_present=0	1		the guests are being at the banks on occasion at some public parks .
experiment=NPI-env=determiner_negation_monoclausal-npi=either-crucial_item=no-licensor=1-scope=1-npi_present=1	1		no waiter was biking to the hospitals either .
experiment=NPI-env=determiner_negation_monoclausal-npi=either-crucial_item=no-licensor=1-scope=1-npi_present=0	1		no waiter was biking to the hospitals on occasion .
experiment=NPI-env=determiner_negation_monoclausal-npi=either-crucial_item=none of the-licensor=1-scope=0-npi_present=1	0		a waiter was biking to the hospitals either at no cafes .
experiment=NPI-env=determiner_negation_monoclausal-npi=either-crucial_item=none of the-licensor=1-scope=0-npi_present=0	1		a waiter was biking to the hospitals on occasion at no cafes .
experiment=NPI-env=determiner_negation_monoclausal-npi=either-crucial_item=some-licensor=0-scope=1-npi_present=1	0		some waiter was biking to the hospitals either .
experiment=NPI-env=determiner_negation_monoclausal-npi=either-crucial_item=some-licensor=0-scope=1-npi_present=0	1		some waiter was biking to the hospitals on occasion .
experiment=NPI-env=determiner_negation_monoclausal-npi=either-crucial_item=some-licensor=0-scope=0-npi_present=1	0		a waiter was biking to the hospitals either at some cafes .
experiment=NPI-env=determiner_negation_monoclausal-npi=either-crucial_item=some-licensor=0-scope=0-npi_present=0	1		a waiter was biking to the hospitals on occasion at some cafes .
experiment=NPI-env=determiner_negation_monoclausal-npi=either-crucial_item=no-licensor=1-scope=1-npi_present=1	1		no guests were breaking the couches either .
experiment=NPI-env=determiner_negation_monoclausal-npi=either-crucial_item=no-licensor=1-scope=1-npi_present=0	1		no guests were breaking the couches for a while .
experiment=NPI-env=determiner_negation_monoclausal-npi=either-crucial_item=none of the-licensor=1-scope=0-npi_present=1	0		the guests were breaking the couches either at no high schools .
experiment=NPI-env=determiner_negation_monoclausal-npi=either-crucial_item=none of the-licensor=1-scope=0-npi_present=0	1		the guests were breaking the couches for a while at no high schools .
experiment=NPI-env=determiner_negation_monoclausal-npi=either-crucial_item=some-licensor=0-scope=1-npi_present=1	0		some guests were breaking the couches either .
experiment=NPI-env=determiner_negation_monoclausal-npi=either-crucial_item=some-licensor=0-scope=1-npi_present=0	1		some guests were breaking the couches for a while .
experiment=NPI-env=determiner_negation_monoclausal-npi=either-crucial_item=some-licensor=0-scope=0-npi_present=1	0		the guests were breaking the couches either at some high schools .
experiment=NPI-env=determiner_negation_monoclausal-npi=either-crucial_item=some-licensor=0-scope=0-npi_present=0	1		the guests were breaking the couches for a while at some high schools .
experiment=NPI-env=determiner_negation_monoclausal-npi=either-crucial_item=none of the-licensor=1-scope=1-npi_present=1	1		none of the actresses have scanned the stories either .
experiment=NPI-env=determiner_negation_monoclausal-npi=either-crucial_item=none of the-licensor=1-scope=1-npi_present=0	1		none of the actresses have scanned the stories regularly .
experiment=NPI-env=determiner_negation_monoclausal-npi=either-crucial_item=no-licensor=1-scope=0-npi_present=1	0		the actresses have scanned the stories either at none of the high schools .
experiment=NPI-env=determiner_negation_monoclausal-npi=either-crucial_item=no-licensor=1-scope=0-npi_present=0	1		the actresses have scanned the stories regularly at none of the high schools .
experiment=NPI-env=determiner_negation_monoclausal-npi=either-crucial_item=some-licensor=0-scope=1-npi_present=1	0		some actresses have scanned the stories either .
experiment=NPI-env=determiner_negation_monoclausal-npi=either-crucial_item=some-licensor=0-scope=1-npi_present=0	1		some actresses have scanned the stories regularly .
experiment=NPI-env=determiner_negation_monoclausal-npi=either-crucial_item=some-licensor=0-scope=0-npi_present=1	0		the actresses have scanned the stories either at some high schools .
experiment=NPI-env=determiner_negation_monoclausal-npi=either-crucial_item=some-licensor=0-scope=0-npi_present=0	1		the actresses have scanned the stories regularly at some high schools .
experiment=NPI-env=determiner_negation_monoclausal-npi=either-crucial_item=no-licensor=1-scope=1-npi_present=1	1		no customers describe the guests either .
experiment=NPI-env=determiner_negation_monoclausal-npi=either-crucial_item=no-licensor=1-scope=1-npi_present=0	1		no customers describe the guests on occasion .
experiment=NPI-env=determiner_negation_monoclausal-npi=either-crucial_item=no-licensor=1-scope=0-npi_present=1	0		the customers describe the guests either at no grocery stores .
experiment=NPI-env=determiner_negation_monoclausal-npi=either-crucial_item=no-licensor=1-scope=0-npi_present=0	1		the customers describe the guests on occasion at no grocery stores .
experiment=NPI-env=determiner_negation_monoclausal-npi=either-crucial_item=some-licensor=0-scope=1-npi_present=1	0		some customers describe the guests either .
experiment=NPI-env=determiner_negation_monoclausal-npi=either-crucial_item=some-licensor=0-scope=1-npi_present=0	1		some customers describe the guests on occasion .
experiment=NPI-env=determiner_negation_monoclausal-npi=either-crucial_item=some-licensor=0-scope=0-npi_present=1	0		the customers describe the guests either at some grocery stores .
experiment=NPI-env=determiner_negation_monoclausal-npi=either-crucial_item=some-licensor=0-scope=0-npi_present=0	1		the customers describe the guests on occasion at some grocery stores .
experiment=NPI-env=determiner_negation_monoclausal-npi=either-crucial_item=no-licensor=1-scope=1-npi_present=1	1		no teachers insulted the teenagers either .
experiment=NPI-env=determiner_negation_monoclausal-npi=either-crucial_item=no-licensor=1-scope=1-npi_present=0	1		no teachers insulted the teenagers regularly .
experiment=NPI-env=determiner_negation_monoclausal-npi=either-crucial_item=no-licensor=1-scope=0-npi_present=1	0		the teachers insulted the teenagers either at no libraries .
experiment=NPI-env=determiner_negation_monoclausal-npi=either-crucial_item=no-licensor=1-scope=0-npi_present=0	1		the teachers insulted the teenagers regularly at no libraries .
experiment=NPI-env=determiner_negation_monoclausal-npi=either-crucial_item=some-licensor=0-scope=1-npi_present=1	0		some teachers insulted the teenagers either .
experiment=NPI-env=determiner_negation_monoclausal-npi=either-crucial_item=some-licensor=0-scope=1-npi_present=0	1		some teachers insulted the teenagers regularly .
experiment=NPI-env=determiner_negation_monoclausal-npi=either-crucial_item=some-licensor=0-scope=0-npi_present=1	0		the teachers insulted the teenagers either at some libraries .
experiment=NPI-env=determiner_negation_monoclausal-npi=either-crucial_item=some-licensor=0-scope=0-npi_present=0	1		the teachers insulted the teenagers regularly at some libraries .
experiment=NPI-env=determiner_negation_monoclausal-npi=either-crucial_item=none of the-licensor=1-scope=1-npi_present=1	1		none of the men escape from the teenagers either .
experiment=NPI-env=determiner_negation_monoclausal-npi=either-crucial_item=none of the-licensor=1-scope=1-npi_present=0	1		none of the men escape from the teenagers on occasion .
experiment=NPI-env=determiner_negation_monoclausal-npi=either-crucial_item=no-licensor=1-scope=0-npi_present=1	0		the men escape from the teenagers either at none of the high schools .
experiment=NPI-env=determiner_negation_monoclausal-npi=either-crucial_item=no-licensor=1-scope=0-npi_present=0	1		the men escape from the teenagers on occasion at none of the high schools .
experiment=NPI-env=determiner_negation_monoclausal-npi=either-crucial_item=some-licensor=0-scope=1-npi_present=1	0		some men escape from the teenagers either .
experiment=NPI-env=determiner_negation_monoclausal-npi=either-crucial_item=some-licensor=0-scope=1-npi_present=0	1		some men escape from the teenagers on occasion .
experiment=NPI-env=determiner_negation_monoclausal-npi=either-crucial_item=some-licensor=0-scope=0-npi_present=1	0		the men escape from the teenagers either at some high schools .
experiment=NPI-env=determiner_negation_monoclausal-npi=either-crucial_item=some-licensor=0-scope=0-npi_present=0	1		the men escape from the teenagers on occasion at some high schools .
experiment=NPI-env=determiner_negation_monoclausal-npi=either-crucial_item=no-licensor=1-scope=1-npi_present=1	1		no pedestrian could know the doctors either .
experiment=NPI-env=determiner_negation_monoclausal-npi=either-crucial_item=no-licensor=1-scope=1-npi_present=0	1		no pedestrian could know the doctors regularly .
experiment=NPI-env=determiner_negation_monoclausal-npi=either-crucial_item=no-licensor=1-scope=0-npi_present=1	0		the pedestrian could know the doctors either at no art galleries .
experiment=NPI-env=determiner_negation_monoclausal-npi=either-crucial_item=no-licensor=1-scope=0-npi_present=0	1		the pedestrian could know the doctors regularly at no art galleries .
experiment=NPI-env=determiner_negation_monoclausal-npi=either-crucial_item=some-licensor=0-scope=1-npi_present=1	0		some pedestrian could know the doctors either .
experiment=NPI-env=determiner_negation_monoclausal-npi=either-crucial_item=some-licensor=0-scope=1-npi_present=0	1		some pedestrian could know the doctors regularly .
experiment=NPI-env=determiner_negation_monoclausal-npi=either-crucial_item=some-licensor=0-scope=0-npi_present=1	0		the pedestrian could know the doctors either at some art galleries .
experiment=NPI-env=determiner_negation_monoclausal-npi=either-crucial_item=some-licensor=0-scope=0-npi_present=0	1		the pedestrian could know the doctors regularly at some art galleries .
experiment=NPI-env=determiner_negation_monoclausal-npi=any-crucial_item=none of the-licensor=1-scope=1-npi_present=1	1		none of the students were going to any gals .
experiment=NPI-env=determiner_negation_monoclausal-npi=any-crucial_item=none of the-licensor=1-scope=1-npi_present=0	1		none of the students were going to that gals .
experiment=NPI-env=determiner_negation_monoclausal-npi=any-crucial_item=no-licensor=1-scope=0-npi_present=1	0		any students were going to none of the gals .
experiment=NPI-env=determiner_negation_monoclausal-npi=any-crucial_item=no-licensor=1-scope=0-npi_present=0	1		the students were going to none of the gals .
experiment=NPI-env=determiner_negation_monoclausal-npi=any-crucial_item=some-licensor=0-scope=1-npi_present=1	0		some students were going to any gals .
experiment=NPI-env=determiner_negation_monoclausal-npi=any-crucial_item=some-licensor=0-scope=1-npi_present=0	1		some students were going to that gals .
experiment=NPI-env=determiner_negation_monoclausal-npi=any-crucial_item=some-licensor=0-scope=0-npi_present=1	0		any students were going to some gals .
experiment=NPI-env=determiner_negation_monoclausal-npi=any-crucial_item=some-licensor=0-scope=0-npi_present=0	1		the students were going to some gals .
experiment=NPI-env=determiner_negation_monoclausal-npi=any-crucial_item=no-licensor=1-scope=1-npi_present=1	1		no boys liked any essays .
experiment=NPI-env=determiner_negation_monoclausal-npi=any-crucial_item=no-licensor=1-scope=1-npi_present=0	1		no boys liked the essays .
experiment=NPI-env=determiner_negation_monoclausal-npi=any-crucial_item=no-licensor=1-scope=0-npi_present=1	0		any boys liked no essays .
experiment=NPI-env=determiner_negation_monoclausal-npi=any-crucial_item=no-licensor=1-scope=0-npi_present=0	1		the boys liked no essays .
experiment=NPI-env=determiner_negation_monoclausal-npi=any-crucial_item=some-licensor=0-scope=1-npi_present=1	0		some boys liked any essays .
experiment=NPI-env=determiner_negation_monoclausal-npi=any-crucial_item=some-licensor=0-scope=1-npi_present=0	1		some boys liked the essays .
experiment=NPI-env=determiner_negation_monoclausal-npi=any-crucial_item=some-licensor=0-scope=0-npi_present=1	0		any boys liked some essays .
experiment=NPI-env=determiner_negation_monoclausal-npi=any-crucial_item=some-licensor=0-scope=0-npi_present=0	1		the boys liked some essays .
experiment=NPI-env=determiner_negation_monoclausal-npi=any-crucial_item=no-licensor=1-scope=1-npi_present=1	1		no actors arrive at any malls .
experiment=NPI-env=determiner_negation_monoclausal-npi=any-crucial_item=no-licensor=1-scope=1-npi_present=0	1		no actors arrive at these malls .
experiment=NPI-env=determiner_negation_monoclausal-npi=any-crucial_item=none of the-licensor=1-scope=0-npi_present=1	0		any actors arrive at no malls .
experiment=NPI-env=determiner_negation_monoclausal-npi=any-crucial_item=none of the-licensor=1-scope=0-npi_present=0	1		these actors arrive at no malls .
experiment=NPI-env=determiner_negation_monoclausal-npi=any-crucial_item=some-licensor=0-scope=1-npi_present=1	0		some actors arrive at any malls .
experiment=NPI-env=determiner_negation_monoclausal-npi=any-crucial_item=some-licensor=0-scope=1-npi_present=0	1		some actors arrive at these malls .
experiment=NPI-env=determiner_negation_monoclausal-npi=any-crucial_item=some-licensor=0-scope=0-npi_present=1	0		any actors arrive at some malls .
experiment=NPI-env=determiner_negation_monoclausal-npi=any-crucial_item=some-licensor=0-scope=0-npi_present=0	1		these actors arrive at some malls .
experiment=NPI-env=determiner_negation_monoclausal-npi=any-crucial_item=none of the-licensor=1-scope=1-npi_present=1	1		none of the ladies arrive at any museums .
experiment=NPI-env=determiner_negation_monoclausal-npi=any-crucial_item=none of the-licensor=1-scope=1-npi_present=0	1		none of the ladies arrive at those museums .
experiment=NPI-env=determiner_negation_monoclausal-npi=any-crucial_item=none of the-licensor=1-scope=0-npi_present=1	0		any ladies arrive at none of the museums .
experiment=NPI-env=determiner_negation_monoclausal-npi=any-crucial_item=none of the-licensor=1-scope=0-npi_present=0	1		the ladies arrive at none of the museums .
experiment=NPI-env=determiner_negation_monoclausal-npi=any-crucial_item=some-licensor=0-scope=1-npi_present=1	0		some ladies arrive at any museums .
experiment=NPI-env=determiner_negation_monoclausal-npi=any-crucial_item=some-licensor=0-scope=1-npi_present=0	1		some ladies arrive at those museums .
experiment=NPI-env=determiner_negation_monoclausal-npi=any-crucial_item=some-licensor=0-scope=0-npi_present=1	0		any ladies arrive at some museums .
experiment=NPI-env=determiner_negation_monoclausal-npi=any-crucial_item=some-licensor=0-scope=0-npi_present=0	1		the ladies arrive at some museums .
experiment=NPI-env=determiner_negation_monoclausal-npi=any-crucial_item=none of the-licensor=1-scope=1-npi_present=1	1		none of the girls had cared for any movies .
experiment=NPI-env=determiner_negation_monoclausal-npi=any-crucial_item=none of the-licensor=1-scope=1-npi_present=0	1		none of the girls had cared for that movies .
experiment=NPI-env=determiner_negation_monoclausal-npi=any-crucial_item=none of the-licensor=1-scope=0-npi_present=1	0		any girls had cared for none of the movies .
experiment=NPI-env=determiner_negation_monoclausal-npi=any-crucial_item=none of the-licensor=1-scope=0-npi_present=0	1		that girls had cared for none of the movies .
experiment=NPI-env=determiner_negation_monoclausal-npi=any-crucial_item=some-licensor=0-scope=1-npi_present=1	0		some girls had cared for any movies .
experiment=NPI-env=determiner_negation_monoclausal-npi=any-crucial_item=some-licensor=0-scope=1-npi_present=0	1		some girls had cared for that movies .
experiment=NPI-env=determiner_negation_monoclausal-npi=any-crucial_item=some-licensor=0-scope=0-npi_present=1	0		any girls had cared for some movies .
experiment=NPI-env=determiner_negation_monoclausal-npi=any-crucial_item=some-licensor=0-scope=0-npi_present=0	1		that girls had cared for some movies .
experiment=NPI-env=determiner_negation_monoclausal-npi=any-crucial_item=no-licensor=1-scope=1-npi_present=1	1		no teachers are cleaning any cafes .
experiment=NPI-env=determiner_negation_monoclausal-npi=any-crucial_item=no-licensor=1-scope=1-npi_present=0	1		no teachers are cleaning the cafes .
experiment=NPI-env=determiner_negation_monoclausal-npi=any-crucial_item=none of the-licensor=1-scope=0-npi_present=1	0		any teachers are cleaning no cafes .
experiment=NPI-env=determiner_negation_monoclausal-npi=any-crucial_item=none of the-licensor=1-scope=0-npi_present=0	1		these teachers are cleaning no cafes .
experiment=NPI-env=determiner_negation_monoclausal-npi=any-crucial_item=some-licensor=0-scope=1-npi_present=1	0		some teachers are cleaning any cafes .
experiment=NPI-env=determiner_negation_monoclausal-npi=any-crucial_item=some-licensor=0-scope=1-npi_present=0	1		some teachers are cleaning the cafes .
experiment=NPI-env=determiner_negation_monoclausal-npi=any-crucial_item=some-licensor=0-scope=0-npi_present=1	0		any teachers are cleaning some cafes .
experiment=NPI-env=determiner_negation_monoclausal-npi=any-crucial_item=some-licensor=0-scope=0-npi_present=0	1		these teachers are cleaning some cafes .
experiment=NPI-env=determiner_negation_monoclausal-npi=any-crucial_item=no-licensor=1-scope=1-npi_present=1	1		no doctors were listening to any hospitals .
experiment=NPI-env=determiner_negation_monoclausal-npi=any-crucial_item=no-licensor=1-scope=1-npi_present=0	1		no doctors were listening to that hospitals .
experiment=NPI-env=determiner_negation_monoclausal-npi=any-crucial_item=none of the-licensor=1-scope=0-npi_present=1	0		any doctors were listening to no hospitals .
experiment=NPI-env=determiner_negation_monoclausal-npi=any-crucial_item=none of the-licensor=1-scope=0-npi_present=0	1		that doctors were listening to no hospitals .
experiment=NPI-env=determiner_negation_monoclausal-npi=any-crucial_item=some-licensor=0-scope=1-npi_present=1	0		some doctors were listening to any hospitals .
experiment=NPI-env=determiner_negation_monoclausal-npi=any-crucial_item=some-licensor=0-scope=1-npi_present=0	1		some doctors were listening to that hospitals .
experiment=NPI-env=determiner_negation_monoclausal-npi=any-crucial_item=some-licensor=0-scope=0-npi_present=1	0		any doctors were listening to some hospitals .
experiment=NPI-env=determiner_negation_monoclausal-npi=any-crucial_item=some-licensor=0-scope=0-npi_present=0	1		that doctors were listening to some hospitals .
experiment=NPI-env=determiner_negation_monoclausal-npi=any-crucial_item=no-licensor=1-scope=1-npi_present=1	1		no pedestrians had described any essays .
experiment=NPI-env=determiner_negation_monoclausal-npi=any-crucial_item=no-licensor=1-scope=1-npi_present=0	1		no pedestrians had described that essays .
experiment=NPI-env=determiner_negation_monoclausal-npi=any-crucial_item=none of the-licensor=1-scope=0-npi_present=1	0		any pedestrians had described no essays .
experiment=NPI-env=determiner_negation_monoclausal-npi=any-crucial_item=none of the-licensor=1-scope=0-npi_present=0	1		those pedestrians had described no essays .
experiment=NPI-env=determiner_negation_monoclausal-npi=any-crucial_item=some-licensor=0-scope=1-npi_present=1	0		some pedestrians had described any essays .
experiment=NPI-env=determiner_negation_monoclausal-npi=any-crucial_item=some-licensor=0-scope=1-npi_present=0	1		some pedestrians had described that essays .
experiment=NPI-env=determiner_negation_monoclausal-npi=any-crucial_item=some-licensor=0-scope=0-npi_present=1	0		any pedestrians had described some essays .
experiment=NPI-env=determiner_negation_monoclausal-npi=any-crucial_item=some-licensor=0-scope=0-npi_present=0	1		those pedestrians had described some essays .
experiment=NPI-env=determiner_negation_monoclausal-npi=any-crucial_item=none of the-licensor=1-scope=1-npi_present=1	1		none of the teenagers were arriving at any books .
experiment=NPI-env=determiner_negation_monoclausal-npi=any-crucial_item=none of the-licensor=1-scope=1-npi_present=0	1		none of the teenagers were arriving at the books .
experiment=NPI-env=determiner_negation_monoclausal-npi=any-crucial_item=no-licensor=1-scope=0-npi_present=1	0		any teenagers were arriving at none of the books .
experiment=NPI-env=determiner_negation_monoclausal-npi=any-crucial_item=no-licensor=1-scope=0-npi_present=0	1		the teenagers were arriving at none of the books .
experiment=NPI-env=determiner_negation_monoclausal-npi=any-crucial_item=some-licensor=0-scope=1-npi_present=1	0		some teenagers were arriving at any books .
