experiment=NPI_env=quantifier_npi=ever_licensor=0_scope=1_npi-present=1	0		the lady who ever likes the gals lifted some rug .
experiment=NPI_env=quantifier_npi=ever_licensor=0_scope=1_npi-present=0	1		the lady who once likes the gals lifted some rug .
experiment=NPI_env=quantifier_npi=ever_licensor=0_scope=0_npi-present=1	0		the lady who likes the gals ever lifted some rug .
experiment=NPI_env=quantifier_npi=ever_licensor=0_scope=0_npi-present=0	1		the lady who likes the gals once lifted some rug .
experiment=NPI_env=quantifier_npi=ever_licensor=0_scope=1_npi-present=1	0		gals who ever bought some glasses knew many doctors .
experiment=NPI_env=quantifier_npi=ever_licensor=0_scope=1_npi-present=0	1		gals who once bought some glasses knew many doctors .
experiment=NPI_env=quantifier_npi=ever_licensor=0_scope=0_npi-present=1	0		gals who bought some glasses ever knew many doctors .
experiment=NPI_env=quantifier_npi=ever_licensor=0_scope=0_npi-present=0	1		gals who bought some glasses once knew many doctors .
experiment=NPI_env=quantifier_npi=ever_licensor=0_scope=1_npi-present=1	0		boys who had ever brought the cars talked to a lot of children .
experiment=NPI_env=quantifier_npi=ever_licensor=0_scope=1_npi-present=0	1		boys who had once brought the cars talked to a lot of children .
experiment=NPI_env=quantifier_npi=ever_licensor=0_scope=0_npi-present=1	0		boys who had brought the cars ever talked to a lot of children .
experiment=NPI_env=quantifier_npi=ever_licensor=0_scope=0_npi-present=0	1		boys who had brought the cars once talked to a lot of children .
experiment=NPI_env=quantifier_npi=ever_licensor=0_scope=1_npi-present=1	0		some girl who has ever loved many pedestrians helped some customer .
experiment=NPI_env=quantifier_npi=ever_licensor=0_scope=1_npi-present=0	1		some girl who has once loved many pedestrians helped some customer .
experiment=NPI_env=quantifier_npi=ever_licensor=0_scope=0_npi-present=1	0		some girl who has loved many pedestrians ever helped some customer .
experiment=NPI_env=quantifier_npi=ever_licensor=0_scope=0_npi-present=0	1		some girl who has loved many pedestrians once helped some customer .
experiment=NPI_env=quantifier_npi=ever_licensor=1_scope=1_npi-present=1	1		fewer than three children who ever remembered a lot of pedestrians hug some someone .
experiment=NPI_env=quantifier_npi=ever_licensor=1_scope=1_npi-present=0	1		fewer than three children who once remembered a lot of pedestrians hug some someone .
experiment=NPI_env=quantifier_npi=ever_licensor=1_scope=1_npi-present=1	1		fewer than three children who remembered a lot of pedestrians ever hug some someone .
experiment=NPI_env=quantifier_npi=ever_licensor=1_scope=1_npi-present=0	1		fewer than three children who remembered a lot of pedestrians once hug some someone .
experiment=NPI_env=quantifier_npi=ever_licensor=0_scope=1_npi-present=1	0		some men who have ever seen a lot of girls will kiss a patient .
experiment=NPI_env=quantifier_npi=ever_licensor=0_scope=1_npi-present=0	1		some men who have once seen a lot of girls will kiss a patient .
experiment=NPI_env=quantifier_npi=ever_licensor=0_scope=0_npi-present=1	0		some men who have seen a lot of girls will ever kiss a patient .
experiment=NPI_env=quantifier_npi=ever_licensor=0_scope=0_npi-present=0	1		some men who have seen a lot of girls will once kiss a patient .
experiment=NPI_env=quantifier_npi=ever_licensor=1_scope=1_npi-present=1	1		no waiter who ever loves the children would visit a customer .
experiment=NPI_env=quantifier_npi=ever_licensor=1_scope=1_npi-present=0	1		no waiter who once loves the children would visit a customer .
experiment=NPI_env=quantifier_npi=ever_licensor=1_scope=1_npi-present=1	1		no waiter who loves the children would ever visit a customer .
experiment=NPI_env=quantifier_npi=ever_licensor=1_scope=1_npi-present=0	1		no waiter who loves the children would once visit a customer .
experiment=NPI_env=quantifier_npi=ever_licensor=0_scope=1_npi-present=1	0		an actor who could ever visit the teachers has visited some man .
experiment=NPI_env=quantifier_npi=ever_licensor=0_scope=1_npi-present=0	1		an actor who could once visit the teachers has visited some man .
experiment=NPI_env=quantifier_npi=ever_licensor=0_scope=0_npi-present=1	0		an actor who could visit the teachers has ever visited some man .
experiment=NPI_env=quantifier_npi=ever_licensor=0_scope=0_npi-present=0	1		an actor who could visit the teachers has once visited some man .
experiment=NPI_env=quantifier_npi=ever_licensor=1_scope=1_npi-present=1	1		every dude who had ever sold the cars admired some pedestrian .
experiment=NPI_env=quantifier_npi=ever_licensor=1_scope=1_npi-present=0	1		every dude who had once sold the cars admired some pedestrian .
experiment=NPI_env=quantifier_npi=ever_licensor=1_scope=0_npi-present=1	0		every dude who had sold the cars ever admired some pedestrian .
experiment=NPI_env=quantifier_npi=ever_licensor=1_scope=0_npi-present=0	1		every dude who had sold the cars once admired some pedestrian .
experiment=NPI_env=quantifier_npi=ever_licensor=0_scope=1_npi-present=1	0		some person who would ever break the forks respected some actor .
experiment=NPI_env=quantifier_npi=ever_licensor=0_scope=1_npi-present=0	1		some person who would once break the forks respected some actor .
experiment=NPI_env=quantifier_npi=ever_licensor=0_scope=0_npi-present=1	0		some person who would break the forks ever respected some actor .
experiment=NPI_env=quantifier_npi=ever_licensor=0_scope=0_npi-present=0	1		some person who would break the forks once respected some actor .
experiment=NPI_env=quantifier_npi=ever_licensor=0_scope=1_npi-present=1	0		some teachers who ever know waitresses took some glasses .
experiment=NPI_env=quantifier_npi=ever_licensor=0_scope=1_npi-present=0	1		some teachers who once know waitresses took some glasses .
experiment=NPI_env=quantifier_npi=ever_licensor=0_scope=0_npi-present=1	0		some teachers who know waitresses ever took some glasses .
experiment=NPI_env=quantifier_npi=ever_licensor=0_scope=0_npi-present=0	1		some teachers who know waitresses once took some glasses .
experiment=NPI_env=quantifier_npi=ever_licensor=1_scope=1_npi-present=1	1		all guys who ever visited gals would attack some woman .
experiment=NPI_env=quantifier_npi=ever_licensor=1_scope=1_npi-present=0	1		all guys who once visited gals would attack some woman .
experiment=NPI_env=quantifier_npi=ever_licensor=1_scope=0_npi-present=1	0		all guys who visited gals would ever attack some woman .
experiment=NPI_env=quantifier_npi=ever_licensor=1_scope=0_npi-present=0	1		all guys who visited gals would once attack some woman .
experiment=NPI_env=quantifier_npi=ever_licensor=1_scope=1_npi-present=1	1		no doctors who ever lifted the dishes had taken some book .
experiment=NPI_env=quantifier_npi=ever_licensor=1_scope=1_npi-present=0	1		no doctors who once lifted the dishes had taken some book .
experiment=NPI_env=quantifier_npi=ever_licensor=1_scope=1_npi-present=1	1		no doctors who lifted the dishes had ever taken some book .
experiment=NPI_env=quantifier_npi=ever_licensor=1_scope=1_npi-present=0	1		no doctors who lifted the dishes had once taken some book .
experiment=NPI_env=quantifier_npi=ever_licensor=0_scope=1_npi-present=1	0		the customer who ever knows some patients has worked with a lot of humans .
experiment=NPI_env=quantifier_npi=ever_licensor=0_scope=1_npi-present=0	1		the customer who once knows some patients has worked with a lot of humans .
experiment=NPI_env=quantifier_npi=ever_licensor=0_scope=0_npi-present=1	0		the customer who knows some patients has ever worked with a lot of humans .
experiment=NPI_env=quantifier_npi=ever_licensor=0_scope=0_npi-present=0	1		the customer who knows some patients has once worked with a lot of humans .
experiment=NPI_env=quantifier_npi=ever_licensor=0_scope=1_npi-present=1	0		some customer who has ever respected some kids took a chair .
experiment=NPI_env=quantifier_npi=ever_licensor=0_scope=1_npi-present=0	1		some customer who has once respected some kids took a chair .
experiment=NPI_env=quantifier_npi=ever_licensor=0_scope=0_npi-present=1	0		some customer who has respected some kids ever took a chair .
experiment=NPI_env=quantifier_npi=ever_licensor=0_scope=0_npi-present=0	1		some customer who has respected some kids once took a chair .
experiment=NPI_env=quantifier_npi=ever_licensor=0_scope=1_npi-present=1	0		more than three dudes who have ever known a lot of cashiers kiss the cashier .
experiment=NPI_env=quantifier_npi=ever_licensor=0_scope=1_npi-present=0	1		more than three dudes who have once known a lot of cashiers kiss the cashier .
experiment=NPI_env=quantifier_npi=ever_licensor=0_scope=0_npi-present=1	0		more than three dudes who have known a lot of cashiers ever kiss the cashier .
experiment=NPI_env=quantifier_npi=ever_licensor=0_scope=0_npi-present=0	1		more than three dudes who have known a lot of cashiers once kiss the cashier .
experiment=NPI_env=quantifier_npi=ever_licensor=0_scope=1_npi-present=1	0		the guests who had ever forgotten more than three kids lifted some dress .
experiment=NPI_env=quantifier_npi=ever_licensor=0_scope=1_npi-present=0	1		the guests who had once forgotten more than three kids lifted some dress .
experiment=NPI_env=quantifier_npi=ever_licensor=0_scope=0_npi-present=1	0		the guests who had forgotten more than three kids ever lifted some dress .
experiment=NPI_env=quantifier_npi=ever_licensor=0_scope=0_npi-present=0	1		the guests who had forgotten more than three kids once lifted some dress .
experiment=NPI_env=quantifier_npi=ever_licensor=0_scope=1_npi-present=1	0		the waiters who have ever kissed ladies forget the gals .
experiment=NPI_env=quantifier_npi=ever_licensor=0_scope=1_npi-present=0	1		the waiters who have once kissed ladies forget the gals .
experiment=NPI_env=quantifier_npi=ever_licensor=0_scope=0_npi-present=1	0		the waiters who have kissed ladies ever forget the gals .
experiment=NPI_env=quantifier_npi=ever_licensor=0_scope=0_npi-present=0	1		the waiters who have kissed ladies once forget the gals .
experiment=NPI_env=quantifier_npi=ever_licensor=0_scope=1_npi-present=1	0		the cashier who has ever loved the humans loves more than three waitresses .
experiment=NPI_env=quantifier_npi=ever_licensor=0_scope=1_npi-present=0	1		the cashier who has once loved the humans loves more than three waitresses .
experiment=NPI_env=quantifier_npi=ever_licensor=0_scope=0_npi-present=1	0		the cashier who has loved the humans ever loves more than three waitresses .
experiment=NPI_env=quantifier_npi=ever_licensor=0_scope=0_npi-present=0	1		the cashier who has loved the humans once loves more than three waitresses .
experiment=NPI_env=quantifier_npi=ever_licensor=1_scope=1_npi-present=1	1		every teacher who has ever hugged many women will care for a man .
experiment=NPI_env=quantifier_npi=ever_licensor=1_scope=1_npi-present=0	1		every teacher who has once hugged many women will care for a man .
experiment=NPI_env=quantifier_npi=ever_licensor=1_scope=0_npi-present=1	0		every teacher who has hugged many women will ever care for a man .
experiment=NPI_env=quantifier_npi=ever_licensor=1_scope=0_npi-present=0	1		every teacher who has hugged many women will once care for a man .
experiment=NPI_env=quantifier_npi=ever_licensor=0_scope=1_npi-present=1	0		the boys who should ever take a lot of dishes can help a no one .
experiment=NPI_env=quantifier_npi=ever_licensor=0_scope=1_npi-present=0	1		the boys who should once take a lot of dishes can help a no one .
experiment=NPI_env=quantifier_npi=ever_licensor=0_scope=0_npi-present=1	0		the boys who should take a lot of dishes can ever help a no one .
experiment=NPI_env=quantifier_npi=ever_licensor=0_scope=0_npi-present=0	1		the boys who should take a lot of dishes can once help a no one .
experiment=NPI_env=quantifier_npi=ever_licensor=1_scope=1_npi-present=1	1		every actor who ever cares for actors had worn glasses .
experiment=NPI_env=quantifier_npi=ever_licensor=1_scope=1_npi-present=0	1		every actor who once cares for actors had worn glasses .
experiment=NPI_env=quantifier_npi=ever_licensor=1_scope=0_npi-present=1	0		every actor who cares for actors had ever worn glasses .
experiment=NPI_env=quantifier_npi=ever_licensor=1_scope=0_npi-present=0	1		every actor who cares for actors had once worn glasses .
experiment=NPI_env=quantifier_npi=ever_licensor=1_scope=1_npi-present=1	1		all dudes who ever forget a lot of actors remember a lot of humans .
experiment=NPI_env=quantifier_npi=ever_licensor=1_scope=1_npi-present=0	1		all dudes who once forget a lot of actors remember a lot of humans .
experiment=NPI_env=quantifier_npi=ever_licensor=1_scope=0_npi-present=1	0		all dudes who forget a lot of actors ever remember a lot of humans .
experiment=NPI_env=quantifier_npi=ever_licensor=1_scope=0_npi-present=0	1		all dudes who forget a lot of actors once remember a lot of humans .
experiment=NPI_env=quantifier_npi=ever_licensor=0_scope=1_npi-present=1	0		a lot of customers who had ever hugged more than three students attacked a person .
experiment=NPI_env=quantifier_npi=ever_licensor=0_scope=1_npi-present=0	1		a lot of customers who had once hugged more than three students attacked a person .
experiment=NPI_env=quantifier_npi=ever_licensor=0_scope=0_npi-present=1	0		a lot of customers who had hugged more than three students ever attacked a person .
experiment=NPI_env=quantifier_npi=ever_licensor=0_scope=0_npi-present=0	1		a lot of customers who had hugged more than three students once attacked a person .
experiment=NPI_env=quantifier_npi=ever_licensor=1_scope=1_npi-present=1	1		all women who ever remember many girls do buy some pants .
experiment=NPI_env=quantifier_npi=ever_licensor=1_scope=1_npi-present=0	1		all women who once remember many girls do buy some pants .
experiment=NPI_env=quantifier_npi=ever_licensor=1_scope=0_npi-present=1	0		all women who remember many girls do ever buy some pants .
experiment=NPI_env=quantifier_npi=ever_licensor=1_scope=0_npi-present=0	1		all women who remember many girls do once buy some pants .
experiment=NPI_env=quantifier_npi=ever_licensor=0_scope=1_npi-present=1	0		a girl who ever remembers many waiters was attacking more than three customers .
experiment=NPI_env=quantifier_npi=ever_licensor=0_scope=1_npi-present=0	1		a girl who once remembers many waiters was attacking more than three customers .
experiment=NPI_env=quantifier_npi=ever_licensor=0_scope=0_npi-present=1	0		a girl who remembers many waiters was ever attacking more than three customers .
experiment=NPI_env=quantifier_npi=ever_licensor=0_scope=0_npi-present=0	1		a girl who remembers many waiters was once attacking more than three customers .
experiment=NPI_env=quantifier_npi=ever_licensor=0_scope=1_npi-present=1	0		some driver who ever visited many kids will clean a chair .
experiment=NPI_env=quantifier_npi=ever_licensor=0_scope=1_npi-present=0	1		some driver who once visited many kids will clean a chair .
experiment=NPI_env=quantifier_npi=ever_licensor=0_scope=0_npi-present=1	0		some driver who visited many kids will ever clean a chair .
experiment=NPI_env=quantifier_npi=ever_licensor=0_scope=0_npi-present=0	1		some driver who visited many kids will once clean a chair .
experiment=NPI_env=quantifier_npi=ever_licensor=1_scope=1_npi-present=1	1		every guy who ever admires more than three cars did like some cup .
experiment=NPI_env=quantifier_npi=ever_licensor=1_scope=1_npi-present=0	1		every guy who once admires more than three cars did like some cup .
experiment=NPI_env=quantifier_npi=ever_licensor=1_scope=0_npi-present=1	0		every guy who admires more than three cars did ever like some cup .
experiment=NPI_env=quantifier_npi=ever_licensor=1_scope=0_npi-present=0	1		every guy who admires more than three cars did once like some cup .
experiment=NPI_env=quantifier_npi=ever_licensor=1_scope=1_npi-present=1	1		any drivers who might ever know more than three guests listen to some doctor .
experiment=NPI_env=quantifier_npi=ever_licensor=1_scope=1_npi-present=0	1		any drivers who might once know more than three guests listen to some doctor .
experiment=NPI_env=quantifier_npi=ever_licensor=1_scope=0_npi-present=1	0		any drivers who might know more than three guests ever listen to some doctor .
experiment=NPI_env=quantifier_npi=ever_licensor=1_scope=0_npi-present=0	1		any drivers who might know more than three guests once listen to some doctor .
experiment=NPI_env=quantifier_npi=ever_licensor=1_scope=1_npi-present=1	1		few patients who ever forget the guys break a chair .
experiment=NPI_env=quantifier_npi=ever_licensor=1_scope=1_npi-present=0	1		few patients who once forget the guys break a chair .
experiment=NPI_env=quantifier_npi=ever_licensor=1_scope=1_npi-present=1	1		few patients who forget the guys ever break a chair .
experiment=NPI_env=quantifier_npi=ever_licensor=1_scope=1_npi-present=0	1		few patients who forget the guys once break a chair .
experiment=NPI_env=quantifier_npi=ever_licensor=1_scope=1_npi-present=1	1		few adults who had ever known patients listen to women .
experiment=NPI_env=quantifier_npi=ever_licensor=1_scope=1_npi-present=0	1		few adults who had once known patients listen to women .
experiment=NPI_env=quantifier_npi=ever_licensor=1_scope=1_npi-present=1	1		few adults who had known patients ever listen to women .
experiment=NPI_env=quantifier_npi=ever_licensor=1_scope=1_npi-present=0	1		few adults who had known patients once listen to women .
experiment=NPI_env=quantifier_npi=ever_licensor=1_scope=1_npi-present=1	1		no guest who ever hugged some kids listens to the student .
experiment=NPI_env=quantifier_npi=ever_licensor=1_scope=1_npi-present=0	1		no guest who once hugged some kids listens to the student .
experiment=NPI_env=quantifier_npi=ever_licensor=1_scope=1_npi-present=1	1		no guest who hugged some kids ever listens to the student .
experiment=NPI_env=quantifier_npi=ever_licensor=1_scope=1_npi-present=0	1		no guest who hugged some kids once listens to the student .
experiment=NPI_env=quantifier_npi=ever_licensor=1_scope=1_npi-present=1	1		all children who ever work with more than three doctors had hugged some waitress .
experiment=NPI_env=quantifier_npi=ever_licensor=1_scope=1_npi-present=0	1		all children who once work with more than three doctors had hugged some waitress .
experiment=NPI_env=quantifier_npi=ever_licensor=1_scope=0_npi-present=1	0		all children who work with more than three doctors had ever hugged some waitress .
experiment=NPI_env=quantifier_npi=ever_licensor=1_scope=0_npi-present=0	1		all children who work with more than three doctors had once hugged some waitress .
experiment=NPI_env=quantifier_npi=ever_licensor=1_scope=1_npi-present=1	1		any children who could ever have rugs are breaking many dishes .
experiment=NPI_env=quantifier_npi=ever_licensor=1_scope=1_npi-present=0	1		any children who could once have rugs are breaking many dishes .
experiment=NPI_env=quantifier_npi=ever_licensor=1_scope=0_npi-present=1	0		any children who could have rugs are ever breaking many dishes .
experiment=NPI_env=quantifier_npi=ever_licensor=1_scope=0_npi-present=0	1		any children who could have rugs are once breaking many dishes .
experiment=NPI_env=quantifier_npi=ever_licensor=0_scope=1_npi-present=1	0		more than three women who ever talk to the teachers like some patient .
experiment=NPI_env=quantifier_npi=ever_licensor=0_scope=1_npi-present=0	1		more than three women who once talk to the teachers like some patient .
experiment=NPI_env=quantifier_npi=ever_licensor=0_scope=0_npi-present=1	0		more than three women who talk to the teachers ever like some patient .
experiment=NPI_env=quantifier_npi=ever_licensor=0_scope=0_npi-present=0	1		more than three women who talk to the teachers once like some patient .
experiment=NPI_env=quantifier_npi=ever_licensor=0_scope=1_npi-present=1	0		some pedestrians who ever hate a lot of women had worked with a lot of students .
experiment=NPI_env=quantifier_npi=ever_licensor=0_scope=1_npi-present=0	1		some pedestrians who once hate a lot of women had worked with a lot of students .
experiment=NPI_env=quantifier_npi=ever_licensor=0_scope=0_npi-present=1	0		some pedestrians who hate a lot of women had ever worked with a lot of students .
experiment=NPI_env=quantifier_npi=ever_licensor=0_scope=0_npi-present=0	1		some pedestrians who hate a lot of women had once worked with a lot of students .
experiment=NPI_env=quantifier_npi=ever_licensor=1_scope=1_npi-present=1	1		no girl who has ever broken dishes was hugging an adult .
experiment=NPI_env=quantifier_npi=ever_licensor=1_scope=1_npi-present=0	1		no girl who has once broken dishes was hugging an adult .
experiment=NPI_env=quantifier_npi=ever_licensor=1_scope=1_npi-present=1	1		no girl who has broken dishes was ever hugging an adult .
experiment=NPI_env=quantifier_npi=ever_licensor=1_scope=1_npi-present=0	1		no girl who has broken dishes was once hugging an adult .
experiment=NPI_env=quantifier_npi=ever_licensor=1_scope=1_npi-present=1	1		no woman who ever sold the glasses can admire a hat .
experiment=NPI_env=quantifier_npi=ever_licensor=1_scope=1_npi-present=0	1		no woman who once sold the glasses can admire a hat .
experiment=NPI_env=quantifier_npi=ever_licensor=1_scope=1_npi-present=1	1		no woman who sold the glasses can ever admire a hat .
experiment=NPI_env=quantifier_npi=ever_licensor=1_scope=1_npi-present=0	1		no woman who sold the glasses can once admire a hat .
experiment=NPI_env=quantifier_npi=ever_licensor=0_scope=1_npi-present=1	0		some patient who ever loves some humans should remember some actors .
experiment=NPI_env=quantifier_npi=ever_licensor=0_scope=1_npi-present=0	1		some patient who once loves some humans should remember some actors .
experiment=NPI_env=quantifier_npi=ever_licensor=0_scope=0_npi-present=1	0		some patient who loves some humans should ever remember some actors .
experiment=NPI_env=quantifier_npi=ever_licensor=0_scope=0_npi-present=0	1		some patient who loves some humans should once remember some actors .
experiment=NPI_env=quantifier_npi=ever_licensor=1_scope=1_npi-present=1	1		no driver who ever had books remembered actors .
experiment=NPI_env=quantifier_npi=ever_licensor=1_scope=1_npi-present=0	1		no driver who once had books remembered actors .
experiment=NPI_env=quantifier_npi=ever_licensor=1_scope=1_npi-present=1	1		no driver who had books ever remembered actors .
experiment=NPI_env=quantifier_npi=ever_licensor=1_scope=1_npi-present=0	1		no driver who had books once remembered actors .
experiment=NPI_env=quantifier_npi=ever_licensor=0_scope=1_npi-present=1	0		humans who ever work with more than three patients clean the cup .
experiment=NPI_env=quantifier_npi=ever_licensor=0_scope=1_npi-present=0	1		humans who once work with more than three patients clean the cup .
experiment=NPI_env=quantifier_npi=ever_licensor=0_scope=0_npi-present=1	0		humans who work with more than three patients ever clean the cup .
experiment=NPI_env=quantifier_npi=ever_licensor=0_scope=0_npi-present=0	1		humans who work with more than three patients once clean the cup .
experiment=NPI_env=quantifier_npi=ever_licensor=1_scope=1_npi-present=1	1		every patient who has ever respected more than three ladies could work with more than three waiters .
experiment=NPI_env=quantifier_npi=ever_licensor=1_scope=1_npi-present=0	1		every patient who has once respected more than three ladies could work with more than three waiters .
experiment=NPI_env=quantifier_npi=ever_licensor=1_scope=0_npi-present=1	0		every patient who has respected more than three ladies could ever work with more than three waiters .
experiment=NPI_env=quantifier_npi=ever_licensor=1_scope=0_npi-present=0	1		every patient who has respected more than three ladies could once work with more than three waiters .
experiment=NPI_env=quantifier_npi=ever_licensor=0_scope=1_npi-present=1	0		some customer who has ever sold some cars could sell some chairs .
experiment=NPI_env=quantifier_npi=ever_licensor=0_scope=1_npi-present=0	1		some customer who has once sold some cars could sell some chairs .
experiment=NPI_env=quantifier_npi=ever_licensor=0_scope=0_npi-present=1	0		some customer who has sold some cars could ever sell some chairs .
experiment=NPI_env=quantifier_npi=ever_licensor=0_scope=0_npi-present=0	1		some customer who has sold some cars could once sell some chairs .
experiment=NPI_env=quantifier_npi=ever_licensor=0_scope=1_npi-present=1	0		more than three adults who ever sold a lot of pants would see the dudes .
experiment=NPI_env=quantifier_npi=ever_licensor=0_scope=1_npi-present=0	1		more than three adults who once sold a lot of pants would see the dudes .
experiment=NPI_env=quantifier_npi=ever_licensor=0_scope=0_npi-present=1	0		more than three adults who sold a lot of pants would ever see the dudes .
experiment=NPI_env=quantifier_npi=ever_licensor=0_scope=0_npi-present=0	1		more than three adults who sold a lot of pants would once see the dudes .
experiment=NPI_env=quantifier_npi=ever_licensor=1_scope=1_npi-present=1	1		any gals who ever respected some people work with some actress .
experiment=NPI_env=quantifier_npi=ever_licensor=1_scope=1_npi-present=0	1		any gals who once respected some people work with some actress .
experiment=NPI_env=quantifier_npi=ever_licensor=1_scope=0_npi-present=1	0		any gals who respected some people ever work with some actress .
experiment=NPI_env=quantifier_npi=ever_licensor=1_scope=0_npi-present=0	1		any gals who respected some people once work with some actress .
experiment=NPI_env=quantifier_npi=ever_licensor=0_scope=1_npi-present=1	0		a customer who ever works with kids likes the plate .
experiment=NPI_env=quantifier_npi=ever_licensor=0_scope=1_npi-present=0	1		a customer who once works with kids likes the plate .
experiment=NPI_env=quantifier_npi=ever_licensor=0_scope=0_npi-present=1	0		a customer who works with kids ever likes the plate .
