experiment=NPI-env=negation-npi=in years-crucial_item=no-licensor=1-scope=0-npi_present=0	1		the boys explained for a while that no gals investigated the teenager .
experiment=NPI-env=determiner_negation_biclausal-npi=in years-crucial_item=some-licensor=0-scope=1-npi_present=1	0		Some boys explained that the gals investigated the teenager in years .
experiment=NPI-env=determiner_negation_biclausal-npi=in years-crucial_item=some-licensor=0-scope=1-npi_present=0	1		Some boys explained that the gals investigated the teenager for a while .
experiment=NPI-env=determiner_negation_biclausal-npi=in years-crucial_item=some-licensor=0-scope=0-npi_present=1	0		the boys explained in years that some gals investigated the teenager .
experiment=NPI-env=determiner_negation_biclausal-npi=in years-crucial_item=some-licensor=0-scope=0-npi_present=0	1		the boys explained for a while that some gals investigated the teenager .
experiment=NPI-env=negation-npi=in years-crucial_item=no-licensor=1-scope=1-npi_present=1	1		no guests have said that the actors remembered the men in years .
experiment=NPI-env=negation-npi=in years-crucial_item=no-licensor=1-scope=1-npi_present=0	1		no guests have said that the actors remembered the men on weekends .
experiment=NPI-env=negation-npi=in years-crucial_item=no-licensor=1-scope=0-npi_present=1	0		the guests have said in years that no actors remembered the men .
experiment=NPI-env=negation-npi=in years-crucial_item=no-licensor=1-scope=0-npi_present=0	1		the guests have said on weekends that no actors remembered the men .
experiment=NPI-env=determiner_negation_biclausal-npi=in years-crucial_item=some-licensor=0-scope=1-npi_present=1	0		Some guests have said that the actors remembered the men in years .
experiment=NPI-env=determiner_negation_biclausal-npi=in years-crucial_item=some-licensor=0-scope=1-npi_present=0	1		Some guests have said that the actors remembered the men on weekends .
experiment=NPI-env=determiner_negation_biclausal-npi=in years-crucial_item=some-licensor=0-scope=0-npi_present=1	0		the guests have said in years that some actors remembered the men .
experiment=NPI-env=determiner_negation_biclausal-npi=in years-crucial_item=some-licensor=0-scope=0-npi_present=0	1		the guests have said on weekends that some actors remembered the men .
experiment=NPI-env=negation-npi=in years-crucial_item=no-licensor=1-scope=1-npi_present=1	1		no guests said that the teenager played in years .
experiment=NPI-env=negation-npi=in years-crucial_item=no-licensor=1-scope=1-npi_present=0	1		no guests said that the teenager played on weekends .
experiment=NPI-env=negation-npi=in years-crucial_item=no-licensor=1-scope=0-npi_present=1	0		the guests said in years that no teenager played .
experiment=NPI-env=negation-npi=in years-crucial_item=no-licensor=1-scope=0-npi_present=0	1		the guests said on weekends that no teenager played .
experiment=NPI-env=determiner_negation_biclausal-npi=in years-crucial_item=some-licensor=0-scope=1-npi_present=1	0		Some guests said that the teenager played in years .
experiment=NPI-env=determiner_negation_biclausal-npi=in years-crucial_item=some-licensor=0-scope=1-npi_present=0	1		Some guests said that the teenager played on weekends .
experiment=NPI-env=determiner_negation_biclausal-npi=in years-crucial_item=some-licensor=0-scope=0-npi_present=1	0		the guests said in years that some teenager played .
experiment=NPI-env=determiner_negation_biclausal-npi=in years-crucial_item=some-licensor=0-scope=0-npi_present=0	1		the guests said on weekends that some teenager played .
experiment=NPI-env=negation-npi=in years-crucial_item=no-licensor=1-scope=1-npi_present=1	1		no teenager has said that the drivers admired a car in years .
experiment=NPI-env=negation-npi=in years-crucial_item=no-licensor=1-scope=1-npi_present=0	1		no teenager has said that the drivers admired a car for a while .
experiment=NPI-env=negation-npi=in years-crucial_item=no-licensor=1-scope=0-npi_present=1	0		a teenager has said in years that no drivers admired a car .
experiment=NPI-env=negation-npi=in years-crucial_item=no-licensor=1-scope=0-npi_present=0	1		a teenager has said for a while that no drivers admired a car .
experiment=NPI-env=determiner_negation_biclausal-npi=in years-crucial_item=some-licensor=0-scope=1-npi_present=1	0		Some teenager has said that the drivers admired a car in years .
experiment=NPI-env=determiner_negation_biclausal-npi=in years-crucial_item=some-licensor=0-scope=1-npi_present=0	1		Some teenager has said that the drivers admired a car for a while .
experiment=NPI-env=determiner_negation_biclausal-npi=in years-crucial_item=some-licensor=0-scope=0-npi_present=1	0		a teenager has said in years that some drivers admired a car .
experiment=NPI-env=determiner_negation_biclausal-npi=in years-crucial_item=some-licensor=0-scope=0-npi_present=0	1		a teenager has said for a while that some drivers admired a car .
experiment=NPI-env=negation-npi=in years-crucial_item=no-licensor=1-scope=1-npi_present=1	1		no waiter said that a patient worried in years .
experiment=NPI-env=negation-npi=in years-crucial_item=no-licensor=1-scope=1-npi_present=0	1		no waiter said that a patient worried for a while .
experiment=NPI-env=negation-npi=in years-crucial_item=no-licensor=1-scope=0-npi_present=1	0		a waiter said in years that no patient worried .
experiment=NPI-env=negation-npi=in years-crucial_item=no-licensor=1-scope=0-npi_present=0	1		a waiter said for a while that no patient worried .
experiment=NPI-env=determiner_negation_biclausal-npi=in years-crucial_item=some-licensor=0-scope=1-npi_present=1	0		Some waiter said that a patient worried in years .
experiment=NPI-env=determiner_negation_biclausal-npi=in years-crucial_item=some-licensor=0-scope=1-npi_present=0	1		Some waiter said that a patient worried for a while .
experiment=NPI-env=determiner_negation_biclausal-npi=in years-crucial_item=some-licensor=0-scope=0-npi_present=1	0		a waiter said in years that some patient worried .
experiment=NPI-env=determiner_negation_biclausal-npi=in years-crucial_item=some-licensor=0-scope=0-npi_present=0	1		a waiter said for a while that some patient worried .
experiment=NPI-env=negation-npi=in years-crucial_item=no-licensor=1-scope=1-npi_present=1	1		no patient thought that the people had screamed in years .
experiment=NPI-env=negation-npi=in years-crucial_item=no-licensor=1-scope=1-npi_present=0	1		no patient thought that the people had screamed on weekends .
experiment=NPI-env=negation-npi=in years-crucial_item=no-licensor=1-scope=0-npi_present=1	0		the patient thought in years that no people had screamed .
experiment=NPI-env=negation-npi=in years-crucial_item=no-licensor=1-scope=0-npi_present=0	1		the patient thought on weekends that no people had screamed .
experiment=NPI-env=determiner_negation_biclausal-npi=in years-crucial_item=some-licensor=0-scope=1-npi_present=1	0		Some patient thought that the people had screamed in years .
experiment=NPI-env=determiner_negation_biclausal-npi=in years-crucial_item=some-licensor=0-scope=1-npi_present=0	1		Some patient thought that the people had screamed on weekends .
experiment=NPI-env=determiner_negation_biclausal-npi=in years-crucial_item=some-licensor=0-scope=0-npi_present=1	0		the patient thought in years that some people had screamed .
experiment=NPI-env=determiner_negation_biclausal-npi=in years-crucial_item=some-licensor=0-scope=0-npi_present=0	1		the patient thought on weekends that some people had screamed .
experiment=NPI-env=negation-npi=in years-crucial_item=no-licensor=1-scope=1-npi_present=1	1		no human explained that a waitress attacked a gal in years .
experiment=NPI-env=negation-npi=in years-crucial_item=no-licensor=1-scope=1-npi_present=0	1		no human explained that a waitress attacked a gal for a while .
experiment=NPI-env=negation-npi=in years-crucial_item=no-licensor=1-scope=0-npi_present=1	0		a human explained in years that no waitress attacked a gal .
experiment=NPI-env=negation-npi=in years-crucial_item=no-licensor=1-scope=0-npi_present=0	1		a human explained for a while that no waitress attacked a gal .
experiment=NPI-env=determiner_negation_biclausal-npi=in years-crucial_item=some-licensor=0-scope=1-npi_present=1	0		Some human explained that a waitress attacked a gal in years .
experiment=NPI-env=determiner_negation_biclausal-npi=in years-crucial_item=some-licensor=0-scope=1-npi_present=0	1		Some human explained that a waitress attacked a gal for a while .
experiment=NPI-env=determiner_negation_biclausal-npi=in years-crucial_item=some-licensor=0-scope=0-npi_present=1	0		a human explained in years that some waitress attacked a gal .
experiment=NPI-env=determiner_negation_biclausal-npi=in years-crucial_item=some-licensor=0-scope=0-npi_present=0	1		a human explained for a while that some waitress attacked a gal .
experiment=NPI-env=negation-npi=in years-crucial_item=no-licensor=1-scope=1-npi_present=1	1		no teenager has thought that the lady has laughed in years .
experiment=NPI-env=negation-npi=in years-crucial_item=no-licensor=1-scope=1-npi_present=0	1		no teenager has thought that the lady has laughed on weekends .
experiment=NPI-env=negation-npi=in years-crucial_item=no-licensor=1-scope=0-npi_present=1	0		the teenager has thought in years that no lady has laughed .
experiment=NPI-env=negation-npi=in years-crucial_item=no-licensor=1-scope=0-npi_present=0	1		the teenager has thought on weekends that no lady has laughed .
experiment=NPI-env=determiner_negation_biclausal-npi=in years-crucial_item=some-licensor=0-scope=1-npi_present=1	0		Some teenager has thought that the lady has laughed in years .
experiment=NPI-env=determiner_negation_biclausal-npi=in years-crucial_item=some-licensor=0-scope=1-npi_present=0	1		Some teenager has thought that the lady has laughed on weekends .
experiment=NPI-env=determiner_negation_biclausal-npi=in years-crucial_item=some-licensor=0-scope=0-npi_present=1	0		the teenager has thought in years that some lady has laughed .
experiment=NPI-env=determiner_negation_biclausal-npi=in years-crucial_item=some-licensor=0-scope=0-npi_present=0	1		the teenager has thought on weekends that some lady has laughed .
experiment=NPI-env=negation-npi=in years-crucial_item=no-licensor=1-scope=1-npi_present=1	1		no women have thought that a person visited the sheep in years .
experiment=NPI-env=negation-npi=in years-crucial_item=no-licensor=1-scope=1-npi_present=0	1		no women have thought that a person visited the sheep for a while .
experiment=NPI-env=negation-npi=in years-crucial_item=no-licensor=1-scope=0-npi_present=1	0		the women have thought in years that no person visited the sheep .
experiment=NPI-env=negation-npi=in years-crucial_item=no-licensor=1-scope=0-npi_present=0	1		the women have thought for a while that no person visited the sheep .
experiment=NPI-env=determiner_negation_biclausal-npi=in years-crucial_item=some-licensor=0-scope=1-npi_present=1	0		Some women have thought that a person visited the sheep in years .
experiment=NPI-env=determiner_negation_biclausal-npi=in years-crucial_item=some-licensor=0-scope=1-npi_present=0	1		Some women have thought that a person visited the sheep for a while .
experiment=NPI-env=determiner_negation_biclausal-npi=in years-crucial_item=some-licensor=0-scope=0-npi_present=1	0		the women have thought in years that some person visited the sheep .
experiment=NPI-env=determiner_negation_biclausal-npi=in years-crucial_item=some-licensor=0-scope=0-npi_present=0	1		the women have thought for a while that some person visited the sheep .
experiment=NPI-env=negation-npi=in years-crucial_item=no-licensor=1-scope=1-npi_present=1	1		no girl has imagined that the people have watched the waitresses in years .
experiment=NPI-env=negation-npi=in years-crucial_item=no-licensor=1-scope=1-npi_present=0	1		no girl has imagined that the people have watched the waitresses as well .
experiment=NPI-env=negation-npi=in years-crucial_item=no-licensor=1-scope=0-npi_present=1	0		the girl has imagined in years that no people have watched the waitresses .
experiment=NPI-env=negation-npi=in years-crucial_item=no-licensor=1-scope=0-npi_present=0	1		the girl has imagined as well that no people have watched the waitresses .
experiment=NPI-env=determiner_negation_biclausal-npi=in years-crucial_item=some-licensor=0-scope=1-npi_present=1	0		Some girl has imagined that the people have watched the waitresses in years .
experiment=NPI-env=determiner_negation_biclausal-npi=in years-crucial_item=some-licensor=0-scope=1-npi_present=0	1		Some girl has imagined that the people have watched the waitresses as well .
experiment=NPI-env=determiner_negation_biclausal-npi=in years-crucial_item=some-licensor=0-scope=0-npi_present=1	0		the girl has imagined in years that some people have watched the waitresses .
experiment=NPI-env=determiner_negation_biclausal-npi=in years-crucial_item=some-licensor=0-scope=0-npi_present=0	1		the girl has imagined as well that some people have watched the waitresses .
experiment=NPI-env=negation-npi=in years-crucial_item=no-licensor=1-scope=1-npi_present=1	1		no actors had imagined that the teachers had grinned in years .
experiment=NPI-env=negation-npi=in years-crucial_item=no-licensor=1-scope=1-npi_present=0	1		no actors had imagined that the teachers had grinned regularly .
experiment=NPI-env=negation-npi=in years-crucial_item=no-licensor=1-scope=0-npi_present=1	0		the actors had imagined in years that no teachers had grinned .
experiment=NPI-env=negation-npi=in years-crucial_item=no-licensor=1-scope=0-npi_present=0	1		the actors had imagined regularly that no teachers had grinned .
experiment=NPI-env=determiner_negation_biclausal-npi=in years-crucial_item=some-licensor=0-scope=1-npi_present=1	0		Some actors had imagined that the teachers had grinned in years .
experiment=NPI-env=determiner_negation_biclausal-npi=in years-crucial_item=some-licensor=0-scope=1-npi_present=0	1		Some actors had imagined that the teachers had grinned regularly .
experiment=NPI-env=determiner_negation_biclausal-npi=in years-crucial_item=some-licensor=0-scope=0-npi_present=1	0		the actors had imagined in years that some teachers had grinned .
experiment=NPI-env=determiner_negation_biclausal-npi=in years-crucial_item=some-licensor=0-scope=0-npi_present=0	1		the actors had imagined regularly that some teachers had grinned .
experiment=NPI-env=negation-npi=in years-crucial_item=no-licensor=1-scope=1-npi_present=1	1		no people imagined that the people have approached the man in years .
experiment=NPI-env=negation-npi=in years-crucial_item=no-licensor=1-scope=1-npi_present=0	1		no people imagined that the people have approached the man regularly .
experiment=NPI-env=negation-npi=in years-crucial_item=no-licensor=1-scope=0-npi_present=1	0		the people imagined in years that no people have approached the man .
experiment=NPI-env=negation-npi=in years-crucial_item=no-licensor=1-scope=0-npi_present=0	1		the people imagined regularly that no people have approached the man .
experiment=NPI-env=determiner_negation_biclausal-npi=in years-crucial_item=some-licensor=0-scope=1-npi_present=1	0		Some people imagined that the people have approached the man in years .
experiment=NPI-env=determiner_negation_biclausal-npi=in years-crucial_item=some-licensor=0-scope=1-npi_present=0	1		Some people imagined that the people have approached the man regularly .
experiment=NPI-env=determiner_negation_biclausal-npi=in years-crucial_item=some-licensor=0-scope=0-npi_present=1	0		the people imagined in years that some people have approached the man .
experiment=NPI-env=determiner_negation_biclausal-npi=in years-crucial_item=some-licensor=0-scope=0-npi_present=0	1		the people imagined regularly that some people have approached the man .
experiment=NPI-env=negation-npi=in years-crucial_item=no-licensor=1-scope=1-npi_present=1	1		no adult said that the patient has respected the libraries in years .
experiment=NPI-env=negation-npi=in years-crucial_item=no-licensor=1-scope=1-npi_present=0	1		no adult said that the patient has respected the libraries for a while .
experiment=NPI-env=negation-npi=in years-crucial_item=no-licensor=1-scope=0-npi_present=1	0		the adult said in years that no patient has respected the libraries .
experiment=NPI-env=negation-npi=in years-crucial_item=no-licensor=1-scope=0-npi_present=0	1		the adult said for a while that no patient has respected the libraries .
experiment=NPI-env=determiner_negation_biclausal-npi=in years-crucial_item=some-licensor=0-scope=1-npi_present=1	0		Some adult said that the patient has respected the libraries in years .
experiment=NPI-env=determiner_negation_biclausal-npi=in years-crucial_item=some-licensor=0-scope=1-npi_present=0	1		Some adult said that the patient has respected the libraries for a while .
experiment=NPI-env=determiner_negation_biclausal-npi=in years-crucial_item=some-licensor=0-scope=0-npi_present=1	0		the adult said in years that some patient has respected the libraries .
experiment=NPI-env=determiner_negation_biclausal-npi=in years-crucial_item=some-licensor=0-scope=0-npi_present=0	1		the adult said for a while that some patient has respected the libraries .
experiment=NPI-env=negation-npi=in years-crucial_item=no-licensor=1-scope=1-npi_present=1	1		no women explained that the adults disliked the college campus in years .
experiment=NPI-env=negation-npi=in years-crucial_item=no-licensor=1-scope=1-npi_present=0	1		no women explained that the adults disliked the college campus as well .
experiment=NPI-env=negation-npi=in years-crucial_item=no-licensor=1-scope=0-npi_present=1	0		the women explained in years that no adults disliked the college campus .
experiment=NPI-env=negation-npi=in years-crucial_item=no-licensor=1-scope=0-npi_present=0	1		the women explained as well that no adults disliked the college campus .
experiment=NPI-env=determiner_negation_biclausal-npi=in years-crucial_item=some-licensor=0-scope=1-npi_present=1	0		Some women explained that the adults disliked the college campus in years .
experiment=NPI-env=determiner_negation_biclausal-npi=in years-crucial_item=some-licensor=0-scope=1-npi_present=0	1		Some women explained that the adults disliked the college campus as well .
experiment=NPI-env=determiner_negation_biclausal-npi=in years-crucial_item=some-licensor=0-scope=0-npi_present=1	0		the women explained in years that some adults disliked the college campus .
experiment=NPI-env=determiner_negation_biclausal-npi=in years-crucial_item=some-licensor=0-scope=0-npi_present=0	1		the women explained as well that some adults disliked the college campus .
experiment=NPI-env=negation-npi=in years-crucial_item=no-licensor=1-scope=1-npi_present=1	1		no girls thought that the guests responded in years .
experiment=NPI-env=negation-npi=in years-crucial_item=no-licensor=1-scope=1-npi_present=0	1		no girls thought that the guests responded on occasion .
experiment=NPI-env=negation-npi=in years-crucial_item=no-licensor=1-scope=0-npi_present=1	0		the girls thought in years that no guests responded .
experiment=NPI-env=negation-npi=in years-crucial_item=no-licensor=1-scope=0-npi_present=0	1		the girls thought on occasion that no guests responded .
experiment=NPI-env=determiner_negation_biclausal-npi=in years-crucial_item=some-licensor=0-scope=1-npi_present=1	0		Some girls thought that the guests responded in years .
experiment=NPI-env=determiner_negation_biclausal-npi=in years-crucial_item=some-licensor=0-scope=1-npi_present=0	1		Some girls thought that the guests responded on occasion .
experiment=NPI-env=determiner_negation_biclausal-npi=in years-crucial_item=some-licensor=0-scope=0-npi_present=1	0		the girls thought in years that some guests responded .
experiment=NPI-env=determiner_negation_biclausal-npi=in years-crucial_item=some-licensor=0-scope=0-npi_present=0	1		the girls thought on occasion that some guests responded .
experiment=NPI-env=negation-npi=in years-crucial_item=no-licensor=1-scope=1-npi_present=1	1		no woman thought that the waiters had shouted in years .
experiment=NPI-env=negation-npi=in years-crucial_item=no-licensor=1-scope=1-npi_present=0	1		no woman thought that the waiters had shouted for a while .
experiment=NPI-env=negation-npi=in years-crucial_item=no-licensor=1-scope=0-npi_present=1	0		a woman thought in years that no waiters had shouted .
experiment=NPI-env=negation-npi=in years-crucial_item=no-licensor=1-scope=0-npi_present=0	1		a woman thought for a while that no waiters had shouted .
experiment=NPI-env=determiner_negation_biclausal-npi=in years-crucial_item=some-licensor=0-scope=1-npi_present=1	0		Some woman thought that the waiters had shouted in years .
experiment=NPI-env=determiner_negation_biclausal-npi=in years-crucial_item=some-licensor=0-scope=1-npi_present=0	1		Some woman thought that the waiters had shouted for a while .
experiment=NPI-env=determiner_negation_biclausal-npi=in years-crucial_item=some-licensor=0-scope=0-npi_present=1	0		a woman thought in years that some waiters had shouted .
experiment=NPI-env=determiner_negation_biclausal-npi=in years-crucial_item=some-licensor=0-scope=0-npi_present=0	1		a woman thought for a while that some waiters had shouted .
experiment=NPI-env=negation-npi=in years-crucial_item=no-licensor=1-scope=1-npi_present=1	1		no customers imagined that the human cared for the ladies in years .
experiment=NPI-env=negation-npi=in years-crucial_item=no-licensor=1-scope=1-npi_present=0	1		no customers imagined that the human cared for the ladies on weekends .
experiment=NPI-env=negation-npi=in years-crucial_item=no-licensor=1-scope=0-npi_present=1	0		the customers imagined in years that no human cared for the ladies .
experiment=NPI-env=negation-npi=in years-crucial_item=no-licensor=1-scope=0-npi_present=0	1		the customers imagined on weekends that no human cared for the ladies .
experiment=NPI-env=determiner_negation_biclausal-npi=in years-crucial_item=some-licensor=0-scope=1-npi_present=1	0		Some customers imagined that the human cared for the ladies in years .
experiment=NPI-env=determiner_negation_biclausal-npi=in years-crucial_item=some-licensor=0-scope=1-npi_present=0	1		Some customers imagined that the human cared for the ladies on weekends .
experiment=NPI-env=determiner_negation_biclausal-npi=in years-crucial_item=some-licensor=0-scope=0-npi_present=1	0		the customers imagined in years that some human cared for the ladies .
experiment=NPI-env=determiner_negation_biclausal-npi=in years-crucial_item=some-licensor=0-scope=0-npi_present=0	1		the customers imagined on weekends that some human cared for the ladies .
experiment=NPI-env=negation-npi=in years-crucial_item=no-licensor=1-scope=1-npi_present=1	1		no children said that a guy boycotted the malls in years .
experiment=NPI-env=negation-npi=in years-crucial_item=no-licensor=1-scope=1-npi_present=0	1		no children said that a guy boycotted the malls on occasion .
experiment=NPI-env=negation-npi=in years-crucial_item=no-licensor=1-scope=0-npi_present=1	0		the children said in years that no guy boycotted the malls .
experiment=NPI-env=negation-npi=in years-crucial_item=no-licensor=1-scope=0-npi_present=0	1		the children said on occasion that no guy boycotted the malls .
experiment=NPI-env=determiner_negation_biclausal-npi=in years-crucial_item=some-licensor=0-scope=1-npi_present=1	0		Some children said that a guy boycotted the malls in years .
experiment=NPI-env=determiner_negation_biclausal-npi=in years-crucial_item=some-licensor=0-scope=1-npi_present=0	1		Some children said that a guy boycotted the malls on occasion .
experiment=NPI-env=determiner_negation_biclausal-npi=in years-crucial_item=some-licensor=0-scope=0-npi_present=1	0		the children said in years that some guy boycotted the malls .
experiment=NPI-env=determiner_negation_biclausal-npi=in years-crucial_item=some-licensor=0-scope=0-npi_present=0	1		the children said on occasion that some guy boycotted the malls .
experiment=NPI-env=negation-npi=in years-crucial_item=no-licensor=1-scope=1-npi_present=1	1		no doctors have explained that the guys have stood up in years .
experiment=NPI-env=negation-npi=in years-crucial_item=no-licensor=1-scope=1-npi_present=0	1		no doctors have explained that the guys have stood up regularly .
experiment=NPI-env=negation-npi=in years-crucial_item=no-licensor=1-scope=0-npi_present=1	0		the doctors have explained in years that no guys have stood up .
experiment=NPI-env=negation-npi=in years-crucial_item=no-licensor=1-scope=0-npi_present=0	1		the doctors have explained regularly that no guys have stood up .
experiment=NPI-env=determiner_negation_biclausal-npi=in years-crucial_item=some-licensor=0-scope=1-npi_present=1	0		Some doctors have explained that the guys have stood up in years .
experiment=NPI-env=determiner_negation_biclausal-npi=in years-crucial_item=some-licensor=0-scope=1-npi_present=0	1		Some doctors have explained that the guys have stood up regularly .
experiment=NPI-env=determiner_negation_biclausal-npi=in years-crucial_item=some-licensor=0-scope=0-npi_present=1	0		the doctors have explained in years that some guys have stood up .
experiment=NPI-env=determiner_negation_biclausal-npi=in years-crucial_item=some-licensor=0-scope=0-npi_present=0	1		the doctors have explained regularly that some guys have stood up .
experiment=NPI-env=negation-npi=in years-crucial_item=no-licensor=1-scope=1-npi_present=1	1		no gal explained that the actresses scratched in years .
experiment=NPI-env=negation-npi=in years-crucial_item=no-licensor=1-scope=1-npi_present=0	1		no gal explained that the actresses scratched regularly .
experiment=NPI-env=negation-npi=in years-crucial_item=no-licensor=1-scope=0-npi_present=1	0		the gal explained in years that no actresses scratched .
experiment=NPI-env=negation-npi=in years-crucial_item=no-licensor=1-scope=0-npi_present=0	1		the gal explained regularly that no actresses scratched .
