experiment=NPI_env=quantifier_npi=any_licensor=0_scope=1_npi-present=1	0		the cashier who breaks any couches will like some dishes .
experiment=NPI_env=quantifier_npi=any_licensor=0_scope=1_npi-present=0	1		the cashier who breaks the couches will like some dishes .
experiment=NPI_env=quantifier_npi=any_licensor=0_scope=0_npi-present=1	0		the cashier who breaks the couches will like any dishes .
experiment=NPI_env=quantifier_npi=any_licensor=0_scope=0_npi-present=0	1		the cashier who breaks the couches will like the dishes .
experiment=NPI_env=quantifier_npi=any_licensor=1_scope=1_npi-present=1	1		fewer than three pedestrians who wore any gloves admire some gloves .
experiment=NPI_env=quantifier_npi=any_licensor=1_scope=1_npi-present=0	1		fewer than three pedestrians who wore the gloves admire some gloves .
experiment=NPI_env=quantifier_npi=any_licensor=1_scope=1_npi-present=1	1		fewer than three pedestrians who wore many gloves admire any gloves .
experiment=NPI_env=quantifier_npi=any_licensor=1_scope=1_npi-present=0	1		fewer than three pedestrians who wore many gloves admire the gloves .
experiment=NPI_env=quantifier_npi=any_licensor=1_scope=1_npi-present=1	1		any children who do see any pants are bringing books .
experiment=NPI_env=quantifier_npi=any_licensor=1_scope=1_npi-present=0	1		any children who do see the pants are bringing books .
experiment=NPI_env=quantifier_npi=any_licensor=1_scope=0_npi-present=1	0		any children who do see some pants are bringing any books .
experiment=NPI_env=quantifier_npi=any_licensor=1_scope=0_npi-present=0	1		any children who do see some pants are bringing the books .
experiment=NPI_env=quantifier_npi=any_licensor=1_scope=1_npi-present=1	1		no driver who is bringing any forks bought the cars .
experiment=NPI_env=quantifier_npi=any_licensor=1_scope=1_npi-present=0	1		no driver who is bringing the forks bought the cars .
experiment=NPI_env=quantifier_npi=any_licensor=1_scope=1_npi-present=1	1		no driver who is bringing a lot of forks bought any cars .
experiment=NPI_env=quantifier_npi=any_licensor=1_scope=1_npi-present=0	1		no driver who is bringing a lot of forks bought the cars .
experiment=NPI_env=quantifier_npi=any_licensor=0_scope=1_npi-present=1	0		some customer who sells any cars saw the cars .
experiment=NPI_env=quantifier_npi=any_licensor=0_scope=1_npi-present=0	1		some customer who sells the cars saw the cars .
experiment=NPI_env=quantifier_npi=any_licensor=0_scope=0_npi-present=1	0		some customer who sells more than three cars saw any cars .
experiment=NPI_env=quantifier_npi=any_licensor=0_scope=0_npi-present=0	1		some customer who sells more than three cars saw the cars .
experiment=NPI_env=quantifier_npi=any_licensor=1_scope=1_npi-present=1	1		all kids who buy any glasses can bring some forks .
experiment=NPI_env=quantifier_npi=any_licensor=1_scope=1_npi-present=0	1		all kids who buy the glasses can bring some forks .
experiment=NPI_env=quantifier_npi=any_licensor=1_scope=0_npi-present=1	0		all kids who buy more than three glasses can bring any forks .
experiment=NPI_env=quantifier_npi=any_licensor=1_scope=0_npi-present=0	1		all kids who buy more than three glasses can bring the forks .
experiment=NPI_env=quantifier_npi=any_licensor=1_scope=1_npi-present=1	1		no human who sold any rugs had brought many rugs .
experiment=NPI_env=quantifier_npi=any_licensor=1_scope=1_npi-present=0	1		no human who sold the rugs had brought many rugs .
experiment=NPI_env=quantifier_npi=any_licensor=1_scope=1_npi-present=1	1		no human who sold a lot of rugs had brought any rugs .
experiment=NPI_env=quantifier_npi=any_licensor=1_scope=1_npi-present=0	1		no human who sold a lot of rugs had brought the rugs .
experiment=NPI_env=quantifier_npi=any_licensor=1_scope=1_npi-present=1	1		any drivers who would bring any plates had seen many glasses .
experiment=NPI_env=quantifier_npi=any_licensor=1_scope=1_npi-present=0	1		any drivers who would bring the plates had seen many glasses .
experiment=NPI_env=quantifier_npi=any_licensor=1_scope=0_npi-present=1	0		any drivers who would bring more than three plates had seen any glasses .
experiment=NPI_env=quantifier_npi=any_licensor=1_scope=0_npi-present=0	1		any drivers who would bring more than three plates had seen the glasses .
experiment=NPI_env=quantifier_npi=any_licensor=0_scope=1_npi-present=1	0		some gal who cleans any dishes was cleaning cups .
experiment=NPI_env=quantifier_npi=any_licensor=0_scope=1_npi-present=0	1		some gal who cleans the dishes was cleaning cups .
experiment=NPI_env=quantifier_npi=any_licensor=0_scope=0_npi-present=1	0		some gal who cleans some dishes was cleaning any cups .
experiment=NPI_env=quantifier_npi=any_licensor=0_scope=0_npi-present=0	1		some gal who cleans some dishes was cleaning the cups .
experiment=NPI_env=quantifier_npi=any_licensor=1_scope=1_npi-present=1	1		fewer than three waitresses who buy any chairs lifted more than three couches .
experiment=NPI_env=quantifier_npi=any_licensor=1_scope=1_npi-present=0	1		fewer than three waitresses who buy the chairs lifted more than three couches .
experiment=NPI_env=quantifier_npi=any_licensor=1_scope=1_npi-present=1	1		fewer than three waitresses who buy the chairs lifted any couches .
experiment=NPI_env=quantifier_npi=any_licensor=1_scope=1_npi-present=0	1		fewer than three waitresses who buy the chairs lifted the couches .
experiment=NPI_env=quantifier_npi=any_licensor=1_scope=1_npi-present=1	1		any cashiers who should have any cars sell some cars .
experiment=NPI_env=quantifier_npi=any_licensor=1_scope=1_npi-present=0	1		any cashiers who should have the cars sell some cars .
experiment=NPI_env=quantifier_npi=any_licensor=1_scope=0_npi-present=1	0		any cashiers who should have some cars sell any cars .
experiment=NPI_env=quantifier_npi=any_licensor=1_scope=0_npi-present=0	1		any cashiers who should have some cars sell the cars .
experiment=NPI_env=quantifier_npi=any_licensor=1_scope=1_npi-present=1	1		no actor who will admire any chairs was bringing cars .
experiment=NPI_env=quantifier_npi=any_licensor=1_scope=1_npi-present=0	1		no actor who will admire the chairs was bringing cars .
experiment=NPI_env=quantifier_npi=any_licensor=1_scope=1_npi-present=1	1		no actor who will admire many chairs was bringing any cars .
experiment=NPI_env=quantifier_npi=any_licensor=1_scope=1_npi-present=0	1		no actor who will admire many chairs was bringing the cars .
experiment=NPI_env=quantifier_npi=any_licensor=0_scope=1_npi-present=1	0		some woman who wore any glasses has broken a lot of dishes .
experiment=NPI_env=quantifier_npi=any_licensor=0_scope=1_npi-present=0	1		some woman who wore the glasses has broken a lot of dishes .
experiment=NPI_env=quantifier_npi=any_licensor=0_scope=0_npi-present=1	0		some woman who wore a lot of glasses has broken any dishes .
experiment=NPI_env=quantifier_npi=any_licensor=0_scope=0_npi-present=0	1		some woman who wore a lot of glasses has broken the dishes .
experiment=NPI_env=quantifier_npi=any_licensor=0_scope=1_npi-present=1	0		many humans who had cleaned any gloves are buying some glasses .
experiment=NPI_env=quantifier_npi=any_licensor=0_scope=1_npi-present=0	1		many humans who had cleaned the gloves are buying some glasses .
experiment=NPI_env=quantifier_npi=any_licensor=0_scope=0_npi-present=1	0		many humans who had cleaned some gloves are buying any glasses .
experiment=NPI_env=quantifier_npi=any_licensor=0_scope=0_npi-present=0	1		many humans who had cleaned some gloves are buying the glasses .
experiment=NPI_env=quantifier_npi=any_licensor=1_scope=1_npi-present=1	1		every waitress who lifted any pants sees more than three rugs .
experiment=NPI_env=quantifier_npi=any_licensor=1_scope=1_npi-present=0	1		every waitress who lifted the pants sees more than three rugs .
experiment=NPI_env=quantifier_npi=any_licensor=1_scope=0_npi-present=1	0		every waitress who lifted the pants sees any rugs .
experiment=NPI_env=quantifier_npi=any_licensor=1_scope=0_npi-present=0	1		every waitress who lifted the pants sees the rugs .
experiment=NPI_env=quantifier_npi=any_licensor=1_scope=1_npi-present=1	1		every student who had any pants was admiring more than three rugs .
experiment=NPI_env=quantifier_npi=any_licensor=1_scope=1_npi-present=0	1		every student who had the pants was admiring more than three rugs .
experiment=NPI_env=quantifier_npi=any_licensor=1_scope=0_npi-present=1	0		every student who had many pants was admiring any rugs .
experiment=NPI_env=quantifier_npi=any_licensor=1_scope=0_npi-present=0	1		every student who had many pants was admiring the rugs .
experiment=NPI_env=quantifier_npi=any_licensor=1_scope=1_npi-present=1	1		all students who have seen any chairs sell more than three couches .
experiment=NPI_env=quantifier_npi=any_licensor=1_scope=1_npi-present=0	1		all students who have seen the chairs sell more than three couches .
experiment=NPI_env=quantifier_npi=any_licensor=1_scope=0_npi-present=1	0		all students who have seen more than three chairs sell any couches .
experiment=NPI_env=quantifier_npi=any_licensor=1_scope=0_npi-present=0	1		all students who have seen more than three chairs sell the couches .
experiment=NPI_env=quantifier_npi=any_licensor=0_scope=1_npi-present=1	0		the guy who had bought any gloves broke many plates .
experiment=NPI_env=quantifier_npi=any_licensor=0_scope=1_npi-present=0	1		the guy who had bought the gloves broke many plates .
experiment=NPI_env=quantifier_npi=any_licensor=0_scope=0_npi-present=1	0		the guy who had bought many gloves broke any plates .
experiment=NPI_env=quantifier_npi=any_licensor=0_scope=0_npi-present=0	1		the guy who had bought many gloves broke the plates .
experiment=NPI_env=quantifier_npi=any_licensor=1_scope=1_npi-present=1	1		few drivers who would buy any dishes brought many rugs .
experiment=NPI_env=quantifier_npi=any_licensor=1_scope=1_npi-present=0	1		few drivers who would buy the dishes brought many rugs .
experiment=NPI_env=quantifier_npi=any_licensor=1_scope=1_npi-present=1	1		few drivers who would buy some dishes brought any rugs .
experiment=NPI_env=quantifier_npi=any_licensor=1_scope=1_npi-present=0	1		few drivers who would buy some dishes brought the rugs .
experiment=NPI_env=quantifier_npi=any_licensor=1_scope=1_npi-present=1	1		every lady who has taken any chairs has taken many forks .
experiment=NPI_env=quantifier_npi=any_licensor=1_scope=1_npi-present=0	1		every lady who has taken the chairs has taken many forks .
experiment=NPI_env=quantifier_npi=any_licensor=1_scope=0_npi-present=1	0		every lady who has taken some chairs has taken any forks .
experiment=NPI_env=quantifier_npi=any_licensor=1_scope=0_npi-present=0	1		every lady who has taken some chairs has taken the forks .
experiment=NPI_env=quantifier_npi=any_licensor=0_scope=1_npi-present=1	0		a lot of boys who break any couches would wear the glasses .
experiment=NPI_env=quantifier_npi=any_licensor=0_scope=1_npi-present=0	1		a lot of boys who break the couches would wear the glasses .
experiment=NPI_env=quantifier_npi=any_licensor=0_scope=0_npi-present=1	0		a lot of boys who break some couches would wear any glasses .
experiment=NPI_env=quantifier_npi=any_licensor=0_scope=0_npi-present=0	1		a lot of boys who break some couches would wear the glasses .
experiment=NPI_env=quantifier_npi=any_licensor=0_scope=1_npi-present=1	0		some pedestrian who is breaking any dishes breaks many cars .
experiment=NPI_env=quantifier_npi=any_licensor=0_scope=1_npi-present=0	1		some pedestrian who is breaking the dishes breaks many cars .
experiment=NPI_env=quantifier_npi=any_licensor=0_scope=0_npi-present=1	0		some pedestrian who is breaking some dishes breaks any cars .
experiment=NPI_env=quantifier_npi=any_licensor=0_scope=0_npi-present=0	1		some pedestrian who is breaking some dishes breaks the cars .
experiment=NPI_env=quantifier_npi=any_licensor=1_scope=1_npi-present=1	1		no person who bought any books wears gloves .
experiment=NPI_env=quantifier_npi=any_licensor=1_scope=1_npi-present=0	1		no person who bought the books wears gloves .
experiment=NPI_env=quantifier_npi=any_licensor=1_scope=1_npi-present=1	1		no person who bought many books wears any gloves .
experiment=NPI_env=quantifier_npi=any_licensor=1_scope=1_npi-present=0	1		no person who bought many books wears the gloves .
experiment=NPI_env=quantifier_npi=any_licensor=1_scope=1_npi-present=1	1		no guest who admired any cars will lift more than three glasses .
experiment=NPI_env=quantifier_npi=any_licensor=1_scope=1_npi-present=0	1		no guest who admired the cars will lift more than three glasses .
experiment=NPI_env=quantifier_npi=any_licensor=1_scope=1_npi-present=1	1		no guest who admired cars will lift any glasses .
experiment=NPI_env=quantifier_npi=any_licensor=1_scope=1_npi-present=0	1		no guest who admired cars will lift the glasses .
experiment=NPI_env=quantifier_npi=any_licensor=0_scope=1_npi-present=1	0		the customers who have bought any chairs like some glasses .
experiment=NPI_env=quantifier_npi=any_licensor=0_scope=1_npi-present=0	1		the customers who have bought the chairs like some glasses .
experiment=NPI_env=quantifier_npi=any_licensor=0_scope=0_npi-present=1	0		the customers who have bought the chairs like any glasses .
experiment=NPI_env=quantifier_npi=any_licensor=0_scope=0_npi-present=0	1		the customers who have bought the chairs like the glasses .
experiment=NPI_env=quantifier_npi=any_licensor=1_scope=1_npi-present=1	1		few teachers who were breaking any books took a lot of plates .
experiment=NPI_env=quantifier_npi=any_licensor=1_scope=1_npi-present=0	1		few teachers who were breaking the books took a lot of plates .
experiment=NPI_env=quantifier_npi=any_licensor=1_scope=1_npi-present=1	1		few teachers who were breaking some books took any plates .
experiment=NPI_env=quantifier_npi=any_licensor=1_scope=1_npi-present=0	1		few teachers who were breaking some books took the plates .
experiment=NPI_env=quantifier_npi=any_licensor=1_scope=1_npi-present=1	1		every man who is taking any rugs has seen dishes .
experiment=NPI_env=quantifier_npi=any_licensor=1_scope=1_npi-present=0	1		every man who is taking the rugs has seen dishes .
experiment=NPI_env=quantifier_npi=any_licensor=1_scope=0_npi-present=1	0		every man who is taking rugs has seen any dishes .
experiment=NPI_env=quantifier_npi=any_licensor=1_scope=0_npi-present=0	1		every man who is taking rugs has seen the dishes .
experiment=NPI_env=quantifier_npi=any_licensor=0_scope=1_npi-present=1	0		a lot of waitresses who are selling any forks did clean cars .
experiment=NPI_env=quantifier_npi=any_licensor=0_scope=1_npi-present=0	1		a lot of waitresses who are selling the forks did clean cars .
experiment=NPI_env=quantifier_npi=any_licensor=0_scope=0_npi-present=1	0		a lot of waitresses who are selling the forks did clean any cars .
experiment=NPI_env=quantifier_npi=any_licensor=0_scope=0_npi-present=0	1		a lot of waitresses who are selling the forks did clean the cars .
experiment=NPI_env=quantifier_npi=any_licensor=1_scope=1_npi-present=1	1		no human who sells any cars has cleaned the books .
experiment=NPI_env=quantifier_npi=any_licensor=1_scope=1_npi-present=0	1		no human who sells the cars has cleaned the books .
experiment=NPI_env=quantifier_npi=any_licensor=1_scope=1_npi-present=1	1		no human who sells a lot of cars has cleaned any books .
experiment=NPI_env=quantifier_npi=any_licensor=1_scope=1_npi-present=0	1		no human who sells a lot of cars has cleaned the books .
experiment=NPI_env=quantifier_npi=any_licensor=0_scope=1_npi-present=1	0		the waitress who lifts any plates admired some chairs .
experiment=NPI_env=quantifier_npi=any_licensor=0_scope=1_npi-present=0	1		the waitress who lifts the plates admired some chairs .
experiment=NPI_env=quantifier_npi=any_licensor=0_scope=0_npi-present=1	0		the waitress who lifts a lot of plates admired any chairs .
experiment=NPI_env=quantifier_npi=any_licensor=0_scope=0_npi-present=0	1		the waitress who lifts a lot of plates admired the chairs .
experiment=NPI_env=quantifier_npi=any_licensor=0_scope=1_npi-present=1	0		more than three cashiers who have worn any gloves were cleaning a lot of dishes .
experiment=NPI_env=quantifier_npi=any_licensor=0_scope=1_npi-present=0	1		more than three cashiers who have worn the gloves were cleaning a lot of dishes .
experiment=NPI_env=quantifier_npi=any_licensor=0_scope=0_npi-present=1	0		more than three cashiers who have worn some gloves were cleaning any dishes .
experiment=NPI_env=quantifier_npi=any_licensor=0_scope=0_npi-present=0	1		more than three cashiers who have worn some gloves were cleaning the dishes .
experiment=NPI_env=quantifier_npi=any_licensor=0_scope=1_npi-present=1	0		the patient who sells any books was selling the cars .
experiment=NPI_env=quantifier_npi=any_licensor=0_scope=1_npi-present=0	1		the patient who sells the books was selling the cars .
experiment=NPI_env=quantifier_npi=any_licensor=0_scope=0_npi-present=1	0		the patient who sells a lot of books was selling any cars .
experiment=NPI_env=quantifier_npi=any_licensor=0_scope=0_npi-present=0	1		the patient who sells a lot of books was selling the cars .
experiment=NPI_env=quantifier_npi=any_licensor=1_scope=1_npi-present=1	1		few adults who admire any pants were breaking glasses .
experiment=NPI_env=quantifier_npi=any_licensor=1_scope=1_npi-present=0	1		few adults who admire the pants were breaking glasses .
experiment=NPI_env=quantifier_npi=any_licensor=1_scope=1_npi-present=1	1		few adults who admire pants were breaking any glasses .
experiment=NPI_env=quantifier_npi=any_licensor=1_scope=1_npi-present=0	1		few adults who admire pants were breaking the glasses .
experiment=NPI_env=quantifier_npi=any_licensor=0_scope=1_npi-present=1	0		more than three boys who had bought any cups sold more than three glasses .
experiment=NPI_env=quantifier_npi=any_licensor=0_scope=1_npi-present=0	1		more than three boys who had bought the cups sold more than three glasses .
experiment=NPI_env=quantifier_npi=any_licensor=0_scope=0_npi-present=1	0		more than three boys who had bought a lot of cups sold any glasses .
experiment=NPI_env=quantifier_npi=any_licensor=0_scope=0_npi-present=0	1		more than three boys who had bought a lot of cups sold the glasses .
experiment=NPI_env=quantifier_npi=any_licensor=0_scope=1_npi-present=1	0		more than three customers who were breaking any cups liked the chairs .
experiment=NPI_env=quantifier_npi=any_licensor=0_scope=1_npi-present=0	1		more than three customers who were breaking the cups liked the chairs .
experiment=NPI_env=quantifier_npi=any_licensor=0_scope=0_npi-present=1	0		more than three customers who were breaking cups liked any chairs .
experiment=NPI_env=quantifier_npi=any_licensor=0_scope=0_npi-present=0	1		more than three customers who were breaking cups liked the chairs .
experiment=NPI_env=quantifier_npi=any_licensor=0_scope=1_npi-present=1	0		a lot of gals who had cleaned any rugs has shoes .
experiment=NPI_env=quantifier_npi=any_licensor=0_scope=1_npi-present=0	1		a lot of gals who had cleaned the rugs has shoes .
experiment=NPI_env=quantifier_npi=any_licensor=0_scope=0_npi-present=1	0		a lot of gals who had cleaned more than three rugs has any shoes .
experiment=NPI_env=quantifier_npi=any_licensor=0_scope=0_npi-present=0	1		a lot of gals who had cleaned more than three rugs has the shoes .
experiment=NPI_env=quantifier_npi=any_licensor=1_scope=1_npi-present=1	1		every adult who is breaking any books bought the pants .
experiment=NPI_env=quantifier_npi=any_licensor=1_scope=1_npi-present=0	1		every adult who is breaking the books bought the pants .
experiment=NPI_env=quantifier_npi=any_licensor=1_scope=0_npi-present=1	0		every adult who is breaking many books bought any pants .
experiment=NPI_env=quantifier_npi=any_licensor=1_scope=0_npi-present=0	1		every adult who is breaking many books bought the pants .
experiment=NPI_env=quantifier_npi=any_licensor=0_scope=1_npi-present=1	0		the patient who can admire any pants has brought the chairs .
experiment=NPI_env=quantifier_npi=any_licensor=0_scope=1_npi-present=0	1		the patient who can admire the pants has brought the chairs .
experiment=NPI_env=quantifier_npi=any_licensor=0_scope=0_npi-present=1	0		the patient who can admire the pants has brought any chairs .
experiment=NPI_env=quantifier_npi=any_licensor=0_scope=0_npi-present=0	1		the patient who can admire the pants has brought the chairs .
experiment=NPI_env=quantifier_npi=any_licensor=0_scope=1_npi-present=1	0		waitresses who were selling any couches had admired the glasses .
experiment=NPI_env=quantifier_npi=any_licensor=0_scope=1_npi-present=0	1		waitresses who were selling the couches had admired the glasses .
experiment=NPI_env=quantifier_npi=any_licensor=0_scope=0_npi-present=1	0		waitresses who were selling couches had admired any glasses .
experiment=NPI_env=quantifier_npi=any_licensor=0_scope=0_npi-present=0	1		waitresses who were selling couches had admired the glasses .
experiment=NPI_env=quantifier_npi=any_licensor=0_scope=1_npi-present=1	0		many students who sold any glasses can like the cups .
experiment=NPI_env=quantifier_npi=any_licensor=0_scope=1_npi-present=0	1		many students who sold the glasses can like the cups .
experiment=NPI_env=quantifier_npi=any_licensor=0_scope=0_npi-present=1	0		many students who sold the glasses can like any cups .
experiment=NPI_env=quantifier_npi=any_licensor=0_scope=0_npi-present=0	1		many students who sold the glasses can like the cups .
experiment=NPI_env=quantifier_npi=any_licensor=0_scope=1_npi-present=1	0		the people who lifted any cups can take books .
experiment=NPI_env=quantifier_npi=any_licensor=0_scope=1_npi-present=0	1		the people who lifted the cups can take books .
experiment=NPI_env=quantifier_npi=any_licensor=0_scope=0_npi-present=1	0		the people who lifted many cups can take any books .
experiment=NPI_env=quantifier_npi=any_licensor=0_scope=0_npi-present=0	1		the people who lifted many cups can take the books .
experiment=NPI_env=quantifier_npi=any_licensor=1_scope=1_npi-present=1	1		all children who had bought any gloves have brought the couches .
experiment=NPI_env=quantifier_npi=any_licensor=1_scope=1_npi-present=0	1		all children who had bought the gloves have brought the couches .
experiment=NPI_env=quantifier_npi=any_licensor=1_scope=0_npi-present=1	0		all children who had bought a lot of gloves have brought any couches .
experiment=NPI_env=quantifier_npi=any_licensor=1_scope=0_npi-present=0	1		all children who had bought a lot of gloves have brought the couches .
experiment=NPI_env=quantifier_npi=any_licensor=0_scope=1_npi-present=1	0		the customer who was selling any rugs would clean many dishes .
experiment=NPI_env=quantifier_npi=any_licensor=0_scope=1_npi-present=0	1		the customer who was selling the rugs would clean many dishes .
experiment=NPI_env=quantifier_npi=any_licensor=0_scope=0_npi-present=1	0		the customer who was selling a lot of rugs would clean any dishes .
experiment=NPI_env=quantifier_npi=any_licensor=0_scope=0_npi-present=0	1		the customer who was selling a lot of rugs would clean the dishes .
experiment=NPI_env=quantifier_npi=any_licensor=0_scope=1_npi-present=1	0		some actor who might wear any shoes had cleaned couches .
experiment=NPI_env=quantifier_npi=any_licensor=0_scope=1_npi-present=0	1		some actor who might wear the shoes had cleaned couches .
experiment=NPI_env=quantifier_npi=any_licensor=0_scope=0_npi-present=1	0		some actor who might wear more than three shoes had cleaned any couches .
experiment=NPI_env=quantifier_npi=any_licensor=0_scope=0_npi-present=0	1		some actor who might wear more than three shoes had cleaned the couches .
experiment=NPI_env=quantifier_npi=any_licensor=0_scope=1_npi-present=1	0		some driver who buys any cars did clean the cups .
experiment=NPI_env=quantifier_npi=any_licensor=0_scope=1_npi-present=0	1		some driver who buys the cars did clean the cups .
experiment=NPI_env=quantifier_npi=any_licensor=0_scope=0_npi-present=1	0		some driver who buys many cars did clean any cups .
experiment=NPI_env=quantifier_npi=any_licensor=0_scope=0_npi-present=0	1		some driver who buys many cars did clean the cups .
experiment=NPI_env=quantifier_npi=any_licensor=1_scope=1_npi-present=1	1		fewer than three girls who saw any pants had worn more than three shoes .
experiment=NPI_env=quantifier_npi=any_licensor=1_scope=1_npi-present=0	1		fewer than three girls who saw the pants had worn more than three shoes .
experiment=NPI_env=quantifier_npi=any_licensor=1_scope=1_npi-present=1	1		fewer than three girls who saw some pants had worn any shoes .
experiment=NPI_env=quantifier_npi=any_licensor=1_scope=1_npi-present=0	1		fewer than three girls who saw some pants had worn the shoes .
experiment=NPI_env=quantifier_npi=any_licensor=0_scope=1_npi-present=1	0		the waiter who had any shoes had lifted more than three plates .
experiment=NPI_env=quantifier_npi=any_licensor=0_scope=1_npi-present=0	1		the waiter who had the shoes had lifted more than three plates .
experiment=NPI_env=quantifier_npi=any_licensor=0_scope=0_npi-present=1	0		the waiter who had a lot of shoes had lifted any plates .
experiment=NPI_env=quantifier_npi=any_licensor=0_scope=0_npi-present=0	1		the waiter who had a lot of shoes had lifted the plates .
experiment=NPI_env=quantifier_npi=any_licensor=1_scope=1_npi-present=1	1		no actresses who had worn any gloves should clean shoes .
experiment=NPI_env=quantifier_npi=any_licensor=1_scope=1_npi-present=0	1		no actresses who had worn the gloves should clean shoes .
experiment=NPI_env=quantifier_npi=any_licensor=1_scope=1_npi-present=1	1		no actresses who had worn more than three gloves should clean any shoes .
experiment=NPI_env=quantifier_npi=any_licensor=1_scope=1_npi-present=0	1		no actresses who had worn more than three gloves should clean the shoes .
experiment=NPI_env=quantifier_npi=any_licensor=1_scope=1_npi-present=1	1		every woman who buys any forks wears the gloves .
