experiment=NPI-env=only-npi=any-crucial_item=_-licensor=1-scope=0-npi_present=1	0		any adults have only attacked the teenagers .
experiment=NPI-env=only-npi=any-crucial_item=_-licensor=1-scope=0-npi_present=0	1		some adults have only attacked the teenagers .
experiment=NPI-env=only-npi=any-crucial_item=_-licensor=0-scope=1-npi_present=1	0		the adults have also attacked any teenagers .
experiment=NPI-env=only-npi=any-crucial_item=_-licensor=0-scope=1-npi_present=0	1		the adults have also attacked some teenagers .
experiment=NPI-env=only-npi=any-crucial_item=_-licensor=0-scope=0-npi_present=1	0		any adults have also attacked the teenagers .
experiment=NPI-env=only-npi=any-crucial_item=_-licensor=0-scope=0-npi_present=0	1		some adults have also attacked the teenagers .
experiment=NPI-env=only-npi=any-crucial_item=_-licensor=1-scope=1-npi_present=1	1		only the lady talks to any cashiers .
experiment=NPI-env=only-npi=any-crucial_item=_-licensor=1-scope=1-npi_present=0	1		only the lady talks to some cashiers .
experiment=NPI-env=only-npi=any-crucial_item=_-licensor=1-scope=0-npi_present=1	0		any lady only talks to the cashiers .
experiment=NPI-env=only-npi=any-crucial_item=_-licensor=1-scope=0-npi_present=0	1		some lady only talks to the cashiers .
experiment=NPI-env=only-npi=any-crucial_item=_-licensor=0-scope=1-npi_present=1	0		the lady also talks to any cashiers .
experiment=NPI-env=only-npi=any-crucial_item=_-licensor=0-scope=1-npi_present=0	1		the lady also talks to some cashiers .
experiment=NPI-env=only-npi=any-crucial_item=_-licensor=0-scope=0-npi_present=1	0		any lady also talks to the cashiers .
experiment=NPI-env=only-npi=any-crucial_item=_-licensor=0-scope=0-npi_present=0	1		some lady also talks to the cashiers .
experiment=NPI-env=only-npi=any-crucial_item=_-licensor=1-scope=1-npi_present=1	1		only the girl had been at any restaurants .
experiment=NPI-env=only-npi=any-crucial_item=_-licensor=1-scope=1-npi_present=0	1		only the girl had been at some restaurants .
experiment=NPI-env=only-npi=any-crucial_item=_-licensor=1-scope=0-npi_present=1	0		any girl had only been at the restaurants .
experiment=NPI-env=only-npi=any-crucial_item=_-licensor=1-scope=0-npi_present=0	1		some girl had only been at the restaurants .
experiment=NPI-env=only-npi=any-crucial_item=_-licensor=0-scope=1-npi_present=1	0		the girl had also been at any restaurants .
experiment=NPI-env=only-npi=any-crucial_item=_-licensor=0-scope=1-npi_present=0	1		the girl had also been at some restaurants .
experiment=NPI-env=only-npi=any-crucial_item=_-licensor=0-scope=0-npi_present=1	0		any girl had also been at the restaurants .
experiment=NPI-env=only-npi=any-crucial_item=_-licensor=0-scope=0-npi_present=0	1		some girl had also been at the restaurants .
experiment=NPI-env=only-npi=any-crucial_item=_-licensor=1-scope=1-npi_present=1	1		only the customers have investigated any doctors .
experiment=NPI-env=only-npi=any-crucial_item=_-licensor=1-scope=1-npi_present=0	1		only the customers have investigated some doctors .
experiment=NPI-env=only-npi=any-crucial_item=_-licensor=1-scope=0-npi_present=1	0		any customers have only investigated the doctors .
experiment=NPI-env=only-npi=any-crucial_item=_-licensor=1-scope=0-npi_present=0	1		some customers have only investigated the doctors .
experiment=NPI-env=only-npi=any-crucial_item=_-licensor=0-scope=1-npi_present=1	0		the customers have also investigated any doctors .
experiment=NPI-env=only-npi=any-crucial_item=_-licensor=0-scope=1-npi_present=0	1		the customers have also investigated some doctors .
experiment=NPI-env=only-npi=any-crucial_item=_-licensor=0-scope=0-npi_present=1	0		any customers have also investigated the doctors .
experiment=NPI-env=only-npi=any-crucial_item=_-licensor=0-scope=0-npi_present=0	1		some customers have also investigated the doctors .
experiment=NPI-env=only-npi=any-crucial_item=_-licensor=1-scope=1-npi_present=1	1		only the lady has criticized any cafes .
experiment=NPI-env=only-npi=any-crucial_item=_-licensor=1-scope=1-npi_present=0	1		only the lady has criticized some cafes .
experiment=NPI-env=only-npi=any-crucial_item=_-licensor=1-scope=0-npi_present=1	0		any lady has only criticized the cafes .
experiment=NPI-env=only-npi=any-crucial_item=_-licensor=1-scope=0-npi_present=0	1		some lady has only criticized the cafes .
experiment=NPI-env=only-npi=any-crucial_item=_-licensor=0-scope=1-npi_present=1	0		the lady has also criticized any cafes .
experiment=NPI-env=only-npi=any-crucial_item=_-licensor=0-scope=1-npi_present=0	1		the lady has also criticized some cafes .
experiment=NPI-env=only-npi=any-crucial_item=_-licensor=0-scope=0-npi_present=1	0		any lady has also criticized the cafes .
experiment=NPI-env=only-npi=any-crucial_item=_-licensor=0-scope=0-npi_present=0	1		some lady has also criticized the cafes .
experiment=NPI-env=only-npi=any-crucial_item=_-licensor=1-scope=1-npi_present=1	1		only a boy had been at any high schools .
experiment=NPI-env=only-npi=any-crucial_item=_-licensor=1-scope=1-npi_present=0	1		only a boy had been at some high schools .
experiment=NPI-env=only-npi=any-crucial_item=_-licensor=1-scope=0-npi_present=1	0		any boy had only been at the high schools .
experiment=NPI-env=only-npi=any-crucial_item=_-licensor=1-scope=0-npi_present=0	1		some boy had only been at the high schools .
experiment=NPI-env=only-npi=any-crucial_item=_-licensor=0-scope=1-npi_present=1	0		a boy had also been at any high schools .
experiment=NPI-env=only-npi=any-crucial_item=_-licensor=0-scope=1-npi_present=0	1		a boy had also been at some high schools .
experiment=NPI-env=only-npi=any-crucial_item=_-licensor=0-scope=0-npi_present=1	0		any boy had also been at the high schools .
experiment=NPI-env=only-npi=any-crucial_item=_-licensor=0-scope=0-npi_present=0	1		some boy had also been at the high schools .
experiment=NPI-env=only-npi=any-crucial_item=_-licensor=1-scope=1-npi_present=1	1		only the woman saw any people .
experiment=NPI-env=only-npi=any-crucial_item=_-licensor=1-scope=1-npi_present=0	1		only the woman saw some people .
experiment=NPI-env=only-npi=any-crucial_item=_-licensor=1-scope=0-npi_present=1	0		any woman only saw the people .
experiment=NPI-env=only-npi=any-crucial_item=_-licensor=1-scope=0-npi_present=0	1		some woman only saw the people .
experiment=NPI-env=only-npi=any-crucial_item=_-licensor=0-scope=1-npi_present=1	0		the woman also saw any people .
experiment=NPI-env=only-npi=any-crucial_item=_-licensor=0-scope=1-npi_present=0	1		the woman also saw some people .
experiment=NPI-env=only-npi=any-crucial_item=_-licensor=0-scope=0-npi_present=1	0		any woman also saw the people .
experiment=NPI-env=only-npi=any-crucial_item=_-licensor=0-scope=0-npi_present=0	1		some woman also saw the people .
experiment=NPI-env=only-npi=any-crucial_item=_-licensor=1-scope=1-npi_present=1	1		only a patient will pass any malls .
experiment=NPI-env=only-npi=any-crucial_item=_-licensor=1-scope=1-npi_present=0	1		only a patient will pass some malls .
experiment=NPI-env=only-npi=any-crucial_item=_-licensor=1-scope=0-npi_present=1	0		any patient will only pass the malls .
experiment=NPI-env=only-npi=any-crucial_item=_-licensor=1-scope=0-npi_present=0	1		some patient will only pass the malls .
experiment=NPI-env=only-npi=any-crucial_item=_-licensor=0-scope=1-npi_present=1	0		a patient will also pass any malls .
experiment=NPI-env=only-npi=any-crucial_item=_-licensor=0-scope=1-npi_present=0	1		a patient will also pass some malls .
experiment=NPI-env=only-npi=any-crucial_item=_-licensor=0-scope=0-npi_present=1	0		any patient will also pass the malls .
experiment=NPI-env=only-npi=any-crucial_item=_-licensor=0-scope=0-npi_present=0	1		some patient will also pass the malls .
experiment=NPI-env=only-npi=any-crucial_item=_-licensor=1-scope=1-npi_present=1	1		only the waiters is at any restaurants .
experiment=NPI-env=only-npi=any-crucial_item=_-licensor=1-scope=1-npi_present=0	1		only the waiters is at some restaurants .
experiment=NPI-env=only-npi=any-crucial_item=_-licensor=1-scope=0-npi_present=1	0		any waiters only is at the restaurants .
experiment=NPI-env=only-npi=any-crucial_item=_-licensor=1-scope=0-npi_present=0	1		some waiters only is at the restaurants .
experiment=NPI-env=only-npi=any-crucial_item=_-licensor=0-scope=1-npi_present=1	0		the waiters also is at any restaurants .
experiment=NPI-env=only-npi=any-crucial_item=_-licensor=0-scope=1-npi_present=0	1		the waiters also is at some restaurants .
experiment=NPI-env=only-npi=any-crucial_item=_-licensor=0-scope=0-npi_present=1	0		any waiters also is at the restaurants .
experiment=NPI-env=only-npi=any-crucial_item=_-licensor=0-scope=0-npi_present=0	1		some waiters also is at the restaurants .
experiment=NPI-env=only-npi=any-crucial_item=_-licensor=1-scope=1-npi_present=1	1		only the ladies could hate any movies .
experiment=NPI-env=only-npi=any-crucial_item=_-licensor=1-scope=1-npi_present=0	1		only the ladies could hate some movies .
experiment=NPI-env=only-npi=any-crucial_item=_-licensor=1-scope=0-npi_present=1	0		any ladies could only hate the movies .
experiment=NPI-env=only-npi=any-crucial_item=_-licensor=1-scope=0-npi_present=0	1		some ladies could only hate the movies .
experiment=NPI-env=only-npi=any-crucial_item=_-licensor=0-scope=1-npi_present=1	0		the ladies could also hate any movies .
experiment=NPI-env=only-npi=any-crucial_item=_-licensor=0-scope=1-npi_present=0	1		the ladies could also hate some movies .
experiment=NPI-env=only-npi=any-crucial_item=_-licensor=0-scope=0-npi_present=1	0		any ladies could also hate the movies .
experiment=NPI-env=only-npi=any-crucial_item=_-licensor=0-scope=0-npi_present=0	1		some ladies could also hate the movies .
experiment=NPI-env=only-npi=any-crucial_item=_-licensor=1-scope=1-npi_present=1	1		only the teenager had any forks .
experiment=NPI-env=only-npi=any-crucial_item=_-licensor=1-scope=1-npi_present=0	1		only the teenager had some forks .
experiment=NPI-env=only-npi=any-crucial_item=_-licensor=1-scope=0-npi_present=1	0		any teenager only had the forks .
experiment=NPI-env=only-npi=any-crucial_item=_-licensor=1-scope=0-npi_present=0	1		some teenager only had the forks .
experiment=NPI-env=only-npi=any-crucial_item=_-licensor=0-scope=1-npi_present=1	0		the teenager also had any forks .
experiment=NPI-env=only-npi=any-crucial_item=_-licensor=0-scope=1-npi_present=0	1		the teenager also had some forks .
experiment=NPI-env=only-npi=any-crucial_item=_-licensor=0-scope=0-npi_present=1	0		any teenager also had the forks .
experiment=NPI-env=only-npi=any-crucial_item=_-licensor=0-scope=0-npi_present=0	1		some teenager also had the forks .
experiment=NPI-env=only-npi=any-crucial_item=_-licensor=1-scope=1-npi_present=1	1		only the drivers should drive to any movie theaters .
experiment=NPI-env=only-npi=any-crucial_item=_-licensor=1-scope=1-npi_present=0	1		only the drivers should drive to some movie theaters .
experiment=NPI-env=only-npi=any-crucial_item=_-licensor=1-scope=0-npi_present=1	0		any drivers should only drive to the movie theaters .
experiment=NPI-env=only-npi=any-crucial_item=_-licensor=1-scope=0-npi_present=0	1		some drivers should only drive to the movie theaters .
experiment=NPI-env=only-npi=any-crucial_item=_-licensor=0-scope=1-npi_present=1	0		the drivers should also drive to any movie theaters .
experiment=NPI-env=only-npi=any-crucial_item=_-licensor=0-scope=1-npi_present=0	1		the drivers should also drive to some movie theaters .
experiment=NPI-env=only-npi=any-crucial_item=_-licensor=0-scope=0-npi_present=1	0		any drivers should also drive to the movie theaters .
experiment=NPI-env=only-npi=any-crucial_item=_-licensor=0-scope=0-npi_present=0	1		some drivers should also drive to the movie theaters .
experiment=NPI-env=only-npi=any-crucial_item=_-licensor=1-scope=1-npi_present=1	1		only a teenager has forgotten any women .
experiment=NPI-env=only-npi=any-crucial_item=_-licensor=1-scope=1-npi_present=0	1		only a teenager has forgotten some women .
experiment=NPI-env=only-npi=any-crucial_item=_-licensor=1-scope=0-npi_present=1	0		any teenager has only forgotten the women .
experiment=NPI-env=only-npi=any-crucial_item=_-licensor=1-scope=0-npi_present=0	1		some teenager has only forgotten the women .
experiment=NPI-env=only-npi=any-crucial_item=_-licensor=0-scope=1-npi_present=1	0		a teenager has also forgotten any women .
experiment=NPI-env=only-npi=any-crucial_item=_-licensor=0-scope=1-npi_present=0	1		a teenager has also forgotten some women .
experiment=NPI-env=only-npi=any-crucial_item=_-licensor=0-scope=0-npi_present=1	0		any teenager has also forgotten the women .
experiment=NPI-env=only-npi=any-crucial_item=_-licensor=0-scope=0-npi_present=0	1		some teenager has also forgotten the women .
experiment=NPI-env=only-npi=any-crucial_item=_-licensor=1-scope=1-npi_present=1	1		only the drivers had attacked any waiters .
experiment=NPI-env=only-npi=any-crucial_item=_-licensor=1-scope=1-npi_present=0	1		only the drivers had attacked some waiters .
experiment=NPI-env=only-npi=any-crucial_item=_-licensor=1-scope=0-npi_present=1	0		any drivers had only attacked the waiters .
experiment=NPI-env=only-npi=any-crucial_item=_-licensor=1-scope=0-npi_present=0	1		some drivers had only attacked the waiters .
experiment=NPI-env=only-npi=any-crucial_item=_-licensor=0-scope=1-npi_present=1	0		the drivers had also attacked any waiters .
experiment=NPI-env=only-npi=any-crucial_item=_-licensor=0-scope=1-npi_present=0	1		the drivers had also attacked some waiters .
experiment=NPI-env=only-npi=any-crucial_item=_-licensor=0-scope=0-npi_present=1	0		any drivers had also attacked the waiters .
experiment=NPI-env=only-npi=any-crucial_item=_-licensor=0-scope=0-npi_present=0	1		some drivers had also attacked the waiters .
experiment=NPI-env=only-npi=any-crucial_item=_-licensor=1-scope=1-npi_present=1	1		only the human references any customers .
experiment=NPI-env=only-npi=any-crucial_item=_-licensor=1-scope=1-npi_present=0	1		only the human references some customers .
experiment=NPI-env=only-npi=any-crucial_item=_-licensor=1-scope=0-npi_present=1	0		any human only references the customers .
experiment=NPI-env=only-npi=any-crucial_item=_-licensor=1-scope=0-npi_present=0	1		some human only references the customers .
experiment=NPI-env=only-npi=any-crucial_item=_-licensor=0-scope=1-npi_present=1	0		the human also references any customers .
experiment=NPI-env=only-npi=any-crucial_item=_-licensor=0-scope=1-npi_present=0	1		the human also references some customers .
experiment=NPI-env=only-npi=any-crucial_item=_-licensor=0-scope=0-npi_present=1	0		any human also references the customers .
experiment=NPI-env=only-npi=any-crucial_item=_-licensor=0-scope=0-npi_present=0	1		some human also references the customers .
experiment=NPI-env=only-npi=any-crucial_item=_-licensor=1-scope=1-npi_present=1	1		only an actress references any ladies .
experiment=NPI-env=only-npi=any-crucial_item=_-licensor=1-scope=1-npi_present=0	1		only an actress references some ladies .
experiment=NPI-env=only-npi=any-crucial_item=_-licensor=1-scope=0-npi_present=1	0		any actress only references the ladies .
experiment=NPI-env=only-npi=any-crucial_item=_-licensor=1-scope=0-npi_present=0	1		some actress only references the ladies .
experiment=NPI-env=only-npi=any-crucial_item=_-licensor=0-scope=1-npi_present=1	0		an actress also references any ladies .
experiment=NPI-env=only-npi=any-crucial_item=_-licensor=0-scope=1-npi_present=0	1		an actress also references some ladies .
experiment=NPI-env=only-npi=any-crucial_item=_-licensor=0-scope=0-npi_present=1	0		any actress also references the ladies .
experiment=NPI-env=only-npi=any-crucial_item=_-licensor=0-scope=0-npi_present=0	1		some actress also references the ladies .
experiment=NPI-env=only-npi=any-crucial_item=_-licensor=1-scope=1-npi_present=1	1		only a waiter will exit any high schools .
experiment=NPI-env=only-npi=any-crucial_item=_-licensor=1-scope=1-npi_present=0	1		only a waiter will exit some high schools .
experiment=NPI-env=only-npi=any-crucial_item=_-licensor=1-scope=0-npi_present=1	0		any waiter will only exit the high schools .
experiment=NPI-env=only-npi=any-crucial_item=_-licensor=1-scope=0-npi_present=0	1		some waiter will only exit the high schools .
experiment=NPI-env=only-npi=any-crucial_item=_-licensor=0-scope=1-npi_present=1	0		a waiter will also exit any high schools .
experiment=NPI-env=only-npi=any-crucial_item=_-licensor=0-scope=1-npi_present=0	1		a waiter will also exit some high schools .
experiment=NPI-env=only-npi=any-crucial_item=_-licensor=0-scope=0-npi_present=1	0		any waiter will also exit the high schools .
experiment=NPI-env=only-npi=any-crucial_item=_-licensor=0-scope=0-npi_present=0	1		some waiter will also exit the high schools .
experiment=NPI-env=only-npi=any-crucial_item=_-licensor=1-scope=1-npi_present=1	1		only the cashiers will resemble any movies .
experiment=NPI-env=only-npi=any-crucial_item=_-licensor=1-scope=1-npi_present=0	1		only the cashiers will resemble some movies .
experiment=NPI-env=only-npi=any-crucial_item=_-licensor=1-scope=0-npi_present=1	0		any cashiers will only resemble the movies .
experiment=NPI-env=only-npi=any-crucial_item=_-licensor=1-scope=0-npi_present=0	1		some cashiers will only resemble the movies .
experiment=NPI-env=only-npi=any-crucial_item=_-licensor=0-scope=1-npi_present=1	0		the cashiers will also resemble any movies .
experiment=NPI-env=only-npi=any-crucial_item=_-licensor=0-scope=1-npi_present=0	1		the cashiers will also resemble some movies .
experiment=NPI-env=only-npi=any-crucial_item=_-licensor=0-scope=0-npi_present=1	0		any cashiers will also resemble the movies .
experiment=NPI-env=only-npi=any-crucial_item=_-licensor=0-scope=0-npi_present=0	1		some cashiers will also resemble the movies .
experiment=NPI-env=only-npi=any-crucial_item=_-licensor=1-scope=1-npi_present=1	1		only a guest has worked with any women .
experiment=NPI-env=only-npi=any-crucial_item=_-licensor=1-scope=1-npi_present=0	1		only a guest has worked with some women .
experiment=NPI-env=only-npi=any-crucial_item=_-licensor=1-scope=0-npi_present=1	0		any guest has only worked with the women .
experiment=NPI-env=only-npi=any-crucial_item=_-licensor=1-scope=0-npi_present=0	1		some guest has only worked with the women .
experiment=NPI-env=only-npi=any-crucial_item=_-licensor=0-scope=1-npi_present=1	0		a guest has also worked with any women .
experiment=NPI-env=only-npi=any-crucial_item=_-licensor=0-scope=1-npi_present=0	1		a guest has also worked with some women .
experiment=NPI-env=only-npi=any-crucial_item=_-licensor=0-scope=0-npi_present=1	0		any guest has also worked with the women .
experiment=NPI-env=only-npi=any-crucial_item=_-licensor=0-scope=0-npi_present=0	1		some guest has also worked with the women .
experiment=NPI-env=only-npi=any-crucial_item=_-licensor=1-scope=1-npi_present=1	1		only the customer lifts any dishes .
experiment=NPI-env=only-npi=any-crucial_item=_-licensor=1-scope=1-npi_present=0	1		only the customer lifts some dishes .
experiment=NPI-env=only-npi=any-crucial_item=_-licensor=1-scope=0-npi_present=1	0		any customer only lifts the dishes .
experiment=NPI-env=only-npi=any-crucial_item=_-licensor=1-scope=0-npi_present=0	1		some customer only lifts the dishes .
experiment=NPI-env=only-npi=any-crucial_item=_-licensor=0-scope=1-npi_present=1	0		the customer also lifts any dishes .
experiment=NPI-env=only-npi=any-crucial_item=_-licensor=0-scope=1-npi_present=0	1		the customer also lifts some dishes .
experiment=NPI-env=only-npi=any-crucial_item=_-licensor=0-scope=0-npi_present=1	0		any customer also lifts the dishes .
experiment=NPI-env=only-npi=any-crucial_item=_-licensor=0-scope=0-npi_present=0	1		some customer also lifts the dishes .
experiment=NPI-env=only-npi=any-crucial_item=_-licensor=1-scope=1-npi_present=1	1		only the cashiers kissed any actresses .
experiment=NPI-env=only-npi=any-crucial_item=_-licensor=1-scope=1-npi_present=0	1		only the cashiers kissed some actresses .
experiment=NPI-env=only-npi=any-crucial_item=_-licensor=1-scope=0-npi_present=1	0		any cashiers only kissed the actresses .
experiment=NPI-env=only-npi=any-crucial_item=_-licensor=1-scope=0-npi_present=0	1		some cashiers only kissed the actresses .
experiment=NPI-env=only-npi=any-crucial_item=_-licensor=0-scope=1-npi_present=1	0		the cashiers also kissed any actresses .
experiment=NPI-env=only-npi=any-crucial_item=_-licensor=0-scope=1-npi_present=0	1		the cashiers also kissed some actresses .
experiment=NPI-env=only-npi=any-crucial_item=_-licensor=0-scope=0-npi_present=1	0		any cashiers also kissed the actresses .
experiment=NPI-env=only-npi=any-crucial_item=_-licensor=0-scope=0-npi_present=0	1		some cashiers also kissed the actresses .
experiment=NPI-env=only-npi=any-crucial_item=_-licensor=1-scope=1-npi_present=1	1		only the actresses have investigated any drivers .
experiment=NPI-env=only-npi=any-crucial_item=_-licensor=1-scope=1-npi_present=0	1		only the actresses have investigated some drivers .
experiment=NPI-env=only-npi=any-crucial_item=_-licensor=1-scope=0-npi_present=1	0		any actresses have only investigated the drivers .
experiment=NPI-env=only-npi=any-crucial_item=_-licensor=1-scope=0-npi_present=0	1		some actresses have only investigated the drivers .
experiment=NPI-env=only-npi=any-crucial_item=_-licensor=0-scope=1-npi_present=1	0		the actresses have also investigated any drivers .
experiment=NPI-env=only-npi=any-crucial_item=_-licensor=0-scope=1-npi_present=0	1		the actresses have also investigated some drivers .
experiment=NPI-env=only-npi=any-crucial_item=_-licensor=0-scope=0-npi_present=1	0		any actresses have also investigated the drivers .
experiment=NPI-env=only-npi=any-crucial_item=_-licensor=0-scope=0-npi_present=0	1		some actresses have also investigated the drivers .
experiment=NPI-env=only-npi=any-crucial_item=_-licensor=1-scope=1-npi_present=1	1		only the guest might like any gals .
experiment=NPI-env=only-npi=any-crucial_item=_-licensor=1-scope=1-npi_present=0	1		only the guest might like some gals .
experiment=NPI-env=only-npi=any-crucial_item=_-licensor=1-scope=0-npi_present=1	0		any guest might only like the gals .
experiment=NPI-env=only-npi=any-crucial_item=_-licensor=1-scope=0-npi_present=0	1		some guest might only like the gals .
experiment=NPI-env=only-npi=any-crucial_item=_-licensor=0-scope=1-npi_present=1	0		the guest might also like any gals .
experiment=NPI-env=only-npi=any-crucial_item=_-licensor=0-scope=1-npi_present=0	1		the guest might also like some gals .
experiment=NPI-env=only-npi=any-crucial_item=_-licensor=0-scope=0-npi_present=1	0		any guest might also like the gals .
experiment=NPI-env=only-npi=any-crucial_item=_-licensor=0-scope=0-npi_present=0	1		some guest might also like the gals .
experiment=NPI-env=only-npi=any-crucial_item=_-licensor=1-scope=1-npi_present=1	1		only a guy resembled any cashiers .
experiment=NPI-env=only-npi=any-crucial_item=_-licensor=1-scope=1-npi_present=0	1		only a guy resembled some cashiers .
experiment=NPI-env=only-npi=any-crucial_item=_-licensor=1-scope=0-npi_present=1	0		any guy only resembled the cashiers .
experiment=NPI-env=only-npi=any-crucial_item=_-licensor=1-scope=0-npi_present=0	1		some guy only resembled the cashiers .
experiment=NPI-env=only-npi=any-crucial_item=_-licensor=0-scope=1-npi_present=1	0		a guy also resembled any cashiers .
experiment=NPI-env=only-npi=any-crucial_item=_-licensor=0-scope=1-npi_present=0	1		a guy also resembled some cashiers .
experiment=NPI-env=only-npi=any-crucial_item=_-licensor=0-scope=0-npi_present=1	0		any guy also resembled the cashiers .
experiment=NPI-env=only-npi=any-crucial_item=_-licensor=0-scope=0-npi_present=0	1		some guy also resembled the cashiers .
experiment=NPI-env=only-npi=any-crucial_item=_-licensor=1-scope=1-npi_present=1	1		only a cashier watches any people .
experiment=NPI-env=only-npi=any-crucial_item=_-licensor=1-scope=1-npi_present=0	1		only a cashier watches some people .
experiment=NPI-env=only-npi=any-crucial_item=_-licensor=1-scope=0-npi_present=1	0		any cashier only watches the people .
experiment=NPI-env=only-npi=any-crucial_item=_-licensor=1-scope=0-npi_present=0	1		some cashier only watches the people .
experiment=NPI-env=only-npi=any-crucial_item=_-licensor=0-scope=1-npi_present=1	0		a cashier also watches any people .
experiment=NPI-env=only-npi=any-crucial_item=_-licensor=0-scope=1-npi_present=0	1		a cashier also watches some people .
experiment=NPI-env=only-npi=any-crucial_item=_-licensor=0-scope=0-npi_present=1	0		any cashier also watches the people .
experiment=NPI-env=only-npi=any-crucial_item=_-licensor=0-scope=0-npi_present=0	1		some cashier also watches the people .
experiment=NPI-env=only-npi=any-crucial_item=_-licensor=1-scope=1-npi_present=1	1		only the humans have gone to any museums .
experiment=NPI-env=only-npi=any-crucial_item=_-licensor=1-scope=1-npi_present=0	1		only the humans have gone to some museums .
experiment=NPI-env=only-npi=any-crucial_item=_-licensor=1-scope=0-npi_present=1	0		any humans have only gone to the museums .
experiment=NPI-env=only-npi=any-crucial_item=_-licensor=1-scope=0-npi_present=0	1		some humans have only gone to the museums .
experiment=NPI-env=only-npi=any-crucial_item=_-licensor=0-scope=1-npi_present=1	0		the humans have also gone to any museums .
experiment=NPI-env=only-npi=any-crucial_item=_-licensor=0-scope=1-npi_present=0	1		the humans have also gone to some museums .
experiment=NPI-env=only-npi=any-crucial_item=_-licensor=0-scope=0-npi_present=1	0		any humans have also gone to the museums .
experiment=NPI-env=only-npi=any-crucial_item=_-licensor=0-scope=0-npi_present=0	1		some humans have also gone to the museums .
experiment=NPI-env=only-npi=any-crucial_item=_-licensor=1-scope=1-npi_present=1	1		only the child would walk through any high schools .
