experiment=NPI-env=sentential_negation_biclausal-npi=ever-crucial_item=not-licensor=1-scope=1-npi_present=1	1		the ladies are not ever imagining that the adults can forget a human .
experiment=NPI-env=sentential_negation_biclausal-npi=ever-crucial_item=not-licensor=1-scope=1-npi_present=0	1		the ladies are not really imagining that the adults can forget a human .
experiment=NPI-env=sentential_negation_biclausal-npi=ever-crucial_item=not-licensor=1-scope=0-npi_present=1	0		the ladies are ever imagining that the adults can not forget a human .
experiment=NPI-env=sentential_negation_biclausal-npi=ever-crucial_item=not-licensor=1-scope=0-npi_present=0	1		the ladies are really imagining that the adults can not forget a human .
experiment=NPI-env=sentential_negation_biclausal-npi=ever-crucial_item=really-licensor=0-scope=1-npi_present=1	0		the ladies are really ever imagining that the adults can forget a human .
experiment=NPI-env=sentential_negation_biclausal-npi=ever-crucial_item=really-licensor=0-scope=1-npi_present=0	1		the ladies are really really imagining that the adults can forget a human .
experiment=NPI-env=sentential_negation_biclausal-npi=ever-crucial_item=really-licensor=0-scope=0-npi_present=1	0		the ladies are ever imagining that the adults can really forget a human .
experiment=NPI-env=sentential_negation_biclausal-npi=ever-crucial_item=really-licensor=0-scope=0-npi_present=0	1		the ladies are really imagining that the adults can really forget a human .
experiment=NPI-env=sentential_negation_biclausal-npi=ever-crucial_item=not-licensor=1-scope=1-npi_present=1	1		the people were not ever explaining that a scarf does shrink .
experiment=NPI-env=sentential_negation_biclausal-npi=ever-crucial_item=not-licensor=1-scope=1-npi_present=0	1		the people were not really explaining that a scarf does shrink .
experiment=NPI-env=sentential_negation_biclausal-npi=ever-crucial_item=not-licensor=1-scope=0-npi_present=1	0		the people were ever explaining that a scarf does not shrink .
experiment=NPI-env=sentential_negation_biclausal-npi=ever-crucial_item=not-licensor=1-scope=0-npi_present=0	1		the people were really explaining that a scarf does not shrink .
experiment=NPI-env=sentential_negation_biclausal-npi=ever-crucial_item=really-licensor=0-scope=1-npi_present=1	0		the people were really ever explaining that a scarf does shrink .
experiment=NPI-env=sentential_negation_biclausal-npi=ever-crucial_item=really-licensor=0-scope=1-npi_present=0	1		the people were really really explaining that a scarf does shrink .
experiment=NPI-env=sentential_negation_biclausal-npi=ever-crucial_item=really-licensor=0-scope=0-npi_present=1	0		the people were ever explaining that a scarf does really shrink .
experiment=NPI-env=sentential_negation_biclausal-npi=ever-crucial_item=really-licensor=0-scope=0-npi_present=0	1		the people were really explaining that a scarf does really shrink .
experiment=NPI-env=sentential_negation_biclausal-npi=ever-crucial_item=not-licensor=1-scope=1-npi_present=1	1		the waitresses did not ever think that the commentary had described the cafes .
experiment=NPI-env=sentential_negation_biclausal-npi=ever-crucial_item=not-licensor=1-scope=1-npi_present=0	1		the waitresses did not clearly think that the commentary had described the cafes .
experiment=NPI-env=sentential_negation_biclausal-npi=ever-crucial_item=not-licensor=1-scope=0-npi_present=1	0		the waitresses did ever did think that the commentary had not described the cafes .
experiment=NPI-env=sentential_negation_biclausal-npi=ever-crucial_item=not-licensor=1-scope=0-npi_present=0	1		the waitresses did clearly did think that the commentary had not described the cafes .
experiment=NPI-env=sentential_negation_biclausal-npi=ever-crucial_item=really-licensor=0-scope=1-npi_present=1	0		the waitresses did really ever think that the commentary had described the cafes .
experiment=NPI-env=sentential_negation_biclausal-npi=ever-crucial_item=really-licensor=0-scope=1-npi_present=0	1		the waitresses did really clearly think that the commentary had described the cafes .
experiment=NPI-env=sentential_negation_biclausal-npi=ever-crucial_item=really-licensor=0-scope=0-npi_present=1	0		the waitresses did ever think that the commentary had really described the cafes .
experiment=NPI-env=sentential_negation_biclausal-npi=ever-crucial_item=really-licensor=0-scope=0-npi_present=0	1		the waitresses did clearly think that the commentary had really described the cafes .
experiment=NPI-env=sentential_negation_biclausal-npi=ever-crucial_item=not-licensor=1-scope=1-npi_present=1	1		the boy had not ever imagined that the girls were criticizing the public park .
experiment=NPI-env=sentential_negation_biclausal-npi=ever-crucial_item=not-licensor=1-scope=1-npi_present=0	1		the boy had not clearly imagined that the girls were criticizing the public park .
experiment=NPI-env=sentential_negation_biclausal-npi=ever-crucial_item=not-licensor=1-scope=0-npi_present=1	0		the boy had ever imagined that the girls were not criticizing the public park .
experiment=NPI-env=sentential_negation_biclausal-npi=ever-crucial_item=not-licensor=1-scope=0-npi_present=0	1		the boy had clearly imagined that the girls were not criticizing the public park .
experiment=NPI-env=sentential_negation_biclausal-npi=ever-crucial_item=really-licensor=0-scope=1-npi_present=1	0		the boy had really ever imagined that the girls were criticizing the public park .
experiment=NPI-env=sentential_negation_biclausal-npi=ever-crucial_item=really-licensor=0-scope=1-npi_present=0	1		the boy had really clearly imagined that the girls were criticizing the public park .
experiment=NPI-env=sentential_negation_biclausal-npi=ever-crucial_item=really-licensor=0-scope=0-npi_present=1	0		the boy had ever imagined that the girls were really criticizing the public park .
experiment=NPI-env=sentential_negation_biclausal-npi=ever-crucial_item=really-licensor=0-scope=0-npi_present=0	1		the boy had clearly imagined that the girls were really criticizing the public park .
experiment=NPI-env=sentential_negation_biclausal-npi=ever-crucial_item=not-licensor=1-scope=1-npi_present=1	1		the teenager could not ever explain that the eyes do resemble the college campus .
experiment=NPI-env=sentential_negation_biclausal-npi=ever-crucial_item=not-licensor=1-scope=1-npi_present=0	1		the teenager could not really explain that the eyes do resemble the college campus .
experiment=NPI-env=sentential_negation_biclausal-npi=ever-crucial_item=not-licensor=1-scope=0-npi_present=1	0		the teenager could ever explain that the eyes do not resemble the college campus .
experiment=NPI-env=sentential_negation_biclausal-npi=ever-crucial_item=not-licensor=1-scope=0-npi_present=0	1		the teenager could really explain that the eyes do not resemble the college campus .
experiment=NPI-env=sentential_negation_biclausal-npi=ever-crucial_item=really-licensor=0-scope=1-npi_present=1	0		the teenager could really ever explain that the eyes do resemble the college campus .
experiment=NPI-env=sentential_negation_biclausal-npi=ever-crucial_item=really-licensor=0-scope=1-npi_present=0	1		the teenager could really really explain that the eyes do resemble the college campus .
experiment=NPI-env=sentential_negation_biclausal-npi=ever-crucial_item=really-licensor=0-scope=0-npi_present=1	0		the teenager could ever explain that the eyes do really resemble the college campus .
experiment=NPI-env=sentential_negation_biclausal-npi=ever-crucial_item=really-licensor=0-scope=0-npi_present=0	1		the teenager could really explain that the eyes do really resemble the college campus .
experiment=NPI-env=sentential_negation_biclausal-npi=ever-crucial_item=not-licensor=1-scope=1-npi_present=1	1		the waiters have not ever said that the reports had described the library .
experiment=NPI-env=sentential_negation_biclausal-npi=ever-crucial_item=not-licensor=1-scope=1-npi_present=0	1		the waiters have not certainly said that the reports had described the library .
experiment=NPI-env=sentential_negation_biclausal-npi=ever-crucial_item=not-licensor=1-scope=0-npi_present=1	0		the waiters have ever said that the reports had not described the library .
experiment=NPI-env=sentential_negation_biclausal-npi=ever-crucial_item=not-licensor=1-scope=0-npi_present=0	1		the waiters have certainly said that the reports had not described the library .
experiment=NPI-env=sentential_negation_biclausal-npi=ever-crucial_item=really-licensor=0-scope=1-npi_present=1	0		the waiters have really ever said that the reports had described the library .
experiment=NPI-env=sentential_negation_biclausal-npi=ever-crucial_item=really-licensor=0-scope=1-npi_present=0	1		the waiters have really certainly said that the reports had described the library .
experiment=NPI-env=sentential_negation_biclausal-npi=ever-crucial_item=really-licensor=0-scope=0-npi_present=1	0		the waiters have ever said that the reports had really described the library .
experiment=NPI-env=sentential_negation_biclausal-npi=ever-crucial_item=really-licensor=0-scope=0-npi_present=0	1		the waiters have certainly said that the reports had really described the library .
experiment=NPI-env=sentential_negation_biclausal-npi=ever-crucial_item=not-licensor=1-scope=1-npi_present=1	1		a doctor was not ever imagining that the cafes could resemble the guests .
experiment=NPI-env=sentential_negation_biclausal-npi=ever-crucial_item=not-licensor=1-scope=1-npi_present=0	1		a doctor was not really imagining that the cafes could resemble the guests .
experiment=NPI-env=sentential_negation_biclausal-npi=ever-crucial_item=not-licensor=1-scope=0-npi_present=1	0		a doctor was ever imagining that the cafes could not resemble the guests .
experiment=NPI-env=sentential_negation_biclausal-npi=ever-crucial_item=not-licensor=1-scope=0-npi_present=0	1		a doctor was really imagining that the cafes could not resemble the guests .
experiment=NPI-env=sentential_negation_biclausal-npi=ever-crucial_item=really-licensor=0-scope=1-npi_present=1	0		a doctor was really ever imagining that the cafes could resemble the guests .
experiment=NPI-env=sentential_negation_biclausal-npi=ever-crucial_item=really-licensor=0-scope=1-npi_present=0	1		a doctor was really really imagining that the cafes could resemble the guests .
experiment=NPI-env=sentential_negation_biclausal-npi=ever-crucial_item=really-licensor=0-scope=0-npi_present=1	0		a doctor was ever imagining that the cafes could really resemble the guests .
experiment=NPI-env=sentential_negation_biclausal-npi=ever-crucial_item=really-licensor=0-scope=0-npi_present=0	1		a doctor was really imagining that the cafes could really resemble the guests .
experiment=NPI-env=sentential_negation_biclausal-npi=ever-crucial_item=not-licensor=1-scope=1-npi_present=1	1		a customer might not ever explain that the newspaper articles had won .
experiment=NPI-env=sentential_negation_biclausal-npi=ever-crucial_item=not-licensor=1-scope=1-npi_present=0	1		a customer might not often explain that the newspaper articles had won .
experiment=NPI-env=sentential_negation_biclausal-npi=ever-crucial_item=not-licensor=1-scope=0-npi_present=1	0		a customer might ever explain that the newspaper articles had not won .
experiment=NPI-env=sentential_negation_biclausal-npi=ever-crucial_item=not-licensor=1-scope=0-npi_present=0	1		a customer might often explain that the newspaper articles had not won .
experiment=NPI-env=sentential_negation_biclausal-npi=ever-crucial_item=really-licensor=0-scope=1-npi_present=1	0		a customer might really ever explain that the newspaper articles had won .
experiment=NPI-env=sentential_negation_biclausal-npi=ever-crucial_item=really-licensor=0-scope=1-npi_present=0	1		a customer might really often explain that the newspaper articles had won .
experiment=NPI-env=sentential_negation_biclausal-npi=ever-crucial_item=really-licensor=0-scope=0-npi_present=1	0		a customer might ever explain that the newspaper articles had really won .
experiment=NPI-env=sentential_negation_biclausal-npi=ever-crucial_item=really-licensor=0-scope=0-npi_present=0	1		a customer might often explain that the newspaper articles had really won .
experiment=NPI-env=sentential_negation_biclausal-npi=ever-crucial_item=not-licensor=1-scope=1-npi_present=1	1		an adult is not ever saying that the people had concurred .
experiment=NPI-env=sentential_negation_biclausal-npi=ever-crucial_item=not-licensor=1-scope=1-npi_present=0	1		an adult is not also saying that the people had concurred .
experiment=NPI-env=sentential_negation_biclausal-npi=ever-crucial_item=not-licensor=1-scope=0-npi_present=1	0		an adult is ever saying that the people had not concurred .
experiment=NPI-env=sentential_negation_biclausal-npi=ever-crucial_item=not-licensor=1-scope=0-npi_present=0	1		an adult is also saying that the people had not concurred .
experiment=NPI-env=sentential_negation_biclausal-npi=ever-crucial_item=really-licensor=0-scope=1-npi_present=1	0		an adult is really ever saying that the people had concurred .
experiment=NPI-env=sentential_negation_biclausal-npi=ever-crucial_item=really-licensor=0-scope=1-npi_present=0	1		an adult is really also saying that the people had concurred .
experiment=NPI-env=sentential_negation_biclausal-npi=ever-crucial_item=really-licensor=0-scope=0-npi_present=1	0		an adult is ever saying that the people had really concurred .
experiment=NPI-env=sentential_negation_biclausal-npi=ever-crucial_item=really-licensor=0-scope=0-npi_present=0	1		an adult is also saying that the people had really concurred .
experiment=NPI-env=sentential_negation_biclausal-npi=ever-crucial_item=not-licensor=1-scope=1-npi_present=1	1		the ladies had not ever explained that the patients can assemble .
experiment=NPI-env=sentential_negation_biclausal-npi=ever-crucial_item=not-licensor=1-scope=1-npi_present=0	1		the ladies had not clearly explained that the patients can assemble .
experiment=NPI-env=sentential_negation_biclausal-npi=ever-crucial_item=not-licensor=1-scope=0-npi_present=1	0		the ladies had ever explained that the patients can not assemble .
experiment=NPI-env=sentential_negation_biclausal-npi=ever-crucial_item=not-licensor=1-scope=0-npi_present=0	1		the ladies had clearly explained that the patients can not assemble .
experiment=NPI-env=sentential_negation_biclausal-npi=ever-crucial_item=really-licensor=0-scope=1-npi_present=1	0		the ladies had really ever explained that the patients can assemble .
experiment=NPI-env=sentential_negation_biclausal-npi=ever-crucial_item=really-licensor=0-scope=1-npi_present=0	1		the ladies had really clearly explained that the patients can assemble .
experiment=NPI-env=sentential_negation_biclausal-npi=ever-crucial_item=really-licensor=0-scope=0-npi_present=1	0		the ladies had ever explained that the patients can really assemble .
experiment=NPI-env=sentential_negation_biclausal-npi=ever-crucial_item=really-licensor=0-scope=0-npi_present=0	1		the ladies had clearly explained that the patients can really assemble .
experiment=NPI-env=sentential_negation_biclausal-npi=yet-crucial_item=not-licensor=1-scope=1-npi_present=1	1		the teenagers could not imagine that the teenager would walk through the museums yet .
experiment=NPI-env=sentential_negation_biclausal-npi=yet-crucial_item=not-licensor=1-scope=1-npi_present=0	1		the teenagers could not imagine that the teenager would walk through the museums regularly .
experiment=NPI-env=sentential_negation_biclausal-npi=yet-crucial_item=not-licensor=1-scope=0-npi_present=1	0		the teenagers could imagine yet that the teenager would not walk through the museums .
experiment=NPI-env=sentential_negation_biclausal-npi=yet-crucial_item=not-licensor=1-scope=0-npi_present=0	1		the teenagers could imagine regularly that the teenager would not walk through the museums .
experiment=NPI-env=sentential_negation_biclausal-npi=yet-crucial_item=really-licensor=0-scope=1-npi_present=1	0		the teenagers could really imagine that the teenager would walk through the museums yet .
experiment=NPI-env=sentential_negation_biclausal-npi=yet-crucial_item=really-licensor=0-scope=1-npi_present=0	1		the teenagers could really imagine that the teenager would walk through the museums regularly .
experiment=NPI-env=sentential_negation_biclausal-npi=yet-crucial_item=really-licensor=0-scope=0-npi_present=1	0		the teenagers could imagine yet that the teenager would really walk through the museums .
experiment=NPI-env=sentential_negation_biclausal-npi=yet-crucial_item=really-licensor=0-scope=0-npi_present=0	1		the teenagers could imagine regularly that the teenager would really walk through the museums .
experiment=NPI-env=sentential_negation_biclausal-npi=yet-crucial_item=not-licensor=1-scope=1-npi_present=1	1		a woman did not explain that the hair did resemble the cups yet .
experiment=NPI-env=sentential_negation_biclausal-npi=yet-crucial_item=not-licensor=1-scope=1-npi_present=0	1		a woman did not explain that the hair did resemble the cups regularly .
experiment=NPI-env=sentential_negation_biclausal-npi=yet-crucial_item=not-licensor=1-scope=0-npi_present=1	0		a woman did explain yet that the hair did not resemble the cups .
experiment=NPI-env=sentential_negation_biclausal-npi=yet-crucial_item=not-licensor=1-scope=0-npi_present=0	1		a woman did explain regularly that the hair did not resemble the cups .
experiment=NPI-env=sentential_negation_biclausal-npi=yet-crucial_item=really-licensor=0-scope=1-npi_present=1	0		a woman did really explain that the hair did resemble the cups yet .
experiment=NPI-env=sentential_negation_biclausal-npi=yet-crucial_item=really-licensor=0-scope=1-npi_present=0	1		a woman did really explain that the hair did resemble the cups regularly .
experiment=NPI-env=sentential_negation_biclausal-npi=yet-crucial_item=really-licensor=0-scope=0-npi_present=1	0		a woman did explain yet that the hair did really resemble the cups .
experiment=NPI-env=sentential_negation_biclausal-npi=yet-crucial_item=really-licensor=0-scope=0-npi_present=0	1		a woman did explain regularly that the hair did really resemble the cups .
experiment=NPI-env=sentential_negation_biclausal-npi=yet-crucial_item=not-licensor=1-scope=1-npi_present=1	1		the actresses had not explained that a newspaper article is describing the libraries yet .
experiment=NPI-env=sentential_negation_biclausal-npi=yet-crucial_item=not-licensor=1-scope=1-npi_present=0	1		the actresses had not explained that a newspaper article is describing the libraries on weekends .
experiment=NPI-env=sentential_negation_biclausal-npi=yet-crucial_item=not-licensor=1-scope=0-npi_present=1	0		the actresses had explained yet that a newspaper article is not describing the libraries .
experiment=NPI-env=sentential_negation_biclausal-npi=yet-crucial_item=not-licensor=1-scope=0-npi_present=0	1		the actresses had explained on weekends that a newspaper article is not describing the libraries .
experiment=NPI-env=sentential_negation_biclausal-npi=yet-crucial_item=really-licensor=0-scope=1-npi_present=1	0		the actresses had really explained that a newspaper article is describing the libraries yet .
experiment=NPI-env=sentential_negation_biclausal-npi=yet-crucial_item=really-licensor=0-scope=1-npi_present=0	1		the actresses had really explained that a newspaper article is describing the libraries on weekends .
experiment=NPI-env=sentential_negation_biclausal-npi=yet-crucial_item=really-licensor=0-scope=0-npi_present=1	0		the actresses had explained yet that a newspaper article is really describing the libraries .
experiment=NPI-env=sentential_negation_biclausal-npi=yet-crucial_item=really-licensor=0-scope=0-npi_present=0	1		the actresses had explained on weekends that a newspaper article is really describing the libraries .
experiment=NPI-env=sentential_negation_biclausal-npi=yet-crucial_item=not-licensor=1-scope=1-npi_present=1	1		the people have not imagined that the movie might disagree yet .
experiment=NPI-env=sentential_negation_biclausal-npi=yet-crucial_item=not-licensor=1-scope=1-npi_present=0	1		the people have not imagined that the movie might disagree for a while .
experiment=NPI-env=sentential_negation_biclausal-npi=yet-crucial_item=not-licensor=1-scope=0-npi_present=1	0		the people have imagined yet that the movie might not disagree .
experiment=NPI-env=sentential_negation_biclausal-npi=yet-crucial_item=not-licensor=1-scope=0-npi_present=0	1		the people have imagined for a while that the movie might not disagree .
experiment=NPI-env=sentential_negation_biclausal-npi=yet-crucial_item=really-licensor=0-scope=1-npi_present=1	0		the people have really imagined that the movie might disagree yet .
experiment=NPI-env=sentential_negation_biclausal-npi=yet-crucial_item=really-licensor=0-scope=1-npi_present=0	1		the people have really imagined that the movie might disagree for a while .
experiment=NPI-env=sentential_negation_biclausal-npi=yet-crucial_item=really-licensor=0-scope=0-npi_present=1	0		the people have imagined yet that the movie might really disagree .
experiment=NPI-env=sentential_negation_biclausal-npi=yet-crucial_item=really-licensor=0-scope=0-npi_present=0	1		the people have imagined for a while that the movie might really disagree .
experiment=NPI-env=sentential_negation_biclausal-npi=yet-crucial_item=not-licensor=1-scope=1-npi_present=1	1		the teenagers can not think that the museum would resemble an actor yet .
experiment=NPI-env=sentential_negation_biclausal-npi=yet-crucial_item=not-licensor=1-scope=1-npi_present=0	1		the teenagers can not think that the museum would resemble an actor on occasion .
experiment=NPI-env=sentential_negation_biclausal-npi=yet-crucial_item=not-licensor=1-scope=0-npi_present=1	0		the teenagers can think yet that the museum would not resemble an actor .
experiment=NPI-env=sentential_negation_biclausal-npi=yet-crucial_item=not-licensor=1-scope=0-npi_present=0	1		the teenagers can think on occasion that the museum would not resemble an actor .
experiment=NPI-env=sentential_negation_biclausal-npi=yet-crucial_item=really-licensor=0-scope=1-npi_present=1	0		the teenagers can really think that the museum would resemble an actor yet .
experiment=NPI-env=sentential_negation_biclausal-npi=yet-crucial_item=really-licensor=0-scope=1-npi_present=0	1		the teenagers can really think that the museum would resemble an actor on occasion .
experiment=NPI-env=sentential_negation_biclausal-npi=yet-crucial_item=really-licensor=0-scope=0-npi_present=1	0		the teenagers can think yet that the museum would really resemble an actor .
experiment=NPI-env=sentential_negation_biclausal-npi=yet-crucial_item=really-licensor=0-scope=0-npi_present=0	1		the teenagers can think on occasion that the museum would really resemble an actor .
experiment=NPI-env=sentential_negation_biclausal-npi=yet-crucial_item=not-licensor=1-scope=1-npi_present=1	1		a driver had not explained that the cashier was working hard yet .
experiment=NPI-env=sentential_negation_biclausal-npi=yet-crucial_item=not-licensor=1-scope=1-npi_present=0	1		a driver had not explained that the cashier was working hard on weekends .
experiment=NPI-env=sentential_negation_biclausal-npi=yet-crucial_item=not-licensor=1-scope=0-npi_present=1	0		a driver had explained yet that the cashier was not working hard .
experiment=NPI-env=sentential_negation_biclausal-npi=yet-crucial_item=not-licensor=1-scope=0-npi_present=0	1		a driver had explained on weekends that the cashier was not working hard .
experiment=NPI-env=sentential_negation_biclausal-npi=yet-crucial_item=really-licensor=0-scope=1-npi_present=1	0		a driver had really explained that the cashier was working hard yet .
experiment=NPI-env=sentential_negation_biclausal-npi=yet-crucial_item=really-licensor=0-scope=1-npi_present=0	1		a driver had really explained that the cashier was working hard on weekends .
experiment=NPI-env=sentential_negation_biclausal-npi=yet-crucial_item=really-licensor=0-scope=0-npi_present=1	0		a driver had explained yet that the cashier was really working hard .
experiment=NPI-env=sentential_negation_biclausal-npi=yet-crucial_item=really-licensor=0-scope=0-npi_present=0	1		a driver had explained on weekends that the cashier was really working hard .
experiment=NPI-env=sentential_negation_biclausal-npi=yet-crucial_item=not-licensor=1-scope=1-npi_present=1	1		a guy does not say that the books have won yet .
experiment=NPI-env=sentential_negation_biclausal-npi=yet-crucial_item=not-licensor=1-scope=1-npi_present=0	1		a guy does not say that the books have won on weekends .
experiment=NPI-env=sentential_negation_biclausal-npi=yet-crucial_item=not-licensor=1-scope=0-npi_present=1	0		a guy does say yet that the books have not won .
experiment=NPI-env=sentential_negation_biclausal-npi=yet-crucial_item=not-licensor=1-scope=0-npi_present=0	1		a guy does say on weekends that the books have not won .
experiment=NPI-env=sentential_negation_biclausal-npi=yet-crucial_item=really-licensor=0-scope=1-npi_present=1	0		a guy does really say that the books have won yet .
experiment=NPI-env=sentential_negation_biclausal-npi=yet-crucial_item=really-licensor=0-scope=1-npi_present=0	1		a guy does really say that the books have won on weekends .
experiment=NPI-env=sentential_negation_biclausal-npi=yet-crucial_item=really-licensor=0-scope=0-npi_present=1	0		a guy does say yet that the books have really won .
experiment=NPI-env=sentential_negation_biclausal-npi=yet-crucial_item=really-licensor=0-scope=0-npi_present=0	1		a guy does say on weekends that the books have really won .
experiment=NPI-env=sentential_negation_biclausal-npi=yet-crucial_item=not-licensor=1-scope=1-npi_present=1	1		an adult has not thought that the report was winning yet .
experiment=NPI-env=sentential_negation_biclausal-npi=yet-crucial_item=not-licensor=1-scope=1-npi_present=0	1		an adult has not thought that the report was winning for a while .
