experiment=NPI-env=determiner_negation_monoclausal-npi=at all-crucial_item=no-licensor=1-scope=1-npi_present=0	1		no teenager was skated around the hospitals as well .
experiment=NPI-env=determiner_negation_monoclausal-npi=at all-crucial_item=no-licensor=1-scope=0-npi_present=1	0		the teenager was skated around the hospitals at all at no cafes .
experiment=NPI-env=determiner_negation_monoclausal-npi=at all-crucial_item=no-licensor=1-scope=0-npi_present=0	1		the teenager was skated around the hospitals as well at no cafes .
experiment=NPI-env=determiner_negation_monoclausal-npi=at all-crucial_item=some-licensor=0-scope=1-npi_present=1	0		some teenager was skated around the hospitals at all .
experiment=NPI-env=determiner_negation_monoclausal-npi=at all-crucial_item=some-licensor=0-scope=1-npi_present=0	1		some teenager was skated around the hospitals as well .
experiment=NPI-env=determiner_negation_monoclausal-npi=at all-crucial_item=some-licensor=0-scope=0-npi_present=1	0		the teenager was skated around the hospitals at all at some cafes .
experiment=NPI-env=determiner_negation_monoclausal-npi=at all-crucial_item=some-licensor=0-scope=0-npi_present=0	1		the teenager was skated around the hospitals as well at some cafes .
experiment=NPI-env=determiner_negation_monoclausal-npi=at all-crucial_item=no-licensor=1-scope=1-npi_present=1	1		no guests can visit the boys at all .
experiment=NPI-env=determiner_negation_monoclausal-npi=at all-crucial_item=no-licensor=1-scope=1-npi_present=0	1		no guests can visit the boys for a while .
experiment=NPI-env=determiner_negation_monoclausal-npi=at all-crucial_item=no-licensor=1-scope=0-npi_present=1	0		the guests can visit the boys at all at no banks .
experiment=NPI-env=determiner_negation_monoclausal-npi=at all-crucial_item=no-licensor=1-scope=0-npi_present=0	1		the guests can visit the boys for a while at no banks .
experiment=NPI-env=determiner_negation_monoclausal-npi=at all-crucial_item=some-licensor=0-scope=1-npi_present=1	0		some guests can visit the boys at all .
experiment=NPI-env=determiner_negation_monoclausal-npi=at all-crucial_item=some-licensor=0-scope=1-npi_present=0	1		some guests can visit the boys for a while .
experiment=NPI-env=determiner_negation_monoclausal-npi=at all-crucial_item=some-licensor=0-scope=0-npi_present=1	0		the guests can visit the boys at all at some banks .
experiment=NPI-env=determiner_negation_monoclausal-npi=at all-crucial_item=some-licensor=0-scope=0-npi_present=0	1		the guests can visit the boys for a while at some banks .
experiment=NPI-env=determiner_negation_monoclausal-npi=at all-crucial_item=no-licensor=1-scope=1-npi_present=1	1		no customers arrive at the high schools at all .
experiment=NPI-env=determiner_negation_monoclausal-npi=at all-crucial_item=no-licensor=1-scope=1-npi_present=0	1		no customers arrive at the high schools for a while .
experiment=NPI-env=determiner_negation_monoclausal-npi=at all-crucial_item=none of the-licensor=1-scope=0-npi_present=1	0		the customers arrive at the high schools at all at no cafes .
experiment=NPI-env=determiner_negation_monoclausal-npi=at all-crucial_item=none of the-licensor=1-scope=0-npi_present=0	1		the customers arrive at the high schools for a while at no cafes .
experiment=NPI-env=determiner_negation_monoclausal-npi=at all-crucial_item=some-licensor=0-scope=1-npi_present=1	0		some customers arrive at the high schools at all .
experiment=NPI-env=determiner_negation_monoclausal-npi=at all-crucial_item=some-licensor=0-scope=1-npi_present=0	1		some customers arrive at the high schools for a while .
experiment=NPI-env=determiner_negation_monoclausal-npi=at all-crucial_item=some-licensor=0-scope=0-npi_present=1	0		the customers arrive at the high schools at all at some cafes .
experiment=NPI-env=determiner_negation_monoclausal-npi=at all-crucial_item=some-licensor=0-scope=0-npi_present=0	1		the customers arrive at the high schools for a while at some cafes .
experiment=NPI-env=determiner_negation_monoclausal-npi=at all-crucial_item=no-licensor=1-scope=1-npi_present=1	1		no doctor could insult the waitresses at all .
experiment=NPI-env=determiner_negation_monoclausal-npi=at all-crucial_item=no-licensor=1-scope=1-npi_present=0	1		no doctor could insult the waitresses regularly .
experiment=NPI-env=determiner_negation_monoclausal-npi=at all-crucial_item=no-licensor=1-scope=0-npi_present=1	0		a doctor could insult the waitresses at all at no malls .
experiment=NPI-env=determiner_negation_monoclausal-npi=at all-crucial_item=no-licensor=1-scope=0-npi_present=0	1		a doctor could insult the waitresses regularly at no malls .
experiment=NPI-env=determiner_negation_monoclausal-npi=at all-crucial_item=some-licensor=0-scope=1-npi_present=1	0		some doctor could insult the waitresses at all .
experiment=NPI-env=determiner_negation_monoclausal-npi=at all-crucial_item=some-licensor=0-scope=1-npi_present=0	1		some doctor could insult the waitresses regularly .
experiment=NPI-env=determiner_negation_monoclausal-npi=at all-crucial_item=some-licensor=0-scope=0-npi_present=1	0		a doctor could insult the waitresses at all at some malls .
experiment=NPI-env=determiner_negation_monoclausal-npi=at all-crucial_item=some-licensor=0-scope=0-npi_present=0	1		a doctor could insult the waitresses regularly at some malls .
experiment=NPI-env=determiner_negation_monoclausal-npi=at all-crucial_item=none of the-licensor=1-scope=1-npi_present=1	1		none of the humans walk through the public parks at all .
experiment=NPI-env=determiner_negation_monoclausal-npi=at all-crucial_item=none of the-licensor=1-scope=1-npi_present=0	1		none of the humans walk through the public parks regularly .
experiment=NPI-env=determiner_negation_monoclausal-npi=at all-crucial_item=no-licensor=1-scope=0-npi_present=1	0		the humans walk through the public parks at all at none of the banks .
experiment=NPI-env=determiner_negation_monoclausal-npi=at all-crucial_item=no-licensor=1-scope=0-npi_present=0	1		the humans walk through the public parks regularly at none of the banks .
experiment=NPI-env=determiner_negation_monoclausal-npi=at all-crucial_item=some-licensor=0-scope=1-npi_present=1	0		some humans walk through the public parks at all .
experiment=NPI-env=determiner_negation_monoclausal-npi=at all-crucial_item=some-licensor=0-scope=1-npi_present=0	1		some humans walk through the public parks regularly .
experiment=NPI-env=determiner_negation_monoclausal-npi=at all-crucial_item=some-licensor=0-scope=0-npi_present=1	0		the humans walk through the public parks at all at some banks .
experiment=NPI-env=determiner_negation_monoclausal-npi=at all-crucial_item=some-licensor=0-scope=0-npi_present=0	1		the humans walk through the public parks regularly at some banks .
experiment=NPI-env=determiner_negation_monoclausal-npi=at all-crucial_item=no-licensor=1-scope=1-npi_present=1	1		no customer buys the books at all .
experiment=NPI-env=determiner_negation_monoclausal-npi=at all-crucial_item=no-licensor=1-scope=1-npi_present=0	1		no customer buys the books as well .
experiment=NPI-env=determiner_negation_monoclausal-npi=at all-crucial_item=no-licensor=1-scope=0-npi_present=1	0		the customer buys the books at all at no art galleries .
experiment=NPI-env=determiner_negation_monoclausal-npi=at all-crucial_item=no-licensor=1-scope=0-npi_present=0	1		the customer buys the books as well at no art galleries .
experiment=NPI-env=determiner_negation_monoclausal-npi=at all-crucial_item=some-licensor=0-scope=1-npi_present=1	0		some customer buys the books at all .
experiment=NPI-env=determiner_negation_monoclausal-npi=at all-crucial_item=some-licensor=0-scope=1-npi_present=0	1		some customer buys the books as well .
experiment=NPI-env=determiner_negation_monoclausal-npi=at all-crucial_item=some-licensor=0-scope=0-npi_present=1	0		the customer buys the books at all at some art galleries .
experiment=NPI-env=determiner_negation_monoclausal-npi=at all-crucial_item=some-licensor=0-scope=0-npi_present=0	1		the customer buys the books as well at some art galleries .
experiment=NPI-env=determiner_negation_monoclausal-npi=at all-crucial_item=no-licensor=1-scope=1-npi_present=1	1		no doctor scanned the newspaper articles at all .
experiment=NPI-env=determiner_negation_monoclausal-npi=at all-crucial_item=no-licensor=1-scope=1-npi_present=0	1		no doctor scanned the newspaper articles on occasion .
experiment=NPI-env=determiner_negation_monoclausal-npi=at all-crucial_item=no-licensor=1-scope=0-npi_present=1	0		a doctor scanned the newspaper articles at all at no art galleries .
experiment=NPI-env=determiner_negation_monoclausal-npi=at all-crucial_item=no-licensor=1-scope=0-npi_present=0	1		a doctor scanned the newspaper articles on occasion at no art galleries .
experiment=NPI-env=determiner_negation_monoclausal-npi=at all-crucial_item=some-licensor=0-scope=1-npi_present=1	0		some doctor scanned the newspaper articles at all .
experiment=NPI-env=determiner_negation_monoclausal-npi=at all-crucial_item=some-licensor=0-scope=1-npi_present=0	1		some doctor scanned the newspaper articles on occasion .
experiment=NPI-env=determiner_negation_monoclausal-npi=at all-crucial_item=some-licensor=0-scope=0-npi_present=1	0		a doctor scanned the newspaper articles at all at some art galleries .
experiment=NPI-env=determiner_negation_monoclausal-npi=at all-crucial_item=some-licensor=0-scope=0-npi_present=0	1		a doctor scanned the newspaper articles on occasion at some art galleries .
experiment=NPI-env=determiner_negation_monoclausal-npi=at all-crucial_item=no-licensor=1-scope=1-npi_present=1	1		no lady is admiring the gloves at all .
experiment=NPI-env=determiner_negation_monoclausal-npi=at all-crucial_item=no-licensor=1-scope=1-npi_present=0	1		no lady is admiring the gloves regularly .
experiment=NPI-env=determiner_negation_monoclausal-npi=at all-crucial_item=none of the-licensor=1-scope=0-npi_present=1	0		the lady is admiring the gloves at all at no public parks .
experiment=NPI-env=determiner_negation_monoclausal-npi=at all-crucial_item=none of the-licensor=1-scope=0-npi_present=0	1		the lady is admiring the gloves regularly at no public parks .
experiment=NPI-env=determiner_negation_monoclausal-npi=at all-crucial_item=some-licensor=0-scope=1-npi_present=1	0		some lady is admiring the gloves at all .
experiment=NPI-env=determiner_negation_monoclausal-npi=at all-crucial_item=some-licensor=0-scope=1-npi_present=0	1		some lady is admiring the gloves regularly .
experiment=NPI-env=determiner_negation_monoclausal-npi=at all-crucial_item=some-licensor=0-scope=0-npi_present=1	0		the lady is admiring the gloves at all at some public parks .
experiment=NPI-env=determiner_negation_monoclausal-npi=at all-crucial_item=some-licensor=0-scope=0-npi_present=0	1		the lady is admiring the gloves regularly at some public parks .
experiment=NPI-env=determiner_negation_monoclausal-npi=at all-crucial_item=no-licensor=1-scope=1-npi_present=1	1		no teacher would exit the museums at all .
experiment=NPI-env=determiner_negation_monoclausal-npi=at all-crucial_item=no-licensor=1-scope=1-npi_present=0	1		no teacher would exit the museums regularly .
experiment=NPI-env=determiner_negation_monoclausal-npi=at all-crucial_item=no-licensor=1-scope=0-npi_present=1	0		the teacher would exit the museums at all at no schools .
experiment=NPI-env=determiner_negation_monoclausal-npi=at all-crucial_item=no-licensor=1-scope=0-npi_present=0	1		the teacher would exit the museums regularly at no schools .
experiment=NPI-env=determiner_negation_monoclausal-npi=at all-crucial_item=some-licensor=0-scope=1-npi_present=1	0		some teacher would exit the museums at all .
experiment=NPI-env=determiner_negation_monoclausal-npi=at all-crucial_item=some-licensor=0-scope=1-npi_present=0	1		some teacher would exit the museums regularly .
experiment=NPI-env=determiner_negation_monoclausal-npi=at all-crucial_item=some-licensor=0-scope=0-npi_present=1	0		the teacher would exit the museums at all at some schools .
experiment=NPI-env=determiner_negation_monoclausal-npi=at all-crucial_item=some-licensor=0-scope=0-npi_present=0	1		the teacher would exit the museums regularly at some schools .
experiment=NPI-env=determiner_negation_monoclausal-npi=at all-crucial_item=none of the-licensor=1-scope=1-npi_present=1	1		none of the children sold the pants at all .
experiment=NPI-env=determiner_negation_monoclausal-npi=at all-crucial_item=none of the-licensor=1-scope=1-npi_present=0	1		none of the children sold the pants regularly .
experiment=NPI-env=determiner_negation_monoclausal-npi=at all-crucial_item=no-licensor=1-scope=0-npi_present=1	0		the children sold the pants at all at none of the movie theaters .
experiment=NPI-env=determiner_negation_monoclausal-npi=at all-crucial_item=no-licensor=1-scope=0-npi_present=0	1		the children sold the pants regularly at none of the movie theaters .
experiment=NPI-env=determiner_negation_monoclausal-npi=at all-crucial_item=some-licensor=0-scope=1-npi_present=1	0		some children sold the pants at all .
experiment=NPI-env=determiner_negation_monoclausal-npi=at all-crucial_item=some-licensor=0-scope=1-npi_present=0	1		some children sold the pants regularly .
experiment=NPI-env=determiner_negation_monoclausal-npi=at all-crucial_item=some-licensor=0-scope=0-npi_present=1	0		the children sold the pants at all at some movie theaters .
experiment=NPI-env=determiner_negation_monoclausal-npi=at all-crucial_item=some-licensor=0-scope=0-npi_present=0	1		the children sold the pants regularly at some movie theaters .
experiment=NPI-env=determiner_negation_monoclausal-npi=in years-crucial_item=none of the-licensor=1-scope=1-npi_present=1	1		none of the waitresses said the waitresses in years .
experiment=NPI-env=determiner_negation_monoclausal-npi=in years-crucial_item=none of the-licensor=1-scope=1-npi_present=0	1		none of the waitresses said the waitresses for a while .
experiment=NPI-env=determiner_negation_monoclausal-npi=in years-crucial_item=no-licensor=1-scope=0-npi_present=1	0		the waitresses said the waitresses in years at none of the cafes .
experiment=NPI-env=determiner_negation_monoclausal-npi=in years-crucial_item=no-licensor=1-scope=0-npi_present=0	1		the waitresses said the waitresses for a while at none of the cafes .
experiment=NPI-env=determiner_negation_monoclausal-npi=in years-crucial_item=some-licensor=0-scope=1-npi_present=1	0		some waitresses said the waitresses in years .
experiment=NPI-env=determiner_negation_monoclausal-npi=in years-crucial_item=some-licensor=0-scope=1-npi_present=0	1		some waitresses said the waitresses for a while .
experiment=NPI-env=determiner_negation_monoclausal-npi=in years-crucial_item=some-licensor=0-scope=0-npi_present=1	0		the waitresses said the waitresses in years at some cafes .
experiment=NPI-env=determiner_negation_monoclausal-npi=in years-crucial_item=some-licensor=0-scope=0-npi_present=0	1		the waitresses said the waitresses for a while at some cafes .
experiment=NPI-env=determiner_negation_monoclausal-npi=in years-crucial_item=no-licensor=1-scope=1-npi_present=1	1		no student explained the adults in years .
experiment=NPI-env=determiner_negation_monoclausal-npi=in years-crucial_item=no-licensor=1-scope=1-npi_present=0	1		no student explained the adults as well .
experiment=NPI-env=determiner_negation_monoclausal-npi=in years-crucial_item=none of the-licensor=1-scope=0-npi_present=1	0		the student explained the adults in years at no banks .
experiment=NPI-env=determiner_negation_monoclausal-npi=in years-crucial_item=none of the-licensor=1-scope=0-npi_present=0	1		the student explained the adults as well at no banks .
experiment=NPI-env=determiner_negation_monoclausal-npi=in years-crucial_item=some-licensor=0-scope=1-npi_present=1	0		some student explained the adults in years .
experiment=NPI-env=determiner_negation_monoclausal-npi=in years-crucial_item=some-licensor=0-scope=1-npi_present=0	1		some student explained the adults as well .
experiment=NPI-env=determiner_negation_monoclausal-npi=in years-crucial_item=some-licensor=0-scope=0-npi_present=1	0		the student explained the adults in years at some banks .
experiment=NPI-env=determiner_negation_monoclausal-npi=in years-crucial_item=some-licensor=0-scope=0-npi_present=0	1		the student explained the adults as well at some banks .
experiment=NPI-env=determiner_negation_monoclausal-npi=in years-crucial_item=no-licensor=1-scope=1-npi_present=1	1		no people imagined the books in years .
experiment=NPI-env=determiner_negation_monoclausal-npi=in years-crucial_item=no-licensor=1-scope=1-npi_present=0	1		no people imagined the books on weekends .
experiment=NPI-env=determiner_negation_monoclausal-npi=in years-crucial_item=no-licensor=1-scope=0-npi_present=1	0		the people imagined the books in years at no museums .
experiment=NPI-env=determiner_negation_monoclausal-npi=in years-crucial_item=no-licensor=1-scope=0-npi_present=0	1		the people imagined the books on weekends at no museums .
experiment=NPI-env=determiner_negation_monoclausal-npi=in years-crucial_item=some-licensor=0-scope=1-npi_present=1	0		some people imagined the books in years .
experiment=NPI-env=determiner_negation_monoclausal-npi=in years-crucial_item=some-licensor=0-scope=1-npi_present=0	1		some people imagined the books on weekends .
experiment=NPI-env=determiner_negation_monoclausal-npi=in years-crucial_item=some-licensor=0-scope=0-npi_present=1	0		the people imagined the books in years at some museums .
experiment=NPI-env=determiner_negation_monoclausal-npi=in years-crucial_item=some-licensor=0-scope=0-npi_present=0	1		the people imagined the books on weekends at some museums .
experiment=NPI-env=determiner_negation_monoclausal-npi=in years-crucial_item=none of the-licensor=1-scope=1-npi_present=1	1		none of the students said the commentaries in years .
experiment=NPI-env=determiner_negation_monoclausal-npi=in years-crucial_item=none of the-licensor=1-scope=1-npi_present=0	1		none of the students said the commentaries for a while .
experiment=NPI-env=determiner_negation_monoclausal-npi=in years-crucial_item=no-licensor=1-scope=0-npi_present=1	0		the students said the commentaries in years at none of the libraries .
experiment=NPI-env=determiner_negation_monoclausal-npi=in years-crucial_item=no-licensor=1-scope=0-npi_present=0	1		the students said the commentaries for a while at none of the libraries .
experiment=NPI-env=determiner_negation_monoclausal-npi=in years-crucial_item=some-licensor=0-scope=1-npi_present=1	0		some students said the commentaries in years .
experiment=NPI-env=determiner_negation_monoclausal-npi=in years-crucial_item=some-licensor=0-scope=1-npi_present=0	1		some students said the commentaries for a while .
experiment=NPI-env=determiner_negation_monoclausal-npi=in years-crucial_item=some-licensor=0-scope=0-npi_present=1	0		the students said the commentaries in years at some libraries .
experiment=NPI-env=determiner_negation_monoclausal-npi=in years-crucial_item=some-licensor=0-scope=0-npi_present=0	1		the students said the commentaries for a while at some libraries .
experiment=NPI-env=determiner_negation_monoclausal-npi=in years-crucial_item=no-licensor=1-scope=1-npi_present=1	1		no teenager thought the restaurants in years .
experiment=NPI-env=determiner_negation_monoclausal-npi=in years-crucial_item=no-licensor=1-scope=1-npi_present=0	1		no teenager thought the restaurants as well .
experiment=NPI-env=determiner_negation_monoclausal-npi=in years-crucial_item=no-licensor=1-scope=0-npi_present=1	0		the teenager thought the restaurants in years at no hospitals .
experiment=NPI-env=determiner_negation_monoclausal-npi=in years-crucial_item=no-licensor=1-scope=0-npi_present=0	1		the teenager thought the restaurants as well at no hospitals .
experiment=NPI-env=determiner_negation_monoclausal-npi=in years-crucial_item=some-licensor=0-scope=1-npi_present=1	0		some teenager thought the restaurants in years .
experiment=NPI-env=determiner_negation_monoclausal-npi=in years-crucial_item=some-licensor=0-scope=1-npi_present=0	1		some teenager thought the restaurants as well .
experiment=NPI-env=determiner_negation_monoclausal-npi=in years-crucial_item=some-licensor=0-scope=0-npi_present=1	0		the teenager thought the restaurants in years at some hospitals .
experiment=NPI-env=determiner_negation_monoclausal-npi=in years-crucial_item=some-licensor=0-scope=0-npi_present=0	1		the teenager thought the restaurants as well at some hospitals .
experiment=NPI-env=determiner_negation_monoclausal-npi=in years-crucial_item=no-licensor=1-scope=1-npi_present=1	1		no driver said the libraries in years .
experiment=NPI-env=determiner_negation_monoclausal-npi=in years-crucial_item=no-licensor=1-scope=1-npi_present=0	1		no driver said the libraries regularly .
experiment=NPI-env=determiner_negation_monoclausal-npi=in years-crucial_item=none of the-licensor=1-scope=0-npi_present=1	0		a driver said the libraries in years at no schools .
experiment=NPI-env=determiner_negation_monoclausal-npi=in years-crucial_item=none of the-licensor=1-scope=0-npi_present=0	1		a driver said the libraries regularly at no schools .
experiment=NPI-env=determiner_negation_monoclausal-npi=in years-crucial_item=some-licensor=0-scope=1-npi_present=1	0		some driver said the libraries in years .
experiment=NPI-env=determiner_negation_monoclausal-npi=in years-crucial_item=some-licensor=0-scope=1-npi_present=0	1		some driver said the libraries regularly .
experiment=NPI-env=determiner_negation_monoclausal-npi=in years-crucial_item=some-licensor=0-scope=0-npi_present=1	0		a driver said the libraries in years at some schools .
experiment=NPI-env=determiner_negation_monoclausal-npi=in years-crucial_item=some-licensor=0-scope=0-npi_present=0	1		a driver said the libraries regularly at some schools .
experiment=NPI-env=determiner_negation_monoclausal-npi=in years-crucial_item=none of the-licensor=1-scope=1-npi_present=1	1		none of the doctors thought the cafes in years .
experiment=NPI-env=determiner_negation_monoclausal-npi=in years-crucial_item=none of the-licensor=1-scope=1-npi_present=0	1		none of the doctors thought the cafes on weekends .
experiment=NPI-env=determiner_negation_monoclausal-npi=in years-crucial_item=no-licensor=1-scope=0-npi_present=1	0		the doctors thought the cafes in years at none of the public parks .
experiment=NPI-env=determiner_negation_monoclausal-npi=in years-crucial_item=no-licensor=1-scope=0-npi_present=0	1		the doctors thought the cafes on weekends at none of the public parks .
experiment=NPI-env=determiner_negation_monoclausal-npi=in years-crucial_item=some-licensor=0-scope=1-npi_present=1	0		some doctors thought the cafes in years .
experiment=NPI-env=determiner_negation_monoclausal-npi=in years-crucial_item=some-licensor=0-scope=1-npi_present=0	1		some doctors thought the cafes on weekends .
experiment=NPI-env=determiner_negation_monoclausal-npi=in years-crucial_item=some-licensor=0-scope=0-npi_present=1	0		the doctors thought the cafes in years at some public parks .
experiment=NPI-env=determiner_negation_monoclausal-npi=in years-crucial_item=some-licensor=0-scope=0-npi_present=0	1		the doctors thought the cafes on weekends at some public parks .
experiment=NPI-env=determiner_negation_monoclausal-npi=in years-crucial_item=no-licensor=1-scope=1-npi_present=1	1		no guys said the hospitals in years .
experiment=NPI-env=determiner_negation_monoclausal-npi=in years-crucial_item=no-licensor=1-scope=1-npi_present=0	1		no guys said the hospitals for a while .
experiment=NPI-env=determiner_negation_monoclausal-npi=in years-crucial_item=none of the-licensor=1-scope=0-npi_present=1	0		the guys said the hospitals in years at no libraries .
experiment=NPI-env=determiner_negation_monoclausal-npi=in years-crucial_item=none of the-licensor=1-scope=0-npi_present=0	1		the guys said the hospitals for a while at no libraries .
experiment=NPI-env=determiner_negation_monoclausal-npi=in years-crucial_item=some-licensor=0-scope=1-npi_present=1	0		some guys said the hospitals in years .
experiment=NPI-env=determiner_negation_monoclausal-npi=in years-crucial_item=some-licensor=0-scope=1-npi_present=0	1		some guys said the hospitals for a while .
experiment=NPI-env=determiner_negation_monoclausal-npi=in years-crucial_item=some-licensor=0-scope=0-npi_present=1	0		the guys said the hospitals in years at some libraries .
experiment=NPI-env=determiner_negation_monoclausal-npi=in years-crucial_item=some-licensor=0-scope=0-npi_present=0	1		the guys said the hospitals for a while at some libraries .
experiment=NPI-env=determiner_negation_monoclausal-npi=in years-crucial_item=no-licensor=1-scope=1-npi_present=1	1		no actress has thought the hospitals in years .
experiment=NPI-env=determiner_negation_monoclausal-npi=in years-crucial_item=no-licensor=1-scope=1-npi_present=0	1		no actress has thought the hospitals as well .
experiment=NPI-env=determiner_negation_monoclausal-npi=in years-crucial_item=none of the-licensor=1-scope=0-npi_present=1	0		an actress has thought the hospitals in years at no libraries .
experiment=NPI-env=determiner_negation_monoclausal-npi=in years-crucial_item=none of the-licensor=1-scope=0-npi_present=0	1		an actress has thought the hospitals as well at no libraries .
experiment=NPI-env=determiner_negation_monoclausal-npi=in years-crucial_item=some-licensor=0-scope=1-npi_present=1	0		some actress has thought the hospitals in years .
experiment=NPI-env=determiner_negation_monoclausal-npi=in years-crucial_item=some-licensor=0-scope=1-npi_present=0	1		some actress has thought the hospitals as well .
experiment=NPI-env=determiner_negation_monoclausal-npi=in years-crucial_item=some-licensor=0-scope=0-npi_present=1	0		an actress has thought the hospitals in years at some libraries .
experiment=NPI-env=determiner_negation_monoclausal-npi=in years-crucial_item=some-licensor=0-scope=0-npi_present=0	1		an actress has thought the hospitals as well at some libraries .
