experiment=NPI-env=determiner_negation_monoclausal-npi=any-crucial_item=some-licensor=0-scope=1-npi_present=0	1		some teenagers were arriving at the books .
experiment=NPI-env=determiner_negation_monoclausal-npi=any-crucial_item=some-licensor=0-scope=0-npi_present=1	0		any teenagers were arriving at some books .
experiment=NPI-env=determiner_negation_monoclausal-npi=any-crucial_item=some-licensor=0-scope=0-npi_present=0	1		the teenagers were arriving at some books .
experiment=NPI-env=determiner_negation_monoclausal-npi=any-crucial_item=no-licensor=1-scope=1-npi_present=1	1		no cashiers were insulting any chairs .
experiment=NPI-env=determiner_negation_monoclausal-npi=any-crucial_item=no-licensor=1-scope=1-npi_present=0	1		no cashiers were insulting those chairs .
experiment=NPI-env=determiner_negation_monoclausal-npi=any-crucial_item=no-licensor=1-scope=0-npi_present=1	0		any cashiers were insulting no chairs .
experiment=NPI-env=determiner_negation_monoclausal-npi=any-crucial_item=no-licensor=1-scope=0-npi_present=0	1		those cashiers were insulting no chairs .
experiment=NPI-env=determiner_negation_monoclausal-npi=any-crucial_item=some-licensor=0-scope=1-npi_present=1	0		some cashiers were insulting any chairs .
experiment=NPI-env=determiner_negation_monoclausal-npi=any-crucial_item=some-licensor=0-scope=1-npi_present=0	1		some cashiers were insulting those chairs .
experiment=NPI-env=determiner_negation_monoclausal-npi=any-crucial_item=some-licensor=0-scope=0-npi_present=1	0		any cashiers were insulting some chairs .
experiment=NPI-env=determiner_negation_monoclausal-npi=any-crucial_item=some-licensor=0-scope=0-npi_present=0	1		those cashiers were insulting some chairs .
