experiment=NPI-env=determiner_negation_biclausal-npi=ever-crucial_item=no-licensor=1-scope=1-npi_present=1	1		no adults had ever imagined that the pedestrians did help the women .
experiment=NPI-env=determiner_negation_biclausal-npi=ever-crucial_item=no-licensor=1-scope=1-npi_present=0	1		no adults had certainly imagined that the pedestrians did help the women .
experiment=NPI-env=determiner_negation_biclausal-npi=ever-crucial_item=no-licensor=1-scope=0-npi_present=1	0		the adults had ever imagined that no pedestrians did help the women .
experiment=NPI-env=determiner_negation_biclausal-npi=ever-crucial_item=no-licensor=1-scope=0-npi_present=0	1		the adults had certainly imagined that no pedestrians did help the women .
experiment=NPI-env=determiner_negation_biclausal-npi=ever-crucial_item=some-licensor=0-scope=1-npi_present=1	0		Some adults had ever imagined that the pedestrians did help the women .
experiment=NPI-env=determiner_negation_biclausal-npi=ever-crucial_item=some-licensor=0-scope=1-npi_present=0	1		Some adults had certainly imagined that the pedestrians did help the women .
experiment=NPI-env=determiner_negation_biclausal-npi=ever-crucial_item=some-licensor=0-scope=0-npi_present=1	0		the adults had ever imagined that some pedestrians did help the women .
experiment=NPI-env=determiner_negation_biclausal-npi=ever-crucial_item=some-licensor=0-scope=0-npi_present=0	1		the adults had certainly imagined that some pedestrians did help the women .
experiment=NPI-env=determiner_negation_biclausal-npi=ever-crucial_item=no-licensor=1-scope=1-npi_present=1	1		no drivers should ever think that the women clean the newspaper article .
experiment=NPI-env=determiner_negation_biclausal-npi=ever-crucial_item=no-licensor=1-scope=1-npi_present=0	1		no drivers should often think that the women clean the newspaper article .
experiment=NPI-env=determiner_negation_biclausal-npi=ever-crucial_item=no-licensor=1-scope=0-npi_present=1	0		the drivers should ever think that no women clean the newspaper article .
experiment=NPI-env=determiner_negation_biclausal-npi=ever-crucial_item=no-licensor=1-scope=0-npi_present=0	1		the drivers should often think that no women clean the newspaper article .
experiment=NPI-env=determiner_negation_biclausal-npi=ever-crucial_item=some-licensor=0-scope=1-npi_present=1	0		Some drivers should ever think that the women clean the newspaper article .
experiment=NPI-env=determiner_negation_biclausal-npi=ever-crucial_item=some-licensor=0-scope=1-npi_present=0	1		Some drivers should often think that the women clean the newspaper article .
experiment=NPI-env=determiner_negation_biclausal-npi=ever-crucial_item=some-licensor=0-scope=0-npi_present=1	0		the drivers should ever think that some women clean the newspaper article .
experiment=NPI-env=determiner_negation_biclausal-npi=ever-crucial_item=some-licensor=0-scope=0-npi_present=0	1		the drivers should often think that some women clean the newspaper article .
experiment=NPI-env=determiner_negation_biclausal-npi=ever-crucial_item=no-licensor=1-scope=1-npi_present=1	1		no person had ever said that the doctor should joke around .
experiment=NPI-env=determiner_negation_biclausal-npi=ever-crucial_item=no-licensor=1-scope=1-npi_present=0	1		no person had certainly said that the doctor should joke around .
experiment=NPI-env=determiner_negation_biclausal-npi=ever-crucial_item=no-licensor=1-scope=0-npi_present=1	0		a person had ever said that no doctor should joke around .
experiment=NPI-env=determiner_negation_biclausal-npi=ever-crucial_item=no-licensor=1-scope=0-npi_present=0	1		a person had certainly said that no doctor should joke around .
experiment=NPI-env=determiner_negation_biclausal-npi=ever-crucial_item=some-licensor=0-scope=1-npi_present=1	0		Some person had ever said that the doctor should joke around .
experiment=NPI-env=determiner_negation_biclausal-npi=ever-crucial_item=some-licensor=0-scope=1-npi_present=0	1		Some person had certainly said that the doctor should joke around .
experiment=NPI-env=determiner_negation_biclausal-npi=ever-crucial_item=some-licensor=0-scope=0-npi_present=1	0		a person had ever said that some doctor should joke around .
experiment=NPI-env=determiner_negation_biclausal-npi=ever-crucial_item=some-licensor=0-scope=0-npi_present=0	1		a person had certainly said that some doctor should joke around .
experiment=NPI-env=determiner_negation_biclausal-npi=ever-crucial_item=no-licensor=1-scope=1-npi_present=1	1		no waitress could ever explain that the customers were bringing the cup .
experiment=NPI-env=determiner_negation_biclausal-npi=ever-crucial_item=no-licensor=1-scope=1-npi_present=0	1		no waitress could often explain that the customers were bringing the cup .
experiment=NPI-env=determiner_negation_biclausal-npi=ever-crucial_item=no-licensor=1-scope=0-npi_present=1	0		a waitress could ever explain that no customers were bringing the cup .
experiment=NPI-env=determiner_negation_biclausal-npi=ever-crucial_item=no-licensor=1-scope=0-npi_present=0	1		a waitress could often explain that no customers were bringing the cup .
experiment=NPI-env=determiner_negation_biclausal-npi=ever-crucial_item=some-licensor=0-scope=1-npi_present=1	0		Some waitress could ever explain that the customers were bringing the cup .
experiment=NPI-env=determiner_negation_biclausal-npi=ever-crucial_item=some-licensor=0-scope=1-npi_present=0	1		Some waitress could often explain that the customers were bringing the cup .
experiment=NPI-env=determiner_negation_biclausal-npi=ever-crucial_item=some-licensor=0-scope=0-npi_present=1	0		a waitress could ever explain that some customers were bringing the cup .
experiment=NPI-env=determiner_negation_biclausal-npi=ever-crucial_item=some-licensor=0-scope=0-npi_present=0	1		a waitress could often explain that some customers were bringing the cup .
experiment=NPI-env=determiner_negation_biclausal-npi=ever-crucial_item=no-licensor=1-scope=1-npi_present=1	1		no gals ever do say that a lady reacts .
experiment=NPI-env=determiner_negation_biclausal-npi=ever-crucial_item=no-licensor=1-scope=1-npi_present=0	1		no gals certainly do say that a lady reacts .
experiment=NPI-env=determiner_negation_biclausal-npi=ever-crucial_item=no-licensor=1-scope=0-npi_present=1	0		the gals ever do say that no lady reacts .
experiment=NPI-env=determiner_negation_biclausal-npi=ever-crucial_item=no-licensor=1-scope=0-npi_present=0	1		the gals certainly do say that no lady reacts .
experiment=NPI-env=determiner_negation_biclausal-npi=ever-crucial_item=some-licensor=0-scope=1-npi_present=1	0		Some gals ever do say that a lady reacts .
experiment=NPI-env=determiner_negation_biclausal-npi=ever-crucial_item=some-licensor=0-scope=1-npi_present=0	1		Some gals certainly do say that a lady reacts .
experiment=NPI-env=determiner_negation_biclausal-npi=ever-crucial_item=some-licensor=0-scope=0-npi_present=1	0		the gals ever do say that some lady reacts .
experiment=NPI-env=determiner_negation_biclausal-npi=ever-crucial_item=some-licensor=0-scope=0-npi_present=0	1		the gals certainly do say that some lady reacts .
experiment=NPI-env=determiner_negation_biclausal-npi=ever-crucial_item=no-licensor=1-scope=1-npi_present=1	1		no women can ever think that the gals baked .
experiment=NPI-env=determiner_negation_biclausal-npi=ever-crucial_item=no-licensor=1-scope=1-npi_present=0	1		no women can also think that the gals baked .
experiment=NPI-env=determiner_negation_biclausal-npi=ever-crucial_item=no-licensor=1-scope=0-npi_present=1	0		the women can ever think that no gals baked .
experiment=NPI-env=determiner_negation_biclausal-npi=ever-crucial_item=no-licensor=1-scope=0-npi_present=0	1		the women can also think that no gals baked .
experiment=NPI-env=determiner_negation_biclausal-npi=ever-crucial_item=some-licensor=0-scope=1-npi_present=1	0		Some women can ever think that the gals baked .
experiment=NPI-env=determiner_negation_biclausal-npi=ever-crucial_item=some-licensor=0-scope=1-npi_present=0	1		Some women can also think that the gals baked .
experiment=NPI-env=determiner_negation_biclausal-npi=ever-crucial_item=some-licensor=0-scope=0-npi_present=1	0		the women can ever think that some gals baked .
experiment=NPI-env=determiner_negation_biclausal-npi=ever-crucial_item=some-licensor=0-scope=0-npi_present=0	1		the women can also think that some gals baked .
experiment=NPI-env=determiner_negation_biclausal-npi=ever-crucial_item=no-licensor=1-scope=1-npi_present=1	1		no actress will ever say that the girls whisper .
experiment=NPI-env=determiner_negation_biclausal-npi=ever-crucial_item=no-licensor=1-scope=1-npi_present=0	1		no actress will clearly say that the girls whisper .
experiment=NPI-env=determiner_negation_biclausal-npi=ever-crucial_item=no-licensor=1-scope=0-npi_present=1	0		the actress will ever say that no girls whisper .
experiment=NPI-env=determiner_negation_biclausal-npi=ever-crucial_item=no-licensor=1-scope=0-npi_present=0	1		the actress will clearly say that no girls whisper .
experiment=NPI-env=determiner_negation_biclausal-npi=ever-crucial_item=some-licensor=0-scope=1-npi_present=1	0		Some actress will ever say that the girls whisper .
experiment=NPI-env=determiner_negation_biclausal-npi=ever-crucial_item=some-licensor=0-scope=1-npi_present=0	1		Some actress will clearly say that the girls whisper .
experiment=NPI-env=determiner_negation_biclausal-npi=ever-crucial_item=some-licensor=0-scope=0-npi_present=1	0		the actress will ever say that some girls whisper .
experiment=NPI-env=determiner_negation_biclausal-npi=ever-crucial_item=some-licensor=0-scope=0-npi_present=0	1		the actress will clearly say that some girls whisper .
experiment=NPI-env=determiner_negation_biclausal-npi=ever-crucial_item=no-licensor=1-scope=1-npi_present=1	1		no guys will ever imagine that the person is describing the drivers .
experiment=NPI-env=determiner_negation_biclausal-npi=ever-crucial_item=no-licensor=1-scope=1-npi_present=0	1		no guys will certainly imagine that the person is describing the drivers .
experiment=NPI-env=determiner_negation_biclausal-npi=ever-crucial_item=no-licensor=1-scope=0-npi_present=1	0		the guys will ever imagine that no person is describing the drivers .
experiment=NPI-env=determiner_negation_biclausal-npi=ever-crucial_item=no-licensor=1-scope=0-npi_present=0	1		the guys will certainly imagine that no person is describing the drivers .
experiment=NPI-env=determiner_negation_biclausal-npi=ever-crucial_item=some-licensor=0-scope=1-npi_present=1	0		Some guys will ever imagine that the person is describing the drivers .
experiment=NPI-env=determiner_negation_biclausal-npi=ever-crucial_item=some-licensor=0-scope=1-npi_present=0	1		Some guys will certainly imagine that the person is describing the drivers .
experiment=NPI-env=determiner_negation_biclausal-npi=ever-crucial_item=some-licensor=0-scope=0-npi_present=1	0		the guys will ever imagine that some person is describing the drivers .
experiment=NPI-env=determiner_negation_biclausal-npi=ever-crucial_item=some-licensor=0-scope=0-npi_present=0	1		the guys will certainly imagine that some person is describing the drivers .
experiment=NPI-env=determiner_negation_biclausal-npi=ever-crucial_item=no-licensor=1-scope=1-npi_present=1	1		no gals should ever imagine that a woman likes the man .
experiment=NPI-env=determiner_negation_biclausal-npi=ever-crucial_item=no-licensor=1-scope=1-npi_present=0	1		no gals should certainly imagine that a woman likes the man .
experiment=NPI-env=determiner_negation_biclausal-npi=ever-crucial_item=no-licensor=1-scope=0-npi_present=1	0		the gals should ever imagine that no woman likes the man .
experiment=NPI-env=determiner_negation_biclausal-npi=ever-crucial_item=no-licensor=1-scope=0-npi_present=0	1		the gals should certainly imagine that no woman likes the man .
experiment=NPI-env=determiner_negation_biclausal-npi=ever-crucial_item=some-licensor=0-scope=1-npi_present=1	0		Some gals should ever imagine that a woman likes the man .
experiment=NPI-env=determiner_negation_biclausal-npi=ever-crucial_item=some-licensor=0-scope=1-npi_present=0	1		Some gals should certainly imagine that a woman likes the man .
experiment=NPI-env=determiner_negation_biclausal-npi=ever-crucial_item=some-licensor=0-scope=0-npi_present=1	0		the gals should ever imagine that some woman likes the man .
experiment=NPI-env=determiner_negation_biclausal-npi=ever-crucial_item=some-licensor=0-scope=0-npi_present=0	1		the gals should certainly imagine that some woman likes the man .
experiment=NPI-env=determiner_negation_biclausal-npi=ever-crucial_item=no-licensor=1-scope=1-npi_present=1	1		no gals ever do imagine that the guest had grinned .
experiment=NPI-env=determiner_negation_biclausal-npi=ever-crucial_item=no-licensor=1-scope=1-npi_present=0	1		no gals clearly do imagine that the guest had grinned .
experiment=NPI-env=determiner_negation_biclausal-npi=ever-crucial_item=no-licensor=1-scope=0-npi_present=1	0		the gals ever do imagine that no guest had grinned .
experiment=NPI-env=determiner_negation_biclausal-npi=ever-crucial_item=no-licensor=1-scope=0-npi_present=0	1		the gals clearly do imagine that no guest had grinned .
experiment=NPI-env=determiner_negation_biclausal-npi=ever-crucial_item=some-licensor=0-scope=1-npi_present=1	0		Some gals ever do imagine that the guest had grinned .
experiment=NPI-env=determiner_negation_biclausal-npi=ever-crucial_item=some-licensor=0-scope=1-npi_present=0	1		Some gals clearly do imagine that the guest had grinned .
experiment=NPI-env=determiner_negation_biclausal-npi=ever-crucial_item=some-licensor=0-scope=0-npi_present=1	0		the gals ever do imagine that some guest had grinned .
experiment=NPI-env=determiner_negation_biclausal-npi=ever-crucial_item=some-licensor=0-scope=0-npi_present=0	1		the gals clearly do imagine that some guest had grinned .
experiment=NPI-env=determiner_negation_biclausal-npi=ever-crucial_item=no-licensor=1-scope=1-npi_present=1	1		no actresses had ever explained that a guest might talk to the man .
experiment=NPI-env=determiner_negation_biclausal-npi=ever-crucial_item=no-licensor=1-scope=1-npi_present=0	1		no actresses had also explained that a guest might talk to the man .
experiment=NPI-env=determiner_negation_biclausal-npi=ever-crucial_item=no-licensor=1-scope=0-npi_present=1	0		the actresses had ever explained that no guest might talk to the man .
experiment=NPI-env=determiner_negation_biclausal-npi=ever-crucial_item=no-licensor=1-scope=0-npi_present=0	1		the actresses had also explained that no guest might talk to the man .
experiment=NPI-env=determiner_negation_biclausal-npi=ever-crucial_item=some-licensor=0-scope=1-npi_present=1	0		Some actresses had ever explained that a guest might talk to the man .
experiment=NPI-env=determiner_negation_biclausal-npi=ever-crucial_item=some-licensor=0-scope=1-npi_present=0	1		Some actresses had also explained that a guest might talk to the man .
experiment=NPI-env=determiner_negation_biclausal-npi=ever-crucial_item=some-licensor=0-scope=0-npi_present=1	0		the actresses had ever explained that some guest might talk to the man .
experiment=NPI-env=determiner_negation_biclausal-npi=ever-crucial_item=some-licensor=0-scope=0-npi_present=0	1		the actresses had also explained that some guest might talk to the man .
experiment=NPI-env=determiner_negation_biclausal-npi=ever-crucial_item=no-licensor=1-scope=1-npi_present=1	1		no person was ever saying that a gal tours the movie theater .
experiment=NPI-env=determiner_negation_biclausal-npi=ever-crucial_item=no-licensor=1-scope=1-npi_present=0	1		no person was often saying that a gal tours the movie theater .
experiment=NPI-env=determiner_negation_biclausal-npi=ever-crucial_item=no-licensor=1-scope=0-npi_present=1	0		a person was ever saying that no gal tours the movie theater .
experiment=NPI-env=determiner_negation_biclausal-npi=ever-crucial_item=no-licensor=1-scope=0-npi_present=0	1		a person was often saying that no gal tours the movie theater .
experiment=NPI-env=determiner_negation_biclausal-npi=ever-crucial_item=some-licensor=0-scope=1-npi_present=1	0		Some person was ever saying that a gal tours the movie theater .
experiment=NPI-env=determiner_negation_biclausal-npi=ever-crucial_item=some-licensor=0-scope=1-npi_present=0	1		Some person was often saying that a gal tours the movie theater .
experiment=NPI-env=determiner_negation_biclausal-npi=ever-crucial_item=some-licensor=0-scope=0-npi_present=1	0		a person was ever saying that some gal tours the movie theater .
experiment=NPI-env=determiner_negation_biclausal-npi=ever-crucial_item=some-licensor=0-scope=0-npi_present=0	1		a person was often saying that some gal tours the movie theater .
experiment=NPI-env=determiner_negation_biclausal-npi=ever-crucial_item=no-licensor=1-scope=1-npi_present=1	1		no adult was ever saying that the actresses are profiting .
experiment=NPI-env=determiner_negation_biclausal-npi=ever-crucial_item=no-licensor=1-scope=1-npi_present=0	1		no adult was also saying that the actresses are profiting .
experiment=NPI-env=determiner_negation_biclausal-npi=ever-crucial_item=no-licensor=1-scope=0-npi_present=1	0		the adult was ever saying that no actresses are profiting .
experiment=NPI-env=determiner_negation_biclausal-npi=ever-crucial_item=no-licensor=1-scope=0-npi_present=0	1		the adult was also saying that no actresses are profiting .
experiment=NPI-env=determiner_negation_biclausal-npi=ever-crucial_item=some-licensor=0-scope=1-npi_present=1	0		Some adult was ever saying that the actresses are profiting .
experiment=NPI-env=determiner_negation_biclausal-npi=ever-crucial_item=some-licensor=0-scope=1-npi_present=0	1		Some adult was also saying that the actresses are profiting .
experiment=NPI-env=determiner_negation_biclausal-npi=ever-crucial_item=some-licensor=0-scope=0-npi_present=1	0		the adult was ever saying that some actresses are profiting .
experiment=NPI-env=determiner_negation_biclausal-npi=ever-crucial_item=some-licensor=0-scope=0-npi_present=0	1		the adult was also saying that some actresses are profiting .
experiment=NPI-env=determiner_negation_biclausal-npi=ever-crucial_item=no-licensor=1-scope=1-npi_present=1	1		no waitress was ever explaining that the actors do reference an actress .
experiment=NPI-env=determiner_negation_biclausal-npi=ever-crucial_item=no-licensor=1-scope=1-npi_present=0	1		no waitress was often explaining that the actors do reference an actress .
experiment=NPI-env=determiner_negation_biclausal-npi=ever-crucial_item=no-licensor=1-scope=0-npi_present=1	0		the waitress was ever explaining that no actors do reference an actress .
experiment=NPI-env=determiner_negation_biclausal-npi=ever-crucial_item=no-licensor=1-scope=0-npi_present=0	1		the waitress was often explaining that no actors do reference an actress .
experiment=NPI-env=determiner_negation_biclausal-npi=ever-crucial_item=some-licensor=0-scope=1-npi_present=1	0		Some waitress was ever explaining that the actors do reference an actress .
experiment=NPI-env=determiner_negation_biclausal-npi=ever-crucial_item=some-licensor=0-scope=1-npi_present=0	1		Some waitress was often explaining that the actors do reference an actress .
experiment=NPI-env=determiner_negation_biclausal-npi=ever-crucial_item=some-licensor=0-scope=0-npi_present=1	0		the waitress was ever explaining that some actors do reference an actress .
experiment=NPI-env=determiner_negation_biclausal-npi=ever-crucial_item=some-licensor=0-scope=0-npi_present=0	1		the waitress was often explaining that some actors do reference an actress .
experiment=NPI-env=determiner_negation_biclausal-npi=ever-crucial_item=no-licensor=1-scope=1-npi_present=1	1		no child had ever explained that the children are speaking up .
experiment=NPI-env=determiner_negation_biclausal-npi=ever-crucial_item=no-licensor=1-scope=1-npi_present=0	1		no child had clearly explained that the children are speaking up .
experiment=NPI-env=determiner_negation_biclausal-npi=ever-crucial_item=no-licensor=1-scope=0-npi_present=1	0		a child had ever explained that no children are speaking up .
experiment=NPI-env=determiner_negation_biclausal-npi=ever-crucial_item=no-licensor=1-scope=0-npi_present=0	1		a child had clearly explained that no children are speaking up .
experiment=NPI-env=determiner_negation_biclausal-npi=ever-crucial_item=some-licensor=0-scope=1-npi_present=1	0		Some child had ever explained that the children are speaking up .
experiment=NPI-env=determiner_negation_biclausal-npi=ever-crucial_item=some-licensor=0-scope=1-npi_present=0	1		Some child had clearly explained that the children are speaking up .
experiment=NPI-env=determiner_negation_biclausal-npi=ever-crucial_item=some-licensor=0-scope=0-npi_present=1	0		a child had ever explained that some children are speaking up .
experiment=NPI-env=determiner_negation_biclausal-npi=ever-crucial_item=some-licensor=0-scope=0-npi_present=0	1		a child had clearly explained that some children are speaking up .
experiment=NPI-env=determiner_negation_biclausal-npi=ever-crucial_item=no-licensor=1-scope=1-npi_present=1	1		no actor will ever imagine that a girl is responding .
experiment=NPI-env=determiner_negation_biclausal-npi=ever-crucial_item=no-licensor=1-scope=1-npi_present=0	1		no actor will also imagine that a girl is responding .
experiment=NPI-env=determiner_negation_biclausal-npi=ever-crucial_item=no-licensor=1-scope=0-npi_present=1	0		the actor will ever imagine that no girl is responding .
experiment=NPI-env=determiner_negation_biclausal-npi=ever-crucial_item=no-licensor=1-scope=0-npi_present=0	1		the actor will also imagine that no girl is responding .
experiment=NPI-env=determiner_negation_biclausal-npi=ever-crucial_item=some-licensor=0-scope=1-npi_present=1	0		Some actor will ever imagine that a girl is responding .
experiment=NPI-env=determiner_negation_biclausal-npi=ever-crucial_item=some-licensor=0-scope=1-npi_present=0	1		Some actor will also imagine that a girl is responding .
experiment=NPI-env=determiner_negation_biclausal-npi=ever-crucial_item=some-licensor=0-scope=0-npi_present=1	0		the actor will ever imagine that some girl is responding .
experiment=NPI-env=determiner_negation_biclausal-npi=ever-crucial_item=some-licensor=0-scope=0-npi_present=0	1		the actor will also imagine that some girl is responding .
experiment=NPI-env=determiner_negation_biclausal-npi=ever-crucial_item=no-licensor=1-scope=1-npi_present=1	1		no actress could ever imagine that the guests were discussing the lady .
experiment=NPI-env=determiner_negation_biclausal-npi=ever-crucial_item=no-licensor=1-scope=1-npi_present=0	1		no actress could clearly imagine that the guests were discussing the lady .
experiment=NPI-env=determiner_negation_biclausal-npi=ever-crucial_item=no-licensor=1-scope=0-npi_present=1	0		the actress could ever imagine that no guests were discussing the lady .
experiment=NPI-env=determiner_negation_biclausal-npi=ever-crucial_item=no-licensor=1-scope=0-npi_present=0	1		the actress could clearly imagine that no guests were discussing the lady .
experiment=NPI-env=determiner_negation_biclausal-npi=ever-crucial_item=some-licensor=0-scope=1-npi_present=1	0		Some actress could ever imagine that the guests were discussing the lady .
experiment=NPI-env=determiner_negation_biclausal-npi=ever-crucial_item=some-licensor=0-scope=1-npi_present=0	1		Some actress could clearly imagine that the guests were discussing the lady .
experiment=NPI-env=determiner_negation_biclausal-npi=ever-crucial_item=some-licensor=0-scope=0-npi_present=1	0		the actress could ever imagine that some guests were discussing the lady .
experiment=NPI-env=determiner_negation_biclausal-npi=ever-crucial_item=some-licensor=0-scope=0-npi_present=0	1		the actress could clearly imagine that some guests were discussing the lady .
experiment=NPI-env=determiner_negation_biclausal-npi=ever-crucial_item=no-licensor=1-scope=1-npi_present=1	1		no adults could ever explain that the teenagers will describe the waitresses .
experiment=NPI-env=determiner_negation_biclausal-npi=ever-crucial_item=no-licensor=1-scope=1-npi_present=0	1		no adults could really explain that the teenagers will describe the waitresses .
experiment=NPI-env=determiner_negation_biclausal-npi=ever-crucial_item=no-licensor=1-scope=0-npi_present=1	0		the adults could ever explain that no teenagers will describe the waitresses .
experiment=NPI-env=determiner_negation_biclausal-npi=ever-crucial_item=no-licensor=1-scope=0-npi_present=0	1		the adults could really explain that no teenagers will describe the waitresses .
experiment=NPI-env=determiner_negation_biclausal-npi=ever-crucial_item=some-licensor=0-scope=1-npi_present=1	0		Some adults could ever explain that the teenagers will describe the waitresses .
experiment=NPI-env=determiner_negation_biclausal-npi=ever-crucial_item=some-licensor=0-scope=1-npi_present=0	1		Some adults could really explain that the teenagers will describe the waitresses .
experiment=NPI-env=determiner_negation_biclausal-npi=ever-crucial_item=some-licensor=0-scope=0-npi_present=1	0		the adults could ever explain that some teenagers will describe the waitresses .
experiment=NPI-env=determiner_negation_biclausal-npi=ever-crucial_item=some-licensor=0-scope=0-npi_present=0	1		the adults could really explain that some teenagers will describe the waitresses .
experiment=NPI-env=determiner_negation_biclausal-npi=ever-crucial_item=no-licensor=1-scope=1-npi_present=1	1		no teenager has ever imagined that the lady talked .
experiment=NPI-env=determiner_negation_biclausal-npi=ever-crucial_item=no-licensor=1-scope=1-npi_present=0	1		no teenager has certainly imagined that the lady talked .
experiment=NPI-env=determiner_negation_biclausal-npi=ever-crucial_item=no-licensor=1-scope=0-npi_present=1	0		the teenager has ever imagined that no lady talked .
