experiment=NPI_env=quantifier_npi=any_licensor=0_scope=1_npi-present=0	1		some person who saw the cups will admire the chairs .
experiment=NPI_env=quantifier_npi=any_licensor=0_scope=0_npi-present=1	0		some person who saw some cups will admire any chairs .
experiment=NPI_env=quantifier_npi=any_licensor=0_scope=0_npi-present=0	1		some person who saw some cups will admire the chairs .
experiment=NPI_env=quantifier_npi=any_licensor=1_scope=1_npi-present=1	1		every student who cleans any shoes had many couches .
experiment=NPI_env=quantifier_npi=any_licensor=1_scope=1_npi-present=0	1		every student who cleans the shoes had many couches .
experiment=NPI_env=quantifier_npi=any_licensor=1_scope=0_npi-present=1	0		every student who cleans the shoes had any couches .
experiment=NPI_env=quantifier_npi=any_licensor=1_scope=0_npi-present=0	1		every student who cleans the shoes had the couches .
experiment=NPI_env=quantifier_npi=any_licensor=0_scope=1_npi-present=1	0		pedestrians who might take any cups wore many shoes .
experiment=NPI_env=quantifier_npi=any_licensor=0_scope=1_npi-present=0	1		pedestrians who might take the cups wore many shoes .
experiment=NPI_env=quantifier_npi=any_licensor=0_scope=0_npi-present=1	0		pedestrians who might take cups wore any shoes .
experiment=NPI_env=quantifier_npi=any_licensor=0_scope=0_npi-present=0	1		pedestrians who might take cups wore the shoes .
experiment=NPI_env=quantifier_npi=any_licensor=0_scope=1_npi-present=1	0		some drivers who did admire any books are lifting shoes .
experiment=NPI_env=quantifier_npi=any_licensor=0_scope=1_npi-present=0	1		some drivers who did admire the books are lifting shoes .
experiment=NPI_env=quantifier_npi=any_licensor=0_scope=0_npi-present=1	0		some drivers who did admire books are lifting any shoes .
experiment=NPI_env=quantifier_npi=any_licensor=0_scope=0_npi-present=0	1		some drivers who did admire books are lifting the shoes .
experiment=NPI_env=quantifier_npi=any_licensor=0_scope=1_npi-present=1	0		some cashier who will lift any plates would lift many couches .
experiment=NPI_env=quantifier_npi=any_licensor=0_scope=1_npi-present=0	1		some cashier who will lift the plates would lift many couches .
experiment=NPI_env=quantifier_npi=any_licensor=0_scope=0_npi-present=1	0		some cashier who will lift the plates would lift any couches .
experiment=NPI_env=quantifier_npi=any_licensor=0_scope=0_npi-present=0	1		some cashier who will lift the plates would lift the couches .
experiment=NPI_env=quantifier_npi=any_licensor=0_scope=1_npi-present=1	0		some driver who cleaned any gloves was selling the glasses .
experiment=NPI_env=quantifier_npi=any_licensor=0_scope=1_npi-present=0	1		some driver who cleaned the gloves was selling the glasses .
experiment=NPI_env=quantifier_npi=any_licensor=0_scope=0_npi-present=1	0		some driver who cleaned more than three gloves was selling any glasses .
experiment=NPI_env=quantifier_npi=any_licensor=0_scope=0_npi-present=0	1		some driver who cleaned more than three gloves was selling the glasses .
experiment=NPI_env=quantifier_npi=any_licensor=1_scope=1_npi-present=1	1		few guests who are wearing any gloves break glasses .
experiment=NPI_env=quantifier_npi=any_licensor=1_scope=1_npi-present=0	1		few guests who are wearing the gloves break glasses .
experiment=NPI_env=quantifier_npi=any_licensor=1_scope=1_npi-present=1	1		few guests who are wearing some gloves break any glasses .
experiment=NPI_env=quantifier_npi=any_licensor=1_scope=1_npi-present=0	1		few guests who are wearing some gloves break the glasses .
experiment=NPI_env=quantifier_npi=any_licensor=0_scope=1_npi-present=1	0		many men who has any plates has a lot of cups .
experiment=NPI_env=quantifier_npi=any_licensor=0_scope=1_npi-present=0	1		many men who has the plates has a lot of cups .
experiment=NPI_env=quantifier_npi=any_licensor=0_scope=0_npi-present=1	0		many men who has a lot of plates has any cups .
experiment=NPI_env=quantifier_npi=any_licensor=0_scope=0_npi-present=0	1		many men who has a lot of plates has the cups .
experiment=NPI_env=quantifier_npi=any_licensor=0_scope=1_npi-present=1	0		some gal who likes any gloves has worn the pants .
experiment=NPI_env=quantifier_npi=any_licensor=0_scope=1_npi-present=0	1		some gal who likes the gloves has worn the pants .
experiment=NPI_env=quantifier_npi=any_licensor=0_scope=0_npi-present=1	0		some gal who likes gloves has worn any pants .
experiment=NPI_env=quantifier_npi=any_licensor=0_scope=0_npi-present=0	1		some gal who likes gloves has worn the pants .
experiment=NPI_env=quantifier_npi=any_licensor=0_scope=1_npi-present=1	0		some waiter who bought any books had broken some glasses .
experiment=NPI_env=quantifier_npi=any_licensor=0_scope=1_npi-present=0	1		some waiter who bought the books had broken some glasses .
experiment=NPI_env=quantifier_npi=any_licensor=0_scope=0_npi-present=1	0		some waiter who bought books had broken any glasses .
experiment=NPI_env=quantifier_npi=any_licensor=0_scope=0_npi-present=0	1		some waiter who bought books had broken the glasses .
experiment=NPI_env=quantifier_npi=any_licensor=1_scope=1_npi-present=1	1		every adult who does buy any glasses breaks cars .
experiment=NPI_env=quantifier_npi=any_licensor=1_scope=1_npi-present=0	1		every adult who does buy the glasses breaks cars .
experiment=NPI_env=quantifier_npi=any_licensor=1_scope=0_npi-present=1	0		every adult who does buy the glasses breaks any cars .
experiment=NPI_env=quantifier_npi=any_licensor=1_scope=0_npi-present=0	1		every adult who does buy the glasses breaks the cars .
experiment=NPI_env=quantifier_npi=any_licensor=1_scope=1_npi-present=1	1		no actor who can clean any books should bring some gloves .
experiment=NPI_env=quantifier_npi=any_licensor=1_scope=1_npi-present=0	1		no actor who can clean the books should bring some gloves .
experiment=NPI_env=quantifier_npi=any_licensor=1_scope=1_npi-present=1	1		no actor who can clean a lot of books should bring any gloves .
experiment=NPI_env=quantifier_npi=any_licensor=1_scope=1_npi-present=0	1		no actor who can clean a lot of books should bring the gloves .
experiment=NPI_env=quantifier_npi=any_licensor=0_scope=1_npi-present=1	0		the gal who saw any gloves lifts more than three glasses .
experiment=NPI_env=quantifier_npi=any_licensor=0_scope=1_npi-present=0	1		the gal who saw the gloves lifts more than three glasses .
experiment=NPI_env=quantifier_npi=any_licensor=0_scope=0_npi-present=1	0		the gal who saw more than three gloves lifts any glasses .
experiment=NPI_env=quantifier_npi=any_licensor=0_scope=0_npi-present=0	1		the gal who saw more than three gloves lifts the glasses .
experiment=NPI_env=quantifier_npi=any_licensor=0_scope=1_npi-present=1	0		more than three children who can wear any glasses admired a lot of cars .
experiment=NPI_env=quantifier_npi=any_licensor=0_scope=1_npi-present=0	1		more than three children who can wear the glasses admired a lot of cars .
experiment=NPI_env=quantifier_npi=any_licensor=0_scope=0_npi-present=1	0		more than three children who can wear some glasses admired any cars .
experiment=NPI_env=quantifier_npi=any_licensor=0_scope=0_npi-present=0	1		more than three children who can wear some glasses admired the cars .
experiment=NPI_env=quantifier_npi=any_licensor=0_scope=1_npi-present=1	0		the ladies who can lift any forks were cleaning the forks .
experiment=NPI_env=quantifier_npi=any_licensor=0_scope=1_npi-present=0	1		the ladies who can lift the forks were cleaning the forks .
experiment=NPI_env=quantifier_npi=any_licensor=0_scope=0_npi-present=1	0		the ladies who can lift the forks were cleaning any forks .
experiment=NPI_env=quantifier_npi=any_licensor=0_scope=0_npi-present=0	1		the ladies who can lift the forks were cleaning the forks .
experiment=NPI_env=quantifier_npi=any_licensor=1_scope=1_npi-present=1	1		all actors who lift any dishes might sell some glasses .
experiment=NPI_env=quantifier_npi=any_licensor=1_scope=1_npi-present=0	1		all actors who lift the dishes might sell some glasses .
experiment=NPI_env=quantifier_npi=any_licensor=1_scope=0_npi-present=1	0		all actors who lift dishes might sell any glasses .
experiment=NPI_env=quantifier_npi=any_licensor=1_scope=0_npi-present=0	1		all actors who lift dishes might sell the glasses .
experiment=NPI_env=quantifier_npi=any_licensor=1_scope=1_npi-present=1	1		no woman who could wear any gloves admired some books .
experiment=NPI_env=quantifier_npi=any_licensor=1_scope=1_npi-present=0	1		no woman who could wear the gloves admired some books .
experiment=NPI_env=quantifier_npi=any_licensor=1_scope=1_npi-present=1	1		no woman who could wear more than three gloves admired any books .
experiment=NPI_env=quantifier_npi=any_licensor=1_scope=1_npi-present=0	1		no woman who could wear more than three gloves admired the books .
experiment=NPI_env=quantifier_npi=any_licensor=0_scope=1_npi-present=1	0		some humans who clean any books might break the dishes .
experiment=NPI_env=quantifier_npi=any_licensor=0_scope=1_npi-present=0	1		some humans who clean the books might break the dishes .
experiment=NPI_env=quantifier_npi=any_licensor=0_scope=0_npi-present=1	0		some humans who clean books might break any dishes .
experiment=NPI_env=quantifier_npi=any_licensor=0_scope=0_npi-present=0	1		some humans who clean books might break the dishes .
experiment=NPI_env=quantifier_npi=any_licensor=0_scope=1_npi-present=1	0		some patient who lifts any plates lifted more than three cups .
experiment=NPI_env=quantifier_npi=any_licensor=0_scope=1_npi-present=0	1		some patient who lifts the plates lifted more than three cups .
experiment=NPI_env=quantifier_npi=any_licensor=0_scope=0_npi-present=1	0		some patient who lifts some plates lifted any cups .
experiment=NPI_env=quantifier_npi=any_licensor=0_scope=0_npi-present=0	1		some patient who lifts some plates lifted the cups .
experiment=NPI_env=quantifier_npi=any_licensor=1_scope=1_npi-present=1	1		every lady who liked any books could have a lot of glasses .
experiment=NPI_env=quantifier_npi=any_licensor=1_scope=1_npi-present=0	1		every lady who liked the books could have a lot of glasses .
experiment=NPI_env=quantifier_npi=any_licensor=1_scope=0_npi-present=1	0		every lady who liked some books could have any glasses .
experiment=NPI_env=quantifier_npi=any_licensor=1_scope=0_npi-present=0	1		every lady who liked some books could have the glasses .
experiment=NPI_env=quantifier_npi=any_licensor=1_scope=1_npi-present=1	1		every human who did bring any books likes more than three rugs .
experiment=NPI_env=quantifier_npi=any_licensor=1_scope=1_npi-present=0	1		every human who did bring the books likes more than three rugs .
experiment=NPI_env=quantifier_npi=any_licensor=1_scope=0_npi-present=1	0		every human who did bring a lot of books likes any rugs .
experiment=NPI_env=quantifier_npi=any_licensor=1_scope=0_npi-present=0	1		every human who did bring a lot of books likes the rugs .
experiment=NPI_env=quantifier_npi=any_licensor=0_scope=1_npi-present=1	0		some student who wore any gloves could lift glasses .
experiment=NPI_env=quantifier_npi=any_licensor=0_scope=1_npi-present=0	1		some student who wore the gloves could lift glasses .
experiment=NPI_env=quantifier_npi=any_licensor=0_scope=0_npi-present=1	0		some student who wore a lot of gloves could lift any glasses .
experiment=NPI_env=quantifier_npi=any_licensor=0_scope=0_npi-present=0	1		some student who wore a lot of gloves could lift the glasses .
experiment=NPI_env=quantifier_npi=any_licensor=0_scope=1_npi-present=1	0		some guy who is bringing any books lifts the books .
experiment=NPI_env=quantifier_npi=any_licensor=0_scope=1_npi-present=0	1		some guy who is bringing the books lifts the books .
experiment=NPI_env=quantifier_npi=any_licensor=0_scope=0_npi-present=1	0		some guy who is bringing more than three books lifts any books .
experiment=NPI_env=quantifier_npi=any_licensor=0_scope=0_npi-present=0	1		some guy who is bringing more than three books lifts the books .
experiment=NPI_env=quantifier_npi=any_licensor=0_scope=1_npi-present=1	0		the human who can sell any plates has taken more than three plates .
experiment=NPI_env=quantifier_npi=any_licensor=0_scope=1_npi-present=0	1		the human who can sell the plates has taken more than three plates .
experiment=NPI_env=quantifier_npi=any_licensor=0_scope=0_npi-present=1	0		the human who can sell plates has taken any plates .
experiment=NPI_env=quantifier_npi=any_licensor=0_scope=0_npi-present=0	1		the human who can sell plates has taken the plates .
experiment=NPI_env=quantifier_npi=any_licensor=1_scope=1_npi-present=1	1		all gals who buy any cups have worn some gloves .
experiment=NPI_env=quantifier_npi=any_licensor=1_scope=1_npi-present=0	1		all gals who buy the cups have worn some gloves .
experiment=NPI_env=quantifier_npi=any_licensor=1_scope=0_npi-present=1	0		all gals who buy cups have worn any gloves .
experiment=NPI_env=quantifier_npi=any_licensor=1_scope=0_npi-present=0	1		all gals who buy cups have worn the gloves .
experiment=NPI_env=quantifier_npi=any_licensor=0_scope=1_npi-present=1	0		patients who bought any glasses will have more than three cars .
experiment=NPI_env=quantifier_npi=any_licensor=0_scope=1_npi-present=0	1		patients who bought the glasses will have more than three cars .
experiment=NPI_env=quantifier_npi=any_licensor=0_scope=0_npi-present=1	0		patients who bought glasses will have any cars .
experiment=NPI_env=quantifier_npi=any_licensor=0_scope=0_npi-present=0	1		patients who bought glasses will have the cars .
experiment=NPI_env=quantifier_npi=any_licensor=1_scope=1_npi-present=1	1		every cashier who would see any pants breaks some plates .
experiment=NPI_env=quantifier_npi=any_licensor=1_scope=1_npi-present=0	1		every cashier who would see the pants breaks some plates .
experiment=NPI_env=quantifier_npi=any_licensor=1_scope=0_npi-present=1	0		every cashier who would see the pants breaks any plates .
experiment=NPI_env=quantifier_npi=any_licensor=1_scope=0_npi-present=0	1		every cashier who would see the pants breaks the plates .
experiment=NPI_env=quantifier_npi=any_licensor=1_scope=1_npi-present=1	1		any drivers who sold any glasses had worn the glasses .
experiment=NPI_env=quantifier_npi=any_licensor=1_scope=1_npi-present=0	1		any drivers who sold the glasses had worn the glasses .
experiment=NPI_env=quantifier_npi=any_licensor=1_scope=0_npi-present=1	0		any drivers who sold some glasses had worn any glasses .
experiment=NPI_env=quantifier_npi=any_licensor=1_scope=0_npi-present=0	1		any drivers who sold some glasses had worn the glasses .
experiment=NPI_env=quantifier_npi=any_licensor=1_scope=1_npi-present=1	1		every student who does like any forks was wearing some pants .
experiment=NPI_env=quantifier_npi=any_licensor=1_scope=1_npi-present=0	1		every student who does like the forks was wearing some pants .
experiment=NPI_env=quantifier_npi=any_licensor=1_scope=0_npi-present=1	0		every student who does like some forks was wearing any pants .
experiment=NPI_env=quantifier_npi=any_licensor=1_scope=0_npi-present=0	1		every student who does like some forks was wearing the pants .
experiment=NPI_env=quantifier_npi=any_licensor=1_scope=1_npi-present=1	1		no woman who had brought any cars is selling more than three glasses .
experiment=NPI_env=quantifier_npi=any_licensor=1_scope=1_npi-present=0	1		no woman who had brought the cars is selling more than three glasses .
experiment=NPI_env=quantifier_npi=any_licensor=1_scope=1_npi-present=1	1		no woman who had brought more than three cars is selling any glasses .
experiment=NPI_env=quantifier_npi=any_licensor=1_scope=1_npi-present=0	1		no woman who had brought more than three cars is selling the glasses .
experiment=NPI_env=quantifier_npi=any_licensor=0_scope=1_npi-present=1	0		many pedestrians who have bought any glasses have seen some rugs .
experiment=NPI_env=quantifier_npi=any_licensor=0_scope=1_npi-present=0	1		many pedestrians who have bought the glasses have seen some rugs .
experiment=NPI_env=quantifier_npi=any_licensor=0_scope=0_npi-present=1	0		many pedestrians who have bought more than three glasses have seen any rugs .
experiment=NPI_env=quantifier_npi=any_licensor=0_scope=0_npi-present=0	1		many pedestrians who have bought more than three glasses have seen the rugs .
experiment=NPI_env=quantifier_npi=any_licensor=1_scope=1_npi-present=1	1		no children who brought any pants do admire a lot of gloves .
experiment=NPI_env=quantifier_npi=any_licensor=1_scope=1_npi-present=0	1		no children who brought the pants do admire a lot of gloves .
experiment=NPI_env=quantifier_npi=any_licensor=1_scope=1_npi-present=1	1		no children who brought a lot of pants do admire any gloves .
experiment=NPI_env=quantifier_npi=any_licensor=1_scope=1_npi-present=0	1		no children who brought a lot of pants do admire the gloves .
experiment=NPI_env=quantifier_npi=any_licensor=1_scope=1_npi-present=1	1		no humans who were admiring any gloves liked many glasses .
experiment=NPI_env=quantifier_npi=any_licensor=1_scope=1_npi-present=0	1		no humans who were admiring the gloves liked many glasses .
experiment=NPI_env=quantifier_npi=any_licensor=1_scope=1_npi-present=1	1		no humans who were admiring more than three gloves liked any glasses .
experiment=NPI_env=quantifier_npi=any_licensor=1_scope=1_npi-present=0	1		no humans who were admiring more than three gloves liked the glasses .
experiment=NPI_env=quantifier_npi=any_licensor=0_scope=1_npi-present=1	0		the teachers who can like any glasses see many plates .
experiment=NPI_env=quantifier_npi=any_licensor=0_scope=1_npi-present=0	1		the teachers who can like the glasses see many plates .
experiment=NPI_env=quantifier_npi=any_licensor=0_scope=0_npi-present=1	0		the teachers who can like more than three glasses see any plates .
experiment=NPI_env=quantifier_npi=any_licensor=0_scope=0_npi-present=0	1		the teachers who can like more than three glasses see the plates .
experiment=NPI_env=quantifier_npi=any_licensor=0_scope=1_npi-present=1	0		more than three children who might bring any plates would admire more than three glasses .
experiment=NPI_env=quantifier_npi=any_licensor=0_scope=1_npi-present=0	1		more than three children who might bring the plates would admire more than three glasses .
experiment=NPI_env=quantifier_npi=any_licensor=0_scope=0_npi-present=1	0		more than three children who might bring plates would admire any glasses .
experiment=NPI_env=quantifier_npi=any_licensor=0_scope=0_npi-present=0	1		more than three children who might bring plates would admire the glasses .
experiment=NPI_env=quantifier_npi=any_licensor=1_scope=1_npi-present=1	1		all actresses who will admire any cars were cleaning a lot of shoes .
experiment=NPI_env=quantifier_npi=any_licensor=1_scope=1_npi-present=0	1		all actresses who will admire the cars were cleaning a lot of shoes .
experiment=NPI_env=quantifier_npi=any_licensor=1_scope=0_npi-present=1	0		all actresses who will admire a lot of cars were cleaning any shoes .
experiment=NPI_env=quantifier_npi=any_licensor=1_scope=0_npi-present=0	1		all actresses who will admire a lot of cars were cleaning the shoes .
experiment=NPI_env=quantifier_npi=any_licensor=0_scope=1_npi-present=1	0		some student who is taking any rugs saw some forks .
experiment=NPI_env=quantifier_npi=any_licensor=0_scope=1_npi-present=0	1		some student who is taking the rugs saw some forks .
experiment=NPI_env=quantifier_npi=any_licensor=0_scope=0_npi-present=1	0		some student who is taking many rugs saw any forks .
experiment=NPI_env=quantifier_npi=any_licensor=0_scope=0_npi-present=0	1		some student who is taking many rugs saw the forks .
experiment=NPI_env=quantifier_npi=any_licensor=1_scope=1_npi-present=1	1		few students who sold any plates had bought some shoes .
experiment=NPI_env=quantifier_npi=any_licensor=1_scope=1_npi-present=0	1		few students who sold the plates had bought some shoes .
experiment=NPI_env=quantifier_npi=any_licensor=1_scope=1_npi-present=1	1		few students who sold the plates had bought any shoes .
experiment=NPI_env=quantifier_npi=any_licensor=1_scope=1_npi-present=0	1		few students who sold the plates had bought the shoes .
experiment=NPI_env=quantifier_npi=any_licensor=1_scope=1_npi-present=1	1		any actors who could like any pants are lifting a lot of pants .
experiment=NPI_env=quantifier_npi=any_licensor=1_scope=1_npi-present=0	1		any actors who could like the pants are lifting a lot of pants .
experiment=NPI_env=quantifier_npi=any_licensor=1_scope=0_npi-present=1	0		any actors who could like pants are lifting any pants .
experiment=NPI_env=quantifier_npi=any_licensor=1_scope=0_npi-present=0	1		any actors who could like pants are lifting the pants .
experiment=NPI_env=quantifier_npi=any_licensor=1_scope=1_npi-present=1	1		every woman who would have any shoes sees glasses .
experiment=NPI_env=quantifier_npi=any_licensor=1_scope=1_npi-present=0	1		every woman who would have the shoes sees glasses .
experiment=NPI_env=quantifier_npi=any_licensor=1_scope=0_npi-present=1	0		every woman who would have a lot of shoes sees any glasses .
experiment=NPI_env=quantifier_npi=any_licensor=1_scope=0_npi-present=0	1		every woman who would have a lot of shoes sees the glasses .
experiment=NPI_env=quantifier_npi=any_licensor=0_scope=1_npi-present=1	0		more than three cashiers who have lifted any glasses admired the shoes .
experiment=NPI_env=quantifier_npi=any_licensor=0_scope=1_npi-present=0	1		more than three cashiers who have lifted the glasses admired the shoes .
experiment=NPI_env=quantifier_npi=any_licensor=0_scope=0_npi-present=1	0		more than three cashiers who have lifted some glasses admired any shoes .
experiment=NPI_env=quantifier_npi=any_licensor=0_scope=0_npi-present=0	1		more than three cashiers who have lifted some glasses admired the shoes .
experiment=NPI_env=quantifier_npi=any_licensor=1_scope=1_npi-present=1	1		few men who brought any chairs might like rugs .
experiment=NPI_env=quantifier_npi=any_licensor=1_scope=1_npi-present=0	1		few men who brought the chairs might like rugs .
experiment=NPI_env=quantifier_npi=any_licensor=1_scope=1_npi-present=1	1		few men who brought some chairs might like any rugs .
experiment=NPI_env=quantifier_npi=any_licensor=1_scope=1_npi-present=0	1		few men who brought some chairs might like the rugs .
experiment=NPI_env=quantifier_npi=any_licensor=1_scope=1_npi-present=1	1		no waiters who have seen any plates break a lot of cups .
experiment=NPI_env=quantifier_npi=any_licensor=1_scope=1_npi-present=0	1		no waiters who have seen the plates break a lot of cups .
experiment=NPI_env=quantifier_npi=any_licensor=1_scope=1_npi-present=1	1		no waiters who have seen more than three plates break any cups .
experiment=NPI_env=quantifier_npi=any_licensor=1_scope=1_npi-present=0	1		no waiters who have seen more than three plates break the cups .
experiment=NPI_env=quantifier_npi=any_licensor=0_scope=1_npi-present=1	0		a lot of drivers who could wear any shoes were cleaning more than three chairs .
experiment=NPI_env=quantifier_npi=any_licensor=0_scope=1_npi-present=0	1		a lot of drivers who could wear the shoes were cleaning more than three chairs .
experiment=NPI_env=quantifier_npi=any_licensor=0_scope=0_npi-present=1	0		a lot of drivers who could wear more than three shoes were cleaning any chairs .
experiment=NPI_env=quantifier_npi=any_licensor=0_scope=0_npi-present=0	1		a lot of drivers who could wear more than three shoes were cleaning the chairs .
experiment=NPI_env=quantifier_npi=any_licensor=0_scope=1_npi-present=1	0		a lot of cashiers who might lift any couches clean the glasses .
experiment=NPI_env=quantifier_npi=any_licensor=0_scope=1_npi-present=0	1		a lot of cashiers who might lift the couches clean the glasses .
experiment=NPI_env=quantifier_npi=any_licensor=0_scope=0_npi-present=1	0		a lot of cashiers who might lift a lot of couches clean any glasses .
experiment=NPI_env=quantifier_npi=any_licensor=0_scope=0_npi-present=0	1		a lot of cashiers who might lift a lot of couches clean the glasses .
experiment=NPI_env=quantifier_npi=any_licensor=0_scope=1_npi-present=1	0		some doctor who can admire any glasses should bring a lot of cars .
experiment=NPI_env=quantifier_npi=any_licensor=0_scope=1_npi-present=0	1		some doctor who can admire the glasses should bring a lot of cars .
experiment=NPI_env=quantifier_npi=any_licensor=0_scope=0_npi-present=1	0		some doctor who can admire many glasses should bring any cars .
experiment=NPI_env=quantifier_npi=any_licensor=0_scope=0_npi-present=0	1		some doctor who can admire many glasses should bring the cars .
experiment=NPI_env=quantifier_npi=any_licensor=0_scope=1_npi-present=1	0		the actresses who saw any glasses break cars .
experiment=NPI_env=quantifier_npi=any_licensor=0_scope=1_npi-present=0	1		the actresses who saw the glasses break cars .
experiment=NPI_env=quantifier_npi=any_licensor=0_scope=0_npi-present=1	0		the actresses who saw more than three glasses break any cars .
experiment=NPI_env=quantifier_npi=any_licensor=0_scope=0_npi-present=0	1		the actresses who saw more than three glasses break the cars .
experiment=NPI_env=quantifier_npi=any_licensor=0_scope=1_npi-present=1	0		the patient who had brought any chairs sold cars .
experiment=NPI_env=quantifier_npi=any_licensor=0_scope=1_npi-present=0	1		the patient who had brought the chairs sold cars .
experiment=NPI_env=quantifier_npi=any_licensor=0_scope=0_npi-present=1	0		the patient who had brought more than three chairs sold any cars .
experiment=NPI_env=quantifier_npi=any_licensor=0_scope=0_npi-present=0	1		the patient who had brought more than three chairs sold the cars .
experiment=NPI_env=quantifier_npi=any_licensor=0_scope=1_npi-present=1	0		the students who see any cups bought more than three chairs .
experiment=NPI_env=quantifier_npi=any_licensor=0_scope=1_npi-present=0	1		the students who see the cups bought more than three chairs .
