experiment=NPI-env=determiner_negation_biclausal-npi=yet-crucial_item=some-licensor=0-scope=1-npi_present=1	0		Some guest explained that the people would admire an report yet .
experiment=NPI-env=determiner_negation_biclausal-npi=yet-crucial_item=some-licensor=0-scope=1-npi_present=0	1		Some guest explained that the people would admire an report for a while .
experiment=NPI-env=determiner_negation_biclausal-npi=yet-crucial_item=some-licensor=0-scope=0-npi_present=1	0		a guest explained yet that some people would admire an report .
experiment=NPI-env=determiner_negation_biclausal-npi=yet-crucial_item=some-licensor=0-scope=0-npi_present=0	1		a guest explained for a while that some people would admire an report .
experiment=NPI-env=negation-npi=yet-crucial_item=no-licensor=1-scope=1-npi_present=1	1		no girls had said that the human is lying yet .
experiment=NPI-env=negation-npi=yet-crucial_item=no-licensor=1-scope=1-npi_present=0	1		no girls had said that the human is lying on weekends .
experiment=NPI-env=negation-npi=yet-crucial_item=no-licensor=1-scope=0-npi_present=1	0		the girls had said yet that no human is lying .
experiment=NPI-env=negation-npi=yet-crucial_item=no-licensor=1-scope=0-npi_present=0	1		the girls had said on weekends that no human is lying .
experiment=NPI-env=determiner_negation_biclausal-npi=yet-crucial_item=some-licensor=0-scope=1-npi_present=1	0		Some girls had said that the human is lying yet .
experiment=NPI-env=determiner_negation_biclausal-npi=yet-crucial_item=some-licensor=0-scope=1-npi_present=0	1		Some girls had said that the human is lying on weekends .
experiment=NPI-env=determiner_negation_biclausal-npi=yet-crucial_item=some-licensor=0-scope=0-npi_present=1	0		the girls had said yet that some human is lying .
experiment=NPI-env=determiner_negation_biclausal-npi=yet-crucial_item=some-licensor=0-scope=0-npi_present=0	1		the girls had said on weekends that some human is lying .
experiment=NPI-env=negation-npi=yet-crucial_item=no-licensor=1-scope=1-npi_present=1	1		no customer imagines that an adult listens to the humans yet .
experiment=NPI-env=negation-npi=yet-crucial_item=no-licensor=1-scope=1-npi_present=0	1		no customer imagines that an adult listens to the humans for a while .
experiment=NPI-env=negation-npi=yet-crucial_item=no-licensor=1-scope=0-npi_present=1	0		the customer imagines yet that no adult listens to the humans .
experiment=NPI-env=negation-npi=yet-crucial_item=no-licensor=1-scope=0-npi_present=0	1		the customer imagines for a while that no adult listens to the humans .
experiment=NPI-env=determiner_negation_biclausal-npi=yet-crucial_item=some-licensor=0-scope=1-npi_present=1	0		Some customer imagines that an adult listens to the humans yet .
experiment=NPI-env=determiner_negation_biclausal-npi=yet-crucial_item=some-licensor=0-scope=1-npi_present=0	1		Some customer imagines that an adult listens to the humans for a while .
experiment=NPI-env=determiner_negation_biclausal-npi=yet-crucial_item=some-licensor=0-scope=0-npi_present=1	0		the customer imagines yet that some adult listens to the humans .
experiment=NPI-env=determiner_negation_biclausal-npi=yet-crucial_item=some-licensor=0-scope=0-npi_present=0	1		the customer imagines for a while that some adult listens to the humans .
experiment=NPI-env=negation-npi=yet-crucial_item=no-licensor=1-scope=1-npi_present=1	1		no actresses had explained that the patients conspire yet .
experiment=NPI-env=negation-npi=yet-crucial_item=no-licensor=1-scope=1-npi_present=0	1		no actresses had explained that the patients conspire on weekends .
experiment=NPI-env=negation-npi=yet-crucial_item=no-licensor=1-scope=0-npi_present=1	0		the actresses had explained yet that no patients conspire .
experiment=NPI-env=negation-npi=yet-crucial_item=no-licensor=1-scope=0-npi_present=0	1		the actresses had explained on weekends that no patients conspire .
experiment=NPI-env=determiner_negation_biclausal-npi=yet-crucial_item=some-licensor=0-scope=1-npi_present=1	0		Some actresses had explained that the patients conspire yet .
experiment=NPI-env=determiner_negation_biclausal-npi=yet-crucial_item=some-licensor=0-scope=1-npi_present=0	1		Some actresses had explained that the patients conspire on weekends .
experiment=NPI-env=determiner_negation_biclausal-npi=yet-crucial_item=some-licensor=0-scope=0-npi_present=1	0		the actresses had explained yet that some patients conspire .
experiment=NPI-env=determiner_negation_biclausal-npi=yet-crucial_item=some-licensor=0-scope=0-npi_present=0	1		the actresses had explained on weekends that some patients conspire .
experiment=NPI-env=negation-npi=yet-crucial_item=no-licensor=1-scope=1-npi_present=1	1		no actress thinks that the drivers have wept yet .
experiment=NPI-env=negation-npi=yet-crucial_item=no-licensor=1-scope=1-npi_present=0	1		no actress thinks that the drivers have wept for a while .
experiment=NPI-env=negation-npi=yet-crucial_item=no-licensor=1-scope=0-npi_present=1	0		an actress thinks yet that no drivers have wept .
experiment=NPI-env=negation-npi=yet-crucial_item=no-licensor=1-scope=0-npi_present=0	1		an actress thinks for a while that no drivers have wept .
experiment=NPI-env=determiner_negation_biclausal-npi=yet-crucial_item=some-licensor=0-scope=1-npi_present=1	0		Some actress thinks that the drivers have wept yet .
experiment=NPI-env=determiner_negation_biclausal-npi=yet-crucial_item=some-licensor=0-scope=1-npi_present=0	1		Some actress thinks that the drivers have wept for a while .
experiment=NPI-env=determiner_negation_biclausal-npi=yet-crucial_item=some-licensor=0-scope=0-npi_present=1	0		an actress thinks yet that some drivers have wept .
experiment=NPI-env=determiner_negation_biclausal-npi=yet-crucial_item=some-licensor=0-scope=0-npi_present=0	1		an actress thinks for a while that some drivers have wept .
experiment=NPI-env=negation-npi=yet-crucial_item=no-licensor=1-scope=1-npi_present=1	1		no girls say that the drivers had joked around yet .
experiment=NPI-env=negation-npi=yet-crucial_item=no-licensor=1-scope=1-npi_present=0	1		no girls say that the drivers had joked around regularly .
experiment=NPI-env=negation-npi=yet-crucial_item=no-licensor=1-scope=0-npi_present=1	0		the girls say yet that no drivers had joked around .
experiment=NPI-env=negation-npi=yet-crucial_item=no-licensor=1-scope=0-npi_present=0	1		the girls say regularly that no drivers had joked around .
experiment=NPI-env=determiner_negation_biclausal-npi=yet-crucial_item=some-licensor=0-scope=1-npi_present=1	0		Some girls say that the drivers had joked around yet .
experiment=NPI-env=determiner_negation_biclausal-npi=yet-crucial_item=some-licensor=0-scope=1-npi_present=0	1		Some girls say that the drivers had joked around regularly .
experiment=NPI-env=determiner_negation_biclausal-npi=yet-crucial_item=some-licensor=0-scope=0-npi_present=1	0		the girls say yet that some drivers had joked around .
experiment=NPI-env=determiner_negation_biclausal-npi=yet-crucial_item=some-licensor=0-scope=0-npi_present=0	1		the girls say regularly that some drivers had joked around .
experiment=NPI-env=negation-npi=yet-crucial_item=no-licensor=1-scope=1-npi_present=1	1		no actors can think that the girls might flee from the man yet .
experiment=NPI-env=negation-npi=yet-crucial_item=no-licensor=1-scope=1-npi_present=0	1		no actors can think that the girls might flee from the man as well .
experiment=NPI-env=negation-npi=yet-crucial_item=no-licensor=1-scope=0-npi_present=1	0		the actors can think yet that no girls might flee from the man .
experiment=NPI-env=negation-npi=yet-crucial_item=no-licensor=1-scope=0-npi_present=0	1		the actors can think as well that no girls might flee from the man .
experiment=NPI-env=determiner_negation_biclausal-npi=yet-crucial_item=some-licensor=0-scope=1-npi_present=1	0		Some actors can think that the girls might flee from the man yet .
experiment=NPI-env=determiner_negation_biclausal-npi=yet-crucial_item=some-licensor=0-scope=1-npi_present=0	1		Some actors can think that the girls might flee from the man as well .
experiment=NPI-env=determiner_negation_biclausal-npi=yet-crucial_item=some-licensor=0-scope=0-npi_present=1	0		the actors can think yet that some girls might flee from the man .
experiment=NPI-env=determiner_negation_biclausal-npi=yet-crucial_item=some-licensor=0-scope=0-npi_present=0	1		the actors can think as well that some girls might flee from the man .
experiment=NPI-env=negation-npi=yet-crucial_item=no-licensor=1-scope=1-npi_present=1	1		no waiter had said that a cashier does nod yet .
experiment=NPI-env=negation-npi=yet-crucial_item=no-licensor=1-scope=1-npi_present=0	1		no waiter had said that a cashier does nod for a while .
experiment=NPI-env=negation-npi=yet-crucial_item=no-licensor=1-scope=0-npi_present=1	0		the waiter had said yet that no cashier does nod .
experiment=NPI-env=negation-npi=yet-crucial_item=no-licensor=1-scope=0-npi_present=0	1		the waiter had said for a while that no cashier does nod .
experiment=NPI-env=determiner_negation_biclausal-npi=yet-crucial_item=some-licensor=0-scope=1-npi_present=1	0		Some waiter had said that a cashier does nod yet .
experiment=NPI-env=determiner_negation_biclausal-npi=yet-crucial_item=some-licensor=0-scope=1-npi_present=0	1		Some waiter had said that a cashier does nod for a while .
experiment=NPI-env=determiner_negation_biclausal-npi=yet-crucial_item=some-licensor=0-scope=0-npi_present=1	0		the waiter had said yet that some cashier does nod .
experiment=NPI-env=determiner_negation_biclausal-npi=yet-crucial_item=some-licensor=0-scope=0-npi_present=0	1		the waiter had said for a while that some cashier does nod .
experiment=NPI-env=negation-npi=yet-crucial_item=no-licensor=1-scope=1-npi_present=1	1		no teacher is explaining that the waitresses might run around the art galleries yet .
experiment=NPI-env=negation-npi=yet-crucial_item=no-licensor=1-scope=1-npi_present=0	1		no teacher is explaining that the waitresses might run around the art galleries regularly .
experiment=NPI-env=negation-npi=yet-crucial_item=no-licensor=1-scope=0-npi_present=1	0		the teacher is explaining yet that no waitresses might run around the art galleries .
experiment=NPI-env=negation-npi=yet-crucial_item=no-licensor=1-scope=0-npi_present=0	1		the teacher is explaining regularly that no waitresses might run around the art galleries .
experiment=NPI-env=determiner_negation_biclausal-npi=yet-crucial_item=some-licensor=0-scope=1-npi_present=1	0		Some teacher is explaining that the waitresses might run around the art galleries yet .
experiment=NPI-env=determiner_negation_biclausal-npi=yet-crucial_item=some-licensor=0-scope=1-npi_present=0	1		Some teacher is explaining that the waitresses might run around the art galleries regularly .
experiment=NPI-env=determiner_negation_biclausal-npi=yet-crucial_item=some-licensor=0-scope=0-npi_present=1	0		the teacher is explaining yet that some waitresses might run around the art galleries .
experiment=NPI-env=determiner_negation_biclausal-npi=yet-crucial_item=some-licensor=0-scope=0-npi_present=0	1		the teacher is explaining regularly that some waitresses might run around the art galleries .
experiment=NPI-env=negation-npi=yet-crucial_item=no-licensor=1-scope=1-npi_present=1	1		no boys have said that the doctor would sell the book yet .
experiment=NPI-env=negation-npi=yet-crucial_item=no-licensor=1-scope=1-npi_present=0	1		no boys have said that the doctor would sell the book regularly .
experiment=NPI-env=negation-npi=yet-crucial_item=no-licensor=1-scope=0-npi_present=1	0		the boys have said yet that no doctor would sell the book .
experiment=NPI-env=negation-npi=yet-crucial_item=no-licensor=1-scope=0-npi_present=0	1		the boys have said regularly that no doctor would sell the book .
experiment=NPI-env=determiner_negation_biclausal-npi=yet-crucial_item=some-licensor=0-scope=1-npi_present=1	0		Some boys have said that the doctor would sell the book yet .
experiment=NPI-env=determiner_negation_biclausal-npi=yet-crucial_item=some-licensor=0-scope=1-npi_present=0	1		Some boys have said that the doctor would sell the book regularly .
experiment=NPI-env=determiner_negation_biclausal-npi=yet-crucial_item=some-licensor=0-scope=0-npi_present=1	0		the boys have said yet that some doctor would sell the book .
experiment=NPI-env=determiner_negation_biclausal-npi=yet-crucial_item=some-licensor=0-scope=0-npi_present=0	1		the boys have said regularly that some doctor would sell the book .
experiment=NPI-env=negation-npi=yet-crucial_item=no-licensor=1-scope=1-npi_present=1	1		no teachers might say that the gals were boycotting the movie theater yet .
experiment=NPI-env=negation-npi=yet-crucial_item=no-licensor=1-scope=1-npi_present=0	1		no teachers might say that the gals were boycotting the movie theater on weekends .
experiment=NPI-env=negation-npi=yet-crucial_item=no-licensor=1-scope=0-npi_present=1	0		the teachers might say yet that no gals were boycotting the movie theater .
experiment=NPI-env=negation-npi=yet-crucial_item=no-licensor=1-scope=0-npi_present=0	1		the teachers might say on weekends that no gals were boycotting the movie theater .
experiment=NPI-env=determiner_negation_biclausal-npi=yet-crucial_item=some-licensor=0-scope=1-npi_present=1	0		Some teachers might say that the gals were boycotting the movie theater yet .
experiment=NPI-env=determiner_negation_biclausal-npi=yet-crucial_item=some-licensor=0-scope=1-npi_present=0	1		Some teachers might say that the gals were boycotting the movie theater on weekends .
experiment=NPI-env=determiner_negation_biclausal-npi=yet-crucial_item=some-licensor=0-scope=0-npi_present=1	0		the teachers might say yet that some gals were boycotting the movie theater .
experiment=NPI-env=determiner_negation_biclausal-npi=yet-crucial_item=some-licensor=0-scope=0-npi_present=0	1		the teachers might say on weekends that some gals were boycotting the movie theater .
experiment=NPI-env=negation-npi=yet-crucial_item=no-licensor=1-scope=1-npi_present=1	1		no patient had said that the adults like the women yet .
experiment=NPI-env=negation-npi=yet-crucial_item=no-licensor=1-scope=1-npi_present=0	1		no patient had said that the adults like the women regularly .
experiment=NPI-env=negation-npi=yet-crucial_item=no-licensor=1-scope=0-npi_present=1	0		a patient had said yet that no adults like the women .
experiment=NPI-env=negation-npi=yet-crucial_item=no-licensor=1-scope=0-npi_present=0	1		a patient had said regularly that no adults like the women .
experiment=NPI-env=determiner_negation_biclausal-npi=yet-crucial_item=some-licensor=0-scope=1-npi_present=1	0		Some patient had said that the adults like the women yet .
experiment=NPI-env=determiner_negation_biclausal-npi=yet-crucial_item=some-licensor=0-scope=1-npi_present=0	1		Some patient had said that the adults like the women regularly .
experiment=NPI-env=determiner_negation_biclausal-npi=yet-crucial_item=some-licensor=0-scope=0-npi_present=1	0		a patient had said yet that some adults like the women .
experiment=NPI-env=determiner_negation_biclausal-npi=yet-crucial_item=some-licensor=0-scope=0-npi_present=0	1		a patient had said regularly that some adults like the women .
experiment=NPI-env=negation-npi=yet-crucial_item=no-licensor=1-scope=1-npi_present=1	1		no guests have said that a student has screamed yet .
experiment=NPI-env=negation-npi=yet-crucial_item=no-licensor=1-scope=1-npi_present=0	1		no guests have said that a student has screamed on weekends .
experiment=NPI-env=negation-npi=yet-crucial_item=no-licensor=1-scope=0-npi_present=1	0		the guests have said yet that no student has screamed .
experiment=NPI-env=negation-npi=yet-crucial_item=no-licensor=1-scope=0-npi_present=0	1		the guests have said on weekends that no student has screamed .
experiment=NPI-env=determiner_negation_biclausal-npi=yet-crucial_item=some-licensor=0-scope=1-npi_present=1	0		Some guests have said that a student has screamed yet .
experiment=NPI-env=determiner_negation_biclausal-npi=yet-crucial_item=some-licensor=0-scope=1-npi_present=0	1		Some guests have said that a student has screamed on weekends .
experiment=NPI-env=determiner_negation_biclausal-npi=yet-crucial_item=some-licensor=0-scope=0-npi_present=1	0		the guests have said yet that some student has screamed .
experiment=NPI-env=determiner_negation_biclausal-npi=yet-crucial_item=some-licensor=0-scope=0-npi_present=0	1		the guests have said on weekends that some student has screamed .
experiment=NPI-env=negation-npi=yet-crucial_item=no-licensor=1-scope=1-npi_present=1	1		no teenagers thought that a driver has escaped from the museums yet .
experiment=NPI-env=negation-npi=yet-crucial_item=no-licensor=1-scope=1-npi_present=0	1		no teenagers thought that a driver has escaped from the museums as well .
experiment=NPI-env=negation-npi=yet-crucial_item=no-licensor=1-scope=0-npi_present=1	0		the teenagers thought yet that no driver has escaped from the museums .
experiment=NPI-env=negation-npi=yet-crucial_item=no-licensor=1-scope=0-npi_present=0	1		the teenagers thought as well that no driver has escaped from the museums .
experiment=NPI-env=determiner_negation_biclausal-npi=yet-crucial_item=some-licensor=0-scope=1-npi_present=1	0		Some teenagers thought that a driver has escaped from the museums yet .
experiment=NPI-env=determiner_negation_biclausal-npi=yet-crucial_item=some-licensor=0-scope=1-npi_present=0	1		Some teenagers thought that a driver has escaped from the museums as well .
experiment=NPI-env=determiner_negation_biclausal-npi=yet-crucial_item=some-licensor=0-scope=0-npi_present=1	0		the teenagers thought yet that some driver has escaped from the museums .
experiment=NPI-env=determiner_negation_biclausal-npi=yet-crucial_item=some-licensor=0-scope=0-npi_present=0	1		the teenagers thought as well that some driver has escaped from the museums .
experiment=NPI-env=negation-npi=yet-crucial_item=no-licensor=1-scope=1-npi_present=1	1		no patient could imagine that a teacher might buy the glasses yet .
experiment=NPI-env=negation-npi=yet-crucial_item=no-licensor=1-scope=1-npi_present=0	1		no patient could imagine that a teacher might buy the glasses for a while .
experiment=NPI-env=negation-npi=yet-crucial_item=no-licensor=1-scope=0-npi_present=1	0		the patient could imagine yet that no teacher might buy the glasses .
experiment=NPI-env=negation-npi=yet-crucial_item=no-licensor=1-scope=0-npi_present=0	1		the patient could imagine for a while that no teacher might buy the glasses .
experiment=NPI-env=determiner_negation_biclausal-npi=yet-crucial_item=some-licensor=0-scope=1-npi_present=1	0		Some patient could imagine that a teacher might buy the glasses yet .
experiment=NPI-env=determiner_negation_biclausal-npi=yet-crucial_item=some-licensor=0-scope=1-npi_present=0	1		Some patient could imagine that a teacher might buy the glasses for a while .
experiment=NPI-env=determiner_negation_biclausal-npi=yet-crucial_item=some-licensor=0-scope=0-npi_present=1	0		the patient could imagine yet that some teacher might buy the glasses .
experiment=NPI-env=determiner_negation_biclausal-npi=yet-crucial_item=some-licensor=0-scope=0-npi_present=0	1		the patient could imagine for a while that some teacher might buy the glasses .
experiment=NPI-env=negation-npi=yet-crucial_item=no-licensor=1-scope=1-npi_present=1	1		no drivers have thought that a gal had practiced yet .
experiment=NPI-env=negation-npi=yet-crucial_item=no-licensor=1-scope=1-npi_present=0	1		no drivers have thought that a gal had practiced as well .
experiment=NPI-env=negation-npi=yet-crucial_item=no-licensor=1-scope=0-npi_present=1	0		the drivers have thought yet that no gal had practiced .
experiment=NPI-env=negation-npi=yet-crucial_item=no-licensor=1-scope=0-npi_present=0	1		the drivers have thought as well that no gal had practiced .
experiment=NPI-env=determiner_negation_biclausal-npi=yet-crucial_item=some-licensor=0-scope=1-npi_present=1	0		Some drivers have thought that a gal had practiced yet .
experiment=NPI-env=determiner_negation_biclausal-npi=yet-crucial_item=some-licensor=0-scope=1-npi_present=0	1		Some drivers have thought that a gal had practiced as well .
experiment=NPI-env=determiner_negation_biclausal-npi=yet-crucial_item=some-licensor=0-scope=0-npi_present=1	0		the drivers have thought yet that some gal had practiced .
experiment=NPI-env=determiner_negation_biclausal-npi=yet-crucial_item=some-licensor=0-scope=0-npi_present=0	1		the drivers have thought as well that some gal had practiced .
experiment=NPI-env=negation-npi=yet-crucial_item=no-licensor=1-scope=1-npi_present=1	1		no actresses thought that the guys should work with the customer yet .
experiment=NPI-env=negation-npi=yet-crucial_item=no-licensor=1-scope=1-npi_present=0	1		no actresses thought that the guys should work with the customer as well .
experiment=NPI-env=negation-npi=yet-crucial_item=no-licensor=1-scope=0-npi_present=1	0		the actresses thought yet that no guys should work with the customer .
experiment=NPI-env=negation-npi=yet-crucial_item=no-licensor=1-scope=0-npi_present=0	1		the actresses thought as well that no guys should work with the customer .
experiment=NPI-env=determiner_negation_biclausal-npi=yet-crucial_item=some-licensor=0-scope=1-npi_present=1	0		Some actresses thought that the guys should work with the customer yet .
experiment=NPI-env=determiner_negation_biclausal-npi=yet-crucial_item=some-licensor=0-scope=1-npi_present=0	1		Some actresses thought that the guys should work with the customer as well .
experiment=NPI-env=determiner_negation_biclausal-npi=yet-crucial_item=some-licensor=0-scope=0-npi_present=1	0		the actresses thought yet that some guys should work with the customer .
experiment=NPI-env=determiner_negation_biclausal-npi=yet-crucial_item=some-licensor=0-scope=0-npi_present=0	1		the actresses thought as well that some guys should work with the customer .
experiment=NPI-env=negation-npi=yet-crucial_item=no-licensor=1-scope=1-npi_present=1	1		no people have imagined that the guests are reacting yet .
experiment=NPI-env=negation-npi=yet-crucial_item=no-licensor=1-scope=1-npi_present=0	1		no people have imagined that the guests are reacting regularly .
experiment=NPI-env=negation-npi=yet-crucial_item=no-licensor=1-scope=0-npi_present=1	0		the people have imagined yet that no guests are reacting .
experiment=NPI-env=negation-npi=yet-crucial_item=no-licensor=1-scope=0-npi_present=0	1		the people have imagined regularly that no guests are reacting .
experiment=NPI-env=determiner_negation_biclausal-npi=yet-crucial_item=some-licensor=0-scope=1-npi_present=1	0		Some people have imagined that the guests are reacting yet .
experiment=NPI-env=determiner_negation_biclausal-npi=yet-crucial_item=some-licensor=0-scope=1-npi_present=0	1		Some people have imagined that the guests are reacting regularly .
experiment=NPI-env=determiner_negation_biclausal-npi=yet-crucial_item=some-licensor=0-scope=0-npi_present=1	0		the people have imagined yet that some guests are reacting .
experiment=NPI-env=determiner_negation_biclausal-npi=yet-crucial_item=some-licensor=0-scope=0-npi_present=0	1		the people have imagined regularly that some guests are reacting .
experiment=NPI-env=negation-npi=yet-crucial_item=no-licensor=1-scope=1-npi_present=1	1		no gals thought that the guests are talking to the cashiers yet .
experiment=NPI-env=negation-npi=yet-crucial_item=no-licensor=1-scope=1-npi_present=0	1		no gals thought that the guests are talking to the cashiers as well .
experiment=NPI-env=negation-npi=yet-crucial_item=no-licensor=1-scope=0-npi_present=1	0		the gals thought yet that no guests are talking to the cashiers .
experiment=NPI-env=negation-npi=yet-crucial_item=no-licensor=1-scope=0-npi_present=0	1		the gals thought as well that no guests are talking to the cashiers .
experiment=NPI-env=determiner_negation_biclausal-npi=yet-crucial_item=some-licensor=0-scope=1-npi_present=1	0		Some gals thought that the guests are talking to the cashiers yet .
experiment=NPI-env=determiner_negation_biclausal-npi=yet-crucial_item=some-licensor=0-scope=1-npi_present=0	1		Some gals thought that the guests are talking to the cashiers as well .
experiment=NPI-env=determiner_negation_biclausal-npi=yet-crucial_item=some-licensor=0-scope=0-npi_present=1	0		the gals thought yet that some guests are talking to the cashiers .
experiment=NPI-env=determiner_negation_biclausal-npi=yet-crucial_item=some-licensor=0-scope=0-npi_present=0	1		the gals thought as well that some guests are talking to the cashiers .
experiment=NPI-env=negation-npi=yet-crucial_item=no-licensor=1-scope=1-npi_present=1	1		no guys explain that the gals have known the lady yet .
experiment=NPI-env=negation-npi=yet-crucial_item=no-licensor=1-scope=1-npi_present=0	1		no guys explain that the gals have known the lady on occasion .
experiment=NPI-env=negation-npi=yet-crucial_item=no-licensor=1-scope=0-npi_present=1	0		the guys explain yet that no gals have known the lady .
experiment=NPI-env=negation-npi=yet-crucial_item=no-licensor=1-scope=0-npi_present=0	1		the guys explain on occasion that no gals have known the lady .
experiment=NPI-env=determiner_negation_biclausal-npi=yet-crucial_item=some-licensor=0-scope=1-npi_present=1	0		Some guys explain that the gals have known the lady yet .
experiment=NPI-env=determiner_negation_biclausal-npi=yet-crucial_item=some-licensor=0-scope=1-npi_present=0	1		Some guys explain that the gals have known the lady on occasion .
experiment=NPI-env=determiner_negation_biclausal-npi=yet-crucial_item=some-licensor=0-scope=0-npi_present=1	0		the guys explain yet that some gals have known the lady .
experiment=NPI-env=determiner_negation_biclausal-npi=yet-crucial_item=some-licensor=0-scope=0-npi_present=0	1		the guys explain on occasion that some gals have known the lady .
