experiment=NPI-env=adverbs-npi=inyears-crucial_item=sometimes-licensor=0-scope=1-npi_present=0	1		the adults who sometimes loved ladies as well have profited .
experiment=NPI-env=adverbs-npi=inyears-crucial_item=sometimes-licensor=0-scope=0-npi_present=1	0		the adults who sometimes loved ladies have profited in years .
experiment=NPI-env=adverbs-npi=inyears-crucial_item=sometimes-licensor=0-scope=0-npi_present=0	1		the adults who sometimes loved ladies have profited as well .
experiment=NPI-env=adverbs-npi=inyears-crucial_item=barely-licensor=1-scope=1-npi_present=1	1		the adults who barely loved ladies in years have profited .
experiment=NPI-env=adverbs-npi=inyears-crucial_item=barely-licensor=1-scope=1-npi_present=0	1		the adults who barely loved ladies as well have profited .
experiment=NPI-env=adverbs-npi=inyears-crucial_item=barely-licensor=1-scope=0-npi_present=1	0		the adults who barely loved ladies have profited in years .
experiment=NPI-env=adverbs-npi=inyears-crucial_item=barely-licensor=1-scope=0-npi_present=0	1		the adults who barely loved ladies have profited as well .
experiment=NPI-env=adverbs-npi=inyears-crucial_item=sometimes-licensor=0-scope=1-npi_present=1	0		the children who have sometimes shouted in years have answered .
experiment=NPI-env=adverbs-npi=inyears-crucial_item=sometimes-licensor=0-scope=1-npi_present=0	1		the children who have sometimes shouted for a while have answered .
experiment=NPI-env=adverbs-npi=inyears-crucial_item=sometimes-licensor=0-scope=0-npi_present=1	0		the children who have sometimes shouted have answered in years .
experiment=NPI-env=adverbs-npi=inyears-crucial_item=sometimes-licensor=0-scope=0-npi_present=0	1		the children who have sometimes shouted have answered for a while .
experiment=NPI-env=adverbs-npi=inyears-crucial_item=rarely-licensor=1-scope=1-npi_present=1	1		the children who have rarely shouted in years have answered .
experiment=NPI-env=adverbs-npi=inyears-crucial_item=rarely-licensor=1-scope=1-npi_present=0	1		the children who have rarely shouted for a while have answered .
experiment=NPI-env=adverbs-npi=inyears-crucial_item=rarely-licensor=1-scope=0-npi_present=1	0		the children who have rarely shouted have answered in years .
experiment=NPI-env=adverbs-npi=inyears-crucial_item=rarely-licensor=1-scope=0-npi_present=0	1		the children who have rarely shouted have answered for a while .
experiment=NPI-env=adverbs-npi=inyears-crucial_item=sometimes-licensor=0-scope=1-npi_present=1	0		the waitresses who have sometimes died in years saw .
experiment=NPI-env=adverbs-npi=inyears-crucial_item=sometimes-licensor=0-scope=1-npi_present=0	1		the waitresses who have sometimes died on occasion saw .
experiment=NPI-env=adverbs-npi=inyears-crucial_item=sometimes-licensor=0-scope=0-npi_present=1	0		the waitresses who have sometimes died saw in years .
experiment=NPI-env=adverbs-npi=inyears-crucial_item=sometimes-licensor=0-scope=0-npi_present=0	1		the waitresses who have sometimes died saw on occasion .
experiment=NPI-env=adverbs-npi=inyears-crucial_item=rarely-licensor=1-scope=1-npi_present=1	1		the waitresses who have rarely died in years saw .
experiment=NPI-env=adverbs-npi=inyears-crucial_item=rarely-licensor=1-scope=1-npi_present=0	1		the waitresses who have rarely died on occasion saw .
experiment=NPI-env=adverbs-npi=inyears-crucial_item=rarely-licensor=1-scope=0-npi_present=1	0		the waitresses who have rarely died saw in years .
experiment=NPI-env=adverbs-npi=inyears-crucial_item=rarely-licensor=1-scope=0-npi_present=0	1		the waitresses who have rarely died saw on occasion .
experiment=NPI-env=adverbs-npi=inyears-crucial_item=often-licensor=0-scope=1-npi_present=1	0		the gal who has often yelled in years had concurred .
experiment=NPI-env=adverbs-npi=inyears-crucial_item=often-licensor=0-scope=1-npi_present=0	1		the gal who has often yelled on weekends had concurred .
experiment=NPI-env=adverbs-npi=inyears-crucial_item=often-licensor=0-scope=0-npi_present=1	0		the gal who has often yelled had concurred in years .
experiment=NPI-env=adverbs-npi=inyears-crucial_item=often-licensor=0-scope=0-npi_present=0	1		the gal who has often yelled had concurred on weekends .
experiment=NPI-env=adverbs-npi=inyears-crucial_item=hardly-licensor=1-scope=1-npi_present=1	1		the gal who has hardly yelled in years had concurred .
experiment=NPI-env=adverbs-npi=inyears-crucial_item=hardly-licensor=1-scope=1-npi_present=0	1		the gal who has hardly yelled on weekends had concurred .
experiment=NPI-env=adverbs-npi=inyears-crucial_item=hardly-licensor=1-scope=0-npi_present=1	0		the gal who has hardly yelled had concurred in years .
experiment=NPI-env=adverbs-npi=inyears-crucial_item=hardly-licensor=1-scope=0-npi_present=0	1		the gal who has hardly yelled had concurred on weekends .
experiment=NPI-env=adverbs-npi=inyears-crucial_item=often-licensor=0-scope=1-npi_present=1	0		a child who has often disliked people in years has baked .
experiment=NPI-env=adverbs-npi=inyears-crucial_item=often-licensor=0-scope=1-npi_present=0	1		a child who has often disliked people for a while has baked .
experiment=NPI-env=adverbs-npi=inyears-crucial_item=often-licensor=0-scope=0-npi_present=1	0		a child who has often disliked people has baked in years .
experiment=NPI-env=adverbs-npi=inyears-crucial_item=often-licensor=0-scope=0-npi_present=0	1		a child who has often disliked people has baked for a while .
experiment=NPI-env=adverbs-npi=inyears-crucial_item=seldom-licensor=1-scope=1-npi_present=1	1		a child who has seldom disliked people in years has baked .
experiment=NPI-env=adverbs-npi=inyears-crucial_item=seldom-licensor=1-scope=1-npi_present=0	1		a child who has seldom disliked people for a while has baked .
experiment=NPI-env=adverbs-npi=inyears-crucial_item=seldom-licensor=1-scope=0-npi_present=1	0		a child who has seldom disliked people has baked in years .
experiment=NPI-env=adverbs-npi=inyears-crucial_item=seldom-licensor=1-scope=0-npi_present=0	1		a child who has seldom disliked people has baked for a while .
experiment=NPI-env=adverbs-npi=inyears-crucial_item=sometimes-licensor=0-scope=1-npi_present=1	0		the customers who sometimes insulted newspaper articles in years had returned to waitresses .
experiment=NPI-env=adverbs-npi=inyears-crucial_item=sometimes-licensor=0-scope=1-npi_present=0	1		the customers who sometimes insulted newspaper articles on occasion had returned to waitresses .
experiment=NPI-env=adverbs-npi=inyears-crucial_item=sometimes-licensor=0-scope=0-npi_present=1	0		the customers who sometimes insulted newspaper articles had returned to waitresses in years .
experiment=NPI-env=adverbs-npi=inyears-crucial_item=sometimes-licensor=0-scope=0-npi_present=0	1		the customers who sometimes insulted newspaper articles had returned to waitresses on occasion .
experiment=NPI-env=adverbs-npi=inyears-crucial_item=hardly-licensor=1-scope=1-npi_present=1	1		the customers who hardly insulted newspaper articles in years had returned to waitresses .
experiment=NPI-env=adverbs-npi=inyears-crucial_item=hardly-licensor=1-scope=1-npi_present=0	1		the customers who hardly insulted newspaper articles on occasion had returned to waitresses .
experiment=NPI-env=adverbs-npi=inyears-crucial_item=hardly-licensor=1-scope=0-npi_present=1	0		the customers who hardly insulted newspaper articles had returned to waitresses in years .
experiment=NPI-env=adverbs-npi=inyears-crucial_item=hardly-licensor=1-scope=0-npi_present=0	1		the customers who hardly insulted newspaper articles had returned to waitresses on occasion .
experiment=NPI-env=adverbs-npi=inyears-crucial_item=always-licensor=0-scope=1-npi_present=1	0		the humans who always divorced in years went fishing .
experiment=NPI-env=adverbs-npi=inyears-crucial_item=always-licensor=0-scope=1-npi_present=0	1		the humans who always divorced on occasion went fishing .
experiment=NPI-env=adverbs-npi=inyears-crucial_item=always-licensor=0-scope=0-npi_present=1	0		the humans who always divorced went fishing in years .
experiment=NPI-env=adverbs-npi=inyears-crucial_item=always-licensor=0-scope=0-npi_present=0	1		the humans who always divorced went fishing on occasion .
experiment=NPI-env=adverbs-npi=inyears-crucial_item=scarcely-licensor=1-scope=1-npi_present=1	1		the humans who scarcely divorced in years went fishing .
experiment=NPI-env=adverbs-npi=inyears-crucial_item=scarcely-licensor=1-scope=1-npi_present=0	1		the humans who scarcely divorced on occasion went fishing .
experiment=NPI-env=adverbs-npi=inyears-crucial_item=scarcely-licensor=1-scope=0-npi_present=1	0		the humans who scarcely divorced went fishing in years .
experiment=NPI-env=adverbs-npi=inyears-crucial_item=scarcely-licensor=1-scope=0-npi_present=0	1		the humans who scarcely divorced went fishing on occasion .
experiment=NPI-env=adverbs-npi=inyears-crucial_item=often-licensor=0-scope=1-npi_present=1	0		the actresses who had often flirted in years had joked around .
experiment=NPI-env=adverbs-npi=inyears-crucial_item=often-licensor=0-scope=1-npi_present=0	1		the actresses who had often flirted on occasion had joked around .
experiment=NPI-env=adverbs-npi=inyears-crucial_item=often-licensor=0-scope=0-npi_present=1	0		the actresses who had often flirted had joked around in years .
experiment=NPI-env=adverbs-npi=inyears-crucial_item=often-licensor=0-scope=0-npi_present=0	1		the actresses who had often flirted had joked around on occasion .
experiment=NPI-env=adverbs-npi=inyears-crucial_item=seldom-licensor=1-scope=1-npi_present=1	1		the actresses who had seldom flirted in years had joked around .
experiment=NPI-env=adverbs-npi=inyears-crucial_item=seldom-licensor=1-scope=1-npi_present=0	1		the actresses who had seldom flirted on occasion had joked around .
experiment=NPI-env=adverbs-npi=inyears-crucial_item=seldom-licensor=1-scope=0-npi_present=1	0		the actresses who had seldom flirted had joked around in years .
experiment=NPI-env=adverbs-npi=inyears-crucial_item=seldom-licensor=1-scope=0-npi_present=0	1		the actresses who had seldom flirted had joked around on occasion .
experiment=NPI-env=adverbs-npi=inyears-crucial_item=sometimes-licensor=0-scope=1-npi_present=1	0		the doctors who had sometimes disagreed in years slumped over .
experiment=NPI-env=adverbs-npi=inyears-crucial_item=sometimes-licensor=0-scope=1-npi_present=0	1		the doctors who had sometimes disagreed on occasion slumped over .
experiment=NPI-env=adverbs-npi=inyears-crucial_item=sometimes-licensor=0-scope=0-npi_present=1	0		the doctors who had sometimes disagreed slumped over in years .
experiment=NPI-env=adverbs-npi=inyears-crucial_item=sometimes-licensor=0-scope=0-npi_present=0	1		the doctors who had sometimes disagreed slumped over on occasion .
experiment=NPI-env=adverbs-npi=inyears-crucial_item=barely-licensor=1-scope=1-npi_present=1	1		the doctors who had barely disagreed in years slumped over .
experiment=NPI-env=adverbs-npi=inyears-crucial_item=barely-licensor=1-scope=1-npi_present=0	1		the doctors who had barely disagreed on occasion slumped over .
experiment=NPI-env=adverbs-npi=inyears-crucial_item=barely-licensor=1-scope=0-npi_present=1	0		the doctors who had barely disagreed slumped over in years .
experiment=NPI-env=adverbs-npi=inyears-crucial_item=barely-licensor=1-scope=0-npi_present=0	1		the doctors who had barely disagreed slumped over on occasion .
experiment=NPI-env=adverbs-npi=inyears-crucial_item=always-licensor=0-scope=1-npi_present=1	0		the guys who always worked with adults in years waved .
experiment=NPI-env=adverbs-npi=inyears-crucial_item=always-licensor=0-scope=1-npi_present=0	1		the guys who always worked with adults on weekends waved .
experiment=NPI-env=adverbs-npi=inyears-crucial_item=always-licensor=0-scope=0-npi_present=1	0		the guys who always worked with adults waved in years .
experiment=NPI-env=adverbs-npi=inyears-crucial_item=always-licensor=0-scope=0-npi_present=0	1		the guys who always worked with adults waved on weekends .
experiment=NPI-env=adverbs-npi=inyears-crucial_item=scarcely-licensor=1-scope=1-npi_present=1	1		the guys who scarcely worked with adults in years waved .
experiment=NPI-env=adverbs-npi=inyears-crucial_item=scarcely-licensor=1-scope=1-npi_present=0	1		the guys who scarcely worked with adults on weekends waved .
experiment=NPI-env=adverbs-npi=inyears-crucial_item=scarcely-licensor=1-scope=0-npi_present=1	0		the guys who scarcely worked with adults waved in years .
experiment=NPI-env=adverbs-npi=inyears-crucial_item=scarcely-licensor=1-scope=0-npi_present=0	1		the guys who scarcely worked with adults waved on weekends .
experiment=NPI-env=adverbs-npi=inyears-crucial_item=sometimes-licensor=0-scope=1-npi_present=1	0		the doctors who had sometimes forfeited in years had conspired .
experiment=NPI-env=adverbs-npi=inyears-crucial_item=sometimes-licensor=0-scope=1-npi_present=0	1		the doctors who had sometimes forfeited for a while had conspired .
experiment=NPI-env=adverbs-npi=inyears-crucial_item=sometimes-licensor=0-scope=0-npi_present=1	0		the doctors who had sometimes forfeited had conspired in years .
experiment=NPI-env=adverbs-npi=inyears-crucial_item=sometimes-licensor=0-scope=0-npi_present=0	1		the doctors who had sometimes forfeited had conspired for a while .
experiment=NPI-env=adverbs-npi=inyears-crucial_item=barely-licensor=1-scope=1-npi_present=1	1		the doctors who had barely forfeited in years had conspired .
experiment=NPI-env=adverbs-npi=inyears-crucial_item=barely-licensor=1-scope=1-npi_present=0	1		the doctors who had barely forfeited for a while had conspired .
experiment=NPI-env=adverbs-npi=inyears-crucial_item=barely-licensor=1-scope=0-npi_present=1	0		the doctors who had barely forfeited had conspired in years .
experiment=NPI-env=adverbs-npi=inyears-crucial_item=barely-licensor=1-scope=0-npi_present=0	1		the doctors who had barely forfeited had conspired for a while .
experiment=NPI-env=adverbs-npi=inyears-crucial_item=often-licensor=0-scope=1-npi_present=1	0		the people who had often worked hard in years argued .
experiment=NPI-env=adverbs-npi=inyears-crucial_item=often-licensor=0-scope=1-npi_present=0	1		the people who had often worked hard as well argued .
experiment=NPI-env=adverbs-npi=inyears-crucial_item=often-licensor=0-scope=0-npi_present=1	0		the people who had often worked hard argued in years .
experiment=NPI-env=adverbs-npi=inyears-crucial_item=often-licensor=0-scope=0-npi_present=0	1		the people who had often worked hard argued as well .
experiment=NPI-env=adverbs-npi=inyears-crucial_item=barely-licensor=1-scope=1-npi_present=1	1		the people who had barely worked hard in years argued .
experiment=NPI-env=adverbs-npi=inyears-crucial_item=barely-licensor=1-scope=1-npi_present=0	1		the people who had barely worked hard as well argued .
experiment=NPI-env=adverbs-npi=inyears-crucial_item=barely-licensor=1-scope=0-npi_present=1	0		the people who had barely worked hard argued in years .
experiment=NPI-env=adverbs-npi=inyears-crucial_item=barely-licensor=1-scope=0-npi_present=0	1		the people who had barely worked hard argued as well .
experiment=NPI-env=adverbs-npi=inyears-crucial_item=sometimes-licensor=0-scope=1-npi_present=1	0		a student who sometimes broke books in years telephoned .
experiment=NPI-env=adverbs-npi=inyears-crucial_item=sometimes-licensor=0-scope=1-npi_present=0	1		a student who sometimes broke books on occasion telephoned .
experiment=NPI-env=adverbs-npi=inyears-crucial_item=sometimes-licensor=0-scope=0-npi_present=1	0		a student who sometimes broke books telephoned in years .
experiment=NPI-env=adverbs-npi=inyears-crucial_item=sometimes-licensor=0-scope=0-npi_present=0	1		a student who sometimes broke books telephoned on occasion .
experiment=NPI-env=adverbs-npi=inyears-crucial_item=barely-licensor=1-scope=1-npi_present=1	1		a student who barely broke books in years telephoned .
experiment=NPI-env=adverbs-npi=inyears-crucial_item=barely-licensor=1-scope=1-npi_present=0	1		a student who barely broke books on occasion telephoned .
experiment=NPI-env=adverbs-npi=inyears-crucial_item=barely-licensor=1-scope=0-npi_present=1	0		a student who barely broke books telephoned in years .
experiment=NPI-env=adverbs-npi=inyears-crucial_item=barely-licensor=1-scope=0-npi_present=0	1		a student who barely broke books telephoned on occasion .
experiment=NPI-env=adverbs-npi=inyears-crucial_item=always-licensor=0-scope=1-npi_present=1	0		the waitress who always approved in years had explained everything .
experiment=NPI-env=adverbs-npi=inyears-crucial_item=always-licensor=0-scope=1-npi_present=0	1		the waitress who always approved regularly had explained everything .
experiment=NPI-env=adverbs-npi=inyears-crucial_item=always-licensor=0-scope=0-npi_present=1	0		the waitress who always approved had explained everything in years .
experiment=NPI-env=adverbs-npi=inyears-crucial_item=always-licensor=0-scope=0-npi_present=0	1		the waitress who always approved had explained everything regularly .
experiment=NPI-env=adverbs-npi=inyears-crucial_item=seldom-licensor=1-scope=1-npi_present=1	1		the waitress who seldom approved in years had explained everything .
experiment=NPI-env=adverbs-npi=inyears-crucial_item=seldom-licensor=1-scope=1-npi_present=0	1		the waitress who seldom approved regularly had explained everything .
experiment=NPI-env=adverbs-npi=inyears-crucial_item=seldom-licensor=1-scope=0-npi_present=1	0		the waitress who seldom approved had explained everything in years .
experiment=NPI-env=adverbs-npi=inyears-crucial_item=seldom-licensor=1-scope=0-npi_present=0	1		the waitress who seldom approved had explained everything regularly .
experiment=NPI-env=adverbs-npi=inyears-crucial_item=always-licensor=0-scope=1-npi_present=1	0		the waitresses who always surrendered in years explored schools .
experiment=NPI-env=adverbs-npi=inyears-crucial_item=always-licensor=0-scope=1-npi_present=0	1		the waitresses who always surrendered as well explored schools .
experiment=NPI-env=adverbs-npi=inyears-crucial_item=always-licensor=0-scope=0-npi_present=1	0		the waitresses who always surrendered explored schools in years .
experiment=NPI-env=adverbs-npi=inyears-crucial_item=always-licensor=0-scope=0-npi_present=0	1		the waitresses who always surrendered explored schools as well .
experiment=NPI-env=adverbs-npi=inyears-crucial_item=rarely-licensor=1-scope=1-npi_present=1	1		the waitresses who rarely surrendered in years explored schools .
experiment=NPI-env=adverbs-npi=inyears-crucial_item=rarely-licensor=1-scope=1-npi_present=0	1		the waitresses who rarely surrendered as well explored schools .
experiment=NPI-env=adverbs-npi=inyears-crucial_item=rarely-licensor=1-scope=0-npi_present=1	0		the waitresses who rarely surrendered explored schools in years .
experiment=NPI-env=adverbs-npi=inyears-crucial_item=rarely-licensor=1-scope=0-npi_present=0	1		the waitresses who rarely surrendered explored schools as well .
experiment=NPI-env=adverbs-npi=inyears-crucial_item=always-licensor=0-scope=1-npi_present=1	0		the actresses who always reunited in years had struggled .
experiment=NPI-env=adverbs-npi=inyears-crucial_item=always-licensor=0-scope=1-npi_present=0	1		the actresses who always reunited on occasion had struggled .
experiment=NPI-env=adverbs-npi=inyears-crucial_item=always-licensor=0-scope=0-npi_present=1	0		the actresses who always reunited had struggled in years .
experiment=NPI-env=adverbs-npi=inyears-crucial_item=always-licensor=0-scope=0-npi_present=0	1		the actresses who always reunited had struggled on occasion .
experiment=NPI-env=adverbs-npi=inyears-crucial_item=barely-licensor=1-scope=1-npi_present=1	1		the actresses who barely reunited in years had struggled .
experiment=NPI-env=adverbs-npi=inyears-crucial_item=barely-licensor=1-scope=1-npi_present=0	1		the actresses who barely reunited on occasion had struggled .
experiment=NPI-env=adverbs-npi=inyears-crucial_item=barely-licensor=1-scope=0-npi_present=1	0		the actresses who barely reunited had struggled in years .
experiment=NPI-env=adverbs-npi=inyears-crucial_item=barely-licensor=1-scope=0-npi_present=0	1		the actresses who barely reunited had struggled on occasion .
experiment=NPI-env=adverbs-npi=either-crucial_item=always-licensor=0-scope=1-npi_present=1	0		the lady who would always scratch either ate .
experiment=NPI-env=adverbs-npi=either-crucial_item=always-licensor=0-scope=1-npi_present=0	1		the lady who would always scratch on occasion ate .
experiment=NPI-env=adverbs-npi=either-crucial_item=always-licensor=0-scope=0-npi_present=1	0		the lady who would always scratch ate either .
experiment=NPI-env=adverbs-npi=either-crucial_item=always-licensor=0-scope=0-npi_present=0	1		the lady who would always scratch ate on occasion .
experiment=NPI-env=adverbs-npi=either-crucial_item=hardly-licensor=1-scope=1-npi_present=1	1		the lady who would hardly scratch either ate .
experiment=NPI-env=adverbs-npi=either-crucial_item=hardly-licensor=1-scope=1-npi_present=0	1		the lady who would hardly scratch on occasion ate .
experiment=NPI-env=adverbs-npi=either-crucial_item=hardly-licensor=1-scope=0-npi_present=1	0		the lady who would hardly scratch ate either .
experiment=NPI-env=adverbs-npi=either-crucial_item=hardly-licensor=1-scope=0-npi_present=0	1		the lady who would hardly scratch ate on occasion .
experiment=NPI-env=adverbs-npi=either-crucial_item=often-licensor=0-scope=1-npi_present=1	0		the guests who have often cried either cried .
experiment=NPI-env=adverbs-npi=either-crucial_item=often-licensor=0-scope=1-npi_present=0	1		the guests who have often cried regularly cried .
experiment=NPI-env=adverbs-npi=either-crucial_item=often-licensor=0-scope=0-npi_present=1	0		the guests who have often cried cried either .
experiment=NPI-env=adverbs-npi=either-crucial_item=often-licensor=0-scope=0-npi_present=0	1		the guests who have often cried cried regularly .
experiment=NPI-env=adverbs-npi=either-crucial_item=rarely-licensor=1-scope=1-npi_present=1	1		the guests who have rarely cried either cried .
experiment=NPI-env=adverbs-npi=either-crucial_item=rarely-licensor=1-scope=1-npi_present=0	1		the guests who have rarely cried regularly cried .
experiment=NPI-env=adverbs-npi=either-crucial_item=rarely-licensor=1-scope=0-npi_present=1	0		the guests who have rarely cried cried either .
experiment=NPI-env=adverbs-npi=either-crucial_item=rarely-licensor=1-scope=0-npi_present=0	1		the guests who have rarely cried cried regularly .
experiment=NPI-env=adverbs-npi=either-crucial_item=often-licensor=0-scope=1-npi_present=1	0		the actresses who should often reunite either do benefit .
experiment=NPI-env=adverbs-npi=either-crucial_item=often-licensor=0-scope=1-npi_present=0	1		the actresses who should often reunite on weekends do benefit .
experiment=NPI-env=adverbs-npi=either-crucial_item=often-licensor=0-scope=0-npi_present=1	0		the actresses who should often reunite do benefit either .
experiment=NPI-env=adverbs-npi=either-crucial_item=often-licensor=0-scope=0-npi_present=0	1		the actresses who should often reunite do benefit on weekends .
experiment=NPI-env=adverbs-npi=either-crucial_item=scarcely-licensor=1-scope=1-npi_present=1	1		the actresses who should scarcely reunite either do benefit .
experiment=NPI-env=adverbs-npi=either-crucial_item=scarcely-licensor=1-scope=1-npi_present=0	1		the actresses who should scarcely reunite on weekends do benefit .
experiment=NPI-env=adverbs-npi=either-crucial_item=scarcely-licensor=1-scope=0-npi_present=1	0		the actresses who should scarcely reunite do benefit either .
experiment=NPI-env=adverbs-npi=either-crucial_item=scarcely-licensor=1-scope=0-npi_present=0	1		the actresses who should scarcely reunite do benefit on weekends .
experiment=NPI-env=adverbs-npi=either-crucial_item=always-licensor=0-scope=1-npi_present=1	0		the waiters who had always blinked either retaliate .
experiment=NPI-env=adverbs-npi=either-crucial_item=always-licensor=0-scope=1-npi_present=0	1		the waiters who had always blinked on occasion retaliate .
experiment=NPI-env=adverbs-npi=either-crucial_item=always-licensor=0-scope=0-npi_present=1	0		the waiters who had always blinked retaliate either .
experiment=NPI-env=adverbs-npi=either-crucial_item=always-licensor=0-scope=0-npi_present=0	1		the waiters who had always blinked retaliate on occasion .
experiment=NPI-env=adverbs-npi=either-crucial_item=rarely-licensor=1-scope=1-npi_present=1	1		the waiters who had rarely blinked either retaliate .
experiment=NPI-env=adverbs-npi=either-crucial_item=rarely-licensor=1-scope=1-npi_present=0	1		the waiters who had rarely blinked on occasion retaliate .
experiment=NPI-env=adverbs-npi=either-crucial_item=rarely-licensor=1-scope=0-npi_present=1	0		the waiters who had rarely blinked retaliate either .
experiment=NPI-env=adverbs-npi=either-crucial_item=rarely-licensor=1-scope=0-npi_present=0	1		the waiters who had rarely blinked retaliate on occasion .
experiment=NPI-env=adverbs-npi=either-crucial_item=often-licensor=0-scope=1-npi_present=1	0		the guys who could often date either leave customers .
experiment=NPI-env=adverbs-npi=either-crucial_item=often-licensor=0-scope=1-npi_present=0	1		the guys who could often date on occasion leave customers .
experiment=NPI-env=adverbs-npi=either-crucial_item=often-licensor=0-scope=0-npi_present=1	0		the guys who could often date leave customers either .
experiment=NPI-env=adverbs-npi=either-crucial_item=often-licensor=0-scope=0-npi_present=0	1		the guys who could often date leave customers on occasion .
experiment=NPI-env=adverbs-npi=either-crucial_item=seldom-licensor=1-scope=1-npi_present=1	1		the guys who could seldom date either leave customers .
experiment=NPI-env=adverbs-npi=either-crucial_item=seldom-licensor=1-scope=1-npi_present=0	1		the guys who could seldom date on occasion leave customers .
experiment=NPI-env=adverbs-npi=either-crucial_item=seldom-licensor=1-scope=0-npi_present=1	0		the guys who could seldom date leave customers either .
