experiment=NPI_env=quantifier_npi=any_licensor=1_scope=0_npi-present=0	1		every guy who buys cars is bringing the rugs .
experiment=NPI_env=quantifier_npi=any_licensor=1_scope=1_npi-present=1	1		no student who sold any forks is buying more than three forks .
experiment=NPI_env=quantifier_npi=any_licensor=1_scope=1_npi-present=0	1		no student who sold the forks is buying more than three forks .
experiment=NPI_env=quantifier_npi=any_licensor=1_scope=1_npi-present=1	1		no student who sold the forks is buying any forks .
experiment=NPI_env=quantifier_npi=any_licensor=1_scope=1_npi-present=0	1		no student who sold the forks is buying the forks .
experiment=NPI_env=quantifier_npi=any_licensor=1_scope=1_npi-present=1	1		all dudes who do have any glasses had sold more than three chairs .
experiment=NPI_env=quantifier_npi=any_licensor=1_scope=1_npi-present=0	1		all dudes who do have the glasses had sold more than three chairs .
experiment=NPI_env=quantifier_npi=any_licensor=1_scope=0_npi-present=1	0		all dudes who do have the glasses had sold any chairs .
experiment=NPI_env=quantifier_npi=any_licensor=1_scope=0_npi-present=0	1		all dudes who do have the glasses had sold the chairs .
experiment=NPI_env=quantifier_npi=any_licensor=0_scope=1_npi-present=1	0		many boys who were admiring any pants liked some chairs .
experiment=NPI_env=quantifier_npi=any_licensor=0_scope=1_npi-present=0	1		many boys who were admiring the pants liked some chairs .
experiment=NPI_env=quantifier_npi=any_licensor=0_scope=0_npi-present=1	0		many boys who were admiring many pants liked any chairs .
experiment=NPI_env=quantifier_npi=any_licensor=0_scope=0_npi-present=0	1		many boys who were admiring many pants liked the chairs .
experiment=NPI_env=quantifier_npi=any_licensor=1_scope=1_npi-present=1	1		no dude who breaks any glasses is lifting some pants .
experiment=NPI_env=quantifier_npi=any_licensor=1_scope=1_npi-present=0	1		no dude who breaks the glasses is lifting some pants .
experiment=NPI_env=quantifier_npi=any_licensor=1_scope=1_npi-present=1	1		no dude who breaks many glasses is lifting any pants .
experiment=NPI_env=quantifier_npi=any_licensor=1_scope=1_npi-present=0	1		no dude who breaks many glasses is lifting the pants .
experiment=NPI_env=quantifier_npi=any_licensor=1_scope=1_npi-present=1	1		no human who took any gloves had bought a lot of forks .
experiment=NPI_env=quantifier_npi=any_licensor=1_scope=1_npi-present=0	1		no human who took the gloves had bought a lot of forks .
experiment=NPI_env=quantifier_npi=any_licensor=1_scope=1_npi-present=1	1		no human who took many gloves had bought any forks .
experiment=NPI_env=quantifier_npi=any_licensor=1_scope=1_npi-present=0	1		no human who took many gloves had bought the forks .
experiment=NPI_env=quantifier_npi=any_licensor=0_scope=1_npi-present=1	0		a lot of waitresses who do lift any pants might bring forks .
experiment=NPI_env=quantifier_npi=any_licensor=0_scope=1_npi-present=0	1		a lot of waitresses who do lift the pants might bring forks .
experiment=NPI_env=quantifier_npi=any_licensor=0_scope=0_npi-present=1	0		a lot of waitresses who do lift a lot of pants might bring any forks .
experiment=NPI_env=quantifier_npi=any_licensor=0_scope=0_npi-present=0	1		a lot of waitresses who do lift a lot of pants might bring the forks .
experiment=NPI_env=quantifier_npi=any_licensor=1_scope=1_npi-present=1	1		few ladies who had brought any gloves has the shoes .
experiment=NPI_env=quantifier_npi=any_licensor=1_scope=1_npi-present=0	1		few ladies who had brought the gloves has the shoes .
experiment=NPI_env=quantifier_npi=any_licensor=1_scope=1_npi-present=1	1		few ladies who had brought a lot of gloves has any shoes .
experiment=NPI_env=quantifier_npi=any_licensor=1_scope=1_npi-present=0	1		few ladies who had brought a lot of gloves has the shoes .
experiment=NPI_env=quantifier_npi=any_licensor=0_scope=1_npi-present=1	0		many students who could lift any pants could lift the books .
experiment=NPI_env=quantifier_npi=any_licensor=0_scope=1_npi-present=0	1		many students who could lift the pants could lift the books .
experiment=NPI_env=quantifier_npi=any_licensor=0_scope=0_npi-present=1	0		many students who could lift many pants could lift any books .
experiment=NPI_env=quantifier_npi=any_licensor=0_scope=0_npi-present=0	1		many students who could lift many pants could lift the books .
experiment=NPI_env=quantifier_npi=any_licensor=0_scope=1_npi-present=1	0		the guests who did wear any shoes will admire the glasses .
experiment=NPI_env=quantifier_npi=any_licensor=0_scope=1_npi-present=0	1		the guests who did wear the shoes will admire the glasses .
experiment=NPI_env=quantifier_npi=any_licensor=0_scope=0_npi-present=1	0		the guests who did wear some shoes will admire any glasses .
experiment=NPI_env=quantifier_npi=any_licensor=0_scope=0_npi-present=0	1		the guests who did wear some shoes will admire the glasses .
experiment=NPI_env=quantifier_npi=any_licensor=1_scope=1_npi-present=1	1		all students who took any cars will break a lot of chairs .
experiment=NPI_env=quantifier_npi=any_licensor=1_scope=1_npi-present=0	1		all students who took the cars will break a lot of chairs .
experiment=NPI_env=quantifier_npi=any_licensor=1_scope=0_npi-present=1	0		all students who took some cars will break any chairs .
experiment=NPI_env=quantifier_npi=any_licensor=1_scope=0_npi-present=0	1		all students who took some cars will break the chairs .
experiment=NPI_env=quantifier_npi=any_licensor=1_scope=1_npi-present=1	1		no child who will see any forks wears many shoes .
experiment=NPI_env=quantifier_npi=any_licensor=1_scope=1_npi-present=0	1		no child who will see the forks wears many shoes .
experiment=NPI_env=quantifier_npi=any_licensor=1_scope=1_npi-present=1	1		no child who will see a lot of forks wears any shoes .
experiment=NPI_env=quantifier_npi=any_licensor=1_scope=1_npi-present=0	1		no child who will see a lot of forks wears the shoes .
experiment=NPI_env=quantifier_npi=any_licensor=0_scope=1_npi-present=1	0		the actress who had bought any books wears the glasses .
experiment=NPI_env=quantifier_npi=any_licensor=0_scope=1_npi-present=0	1		the actress who had bought the books wears the glasses .
experiment=NPI_env=quantifier_npi=any_licensor=0_scope=0_npi-present=1	0		the actress who had bought many books wears any glasses .
experiment=NPI_env=quantifier_npi=any_licensor=0_scope=0_npi-present=0	1		the actress who had bought many books wears the glasses .
experiment=NPI_env=quantifier_npi=any_licensor=0_scope=1_npi-present=1	0		a lot of customers who lift any books are buying gloves .
experiment=NPI_env=quantifier_npi=any_licensor=0_scope=1_npi-present=0	1		a lot of customers who lift the books are buying gloves .
experiment=NPI_env=quantifier_npi=any_licensor=0_scope=0_npi-present=1	0		a lot of customers who lift books are buying any gloves .
experiment=NPI_env=quantifier_npi=any_licensor=0_scope=0_npi-present=0	1		a lot of customers who lift books are buying the gloves .
experiment=NPI_env=quantifier_npi=any_licensor=1_scope=1_npi-present=1	1		no driver who is admiring any rugs has bought some cars .
experiment=NPI_env=quantifier_npi=any_licensor=1_scope=1_npi-present=0	1		no driver who is admiring the rugs has bought some cars .
experiment=NPI_env=quantifier_npi=any_licensor=1_scope=1_npi-present=1	1		no driver who is admiring the rugs has bought any cars .
experiment=NPI_env=quantifier_npi=any_licensor=1_scope=1_npi-present=0	1		no driver who is admiring the rugs has bought the cars .
experiment=NPI_env=quantifier_npi=any_licensor=1_scope=1_npi-present=1	1		no boy who could see any chairs is breaking some books .
experiment=NPI_env=quantifier_npi=any_licensor=1_scope=1_npi-present=0	1		no boy who could see the chairs is breaking some books .
experiment=NPI_env=quantifier_npi=any_licensor=1_scope=1_npi-present=1	1		no boy who could see a lot of chairs is breaking any books .
experiment=NPI_env=quantifier_npi=any_licensor=1_scope=1_npi-present=0	1		no boy who could see a lot of chairs is breaking the books .
experiment=NPI_env=quantifier_npi=any_licensor=1_scope=1_npi-present=1	1		few boys who sold any forks had bought many rugs .
experiment=NPI_env=quantifier_npi=any_licensor=1_scope=1_npi-present=0	1		few boys who sold the forks had bought many rugs .
experiment=NPI_env=quantifier_npi=any_licensor=1_scope=1_npi-present=1	1		few boys who sold many forks had bought any rugs .
experiment=NPI_env=quantifier_npi=any_licensor=1_scope=1_npi-present=0	1		few boys who sold many forks had bought the rugs .
experiment=NPI_env=quantifier_npi=any_licensor=0_scope=1_npi-present=1	0		some customers who had worn any gloves lift more than three rugs .
experiment=NPI_env=quantifier_npi=any_licensor=0_scope=1_npi-present=0	1		some customers who had worn the gloves lift more than three rugs .
experiment=NPI_env=quantifier_npi=any_licensor=0_scope=0_npi-present=1	0		some customers who had worn some gloves lift any rugs .
experiment=NPI_env=quantifier_npi=any_licensor=0_scope=0_npi-present=0	1		some customers who had worn some gloves lift the rugs .
experiment=NPI_env=quantifier_npi=any_licensor=1_scope=1_npi-present=1	1		no waitress who is wearing any gloves broke books .
experiment=NPI_env=quantifier_npi=any_licensor=1_scope=1_npi-present=0	1		no waitress who is wearing the gloves broke books .
experiment=NPI_env=quantifier_npi=any_licensor=1_scope=1_npi-present=1	1		no waitress who is wearing the gloves broke any books .
experiment=NPI_env=quantifier_npi=any_licensor=1_scope=1_npi-present=0	1		no waitress who is wearing the gloves broke the books .
experiment=NPI_env=quantifier_npi=any_licensor=0_scope=1_npi-present=1	0		the waitresses who are lifting any pants wear pants .
experiment=NPI_env=quantifier_npi=any_licensor=0_scope=1_npi-present=0	1		the waitresses who are lifting the pants wear pants .
experiment=NPI_env=quantifier_npi=any_licensor=0_scope=0_npi-present=1	0		the waitresses who are lifting some pants wear any pants .
experiment=NPI_env=quantifier_npi=any_licensor=0_scope=0_npi-present=0	1		the waitresses who are lifting some pants wear the pants .
experiment=NPI_env=quantifier_npi=any_licensor=0_scope=1_npi-present=1	0		many children who brought any pants admired some shoes .
experiment=NPI_env=quantifier_npi=any_licensor=0_scope=1_npi-present=0	1		many children who brought the pants admired some shoes .
experiment=NPI_env=quantifier_npi=any_licensor=0_scope=0_npi-present=1	0		many children who brought pants admired any shoes .
experiment=NPI_env=quantifier_npi=any_licensor=0_scope=0_npi-present=0	1		many children who brought pants admired the shoes .
experiment=NPI_env=quantifier_npi=any_licensor=1_scope=1_npi-present=1	1		few adults who might like any shoes should take many couches .
experiment=NPI_env=quantifier_npi=any_licensor=1_scope=1_npi-present=0	1		few adults who might like the shoes should take many couches .
experiment=NPI_env=quantifier_npi=any_licensor=1_scope=1_npi-present=1	1		few adults who might like many shoes should take any couches .
experiment=NPI_env=quantifier_npi=any_licensor=1_scope=1_npi-present=0	1		few adults who might like many shoes should take the couches .
experiment=NPI_env=quantifier_npi=any_licensor=0_scope=1_npi-present=1	0		the guy who brought any glasses liked more than three couches .
experiment=NPI_env=quantifier_npi=any_licensor=0_scope=1_npi-present=0	1		the guy who brought the glasses liked more than three couches .
experiment=NPI_env=quantifier_npi=any_licensor=0_scope=0_npi-present=1	0		the guy who brought a lot of glasses liked any couches .
experiment=NPI_env=quantifier_npi=any_licensor=0_scope=0_npi-present=0	1		the guy who brought a lot of glasses liked the couches .
experiment=NPI_env=quantifier_npi=any_licensor=0_scope=1_npi-present=1	0		the actress who has taken any books did lift more than three glasses .
experiment=NPI_env=quantifier_npi=any_licensor=0_scope=1_npi-present=0	1		the actress who has taken the books did lift more than three glasses .
experiment=NPI_env=quantifier_npi=any_licensor=0_scope=0_npi-present=1	0		the actress who has taken the books did lift any glasses .
experiment=NPI_env=quantifier_npi=any_licensor=0_scope=0_npi-present=0	1		the actress who has taken the books did lift the glasses .
experiment=NPI_env=quantifier_npi=any_licensor=1_scope=1_npi-present=1	1		few girls who broke any cups cleaned some rugs .
experiment=NPI_env=quantifier_npi=any_licensor=1_scope=1_npi-present=0	1		few girls who broke the cups cleaned some rugs .
experiment=NPI_env=quantifier_npi=any_licensor=1_scope=1_npi-present=1	1		few girls who broke more than three cups cleaned any rugs .
experiment=NPI_env=quantifier_npi=any_licensor=1_scope=1_npi-present=0	1		few girls who broke more than three cups cleaned the rugs .
experiment=NPI_env=quantifier_npi=any_licensor=1_scope=1_npi-present=1	1		no woman who had bought any cups sells a lot of forks .
experiment=NPI_env=quantifier_npi=any_licensor=1_scope=1_npi-present=0	1		no woman who had bought the cups sells a lot of forks .
experiment=NPI_env=quantifier_npi=any_licensor=1_scope=1_npi-present=1	1		no woman who had bought many cups sells any forks .
experiment=NPI_env=quantifier_npi=any_licensor=1_scope=1_npi-present=0	1		no woman who had bought many cups sells the forks .
experiment=NPI_env=quantifier_npi=any_licensor=0_scope=1_npi-present=1	0		a lot of women who can like any plates admired a lot of glasses .
experiment=NPI_env=quantifier_npi=any_licensor=0_scope=1_npi-present=0	1		a lot of women who can like the plates admired a lot of glasses .
experiment=NPI_env=quantifier_npi=any_licensor=0_scope=0_npi-present=1	0		a lot of women who can like some plates admired any glasses .
experiment=NPI_env=quantifier_npi=any_licensor=0_scope=0_npi-present=0	1		a lot of women who can like some plates admired the glasses .
experiment=NPI_env=quantifier_npi=any_licensor=0_scope=1_npi-present=1	0		some waiters who broke any cars lift the cups .
experiment=NPI_env=quantifier_npi=any_licensor=0_scope=1_npi-present=0	1		some waiters who broke the cars lift the cups .
experiment=NPI_env=quantifier_npi=any_licensor=0_scope=0_npi-present=1	0		some waiters who broke the cars lift any cups .
experiment=NPI_env=quantifier_npi=any_licensor=0_scope=0_npi-present=0	1		some waiters who broke the cars lift the cups .
experiment=NPI_env=quantifier_npi=any_licensor=0_scope=1_npi-present=1	0		the man who was bringing any forks was wearing the pants .
experiment=NPI_env=quantifier_npi=any_licensor=0_scope=1_npi-present=0	1		the man who was bringing the forks was wearing the pants .
experiment=NPI_env=quantifier_npi=any_licensor=0_scope=0_npi-present=1	0		the man who was bringing more than three forks was wearing any pants .
experiment=NPI_env=quantifier_npi=any_licensor=0_scope=0_npi-present=0	1		the man who was bringing more than three forks was wearing the pants .
experiment=NPI_env=quantifier_npi=any_licensor=0_scope=1_npi-present=1	0		many men who see any glasses saw some shoes .
experiment=NPI_env=quantifier_npi=any_licensor=0_scope=1_npi-present=0	1		many men who see the glasses saw some shoes .
experiment=NPI_env=quantifier_npi=any_licensor=0_scope=0_npi-present=1	0		many men who see more than three glasses saw any shoes .
experiment=NPI_env=quantifier_npi=any_licensor=0_scope=0_npi-present=0	1		many men who see more than three glasses saw the shoes .
experiment=NPI_env=quantifier_npi=any_licensor=1_scope=1_npi-present=1	1		no cashier who buys any glasses has bought the dishes .
experiment=NPI_env=quantifier_npi=any_licensor=1_scope=1_npi-present=0	1		no cashier who buys the glasses has bought the dishes .
experiment=NPI_env=quantifier_npi=any_licensor=1_scope=1_npi-present=1	1		no cashier who buys glasses has bought any dishes .
experiment=NPI_env=quantifier_npi=any_licensor=1_scope=1_npi-present=0	1		no cashier who buys glasses has bought the dishes .
experiment=NPI_env=quantifier_npi=any_licensor=0_scope=1_npi-present=1	0		the waitress who has bought any dishes can clean a lot of glasses .
experiment=NPI_env=quantifier_npi=any_licensor=0_scope=1_npi-present=0	1		the waitress who has bought the dishes can clean a lot of glasses .
experiment=NPI_env=quantifier_npi=any_licensor=0_scope=0_npi-present=1	0		the waitress who has bought the dishes can clean any glasses .
experiment=NPI_env=quantifier_npi=any_licensor=0_scope=0_npi-present=0	1		the waitress who has bought the dishes can clean the glasses .
experiment=NPI_env=quantifier_npi=any_licensor=0_scope=1_npi-present=1	0		actresses who had bought any cups were selling couches .
experiment=NPI_env=quantifier_npi=any_licensor=0_scope=1_npi-present=0	1		actresses who had bought the cups were selling couches .
experiment=NPI_env=quantifier_npi=any_licensor=0_scope=0_npi-present=1	0		actresses who had bought cups were selling any couches .
experiment=NPI_env=quantifier_npi=any_licensor=0_scope=0_npi-present=0	1		actresses who had bought cups were selling the couches .
experiment=NPI_env=quantifier_npi=any_licensor=1_scope=1_npi-present=1	1		every student who could have any forks has lifted the dishes .
experiment=NPI_env=quantifier_npi=any_licensor=1_scope=1_npi-present=0	1		every student who could have the forks has lifted the dishes .
experiment=NPI_env=quantifier_npi=any_licensor=1_scope=0_npi-present=1	0		every student who could have many forks has lifted any dishes .
experiment=NPI_env=quantifier_npi=any_licensor=1_scope=0_npi-present=0	1		every student who could have many forks has lifted the dishes .
experiment=NPI_env=quantifier_npi=any_licensor=1_scope=1_npi-present=1	1		every adult who would lift any plates had broken some books .
experiment=NPI_env=quantifier_npi=any_licensor=1_scope=1_npi-present=0	1		every adult who would lift the plates had broken some books .
experiment=NPI_env=quantifier_npi=any_licensor=1_scope=0_npi-present=1	0		every adult who would lift some plates had broken any books .
experiment=NPI_env=quantifier_npi=any_licensor=1_scope=0_npi-present=0	1		every adult who would lift some plates had broken the books .
experiment=NPI_env=quantifier_npi=any_licensor=1_scope=1_npi-present=1	1		no student who is cleaning any gloves breaks couches .
experiment=NPI_env=quantifier_npi=any_licensor=1_scope=1_npi-present=0	1		no student who is cleaning the gloves breaks couches .
experiment=NPI_env=quantifier_npi=any_licensor=1_scope=1_npi-present=1	1		no student who is cleaning some gloves breaks any couches .
experiment=NPI_env=quantifier_npi=any_licensor=1_scope=1_npi-present=0	1		no student who is cleaning some gloves breaks the couches .
experiment=NPI_env=quantifier_npi=any_licensor=0_scope=1_npi-present=1	0		some girls who can admire any cars might wear many shoes .
experiment=NPI_env=quantifier_npi=any_licensor=0_scope=1_npi-present=0	1		some girls who can admire the cars might wear many shoes .
experiment=NPI_env=quantifier_npi=any_licensor=0_scope=0_npi-present=1	0		some girls who can admire many cars might wear any shoes .
experiment=NPI_env=quantifier_npi=any_licensor=0_scope=0_npi-present=0	1		some girls who can admire many cars might wear the shoes .
experiment=NPI_env=quantifier_npi=any_licensor=1_scope=1_npi-present=1	1		few customers who wore any shoes are bringing many cups .
experiment=NPI_env=quantifier_npi=any_licensor=1_scope=1_npi-present=0	1		few customers who wore the shoes are bringing many cups .
experiment=NPI_env=quantifier_npi=any_licensor=1_scope=1_npi-present=1	1		few customers who wore the shoes are bringing any cups .
experiment=NPI_env=quantifier_npi=any_licensor=1_scope=1_npi-present=0	1		few customers who wore the shoes are bringing the cups .
experiment=NPI_env=quantifier_npi=any_licensor=1_scope=1_npi-present=1	1		no person who does sell any rugs had bought many rugs .
experiment=NPI_env=quantifier_npi=any_licensor=1_scope=1_npi-present=0	1		no person who does sell the rugs had bought many rugs .
experiment=NPI_env=quantifier_npi=any_licensor=1_scope=1_npi-present=1	1		no person who does sell the rugs had bought any rugs .
experiment=NPI_env=quantifier_npi=any_licensor=1_scope=1_npi-present=0	1		no person who does sell the rugs had bought the rugs .
experiment=NPI_env=quantifier_npi=any_licensor=0_scope=1_npi-present=1	0		the dude who can clean any glasses should break the chairs .
experiment=NPI_env=quantifier_npi=any_licensor=0_scope=1_npi-present=0	1		the dude who can clean the glasses should break the chairs .
experiment=NPI_env=quantifier_npi=any_licensor=0_scope=0_npi-present=1	0		the dude who can clean the glasses should break any chairs .
experiment=NPI_env=quantifier_npi=any_licensor=0_scope=0_npi-present=0	1		the dude who can clean the glasses should break the chairs .
experiment=NPI_env=quantifier_npi=any_licensor=0_scope=1_npi-present=1	0		the cashier who admires any pants can lift a lot of plates .
experiment=NPI_env=quantifier_npi=any_licensor=0_scope=1_npi-present=0	1		the cashier who admires the pants can lift a lot of plates .
experiment=NPI_env=quantifier_npi=any_licensor=0_scope=0_npi-present=1	0		the cashier who admires a lot of pants can lift any plates .
experiment=NPI_env=quantifier_npi=any_licensor=0_scope=0_npi-present=0	1		the cashier who admires a lot of pants can lift the plates .
experiment=NPI_env=quantifier_npi=any_licensor=1_scope=1_npi-present=1	1		fewer than three boys who will break any plates are taking a lot of cups .
experiment=NPI_env=quantifier_npi=any_licensor=1_scope=1_npi-present=0	1		fewer than three boys who will break the plates are taking a lot of cups .
experiment=NPI_env=quantifier_npi=any_licensor=1_scope=1_npi-present=1	1		fewer than three boys who will break some plates are taking any cups .
experiment=NPI_env=quantifier_npi=any_licensor=1_scope=1_npi-present=0	1		fewer than three boys who will break some plates are taking the cups .
experiment=NPI_env=quantifier_npi=any_licensor=0_scope=1_npi-present=1	0		some patient who sees any glasses might see a lot of chairs .
experiment=NPI_env=quantifier_npi=any_licensor=0_scope=1_npi-present=0	1		some patient who sees the glasses might see a lot of chairs .
experiment=NPI_env=quantifier_npi=any_licensor=0_scope=0_npi-present=1	0		some patient who sees the glasses might see any chairs .
experiment=NPI_env=quantifier_npi=any_licensor=0_scope=0_npi-present=0	1		some patient who sees the glasses might see the chairs .
experiment=NPI_env=quantifier_npi=any_licensor=1_scope=1_npi-present=1	1		no woman who would admire any cars wore the gloves .
experiment=NPI_env=quantifier_npi=any_licensor=1_scope=1_npi-present=0	1		no woman who would admire the cars wore the gloves .
experiment=NPI_env=quantifier_npi=any_licensor=1_scope=1_npi-present=1	1		no woman who would admire the cars wore any gloves .
experiment=NPI_env=quantifier_npi=any_licensor=1_scope=1_npi-present=0	1		no woman who would admire the cars wore the gloves .
experiment=NPI_env=quantifier_npi=any_licensor=0_scope=1_npi-present=1	0		many doctors who can have any shoes has more than three plates .
experiment=NPI_env=quantifier_npi=any_licensor=0_scope=1_npi-present=0	1		many doctors who can have the shoes has more than three plates .
experiment=NPI_env=quantifier_npi=any_licensor=0_scope=0_npi-present=1	0		many doctors who can have a lot of shoes has any plates .
experiment=NPI_env=quantifier_npi=any_licensor=0_scope=0_npi-present=0	1		many doctors who can have a lot of shoes has the plates .
experiment=NPI_env=quantifier_npi=any_licensor=0_scope=1_npi-present=1	0		some doctor who is wearing any shoes could break a lot of couches .
experiment=NPI_env=quantifier_npi=any_licensor=0_scope=1_npi-present=0	1		some doctor who is wearing the shoes could break a lot of couches .
experiment=NPI_env=quantifier_npi=any_licensor=0_scope=0_npi-present=1	0		some doctor who is wearing the shoes could break any couches .
experiment=NPI_env=quantifier_npi=any_licensor=0_scope=0_npi-present=0	1		some doctor who is wearing the shoes could break the couches .
experiment=NPI_env=quantifier_npi=any_licensor=0_scope=1_npi-present=1	0		a lot of students who admire any chairs are cleaning a lot of shoes .
experiment=NPI_env=quantifier_npi=any_licensor=0_scope=1_npi-present=0	1		a lot of students who admire the chairs are cleaning a lot of shoes .
experiment=NPI_env=quantifier_npi=any_licensor=0_scope=0_npi-present=1	0		a lot of students who admire some chairs are cleaning any shoes .
experiment=NPI_env=quantifier_npi=any_licensor=0_scope=0_npi-present=0	1		a lot of students who admire some chairs are cleaning the shoes .
experiment=NPI_env=quantifier_npi=any_licensor=0_scope=1_npi-present=1	0		some cashier who might have any cars has brought some chairs .
experiment=NPI_env=quantifier_npi=any_licensor=0_scope=1_npi-present=0	1		some cashier who might have the cars has brought some chairs .
experiment=NPI_env=quantifier_npi=any_licensor=0_scope=0_npi-present=1	0		some cashier who might have more than three cars has brought any chairs .
experiment=NPI_env=quantifier_npi=any_licensor=0_scope=0_npi-present=0	1		some cashier who might have more than three cars has brought the chairs .
experiment=NPI_env=quantifier_npi=any_licensor=0_scope=1_npi-present=1	0		some boy who had taken any glasses had bought more than three chairs .
experiment=NPI_env=quantifier_npi=any_licensor=0_scope=1_npi-present=0	1		some boy who had taken the glasses had bought more than three chairs .
experiment=NPI_env=quantifier_npi=any_licensor=0_scope=0_npi-present=1	0		some boy who had taken some glasses had bought any chairs .
experiment=NPI_env=quantifier_npi=any_licensor=0_scope=0_npi-present=0	1		some boy who had taken some glasses had bought the chairs .
experiment=NPI_env=quantifier_npi=any_licensor=1_scope=1_npi-present=1	1		no kid who was buying any cups bought the shoes .
experiment=NPI_env=quantifier_npi=any_licensor=1_scope=1_npi-present=0	1		no kid who was buying the cups bought the shoes .
