experiment=NPI-env=only-npi=inyears-crucial_item=only-licensor=1-scope=0-npi_present=1-paradigm=4760	0		The women cared for guests in years only at the restaurant.
experiment=NPI-env=only-npi=inyears-crucial_item=only-licensor=1-scope=0-npi_present=0-paradigm=4760	0		The women cared for guests on weekends only at the restaurant.
experiment=NPI-env=only-npi=inyears-crucial_item=only-licensor=1-scope=1-npi_present=1-paradigm=4208	1		Only a person murmured in years at the library.
experiment=NPI-env=only-npi=inyears-crucial_item=only-licensor=1-scope=1-npi_present=0-paradigm=4208	1		Only a person murmured regularly at the library.
experiment=NPI-env=only-npi=inyears-crucial_item=only-licensor=1-scope=0-npi_present=1-paradigm=4208	0		A person murmured in years only at the library.
experiment=NPI-env=only-npi=inyears-crucial_item=only-licensor=1-scope=0-npi_present=0-paradigm=4208	0		A person murmured regularly only at the library.
experiment=NPI-env=only-npi=any-crucial_item=only-licensor=1-scope=1-npi_present=1-paradigm=1935	1		Only the drivers have ran around any grocery stores.
experiment=NPI-env=only-npi=any-crucial_item=only-licensor=1-scope=1-npi_present=0-paradigm=1935	1		Only the drivers have ran around those grocery stores.
experiment=NPI-env=only-npi=any-crucial_item=only-licensor=1-scope=0-npi_present=1-paradigm=1935	0		Any drivers only have ran around the grocery stores.
experiment=NPI-env=only-npi=any-crucial_item=only-licensor=1-scope=0-npi_present=0-paradigm=1935	0		These drivers only have ran around the grocery stores.
experiment=NPI-env=only-npi=atall-crucial_item=only-licensor=1-scope=1-npi_present=1-paradigm=2436	1		Only a person was talking to adults at all at the public park.
experiment=NPI-env=only-npi=atall-crucial_item=only-licensor=1-scope=1-npi_present=0-paradigm=2436	1		Only a person was talking to adults on occasion at the public park.
experiment=NPI-env=only-npi=atall-crucial_item=only-licensor=1-scope=0-npi_present=1-paradigm=2436	0		A person was talking to adults at all only at the public park.
experiment=NPI-env=only-npi=atall-crucial_item=only-licensor=1-scope=0-npi_present=0-paradigm=2436	0		A person adults on occasion only at the public park.
experiment=NPI-env=only-npi=atall-crucial_item=only-licensor=1-scope=1-npi_present=1-paradigm=2954	1		Only the actors paint at all at the public park.
experiment=NPI-env=only-npi=atall-crucial_item=only-licensor=1-scope=1-npi_present=0-paradigm=2954	1		Only the actors paint on weekends at the public park.
experiment=NPI-env=only-npi=atall-crucial_item=only-licensor=1-scope=0-npi_present=1-paradigm=2954	0		The actors paint at all only at the public park.
experiment=NPI-env=only-npi=atall-crucial_item=only-licensor=1-scope=0-npi_present=0-paradigm=2954	0		The actors on weekends only at the public park.
experiment=NPI-env=only-npi=ever-crucial_item=only-licensor=1-scope=1-npi_present=1-paradigm=389	1		Only the gals can ever describe the essays.
experiment=NPI-env=only-npi=ever-crucial_item=only-licensor=1-scope=1-npi_present=0-paradigm=389	1		Only the gals can clearly describe the essays.
experiment=NPI-env=only-npi=ever-crucial_item=only-licensor=1-scope=0-npi_present=1-paradigm=389	0		The gals can ever describe only the essays.
experiment=NPI-env=only-npi=ever-crucial_item=only-licensor=1-scope=0-npi_present=0-paradigm=389	0		The gals can clearly describe only the essays.
experiment=NPI-env=only-npi=ever-crucial_item=only-licensor=1-scope=1-npi_present=1-paradigm=709	1		Only the driver ever visited the cashiers.
experiment=NPI-env=only-npi=ever-crucial_item=only-licensor=1-scope=1-npi_present=0-paradigm=709	1		Only the driver often visited the cashiers.
experiment=NPI-env=only-npi=ever-crucial_item=only-licensor=1-scope=0-npi_present=1-paradigm=709	0		The driver ever visited only the cashiers.
experiment=NPI-env=only-npi=ever-crucial_item=only-licensor=1-scope=0-npi_present=0-paradigm=709	0		The driver often visited only the cashiers.
experiment=NPI-env=only-npi=atall-crucial_item=only-licensor=1-scope=1-npi_present=1-paradigm=2123	1		Only the boy tours public parks at all at the restaurant.
experiment=NPI-env=only-npi=atall-crucial_item=only-licensor=1-scope=1-npi_present=0-paradigm=2123	1		Only the boy tours public parks for a while at the restaurant.
experiment=NPI-env=only-npi=atall-crucial_item=only-licensor=1-scope=0-npi_present=1-paradigm=2123	0		The boy tours public parks at all only at the restaurant.
experiment=NPI-env=only-npi=atall-crucial_item=only-licensor=1-scope=0-npi_present=0-paradigm=2123	0		The boy public parks for a while only at the restaurant.
experiment=NPI-env=only-npi=any-crucial_item=only-licensor=1-scope=1-npi_present=1-paradigm=1142	1		Only the pedestrians had talked about any actors.
experiment=NPI-env=only-npi=any-crucial_item=only-licensor=1-scope=1-npi_present=0-paradigm=1142	1		Only the pedestrians had talked about the actors.
experiment=NPI-env=only-npi=any-crucial_item=only-licensor=1-scope=0-npi_present=1-paradigm=1142	0		Any pedestrians only had talked about the actors.
experiment=NPI-env=only-npi=any-crucial_item=only-licensor=1-scope=0-npi_present=0-paradigm=1142	0		Those pedestrians only had talked about the actors.
experiment=NPI-env=only-npi=inyears-crucial_item=only-licensor=1-scope=1-npi_present=1-paradigm=4847	1		Only the men have broken cars in years at the art gallery.
experiment=NPI-env=only-npi=inyears-crucial_item=only-licensor=1-scope=1-npi_present=0-paradigm=4847	1		Only the men have broken cars for a while at the art gallery.
experiment=NPI-env=only-npi=inyears-crucial_item=only-licensor=1-scope=0-npi_present=1-paradigm=4847	0		The men have broken cars in years only at the art gallery.
experiment=NPI-env=only-npi=inyears-crucial_item=only-licensor=1-scope=0-npi_present=0-paradigm=4847	0		The men have broken cars for a while only at the art gallery.
experiment=NPI-env=only-npi=inyears-crucial_item=only-licensor=1-scope=1-npi_present=1-paradigm=4542	1		Only the humans had argued in years at the restaurant.
experiment=NPI-env=only-npi=inyears-crucial_item=only-licensor=1-scope=1-npi_present=0-paradigm=4542	1		Only the humans had argued as well at the restaurant.
experiment=NPI-env=only-npi=inyears-crucial_item=only-licensor=1-scope=0-npi_present=1-paradigm=4542	0		The humans had argued in years only at the restaurant.
experiment=NPI-env=only-npi=inyears-crucial_item=only-licensor=1-scope=0-npi_present=0-paradigm=4542	0		The humans had argued as well only at the restaurant.
experiment=NPI-env=only-npi=inyears-crucial_item=only-licensor=1-scope=1-npi_present=1-paradigm=4758	1		Only an adult sat down in years at the museum.
experiment=NPI-env=only-npi=inyears-crucial_item=only-licensor=1-scope=1-npi_present=0-paradigm=4758	1		Only an adult sat down for a while at the museum.
experiment=NPI-env=only-npi=inyears-crucial_item=only-licensor=1-scope=0-npi_present=1-paradigm=4758	0		An adult sat down in years only at the museum.
experiment=NPI-env=only-npi=inyears-crucial_item=only-licensor=1-scope=0-npi_present=0-paradigm=4758	0		An adult sat down for a while only at the museum.
experiment=NPI-env=only-npi=yet-crucial_item=only-licensor=1-scope=1-npi_present=1-paradigm=3996	1		Only the woman might resemble ladies yet at the library.
experiment=NPI-env=only-npi=yet-crucial_item=only-licensor=1-scope=1-npi_present=0-paradigm=3996	1		Only the woman might resemble ladies on weekends at the library.
experiment=NPI-env=only-npi=yet-crucial_item=only-licensor=1-scope=0-npi_present=1-paradigm=3996	0		The woman might resemble ladies yet only at the library.
experiment=NPI-env=only-npi=yet-crucial_item=only-licensor=1-scope=0-npi_present=0-paradigm=3996	0		The woman might resemble ladies on weekends only at the library.
experiment=NPI-env=only-npi=any-crucial_item=only-licensor=1-scope=1-npi_present=1-paradigm=1004	1		Only the cashiers escaped from any girls.
experiment=NPI-env=only-npi=any-crucial_item=only-licensor=1-scope=1-npi_present=0-paradigm=1004	1		Only the cashiers escaped from these girls.
experiment=NPI-env=only-npi=any-crucial_item=only-licensor=1-scope=0-npi_present=1-paradigm=1004	0		Any cashiers only escaped from the girls.
experiment=NPI-env=only-npi=any-crucial_item=only-licensor=1-scope=0-npi_present=0-paradigm=1004	0		The cashiers only escaped from the girls.
experiment=NPI-env=only-npi=yet-crucial_item=only-licensor=1-scope=1-npi_present=1-paradigm=3178	1		Only a person can talk to women yet at the cafe.
experiment=NPI-env=only-npi=yet-crucial_item=only-licensor=1-scope=1-npi_present=0-paradigm=3178	1		Only a person can talk to women as well at the cafe.
experiment=NPI-env=only-npi=yet-crucial_item=only-licensor=1-scope=0-npi_present=1-paradigm=3178	0		A person can talk to women yet only at the cafe.
experiment=NPI-env=only-npi=yet-crucial_item=only-licensor=1-scope=0-npi_present=0-paradigm=3178	0		A person can talk to women as well only at the cafe.
experiment=NPI-env=only-npi=either-crucial_item=only-licensor=1-scope=1-npi_present=1-paradigm=5621	1		Only the drivers do interact either at the college campus.
experiment=NPI-env=only-npi=either-crucial_item=only-licensor=1-scope=1-npi_present=0-paradigm=5621	1		Only the drivers do interact as well at the college campus.
experiment=NPI-env=only-npi=either-crucial_item=only-licensor=1-scope=0-npi_present=1-paradigm=5621	0		The drivers do interact either only at the college campus.
experiment=NPI-env=only-npi=either-crucial_item=only-licensor=1-scope=0-npi_present=0-paradigm=5621	0		The drivers do interact as well only at the college campus.
experiment=NPI-env=only-npi=any-crucial_item=only-licensor=1-scope=1-npi_present=1-paradigm=1471	1		Only the customers have examined any documentaries.
experiment=NPI-env=only-npi=any-crucial_item=only-licensor=1-scope=1-npi_present=0-paradigm=1471	1		Only the customers have examined the documentaries.
experiment=NPI-env=only-npi=any-crucial_item=only-licensor=1-scope=0-npi_present=1-paradigm=1471	0		Any customers only have examined the documentaries.
experiment=NPI-env=only-npi=any-crucial_item=only-licensor=1-scope=0-npi_present=0-paradigm=1471	0		The customers only have examined the documentaries.
experiment=NPI-env=only-npi=inyears-crucial_item=only-licensor=1-scope=1-npi_present=1-paradigm=4890	1		Only the boys flirted in years at the museum.
experiment=NPI-env=only-npi=inyears-crucial_item=only-licensor=1-scope=1-npi_present=0-paradigm=4890	1		Only the boys flirted for a while at the museum.
experiment=NPI-env=only-npi=inyears-crucial_item=only-licensor=1-scope=0-npi_present=1-paradigm=4890	0		The boys flirted in years only at the museum.
experiment=NPI-env=only-npi=inyears-crucial_item=only-licensor=1-scope=0-npi_present=0-paradigm=4890	0		The boys flirted for a while only at the museum.
experiment=NPI-env=only-npi=atall-crucial_item=only-licensor=1-scope=1-npi_present=1-paradigm=2696	1		Only the adult had taken cars at all at the movie theater.
experiment=NPI-env=only-npi=atall-crucial_item=only-licensor=1-scope=1-npi_present=0-paradigm=2696	1		Only the adult had taken cars for a while at the movie theater.
experiment=NPI-env=only-npi=atall-crucial_item=only-licensor=1-scope=0-npi_present=1-paradigm=2696	0		The adult had taken cars at all only at the movie theater.
experiment=NPI-env=only-npi=atall-crucial_item=only-licensor=1-scope=0-npi_present=0-paradigm=2696	0		The adult cars for a while only at the movie theater.
experiment=NPI-env=only-npi=yet-crucial_item=only-licensor=1-scope=1-npi_present=1-paradigm=3661	1		Only the man was talking about public parks yet at the restaurant.
experiment=NPI-env=only-npi=yet-crucial_item=only-licensor=1-scope=1-npi_present=0-paradigm=3661	1		Only the man was talking about public parks on weekends at the restaurant.
experiment=NPI-env=only-npi=yet-crucial_item=only-licensor=1-scope=0-npi_present=1-paradigm=3661	0		The man was talking about public parks yet only at the restaurant.
experiment=NPI-env=only-npi=yet-crucial_item=only-licensor=1-scope=0-npi_present=0-paradigm=3661	0		The man was talking about public parks on weekends only at the restaurant.
experiment=NPI-env=only-npi=atall-crucial_item=only-licensor=1-scope=1-npi_present=1-paradigm=2281	1		Only the actor died at all at the restaurant.
experiment=NPI-env=only-npi=atall-crucial_item=only-licensor=1-scope=1-npi_present=0-paradigm=2281	1		Only the actor died as well at the restaurant.
experiment=NPI-env=only-npi=atall-crucial_item=only-licensor=1-scope=0-npi_present=1-paradigm=2281	0		The actor died at all only at the restaurant.
experiment=NPI-env=only-npi=atall-crucial_item=only-licensor=1-scope=0-npi_present=0-paradigm=2281	0		The actor as well only at the restaurant.
experiment=NPI-env=only-npi=either-crucial_item=only-licensor=1-scope=1-npi_present=1-paradigm=5638	1		Only a teenager is painting either at the bank.
experiment=NPI-env=only-npi=either-crucial_item=only-licensor=1-scope=1-npi_present=0-paradigm=5638	1		Only a teenager is painting as well at the bank.
experiment=NPI-env=only-npi=either-crucial_item=only-licensor=1-scope=0-npi_present=1-paradigm=5638	0		A teenager is painting either only at the bank.
experiment=NPI-env=only-npi=either-crucial_item=only-licensor=1-scope=0-npi_present=0-paradigm=5638	0		A teenager is painting as well only at the bank.
experiment=NPI-env=only-npi=any-crucial_item=only-licensor=1-scope=1-npi_present=1-paradigm=1737	1		Only the teenagers were helping any doctors.
experiment=NPI-env=only-npi=any-crucial_item=only-licensor=1-scope=1-npi_present=0-paradigm=1737	1		Only the teenagers were helping the doctors.
experiment=NPI-env=only-npi=any-crucial_item=only-licensor=1-scope=0-npi_present=1-paradigm=1737	0		Any teenagers only were helping the doctors.
experiment=NPI-env=only-npi=any-crucial_item=only-licensor=1-scope=0-npi_present=0-paradigm=1737	0		The teenagers only were helping the doctors.
experiment=NPI-env=only-npi=either-crucial_item=only-licensor=1-scope=1-npi_present=1-paradigm=5541	1		Only an adult waved either at the cafe.
experiment=NPI-env=only-npi=either-crucial_item=only-licensor=1-scope=1-npi_present=0-paradigm=5541	1		Only an adult waved on weekends at the cafe.
experiment=NPI-env=only-npi=either-crucial_item=only-licensor=1-scope=0-npi_present=1-paradigm=5541	0		An adult waved either only at the cafe.
experiment=NPI-env=only-npi=either-crucial_item=only-licensor=1-scope=0-npi_present=0-paradigm=5541	0		An adult waved on weekends only at the cafe.
experiment=NPI-env=only-npi=atall-crucial_item=only-licensor=1-scope=1-npi_present=1-paradigm=2607	1		Only the adults might help cashiers at all at the grocery store.
experiment=NPI-env=only-npi=atall-crucial_item=only-licensor=1-scope=1-npi_present=0-paradigm=2607	1		Only the adults might help cashiers on occasion at the grocery store.
experiment=NPI-env=only-npi=atall-crucial_item=only-licensor=1-scope=0-npi_present=1-paradigm=2607	0		The adults might help cashiers at all only at the grocery store.
experiment=NPI-env=only-npi=atall-crucial_item=only-licensor=1-scope=0-npi_present=0-paradigm=2607	0		The adults cashiers on occasion only at the grocery store.
experiment=NPI-env=only-npi=inyears-crucial_item=only-licensor=1-scope=1-npi_present=1-paradigm=4923	1		Only the students lied in years at the museum.
experiment=NPI-env=only-npi=inyears-crucial_item=only-licensor=1-scope=1-npi_present=0-paradigm=4923	1		Only the students lied on weekends at the museum.
experiment=NPI-env=only-npi=inyears-crucial_item=only-licensor=1-scope=0-npi_present=1-paradigm=4923	0		The students lied in years only at the museum.
experiment=NPI-env=only-npi=inyears-crucial_item=only-licensor=1-scope=0-npi_present=0-paradigm=4923	0		The students lied on weekends only at the museum.
experiment=NPI-env=only-npi=yet-crucial_item=only-licensor=1-scope=1-npi_present=1-paradigm=3506	1		Only the men boycotted public parks yet at the public park.
experiment=NPI-env=only-npi=yet-crucial_item=only-licensor=1-scope=1-npi_present=0-paradigm=3506	1		Only the men boycotted public parks as well at the public park.
experiment=NPI-env=only-npi=yet-crucial_item=only-licensor=1-scope=0-npi_present=1-paradigm=3506	0		The men boycotted public parks yet only at the public park.
experiment=NPI-env=only-npi=yet-crucial_item=only-licensor=1-scope=0-npi_present=0-paradigm=3506	0		The men boycotted public parks as well only at the public park.
experiment=NPI-env=only-npi=any-crucial_item=only-licensor=1-scope=1-npi_present=1-paradigm=1597	1		Only the guys were kissing any adults.
experiment=NPI-env=only-npi=any-crucial_item=only-licensor=1-scope=1-npi_present=0-paradigm=1597	1		Only the guys were kissing these adults.
experiment=NPI-env=only-npi=any-crucial_item=only-licensor=1-scope=0-npi_present=1-paradigm=1597	0		Any guys only were kissing the adults.
experiment=NPI-env=only-npi=any-crucial_item=only-licensor=1-scope=0-npi_present=0-paradigm=1597	0		These guys only were kissing the adults.
experiment=NPI-env=only-npi=ever-crucial_item=only-licensor=1-scope=1-npi_present=1-paradigm=740	1		Only the cashier has ever fled from the drivers.
experiment=NPI-env=only-npi=ever-crucial_item=only-licensor=1-scope=1-npi_present=0-paradigm=740	1		Only the cashier has clearly fled from the drivers.
experiment=NPI-env=only-npi=ever-crucial_item=only-licensor=1-scope=0-npi_present=1-paradigm=740	0		The cashier has ever fled from only the drivers.
experiment=NPI-env=only-npi=ever-crucial_item=only-licensor=1-scope=0-npi_present=0-paradigm=740	0		The cashier has clearly fled from only the drivers.
experiment=NPI-env=only-npi=any-crucial_item=only-licensor=1-scope=1-npi_present=1-paradigm=1490	1		Only the men have discussed any movie theaters.
experiment=NPI-env=only-npi=any-crucial_item=only-licensor=1-scope=1-npi_present=0-paradigm=1490	1		Only the men have discussed the movie theaters.
experiment=NPI-env=only-npi=any-crucial_item=only-licensor=1-scope=0-npi_present=1-paradigm=1490	0		Any men only have discussed the movie theaters.
experiment=NPI-env=only-npi=any-crucial_item=only-licensor=1-scope=0-npi_present=0-paradigm=1490	0		The men only have discussed the movie theaters.
experiment=NPI-env=only-npi=atall-crucial_item=only-licensor=1-scope=1-npi_present=1-paradigm=2285	1		Only the cashier attacked teachers at all at the college campus.
experiment=NPI-env=only-npi=atall-crucial_item=only-licensor=1-scope=1-npi_present=0-paradigm=2285	1		Only the cashier attacked teachers regularly at the college campus.
experiment=NPI-env=only-npi=atall-crucial_item=only-licensor=1-scope=0-npi_present=1-paradigm=2285	0		The cashier attacked teachers at all only at the college campus.
experiment=NPI-env=only-npi=atall-crucial_item=only-licensor=1-scope=0-npi_present=0-paradigm=2285	0		The cashier teachers regularly only at the college campus.
experiment=NPI-env=only-npi=atall-crucial_item=only-licensor=1-scope=1-npi_present=1-paradigm=2854	1		Only the teenager practiced at all at the movie theater.
experiment=NPI-env=only-npi=atall-crucial_item=only-licensor=1-scope=1-npi_present=0-paradigm=2854	1		Only the teenager practiced on weekends at the movie theater.
experiment=NPI-env=only-npi=atall-crucial_item=only-licensor=1-scope=0-npi_present=1-paradigm=2854	0		The teenager practiced at all only at the movie theater.
experiment=NPI-env=only-npi=atall-crucial_item=only-licensor=1-scope=0-npi_present=0-paradigm=2854	0		The teenager on weekends only at the movie theater.
experiment=NPI-env=only-npi=atall-crucial_item=only-licensor=1-scope=1-npi_present=1-paradigm=2480	1		Only a teenager walks through cafes at all at the school.
experiment=NPI-env=only-npi=atall-crucial_item=only-licensor=1-scope=1-npi_present=0-paradigm=2480	1		Only a teenager walks through cafes regularly at the school.
experiment=NPI-env=only-npi=atall-crucial_item=only-licensor=1-scope=0-npi_present=1-paradigm=2480	0		A teenager walks through cafes at all only at the school.
experiment=NPI-env=only-npi=atall-crucial_item=only-licensor=1-scope=0-npi_present=0-paradigm=2480	0		A teenager cafes regularly only at the school.
experiment=NPI-env=only-npi=yet-crucial_item=only-licensor=1-scope=1-npi_present=1-paradigm=3287	1		Only a girl approves yet at the restaurant.
experiment=NPI-env=only-npi=yet-crucial_item=only-licensor=1-scope=1-npi_present=0-paradigm=3287	1		Only a girl approves regularly at the restaurant.
experiment=NPI-env=only-npi=yet-crucial_item=only-licensor=1-scope=0-npi_present=1-paradigm=3287	0		A girl approves yet only at the restaurant.
experiment=NPI-env=only-npi=yet-crucial_item=only-licensor=1-scope=0-npi_present=0-paradigm=3287	0		A girl approves regularly only at the restaurant.
experiment=NPI-env=only-npi=yet-crucial_item=only-licensor=1-scope=1-npi_present=1-paradigm=3699	1		Only the patients had chatted yet at the museum.
experiment=NPI-env=only-npi=yet-crucial_item=only-licensor=1-scope=1-npi_present=0-paradigm=3699	1		Only the patients had chatted on weekends at the museum.
experiment=NPI-env=only-npi=yet-crucial_item=only-licensor=1-scope=0-npi_present=1-paradigm=3699	0		The patients had chatted yet only at the museum.
experiment=NPI-env=only-npi=yet-crucial_item=only-licensor=1-scope=0-npi_present=0-paradigm=3699	0		The patients had chatted on weekends only at the museum.
experiment=NPI-env=only-npi=either-crucial_item=only-licensor=1-scope=1-npi_present=1-paradigm=5510	1		Only the girls are concurring either at the high school.
experiment=NPI-env=only-npi=either-crucial_item=only-licensor=1-scope=1-npi_present=0-paradigm=5510	1		Only the girls are concurring as well at the high school.
experiment=NPI-env=only-npi=either-crucial_item=only-licensor=1-scope=0-npi_present=1-paradigm=5510	0		The girls are concurring either only at the high school.
experiment=NPI-env=only-npi=either-crucial_item=only-licensor=1-scope=0-npi_present=0-paradigm=5510	0		The girls are concurring as well only at the high school.
experiment=NPI-env=only-npi=ever-crucial_item=only-licensor=1-scope=1-npi_present=1-paradigm=305	1		Only a customer has ever watched the teenagers.
experiment=NPI-env=only-npi=ever-crucial_item=only-licensor=1-scope=1-npi_present=0-paradigm=305	1		Only a customer has really watched the teenagers.
experiment=NPI-env=only-npi=ever-crucial_item=only-licensor=1-scope=0-npi_present=1-paradigm=305	0		A customer has ever watched only the teenagers.
experiment=NPI-env=only-npi=ever-crucial_item=only-licensor=1-scope=0-npi_present=0-paradigm=305	0		A customer has really watched only the teenagers.
experiment=NPI-env=only-npi=yet-crucial_item=only-licensor=1-scope=1-npi_present=1-paradigm=3289	1		Only the teenagers hated documentaries yet at the cafe.
experiment=NPI-env=only-npi=yet-crucial_item=only-licensor=1-scope=1-npi_present=0-paradigm=3289	1		Only the teenagers hated documentaries for a while at the cafe.
experiment=NPI-env=only-npi=yet-crucial_item=only-licensor=1-scope=0-npi_present=1-paradigm=3289	0		The teenagers hated documentaries yet only at the cafe.
experiment=NPI-env=only-npi=yet-crucial_item=only-licensor=1-scope=0-npi_present=0-paradigm=3289	0		The teenagers hated documentaries for a while only at the cafe.
experiment=NPI-env=only-npi=yet-crucial_item=only-licensor=1-scope=1-npi_present=1-paradigm=3557	1		Only the waitresses have watched actors yet at the art gallery.
experiment=NPI-env=only-npi=yet-crucial_item=only-licensor=1-scope=1-npi_present=0-paradigm=3557	1		Only the waitresses have watched actors regularly at the art gallery.
experiment=NPI-env=only-npi=yet-crucial_item=only-licensor=1-scope=0-npi_present=1-paradigm=3557	0		The waitresses have watched actors yet only at the art gallery.
experiment=NPI-env=only-npi=yet-crucial_item=only-licensor=1-scope=0-npi_present=0-paradigm=3557	0		The waitresses have watched actors regularly only at the art gallery.
experiment=NPI-env=only-npi=atall-crucial_item=only-licensor=1-scope=1-npi_present=1-paradigm=2079	1		Only the adults had brought books at all at the bank.
experiment=NPI-env=only-npi=atall-crucial_item=only-licensor=1-scope=1-npi_present=0-paradigm=2079	1		Only the adults had brought books as well at the bank.
experiment=NPI-env=only-npi=atall-crucial_item=only-licensor=1-scope=0-npi_present=1-paradigm=2079	0		The adults had brought books at all only at the bank.
experiment=NPI-env=only-npi=atall-crucial_item=only-licensor=1-scope=0-npi_present=0-paradigm=2079	0		The adults books as well only at the bank.
experiment=NPI-env=only-npi=inyears-crucial_item=only-licensor=1-scope=1-npi_present=1-paradigm=4408	1		Only the adults drove to hospitals in years at the museum.
experiment=NPI-env=only-npi=inyears-crucial_item=only-licensor=1-scope=1-npi_present=0-paradigm=4408	1		Only the adults drove to hospitals regularly at the museum.
experiment=NPI-env=only-npi=inyears-crucial_item=only-licensor=1-scope=0-npi_present=1-paradigm=4408	0		The adults drove to hospitals in years only at the museum.
experiment=NPI-env=only-npi=inyears-crucial_item=only-licensor=1-scope=0-npi_present=0-paradigm=4408	0		The adults drove to hospitals regularly only at the museum.
experiment=NPI-env=only-npi=yet-crucial_item=only-licensor=1-scope=1-npi_present=1-paradigm=3678	1		Only a person is succeeding yet at the cafe.
experiment=NPI-env=only-npi=yet-crucial_item=only-licensor=1-scope=1-npi_present=0-paradigm=3678	1		Only a person is succeeding on occasion at the cafe.
experiment=NPI-env=only-npi=yet-crucial_item=only-licensor=1-scope=0-npi_present=1-paradigm=3678	0		A person is succeeding yet only at the cafe.
experiment=NPI-env=only-npi=yet-crucial_item=only-licensor=1-scope=0-npi_present=0-paradigm=3678	0		A person is succeeding on occasion only at the cafe.
experiment=NPI-env=only-npi=atall-crucial_item=only-licensor=1-scope=1-npi_present=1-paradigm=2139	1		Only a teenager runs around banks at all at the school.
