experiment=NPI-env=only-npi=yet-crucial_item=only-licensor=1-scope=0-npi_present=1-paradigm=3791	0		A guy had studied yet only at the grocery store.
experiment=NPI-env=only-npi=yet-crucial_item=only-licensor=1-scope=0-npi_present=0-paradigm=3791	0		A guy had studied as well only at the grocery store.
experiment=NPI-env=only-npi=any-crucial_item=only-licensor=1-scope=1-npi_present=1-paradigm=1266	1		Only the students dropped by any cafes.
experiment=NPI-env=only-npi=any-crucial_item=only-licensor=1-scope=1-npi_present=0-paradigm=1266	1		Only the students dropped by those cafes.
experiment=NPI-env=only-npi=any-crucial_item=only-licensor=1-scope=0-npi_present=1-paradigm=1266	0		Any students only dropped by the cafes.
experiment=NPI-env=only-npi=any-crucial_item=only-licensor=1-scope=0-npi_present=0-paradigm=1266	0		Those students only dropped by the cafes.
experiment=NPI-env=only-npi=atall-crucial_item=only-licensor=1-scope=1-npi_present=1-paradigm=2665	1		Only the waitress sold forks at all at the museum.
experiment=NPI-env=only-npi=atall-crucial_item=only-licensor=1-scope=1-npi_present=0-paradigm=2665	1		Only the waitress sold forks for a while at the museum.
experiment=NPI-env=only-npi=atall-crucial_item=only-licensor=1-scope=0-npi_present=1-paradigm=2665	0		The waitress sold forks at all only at the museum.
experiment=NPI-env=only-npi=atall-crucial_item=only-licensor=1-scope=0-npi_present=0-paradigm=2665	0		The waitress forks for a while only at the museum.
experiment=NPI-env=only-npi=atall-crucial_item=only-licensor=1-scope=1-npi_present=1-paradigm=2263	1		Only the waiter scanned plays at all at the bank.
experiment=NPI-env=only-npi=atall-crucial_item=only-licensor=1-scope=1-npi_present=0-paradigm=2263	1		Only the waiter scanned plays regularly at the bank.
experiment=NPI-env=only-npi=atall-crucial_item=only-licensor=1-scope=0-npi_present=1-paradigm=2263	0		The waiter scanned plays at all only at the bank.
experiment=NPI-env=only-npi=atall-crucial_item=only-licensor=1-scope=0-npi_present=0-paradigm=2263	0		The waiter plays regularly only at the bank.
experiment=NPI-env=only-npi=either-crucial_item=only-licensor=1-scope=1-npi_present=1-paradigm=5195	1		Only the women have played either at the school.
experiment=NPI-env=only-npi=either-crucial_item=only-licensor=1-scope=1-npi_present=0-paradigm=5195	1		Only the women have played as well at the school.
experiment=NPI-env=only-npi=either-crucial_item=only-licensor=1-scope=0-npi_present=1-paradigm=5195	0		The women have played either only at the school.
experiment=NPI-env=only-npi=either-crucial_item=only-licensor=1-scope=0-npi_present=0-paradigm=5195	0		The women have played as well only at the school.
experiment=NPI-env=only-npi=atall-crucial_item=only-licensor=1-scope=1-npi_present=1-paradigm=2542	1		Only the waiter had washed at all at the art gallery.
experiment=NPI-env=only-npi=atall-crucial_item=only-licensor=1-scope=1-npi_present=0-paradigm=2542	1		Only the waiter had washed for a while at the art gallery.
experiment=NPI-env=only-npi=atall-crucial_item=only-licensor=1-scope=0-npi_present=1-paradigm=2542	0		The waiter had washed at all only at the art gallery.
experiment=NPI-env=only-npi=atall-crucial_item=only-licensor=1-scope=0-npi_present=0-paradigm=2542	0		The waiter for a while only at the art gallery.
experiment=NPI-env=only-npi=atall-crucial_item=only-licensor=1-scope=1-npi_present=1-paradigm=2000	1		Only the actors have spoken up at all at the high school.
experiment=NPI-env=only-npi=atall-crucial_item=only-licensor=1-scope=1-npi_present=0-paradigm=2000	1		Only the actors have spoken up for a while at the high school.
experiment=NPI-env=only-npi=atall-crucial_item=only-licensor=1-scope=0-npi_present=1-paradigm=2000	0		The actors have spoken up at all only at the high school.
experiment=NPI-env=only-npi=atall-crucial_item=only-licensor=1-scope=0-npi_present=0-paradigm=2000	0		The actors for a while only at the high school.
experiment=NPI-env=only-npi=any-crucial_item=only-licensor=1-scope=1-npi_present=1-paradigm=1843	1		Only the actresses flee from any college campuses.
experiment=NPI-env=only-npi=any-crucial_item=only-licensor=1-scope=1-npi_present=0-paradigm=1843	1		Only the actresses flee from the college campuses.
experiment=NPI-env=only-npi=any-crucial_item=only-licensor=1-scope=0-npi_present=1-paradigm=1843	0		Any actresses only flee from the college campuses.
experiment=NPI-env=only-npi=any-crucial_item=only-licensor=1-scope=0-npi_present=0-paradigm=1843	0		Those actresses only flee from the college campuses.
experiment=NPI-env=only-npi=inyears-crucial_item=only-licensor=1-scope=1-npi_present=1-paradigm=4955	1		Only the boys have talked to teachers in years at the art gallery.
experiment=NPI-env=only-npi=inyears-crucial_item=only-licensor=1-scope=1-npi_present=0-paradigm=4955	1		Only the boys have talked to teachers regularly at the art gallery.
experiment=NPI-env=only-npi=inyears-crucial_item=only-licensor=1-scope=0-npi_present=1-paradigm=4955	0		The boys have talked to teachers in years only at the art gallery.
experiment=NPI-env=only-npi=inyears-crucial_item=only-licensor=1-scope=0-npi_present=0-paradigm=4955	0		The boys have talked to teachers regularly only at the art gallery.
experiment=NPI-env=only-npi=inyears-crucial_item=only-licensor=1-scope=1-npi_present=1-paradigm=4158	1		Only a person has escaped from public parks in years at the cafe.
experiment=NPI-env=only-npi=inyears-crucial_item=only-licensor=1-scope=1-npi_present=0-paradigm=4158	1		Only a person has escaped from public parks as well at the cafe.
experiment=NPI-env=only-npi=inyears-crucial_item=only-licensor=1-scope=0-npi_present=1-paradigm=4158	0		A person has escaped from public parks in years only at the cafe.
experiment=NPI-env=only-npi=inyears-crucial_item=only-licensor=1-scope=0-npi_present=0-paradigm=4158	0		A person has escaped from public parks as well only at the cafe.
experiment=NPI-env=only-npi=any-crucial_item=only-licensor=1-scope=1-npi_present=1-paradigm=1412	1		Only the students kiss any teenagers.
experiment=NPI-env=only-npi=any-crucial_item=only-licensor=1-scope=1-npi_present=0-paradigm=1412	1		Only the students kiss the teenagers.
experiment=NPI-env=only-npi=any-crucial_item=only-licensor=1-scope=0-npi_present=1-paradigm=1412	0		Any students only kiss the teenagers.
experiment=NPI-env=only-npi=any-crucial_item=only-licensor=1-scope=0-npi_present=0-paradigm=1412	0		The students only kiss the teenagers.
experiment=NPI-env=only-npi=any-crucial_item=only-licensor=1-scope=1-npi_present=1-paradigm=1513	1		Only the customers like any rugs.
experiment=NPI-env=only-npi=any-crucial_item=only-licensor=1-scope=1-npi_present=0-paradigm=1513	1		Only the customers like those rugs.
experiment=NPI-env=only-npi=any-crucial_item=only-licensor=1-scope=0-npi_present=1-paradigm=1513	0		Any customers only like the rugs.
experiment=NPI-env=only-npi=any-crucial_item=only-licensor=1-scope=0-npi_present=0-paradigm=1513	0		Those customers only like the rugs.
experiment=NPI-env=only-npi=any-crucial_item=only-licensor=1-scope=1-npi_present=1-paradigm=1571	1		Only the people have worked with any girls.
experiment=NPI-env=only-npi=any-crucial_item=only-licensor=1-scope=1-npi_present=0-paradigm=1571	1		Only the people have worked with these girls.
experiment=NPI-env=only-npi=any-crucial_item=only-licensor=1-scope=0-npi_present=1-paradigm=1571	0		Any people only have worked with the girls.
experiment=NPI-env=only-npi=any-crucial_item=only-licensor=1-scope=0-npi_present=0-paradigm=1571	0		The people only have worked with the girls.
experiment=NPI-env=only-npi=either-crucial_item=only-licensor=1-scope=1-npi_present=1-paradigm=5366	1		Only the children answer either at the cafe.
experiment=NPI-env=only-npi=either-crucial_item=only-licensor=1-scope=1-npi_present=0-paradigm=5366	1		Only the children answer on occasion at the cafe.
experiment=NPI-env=only-npi=either-crucial_item=only-licensor=1-scope=0-npi_present=1-paradigm=5366	0		The children answer either only at the cafe.
experiment=NPI-env=only-npi=either-crucial_item=only-licensor=1-scope=0-npi_present=0-paradigm=5366	0		The children answer on occasion only at the cafe.
experiment=NPI-env=only-npi=ever-crucial_item=only-licensor=1-scope=1-npi_present=1-paradigm=567	1		Only a doctor ever walked through the schools.
experiment=NPI-env=only-npi=ever-crucial_item=only-licensor=1-scope=1-npi_present=0-paradigm=567	1		Only a doctor certainly walked through the schools.
experiment=NPI-env=only-npi=ever-crucial_item=only-licensor=1-scope=0-npi_present=1-paradigm=567	0		A doctor ever walked through only the schools.
experiment=NPI-env=only-npi=ever-crucial_item=only-licensor=1-scope=0-npi_present=0-paradigm=567	0		A doctor certainly walked through only the schools.
experiment=NPI-env=only-npi=ever-crucial_item=only-licensor=1-scope=1-npi_present=1-paradigm=794	1		Only the people will ever respect the hospitals.
experiment=NPI-env=only-npi=ever-crucial_item=only-licensor=1-scope=1-npi_present=0-paradigm=794	1		Only the people will also respect the hospitals.
experiment=NPI-env=only-npi=ever-crucial_item=only-licensor=1-scope=0-npi_present=1-paradigm=794	0		The people will ever respect only the hospitals.
experiment=NPI-env=only-npi=ever-crucial_item=only-licensor=1-scope=0-npi_present=0-paradigm=794	0		The people will also respect only the hospitals.
experiment=NPI-env=only-npi=either-crucial_item=only-licensor=1-scope=1-npi_present=1-paradigm=5650	1		Only the people cope either at the hospital.
experiment=NPI-env=only-npi=either-crucial_item=only-licensor=1-scope=1-npi_present=0-paradigm=5650	1		Only the people cope on occasion at the hospital.
experiment=NPI-env=only-npi=either-crucial_item=only-licensor=1-scope=0-npi_present=1-paradigm=5650	0		The people cope either only at the hospital.
experiment=NPI-env=only-npi=either-crucial_item=only-licensor=1-scope=0-npi_present=0-paradigm=5650	0		The people cope on occasion only at the hospital.
experiment=NPI-env=only-npi=yet-crucial_item=only-licensor=1-scope=1-npi_present=1-paradigm=3734	1		Only the humans talked about gals yet at the bank.
experiment=NPI-env=only-npi=yet-crucial_item=only-licensor=1-scope=1-npi_present=0-paradigm=3734	1		Only the humans talked about gals for a while at the bank.
experiment=NPI-env=only-npi=yet-crucial_item=only-licensor=1-scope=0-npi_present=1-paradigm=3734	0		The humans talked about gals yet only at the bank.
experiment=NPI-env=only-npi=yet-crucial_item=only-licensor=1-scope=0-npi_present=0-paradigm=3734	0		The humans talked about gals for a while only at the bank.
experiment=NPI-env=only-npi=yet-crucial_item=only-licensor=1-scope=1-npi_present=1-paradigm=3571	1		Only the woman nodded yet at the library.
experiment=NPI-env=only-npi=yet-crucial_item=only-licensor=1-scope=1-npi_present=0-paradigm=3571	1		Only the woman nodded on weekends at the library.
experiment=NPI-env=only-npi=yet-crucial_item=only-licensor=1-scope=0-npi_present=1-paradigm=3571	0		The woman nodded yet only at the library.
experiment=NPI-env=only-npi=yet-crucial_item=only-licensor=1-scope=0-npi_present=0-paradigm=3571	0		The woman nodded on weekends only at the library.
experiment=NPI-env=only-npi=atall-crucial_item=only-licensor=1-scope=1-npi_present=1-paradigm=2944	1		Only a person can like forks at all at the grocery store.
experiment=NPI-env=only-npi=atall-crucial_item=only-licensor=1-scope=1-npi_present=0-paradigm=2944	1		Only a person can like forks on occasion at the grocery store.
experiment=NPI-env=only-npi=atall-crucial_item=only-licensor=1-scope=0-npi_present=1-paradigm=2944	0		A person can like forks at all only at the grocery store.
experiment=NPI-env=only-npi=atall-crucial_item=only-licensor=1-scope=0-npi_present=0-paradigm=2944	0		A person forks on occasion only at the grocery store.
experiment=NPI-env=only-npi=any-crucial_item=only-licensor=1-scope=1-npi_present=1-paradigm=1521	1		Only the humans are going to any movie theaters.
experiment=NPI-env=only-npi=any-crucial_item=only-licensor=1-scope=1-npi_present=0-paradigm=1521	1		Only the humans are going to these movie theaters.
experiment=NPI-env=only-npi=any-crucial_item=only-licensor=1-scope=0-npi_present=1-paradigm=1521	0		Any humans only are going to the movie theaters.
experiment=NPI-env=only-npi=any-crucial_item=only-licensor=1-scope=0-npi_present=0-paradigm=1521	0		The humans only are going to the movie theaters.
experiment=NPI-env=only-npi=ever-crucial_item=only-licensor=1-scope=1-npi_present=1-paradigm=695	1		Only the waiters ever worked with the actors.
experiment=NPI-env=only-npi=ever-crucial_item=only-licensor=1-scope=1-npi_present=0-paradigm=695	1		Only the waiters clearly worked with the actors.
experiment=NPI-env=only-npi=ever-crucial_item=only-licensor=1-scope=0-npi_present=1-paradigm=695	0		The waiters ever worked with only the actors.
experiment=NPI-env=only-npi=ever-crucial_item=only-licensor=1-scope=0-npi_present=0-paradigm=695	0		The waiters clearly worked with only the actors.
experiment=NPI-env=only-npi=inyears-crucial_item=only-licensor=1-scope=1-npi_present=1-paradigm=4454	1		Only the men hugged doctors in years at the high school.
experiment=NPI-env=only-npi=inyears-crucial_item=only-licensor=1-scope=1-npi_present=0-paradigm=4454	1		Only the men hugged doctors on occasion at the high school.
experiment=NPI-env=only-npi=inyears-crucial_item=only-licensor=1-scope=0-npi_present=1-paradigm=4454	0		The men hugged doctors in years only at the high school.
experiment=NPI-env=only-npi=inyears-crucial_item=only-licensor=1-scope=0-npi_present=0-paradigm=4454	0		The men hugged doctors on occasion only at the high school.
experiment=NPI-env=only-npi=either-crucial_item=only-licensor=1-scope=1-npi_present=1-paradigm=5405	1		Only the actor cooks either at the bank.
experiment=NPI-env=only-npi=either-crucial_item=only-licensor=1-scope=1-npi_present=0-paradigm=5405	1		Only the actor cooks on occasion at the bank.
experiment=NPI-env=only-npi=either-crucial_item=only-licensor=1-scope=0-npi_present=1-paradigm=5405	0		The actor cooks either only at the bank.
experiment=NPI-env=only-npi=either-crucial_item=only-licensor=1-scope=0-npi_present=0-paradigm=5405	0		The actor cooks on occasion only at the bank.
experiment=NPI-env=only-npi=inyears-crucial_item=only-licensor=1-scope=1-npi_present=1-paradigm=4631	1		Only the teachers had disliked waiters in years at the high school.
experiment=NPI-env=only-npi=inyears-crucial_item=only-licensor=1-scope=1-npi_present=0-paradigm=4631	1		Only the teachers had disliked waiters on occasion at the high school.
experiment=NPI-env=only-npi=inyears-crucial_item=only-licensor=1-scope=0-npi_present=1-paradigm=4631	0		The teachers had disliked waiters in years only at the high school.
experiment=NPI-env=only-npi=inyears-crucial_item=only-licensor=1-scope=0-npi_present=0-paradigm=4631	0		The teachers had disliked waiters on occasion only at the high school.
experiment=NPI-env=only-npi=ever-crucial_item=only-licensor=1-scope=1-npi_present=1-paradigm=459	1		Only the cashiers would ever like the waitresses.
experiment=NPI-env=only-npi=ever-crucial_item=only-licensor=1-scope=1-npi_present=0-paradigm=459	1		Only the cashiers would certainly like the waitresses.
experiment=NPI-env=only-npi=ever-crucial_item=only-licensor=1-scope=0-npi_present=1-paradigm=459	0		The cashiers would ever like only the waitresses.
experiment=NPI-env=only-npi=ever-crucial_item=only-licensor=1-scope=0-npi_present=0-paradigm=459	0		The cashiers would certainly like only the waitresses.
experiment=NPI-env=only-npi=ever-crucial_item=only-licensor=1-scope=1-npi_present=1-paradigm=933	1		Only the cashier ever cares for the women.
experiment=NPI-env=only-npi=ever-crucial_item=only-licensor=1-scope=1-npi_present=0-paradigm=933	1		Only the cashier certainly cares for the women.
experiment=NPI-env=only-npi=ever-crucial_item=only-licensor=1-scope=0-npi_present=1-paradigm=933	0		The cashier ever cares for only the women.
experiment=NPI-env=only-npi=ever-crucial_item=only-licensor=1-scope=0-npi_present=0-paradigm=933	0		The cashier certainly cares for only the women.
experiment=NPI-env=only-npi=any-crucial_item=only-licensor=1-scope=1-npi_present=1-paradigm=1431	1		Only the doctors drive to any grocery stores.
experiment=NPI-env=only-npi=any-crucial_item=only-licensor=1-scope=1-npi_present=0-paradigm=1431	1		Only the doctors drive to the grocery stores.
experiment=NPI-env=only-npi=any-crucial_item=only-licensor=1-scope=0-npi_present=1-paradigm=1431	0		Any doctors only drive to the grocery stores.
experiment=NPI-env=only-npi=any-crucial_item=only-licensor=1-scope=0-npi_present=0-paradigm=1431	0		The doctors only drive to the grocery stores.
experiment=NPI-env=only-npi=any-crucial_item=only-licensor=1-scope=1-npi_present=1-paradigm=1724	1		Only the waiters have bought any dishes.
experiment=NPI-env=only-npi=any-crucial_item=only-licensor=1-scope=1-npi_present=0-paradigm=1724	1		Only the waiters have bought these dishes.
experiment=NPI-env=only-npi=any-crucial_item=only-licensor=1-scope=0-npi_present=1-paradigm=1724	0		Any waiters only have bought the dishes.
experiment=NPI-env=only-npi=any-crucial_item=only-licensor=1-scope=0-npi_present=0-paradigm=1724	0		Those waiters only have bought the dishes.
experiment=NPI-env=only-npi=either-crucial_item=only-licensor=1-scope=1-npi_present=1-paradigm=5322	1		Only the student would reply either at the library.
experiment=NPI-env=only-npi=either-crucial_item=only-licensor=1-scope=1-npi_present=0-paradigm=5322	1		Only the student would reply as well at the library.
experiment=NPI-env=only-npi=either-crucial_item=only-licensor=1-scope=0-npi_present=1-paradigm=5322	0		The student would reply either only at the library.
experiment=NPI-env=only-npi=either-crucial_item=only-licensor=1-scope=0-npi_present=0-paradigm=5322	0		The student would reply as well only at the library.
experiment=NPI-env=only-npi=atall-crucial_item=only-licensor=1-scope=1-npi_present=1-paradigm=2433	1		Only the women have chatted at all at the school.
experiment=NPI-env=only-npi=atall-crucial_item=only-licensor=1-scope=1-npi_present=0-paradigm=2433	1		Only the women have chatted on occasion at the school.
experiment=NPI-env=only-npi=atall-crucial_item=only-licensor=1-scope=0-npi_present=1-paradigm=2433	0		The women have chatted at all only at the school.
experiment=NPI-env=only-npi=atall-crucial_item=only-licensor=1-scope=0-npi_present=0-paradigm=2433	0		The women on occasion only at the school.
experiment=NPI-env=only-npi=inyears-crucial_item=only-licensor=1-scope=1-npi_present=1-paradigm=4506	1		Only the waiter fled from guys in years at the cafe.
experiment=NPI-env=only-npi=inyears-crucial_item=only-licensor=1-scope=1-npi_present=0-paradigm=4506	1		Only the waiter fled from guys for a while at the cafe.
experiment=NPI-env=only-npi=inyears-crucial_item=only-licensor=1-scope=0-npi_present=1-paradigm=4506	0		The waiter fled from guys in years only at the cafe.
experiment=NPI-env=only-npi=inyears-crucial_item=only-licensor=1-scope=0-npi_present=0-paradigm=4506	0		The waiter fled from guys for a while only at the cafe.
experiment=NPI-env=only-npi=any-crucial_item=only-licensor=1-scope=1-npi_present=1-paradigm=1153	1		Only the students should arrive at any libraries.
experiment=NPI-env=only-npi=any-crucial_item=only-licensor=1-scope=1-npi_present=0-paradigm=1153	1		Only the students should arrive at the libraries.
experiment=NPI-env=only-npi=any-crucial_item=only-licensor=1-scope=0-npi_present=1-paradigm=1153	0		Any students only should arrive at the libraries.
experiment=NPI-env=only-npi=any-crucial_item=only-licensor=1-scope=0-npi_present=0-paradigm=1153	0		The students only should arrive at the libraries.
experiment=NPI-env=only-npi=either-crucial_item=only-licensor=1-scope=1-npi_present=1-paradigm=5833	1		Only the dancer was drinking either at the college campus.
experiment=NPI-env=only-npi=either-crucial_item=only-licensor=1-scope=1-npi_present=0-paradigm=5833	1		Only the dancer was drinking on weekends at the college campus.
experiment=NPI-env=only-npi=either-crucial_item=only-licensor=1-scope=0-npi_present=1-paradigm=5833	0		The dancer was drinking either only at the college campus.
experiment=NPI-env=only-npi=either-crucial_item=only-licensor=1-scope=0-npi_present=0-paradigm=5833	0		The dancer was drinking on weekends only at the college campus.
experiment=NPI-env=only-npi=atall-crucial_item=only-licensor=1-scope=1-npi_present=1-paradigm=2857	1		Only the waitresses have forgotten books at all at the movie theater.
experiment=NPI-env=only-npi=atall-crucial_item=only-licensor=1-scope=1-npi_present=0-paradigm=2857	1		Only the waitresses have forgotten books regularly at the movie theater.
experiment=NPI-env=only-npi=atall-crucial_item=only-licensor=1-scope=0-npi_present=1-paradigm=2857	0		The waitresses have forgotten books at all only at the movie theater.
experiment=NPI-env=only-npi=atall-crucial_item=only-licensor=1-scope=0-npi_present=0-paradigm=2857	0		The waitresses books regularly only at the movie theater.
experiment=NPI-env=only-npi=either-crucial_item=only-licensor=1-scope=1-npi_present=1-paradigm=5989	1		Only the teachers would conspire either at the bank.
experiment=NPI-env=only-npi=either-crucial_item=only-licensor=1-scope=1-npi_present=0-paradigm=5989	1		Only the teachers would conspire on weekends at the bank.
experiment=NPI-env=only-npi=either-crucial_item=only-licensor=1-scope=0-npi_present=1-paradigm=5989	0		The teachers would conspire either only at the bank.
experiment=NPI-env=only-npi=either-crucial_item=only-licensor=1-scope=0-npi_present=0-paradigm=5989	0		The teachers would conspire on weekends only at the bank.
experiment=NPI-env=only-npi=atall-crucial_item=only-licensor=1-scope=1-npi_present=1-paradigm=2903	1		Only the student does insult documentaries at all at the cafe.
experiment=NPI-env=only-npi=atall-crucial_item=only-licensor=1-scope=1-npi_present=0-paradigm=2903	1		Only the student does insult documentaries as well at the cafe.
experiment=NPI-env=only-npi=atall-crucial_item=only-licensor=1-scope=0-npi_present=1-paradigm=2903	0		The student does insult documentaries at all only at the cafe.
experiment=NPI-env=only-npi=atall-crucial_item=only-licensor=1-scope=0-npi_present=0-paradigm=2903	0		The student documentaries as well only at the cafe.
experiment=NPI-env=only-npi=yet-crucial_item=only-licensor=1-scope=1-npi_present=1-paradigm=3187	1		Only a child swallowed yet at the bank.
experiment=NPI-env=only-npi=yet-crucial_item=only-licensor=1-scope=1-npi_present=0-paradigm=3187	1		Only a child swallowed regularly at the bank.
experiment=NPI-env=only-npi=yet-crucial_item=only-licensor=1-scope=0-npi_present=1-paradigm=3187	0		A child swallowed yet only at the bank.
experiment=NPI-env=only-npi=yet-crucial_item=only-licensor=1-scope=0-npi_present=0-paradigm=3187	0		A child swallowed regularly only at the bank.
experiment=NPI-env=only-npi=either-crucial_item=only-licensor=1-scope=1-npi_present=1-paradigm=5847	1		Only the pedestrians could embrace either at the museum.
experiment=NPI-env=only-npi=either-crucial_item=only-licensor=1-scope=1-npi_present=0-paradigm=5847	1		Only the pedestrians could embrace as well at the museum.
experiment=NPI-env=only-npi=either-crucial_item=only-licensor=1-scope=0-npi_present=1-paradigm=5847	0		The pedestrians could embrace either only at the museum.
experiment=NPI-env=only-npi=either-crucial_item=only-licensor=1-scope=0-npi_present=0-paradigm=5847	0		The pedestrians could embrace as well only at the museum.
experiment=NPI-env=only-npi=yet-crucial_item=only-licensor=1-scope=1-npi_present=1-paradigm=3709	1		Only a boy was laughing yet at the library.
experiment=NPI-env=only-npi=yet-crucial_item=only-licensor=1-scope=1-npi_present=0-paradigm=3709	1		Only a boy was laughing regularly at the library.
experiment=NPI-env=only-npi=yet-crucial_item=only-licensor=1-scope=0-npi_present=1-paradigm=3709	0		A boy was laughing yet only at the library.
experiment=NPI-env=only-npi=yet-crucial_item=only-licensor=1-scope=0-npi_present=0-paradigm=3709	0		A boy was laughing regularly only at the library.
experiment=NPI-env=only-npi=ever-crucial_item=only-licensor=1-scope=1-npi_present=1-paradigm=949	1		Only the cashiers ever drove to the art galleries.
experiment=NPI-env=only-npi=ever-crucial_item=only-licensor=1-scope=1-npi_present=0-paradigm=949	1		Only the cashiers really drove to the art galleries.
experiment=NPI-env=only-npi=ever-crucial_item=only-licensor=1-scope=0-npi_present=1-paradigm=949	0		The cashiers ever drove to only the art galleries.
experiment=NPI-env=only-npi=ever-crucial_item=only-licensor=1-scope=0-npi_present=0-paradigm=949	0		The cashiers really drove to only the art galleries.
experiment=NPI-env=only-npi=ever-crucial_item=only-licensor=1-scope=1-npi_present=1-paradigm=800	1		Only the girls should ever explore the banks.
experiment=NPI-env=only-npi=ever-crucial_item=only-licensor=1-scope=1-npi_present=0-paradigm=800	1		Only the girls should really explore the banks.
experiment=NPI-env=only-npi=ever-crucial_item=only-licensor=1-scope=0-npi_present=1-paradigm=800	0		The girls should ever explore only the banks.
experiment=NPI-env=only-npi=ever-crucial_item=only-licensor=1-scope=0-npi_present=0-paradigm=800	0		The girls should really explore only the banks.
experiment=NPI-env=only-npi=either-crucial_item=only-licensor=1-scope=1-npi_present=1-paradigm=5135	1		Only the girl studied either at the college campus.
experiment=NPI-env=only-npi=either-crucial_item=only-licensor=1-scope=1-npi_present=0-paradigm=5135	1		Only the girl studied regularly at the college campus.
experiment=NPI-env=only-npi=either-crucial_item=only-licensor=1-scope=0-npi_present=1-paradigm=5135	0		The girl studied either only at the college campus.
