experiment=NPI-env=only-npi=any-crucial_item=only-licensor=1-scope=0-npi_present=0-paradigm=1594	0		These teenagers only attacked the students.
experiment=NPI-env=only-npi=ever-crucial_item=only-licensor=1-scope=1-npi_present=1-paradigm=522	1		Only the girl might ever admire the gloves.
experiment=NPI-env=only-npi=ever-crucial_item=only-licensor=1-scope=1-npi_present=0-paradigm=522	1		Only the girl might clearly admire the gloves.
experiment=NPI-env=only-npi=ever-crucial_item=only-licensor=1-scope=0-npi_present=1-paradigm=522	0		The girl might ever admire only the gloves.
experiment=NPI-env=only-npi=ever-crucial_item=only-licensor=1-scope=0-npi_present=0-paradigm=522	0		The girl might clearly admire only the gloves.
experiment=NPI-env=only-npi=any-crucial_item=only-licensor=1-scope=1-npi_present=1-paradigm=1747	1		Only the students are breaking any glasses.
experiment=NPI-env=only-npi=any-crucial_item=only-licensor=1-scope=1-npi_present=0-paradigm=1747	1		Only the students are breaking the glasses.
experiment=NPI-env=only-npi=any-crucial_item=only-licensor=1-scope=0-npi_present=1-paradigm=1747	0		Any students only are breaking the glasses.
experiment=NPI-env=only-npi=any-crucial_item=only-licensor=1-scope=0-npi_present=0-paradigm=1747	0		The students only are breaking the glasses.
experiment=NPI-env=only-npi=either-crucial_item=only-licensor=1-scope=1-npi_present=1-paradigm=5068	1		Only the teenager hunts either at the art gallery.
experiment=NPI-env=only-npi=either-crucial_item=only-licensor=1-scope=1-npi_present=0-paradigm=5068	1		Only the teenager hunts for a while at the art gallery.
experiment=NPI-env=only-npi=either-crucial_item=only-licensor=1-scope=0-npi_present=1-paradigm=5068	0		The teenager hunts either only at the art gallery.
experiment=NPI-env=only-npi=either-crucial_item=only-licensor=1-scope=0-npi_present=0-paradigm=5068	0		The teenager hunts for a while only at the art gallery.
experiment=NPI-env=only-npi=yet-crucial_item=only-licensor=1-scope=1-npi_present=1-paradigm=3169	1		Only the doctor likes couches yet at the public park.
experiment=NPI-env=only-npi=yet-crucial_item=only-licensor=1-scope=1-npi_present=0-paradigm=3169	1		Only the doctor likes couches as well at the public park.
experiment=NPI-env=only-npi=yet-crucial_item=only-licensor=1-scope=0-npi_present=1-paradigm=3169	0		The doctor likes couches yet only at the public park.
experiment=NPI-env=only-npi=yet-crucial_item=only-licensor=1-scope=0-npi_present=0-paradigm=3169	0		The doctor likes couches as well only at the public park.
experiment=NPI-env=only-npi=atall-crucial_item=only-licensor=1-scope=1-npi_present=1-paradigm=2176	1		Only the waiters might skate around art galleries at all at the college campus.
experiment=NPI-env=only-npi=atall-crucial_item=only-licensor=1-scope=1-npi_present=0-paradigm=2176	1		Only the waiters might skate around art galleries on weekends at the college campus.
experiment=NPI-env=only-npi=atall-crucial_item=only-licensor=1-scope=0-npi_present=1-paradigm=2176	0		The waiters might skate around art galleries at all only at the college campus.
experiment=NPI-env=only-npi=atall-crucial_item=only-licensor=1-scope=0-npi_present=0-paradigm=2176	0		The waiters art galleries on weekends only at the college campus.
experiment=NPI-env=only-npi=atall-crucial_item=only-licensor=1-scope=1-npi_present=1-paradigm=2992	1		Only an actress was attacking actresses at all at the cafe.
experiment=NPI-env=only-npi=atall-crucial_item=only-licensor=1-scope=1-npi_present=0-paradigm=2992	1		Only an actress was attacking actresses for a while at the cafe.
experiment=NPI-env=only-npi=atall-crucial_item=only-licensor=1-scope=0-npi_present=1-paradigm=2992	0		An actress was attacking actresses at all only at the cafe.
experiment=NPI-env=only-npi=atall-crucial_item=only-licensor=1-scope=0-npi_present=0-paradigm=2992	0		An actress actresses for a while only at the cafe.
experiment=NPI-env=only-npi=ever-crucial_item=only-licensor=1-scope=1-npi_present=1-paradigm=458	1		Only the actresses should ever exit the hospitals.
experiment=NPI-env=only-npi=ever-crucial_item=only-licensor=1-scope=1-npi_present=0-paradigm=458	1		Only the actresses should certainly exit the hospitals.
experiment=NPI-env=only-npi=ever-crucial_item=only-licensor=1-scope=0-npi_present=1-paradigm=458	0		The actresses should ever exit only the hospitals.
experiment=NPI-env=only-npi=ever-crucial_item=only-licensor=1-scope=0-npi_present=0-paradigm=458	0		The actresses should certainly exit only the hospitals.
experiment=NPI-env=only-npi=any-crucial_item=only-licensor=1-scope=1-npi_present=1-paradigm=1011	1		Only the children had described any documentaries.
experiment=NPI-env=only-npi=any-crucial_item=only-licensor=1-scope=1-npi_present=0-paradigm=1011	1		Only the children had described the documentaries.
experiment=NPI-env=only-npi=any-crucial_item=only-licensor=1-scope=0-npi_present=1-paradigm=1011	0		Any children only had described the documentaries.
experiment=NPI-env=only-npi=any-crucial_item=only-licensor=1-scope=0-npi_present=0-paradigm=1011	0		These children only had described the documentaries.
experiment=NPI-env=only-npi=either-crucial_item=only-licensor=1-scope=1-npi_present=1-paradigm=5054	1		Only the adults do meet either at the movie theater.
experiment=NPI-env=only-npi=either-crucial_item=only-licensor=1-scope=1-npi_present=0-paradigm=5054	1		Only the adults do meet on weekends at the movie theater.
experiment=NPI-env=only-npi=either-crucial_item=only-licensor=1-scope=0-npi_present=1-paradigm=5054	0		The adults do meet either only at the movie theater.
experiment=NPI-env=only-npi=either-crucial_item=only-licensor=1-scope=0-npi_present=0-paradigm=5054	0		The adults do meet on weekends only at the movie theater.
experiment=NPI-env=only-npi=either-crucial_item=only-licensor=1-scope=1-npi_present=1-paradigm=5031	1		Only a girl could succeed either at the movie theater.
experiment=NPI-env=only-npi=either-crucial_item=only-licensor=1-scope=1-npi_present=0-paradigm=5031	1		Only a girl could succeed for a while at the movie theater.
experiment=NPI-env=only-npi=either-crucial_item=only-licensor=1-scope=0-npi_present=1-paradigm=5031	0		A girl could succeed either only at the movie theater.
experiment=NPI-env=only-npi=either-crucial_item=only-licensor=1-scope=0-npi_present=0-paradigm=5031	0		A girl could succeed for a while only at the movie theater.
experiment=NPI-env=only-npi=any-crucial_item=only-licensor=1-scope=1-npi_present=1-paradigm=1306	1		Only the customers were taking any books.
experiment=NPI-env=only-npi=any-crucial_item=only-licensor=1-scope=1-npi_present=0-paradigm=1306	1		Only the customers were taking the books.
experiment=NPI-env=only-npi=any-crucial_item=only-licensor=1-scope=0-npi_present=1-paradigm=1306	0		Any customers only were taking the books.
experiment=NPI-env=only-npi=any-crucial_item=only-licensor=1-scope=0-npi_present=0-paradigm=1306	0		These customers only were taking the books.
experiment=NPI-env=only-npi=atall-crucial_item=only-licensor=1-scope=1-npi_present=1-paradigm=2231	1		Only the guys would care for adults at all at the library.
experiment=NPI-env=only-npi=atall-crucial_item=only-licensor=1-scope=1-npi_present=0-paradigm=2231	1		Only the guys would care for adults as well at the library.
experiment=NPI-env=only-npi=atall-crucial_item=only-licensor=1-scope=0-npi_present=1-paradigm=2231	0		The guys would care for adults at all only at the library.
experiment=NPI-env=only-npi=atall-crucial_item=only-licensor=1-scope=0-npi_present=0-paradigm=2231	0		The guys adults as well only at the library.
experiment=NPI-env=only-npi=yet-crucial_item=only-licensor=1-scope=1-npi_present=1-paradigm=3030	1		Only the actor responds yet at the restaurant.
experiment=NPI-env=only-npi=yet-crucial_item=only-licensor=1-scope=1-npi_present=0-paradigm=3030	1		Only the actor responds as well at the restaurant.
experiment=NPI-env=only-npi=yet-crucial_item=only-licensor=1-scope=0-npi_present=1-paradigm=3030	0		The actor responds yet only at the restaurant.
experiment=NPI-env=only-npi=yet-crucial_item=only-licensor=1-scope=0-npi_present=0-paradigm=3030	0		The actor responds as well only at the restaurant.
experiment=NPI-env=only-npi=ever-crucial_item=only-licensor=1-scope=1-npi_present=1-paradigm=643	1		Only the actor ever discussed the doctors.
experiment=NPI-env=only-npi=ever-crucial_item=only-licensor=1-scope=1-npi_present=0-paradigm=643	1		Only the actor also discussed the doctors.
experiment=NPI-env=only-npi=ever-crucial_item=only-licensor=1-scope=0-npi_present=1-paradigm=643	0		The actor ever discussed only the doctors.
experiment=NPI-env=only-npi=ever-crucial_item=only-licensor=1-scope=0-npi_present=0-paradigm=643	0		The actor also discussed only the doctors.
experiment=NPI-env=only-npi=ever-crucial_item=only-licensor=1-scope=1-npi_present=1-paradigm=711	1		Only the pedestrian ever dropped by the malls.
experiment=NPI-env=only-npi=ever-crucial_item=only-licensor=1-scope=1-npi_present=0-paradigm=711	1		Only the pedestrian clearly dropped by the malls.
experiment=NPI-env=only-npi=ever-crucial_item=only-licensor=1-scope=0-npi_present=1-paradigm=711	0		The pedestrian ever dropped by only the malls.
experiment=NPI-env=only-npi=ever-crucial_item=only-licensor=1-scope=0-npi_present=0-paradigm=711	0		The pedestrian clearly dropped by only the malls.
experiment=NPI-env=only-npi=ever-crucial_item=only-licensor=1-scope=1-npi_present=1-paradigm=282	1		Only the customer ever cleans the glasses.
experiment=NPI-env=only-npi=ever-crucial_item=only-licensor=1-scope=1-npi_present=0-paradigm=282	1		Only the customer really cleans the glasses.
experiment=NPI-env=only-npi=ever-crucial_item=only-licensor=1-scope=0-npi_present=1-paradigm=282	0		The customer ever cleans only the glasses.
experiment=NPI-env=only-npi=ever-crucial_item=only-licensor=1-scope=0-npi_present=0-paradigm=282	0		The customer really cleans only the glasses.
experiment=NPI-env=only-npi=either-crucial_item=only-licensor=1-scope=1-npi_present=1-paradigm=5227	1		Only the adults would wave either at the high school.
experiment=NPI-env=only-npi=either-crucial_item=only-licensor=1-scope=1-npi_present=0-paradigm=5227	1		Only the adults would wave for a while at the high school.
experiment=NPI-env=only-npi=either-crucial_item=only-licensor=1-scope=0-npi_present=1-paradigm=5227	0		The adults would wave either only at the high school.
experiment=NPI-env=only-npi=either-crucial_item=only-licensor=1-scope=0-npi_present=0-paradigm=5227	0		The adults would wave for a while only at the high school.
experiment=NPI-env=only-npi=ever-crucial_item=only-licensor=1-scope=1-npi_present=1-paradigm=773	1		Only the driver has ever known the humans.
experiment=NPI-env=only-npi=ever-crucial_item=only-licensor=1-scope=1-npi_present=0-paradigm=773	1		Only the driver has certainly known the humans.
experiment=NPI-env=only-npi=ever-crucial_item=only-licensor=1-scope=0-npi_present=1-paradigm=773	0		The driver has ever known only the humans.
experiment=NPI-env=only-npi=ever-crucial_item=only-licensor=1-scope=0-npi_present=0-paradigm=773	0		The driver has certainly known only the humans.
experiment=NPI-env=only-npi=either-crucial_item=only-licensor=1-scope=1-npi_present=1-paradigm=5355	1		Only a teacher could yell either at the art gallery.
experiment=NPI-env=only-npi=either-crucial_item=only-licensor=1-scope=1-npi_present=0-paradigm=5355	1		Only a teacher could yell on occasion at the art gallery.
experiment=NPI-env=only-npi=either-crucial_item=only-licensor=1-scope=0-npi_present=1-paradigm=5355	0		A teacher could yell either only at the art gallery.
experiment=NPI-env=only-npi=either-crucial_item=only-licensor=1-scope=0-npi_present=0-paradigm=5355	0		A teacher could yell on occasion only at the art gallery.
experiment=NPI-env=only-npi=any-crucial_item=only-licensor=1-scope=1-npi_present=1-paradigm=1671	1		Only the adults are passing any libraries.
experiment=NPI-env=only-npi=any-crucial_item=only-licensor=1-scope=1-npi_present=0-paradigm=1671	1		Only the adults are passing these libraries.
experiment=NPI-env=only-npi=any-crucial_item=only-licensor=1-scope=0-npi_present=1-paradigm=1671	0		Any adults only are passing the libraries.
experiment=NPI-env=only-npi=any-crucial_item=only-licensor=1-scope=0-npi_present=0-paradigm=1671	0		These adults only are passing the libraries.
experiment=NPI-env=only-npi=ever-crucial_item=only-licensor=1-scope=1-npi_present=1-paradigm=538	1		Only the boys had ever remembered the adults.
experiment=NPI-env=only-npi=ever-crucial_item=only-licensor=1-scope=1-npi_present=0-paradigm=538	1		Only the boys had really remembered the adults.
experiment=NPI-env=only-npi=ever-crucial_item=only-licensor=1-scope=0-npi_present=1-paradigm=538	0		The boys had ever remembered only the adults.
experiment=NPI-env=only-npi=ever-crucial_item=only-licensor=1-scope=0-npi_present=0-paradigm=538	0		The boys had really remembered only the adults.
experiment=NPI-env=only-npi=yet-crucial_item=only-licensor=1-scope=1-npi_present=1-paradigm=3665	1		Only the driver has died yet at the bank.
experiment=NPI-env=only-npi=yet-crucial_item=only-licensor=1-scope=1-npi_present=0-paradigm=3665	1		Only the driver has died as well at the bank.
experiment=NPI-env=only-npi=yet-crucial_item=only-licensor=1-scope=0-npi_present=1-paradigm=3665	0		The driver has died yet only at the bank.
experiment=NPI-env=only-npi=yet-crucial_item=only-licensor=1-scope=0-npi_present=0-paradigm=3665	0		The driver has died as well only at the bank.
experiment=NPI-env=only-npi=either-crucial_item=only-licensor=1-scope=1-npi_present=1-paradigm=5225	1		Only a pedestrian can see either at the art gallery.
experiment=NPI-env=only-npi=either-crucial_item=only-licensor=1-scope=1-npi_present=0-paradigm=5225	1		Only a pedestrian can see regularly at the art gallery.
experiment=NPI-env=only-npi=either-crucial_item=only-licensor=1-scope=0-npi_present=1-paradigm=5225	0		A pedestrian can see either only at the art gallery.
experiment=NPI-env=only-npi=either-crucial_item=only-licensor=1-scope=0-npi_present=0-paradigm=5225	0		A pedestrian can see regularly only at the art gallery.
experiment=NPI-env=only-npi=inyears-crucial_item=only-licensor=1-scope=1-npi_present=1-paradigm=4273	1		Only the cashiers have returned to waiters in years at the library.
experiment=NPI-env=only-npi=inyears-crucial_item=only-licensor=1-scope=1-npi_present=0-paradigm=4273	1		Only the cashiers have returned to waiters as well at the library.
experiment=NPI-env=only-npi=inyears-crucial_item=only-licensor=1-scope=0-npi_present=1-paradigm=4273	0		The cashiers have returned to waiters in years only at the library.
experiment=NPI-env=only-npi=inyears-crucial_item=only-licensor=1-scope=0-npi_present=0-paradigm=4273	0		The cashiers have returned to waiters as well only at the library.
experiment=NPI-env=only-npi=ever-crucial_item=only-licensor=1-scope=1-npi_present=1-paradigm=692	1		Only the teachers ever examined the stories.
experiment=NPI-env=only-npi=ever-crucial_item=only-licensor=1-scope=1-npi_present=0-paradigm=692	1		Only the teachers also examined the stories.
experiment=NPI-env=only-npi=ever-crucial_item=only-licensor=1-scope=0-npi_present=1-paradigm=692	0		The teachers ever examined only the stories.
experiment=NPI-env=only-npi=ever-crucial_item=only-licensor=1-scope=0-npi_present=0-paradigm=692	0		The teachers also examined only the stories.
experiment=NPI-env=only-npi=either-crucial_item=only-licensor=1-scope=1-npi_present=1-paradigm=5337	1		Only the customers have cooked either at the restaurant.
experiment=NPI-env=only-npi=either-crucial_item=only-licensor=1-scope=1-npi_present=0-paradigm=5337	1		Only the customers have cooked for a while at the restaurant.
experiment=NPI-env=only-npi=either-crucial_item=only-licensor=1-scope=0-npi_present=1-paradigm=5337	0		The customers have cooked either only at the restaurant.
experiment=NPI-env=only-npi=either-crucial_item=only-licensor=1-scope=0-npi_present=0-paradigm=5337	0		The customers have cooked for a while only at the restaurant.
experiment=NPI-env=only-npi=atall-crucial_item=only-licensor=1-scope=1-npi_present=1-paradigm=2625	1		Only the boys communicated at all at the cafe.
experiment=NPI-env=only-npi=atall-crucial_item=only-licensor=1-scope=1-npi_present=0-paradigm=2625	1		Only the boys communicated regularly at the cafe.
experiment=NPI-env=only-npi=atall-crucial_item=only-licensor=1-scope=0-npi_present=1-paradigm=2625	0		The boys communicated at all only at the cafe.
experiment=NPI-env=only-npi=atall-crucial_item=only-licensor=1-scope=0-npi_present=0-paradigm=2625	0		The boys regularly only at the cafe.
experiment=NPI-env=only-npi=either-crucial_item=only-licensor=1-scope=1-npi_present=1-paradigm=5675	1		Only the senator can see either at the art gallery.
experiment=NPI-env=only-npi=either-crucial_item=only-licensor=1-scope=1-npi_present=0-paradigm=5675	1		Only the senator can see on weekends at the art gallery.
experiment=NPI-env=only-npi=either-crucial_item=only-licensor=1-scope=0-npi_present=1-paradigm=5675	0		The senator can see either only at the art gallery.
experiment=NPI-env=only-npi=either-crucial_item=only-licensor=1-scope=0-npi_present=0-paradigm=5675	0		The senator can see on weekends only at the art gallery.
experiment=NPI-env=only-npi=yet-crucial_item=only-licensor=1-scope=1-npi_present=1-paradigm=3476	1		Only the men will fight yet at the high school.
experiment=NPI-env=only-npi=yet-crucial_item=only-licensor=1-scope=1-npi_present=0-paradigm=3476	1		Only the men will fight on weekends at the high school.
experiment=NPI-env=only-npi=yet-crucial_item=only-licensor=1-scope=0-npi_present=1-paradigm=3476	0		The men will fight yet only at the high school.
experiment=NPI-env=only-npi=yet-crucial_item=only-licensor=1-scope=0-npi_present=0-paradigm=3476	0		The men will fight on weekends only at the high school.
experiment=NPI-env=only-npi=yet-crucial_item=only-licensor=1-scope=1-npi_present=1-paradigm=3267	1		Only the doctor discussed men yet at the movie theater.
experiment=NPI-env=only-npi=yet-crucial_item=only-licensor=1-scope=1-npi_present=0-paradigm=3267	1		Only the doctor discussed men on weekends at the movie theater.
experiment=NPI-env=only-npi=yet-crucial_item=only-licensor=1-scope=0-npi_present=1-paradigm=3267	0		The doctor discussed men yet only at the movie theater.
experiment=NPI-env=only-npi=yet-crucial_item=only-licensor=1-scope=0-npi_present=0-paradigm=3267	0		The doctor discussed men on weekends only at the movie theater.
experiment=NPI-env=only-npi=inyears-crucial_item=only-licensor=1-scope=1-npi_present=1-paradigm=4927	1		Only the teacher retaliated in years at the restaurant.
experiment=NPI-env=only-npi=inyears-crucial_item=only-licensor=1-scope=1-npi_present=0-paradigm=4927	1		Only the teacher retaliated for a while at the restaurant.
experiment=NPI-env=only-npi=inyears-crucial_item=only-licensor=1-scope=0-npi_present=1-paradigm=4927	0		The teacher retaliated in years only at the restaurant.
experiment=NPI-env=only-npi=inyears-crucial_item=only-licensor=1-scope=0-npi_present=0-paradigm=4927	0		The teacher retaliated for a while only at the restaurant.
experiment=NPI-env=only-npi=atall-crucial_item=only-licensor=1-scope=1-npi_present=1-paradigm=2908	1		Only an actor had helped teenagers at all at the library.
experiment=NPI-env=only-npi=atall-crucial_item=only-licensor=1-scope=1-npi_present=0-paradigm=2908	1		Only an actor had helped teenagers on weekends at the library.
experiment=NPI-env=only-npi=atall-crucial_item=only-licensor=1-scope=0-npi_present=1-paradigm=2908	0		An actor had helped teenagers at all only at the library.
experiment=NPI-env=only-npi=atall-crucial_item=only-licensor=1-scope=0-npi_present=0-paradigm=2908	0		An actor teenagers on weekends only at the library.
experiment=NPI-env=only-npi=yet-crucial_item=only-licensor=1-scope=1-npi_present=1-paradigm=3430	1		Only the waitresses spin around yet at the mall.
experiment=NPI-env=only-npi=yet-crucial_item=only-licensor=1-scope=1-npi_present=0-paradigm=3430	1		Only the waitresses spin around as well at the mall.
experiment=NPI-env=only-npi=yet-crucial_item=only-licensor=1-scope=0-npi_present=1-paradigm=3430	0		The waitresses spin around yet only at the mall.
experiment=NPI-env=only-npi=yet-crucial_item=only-licensor=1-scope=0-npi_present=0-paradigm=3430	0		The waitresses spin around as well only at the mall.
experiment=NPI-env=only-npi=any-crucial_item=only-licensor=1-scope=1-npi_present=1-paradigm=1130	1		Only the teachers talked about any actresses.
experiment=NPI-env=only-npi=any-crucial_item=only-licensor=1-scope=1-npi_present=0-paradigm=1130	1		Only the teachers talked about the actresses.
experiment=NPI-env=only-npi=any-crucial_item=only-licensor=1-scope=0-npi_present=1-paradigm=1130	0		Any teachers only talked about the actresses.
experiment=NPI-env=only-npi=any-crucial_item=only-licensor=1-scope=0-npi_present=0-paradigm=1130	0		Those teachers only talked about the actresses.
experiment=NPI-env=only-npi=inyears-crucial_item=only-licensor=1-scope=1-npi_present=1-paradigm=4600	1		Only a boy has gone fishing in years at the mall.
experiment=NPI-env=only-npi=inyears-crucial_item=only-licensor=1-scope=1-npi_present=0-paradigm=4600	1		Only a boy has gone fishing regularly at the mall.
experiment=NPI-env=only-npi=inyears-crucial_item=only-licensor=1-scope=0-npi_present=1-paradigm=4600	0		A boy has gone fishing in years only at the mall.
experiment=NPI-env=only-npi=inyears-crucial_item=only-licensor=1-scope=0-npi_present=0-paradigm=4600	0		A boy has gone fishing regularly only at the mall.
experiment=NPI-env=only-npi=atall-crucial_item=only-licensor=1-scope=1-npi_present=1-paradigm=2558	1		Only the waitress litters at all at the library.
experiment=NPI-env=only-npi=atall-crucial_item=only-licensor=1-scope=1-npi_present=0-paradigm=2558	1		Only the waitress litters as well at the library.
experiment=NPI-env=only-npi=atall-crucial_item=only-licensor=1-scope=0-npi_present=1-paradigm=2558	0		The waitress litters at all only at the library.
experiment=NPI-env=only-npi=atall-crucial_item=only-licensor=1-scope=0-npi_present=0-paradigm=2558	0		The waitress as well only at the library.
experiment=NPI-env=only-npi=either-crucial_item=only-licensor=1-scope=1-npi_present=1-paradigm=5321	1		Only a patient concurred either at the museum.
experiment=NPI-env=only-npi=either-crucial_item=only-licensor=1-scope=1-npi_present=0-paradigm=5321	1		Only a patient concurred regularly at the museum.
experiment=NPI-env=only-npi=either-crucial_item=only-licensor=1-scope=0-npi_present=1-paradigm=5321	0		A patient concurred either only at the museum.
experiment=NPI-env=only-npi=either-crucial_item=only-licensor=1-scope=0-npi_present=0-paradigm=5321	0		A patient concurred regularly only at the museum.
experiment=NPI-env=only-npi=any-crucial_item=only-licensor=1-scope=1-npi_present=1-paradigm=1478	1		Only the patients clean any dishes.
experiment=NPI-env=only-npi=any-crucial_item=only-licensor=1-scope=1-npi_present=0-paradigm=1478	1		Only the patients clean the dishes.
experiment=NPI-env=only-npi=any-crucial_item=only-licensor=1-scope=0-npi_present=1-paradigm=1478	0		Any patients only clean the dishes.
experiment=NPI-env=only-npi=any-crucial_item=only-licensor=1-scope=0-npi_present=0-paradigm=1478	0		The patients only clean the dishes.
experiment=NPI-env=only-npi=ever-crucial_item=only-licensor=1-scope=1-npi_present=1-paradigm=420	1		Only a woman ever sold the cars.
experiment=NPI-env=only-npi=ever-crucial_item=only-licensor=1-scope=1-npi_present=0-paradigm=420	1		Only a woman clearly sold the cars.
experiment=NPI-env=only-npi=ever-crucial_item=only-licensor=1-scope=0-npi_present=1-paradigm=420	0		A woman ever sold only the cars.
experiment=NPI-env=only-npi=ever-crucial_item=only-licensor=1-scope=0-npi_present=0-paradigm=420	0		A woman clearly sold only the cars.
experiment=NPI-env=only-npi=yet-crucial_item=only-licensor=1-scope=1-npi_present=1-paradigm=3937	1		Only the waitress murmured yet at the college campus.
experiment=NPI-env=only-npi=yet-crucial_item=only-licensor=1-scope=1-npi_present=0-paradigm=3937	1		Only the waitress murmured as well at the college campus.
experiment=NPI-env=only-npi=yet-crucial_item=only-licensor=1-scope=0-npi_present=1-paradigm=3937	0		The waitress murmured yet only at the college campus.
experiment=NPI-env=only-npi=yet-crucial_item=only-licensor=1-scope=0-npi_present=0-paradigm=3937	0		The waitress murmured as well only at the college campus.
experiment=NPI-env=only-npi=inyears-crucial_item=only-licensor=1-scope=1-npi_present=1-paradigm=4746	1		Only the waitresses have kissed men in years at the restaurant.
experiment=NPI-env=only-npi=inyears-crucial_item=only-licensor=1-scope=1-npi_present=0-paradigm=4746	1		Only the waitresses have kissed men regularly at the restaurant.
experiment=NPI-env=only-npi=inyears-crucial_item=only-licensor=1-scope=0-npi_present=1-paradigm=4746	0		The waitresses have kissed men in years only at the restaurant.
experiment=NPI-env=only-npi=inyears-crucial_item=only-licensor=1-scope=0-npi_present=0-paradigm=4746	0		The waitresses have kissed men regularly only at the restaurant.
experiment=NPI-env=only-npi=ever-crucial_item=only-licensor=1-scope=1-npi_present=1-paradigm=128	1		Only the drivers had ever helped the guests.
experiment=NPI-env=only-npi=ever-crucial_item=only-licensor=1-scope=1-npi_present=0-paradigm=128	1		Only the drivers had certainly helped the guests.
experiment=NPI-env=only-npi=ever-crucial_item=only-licensor=1-scope=0-npi_present=1-paradigm=128	0		The drivers had ever helped only the guests.
experiment=NPI-env=only-npi=ever-crucial_item=only-licensor=1-scope=0-npi_present=0-paradigm=128	0		The drivers had certainly helped only the guests.
experiment=NPI-env=only-npi=either-crucial_item=only-licensor=1-scope=1-npi_present=1-paradigm=5994	1		Only the teacher was donating either at the college campus.
