experiment=NPI-env=negation-npi=ever-crucial_item=no-licensor=1-scope=1-npi_present=0	1		no guests often say that the patients have fled from the deer .
experiment=NPI-env=negation-npi=ever-crucial_item=no-licensor=1-scope=0-npi_present=1	0		the guests ever say that no patients have fled from the deer .
experiment=NPI-env=negation-npi=ever-crucial_item=some-licensor=0-scope=1-npi_present=0	1		Some guests often say that the patients have fled from the deer .
experiment=NPI-env=negation-npi=ever-crucial_item=no-licensor=1-scope=1-npi_present=1	1		no actress did ever imagine that a lady did walk through the mall .
experiment=NPI-env=negation-npi=ever-crucial_item=no-licensor=1-scope=0-npi_present=1	0		an actress did ever imagine that no lady did walk through the mall .
experiment=NPI-env=negation-npi=ever-crucial_item=no-licensor=1-scope=0-npi_present=0	1		an actress did often imagine that no lady did walk through the mall .
experiment=NPI-env=negation-npi=ever-crucial_item=some-licensor=0-scope=1-npi_present=0	1		Some actress did often imagine that a lady did walk through the mall .
experiment=NPI-env=negation-npi=ever-crucial_item=some-licensor=0-scope=0-npi_present=0	1		an actress did often imagine that some lady did walk through the mall .
experiment=NPI-env=negation-npi=ever-crucial_item=no-licensor=1-scope=1-npi_present=1	1		no girls were ever saying that the gals were studying .
experiment=NPI-env=negation-npi=ever-crucial_item=no-licensor=1-scope=0-npi_present=1	0		the girls were ever saying that no gals were studying .
experiment=NPI-env=negation-npi=ever-crucial_item=no-licensor=1-scope=1-npi_present=0	1		no drivers are often thinking that the boy returned to the banks .
experiment=NPI-env=negation-npi=ever-crucial_item=some-licensor=0-scope=1-npi_present=1	0		Some drivers are ever thinking that the boy returned to the banks .
experiment=NPI-env=negation-npi=ever-crucial_item=some-licensor=0-scope=0-npi_present=1	0		the drivers are ever thinking that some boy returned to the banks .
experiment=NPI-env=negation-npi=ever-crucial_item=no-licensor=1-scope=1-npi_present=0	1		no boy had often imagined that a cashier sold a hat .
experiment=NPI-env=negation-npi=ever-crucial_item=no-licensor=1-scope=0-npi_present=1	0		the boy had ever imagined that no cashier sold a hat .
experiment=NPI-env=negation-npi=ever-crucial_item=no-licensor=1-scope=0-npi_present=0	1		the boy had often imagined that no cashier sold a hat .
experiment=NPI-env=negation-npi=ever-crucial_item=some-licensor=0-scope=1-npi_present=0	1		Some boy had often imagined that a cashier sold a hat .
experiment=NPI-env=negation-npi=ever-crucial_item=no-licensor=1-scope=0-npi_present=1	0		the waitresses are ever thinking that no girls forfeit .
experiment=NPI-env=negation-npi=ever-crucial_item=no-licensor=1-scope=0-npi_present=0	1		the waitresses are often thinking that no girls forfeit .
experiment=NPI-env=negation-npi=ever-crucial_item=some-licensor=0-scope=0-npi_present=0	1		the waitresses are often thinking that some girls forfeit .
experiment=NPI-env=negation-npi=ever-crucial_item=no-licensor=1-scope=0-npi_present=0	1		the driver often thinks that no waiter can protest .
experiment=NPI-env=negation-npi=ever-crucial_item=some-licensor=0-scope=0-npi_present=0	1		the driver often thinks that some waiter can protest .
experiment=NPI-env=negation-npi=ever-crucial_item=no-licensor=1-scope=1-npi_present=0	1		no girl was often explaining that the guys wave .
experiment=NPI-env=negation-npi=ever-crucial_item=no-licensor=1-scope=0-npi_present=0	1		a girl was often explaining that no guys wave .
experiment=NPI-env=negation-npi=ever-crucial_item=some-licensor=0-scope=1-npi_present=1	0		Some girl was ever explaining that the guys wave .
experiment=NPI-env=negation-npi=ever-crucial_item=some-licensor=0-scope=1-npi_present=0	1		Some girl was often explaining that the guys wave .
experiment=NPI-env=negation-npi=ever-crucial_item=some-licensor=0-scope=1-npi_present=1	0		Some actresses ever said that a student was seeing .
experiment=NPI-env=negation-npi=ever-crucial_item=no-licensor=1-scope=1-npi_present=0	1		no student was often thinking that the ladies hunt .
experiment=NPI-env=negation-npi=ever-crucial_item=no-licensor=1-scope=0-npi_present=1	0		the student was ever thinking that no ladies hunt .
experiment=NPI-env=negation-npi=ever-crucial_item=no-licensor=1-scope=0-npi_present=0	1		the student was often thinking that no ladies hunt .
experiment=NPI-env=negation-npi=ever-crucial_item=some-licensor=0-scope=1-npi_present=1	0		Some student was ever thinking that the ladies hunt .
experiment=NPI-env=negation-npi=ever-crucial_item=some-licensor=0-scope=0-npi_present=1	0		the student was ever thinking that some ladies hunt .
experiment=NPI-env=negation-npi=ever-crucial_item=no-licensor=1-scope=0-npi_present=1	0		a doctor was ever saying that no woman was driving to the bank .
experiment=NPI-env=negation-npi=ever-crucial_item=no-licensor=1-scope=0-npi_present=0	1		a doctor was often saying that no woman was driving to the bank .
experiment=NPI-env=negation-npi=ever-crucial_item=some-licensor=0-scope=1-npi_present=0	1		Some doctor was often saying that the woman was driving to the bank .
experiment=NPI-env=negation-npi=ever-crucial_item=some-licensor=0-scope=0-npi_present=1	0		a doctor was ever saying that some woman was driving to the bank .
experiment=NPI-env=negation-npi=ever-crucial_item=some-licensor=0-scope=1-npi_present=1	0		Some waitress is ever explaining that a customer had sighed .
experiment=NPI-env=negation-npi=ever-crucial_item=some-licensor=0-scope=1-npi_present=0	1		Some waitress is often explaining that a customer had sighed .
experiment=NPI-env=negation-npi=ever-crucial_item=some-licensor=0-scope=0-npi_present=0	1		the waitress is often explaining that some customer had sighed .
experiment=NPI-env=negation-npi=ever-crucial_item=no-licensor=1-scope=0-npi_present=0	1		a teenager often thinks that no boy did laugh .
experiment=NPI-env=negation-npi=ever-crucial_item=some-licensor=0-scope=1-npi_present=0	1		Some teenager often thinks that the boy did laugh .
experiment=NPI-env=negation-npi=ever-crucial_item=some-licensor=0-scope=0-npi_present=0	1		a teenager often thinks that some boy did laugh .
experiment=NPI-env=negation-npi=ever-crucial_item=no-licensor=1-scope=0-npi_present=1	0		the women had ever explained that no waiter passed the cafes .
experiment=NPI-env=negation-npi=ever-crucial_item=some-licensor=0-scope=0-npi_present=1	0		the women had ever explained that some waiter passed the cafes .
experiment=NPI-env=negation-npi=ever-crucial_item=some-licensor=0-scope=0-npi_present=0	1		the women had often explained that some waiter passed the cafes .
experiment=NPI-env=negation-npi=ever-crucial_item=no-licensor=1-scope=1-npi_present=1	1		no child ever imagined that the pedestrian fled from the actress .
experiment=NPI-env=negation-npi=ever-crucial_item=no-licensor=1-scope=1-npi_present=0	1		no child often imagined that the pedestrian fled from the actress .
experiment=NPI-env=negation-npi=ever-crucial_item=no-licensor=1-scope=0-npi_present=0	1		a person did often imagine that no people will weep .
experiment=NPI-env=negation-npi=ever-crucial_item=some-licensor=0-scope=1-npi_present=1	0		Some person did ever imagine that the people will weep .
experiment=NPI-env=negation-npi=ever-crucial_item=some-licensor=0-scope=0-npi_present=1	0		a person did ever imagine that some people will weep .
experiment=NPI-env=negation-npi=ever-crucial_item=no-licensor=1-scope=1-npi_present=0	1		no lady is often imagining that the gals referenced the waiters .
experiment=NPI-env=negation-npi=ever-crucial_item=no-licensor=1-scope=0-npi_present=1	0		the lady is ever imagining that no gals referenced the waiters .
experiment=NPI-env=negation-npi=ever-crucial_item=some-licensor=0-scope=1-npi_present=1	0		Some lady is ever imagining that the gals referenced the waiters .
experiment=NPI-env=negation-npi=ever-crucial_item=some-licensor=0-scope=0-npi_present=1	0		the lady is ever imagining that some gals referenced the waiters .
experiment=NPI-env=negation-npi=ever-crucial_item=no-licensor=1-scope=1-npi_present=1	1		no patients ever explained that the child would retaliate .
experiment=NPI-env=negation-npi=ever-crucial_item=no-licensor=1-scope=0-npi_present=0	1		the patients often explained that no child would retaliate .
experiment=NPI-env=negation-npi=ever-crucial_item=some-licensor=0-scope=1-npi_present=1	0		Some patients ever explained that the child would retaliate .
experiment=NPI-env=negation-npi=ever-crucial_item=some-licensor=0-scope=0-npi_present=0	1		the students are often explaining that some customer benefits .
experiment=NPI-env=negation-npi=ever-crucial_item=no-licensor=1-scope=0-npi_present=1	0		the woman ever imagined that no guests exit the college campus .
experiment=NPI-env=negation-npi=ever-crucial_item=some-licensor=0-scope=0-npi_present=0	1		the woman often imagined that some guests exit the college campus .
experiment=NPI-env=negation-npi=ever-crucial_item=no-licensor=1-scope=0-npi_present=1	0		the humans ever explain that no guests were explaining everything .
experiment=NPI-env=negation-npi=ever-crucial_item=some-licensor=0-scope=1-npi_present=1	0		Some humans ever explain that the guests were explaining everything .
experiment=NPI-env=negation-npi=ever-crucial_item=no-licensor=1-scope=1-npi_present=1	1		no pedestrian had ever imagined that a boy does criticize the school .
experiment=NPI-env=negation-npi=ever-crucial_item=some-licensor=0-scope=1-npi_present=0	1		Some pedestrian had often imagined that a boy does criticize the school .
experiment=NPI-env=negation-npi=ever-crucial_item=no-licensor=1-scope=1-npi_present=1	1		no people have ever thought that the doctors explored the movie theater .
experiment=NPI-env=negation-npi=ever-crucial_item=some-licensor=0-scope=0-npi_present=0	1		the people have often thought that some doctors explored the movie theater .
experiment=NPI-env=negation-npi=ever-crucial_item=no-licensor=1-scope=1-npi_present=1	1		no guest ever says that the girls sighed .
experiment=NPI-env=negation-npi=ever-crucial_item=no-licensor=1-scope=0-npi_present=0	1		a guest often says that no girls sighed .
experiment=NPI-env=negation-npi=ever-crucial_item=some-licensor=0-scope=0-npi_present=1	0		a guest ever says that some girls sighed .
experiment=NPI-env=negation-npi=ever-crucial_item=no-licensor=1-scope=1-npi_present=1	1		no guests ever say that the patient was cooperating .
experiment=NPI-env=negation-npi=ever-crucial_item=no-licensor=1-scope=1-npi_present=0	1		no guests often say that the patient was cooperating .
experiment=NPI-env=negation-npi=ever-crucial_item=no-licensor=1-scope=0-npi_present=1	0		the guests ever say that no patient was cooperating .
experiment=NPI-env=negation-npi=ever-crucial_item=some-licensor=0-scope=1-npi_present=1	0		Some guests ever say that the patient was cooperating .
experiment=NPI-env=negation-npi=ever-crucial_item=some-licensor=0-scope=0-npi_present=0	1		the guests often say that some patient was cooperating .
experiment=NPI-env=negation-npi=ever-crucial_item=no-licensor=1-scope=1-npi_present=1	1		no teachers were ever explaining that the people discuss a student .
experiment=NPI-env=negation-npi=ever-crucial_item=no-licensor=1-scope=0-npi_present=1	0		the teachers were ever explaining that no people discuss a student .
experiment=NPI-env=negation-npi=ever-crucial_item=no-licensor=1-scope=0-npi_present=0	1		the teachers were often explaining that no people discuss a student .
experiment=NPI-env=negation-npi=ever-crucial_item=some-licensor=0-scope=0-npi_present=1	0		the teachers were ever explaining that some people discuss a student .
experiment=NPI-env=negation-npi=ever-crucial_item=no-licensor=1-scope=1-npi_present=0	1		no waiters are often thinking that the boys have been at the movie theater .
experiment=NPI-env=negation-npi=ever-crucial_item=no-licensor=1-scope=0-npi_present=0	1		a person is often imagining that no people can attack the customers .
experiment=NPI-env=negation-npi=ever-crucial_item=some-licensor=0-scope=1-npi_present=1	0		Some drivers ever thought that the girls could testify .
experiment=NPI-env=negation-npi=ever-crucial_item=some-licensor=0-scope=0-npi_present=1	0		the drivers ever thought that some girls could testify .
experiment=NPI-env=negation-npi=ever-crucial_item=no-licensor=1-scope=1-npi_present=0	1		no customers often imagined that a guy had stretched .
experiment=NPI-env=negation-npi=ever-crucial_item=no-licensor=1-scope=0-npi_present=1	0		the ladies were ever explaining that no doctor skates around the library .
experiment=NPI-env=negation-npi=ever-crucial_item=no-licensor=1-scope=0-npi_present=0	1		the ladies were often explaining that no doctor skates around the library .
experiment=NPI-env=negation-npi=ever-crucial_item=some-licensor=0-scope=1-npi_present=0	1		Some ladies were often explaining that the doctor skates around the library .
experiment=NPI-env=negation-npi=ever-crucial_item=some-licensor=0-scope=0-npi_present=0	1		the ladies were often explaining that some doctor skates around the library .
experiment=NPI-env=negation-npi=ever-crucial_item=no-licensor=1-scope=1-npi_present=0	1		no teachers often said that a woman grins .
experiment=NPI-env=negation-npi=ever-crucial_item=no-licensor=1-scope=0-npi_present=1	0		the teachers ever said that no woman grins .
experiment=NPI-env=negation-npi=ever-crucial_item=no-licensor=1-scope=0-npi_present=0	1		the teachers often said that no woman grins .
experiment=NPI-env=negation-npi=ever-crucial_item=no-licensor=1-scope=0-npi_present=1	0		the guy was ever explaining that no girl shrugged .
experiment=NPI-env=negation-npi=ever-crucial_item=some-licensor=0-scope=0-npi_present=0	1		the guy was often explaining that some girl shrugged .
experiment=NPI-env=negation-npi=ever-crucial_item=no-licensor=1-scope=1-npi_present=0	1		no waitress has often said that a patient screamed .
experiment=NPI-env=negation-npi=ever-crucial_item=some-licensor=0-scope=0-npi_present=0	1		a waitress has often said that some patient screamed .
experiment=NPI-env=negation-npi=ever-crucial_item=no-licensor=1-scope=1-npi_present=1	1		no men are ever imagining that the teachers cared for the deer .
experiment=NPI-env=negation-npi=ever-crucial_item=no-licensor=1-scope=1-npi_present=1	1		no women ever said that the customer boycotts the high schools .
experiment=NPI-env=negation-npi=ever-crucial_item=no-licensor=1-scope=0-npi_present=0	1		the women often said that no customer boycotts the high schools .
experiment=NPI-env=negation-npi=ever-crucial_item=some-licensor=0-scope=1-npi_present=0	1		Some women often said that the customer boycotts the high schools .
experiment=NPI-env=negation-npi=ever-crucial_item=some-licensor=0-scope=0-npi_present=1	0		the women ever said that some customer boycotts the high schools .
experiment=NPI-env=negation-npi=ever-crucial_item=no-licensor=1-scope=0-npi_present=1	0		a student was ever imagining that no customer has passed the grocery store .
experiment=NPI-env=negation-npi=ever-crucial_item=some-licensor=0-scope=1-npi_present=0	1		Some customer has often thought that the lady is walking through the movie theater .
experiment=NPI-env=negation-npi=ever-crucial_item=some-licensor=0-scope=0-npi_present=0	1		the customer has often thought that some lady is walking through the movie theater .
experiment=NPI-env=negation-npi=ever-crucial_item=no-licensor=1-scope=1-npi_present=1	1		no guy ever says that the boy was washing .
experiment=NPI-env=negation-npi=ever-crucial_item=no-licensor=1-scope=1-npi_present=0	1		no guy often says that the boy was washing .
experiment=NPI-env=negation-npi=ever-crucial_item=no-licensor=1-scope=1-npi_present=0	1		no doctor is often thinking that the girls criticize the children .
experiment=NPI-env=negation-npi=ever-crucial_item=no-licensor=1-scope=0-npi_present=0	1		the doctor is often thinking that no girls criticize the children .
experiment=NPI-env=negation-npi=ever-crucial_item=some-licensor=0-scope=0-npi_present=0	1		the doctor is often thinking that some girls criticize the children .
experiment=NPI-env=negation-npi=ever-crucial_item=no-licensor=1-scope=1-npi_present=0	1		no waitress often imagines that the humans have struggled .
experiment=NPI-env=negation-npi=ever-crucial_item=no-licensor=1-scope=0-npi_present=0	1		a waitress often imagines that no humans have struggled .
experiment=NPI-env=negation-npi=ever-crucial_item=some-licensor=0-scope=1-npi_present=0	1		Some waitress often imagines that the humans have struggled .
experiment=NPI-env=negation-npi=ever-crucial_item=some-licensor=0-scope=0-npi_present=0	1		a waitress often imagines that some humans have struggled .
experiment=NPI-env=negation-npi=ever-crucial_item=some-licensor=0-scope=1-npi_present=1	0		Some driver ever says that the humans drop by the high school .
experiment=NPI-env=negation-npi=ever-crucial_item=no-licensor=1-scope=1-npi_present=0	1		no actors did often explain that the ladies describe the cafes .
experiment=NPI-env=negation-npi=ever-crucial_item=some-licensor=0-scope=1-npi_present=1	0		Some actors did ever explain that the ladies describe the cafes .
experiment=NPI-env=negation-npi=ever-crucial_item=some-licensor=0-scope=0-npi_present=1	0		the actors did ever explain that some ladies describe the cafes .
experiment=NPI-env=negation-npi=ever-crucial_item=some-licensor=0-scope=0-npi_present=0	1		the actors did often explain that some ladies describe the cafes .
experiment=NPI-env=negation-npi=ever-crucial_item=no-licensor=1-scope=1-npi_present=0	1		no boy does often imagine that the pedestrians were hunting .
experiment=NPI-env=negation-npi=ever-crucial_item=no-licensor=1-scope=0-npi_present=0	1		a boy does often imagine that no pedestrians were hunting .
experiment=NPI-env=negation-npi=ever-crucial_item=some-licensor=0-scope=1-npi_present=1	0		Some boy does ever imagine that the pedestrians were hunting .
experiment=NPI-env=negation-npi=ever-crucial_item=no-licensor=1-scope=0-npi_present=1	0		the guys are ever thinking that no actor skated around the art galleries .
experiment=NPI-env=negation-npi=ever-crucial_item=no-licensor=1-scope=0-npi_present=0	1		the guys are often thinking that no actor skated around the art galleries .
experiment=NPI-env=negation-npi=ever-crucial_item=some-licensor=0-scope=1-npi_present=1	0		Some guys are ever thinking that an actor skated around the art galleries .
experiment=NPI-env=negation-npi=ever-crucial_item=some-licensor=0-scope=1-npi_present=0	1		Some guys are often thinking that an actor skated around the art galleries .
experiment=NPI-env=negation-npi=ever-crucial_item=some-licensor=0-scope=1-npi_present=0	1		Some man often says that an actor admires the drivers .
experiment=NPI-env=negation-npi=ever-crucial_item=some-licensor=0-scope=1-npi_present=1	0		Some customers ever explained that the guy did be at the college campuses .
experiment=NPI-env=negation-npi=ever-crucial_item=some-licensor=0-scope=0-npi_present=1	0		the customers ever explained that some guy did be at the college campuses .
experiment=NPI-env=negation-npi=ever-crucial_item=some-licensor=0-scope=0-npi_present=0	1		the customers often explained that some guy did be at the college campuses .
experiment=NPI-env=negation-npi=ever-crucial_item=some-licensor=0-scope=1-npi_present=0	1		Some teachers did often think that the actor had fled from the children .
experiment=NPI-env=negation-npi=ever-crucial_item=some-licensor=0-scope=0-npi_present=0	1		the teachers did often think that some actor had fled from the children .
experiment=NPI-env=negation-npi=ever-crucial_item=no-licensor=1-scope=1-npi_present=1	1		no men ever thought that the guest talks .
experiment=NPI-env=negation-npi=ever-crucial_item=no-licensor=1-scope=1-npi_present=0	1		no men often thought that the guest talks .
experiment=NPI-env=negation-npi=ever-crucial_item=some-licensor=0-scope=1-npi_present=1	0		Some men ever thought that the guest talks .
experiment=NPI-env=negation-npi=ever-crucial_item=some-licensor=0-scope=0-npi_present=0	1		the men often thought that some guest talks .
experiment=NPI-env=negation-npi=ever-crucial_item=no-licensor=1-scope=0-npi_present=1	0		the actor ever thought that no guests remember a man .
experiment=NPI-env=negation-npi=ever-crucial_item=no-licensor=1-scope=0-npi_present=0	1		the actor often thought that no guests remember a man .
experiment=NPI-env=negation-npi=ever-crucial_item=some-licensor=0-scope=1-npi_present=1	0		Some actor ever thought that the guests remember a man .
experiment=NPI-env=negation-npi=ever-crucial_item=some-licensor=0-scope=1-npi_present=0	1		Some actor often thought that the guests remember a man .
experiment=NPI-env=negation-npi=ever-crucial_item=some-licensor=0-scope=0-npi_present=0	1		the actor often thought that some guests remember a man .
experiment=NPI-env=negation-npi=ever-crucial_item=some-licensor=0-scope=0-npi_present=1	0		a teacher had ever thought that some doctors will admire the chairs .
experiment=NPI-env=negation-npi=ever-crucial_item=no-licensor=1-scope=0-npi_present=0	1		the driver is often saying that no patient criticizes the ladies .
experiment=NPI-env=negation-npi=ever-crucial_item=no-licensor=1-scope=0-npi_present=1	0		the boys ever imagine that no driver would investigate the mice .
experiment=NPI-env=negation-npi=ever-crucial_item=no-licensor=1-scope=1-npi_present=1	1		no humans have ever said that the cashiers did wear a hat .
experiment=NPI-env=negation-npi=ever-crucial_item=no-licensor=1-scope=1-npi_present=0	1		no humans have often said that the cashiers did wear a hat .
experiment=NPI-env=negation-npi=ever-crucial_item=some-licensor=0-scope=1-npi_present=1	0		Some humans have ever said that the cashiers did wear a hat .
experiment=NPI-env=negation-npi=ever-crucial_item=some-licensor=0-scope=0-npi_present=0	1		the ladies often thought that some doctors were scanning the reports .
experiment=NPI-env=negation-npi=ever-crucial_item=some-licensor=0-scope=1-npi_present=0	1		Some actors should often explain that the teachers would remember the humans .
experiment=NPI-env=negation-npi=ever-crucial_item=some-licensor=0-scope=0-npi_present=1	0		the actors should ever explain that some teachers would remember the humans .
experiment=NPI-env=negation-npi=ever-crucial_item=no-licensor=1-scope=0-npi_present=0	1		the people could often think that no customer will exit the schools .
experiment=NPI-env=negation-npi=ever-crucial_item=no-licensor=1-scope=1-npi_present=1	1		no actress has ever imagined that the doctors are chatting .
experiment=NPI-env=negation-npi=ever-crucial_item=no-licensor=1-scope=0-npi_present=1	0		the actress has ever imagined that no doctors are chatting .
experiment=NPI-env=negation-npi=ever-crucial_item=some-licensor=0-scope=1-npi_present=1	0		Some actress has ever imagined that the doctors are chatting .
experiment=NPI-env=negation-npi=ever-crucial_item=some-licensor=0-scope=1-npi_present=0	1		Some actress has often imagined that the doctors are chatting .
experiment=NPI-env=negation-npi=ever-crucial_item=some-licensor=0-scope=0-npi_present=0	1		the actress has often imagined that some doctors are chatting .
experiment=NPI-env=negation-npi=ever-crucial_item=no-licensor=1-scope=1-npi_present=0	1		no waitress often imagines that the waiter could reply .
experiment=NPI-env=negation-npi=ever-crucial_item=no-licensor=1-scope=0-npi_present=1	0		the waitress ever imagines that no waiter could reply .
experiment=NPI-env=negation-npi=ever-crucial_item=no-licensor=1-scope=0-npi_present=0	1		the waitress often imagines that no waiter could reply .
experiment=NPI-env=negation-npi=ever-crucial_item=some-licensor=0-scope=0-npi_present=0	1		the actors often think that some people criticized the essays .
experiment=NPI-env=negation-npi=ever-crucial_item=no-licensor=1-scope=1-npi_present=1	1		no people ever think that the gals remembered the museum .
experiment=NPI-env=negation-npi=ever-crucial_item=no-licensor=1-scope=0-npi_present=1	0		the people ever think that no gals remembered the museum .
experiment=NPI-env=negation-npi=ever-crucial_item=some-licensor=0-scope=0-npi_present=0	1		the people often think that some gals remembered the museum .
experiment=NPI-env=negation-npi=ever-crucial_item=no-licensor=1-scope=0-npi_present=1	0		the guys ever say that no patients respected the child .
experiment=NPI-env=negation-npi=ever-crucial_item=some-licensor=0-scope=0-npi_present=1	0		the guys ever say that some patients respected the child .
experiment=NPI-env=negation-npi=ever-crucial_item=no-licensor=1-scope=1-npi_present=1	1		no patient has ever explained that the patients are succeeding .
experiment=NPI-env=negation-npi=ever-crucial_item=no-licensor=1-scope=1-npi_present=0	1		no patient has often explained that the patients are succeeding .
experiment=NPI-env=negation-npi=ever-crucial_item=no-licensor=1-scope=0-npi_present=1	0		a patient has ever explained that no patients are succeeding .
experiment=NPI-env=negation-npi=ever-crucial_item=no-licensor=1-scope=0-npi_present=0	1		a patient has often explained that no patients are succeeding .
experiment=NPI-env=negation-npi=ever-crucial_item=no-licensor=1-scope=1-npi_present=1	1		no driver has ever imagined that the teachers whisper .
experiment=NPI-env=negation-npi=ever-crucial_item=no-licensor=1-scope=0-npi_present=1	0		the driver has ever imagined that no teachers whisper .
experiment=NPI-env=negation-npi=ever-crucial_item=no-licensor=1-scope=0-npi_present=0	1		the driver has often imagined that no teachers whisper .
experiment=NPI-env=negation-npi=ever-crucial_item=no-licensor=1-scope=1-npi_present=0	1		no children were often thinking that the waitress should scratch .
