experiment=NPI-env=negation-npi=yet-crucial_item=not-licensor=1-scope=1-npi_present=1	1		the lady has not explained that the adults have kissed a teacher yet .
experiment=NPI-env=negation-npi=yet-crucial_item=not-licensor=1-scope=0-npi_present=1	0		the lady has explained that the adults have not kissed a teacher yet .
experiment=NPI-env=negation-npi=yet-crucial_item=not-licensor=1-scope=0-npi_present=0	1		the lady has explained that the adults have not kissed a teacher sometimes .
experiment=NPI-env=negation-npi=yet-crucial_item=really-licensor=0-scope=1-npi_present=1	0		the lady has really explained that the adults have kissed a teacher yet .
experiment=NPI-env=negation-npi=yet-crucial_item=really-licensor=0-scope=0-npi_present=0	1		the lady has explained that the adults have really kissed a teacher sometimes .
experiment=NPI-env=negation-npi=in years-crucial_item=not-licensor=1-scope=0-npi_present=1	0		a lady explains that the children not respond in years .
experiment=NPI-env=negation-npi=in years-crucial_item=not-licensor=1-scope=0-npi_present=0	1		a lady explains that the children not respond sometimes .
experiment=NPI-env=negation-npi=in years-crucial_item=really-licensor=0-scope=0-npi_present=1	0		a lady explains that the children really respond in years .
experiment=NPI-env=negation-npi=yet-crucial_item=really-licensor=0-scope=0-npi_present=0	1		the women said that the pedestrians really hated the book sometimes .
experiment=NPI-env=negation-npi=yet-crucial_item=not-licensor=1-scope=1-npi_present=1	1		a person not imagined that the student praised the fish yet .
experiment=NPI-env=negation-npi=yet-crucial_item=not-licensor=1-scope=0-npi_present=0	1		a person imagined that the student not praised the fish sometimes .
experiment=NPI-env=negation-npi=yet-crucial_item=really-licensor=0-scope=1-npi_present=1	0		a person really imagined that the student praised the fish yet .
experiment=NPI-env=negation-npi=yet-crucial_item=not-licensor=1-scope=1-npi_present=1	1		the guys can not explain that the patient should boycott the restaurants yet .
experiment=NPI-env=negation-npi=yet-crucial_item=not-licensor=1-scope=1-npi_present=0	1		the guys can not explain that the patient should boycott the restaurants sometimes .
experiment=NPI-env=negation-npi=yet-crucial_item=really-licensor=0-scope=1-npi_present=0	1		the guys can really explain that the patient should boycott the restaurants sometimes .
experiment=NPI-env=negation-npi=yet-crucial_item=really-licensor=0-scope=0-npi_present=1	0		the guys can explain that the patient should really boycott the restaurants yet .
experiment=NPI-env=negation-npi=at all-crucial_item=not-licensor=1-scope=1-npi_present=1	1		the waitress has not explained that a waitress had sung at all .
experiment=NPI-env=negation-npi=at all-crucial_item=really-licensor=0-scope=0-npi_present=0	1		the waitress has explained that a waitress had really sung sometimes .
experiment=NPI-env=negation-npi=yet-crucial_item=not-licensor=1-scope=1-npi_present=1	1		the women not said that the waitresses can wear a dress yet .
experiment=NPI-env=negation-npi=yet-crucial_item=not-licensor=1-scope=1-npi_present=0	1		the women not said that the waitresses can wear a dress sometimes .
experiment=NPI-env=negation-npi=at all-crucial_item=not-licensor=1-scope=1-npi_present=1	1		the waitresses not explain that the waiters can spin around at all .
experiment=NPI-env=negation-npi=at all-crucial_item=not-licensor=1-scope=0-npi_present=0	1		the waitresses explain that the waiters can not spin around sometimes .
experiment=NPI-env=negation-npi=at all-crucial_item=really-licensor=0-scope=1-npi_present=1	0		the waitresses really explain that the waiters can spin around at all .
experiment=NPI-env=negation-npi=at all-crucial_item=really-licensor=0-scope=1-npi_present=0	1		the waitresses really explain that the waiters can spin around sometimes .
experiment=NPI-env=negation-npi=at all-crucial_item=really-licensor=0-scope=0-npi_present=0	1		the waitresses explain that the waiters can really spin around sometimes .
experiment=NPI-env=only-npi=ever-crucial_item=_-licensor=1-scope=1-npi_present=1	1		only a customer had ever lifted the plates .
experiment=NPI-env=only-npi=ever-crucial_item=_-licensor=1-scope=0-npi_present=1	0		a customer had ever lifted only the plates .
experiment=NPI-env=only-npi=ever-crucial_item=_-licensor=1-scope=0-npi_present=0	1		a customer had often lifted only the plates .
experiment=NPI-env=only-npi=ever-crucial_item=_-licensor=0-scope=1-npi_present=1	0		a customer had also ever lifted the plates .
experiment=NPI-env=only-npi=ever-crucial_item=_-licensor=1-scope=1-npi_present=0	1		only the teenager had often watched the teenagers .
experiment=NPI-env=only-npi=ever-crucial_item=_-licensor=0-scope=0-npi_present=1	0		the teenager had ever also watched the teenagers .
experiment=NPI-env=only-npi=ever-crucial_item=_-licensor=1-scope=0-npi_present=1	0		the patient might ever love only the children .
experiment=NPI-env=only-npi=ever-crucial_item=_-licensor=1-scope=1-npi_present=1	1		only the adult ever discusses the drivers .
experiment=NPI-env=only-npi=ever-crucial_item=_-licensor=1-scope=1-npi_present=0	1		only the adult sometimes discusses the drivers .
experiment=NPI-env=only-npi=ever-crucial_item=_-licensor=1-scope=0-npi_present=1	0		the adult ever discusses only the drivers .
experiment=NPI-env=only-npi=ever-crucial_item=_-licensor=1-scope=0-npi_present=0	1		the adult sometimes discusses only the drivers .
experiment=NPI-env=only-npi=ever-crucial_item=_-licensor=0-scope=1-npi_present=1	0		the adult also ever discusses the drivers .
experiment=NPI-env=only-npi=ever-crucial_item=_-licensor=1-scope=1-npi_present=1	1		only the student ever cleans the plates .
experiment=NPI-env=only-npi=ever-crucial_item=_-licensor=1-scope=0-npi_present=1	0		the student ever cleans only the plates .
experiment=NPI-env=only-npi=ever-crucial_item=_-licensor=1-scope=0-npi_present=0	1		the student sometimes cleans only the plates .
experiment=NPI-env=only-npi=ever-crucial_item=_-licensor=0-scope=0-npi_present=1	0		the student ever also cleans the plates .
experiment=NPI-env=only-npi=ever-crucial_item=_-licensor=0-scope=1-npi_present=1	0		the humans also ever passed the high schools .
experiment=NPI-env=only-npi=ever-crucial_item=_-licensor=0-scope=0-npi_present=1	0		the humans ever also passed the high schools .
experiment=NPI-env=only-npi=ever-crucial_item=_-licensor=0-scope=0-npi_present=0	1		the humans often also passed the high schools .
experiment=NPI-env=only-npi=ever-crucial_item=_-licensor=0-scope=0-npi_present=1	0		the customer has ever also forgotten the doctors .
experiment=NPI-env=only-npi=ever-crucial_item=_-licensor=1-scope=0-npi_present=0	1		a gal does always pass only the college campuses .
experiment=NPI-env=only-npi=ever-crucial_item=_-licensor=0-scope=1-npi_present=1	0		a gal does also ever pass the college campuses .
experiment=NPI-env=only-npi=ever-crucial_item=_-licensor=1-scope=0-npi_present=0	1		the doctors sometimes been at only the college campuses .
experiment=NPI-env=only-npi=ever-crucial_item=_-licensor=0-scope=1-npi_present=0	1		the doctors also sometimes been at the college campuses .
experiment=NPI-env=only-npi=ever-crucial_item=_-licensor=1-scope=1-npi_present=1	1		only the people do ever examine the books .
experiment=NPI-env=only-npi=ever-crucial_item=_-licensor=1-scope=0-npi_present=1	0		the people do ever examine only the books .
experiment=NPI-env=only-npi=ever-crucial_item=_-licensor=1-scope=0-npi_present=0	1		the people do now examine only the books .
experiment=NPI-env=only-npi=ever-crucial_item=_-licensor=0-scope=1-npi_present=0	1		the people do also now examine the books .
experiment=NPI-env=only-npi=ever-crucial_item=_-licensor=0-scope=0-npi_present=1	0		the people do ever also examine the books .
experiment=NPI-env=only-npi=ever-crucial_item=_-licensor=0-scope=0-npi_present=0	1		the people do now also examine the books .
experiment=NPI-env=only-npi=ever-crucial_item=_-licensor=1-scope=0-npi_present=0	1		the pedestrian sometimes remembers only the grocery stores .
experiment=NPI-env=only-npi=ever-crucial_item=_-licensor=0-scope=1-npi_present=0	1		the pedestrian also sometimes remembers the grocery stores .
experiment=NPI-env=only-npi=ever-crucial_item=_-licensor=1-scope=1-npi_present=0	1		only the patients have sometimes hugged the teenagers .
experiment=NPI-env=only-npi=ever-crucial_item=_-licensor=0-scope=0-npi_present=1	0		the patients have ever also hugged the teenagers .
experiment=NPI-env=only-npi=ever-crucial_item=_-licensor=0-scope=0-npi_present=0	1		the patients have sometimes also hugged the teenagers .
experiment=NPI-env=only-npi=ever-crucial_item=_-licensor=1-scope=0-npi_present=0	1		the girls have sometimes kissed only the girls .
experiment=NPI-env=only-npi=ever-crucial_item=_-licensor=0-scope=1-npi_present=0	1		the girls have also sometimes kissed the girls .
experiment=NPI-env=only-npi=ever-crucial_item=_-licensor=1-scope=1-npi_present=1	1		only the waitresses have ever observed the gals .
experiment=NPI-env=only-npi=ever-crucial_item=_-licensor=1-scope=0-npi_present=1	0		the waitresses have ever observed only the gals .
experiment=NPI-env=only-npi=ever-crucial_item=_-licensor=1-scope=0-npi_present=0	1		the waitresses have now observed only the gals .
experiment=NPI-env=only-npi=ever-crucial_item=_-licensor=0-scope=1-npi_present=0	1		the waitresses have also now observed the gals .
experiment=NPI-env=only-npi=ever-crucial_item=_-licensor=0-scope=0-npi_present=1	0		the waitresses have ever also observed the gals .
experiment=NPI-env=only-npi=ever-crucial_item=_-licensor=1-scope=1-npi_present=1	1		only a girl ever loves the gals .
experiment=NPI-env=only-npi=ever-crucial_item=_-licensor=1-scope=0-npi_present=1	0		a girl ever loves only the gals .
experiment=NPI-env=only-npi=ever-crucial_item=_-licensor=1-scope=0-npi_present=0	1		a girl sometimes loves only the gals .
experiment=NPI-env=only-npi=ever-crucial_item=_-licensor=0-scope=1-npi_present=0	1		a girl also sometimes loves the gals .
experiment=NPI-env=only-npi=ever-crucial_item=_-licensor=0-scope=0-npi_present=1	0		the customer had ever also passed the schools .
experiment=NPI-env=only-npi=ever-crucial_item=_-licensor=0-scope=1-npi_present=1	0		a doctor had also ever dropped by the restaurants .
experiment=NPI-env=only-npi=ever-crucial_item=_-licensor=0-scope=0-npi_present=0	1		the boy now also talks about the college campuses .
experiment=NPI-env=only-npi=ever-crucial_item=_-licensor=1-scope=1-npi_present=0	1		only the actors often loved the teachers .
experiment=NPI-env=only-npi=ever-crucial_item=_-licensor=0-scope=1-npi_present=0	1		the actors also often loved the teachers .
experiment=NPI-env=only-npi=ever-crucial_item=_-licensor=0-scope=0-npi_present=1	0		the actors ever also loved the teachers .
experiment=NPI-env=only-npi=ever-crucial_item=_-licensor=1-scope=0-npi_present=0	1		the girls had always loved only the actresses .
experiment=NPI-env=only-npi=ever-crucial_item=_-licensor=0-scope=1-npi_present=0	1		the girls had also always loved the actresses .
experiment=NPI-env=only-npi=ever-crucial_item=_-licensor=1-scope=1-npi_present=1	1		only a woman had ever toured the restaurants .
experiment=NPI-env=only-npi=ever-crucial_item=_-licensor=1-scope=0-npi_present=1	0		a woman had ever toured only the restaurants .
experiment=NPI-env=only-npi=ever-crucial_item=_-licensor=0-scope=1-npi_present=0	1		a woman had also sometimes toured the restaurants .
experiment=NPI-env=only-npi=ever-crucial_item=_-licensor=0-scope=0-npi_present=0	1		a woman had sometimes also toured the restaurants .
experiment=NPI-env=only-npi=ever-crucial_item=_-licensor=1-scope=1-npi_present=0	1		only the adult now drove to the grocery stores .
experiment=NPI-env=only-npi=ever-crucial_item=_-licensor=0-scope=1-npi_present=1	0		the adult also ever drove to the grocery stores .
experiment=NPI-env=only-npi=ever-crucial_item=_-licensor=1-scope=0-npi_present=0	1		the cashiers could often watch only the waitresses .
experiment=NPI-env=only-npi=ever-crucial_item=_-licensor=0-scope=1-npi_present=1	0		the cashiers could also ever watch the waitresses .
experiment=NPI-env=only-npi=ever-crucial_item=_-licensor=0-scope=0-npi_present=0	1		the cashiers could often also watch the waitresses .
experiment=NPI-env=only-npi=ever-crucial_item=_-licensor=1-scope=1-npi_present=1	1		only a guest could ever have the books .
experiment=NPI-env=only-npi=ever-crucial_item=_-licensor=0-scope=1-npi_present=0	1		a guest could also now have the books .
experiment=NPI-env=only-npi=ever-crucial_item=_-licensor=1-scope=0-npi_present=0	1		a man often listened to only the guys .
experiment=NPI-env=only-npi=ever-crucial_item=_-licensor=1-scope=1-npi_present=1	1		only a guy ever describes the actors .
experiment=NPI-env=only-npi=ever-crucial_item=_-licensor=1-scope=1-npi_present=0	1		only a guy sometimes describes the actors .
experiment=NPI-env=only-npi=ever-crucial_item=_-licensor=1-scope=1-npi_present=1	1		only the humans might ever attack the teachers .
experiment=NPI-env=only-npi=ever-crucial_item=_-licensor=1-scope=1-npi_present=0	1		only the humans might now attack the teachers .
experiment=NPI-env=only-npi=ever-crucial_item=_-licensor=0-scope=1-npi_present=1	0		the humans might also ever attack the teachers .
experiment=NPI-env=only-npi=ever-crucial_item=_-licensor=0-scope=0-npi_present=0	1		the humans might now also attack the teachers .
experiment=NPI-env=only-npi=ever-crucial_item=_-licensor=1-scope=0-npi_present=0	1		a person always attacked only the people .
experiment=NPI-env=only-npi=ever-crucial_item=_-licensor=0-scope=1-npi_present=0	1		a person also always attacked the people .
experiment=NPI-env=only-npi=ever-crucial_item=_-licensor=0-scope=0-npi_present=1	0		a person ever also attacked the people .
experiment=NPI-env=only-npi=ever-crucial_item=_-licensor=0-scope=0-npi_present=0	1		a person always also attacked the people .
experiment=NPI-env=only-npi=ever-crucial_item=_-licensor=0-scope=0-npi_present=1	0		the teenagers ever also discuss the museums .
experiment=NPI-env=only-npi=ever-crucial_item=_-licensor=0-scope=0-npi_present=0	1		the teenagers always also discuss the museums .
experiment=NPI-env=only-npi=ever-crucial_item=_-licensor=1-scope=1-npi_present=1	1		only the teacher ever escapes from the pedestrians .
experiment=NPI-env=only-npi=ever-crucial_item=_-licensor=1-scope=0-npi_present=0	1		the teacher now escapes from only the pedestrians .
experiment=NPI-env=only-npi=ever-crucial_item=_-licensor=0-scope=1-npi_present=1	0		the teacher also ever escapes from the pedestrians .
experiment=NPI-env=only-npi=ever-crucial_item=_-licensor=0-scope=1-npi_present=0	1		the teacher also now escapes from the pedestrians .
experiment=NPI-env=only-npi=ever-crucial_item=_-licensor=0-scope=0-npi_present=0	1		the teacher now also escapes from the pedestrians .
experiment=NPI-env=only-npi=ever-crucial_item=_-licensor=1-scope=0-npi_present=1	0		the boys do ever flee from only the people .
experiment=NPI-env=only-npi=ever-crucial_item=_-licensor=1-scope=0-npi_present=0	1		the boys do often flee from only the people .
experiment=NPI-env=only-npi=ever-crucial_item=_-licensor=0-scope=0-npi_present=1	0		the boys do ever also flee from the people .
experiment=NPI-env=only-npi=ever-crucial_item=_-licensor=0-scope=0-npi_present=0	1		the boys do often also flee from the people .
experiment=NPI-env=only-npi=ever-crucial_item=_-licensor=1-scope=0-npi_present=1	0		the people could ever drop by only the libraries .
experiment=NPI-env=only-npi=ever-crucial_item=_-licensor=0-scope=1-npi_present=0	1		the people could also always drop by the libraries .
experiment=NPI-env=only-npi=ever-crucial_item=_-licensor=1-scope=1-npi_present=1	1		only the child had ever sold the reports .
experiment=NPI-env=only-npi=ever-crucial_item=_-licensor=1-scope=1-npi_present=0	1		only the child had now sold the reports .
experiment=NPI-env=only-npi=ever-crucial_item=_-licensor=1-scope=0-npi_present=1	0		the child had ever sold only the reports .
experiment=NPI-env=only-npi=ever-crucial_item=_-licensor=1-scope=1-npi_present=0	1		only the actor sometimes exits the libraries .
experiment=NPI-env=only-npi=ever-crucial_item=_-licensor=0-scope=0-npi_present=1	0		the actor ever also exits the libraries .
experiment=NPI-env=only-npi=ever-crucial_item=_-licensor=1-scope=0-npi_present=1	0		the cashiers ever exited only the high schools .
experiment=NPI-env=only-npi=ever-crucial_item=_-licensor=1-scope=0-npi_present=0	1		the cashiers now exited only the high schools .
experiment=NPI-env=only-npi=ever-crucial_item=_-licensor=0-scope=0-npi_present=1	0		the cashiers ever also exited the high schools .
experiment=NPI-env=only-npi=ever-crucial_item=_-licensor=0-scope=0-npi_present=0	1		the cashiers now also exited the high schools .
experiment=NPI-env=only-npi=ever-crucial_item=_-licensor=0-scope=1-npi_present=0	1		the girls also often attacked the gals .
experiment=NPI-env=only-npi=ever-crucial_item=_-licensor=0-scope=0-npi_present=0	1		the girls often also attacked the gals .
experiment=NPI-env=only-npi=ever-crucial_item=_-licensor=1-scope=1-npi_present=1	1		only the person would ever reference the movies .
experiment=NPI-env=only-npi=ever-crucial_item=_-licensor=1-scope=1-npi_present=0	1		only the person would sometimes reference the movies .
experiment=NPI-env=only-npi=ever-crucial_item=_-licensor=1-scope=0-npi_present=1	0		the person would ever reference only the movies .
experiment=NPI-env=only-npi=ever-crucial_item=_-licensor=1-scope=0-npi_present=0	1		the person would sometimes reference only the movies .
experiment=NPI-env=only-npi=ever-crucial_item=_-licensor=0-scope=1-npi_present=1	0		the person would also ever reference the movies .
experiment=NPI-env=only-npi=ever-crucial_item=_-licensor=0-scope=1-npi_present=0	1		the person would also sometimes reference the movies .
experiment=NPI-env=only-npi=ever-crucial_item=_-licensor=0-scope=0-npi_present=0	1		the person would sometimes also reference the movies .
experiment=NPI-env=only-npi=ever-crucial_item=_-licensor=0-scope=1-npi_present=0	1		the actors also often helped the children .
experiment=NPI-env=only-npi=ever-crucial_item=_-licensor=0-scope=0-npi_present=0	1		the actors often also helped the children .
experiment=NPI-env=only-npi=ever-crucial_item=_-licensor=1-scope=1-npi_present=1	1		only the waiters ever insulted the waitresses .
experiment=NPI-env=only-npi=ever-crucial_item=_-licensor=0-scope=0-npi_present=1	0		the waiters ever also insulted the waitresses .
experiment=NPI-env=only-npi=ever-crucial_item=_-licensor=1-scope=1-npi_present=0	1		only the men often respect the boys .
experiment=NPI-env=only-npi=ever-crucial_item=_-licensor=0-scope=1-npi_present=1	0		the men also ever respect the boys .
experiment=NPI-env=only-npi=ever-crucial_item=_-licensor=1-scope=1-npi_present=0	1		only the teachers do sometimes talk about the guys .
experiment=NPI-env=only-npi=ever-crucial_item=_-licensor=1-scope=0-npi_present=0	1		the teenagers always had only the newspaper articles .
experiment=NPI-env=only-npi=ever-crucial_item=_-licensor=0-scope=0-npi_present=1	0		the teenagers ever also had the newspaper articles .
experiment=NPI-env=only-npi=ever-crucial_item=_-licensor=1-scope=1-npi_present=1	1		only the students ever listen to the gals .
experiment=NPI-env=only-npi=ever-crucial_item=_-licensor=0-scope=1-npi_present=1	0		the students also ever listen to the gals .
experiment=NPI-env=only-npi=ever-crucial_item=_-licensor=1-scope=1-npi_present=0	1		only the guests might now bring the forks .
experiment=NPI-env=only-npi=ever-crucial_item=_-licensor=0-scope=0-npi_present=0	1		the guests might now also bring the forks .
experiment=NPI-env=only-npi=ever-crucial_item=_-licensor=1-scope=1-npi_present=0	1		only the boys now insulted the public parks .
experiment=NPI-env=only-npi=ever-crucial_item=_-licensor=0-scope=1-npi_present=0	1		the boys also now insulted the public parks .
experiment=NPI-env=only-npi=ever-crucial_item=_-licensor=1-scope=0-npi_present=1	0		an adult ever runs around only the art galleries .
experiment=NPI-env=only-npi=ever-crucial_item=_-licensor=0-scope=1-npi_present=1	0		an adult also ever runs around the art galleries .
experiment=NPI-env=only-npi=ever-crucial_item=_-licensor=0-scope=1-npi_present=1	0		the women also ever remembered the drivers .
experiment=NPI-env=only-npi=ever-crucial_item=_-licensor=0-scope=0-npi_present=0	1		the women now also remembered the drivers .
experiment=NPI-env=only-npi=ever-crucial_item=_-licensor=1-scope=0-npi_present=0	1		the waiters often dropped by only the restaurants .
experiment=NPI-env=only-npi=ever-crucial_item=_-licensor=1-scope=1-npi_present=1	1		only the girls could ever visit the waiters .
experiment=NPI-env=only-npi=ever-crucial_item=_-licensor=1-scope=0-npi_present=0	1		the girls could now visit only the waiters .
experiment=NPI-env=only-npi=ever-crucial_item=_-licensor=0-scope=1-npi_present=0	1		the girls could also now visit the waiters .
experiment=NPI-env=only-npi=ever-crucial_item=_-licensor=0-scope=0-npi_present=0	1		the girls could now also visit the waiters .
experiment=NPI-env=only-npi=ever-crucial_item=_-licensor=1-scope=1-npi_present=0	1		only the cashiers might often approach the people .
experiment=NPI-env=only-npi=ever-crucial_item=_-licensor=0-scope=0-npi_present=0	1		the cashiers might often also approach the people .
experiment=NPI-env=only-npi=ever-crucial_item=_-licensor=1-scope=0-npi_present=1	0		the drivers ever scanned only the books .
experiment=NPI-env=only-npi=ever-crucial_item=_-licensor=0-scope=1-npi_present=1	0		the drivers also ever scanned the books .
experiment=NPI-env=only-npi=ever-crucial_item=_-licensor=0-scope=1-npi_present=0	1		the drivers also always scanned the books .
experiment=NPI-env=only-npi=ever-crucial_item=_-licensor=0-scope=0-npi_present=1	0		the drivers ever also scanned the books .
experiment=NPI-env=only-npi=ever-crucial_item=_-licensor=0-scope=0-npi_present=0	1		the drivers always also scanned the books .
experiment=NPI-env=only-npi=ever-crucial_item=_-licensor=1-scope=1-npi_present=1	1		only the student does ever lift the glasses .
experiment=NPI-env=only-npi=ever-crucial_item=_-licensor=1-scope=0-npi_present=1	0		the student does ever lift only the glasses .
experiment=NPI-env=only-npi=ever-crucial_item=_-licensor=1-scope=0-npi_present=0	1		the student does now lift only the glasses .
experiment=NPI-env=only-npi=ever-crucial_item=_-licensor=0-scope=1-npi_present=1	0		the student does also ever lift the glasses .
experiment=NPI-env=only-npi=ever-crucial_item=_-licensor=0-scope=1-npi_present=0	1		the student does also now lift the glasses .
experiment=NPI-env=only-npi=ever-crucial_item=_-licensor=0-scope=0-npi_present=0	1		the student does now also lift the glasses .
experiment=NPI-env=only-npi=ever-crucial_item=_-licensor=1-scope=1-npi_present=0	1		only the man always cared for the drivers .
experiment=NPI-env=only-npi=ever-crucial_item=_-licensor=0-scope=1-npi_present=1	0		the man also ever cared for the drivers .
experiment=NPI-env=only-npi=ever-crucial_item=_-licensor=0-scope=0-npi_present=1	0		the man ever also cared for the drivers .
experiment=NPI-env=only-npi=ever-crucial_item=_-licensor=0-scope=0-npi_present=0	1		the man always also cared for the drivers .
experiment=NPI-env=only-npi=ever-crucial_item=_-licensor=1-scope=1-npi_present=1	1		only a human has ever broken the books .
experiment=NPI-env=only-npi=ever-crucial_item=_-licensor=1-scope=1-npi_present=0	1		only a human has often broken the books .
experiment=NPI-env=only-npi=ever-crucial_item=_-licensor=1-scope=0-npi_present=1	0		a human has ever broken only the books .
experiment=NPI-env=only-npi=ever-crucial_item=_-licensor=0-scope=1-npi_present=1	0		a human has also ever broken the books .
experiment=NPI-env=only-npi=ever-crucial_item=_-licensor=0-scope=1-npi_present=0	1		a human has also often broken the books .
experiment=NPI-env=only-npi=ever-crucial_item=_-licensor=0-scope=0-npi_present=0	1		a human has often also broken the books .
experiment=NPI-env=only-npi=ever-crucial_item=_-licensor=1-scope=0-npi_present=1	0		the child ever biked to only the banks .
experiment=NPI-env=only-npi=ever-crucial_item=_-licensor=0-scope=0-npi_present=1	0		the child ever also biked to the banks .
experiment=NPI-env=only-npi=ever-crucial_item=_-licensor=1-scope=1-npi_present=0	1		only the drivers have always passed the college campuses .
experiment=NPI-env=only-npi=ever-crucial_item=_-licensor=1-scope=0-npi_present=0	1		the drivers have always passed only the college campuses .
experiment=NPI-env=only-npi=ever-crucial_item=_-licensor=0-scope=1-npi_present=1	0		the drivers have also ever passed the college campuses .
experiment=NPI-env=only-npi=ever-crucial_item=_-licensor=0-scope=1-npi_present=0	1		the drivers have also always passed the college campuses .
experiment=NPI-env=only-npi=ever-crucial_item=_-licensor=1-scope=1-npi_present=0	1		only the customer often hates the people .
experiment=NPI-env=only-npi=ever-crucial_item=_-licensor=1-scope=0-npi_present=1	0		the customer ever hates only the people .
experiment=NPI-env=only-npi=ever-crucial_item=_-licensor=0-scope=1-npi_present=1	0		the customer also ever hates the people .
experiment=NPI-env=only-npi=ever-crucial_item=_-licensor=1-scope=1-npi_present=1	1		only an actor has ever insulted the humans .
experiment=NPI-env=only-npi=ever-crucial_item=_-licensor=1-scope=1-npi_present=0	1		only an actor has sometimes insulted the humans .
experiment=NPI-env=only-npi=ever-crucial_item=_-licensor=1-scope=0-npi_present=0	1		an actor has sometimes insulted only the humans .
experiment=NPI-env=only-npi=ever-crucial_item=_-licensor=1-scope=0-npi_present=1	0		the students have ever forgotten only the humans .
