experiment=NPI-env=negation-npi=ever-crucial_item=no-licensor=1-scope=0-npi_present=1	0		the guys ever went to no girl .
experiment=NPI-env=negation-npi=ever-crucial_item=some-licensor=0-scope=0-npi_present=0	1		an actor often resembles some waitresses .
experiment=NPI-env=negation-npi=ever-crucial_item=no-licensor=1-scope=0-npi_present=1	0		the cashier does ever skate around no teacher .
experiment=NPI-env=negation-npi=ever-crucial_item=no-licensor=1-scope=0-npi_present=0	1		the cashier does often skate around no teacher .
experiment=NPI-env=negation-npi=ever-crucial_item=some-licensor=0-scope=0-npi_present=1	0		the cashier does ever skate around some teacher .
experiment=NPI-env=negation-npi=ever-crucial_item=some-licensor=0-scope=0-npi_present=0	1		the cashier does often skate around some teacher .
experiment=NPI-env=negation-npi=ever-crucial_item=no-licensor=1-scope=1-npi_present=0	1		no teacher can often wear the customer .
experiment=NPI-env=negation-npi=ever-crucial_item=no-licensor=1-scope=0-npi_present=1	0		the teacher can ever wear no customer .
experiment=NPI-env=negation-npi=ever-crucial_item=some-licensor=0-scope=1-npi_present=1	0		Some teacher can ever wear the customer .
experiment=NPI-env=negation-npi=ever-crucial_item=some-licensor=0-scope=1-npi_present=0	1		Some teacher can often wear the customer .
experiment=NPI-env=negation-npi=ever-crucial_item=some-licensor=0-scope=0-npi_present=0	1		the teacher can often wear some customer .
experiment=NPI-env=negation-npi=ever-crucial_item=some-licensor=0-scope=1-npi_present=1	0		Some men ever examined the patient .
experiment=NPI-env=negation-npi=ever-crucial_item=no-licensor=1-scope=1-npi_present=0	1		no actresses have often praised a human .
experiment=NPI-env=negation-npi=ever-crucial_item=no-licensor=1-scope=1-npi_present=1	1		no adult does ever dislike the girls .
experiment=NPI-env=negation-npi=ever-crucial_item=no-licensor=1-scope=1-npi_present=0	1		no adult does often dislike the girls .
experiment=NPI-env=negation-npi=ever-crucial_item=some-licensor=0-scope=1-npi_present=1	0		Some adult does ever dislike the girls .
experiment=NPI-env=negation-npi=ever-crucial_item=some-licensor=0-scope=1-npi_present=0	1		Some adult does often dislike the girls .
experiment=NPI-env=negation-npi=ever-crucial_item=some-licensor=0-scope=0-npi_present=1	0		an adult does ever dislike some girls .
experiment=NPI-env=negation-npi=ever-crucial_item=no-licensor=1-scope=1-npi_present=1	1		no teacher is ever watching the waiters .
experiment=NPI-env=negation-npi=ever-crucial_item=no-licensor=1-scope=1-npi_present=0	1		no teacher is often watching the waiters .
experiment=NPI-env=negation-npi=ever-crucial_item=no-licensor=1-scope=0-npi_present=0	1		the teacher is often watching no waiters .
experiment=NPI-env=negation-npi=ever-crucial_item=some-licensor=0-scope=0-npi_present=1	0		the teacher is ever watching some waiters .
experiment=NPI-env=negation-npi=ever-crucial_item=some-licensor=0-scope=1-npi_present=0	1		Some doctor does often skate around the guy .
experiment=NPI-env=negation-npi=ever-crucial_item=some-licensor=0-scope=0-npi_present=1	0		a doctor does ever skate around some guy .
experiment=NPI-env=negation-npi=ever-crucial_item=some-licensor=0-scope=0-npi_present=0	1		a doctor does often skate around some guy .
experiment=NPI-env=negation-npi=ever-crucial_item=no-licensor=1-scope=1-npi_present=1	1		no students have ever cleaned the gal .
experiment=NPI-env=negation-npi=ever-crucial_item=some-licensor=0-scope=1-npi_present=1	0		Some students have ever cleaned the gal .
experiment=NPI-env=negation-npi=ever-crucial_item=no-licensor=1-scope=1-npi_present=1	1		no guys would ever drive to the woman .
experiment=NPI-env=negation-npi=ever-crucial_item=no-licensor=1-scope=0-npi_present=1	0		the guys would ever drive to no woman .
experiment=NPI-env=negation-npi=ever-crucial_item=some-licensor=0-scope=0-npi_present=1	0		the guys would ever drive to some woman .
experiment=NPI-env=negation-npi=ever-crucial_item=no-licensor=1-scope=0-npi_present=0	1		the girls often escaped from no guys .
experiment=NPI-env=negation-npi=ever-crucial_item=some-licensor=0-scope=0-npi_present=0	1		the girls often escaped from some guys .
experiment=NPI-env=negation-npi=ever-crucial_item=no-licensor=1-scope=1-npi_present=1	1		no actresses ever investigate the guys .
experiment=NPI-env=negation-npi=ever-crucial_item=no-licensor=1-scope=1-npi_present=0	1		no actresses often investigate the guys .
experiment=NPI-env=negation-npi=ever-crucial_item=no-licensor=1-scope=0-npi_present=1	0		the actresses ever investigate no guys .
experiment=NPI-env=negation-npi=ever-crucial_item=some-licensor=0-scope=1-npi_present=1	0		Some actresses ever investigate the guys .
experiment=NPI-env=negation-npi=ever-crucial_item=some-licensor=0-scope=0-npi_present=0	1		the actresses often investigate some guys .
experiment=NPI-env=negation-npi=ever-crucial_item=no-licensor=1-scope=1-npi_present=1	1		no doctor will ever care for the humans .
experiment=NPI-env=negation-npi=ever-crucial_item=no-licensor=1-scope=0-npi_present=0	1		a doctor will often care for no humans .
experiment=NPI-env=negation-npi=ever-crucial_item=some-licensor=0-scope=1-npi_present=1	0		Some doctor will ever care for the humans .
experiment=NPI-env=negation-npi=ever-crucial_item=some-licensor=0-scope=0-npi_present=1	0		a doctor will ever care for some humans .
experiment=NPI-env=negation-npi=ever-crucial_item=no-licensor=1-scope=1-npi_present=1	1		no adult did ever flee from the pedestrian .
experiment=NPI-env=negation-npi=ever-crucial_item=no-licensor=1-scope=0-npi_present=0	1		an adult did often flee from no pedestrian .
experiment=NPI-env=negation-npi=ever-crucial_item=some-licensor=0-scope=1-npi_present=1	0		Some adult did ever flee from the pedestrian .
experiment=NPI-env=negation-npi=ever-crucial_item=no-licensor=1-scope=1-npi_present=0	1		no driver has often remembered the child .
experiment=NPI-env=negation-npi=ever-crucial_item=no-licensor=1-scope=0-npi_present=0	1		the driver has often remembered no child .
experiment=NPI-env=negation-npi=ever-crucial_item=some-licensor=0-scope=1-npi_present=1	0		Some driver has ever remembered the child .
experiment=NPI-env=negation-npi=ever-crucial_item=some-licensor=0-scope=1-npi_present=0	1		Some driver has often remembered the child .
experiment=NPI-env=negation-npi=ever-crucial_item=some-licensor=0-scope=0-npi_present=0	1		the driver has often remembered some child .
experiment=NPI-env=negation-npi=ever-crucial_item=some-licensor=0-scope=0-npi_present=0	1		the doctor might often buy some teenagers .
experiment=NPI-env=negation-npi=ever-crucial_item=no-licensor=1-scope=0-npi_present=1	0		the waiters will ever drop by no teenager .
experiment=NPI-env=negation-npi=ever-crucial_item=some-licensor=0-scope=0-npi_present=1	0		the waiters will ever drop by some teenager .
experiment=NPI-env=negation-npi=ever-crucial_item=some-licensor=0-scope=0-npi_present=0	1		the waiters will often drop by some teenager .
experiment=NPI-env=negation-npi=ever-crucial_item=no-licensor=1-scope=1-npi_present=0	1		no teachers will often tour the pedestrians .
experiment=NPI-env=negation-npi=ever-crucial_item=some-licensor=0-scope=1-npi_present=1	0		Some teachers will ever tour the pedestrians .
experiment=NPI-env=negation-npi=ever-crucial_item=some-licensor=0-scope=1-npi_present=0	1		Some teachers will often tour the pedestrians .
experiment=NPI-env=negation-npi=ever-crucial_item=some-licensor=0-scope=0-npi_present=0	1		the teachers will often tour some pedestrians .
experiment=NPI-env=negation-npi=ever-crucial_item=no-licensor=1-scope=1-npi_present=1	1		no gal ever flees from the actors .
experiment=NPI-env=negation-npi=ever-crucial_item=some-licensor=0-scope=1-npi_present=0	1		Some gal often flees from the actors .
experiment=NPI-env=negation-npi=ever-crucial_item=no-licensor=1-scope=1-npi_present=0	1		no human often investigated the girl .
experiment=NPI-env=negation-npi=ever-crucial_item=no-licensor=1-scope=0-npi_present=0	1		a human often investigated no girl .
experiment=NPI-env=negation-npi=ever-crucial_item=some-licensor=0-scope=1-npi_present=1	0		Some human ever investigated the girl .
experiment=NPI-env=negation-npi=ever-crucial_item=some-licensor=0-scope=1-npi_present=0	1		Some human often investigated the girl .
experiment=NPI-env=negation-npi=ever-crucial_item=some-licensor=0-scope=0-npi_present=0	1		a human often investigated some girl .
experiment=NPI-env=negation-npi=ever-crucial_item=no-licensor=1-scope=1-npi_present=0	1		no customer often disliked the teenagers .
experiment=NPI-env=negation-npi=ever-crucial_item=some-licensor=0-scope=1-npi_present=1	0		Some customer ever disliked the teenagers .
experiment=NPI-env=negation-npi=ever-crucial_item=no-licensor=1-scope=1-npi_present=0	1		no students had often arrived at the humans .
experiment=NPI-env=negation-npi=ever-crucial_item=no-licensor=1-scope=0-npi_present=1	0		the students had ever arrived at no humans .
experiment=NPI-env=negation-npi=ever-crucial_item=no-licensor=1-scope=1-npi_present=0	1		no actors often exit a child .
experiment=NPI-env=negation-npi=ever-crucial_item=some-licensor=0-scope=1-npi_present=1	0		Some actors ever exit a child .
experiment=NPI-env=negation-npi=in years-crucial_item=no-licensor=1-scope=0-npi_present=0	1		a gal was scanning no actresses sometimes .
experiment=NPI-env=negation-npi=in years-crucial_item=some-licensor=0-scope=1-npi_present=1	0		Some gal was scanning the actresses in years .
experiment=NPI-env=negation-npi=in years-crucial_item=some-licensor=0-scope=0-npi_present=0	1		a human wears some lady sometimes .
experiment=NPI-env=negation-npi=yet-crucial_item=no-licensor=1-scope=1-npi_present=1	1		no ladies were talking to the waitresses yet .
experiment=NPI-env=negation-npi=yet-crucial_item=no-licensor=1-scope=0-npi_present=1	1		the ladies were talking to no waitresses yet .
experiment=NPI-env=negation-npi=yet-crucial_item=no-licensor=1-scope=0-npi_present=0	1		the ladies were talking to no waitresses sometimes .
experiment=NPI-env=negation-npi=yet-crucial_item=some-licensor=0-scope=1-npi_present=0	1		Some ladies were talking to the waitresses sometimes .
experiment=NPI-env=negation-npi=yet-crucial_item=no-licensor=1-scope=1-npi_present=0	1		no actress talked about the guests sometimes .
experiment=NPI-env=negation-npi=yet-crucial_item=no-licensor=1-scope=0-npi_present=1	1		an actress talked about no guests yet .
experiment=NPI-env=negation-npi=yet-crucial_item=some-licensor=0-scope=0-npi_present=1	0		an actress talked about some guests yet .
experiment=NPI-env=negation-npi=yet-crucial_item=some-licensor=0-scope=0-npi_present=0	1		an actress talked about some guests sometimes .
experiment=NPI-env=negation-npi=yet-crucial_item=no-licensor=1-scope=0-npi_present=1	1		a teacher tours no drivers yet .
experiment=NPI-env=negation-npi=yet-crucial_item=some-licensor=0-scope=0-npi_present=0	1		a teacher tours some drivers sometimes .
experiment=NPI-env=negation-npi=in years-crucial_item=no-licensor=1-scope=1-npi_present=0	1		no students could examine the teenagers sometimes .
experiment=NPI-env=negation-npi=in years-crucial_item=some-licensor=0-scope=1-npi_present=0	1		Some students could examine the teenagers sometimes .
experiment=NPI-env=negation-npi=in years-crucial_item=some-licensor=0-scope=0-npi_present=1	0		the students could examine some teenagers in years .
experiment=NPI-env=negation-npi=at all-crucial_item=no-licensor=1-scope=0-npi_present=1	1		the lady had toured no girls at all .
experiment=NPI-env=negation-npi=at all-crucial_item=no-licensor=1-scope=0-npi_present=0	1		the lady had toured no girls sometimes .
experiment=NPI-env=negation-npi=at all-crucial_item=some-licensor=0-scope=1-npi_present=0	1		Some lady had toured the girls sometimes .
experiment=NPI-env=negation-npi=yet-crucial_item=no-licensor=1-scope=1-npi_present=1	1		no teenager does clean a doctor yet .
experiment=NPI-env=negation-npi=yet-crucial_item=no-licensor=1-scope=1-npi_present=0	1		no teenager does clean a doctor sometimes .
experiment=NPI-env=negation-npi=yet-crucial_item=no-licensor=1-scope=0-npi_present=1	1		a teenager does clean no doctor yet .
experiment=NPI-env=negation-npi=yet-crucial_item=some-licensor=0-scope=0-npi_present=0	1		a teenager does clean some doctor sometimes .
experiment=NPI-env=negation-npi=yet-crucial_item=no-licensor=1-scope=1-npi_present=0	1		no actress had referenced the waiters sometimes .
experiment=NPI-env=negation-npi=yet-crucial_item=no-licensor=1-scope=1-npi_present=0	1		no cashiers criticized the adult sometimes .
experiment=NPI-env=negation-npi=yet-crucial_item=some-licensor=0-scope=0-npi_present=0	1		the cashiers criticized some adult sometimes .
experiment=NPI-env=negation-npi=at all-crucial_item=no-licensor=1-scope=1-npi_present=0	1		no people had forgotten the men sometimes .
experiment=NPI-env=negation-npi=at all-crucial_item=some-licensor=0-scope=1-npi_present=0	1		Some people had forgotten the men sometimes .
experiment=NPI-env=negation-npi=yet-crucial_item=no-licensor=1-scope=0-npi_present=1	1		a driver forgot no gals yet .
experiment=NPI-env=negation-npi=yet-crucial_item=no-licensor=1-scope=0-npi_present=0	1		a driver forgot no gals sometimes .
experiment=NPI-env=negation-npi=yet-crucial_item=some-licensor=0-scope=1-npi_present=1	0		Some driver forgot the gals yet .
experiment=NPI-env=negation-npi=yet-crucial_item=some-licensor=0-scope=1-npi_present=0	1		Some driver forgot the gals sometimes .
experiment=NPI-env=negation-npi=in years-crucial_item=no-licensor=1-scope=1-npi_present=1	1		no child observed a waitress in years .
experiment=NPI-env=negation-npi=in years-crucial_item=no-licensor=1-scope=0-npi_present=1	1		a child observed no waitress in years .
experiment=NPI-env=negation-npi=in years-crucial_item=no-licensor=1-scope=0-npi_present=0	1		a child observed no waitress sometimes .
experiment=NPI-env=negation-npi=in years-crucial_item=some-licensor=0-scope=0-npi_present=0	1		a child observed some waitress sometimes .
experiment=NPI-env=negation-npi=at all-crucial_item=no-licensor=1-scope=1-npi_present=0	1		no student criticizes the guy sometimes .
experiment=NPI-env=negation-npi=at all-crucial_item=no-licensor=1-scope=0-npi_present=1	1		a student criticizes no guy at all .
experiment=NPI-env=negation-npi=in years-crucial_item=no-licensor=1-scope=1-npi_present=1	1		no doctors fled from the customers in years .
experiment=NPI-env=negation-npi=in years-crucial_item=no-licensor=1-scope=1-npi_present=0	1		no doctors fled from the customers sometimes .
experiment=NPI-env=negation-npi=in years-crucial_item=no-licensor=1-scope=0-npi_present=0	1		the doctors fled from no customers sometimes .
experiment=NPI-env=negation-npi=at all-crucial_item=no-licensor=1-scope=1-npi_present=1	1		no adults had returned to the actors at all .
experiment=NPI-env=negation-npi=at all-crucial_item=some-licensor=0-scope=1-npi_present=1	0		Some adults had returned to the actors at all .
experiment=NPI-env=negation-npi=at all-crucial_item=some-licensor=0-scope=0-npi_present=1	0		the adults had returned to some actors at all .
experiment=NPI-env=negation-npi=yet-crucial_item=some-licensor=0-scope=0-npi_present=0	1		the actor describes some students sometimes .
experiment=NPI-env=negation-npi=yet-crucial_item=no-licensor=1-scope=1-npi_present=0	1		no humans observe a teacher sometimes .
experiment=NPI-env=negation-npi=yet-crucial_item=no-licensor=1-scope=0-npi_present=1	1		the humans observe no teacher yet .
experiment=NPI-env=negation-npi=yet-crucial_item=no-licensor=1-scope=0-npi_present=0	1		the humans observe no teacher sometimes .
experiment=NPI-env=negation-npi=yet-crucial_item=some-licensor=0-scope=1-npi_present=1	0		Some humans observe a teacher yet .
experiment=NPI-env=negation-npi=yet-crucial_item=some-licensor=0-scope=0-npi_present=1	0		the humans observe some teacher yet .
experiment=NPI-env=negation-npi=yet-crucial_item=some-licensor=0-scope=0-npi_present=0	1		the humans observe some teacher sometimes .
experiment=NPI-env=negation-npi=in years-crucial_item=no-licensor=1-scope=0-npi_present=0	1		a child escapes from no actress sometimes .
experiment=NPI-env=negation-npi=in years-crucial_item=some-licensor=0-scope=1-npi_present=1	0		Some child escapes from an actress in years .
experiment=NPI-env=negation-npi=in years-crucial_item=some-licensor=0-scope=0-npi_present=1	0		a child escapes from some actress in years .
experiment=NPI-env=negation-npi=at all-crucial_item=no-licensor=1-scope=0-npi_present=1	1		a doctor could talk to no pedestrians at all .
experiment=NPI-env=negation-npi=at all-crucial_item=some-licensor=0-scope=1-npi_present=1	0		Some doctor could talk to the pedestrians at all .
experiment=NPI-env=negation-npi=at all-crucial_item=some-licensor=0-scope=0-npi_present=0	1		a doctor could talk to some pedestrians sometimes .
experiment=NPI-env=negation-npi=at all-crucial_item=no-licensor=1-scope=1-npi_present=0	1		no patient has helped the waitresses sometimes .
experiment=NPI-env=negation-npi=at all-crucial_item=no-licensor=1-scope=0-npi_present=0	1		a patient has helped no waitresses sometimes .
experiment=NPI-env=negation-npi=at all-crucial_item=some-licensor=0-scope=1-npi_present=0	1		Some patient has helped the waitresses sometimes .
experiment=NPI-env=negation-npi=at all-crucial_item=some-licensor=0-scope=0-npi_present=1	0		a patient has helped some waitresses at all .
experiment=NPI-env=negation-npi=yet-crucial_item=some-licensor=0-scope=1-npi_present=1	0		Some women have talked to the patient yet .
experiment=NPI-env=negation-npi=in years-crucial_item=no-licensor=1-scope=1-npi_present=0	1		no guy hated the student sometimes .
experiment=NPI-env=negation-npi=in years-crucial_item=some-licensor=0-scope=1-npi_present=1	0		Some guy hated the student in years .
experiment=NPI-env=negation-npi=in years-crucial_item=no-licensor=1-scope=1-npi_present=1	1		no teenagers did escape from the waitresses in years .
experiment=NPI-env=negation-npi=in years-crucial_item=some-licensor=0-scope=1-npi_present=0	1		Some teenagers did escape from the waitresses sometimes .
experiment=NPI-env=negation-npi=in years-crucial_item=no-licensor=1-scope=0-npi_present=0	1		the patients saw no actors sometimes .
experiment=NPI-env=negation-npi=in years-crucial_item=some-licensor=0-scope=1-npi_present=1	0		Some patients saw the actors in years .
experiment=NPI-env=negation-npi=in years-crucial_item=some-licensor=0-scope=1-npi_present=0	1		Some patients saw the actors sometimes .
experiment=NPI-env=negation-npi=yet-crucial_item=no-licensor=1-scope=0-npi_present=1	1		the humans were running around no cashiers yet .
experiment=NPI-env=negation-npi=yet-crucial_item=no-licensor=1-scope=1-npi_present=0	1		no guest was talking about the waiters sometimes .
experiment=NPI-env=negation-npi=yet-crucial_item=some-licensor=0-scope=1-npi_present=1	0		Some guest was talking about the waiters yet .
experiment=NPI-env=negation-npi=yet-crucial_item=some-licensor=0-scope=1-npi_present=0	1		Some guest was talking about the waiters sometimes .
experiment=NPI-env=negation-npi=yet-crucial_item=some-licensor=0-scope=0-npi_present=1	0		the guest was talking about some waiters yet .
experiment=NPI-env=negation-npi=yet-crucial_item=no-licensor=1-scope=1-npi_present=1	1		no student broke a patient yet .
experiment=NPI-env=negation-npi=yet-crucial_item=no-licensor=1-scope=0-npi_present=1	1		the student broke no patient yet .
experiment=NPI-env=negation-npi=yet-crucial_item=some-licensor=0-scope=0-npi_present=1	0		the student broke some patient yet .
experiment=NPI-env=negation-npi=yet-crucial_item=some-licensor=0-scope=0-npi_present=0	1		the student broke some patient sometimes .
experiment=NPI-env=negation-npi=at all-crucial_item=no-licensor=1-scope=0-npi_present=0	1		a girl bikes to no pedestrians sometimes .
experiment=NPI-env=negation-npi=yet-crucial_item=no-licensor=1-scope=1-npi_present=1	1		no patient was arriving at the student yet .
experiment=NPI-env=negation-npi=yet-crucial_item=no-licensor=1-scope=1-npi_present=0	1		no patient was arriving at the student sometimes .
experiment=NPI-env=negation-npi=yet-crucial_item=no-licensor=1-scope=0-npi_present=1	1		the patient was arriving at no student yet .
experiment=NPI-env=negation-npi=yet-crucial_item=some-licensor=0-scope=1-npi_present=0	1		Some patient was arriving at the student sometimes .
experiment=NPI-env=negation-npi=yet-crucial_item=some-licensor=0-scope=0-npi_present=0	1		the patient was arriving at some student sometimes .
experiment=NPI-env=negation-npi=yet-crucial_item=no-licensor=1-scope=1-npi_present=0	1		no gals returned to the student sometimes .
experiment=NPI-env=negation-npi=yet-crucial_item=some-licensor=0-scope=1-npi_present=1	0		Some gals returned to the student yet .
experiment=NPI-env=negation-npi=yet-crucial_item=no-licensor=1-scope=1-npi_present=1	1		no human bought the cashiers yet .
experiment=NPI-env=negation-npi=yet-crucial_item=no-licensor=1-scope=0-npi_present=0	1		a human bought no cashiers sometimes .
experiment=NPI-env=negation-npi=yet-crucial_item=some-licensor=0-scope=0-npi_present=0	1		a human bought some cashiers sometimes .
experiment=NPI-env=negation-npi=yet-crucial_item=no-licensor=1-scope=1-npi_present=1	1		no drivers can flee from the person yet .
experiment=NPI-env=negation-npi=yet-crucial_item=no-licensor=1-scope=0-npi_present=0	1		the drivers can flee from no person sometimes .
experiment=NPI-env=negation-npi=yet-crucial_item=some-licensor=0-scope=1-npi_present=1	0		Some drivers can flee from the person yet .
experiment=NPI-env=negation-npi=yet-crucial_item=some-licensor=0-scope=0-npi_present=0	1		the drivers can flee from some person sometimes .
experiment=NPI-env=negation-npi=yet-crucial_item=no-licensor=1-scope=1-npi_present=0	1		no guy will buy the guests sometimes .
experiment=NPI-env=negation-npi=yet-crucial_item=some-licensor=0-scope=0-npi_present=1	0		a guy will buy some guests yet .
experiment=NPI-env=negation-npi=in years-crucial_item=no-licensor=1-scope=1-npi_present=0	1		no girl kissed the actor sometimes .
experiment=NPI-env=negation-npi=in years-crucial_item=no-licensor=1-scope=0-npi_present=0	1		the girl kissed no actor sometimes .
experiment=NPI-env=negation-npi=in years-crucial_item=some-licensor=0-scope=1-npi_present=1	0		Some girl kissed the actor in years .
experiment=NPI-env=negation-npi=in years-crucial_item=some-licensor=0-scope=0-npi_present=1	0		the girl kissed some actor in years .
experiment=NPI-env=negation-npi=at all-crucial_item=no-licensor=1-scope=0-npi_present=1	1		the teachers were exiting no doctor at all .
experiment=NPI-env=negation-npi=yet-crucial_item=no-licensor=1-scope=1-npi_present=0	1		no teachers can exit the adult sometimes .
experiment=NPI-env=negation-npi=yet-crucial_item=no-licensor=1-scope=0-npi_present=1	1		the teachers can exit no adult yet .
experiment=NPI-env=negation-npi=yet-crucial_item=no-licensor=1-scope=0-npi_present=0	1		the teachers can exit no adult sometimes .
experiment=NPI-env=negation-npi=yet-crucial_item=some-licensor=0-scope=1-npi_present=0	1		Some teachers can exit the adult sometimes .
experiment=NPI-env=negation-npi=yet-crucial_item=no-licensor=1-scope=0-npi_present=1	1		a human is referencing no teenagers yet .
experiment=NPI-env=negation-npi=yet-crucial_item=no-licensor=1-scope=0-npi_present=0	1		a human is referencing no teenagers sometimes .
experiment=NPI-env=negation-npi=yet-crucial_item=some-licensor=0-scope=1-npi_present=0	1		Some human is referencing the teenagers sometimes .
experiment=NPI-env=negation-npi=in years-crucial_item=no-licensor=1-scope=0-npi_present=0	1		a boy escaped from no students sometimes .
experiment=NPI-env=negation-npi=in years-crucial_item=some-licensor=0-scope=1-npi_present=0	1		Some boy escaped from the students sometimes .
experiment=NPI-env=negation-npi=at all-crucial_item=no-licensor=1-scope=0-npi_present=0	1		the waitresses did kiss no driver sometimes .
experiment=NPI-env=negation-npi=at all-crucial_item=some-licensor=0-scope=1-npi_present=1	0		Some waitresses did kiss the driver at all .
experiment=NPI-env=negation-npi=at all-crucial_item=some-licensor=0-scope=0-npi_present=1	0		the waitresses did kiss some driver at all .
experiment=NPI-env=negation-npi=yet-crucial_item=no-licensor=1-scope=0-npi_present=1	1		the actors do criticize no human yet .
experiment=NPI-env=negation-npi=yet-crucial_item=some-licensor=0-scope=1-npi_present=0	1		Some actors do criticize the human sometimes .
experiment=NPI-env=negation-npi=yet-crucial_item=some-licensor=0-scope=0-npi_present=1	0		the actors do criticize some human yet .
experiment=NPI-env=negation-npi=in years-crucial_item=no-licensor=1-scope=0-npi_present=0	1		the drivers hate no humans sometimes .
experiment=NPI-env=negation-npi=in years-crucial_item=some-licensor=0-scope=1-npi_present=1	0		Some drivers hate the humans in years .
experiment=NPI-env=negation-npi=yet-crucial_item=no-licensor=1-scope=1-npi_present=1	1		no boys had loved a guy yet .
experiment=NPI-env=negation-npi=yet-crucial_item=no-licensor=1-scope=1-npi_present=0	1		no boys had loved a guy sometimes .
experiment=NPI-env=negation-npi=yet-crucial_item=no-licensor=1-scope=0-npi_present=0	1		the boys had loved no guy sometimes .
experiment=NPI-env=negation-npi=yet-crucial_item=some-licensor=0-scope=1-npi_present=0	1		Some boys had loved a guy sometimes .
experiment=NPI-env=negation-npi=yet-crucial_item=some-licensor=0-scope=0-npi_present=0	1		the boys had loved some guy sometimes .
experiment=NPI-env=negation-npi=at all-crucial_item=no-licensor=1-scope=1-npi_present=1	1		no waiter has been at the teachers at all .
experiment=NPI-env=negation-npi=at all-crucial_item=no-licensor=1-scope=0-npi_present=1	1		the waiter has been at no teachers at all .
