experiment=NPI-env=adverbs-npi=ever-crucial_item=always-licensor=0-scope=1-npi_present=1	0		a teenager always ever thought that the girl hugged the women .
experiment=NPI-env=adverbs-npi=ever-crucial_item=barely-licensor=1-scope=1-npi_present=1	1		a teenager barely ever thought that the girl hugged the women .
experiment=NPI-env=adverbs-npi=ever-crucial_item=always-licensor=0-scope=0-npi_present=0	1		the pedestrians always explain that a driver also watches the waiters .
experiment=NPI-env=adverbs-npi=ever-crucial_item=seldom-licensor=1-scope=0-npi_present=1	0		the pedestrians seldom explain that a driver ever watches the waiters .
experiment=NPI-env=adverbs-npi=ever-crucial_item=always-licensor=0-scope=1-npi_present=1	0		the adults always ever say that the pedestrians surrendered .
experiment=NPI-env=adverbs-npi=ever-crucial_item=barely-licensor=1-scope=1-npi_present=1	1		the adults barely ever say that the pedestrians surrendered .
experiment=NPI-env=adverbs-npi=ever-crucial_item=always-licensor=0-scope=1-npi_present=0	1		the patient always also explained that the waitress murmured .
experiment=NPI-env=adverbs-npi=ever-crucial_item=always-licensor=0-scope=0-npi_present=1	0		the patient always explained that the waitress ever murmured .
experiment=NPI-env=adverbs-npi=ever-crucial_item=seldom-licensor=1-scope=0-npi_present=0	1		the patient seldom explained that the waitress also murmured .
experiment=NPI-env=adverbs-npi=ever-crucial_item=always-licensor=0-scope=1-npi_present=1	0		a doctor always ever thought that the guests grinned .
experiment=NPI-env=adverbs-npi=ever-crucial_item=barely-licensor=1-scope=0-npi_present=0	1		a doctor barely thought that the guests also grinned .
experiment=NPI-env=adverbs-npi=ever-crucial_item=hardly-licensor=1-scope=1-npi_present=1	1		the adults hardly ever imagined that a person would watch the goose .
experiment=NPI-env=adverbs-npi=ever-crucial_item=hardly-licensor=1-scope=1-npi_present=0	1		the adults hardly also imagined that a person would watch the goose .
experiment=NPI-env=adverbs-npi=ever-crucial_item=hardly-licensor=1-scope=0-npi_present=1	0		the adults hardly imagined that a person would ever watch the goose .
experiment=NPI-env=adverbs-npi=ever-crucial_item=hardly-licensor=1-scope=1-npi_present=0	1		the pedestrians hardly also explained that the men kiss a patient .
experiment=NPI-env=adverbs-npi=ever-crucial_item=hardly-licensor=1-scope=0-npi_present=0	1		the pedestrians hardly explained that the men also kiss a patient .
experiment=NPI-env=adverbs-npi=ever-crucial_item=often-licensor=0-scope=1-npi_present=1	0		the customers often ever say that the gals yelled .
experiment=NPI-env=adverbs-npi=ever-crucial_item=often-licensor=0-scope=0-npi_present=0	1		the customers often say that the gals also yelled .
experiment=NPI-env=adverbs-npi=ever-crucial_item=barely-licensor=1-scope=0-npi_present=0	1		the customers barely say that the gals also yelled .
experiment=NPI-env=adverbs-npi=ever-crucial_item=often-licensor=0-scope=1-npi_present=0	1		the waitresses often also thought that the boys have investigated the fish .
experiment=NPI-env=adverbs-npi=ever-crucial_item=seldom-licensor=1-scope=0-npi_present=0	1		the waitresses seldom thought that the boys have also investigated the fish .
experiment=NPI-env=adverbs-npi=ever-crucial_item=rarely-licensor=1-scope=1-npi_present=1	1		the cashiers rarely ever think that the gal stood up .
experiment=NPI-env=adverbs-npi=ever-crucial_item=rarely-licensor=1-scope=0-npi_present=1	0		the cashiers rarely think that the gal ever stood up .
experiment=NPI-env=adverbs-npi=ever-crucial_item=always-licensor=0-scope=1-npi_present=0	1		a person always also imagined that the woman has responded .
experiment=NPI-env=adverbs-npi=ever-crucial_item=always-licensor=0-scope=0-npi_present=1	0		a person always imagined that the woman has ever responded .
experiment=NPI-env=adverbs-npi=ever-crucial_item=always-licensor=0-scope=0-npi_present=0	1		a person always imagined that the woman has also responded .
experiment=NPI-env=adverbs-npi=ever-crucial_item=hardly-licensor=1-scope=0-npi_present=0	1		a person hardly imagined that the woman has also responded .
experiment=NPI-env=adverbs-npi=ever-crucial_item=always-licensor=0-scope=1-npi_present=1	0		the waiter always ever thought that the actress does approach the waiters .
experiment=NPI-env=adverbs-npi=ever-crucial_item=always-licensor=0-scope=0-npi_present=0	1		the waiter always thought that the actress also does approach the waiters .
experiment=NPI-env=adverbs-npi=ever-crucial_item=hardly-licensor=1-scope=1-npi_present=0	1		the waiter hardly also thought that the actress does approach the waiters .
experiment=NPI-env=adverbs-npi=ever-crucial_item=hardly-licensor=1-scope=0-npi_present=1	0		the waiter hardly thought that the actress ever does approach the waiters .
experiment=NPI-env=adverbs-npi=ever-crucial_item=often-licensor=0-scope=1-npi_present=1	0		a human often ever explains that the guys do react .
experiment=NPI-env=adverbs-npi=ever-crucial_item=often-licensor=0-scope=0-npi_present=0	1		a human often explains that the guys also do react .
experiment=NPI-env=adverbs-npi=ever-crucial_item=scarcely-licensor=1-scope=1-npi_present=1	1		a human scarcely ever explains that the guys do react .
experiment=NPI-env=adverbs-npi=ever-crucial_item=scarcely-licensor=1-scope=1-npi_present=0	1		a human scarcely also explains that the guys do react .
experiment=NPI-env=adverbs-npi=ever-crucial_item=sometimes-licensor=0-scope=0-npi_present=1	0		an adult sometimes says that a boy has ever forgotten the woman .
experiment=NPI-env=adverbs-npi=ever-crucial_item=hardly-licensor=1-scope=1-npi_present=1	1		an adult hardly ever says that a boy has forgotten the woman .
experiment=NPI-env=adverbs-npi=ever-crucial_item=sometimes-licensor=0-scope=0-npi_present=0	1		a person sometimes thinks that the cashier also runs around the libraries .
experiment=NPI-env=adverbs-npi=ever-crucial_item=scarcely-licensor=1-scope=0-npi_present=1	0		a person scarcely thinks that the cashier ever runs around the libraries .
experiment=NPI-env=adverbs-npi=ever-crucial_item=scarcely-licensor=1-scope=0-npi_present=0	1		a person scarcely thinks that the cashier also runs around the libraries .
experiment=NPI-env=adverbs-npi=ever-crucial_item=sometimes-licensor=0-scope=1-npi_present=1	0		the gals sometimes ever think that a lady had examined an commentary .
experiment=NPI-env=adverbs-npi=ever-crucial_item=sometimes-licensor=0-scope=1-npi_present=0	1		the gals sometimes also think that a lady had examined an commentary .
experiment=NPI-env=adverbs-npi=ever-crucial_item=sometimes-licensor=0-scope=0-npi_present=0	1		the gals sometimes think that a lady had also examined an commentary .
experiment=NPI-env=adverbs-npi=ever-crucial_item=barely-licensor=1-scope=1-npi_present=1	1		the gals barely ever think that a lady had examined an commentary .
experiment=NPI-env=adverbs-npi=ever-crucial_item=barely-licensor=1-scope=0-npi_present=0	1		the gals barely think that a lady had also examined an commentary .
experiment=NPI-env=adverbs-npi=ever-crucial_item=always-licensor=0-scope=0-npi_present=1	0		the patients always thought that an actress has ever cooperated .
experiment=NPI-env=adverbs-npi=ever-crucial_item=hardly-licensor=1-scope=0-npi_present=0	1		the patients hardly thought that an actress has also cooperated .
experiment=NPI-env=adverbs-npi=ever-crucial_item=hardly-licensor=1-scope=1-npi_present=1	1		the women hardly ever think that the pedestrian stretched .
experiment=NPI-env=adverbs-npi=ever-crucial_item=hardly-licensor=1-scope=1-npi_present=0	1		the women hardly also think that the pedestrian stretched .
experiment=NPI-env=adverbs-npi=ever-crucial_item=hardly-licensor=1-scope=0-npi_present=1	0		the women hardly think that the pedestrian ever stretched .
experiment=NPI-env=adverbs-npi=ever-crucial_item=often-licensor=0-scope=1-npi_present=1	0		the girls often ever say that the customers had muttered .
experiment=NPI-env=adverbs-npi=ever-crucial_item=often-licensor=0-scope=0-npi_present=1	0		the girls often say that the customers had ever muttered .
experiment=NPI-env=adverbs-npi=ever-crucial_item=scarcely-licensor=1-scope=1-npi_present=1	1		the girls scarcely ever say that the customers had muttered .
experiment=NPI-env=adverbs-npi=ever-crucial_item=often-licensor=0-scope=1-npi_present=1	0		a cashier often ever explained that the patients would attack a teenager .
experiment=NPI-env=adverbs-npi=ever-crucial_item=often-licensor=0-scope=1-npi_present=0	1		a cashier often also explained that the patients would attack a teenager .
experiment=NPI-env=adverbs-npi=ever-crucial_item=scarcely-licensor=1-scope=1-npi_present=1	1		a cashier scarcely ever explained that the patients would attack a teenager .
experiment=NPI-env=adverbs-npi=ever-crucial_item=scarcely-licensor=1-scope=0-npi_present=1	0		a cashier scarcely explained that the patients would ever attack a teenager .
experiment=NPI-env=adverbs-npi=ever-crucial_item=scarcely-licensor=1-scope=0-npi_present=0	1		a cashier scarcely explained that the patients would also attack a teenager .
experiment=NPI-env=adverbs-npi=ever-crucial_item=sometimes-licensor=0-scope=0-npi_present=0	1		the students sometimes imagined that the people also corresponded .
experiment=NPI-env=adverbs-npi=ever-crucial_item=seldom-licensor=1-scope=0-npi_present=0	1		the students seldom imagined that the people also corresponded .
experiment=NPI-env=adverbs-npi=ever-crucial_item=always-licensor=0-scope=1-npi_present=0	1		the boy always also explained that the doctors would perform .
experiment=NPI-env=adverbs-npi=ever-crucial_item=always-licensor=0-scope=0-npi_present=0	1		the teenagers always thought that the girls also argue .
experiment=NPI-env=adverbs-npi=ever-crucial_item=hardly-licensor=1-scope=1-npi_present=1	1		the teenagers hardly ever thought that the girls argue .
experiment=NPI-env=adverbs-npi=ever-crucial_item=hardly-licensor=1-scope=1-npi_present=0	1		the teenagers hardly also thought that the girls argue .
experiment=NPI-env=adverbs-npi=ever-crucial_item=seldom-licensor=1-scope=0-npi_present=0	1		the boys seldom explained that the girls also paint .
experiment=NPI-env=adverbs-npi=ever-crucial_item=always-licensor=0-scope=1-npi_present=0	1		a customer always also explained that the customer ate .
experiment=NPI-env=adverbs-npi=ever-crucial_item=scarcely-licensor=1-scope=1-npi_present=0	1		a customer scarcely also explained that the customer ate .
experiment=NPI-env=adverbs-npi=ever-crucial_item=scarcely-licensor=1-scope=0-npi_present=1	0		a customer scarcely explained that the customer ever ate .
experiment=NPI-env=adverbs-npi=ever-crucial_item=sometimes-licensor=0-scope=1-npi_present=1	0		the men sometimes ever thought that the guests observed a teacher .
experiment=NPI-env=adverbs-npi=ever-crucial_item=sometimes-licensor=0-scope=0-npi_present=0	1		the men sometimes thought that the guests also observed a teacher .
experiment=NPI-env=adverbs-npi=ever-crucial_item=hardly-licensor=1-scope=1-npi_present=1	1		the men hardly ever thought that the guests observed a teacher .
experiment=NPI-env=adverbs-npi=ever-crucial_item=hardly-licensor=1-scope=1-npi_present=0	1		the men hardly also thought that the guests observed a teacher .
experiment=NPI-env=adverbs-npi=ever-crucial_item=rarely-licensor=1-scope=1-npi_present=1	1		the waitresses rarely ever imagined that the patients have donated .
experiment=NPI-env=adverbs-npi=ever-crucial_item=rarely-licensor=1-scope=0-npi_present=0	1		the waitresses rarely imagined that the patients have also donated .
experiment=NPI-env=adverbs-npi=ever-crucial_item=often-licensor=0-scope=0-npi_present=1	0		the actor often explained that the human can ever observe the patients .
experiment=NPI-env=adverbs-npi=ever-crucial_item=often-licensor=0-scope=0-npi_present=0	1		the actor often explained that the human can also observe the patients .
experiment=NPI-env=adverbs-npi=ever-crucial_item=scarcely-licensor=1-scope=1-npi_present=1	1		the actor scarcely ever explained that the human can observe the patients .
experiment=NPI-env=adverbs-npi=ever-crucial_item=always-licensor=0-scope=0-npi_present=1	0		the woman always says that the adults ever work with a boy .
experiment=NPI-env=adverbs-npi=ever-crucial_item=always-licensor=0-scope=0-npi_present=0	1		the woman always says that the adults also work with a boy .
experiment=NPI-env=adverbs-npi=ever-crucial_item=scarcely-licensor=1-scope=1-npi_present=0	1		the woman scarcely also says that the adults work with a boy .
experiment=NPI-env=adverbs-npi=ever-crucial_item=scarcely-licensor=1-scope=0-npi_present=1	0		the actors scarcely explained that the cashiers had ever left a human .
experiment=NPI-env=adverbs-npi=ever-crucial_item=scarcely-licensor=1-scope=0-npi_present=0	1		the actors scarcely explained that the cashiers had also left a human .
experiment=NPI-env=adverbs-npi=ever-crucial_item=seldom-licensor=1-scope=0-npi_present=1	0		the guests seldom think that a guest ever washes .
experiment=NPI-env=adverbs-npi=ever-crucial_item=sometimes-licensor=0-scope=1-npi_present=0	1		the gals sometimes also explained that the driver might return to the children .
experiment=NPI-env=adverbs-npi=ever-crucial_item=sometimes-licensor=0-scope=0-npi_present=1	0		the gals sometimes explained that the driver might ever return to the children .
experiment=NPI-env=adverbs-npi=ever-crucial_item=barely-licensor=1-scope=0-npi_present=0	1		the gals barely explained that the driver might also return to the children .
experiment=NPI-env=adverbs-npi=ever-crucial_item=sometimes-licensor=0-scope=0-npi_present=0	1		a person sometimes thought that the person had also disliked the movie theater .
experiment=NPI-env=adverbs-npi=ever-crucial_item=barely-licensor=1-scope=0-npi_present=1	0		a person barely thought that the person had ever disliked the movie theater .
experiment=NPI-env=adverbs-npi=ever-crucial_item=often-licensor=0-scope=1-npi_present=1	0		the guests often ever thought that a boy been at the grocery stores .
experiment=NPI-env=adverbs-npi=ever-crucial_item=barely-licensor=1-scope=1-npi_present=0	1		the teenagers barely also imagine that the guys shrugged .
experiment=NPI-env=adverbs-npi=ever-crucial_item=barely-licensor=1-scope=0-npi_present=0	1		the teenagers barely imagine that the guys also shrugged .
experiment=NPI-env=adverbs-npi=ever-crucial_item=always-licensor=0-scope=1-npi_present=1	0		the doctors always ever thought that a waiter murmured .
experiment=NPI-env=adverbs-npi=ever-crucial_item=always-licensor=0-scope=0-npi_present=0	1		the doctors always thought that a waiter also murmured .
experiment=NPI-env=adverbs-npi=ever-crucial_item=rarely-licensor=1-scope=0-npi_present=1	0		the doctors rarely thought that a waiter ever murmured .
experiment=NPI-env=adverbs-npi=ever-crucial_item=sometimes-licensor=0-scope=0-npi_present=1	0		a human sometimes thought that the cashier would ever win .
experiment=NPI-env=adverbs-npi=ever-crucial_item=often-licensor=0-scope=0-npi_present=1	0		the driver often says that the men should ever negotiate .
experiment=NPI-env=adverbs-npi=ever-crucial_item=barely-licensor=1-scope=0-npi_present=1	0		the driver barely says that the men should ever negotiate .
experiment=NPI-env=adverbs-npi=ever-crucial_item=rarely-licensor=1-scope=1-npi_present=1	1		the women rarely ever say that the men had visited the people .
experiment=NPI-env=adverbs-npi=ever-crucial_item=often-licensor=0-scope=1-npi_present=1	0		the customers often ever imagined that a customer has sung .
experiment=NPI-env=adverbs-npi=ever-crucial_item=seldom-licensor=1-scope=1-npi_present=0	1		the customers seldom also imagined that a customer has sung .
experiment=NPI-env=adverbs-npi=ever-crucial_item=often-licensor=0-scope=1-npi_present=1	0		the gals often ever imagined that a driver changed .
experiment=NPI-env=adverbs-npi=ever-crucial_item=often-licensor=0-scope=0-npi_present=1	0		the gals often imagined that a driver ever changed .
experiment=NPI-env=adverbs-npi=ever-crucial_item=often-licensor=0-scope=0-npi_present=0	1		the gals often imagined that a driver also changed .
experiment=NPI-env=adverbs-npi=ever-crucial_item=hardly-licensor=1-scope=1-npi_present=0	1		the gals hardly also imagined that a driver changed .
experiment=NPI-env=adverbs-npi=ever-crucial_item=hardly-licensor=1-scope=0-npi_present=1	0		the gals hardly imagined that a driver ever changed .
experiment=NPI-env=adverbs-npi=ever-crucial_item=often-licensor=0-scope=1-npi_present=1	0		an adult often ever says that a child had kissed a teacher .
experiment=NPI-env=adverbs-npi=ever-crucial_item=always-licensor=0-scope=0-npi_present=0	1		the doctor always says that a patient should also watch the men .
experiment=NPI-env=adverbs-npi=ever-crucial_item=barely-licensor=1-scope=1-npi_present=0	1		the doctor barely also says that a patient should watch the men .
experiment=NPI-env=adverbs-npi=ever-crucial_item=sometimes-licensor=0-scope=1-npi_present=1	0		an actor sometimes ever explains that the lady dislikes the cafe .
experiment=NPI-env=adverbs-npi=ever-crucial_item=sometimes-licensor=0-scope=0-npi_present=1	0		an actor sometimes explains that the lady ever dislikes the cafe .
experiment=NPI-env=adverbs-npi=ever-crucial_item=sometimes-licensor=0-scope=0-npi_present=0	1		an actor sometimes explains that the lady also dislikes the cafe .
experiment=NPI-env=adverbs-npi=ever-crucial_item=hardly-licensor=1-scope=1-npi_present=0	1		an actor hardly also explains that the lady dislikes the cafe .
experiment=NPI-env=adverbs-npi=ever-crucial_item=always-licensor=0-scope=1-npi_present=1	0		the waiters always ever explained that the gal hunted .
experiment=NPI-env=adverbs-npi=ever-crucial_item=barely-licensor=1-scope=1-npi_present=1	1		the waiters barely ever explained that the gal hunted .
experiment=NPI-env=adverbs-npi=ever-crucial_item=barely-licensor=1-scope=0-npi_present=0	1		the waiters barely explained that the gal also hunted .
experiment=NPI-env=adverbs-npi=ever-crucial_item=often-licensor=0-scope=1-npi_present=1	0		the drivers often ever explained that the women should run around the schools .
experiment=NPI-env=adverbs-npi=ever-crucial_item=barely-licensor=1-scope=0-npi_present=1	0		the drivers barely explained that the women should ever run around the schools .
experiment=NPI-env=adverbs-npi=ever-crucial_item=sometimes-licensor=0-scope=0-npi_present=1	0		the humans sometimes explain that the gal has ever exercised .
experiment=NPI-env=adverbs-npi=ever-crucial_item=barely-licensor=1-scope=1-npi_present=1	1		the humans barely ever explain that the gal has exercised .
experiment=NPI-env=adverbs-npi=ever-crucial_item=often-licensor=0-scope=1-npi_present=1	0		the driver often ever imagines that the guys attacked the waitress .
experiment=NPI-env=adverbs-npi=ever-crucial_item=often-licensor=0-scope=1-npi_present=0	1		the driver often also imagines that the guys attacked the waitress .
experiment=NPI-env=adverbs-npi=ever-crucial_item=hardly-licensor=1-scope=1-npi_present=0	1		the driver hardly also imagines that the guys attacked the waitress .
experiment=NPI-env=adverbs-npi=ever-crucial_item=hardly-licensor=1-scope=0-npi_present=0	1		the driver hardly imagines that the guys also attacked the waitress .
experiment=NPI-env=adverbs-npi=ever-crucial_item=sometimes-licensor=0-scope=1-npi_present=1	0		the waitress sometimes ever says that the women had scanned the report .
experiment=NPI-env=adverbs-npi=ever-crucial_item=sometimes-licensor=0-scope=0-npi_present=1	0		the waitress sometimes says that the women had ever scanned the report .
experiment=NPI-env=adverbs-npi=ever-crucial_item=sometimes-licensor=0-scope=0-npi_present=0	1		the waitress sometimes says that the women had also scanned the report .
experiment=NPI-env=adverbs-npi=ever-crucial_item=seldom-licensor=1-scope=0-npi_present=1	0		the waitress seldom says that the women had ever scanned the report .
experiment=NPI-env=adverbs-npi=ever-crucial_item=often-licensor=0-scope=1-npi_present=1	0		the teacher often ever thought that the boys spun around .
experiment=NPI-env=adverbs-npi=ever-crucial_item=scarcely-licensor=1-scope=1-npi_present=1	1		the teacher scarcely ever thought that the boys spun around .
experiment=NPI-env=adverbs-npi=ever-crucial_item=scarcely-licensor=1-scope=0-npi_present=1	0		the teacher scarcely thought that the boys ever spun around .
experiment=NPI-env=adverbs-npi=ever-crucial_item=scarcely-licensor=1-scope=0-npi_present=0	1		the teacher scarcely thought that the boys also spun around .
experiment=NPI-env=adverbs-npi=ever-crucial_item=always-licensor=0-scope=1-npi_present=1	0		the doctors always ever say that a boy had yelled .
experiment=NPI-env=adverbs-npi=ever-crucial_item=always-licensor=0-scope=0-npi_present=1	0		the doctors always say that a boy had ever yelled .
experiment=NPI-env=adverbs-npi=ever-crucial_item=seldom-licensor=1-scope=1-npi_present=0	1		the doctors seldom also say that a boy had yelled .
experiment=NPI-env=adverbs-npi=ever-crucial_item=hardly-licensor=1-scope=1-npi_present=1	1		the people hardly ever imagine that the people examined the pamphlets .
experiment=NPI-env=adverbs-npi=ever-crucial_item=sometimes-licensor=0-scope=1-npi_present=1	0		a pedestrian sometimes ever explains that a boy should shrug .
experiment=NPI-env=adverbs-npi=ever-crucial_item=sometimes-licensor=0-scope=0-npi_present=1	0		a pedestrian sometimes explains that a boy should ever shrug .
experiment=NPI-env=adverbs-npi=ever-crucial_item=sometimes-licensor=0-scope=0-npi_present=0	1		a pedestrian sometimes explains that a boy should also shrug .
experiment=NPI-env=adverbs-npi=ever-crucial_item=scarcely-licensor=1-scope=0-npi_present=1	0		a pedestrian scarcely explains that a boy should ever shrug .
experiment=NPI-env=adverbs-npi=ever-crucial_item=often-licensor=0-scope=1-npi_present=1	0		the boy often ever thought that the guys pass the cafes .
experiment=NPI-env=adverbs-npi=ever-crucial_item=often-licensor=0-scope=0-npi_present=0	1		the boy often thought that the guys also pass the cafes .
experiment=NPI-env=adverbs-npi=ever-crucial_item=barely-licensor=1-scope=1-npi_present=1	1		the boy barely ever thought that the guys pass the cafes .
experiment=NPI-env=adverbs-npi=ever-crucial_item=barely-licensor=1-scope=1-npi_present=0	1		the boy barely also thought that the guys pass the cafes .
experiment=NPI-env=adverbs-npi=ever-crucial_item=barely-licensor=1-scope=0-npi_present=1	0		the boy barely thought that the guys ever pass the cafes .
experiment=NPI-env=adverbs-npi=ever-crucial_item=always-licensor=0-scope=1-npi_present=0	1		the cashiers always also thought that the students had boasted .
experiment=NPI-env=adverbs-npi=ever-crucial_item=hardly-licensor=1-scope=0-npi_present=1	0		the cashiers hardly thought that the students had ever boasted .
experiment=NPI-env=adverbs-npi=ever-crucial_item=hardly-licensor=1-scope=0-npi_present=0	1		the cashiers hardly thought that the students had also boasted .
experiment=NPI-env=adverbs-npi=ever-crucial_item=sometimes-licensor=0-scope=1-npi_present=1	0		the student sometimes ever says that the child spins around .
experiment=NPI-env=adverbs-npi=ever-crucial_item=rarely-licensor=1-scope=0-npi_present=1	0		the student rarely says that the child ever spins around .
experiment=NPI-env=adverbs-npi=ever-crucial_item=often-licensor=0-scope=0-npi_present=1	0		a patient often imagines that a boy ever talks about the art galleries .
experiment=NPI-env=adverbs-npi=ever-crucial_item=rarely-licensor=1-scope=0-npi_present=0	1		a patient rarely imagines that a boy also talks about the art galleries .
experiment=NPI-env=adverbs-npi=ever-crucial_item=sometimes-licensor=0-scope=0-npi_present=0	1		an actress sometimes thinks that the woman also slumped over .
experiment=NPI-env=adverbs-npi=ever-crucial_item=barely-licensor=1-scope=1-npi_present=0	1		an actress barely also thinks that the woman slumped over .
experiment=NPI-env=adverbs-npi=ever-crucial_item=often-licensor=0-scope=1-npi_present=0	1		a customer often also said that a patient chuckled .
experiment=NPI-env=adverbs-npi=ever-crucial_item=barely-licensor=1-scope=1-npi_present=0	1		a customer barely also said that a patient chuckled .
experiment=NPI-env=adverbs-npi=ever-crucial_item=sometimes-licensor=0-scope=0-npi_present=0	1		the actresses sometimes explain that the students also took the glass .
experiment=NPI-env=adverbs-npi=ever-crucial_item=seldom-licensor=1-scope=1-npi_present=1	1		the actresses seldom ever explain that the students took the glass .
experiment=NPI-env=adverbs-npi=ever-crucial_item=often-licensor=0-scope=1-npi_present=1	0		the guys often ever say that the teenagers describe the child .
experiment=NPI-env=adverbs-npi=ever-crucial_item=seldom-licensor=1-scope=0-npi_present=0	1		the guys seldom say that the teenagers also describe the child .
experiment=NPI-env=adverbs-npi=ever-crucial_item=sometimes-licensor=0-scope=1-npi_present=0	1		a human sometimes also explained that a boy exited the banks .
experiment=NPI-env=adverbs-npi=ever-crucial_item=hardly-licensor=1-scope=0-npi_present=1	0		a human hardly explained that a boy ever exited the banks .
experiment=NPI-env=adverbs-npi=ever-crucial_item=hardly-licensor=1-scope=0-npi_present=0	1		a human hardly explained that a boy also exited the banks .
experiment=NPI-env=adverbs-npi=ever-crucial_item=always-licensor=0-scope=1-npi_present=1	0		the children always ever explain that the teenager wept .
experiment=NPI-env=adverbs-npi=ever-crucial_item=always-licensor=0-scope=1-npi_present=0	1		the children always also explain that the teenager wept .
experiment=NPI-env=adverbs-npi=ever-crucial_item=always-licensor=0-scope=0-npi_present=0	1		the children always explain that the teenager also wept .
