5,"trial",14,"experiment=NPI-env=only-npi=either-crucial_item=even-licensor=0-scope=0-npi_present=1-paradigm=5675-acceptability=0","The senator can see either even at the art gallery.","trial",5,"experiment=NPI-env=sentential_negation_biclausal-npi=any-crucial_item=really-licensor=0-scope=1-npi_present=1-paradigm=5707-acceptability=0","These teenagers did really say that any cups might resemble a hat.","trial",16,"experiment=NPI-env=adverbs-npi=atall-crucial_item=seldom-licensor=1-scope=1-npi_present=1-paradigm=2403-acceptability=1","The children who could seldom collaborate at all flirted.","trial",15,"experiment=NPI-env=determiner_negation_biclausal-npi=at all-crucial_item=none of the-licensor=1-scope=1-npi_present=0-paradigm=2493-acceptability=1","None of the guests said that the couches resemble the movie theaters on occasion.","trial",10,"experiment=NPI-env=questions-npi=yet-crucial_item=whether-licensor=0-scope=0-npi_present=1-paradigm=2025-acceptability=0","The teenagers have said yet that the students will like the plates.","trial",1,"experiment=NPI-env=superlative-npi=yet-crucial_item=worst-licensor=1-scope=1-npi_present=1-paradigm=3237-acceptability=1","The dancers who investigated the worst patient yet pass art galleries.","trial",2,"experiment=NPI-env=superlative-npi=any-crucial_item=new-licensor=0-scope=1-npi_present=1-paradigm=1046-acceptability=0","The guests were bringing the new glasses that any waiters have brought.","trial",8,"experiment=NPI-env=quantifier-npi=yet-crucial_item=every-licensor=1-scope=0-npi_present=0-paradigm=2274-acceptability=1","Every actress who flees from more than three students knows more than three women for a while.","trial",13,"experiment=NPI-env=sentential_negation_biclausal-npi=at all-crucial_item=not-licensor=1-scope=0-npi_present=0-paradigm=2264-acceptability=1","The customer had thought on weekends that the girls had not kissed the adults.","trial",7,"experiment=NPI-env=sentential_negation_biclausal-npi=yet-crucial_item=really-licensor=0-scope=0-npi_present=1-paradigm=1473-acceptability=0","A patient had said yet that the museums could really resemble a play.","trial",17,"experiment=NPI-env=adverbs-npi=inyears-crucial_item=often-licensor=0-scope=1-npi_present=0-paradigm=3441-acceptability=1","An actor who often cleaned glasses on occasion had studied.","trial",3,"experiment=NPI-env=adverbs-npi=either-crucial_item=often-licensor=0-scope=0-npi_present=1-paradigm=4444-acceptability=0","The waitresses who often did bring glasses had conferred either.","trial",18,"experiment=NPI-env=sentential_negation_biclausal-npi=ever-crucial_item=not-licensor=1-scope=1-npi_present=0-paradigm=334-acceptability=1","The men will not clearly say that a person can wash.","trial",6,"experiment=NPI-env=simplequestions-npi=any-crucial_item=?-licensor=0-scope=1-npi_present=0-paradigm=1292-acceptability=1","The actresses were discussing the hospitals.","trial",19,"experiment=NPI-env=adverbs-npi=any-crucial_item=always-licensor=0-scope=0-npi_present=1-paradigm=1552-acceptability=0","A customer who has always arrived at schools discusses any cashiers.","trial",20,"experiment=NPI-env=superlative-npi=either-crucial_item=happy-licensor=0-scope=1-npi_present=0-paradigm=5744-acceptability=1","The patient who saw the happy women for a while observed actresses.","trial",22,"attention_check_item_2-acceptability=0","Select two for this answer to show that you are being attentive.","trial",9,"experiment=NPI-env=simplequestions-npi=atall-crucial_item=?-licensor=1-scope=1-npi_present=1-paradigm=2950-acceptability=1","Had the waiters cared for the people at all?","trial",12,"experiment=NPI-env=superlative-npi=atall-crucial_item=important-licensor=0-scope=1-npi_present=1-paradigm=2229-acceptability=0","The boys who forgot the important report at all toured schools.","trial",4,"experiment=NPI-env=only-npi=ever-crucial_item=even-licensor=0-scope=0-npi_present=1-paradigm=608-acceptability=0","A waitress does ever love even the men.","trial",21,"attention_check_item_6-acceptability=1","Show that you are paying attention by choosing the highest number on the scale.","trial",11,"experiment=NPI-env=only-npi=yet-crucial_item=even-licensor=0-scope=1-npi_present=1-paradigm=3782-acceptability=0","Even a guy had described schools yet at the restaurant."
6,"trial",21,"attention_check_item_6-acceptability=1","Show that you are paying attention by choosing the highest number on the scale.","trial",18,"experiment=NPI-env=sentential_negation_biclausal-npi=ever-crucial_item=not-licensor=1-scope=1-npi_present=0-paradigm=334-acceptability=1","The men will not clearly say that a person can wash.","trial",17,"experiment=NPI-env=adverbs-npi=inyears-crucial_item=often-licensor=0-scope=1-npi_present=0-paradigm=3441-acceptability=1","An actor who often cleaned glasses on occasion had studied.","trial",13,"experiment=NPI-env=sentential_negation_biclausal-npi=at all-crucial_item=not-licensor=1-scope=0-npi_present=0-paradigm=2264-acceptability=1","The customer had thought on weekends that the girls had not kissed the adults.","trial",3,"experiment=NPI-env=adverbs-npi=either-crucial_item=often-licensor=0-scope=0-npi_present=1-paradigm=4444-acceptability=0","The waitresses who often did bring glasses had conferred either.","trial",20,"experiment=NPI-env=superlative-npi=either-crucial_item=happy-licensor=0-scope=1-npi_present=0-paradigm=5744-acceptability=1","The patient who saw the happy women for a while observed actresses.","trial",12,"experiment=NPI-env=superlative-npi=atall-crucial_item=important-licensor=0-scope=1-npi_present=1-paradigm=2229-acceptability=0","The boys who forgot the important report at all toured schools.","trial",11,"experiment=NPI-env=only-npi=yet-crucial_item=even-licensor=0-scope=1-npi_present=1-paradigm=3782-acceptability=0","Even a guy had described schools yet at the restaurant.","trial",4,"experiment=NPI-env=only-npi=ever-crucial_item=even-licensor=0-scope=0-npi_present=1-paradigm=608-acceptability=0","A waitress does ever love even the men.","trial",10,"experiment=NPI-env=questions-npi=yet-crucial_item=whether-licensor=0-scope=0-npi_present=1-paradigm=2025-acceptability=0","The teenagers have said yet that the students will like the plates.","trial",19,"experiment=NPI-env=adverbs-npi=any-crucial_item=always-licensor=0-scope=0-npi_present=1-paradigm=1552-acceptability=0","A customer who has always arrived at schools discusses any cashiers.","trial",14,"experiment=NPI-env=only-npi=either-crucial_item=even-licensor=0-scope=0-npi_present=1-paradigm=5675-acceptability=0","The senator can see either even at the art gallery.","trial",9,"experiment=NPI-env=simplequestions-npi=atall-crucial_item=?-licensor=1-scope=1-npi_present=1-paradigm=2950-acceptability=1","Had the waiters cared for the people at all?","trial",1,"experiment=NPI-env=superlative-npi=yet-crucial_item=worst-licensor=1-scope=1-npi_present=1-paradigm=3237-acceptability=1","The dancers who investigated the worst patient yet pass art galleries.","trial",6,"experiment=NPI-env=simplequestions-npi=any-crucial_item=?-licensor=0-scope=1-npi_present=0-paradigm=1292-acceptability=1","The actresses were discussing the hospitals.","trial",8,"experiment=NPI-env=quantifier-npi=yet-crucial_item=every-licensor=1-scope=0-npi_present=0-paradigm=2274-acceptability=1","Every actress who flees from more than three students knows more than three women for a while.","trial",22,"attention_check_item_2-acceptability=0","Select two for this answer to show that you are being attentive.","trial",5,"experiment=NPI-env=sentential_negation_biclausal-npi=any-crucial_item=really-licensor=0-scope=1-npi_present=1-paradigm=5707-acceptability=0","These teenagers did really say that any cups might resemble a hat.","trial",16,"experiment=NPI-env=adverbs-npi=atall-crucial_item=seldom-licensor=1-scope=1-npi_present=1-paradigm=2403-acceptability=1","The children who could seldom collaborate at all flirted.","trial",2,"experiment=NPI-env=superlative-npi=any-crucial_item=new-licensor=0-scope=1-npi_present=1-paradigm=1046-acceptability=0","The guests were bringing the new glasses that any waiters have brought.","trial",7,"experiment=NPI-env=sentential_negation_biclausal-npi=yet-crucial_item=really-licensor=0-scope=0-npi_present=1-paradigm=1473-acceptability=0","A patient had said yet that the museums could really resemble a play.","trial",15,"experiment=NPI-env=determiner_negation_biclausal-npi=at all-crucial_item=none of the-licensor=1-scope=1-npi_present=0-paradigm=2493-acceptability=1","None of the guests said that the couches resemble the movie theaters on occasion."
7,"trial",11,"experiment=NPI-env=only-npi=yet-crucial_item=even-licensor=0-scope=1-npi_present=1-paradigm=3782-acceptability=0","Even a guy had described schools yet at the restaurant.","trial",5,"experiment=NPI-env=sentential_negation_biclausal-npi=any-crucial_item=really-licensor=0-scope=1-npi_present=1-paradigm=5707-acceptability=0","These teenagers did really say that any cups might resemble a hat.","trial",3,"experiment=NPI-env=adverbs-npi=either-crucial_item=often-licensor=0-scope=0-npi_present=1-paradigm=4444-acceptability=0","The waitresses who often did bring glasses had conferred either.","trial",6,"experiment=NPI-env=simplequestions-npi=any-crucial_item=?-licensor=0-scope=1-npi_present=0-paradigm=1292-acceptability=1","The actresses were discussing the hospitals.","trial",14,"experiment=NPI-env=only-npi=either-crucial_item=even-licensor=0-scope=0-npi_present=1-paradigm=5675-acceptability=0","The senator can see either even at the art gallery.","trial",18,"experiment=NPI-env=sentential_negation_biclausal-npi=ever-crucial_item=not-licensor=1-scope=1-npi_present=0-paradigm=334-acceptability=1","The men will not clearly say that a person can wash.","trial",4,"experiment=NPI-env=only-npi=ever-crucial_item=even-licensor=0-scope=0-npi_present=1-paradigm=608-acceptability=0","A waitress does ever love even the men.","trial",7,"experiment=NPI-env=sentential_negation_biclausal-npi=yet-crucial_item=really-licensor=0-scope=0-npi_present=1-paradigm=1473-acceptability=0","A patient had said yet that the museums could really resemble a play.","trial",16,"experiment=NPI-env=adverbs-npi=atall-crucial_item=seldom-licensor=1-scope=1-npi_present=1-paradigm=2403-acceptability=1","The children who could seldom collaborate at all flirted.","trial",13,"experiment=NPI-env=sentential_negation_biclausal-npi=at all-crucial_item=not-licensor=1-scope=0-npi_present=0-paradigm=2264-acceptability=1","The customer had thought on weekends that the girls had not kissed the adults.","trial",19,"experiment=NPI-env=adverbs-npi=any-crucial_item=always-licensor=0-scope=0-npi_present=1-paradigm=1552-acceptability=0","A customer who has always arrived at schools discusses any cashiers.","trial",8,"experiment=NPI-env=quantifier-npi=yet-crucial_item=every-licensor=1-scope=0-npi_present=0-paradigm=2274-acceptability=1","Every actress who flees from more than three students knows more than three women for a while.","trial",10,"experiment=NPI-env=questions-npi=yet-crucial_item=whether-licensor=0-scope=0-npi_present=1-paradigm=2025-acceptability=0","The teenagers have said yet that the students will like the plates.","trial",12,"experiment=NPI-env=superlative-npi=atall-crucial_item=important-licensor=0-scope=1-npi_present=1-paradigm=2229-acceptability=0","The boys who forgot the important report at all toured schools.","trial",2,"experiment=NPI-env=superlative-npi=any-crucial_item=new-licensor=0-scope=1-npi_present=1-paradigm=1046-acceptability=0","The guests were bringing the new glasses that any waiters have brought.","trial",1,"experiment=NPI-env=superlative-npi=yet-crucial_item=worst-licensor=1-scope=1-npi_present=1-paradigm=3237-acceptability=1","The dancers who investigated the worst patient yet pass art galleries.","trial",21,"attention_check_item_6-acceptability=1","Show that you are paying attention by choosing the highest number on the scale.","trial",9,"experiment=NPI-env=simplequestions-npi=atall-crucial_item=?-licensor=1-scope=1-npi_present=1-paradigm=2950-acceptability=1","Had the waiters cared for the people at all?","trial",20,"experiment=NPI-env=superlative-npi=either-crucial_item=happy-licensor=0-scope=1-npi_present=0-paradigm=5744-acceptability=1","The patient who saw the happy women for a while observed actresses.","trial",22,"attention_check_item_2-acceptability=0","Select two for this answer to show that you are being attentive.","trial",17,"experiment=NPI-env=adverbs-npi=inyears-crucial_item=often-licensor=0-scope=1-npi_present=0-paradigm=3441-acceptability=1","An actor who often cleaned glasses on occasion had studied.","trial",15,"experiment=NPI-env=determiner_negation_biclausal-npi=at all-crucial_item=none of the-licensor=1-scope=1-npi_present=0-paradigm=2493-acceptability=1","None of the guests said that the couches resemble the movie theaters on occasion."
8,"trial",10,"experiment=NPI-env=questions-npi=yet-crucial_item=whether-licensor=0-scope=0-npi_present=1-paradigm=2025-acceptability=0","The teenagers have said yet that the students will like the plates.","trial",6,"experiment=NPI-env=simplequestions-npi=any-crucial_item=?-licensor=0-scope=1-npi_present=0-paradigm=1292-acceptability=1","The actresses were discussing the hospitals.","trial",9,"experiment=NPI-env=simplequestions-npi=atall-crucial_item=?-licensor=1-scope=1-npi_present=1-paradigm=2950-acceptability=1","Had the waiters cared for the people at all?","trial",8,"experiment=NPI-env=quantifier-npi=yet-crucial_item=every-licensor=1-scope=0-npi_present=0-paradigm=2274-acceptability=1","Every actress who flees from more than three students knows more than three women for a while.","trial",22,"attention_check_item_2-acceptability=0","Select two for this answer to show that you are being attentive.","trial",21,"attention_check_item_6-acceptability=1","Show that you are paying attention by choosing the highest number on the scale.","trial",16,"experiment=NPI-env=adverbs-npi=atall-crucial_item=seldom-licensor=1-scope=1-npi_present=1-paradigm=2403-acceptability=1","The children who could seldom collaborate at all flirted.","trial",3,"experiment=NPI-env=adverbs-npi=either-crucial_item=often-licensor=0-scope=0-npi_present=1-paradigm=4444-acceptability=0","The waitresses who often did bring glasses had conferred either.","trial",4,"experiment=NPI-env=only-npi=ever-crucial_item=even-licensor=0-scope=0-npi_present=1-paradigm=608-acceptability=0","A waitress does ever love even the men.","trial",18,"experiment=NPI-env=sentential_negation_biclausal-npi=ever-crucial_item=not-licensor=1-scope=1-npi_present=0-paradigm=334-acceptability=1","The men will not clearly say that a person can wash.","trial",14,"experiment=NPI-env=only-npi=either-crucial_item=even-licensor=0-scope=0-npi_present=1-paradigm=5675-acceptability=0","The senator can see either even at the art gallery.","trial",19,"experiment=NPI-env=adverbs-npi=any-crucial_item=always-licensor=0-scope=0-npi_present=1-paradigm=1552-acceptability=0","A customer who has always arrived at schools discusses any cashiers.","trial",5,"experiment=NPI-env=sentential_negation_biclausal-npi=any-crucial_item=really-licensor=0-scope=1-npi_present=1-paradigm=5707-acceptability=0","These teenagers did really say that any cups might resemble a hat.","trial",11,"experiment=NPI-env=only-npi=yet-crucial_item=even-licensor=0-scope=1-npi_present=1-paradigm=3782-acceptability=0","Even a guy had described schools yet at the restaurant.","trial",12,"experiment=NPI-env=superlative-npi=atall-crucial_item=important-licensor=0-scope=1-npi_present=1-paradigm=2229-acceptability=0","The boys who forgot the important report at all toured schools.","trial",1,"experiment=NPI-env=superlative-npi=yet-crucial_item=worst-licensor=1-scope=1-npi_present=1-paradigm=3237-acceptability=1","The dancers who investigated the worst patient yet pass art galleries.","trial",2,"experiment=NPI-env=superlative-npi=any-crucial_item=new-licensor=0-scope=1-npi_present=1-paradigm=1046-acceptability=0","The guests were bringing the new glasses that any waiters have brought.","trial",13,"experiment=NPI-env=sentential_negation_biclausal-npi=at all-crucial_item=not-licensor=1-scope=0-npi_present=0-paradigm=2264-acceptability=1","The customer had thought on weekends that the girls had not kissed the adults.","trial",20,"experiment=NPI-env=superlative-npi=either-crucial_item=happy-licensor=0-scope=1-npi_present=0-paradigm=5744-acceptability=1","The patient who saw the happy women for a while observed actresses.","trial",15,"experiment=NPI-env=determiner_negation_biclausal-npi=at all-crucial_item=none of the-licensor=1-scope=1-npi_present=0-paradigm=2493-acceptability=1","None of the guests said that the couches resemble the movie theaters on occasion.","trial",7,"experiment=NPI-env=sentential_negation_biclausal-npi=yet-crucial_item=really-licensor=0-scope=0-npi_present=1-paradigm=1473-acceptability=0","A patient had said yet that the museums could really resemble a play.","trial",17,"experiment=NPI-env=adverbs-npi=inyears-crucial_item=often-licensor=0-scope=1-npi_present=0-paradigm=3441-acceptability=1","An actor who often cleaned glasses on occasion had studied."
9,"trial",15,"experiment=NPI-env=determiner_negation_biclausal-npi=at all-crucial_item=none of the-licensor=1-scope=1-npi_present=0-paradigm=2493-acceptability=1","None of the guests said that the couches resemble the movie theaters on occasion.","trial",16,"experiment=NPI-env=adverbs-npi=atall-crucial_item=seldom-licensor=1-scope=1-npi_present=1-paradigm=2403-acceptability=1","The children who could seldom collaborate at all flirted.","trial",12,"experiment=NPI-env=superlative-npi=atall-crucial_item=important-licensor=0-scope=1-npi_present=1-paradigm=2229-acceptability=0","The boys who forgot the important report at all toured schools.","trial",1,"experiment=NPI-env=superlative-npi=yet-crucial_item=worst-licensor=1-scope=1-npi_present=1-paradigm=3237-acceptability=1","The dancers who investigated the worst patient yet pass art galleries.","trial",13,"experiment=NPI-env=sentential_negation_biclausal-npi=at all-crucial_item=not-licensor=1-scope=0-npi_present=0-paradigm=2264-acceptability=1","The customer had thought on weekends that the girls had not kissed the adults.","trial",5,"experiment=NPI-env=sentential_negation_biclausal-npi=any-crucial_item=really-licensor=0-scope=1-npi_present=1-paradigm=5707-acceptability=0","These teenagers did really say that any cups might resemble a hat.","trial",11,"experiment=NPI-env=only-npi=yet-crucial_item=even-licensor=0-scope=1-npi_present=1-paradigm=3782-acceptability=0","Even a guy had described schools yet at the restaurant.","trial",9,"experiment=NPI-env=simplequestions-npi=atall-crucial_item=?-licensor=1-scope=1-npi_present=1-paradigm=2950-acceptability=1","Had the waiters cared for the people at all?","trial",20,"experiment=NPI-env=superlative-npi=either-crucial_item=happy-licensor=0-scope=1-npi_present=0-paradigm=5744-acceptability=1","The patient who saw the happy women for a while observed actresses.","trial",7,"experiment=NPI-env=sentential_negation_biclausal-npi=yet-crucial_item=really-licensor=0-scope=0-npi_present=1-paradigm=1473-acceptability=0","A patient had said yet that the museums could really resemble a play.","trial",8,"experiment=NPI-env=quantifier-npi=yet-crucial_item=every-licensor=1-scope=0-npi_present=0-paradigm=2274-acceptability=1","Every actress who flees from more than three students knows more than three women for a while.","trial",2,"experiment=NPI-env=superlative-npi=any-crucial_item=new-licensor=0-scope=1-npi_present=1-paradigm=1046-acceptability=0","The guests were bringing the new glasses that any waiters have brought.","trial",19,"experiment=NPI-env=adverbs-npi=any-crucial_item=always-licensor=0-scope=0-npi_present=1-paradigm=1552-acceptability=0","A customer who has always arrived at schools discusses any cashiers.","trial",6,"experiment=NPI-env=simplequestions-npi=any-crucial_item=?-licensor=0-scope=1-npi_present=0-paradigm=1292-acceptability=1","The actresses were discussing the hospitals.","trial",3,"experiment=NPI-env=adverbs-npi=either-crucial_item=often-licensor=0-scope=0-npi_present=1-paradigm=4444-acceptability=0","The waitresses who often did bring glasses had conferred either.","trial",21,"attention_check_item_6-acceptability=1","Show that you are paying attention by choosing the highest number on the scale.","trial",10,"experiment=NPI-env=questions-npi=yet-crucial_item=whether-licensor=0-scope=0-npi_present=1-paradigm=2025-acceptability=0","The teenagers have said yet that the students will like the plates.","trial",17,"experiment=NPI-env=adverbs-npi=inyears-crucial_item=often-licensor=0-scope=1-npi_present=0-paradigm=3441-acceptability=1","An actor who often cleaned glasses on occasion had studied.","trial",14,"experiment=NPI-env=only-npi=either-crucial_item=even-licensor=0-scope=0-npi_present=1-paradigm=5675-acceptability=0","The senator can see either even at the art gallery.","trial",18,"experiment=NPI-env=sentential_negation_biclausal-npi=ever-crucial_item=not-licensor=1-scope=1-npi_present=0-paradigm=334-acceptability=1","The men will not clearly say that a person can wash.","trial",22,"attention_check_item_2-acceptability=0","Select two for this answer to show that you are being attentive.","trial",4,"experiment=NPI-env=only-npi=ever-crucial_item=even-licensor=0-scope=0-npi_present=1-paradigm=608-acceptability=0","A waitress does ever love even the men."
10,"trial",9,"experiment=NPI-env=simplequestions-npi=atall-crucial_item=?-licensor=1-scope=1-npi_present=1-paradigm=2950-acceptability=1","Had the waiters cared for the people at all?","trial",1,"experiment=NPI-env=superlative-npi=yet-crucial_item=worst-licensor=1-scope=1-npi_present=1-paradigm=3237-acceptability=1","The dancers who investigated the worst patient yet pass art galleries.","trial",4,"experiment=NPI-env=only-npi=ever-crucial_item=even-licensor=0-scope=0-npi_present=1-paradigm=608-acceptability=0","A waitress does ever love even the men.","trial",5,"experiment=NPI-env=sentential_negation_biclausal-npi=any-crucial_item=really-licensor=0-scope=1-npi_present=1-paradigm=5707-acceptability=0","These teenagers did really say that any cups might resemble a hat.","trial",14,"experiment=NPI-env=only-npi=either-crucial_item=even-licensor=0-scope=0-npi_present=1-paradigm=5675-acceptability=0","The senator can see either even at the art gallery.","trial",21,"attention_check_item_6-acceptability=1","Show that you are paying attention by choosing the highest number on the scale.","trial",2,"experiment=NPI-env=superlative-npi=any-crucial_item=new-licensor=0-scope=1-npi_present=1-paradigm=1046-acceptability=0","The guests were bringing the new glasses that any waiters have brought.","trial",11,"experiment=NPI-env=only-npi=yet-crucial_item=even-licensor=0-scope=1-npi_present=1-paradigm=3782-acceptability=0","Even a guy had described schools yet at the restaurant.","trial",20,"experiment=NPI-env=superlative-npi=either-crucial_item=happy-licensor=0-scope=1-npi_present=0-paradigm=5744-acceptability=1","The patient who saw the happy women for a while observed actresses.","trial",15,"experiment=NPI-env=determiner_negation_biclausal-npi=at all-crucial_item=none of the-licensor=1-scope=1-npi_present=0-paradigm=2493-acceptability=1","None of the guests said that the couches resemble the movie theaters on occasion.","trial",18,"experiment=NPI-env=sentential_negation_biclausal-npi=ever-crucial_item=not-licensor=1-scope=1-npi_present=0-paradigm=334-acceptability=1","The men will not clearly say that a person can wash.","trial",8,"experiment=NPI-env=quantifier-npi=yet-crucial_item=every-licensor=1-scope=0-npi_present=0-paradigm=2274-acceptability=1","Every actress who flees from more than three students knows more than three women for a while.","trial",19,"experiment=NPI-env=adverbs-npi=any-crucial_item=always-licensor=0-scope=0-npi_present=1-paradigm=1552-acceptability=0","A customer who has always arrived at schools discusses any cashiers.","trial",22,"attention_check_item_2-acceptability=0","Select two for this answer to show that you are being attentive.","trial",16,"experiment=NPI-env=adverbs-npi=atall-crucial_item=seldom-licensor=1-scope=1-npi_present=1-paradigm=2403-acceptability=1","The children who could seldom collaborate at all flirted.","trial",17,"experiment=NPI-env=adverbs-npi=inyears-crucial_item=often-licensor=0-scope=1-npi_present=0-paradigm=3441-acceptability=1","An actor who often cleaned glasses on occasion had studied.","trial",3,"experiment=NPI-env=adverbs-npi=either-crucial_item=often-licensor=0-scope=0-npi_present=1-paradigm=4444-acceptability=0","The waitresses who often did bring glasses had conferred either.","trial",7,"experiment=NPI-env=sentential_negation_biclausal-npi=yet-crucial_item=really-licensor=0-scope=0-npi_present=1-paradigm=1473-acceptability=0","A patient had said yet that the museums could really resemble a play.","trial",13,"experiment=NPI-env=sentential_negation_biclausal-npi=at all-crucial_item=not-licensor=1-scope=0-npi_present=0-paradigm=2264-acceptability=1","The customer had thought on weekends that the girls had not kissed the adults.","trial",12,"experiment=NPI-env=superlative-npi=atall-crucial_item=important-licensor=0-scope=1-npi_present=1-paradigm=2229-acceptability=0","The boys who forgot the important report at all toured schools.","trial",6,"experiment=NPI-env=simplequestions-npi=any-crucial_item=?-licensor=0-scope=1-npi_present=0-paradigm=1292-acceptability=1","The actresses were discussing the hospitals.","trial",10,"experiment=NPI-env=questions-npi=yet-crucial_item=whether-licensor=0-scope=0-npi_present=1-paradigm=2025-acceptability=0","The teenagers have said yet that the students will like the plates."
