"list","item_1_section","item_1_number","item_1_condition","field_1_1","item_2_section","item_2_number","item_2_condition","field_2_1","item_3_section","item_3_number","item_3_condition","field_3_1","item_4_section","item_4_number","item_4_condition","field_4_1","item_5_section","item_5_number","item_5_condition","field_5_1","item_6_section","item_6_number","item_6_condition","field_6_1","item_7_section","item_7_number","item_7_condition","field_7_1","item_8_section","item_8_number","item_8_condition","field_8_1","item_9_section","item_9_number","item_9_condition","field_9_1","item_10_section","item_10_number","item_10_condition","field_10_1","item_11_section","item_11_number","item_11_condition","field_11_1","item_12_section","item_12_number","item_12_condition","field_12_1","item_13_section","item_13_number","item_13_condition","field_13_1","item_14_section","item_14_number","item_14_condition","field_14_1","item_15_section","item_15_number","item_15_condition","field_15_1","item_16_section","item_16_number","item_16_condition","field_16_1","item_17_section","item_17_number","item_17_condition","field_17_1","item_18_section","item_18_number","item_18_condition","field_18_1","item_19_section","item_19_number","item_19_condition","field_19_1","item_20_section","item_20_number","item_20_condition","field_20_1","item_21_section","item_21_number","item_21_condition","field_21_1","item_22_section","item_22_number","item_22_condition","field_22_1"
0,"trial",2,"experiment=NPI-env=superlative-npi=inyears-crucial_item=fast-licensor=0-scope=0-npi_present=1-paradigm=4989-acceptability=0","A person who described the fast adults has boycotted museums in years.","trial",16,"experiment=NPI-env=questions-npi=atall-crucial_item=whether-licensor=1-scope=1-npi_present=1-paradigm=3009-acceptability=1","The dancers have wondered whether the girl should walk through grocery stores at all.","trial",13,"experiment=NPI-env=adverbs-npi=ever-crucial_item=seldom-licensor=1-scope=1-npi_present=0-paradigm=309-acceptability=1","The actors seldom also imagine that the girls had lifted the cars.","trial",11,"experiment=NPI-env=sentential_negation_biclausal-npi=ever-crucial_item=really-licensor=0-scope=1-npi_present=0-paradigm=714-acceptability=1","The waiter has really also imagined that the cars do resemble a book.","trial",7,"experiment=NPI-env=simplequestions-npi=ever-crucial_item=?-licensor=1-scope=1-npi_present=0-paradigm=301-acceptability=1","Were the senators clearly talking about the guys?","trial",17,"experiment=NPI-env=only-npi=yet-crucial_item=only-licensor=1-scope=0-npi_present=0-paradigm=3538-acceptability=1","A boy is worrying regularly only at the cafe.","trial",3,"experiment=NPI-env=superlative-npi=either-crucial_item=popular-licensor=0-scope=1-npi_present=1-paradigm=5396-acceptability=0","A teacher who disliked the popular pedestrian either ran around museums.","trial",10,"experiment=NPI-env=determiner_negation_biclausal-npi=ever-crucial_item=none of the-licensor=1-scope=1-npi_present=0-paradigm=480-acceptability=1","None of the gals might often think that the gloves would resemble the grocery store.","trial",20,"experiment=NPI-env=conditional-npi=either-crucial_item=while-licensor=0-scope=0-npi_present=0-paradigm=5253-acceptability=1","While the girl likes the ladies, the customer will escape from the malls on occasion.","trial",1,"experiment=NPI-env=adverbs-npi=inyears-crucial_item=rarely-licensor=1-scope=0-npi_present=0-paradigm=3865-acceptability=1","The patient who had rarely changed has worried as well.","trial",19,"experiment=NPI-env=questions-npi=yet-crucial_item=whether-licensor=1-scope=1-npi_present=1-paradigm=2543-acceptability=1","The girls have wondered whether the patients have referenced waiters yet.","trial",18,"experiment=NPI-env=only-npi=atall-crucial_item=only-licensor=1-scope=1-npi_present=0-paradigm=2586-acceptability=1","Only the guest can buy forks as well at the grocery store.","trial",14,"experiment=NPI-env=quantifier-npi=atall-crucial_item=any-licensor=1-scope=0-npi_present=1-paradigm=3423-acceptability=0","Any students who did run around the movie theaters discussed a lot of girls at all.","trial",15,"experiment=NPI-env=sentential_negation_biclausal-npi=any-crucial_item=not-licensor=1-scope=1-npi_present=0-paradigm=5806-acceptability=1","Those cashiers are not saying that the grocery stores might resemble the hair.","trial",22,"attention_check_item_2-acceptability=0","Select two for this answer to show that you are being attentive.","trial",21,"attention_check_item_6-acceptability=1","Show that you are paying attention by choosing the highest number on the scale.","trial",8,"experiment=NPI-env=simplequestions-npi=either-crucial_item=?-licensor=0-scope=1-npi_present=1-paradigm=5836-acceptability=0","The ladies were admiring the men either.","trial",4,"experiment=NPI-env=determiner_negation_biclausal-npi=either-crucial_item=no-licensor=1-scope=0-npi_present=1-paradigm=4288-acceptability=0","The doctors have explained either that no waiters had passed the high schools.","trial",5,"experiment=NPI-env=questions-npi=either-crucial_item=whether-licensor=0-scope=1-npi_present=0-paradigm=5312-acceptability=1","The men have said that the student has escaped from the banks on weekends.","trial",9,"experiment=NPI-env=conditional-npi=inyears-crucial_item=while-licensor=0-scope=0-npi_present=0-paradigm=4896-acceptability=1","While the teachers have known the girls, the cashier will wear the shoes regularly.","trial",12,"experiment=NPI-env=quantifier-npi=ever-crucial_item=a lot of-licensor=0-scope=1-npi_present=1-paradigm=1514-acceptability=0","A lot of adults who have ever boycotted public parks can drop by many museums.","trial",6,"experiment=NPI-env=only-npi=inyears-crucial_item=even-licensor=0-scope=0-npi_present=0-paradigm=4731-acceptability=1","The men watched actresses as well even at the school."
1,"trial",16,"experiment=NPI-env=questions-npi=atall-crucial_item=whether-licensor=1-scope=1-npi_present=1-paradigm=3009-acceptability=1","The dancers have wondered whether the girl should walk through grocery stores at all.","trial",8,"experiment=NPI-env=simplequestions-npi=either-crucial_item=?-licensor=0-scope=1-npi_present=1-paradigm=5836-acceptability=0","The ladies were admiring the men either.","trial",1,"experiment=NPI-env=adverbs-npi=inyears-crucial_item=rarely-licensor=1-scope=0-npi_present=0-paradigm=3865-acceptability=1","The patient who had rarely changed has worried as well.","trial",20,"experiment=NPI-env=conditional-npi=either-crucial_item=while-licensor=0-scope=0-npi_present=0-paradigm=5253-acceptability=1","While the girl likes the ladies, the customer will escape from the malls on occasion.","trial",18,"experiment=NPI-env=only-npi=atall-crucial_item=only-licensor=1-scope=1-npi_present=0-paradigm=2586-acceptability=1","Only the guest can buy forks as well at the grocery store.","trial",2,"experiment=NPI-env=superlative-npi=inyears-crucial_item=fast-licensor=0-scope=0-npi_present=1-paradigm=4989-acceptability=0","A person who described the fast adults has boycotted museums in years.","trial",17,"experiment=NPI-env=only-npi=yet-crucial_item=only-licensor=1-scope=0-npi_present=0-paradigm=3538-acceptability=1","A boy is worrying regularly only at the cafe.","trial",14,"experiment=NPI-env=quantifier-npi=atall-crucial_item=any-licensor=1-scope=0-npi_present=1-paradigm=3423-acceptability=0","Any students who did run around the movie theaters discussed a lot of girls at all.","trial",4,"experiment=NPI-env=determiner_negation_biclausal-npi=either-crucial_item=no-licensor=1-scope=0-npi_present=1-paradigm=4288-acceptability=0","The doctors have explained either that no waiters had passed the high schools.","trial",3,"experiment=NPI-env=superlative-npi=either-crucial_item=popular-licensor=0-scope=1-npi_present=1-paradigm=5396-acceptability=0","A teacher who disliked the popular pedestrian either ran around museums.","trial",12,"experiment=NPI-env=quantifier-npi=ever-crucial_item=a lot of-licensor=0-scope=1-npi_present=1-paradigm=1514-acceptability=0","A lot of adults who have ever boycotted public parks can drop by many museums.","trial",19,"experiment=NPI-env=questions-npi=yet-crucial_item=whether-licensor=1-scope=1-npi_present=1-paradigm=2543-acceptability=1","The girls have wondered whether the patients have referenced waiters yet.","trial",5,"experiment=NPI-env=questions-npi=either-crucial_item=whether-licensor=0-scope=1-npi_present=0-paradigm=5312-acceptability=1","The men have said that the student has escaped from the banks on weekends.","trial",10,"experiment=NPI-env=determiner_negation_biclausal-npi=ever-crucial_item=none of the-licensor=1-scope=1-npi_present=0-paradigm=480-acceptability=1","None of the gals might often think that the gloves would resemble the grocery store.","trial",6,"experiment=NPI-env=only-npi=inyears-crucial_item=even-licensor=0-scope=0-npi_present=0-paradigm=4731-acceptability=1","The men watched actresses as well even at the school.","trial",9,"experiment=NPI-env=conditional-npi=inyears-crucial_item=while-licensor=0-scope=0-npi_present=0-paradigm=4896-acceptability=1","While the teachers have known the girls, the cashier will wear the shoes regularly.","trial",22,"attention_check_item_2-acceptability=0","Select two for this answer to show that you are being attentive.","trial",21,"attention_check_item_6-acceptability=1","Show that you are paying attention by choosing the highest number on the scale.","trial",7,"experiment=NPI-env=simplequestions-npi=ever-crucial_item=?-licensor=1-scope=1-npi_present=0-paradigm=301-acceptability=1","Were the senators clearly talking about the guys?","trial",11,"experiment=NPI-env=sentential_negation_biclausal-npi=ever-crucial_item=really-licensor=0-scope=1-npi_present=0-paradigm=714-acceptability=1","The waiter has really also imagined that the cars do resemble a book.","trial",13,"experiment=NPI-env=adverbs-npi=ever-crucial_item=seldom-licensor=1-scope=1-npi_present=0-paradigm=309-acceptability=1","The actors seldom also imagine that the girls had lifted the cars.","trial",15,"experiment=NPI-env=sentential_negation_biclausal-npi=any-crucial_item=not-licensor=1-scope=1-npi_present=0-paradigm=5806-acceptability=1","Those cashiers are not saying that the grocery stores might resemble the hair."
2,"trial",11,"experiment=NPI-env=sentential_negation_biclausal-npi=ever-crucial_item=really-licensor=0-scope=1-npi_present=0-paradigm=714-acceptability=1","The waiter has really also imagined that the cars do resemble a book.","trial",4,"experiment=NPI-env=determiner_negation_biclausal-npi=either-crucial_item=no-licensor=1-scope=0-npi_present=1-paradigm=4288-acceptability=0","The doctors have explained either that no waiters had passed the high schools.","trial",19,"experiment=NPI-env=questions-npi=yet-crucial_item=whether-licensor=1-scope=1-npi_present=1-paradigm=2543-acceptability=1","The girls have wondered whether the patients have referenced waiters yet.","trial",5,"experiment=NPI-env=questions-npi=either-crucial_item=whether-licensor=0-scope=1-npi_present=0-paradigm=5312-acceptability=1","The men have said that the student has escaped from the banks on weekends.","trial",18,"experiment=NPI-env=only-npi=atall-crucial_item=only-licensor=1-scope=1-npi_present=0-paradigm=2586-acceptability=1","Only the guest can buy forks as well at the grocery store.","trial",15,"experiment=NPI-env=sentential_negation_biclausal-npi=any-crucial_item=not-licensor=1-scope=1-npi_present=0-paradigm=5806-acceptability=1","Those cashiers are not saying that the grocery stores might resemble the hair.","trial",22,"attention_check_item_2-acceptability=0","Select two for this answer to show that you are being attentive.","trial",9,"experiment=NPI-env=conditional-npi=inyears-crucial_item=while-licensor=0-scope=0-npi_present=0-paradigm=4896-acceptability=1","While the teachers have known the girls, the cashier will wear the shoes regularly.","trial",12,"experiment=NPI-env=quantifier-npi=ever-crucial_item=a lot of-licensor=0-scope=1-npi_present=1-paradigm=1514-acceptability=0","A lot of adults who have ever boycotted public parks can drop by many museums.","trial",16,"experiment=NPI-env=questions-npi=atall-crucial_item=whether-licensor=1-scope=1-npi_present=1-paradigm=3009-acceptability=1","The dancers have wondered whether the girl should walk through grocery stores at all.","trial",21,"attention_check_item_6-acceptability=1","Show that you are paying attention by choosing the highest number on the scale.","trial",7,"experiment=NPI-env=simplequestions-npi=ever-crucial_item=?-licensor=1-scope=1-npi_present=0-paradigm=301-acceptability=1","Were the senators clearly talking about the guys?","trial",14,"experiment=NPI-env=quantifier-npi=atall-crucial_item=any-licensor=1-scope=0-npi_present=1-paradigm=3423-acceptability=0","Any students who did run around the movie theaters discussed a lot of girls at all.","trial",10,"experiment=NPI-env=determiner_negation_biclausal-npi=ever-crucial_item=none of the-licensor=1-scope=1-npi_present=0-paradigm=480-acceptability=1","None of the gals might often think that the gloves would resemble the grocery store.","trial",3,"experiment=NPI-env=superlative-npi=either-crucial_item=popular-licensor=0-scope=1-npi_present=1-paradigm=5396-acceptability=0","A teacher who disliked the popular pedestrian either ran around museums.","trial",20,"experiment=NPI-env=conditional-npi=either-crucial_item=while-licensor=0-scope=0-npi_present=0-paradigm=5253-acceptability=1","While the girl likes the ladies, the customer will escape from the malls on occasion.","trial",2,"experiment=NPI-env=superlative-npi=inyears-crucial_item=fast-licensor=0-scope=0-npi_present=1-paradigm=4989-acceptability=0","A person who described the fast adults has boycotted museums in years.","trial",17,"experiment=NPI-env=only-npi=yet-crucial_item=only-licensor=1-scope=0-npi_present=0-paradigm=3538-acceptability=1","A boy is worrying regularly only at the cafe.","trial",8,"experiment=NPI-env=simplequestions-npi=either-crucial_item=?-licensor=0-scope=1-npi_present=1-paradigm=5836-acceptability=0","The ladies were admiring the men either.","trial",1,"experiment=NPI-env=adverbs-npi=inyears-crucial_item=rarely-licensor=1-scope=0-npi_present=0-paradigm=3865-acceptability=1","The patient who had rarely changed has worried as well.","trial",6,"experiment=NPI-env=only-npi=inyears-crucial_item=even-licensor=0-scope=0-npi_present=0-paradigm=4731-acceptability=1","The men watched actresses as well even at the school.","trial",13,"experiment=NPI-env=adverbs-npi=ever-crucial_item=seldom-licensor=1-scope=1-npi_present=0-paradigm=309-acceptability=1","The actors seldom also imagine that the girls had lifted the cars."
3,"trial",22,"attention_check_item_2-acceptability=0","Select two for this answer to show that you are being attentive.","trial",15,"experiment=NPI-env=sentential_negation_biclausal-npi=any-crucial_item=not-licensor=1-scope=1-npi_present=0-paradigm=5806-acceptability=1","Those cashiers are not saying that the grocery stores might resemble the hair.","trial",5,"experiment=NPI-env=questions-npi=either-crucial_item=whether-licensor=0-scope=1-npi_present=0-paradigm=5312-acceptability=1","The men have said that the student has escaped from the banks on weekends.","trial",14,"experiment=NPI-env=quantifier-npi=atall-crucial_item=any-licensor=1-scope=0-npi_present=1-paradigm=3423-acceptability=0","Any students who did run around the movie theaters discussed a lot of girls at all.","trial",7,"experiment=NPI-env=simplequestions-npi=ever-crucial_item=?-licensor=1-scope=1-npi_present=0-paradigm=301-acceptability=1","Were the senators clearly talking about the guys?","trial",17,"experiment=NPI-env=only-npi=yet-crucial_item=only-licensor=1-scope=0-npi_present=0-paradigm=3538-acceptability=1","A boy is worrying regularly only at the cafe.","trial",18,"experiment=NPI-env=only-npi=atall-crucial_item=only-licensor=1-scope=1-npi_present=0-paradigm=2586-acceptability=1","Only the guest can buy forks as well at the grocery store.","trial",8,"experiment=NPI-env=simplequestions-npi=either-crucial_item=?-licensor=0-scope=1-npi_present=1-paradigm=5836-acceptability=0","The ladies were admiring the men either.","trial",10,"experiment=NPI-env=determiner_negation_biclausal-npi=ever-crucial_item=none of the-licensor=1-scope=1-npi_present=0-paradigm=480-acceptability=1","None of the gals might often think that the gloves would resemble the grocery store.","trial",20,"experiment=NPI-env=conditional-npi=either-crucial_item=while-licensor=0-scope=0-npi_present=0-paradigm=5253-acceptability=1","While the girl likes the ladies, the customer will escape from the malls on occasion.","trial",1,"experiment=NPI-env=adverbs-npi=inyears-crucial_item=rarely-licensor=1-scope=0-npi_present=0-paradigm=3865-acceptability=1","The patient who had rarely changed has worried as well.","trial",13,"experiment=NPI-env=adverbs-npi=ever-crucial_item=seldom-licensor=1-scope=1-npi_present=0-paradigm=309-acceptability=1","The actors seldom also imagine that the girls had lifted the cars.","trial",6,"experiment=NPI-env=only-npi=inyears-crucial_item=even-licensor=0-scope=0-npi_present=0-paradigm=4731-acceptability=1","The men watched actresses as well even at the school.","trial",2,"experiment=NPI-env=superlative-npi=inyears-crucial_item=fast-licensor=0-scope=0-npi_present=1-paradigm=4989-acceptability=0","A person who described the fast adults has boycotted museums in years.","trial",3,"experiment=NPI-env=superlative-npi=either-crucial_item=popular-licensor=0-scope=1-npi_present=1-paradigm=5396-acceptability=0","A teacher who disliked the popular pedestrian either ran around museums.","trial",12,"experiment=NPI-env=quantifier-npi=ever-crucial_item=a lot of-licensor=0-scope=1-npi_present=1-paradigm=1514-acceptability=0","A lot of adults who have ever boycotted public parks can drop by many museums.","trial",11,"experiment=NPI-env=sentential_negation_biclausal-npi=ever-crucial_item=really-licensor=0-scope=1-npi_present=0-paradigm=714-acceptability=1","The waiter has really also imagined that the cars do resemble a book.","trial",21,"attention_check_item_6-acceptability=1","Show that you are paying attention by choosing the highest number on the scale.","trial",19,"experiment=NPI-env=questions-npi=yet-crucial_item=whether-licensor=1-scope=1-npi_present=1-paradigm=2543-acceptability=1","The girls have wondered whether the patients have referenced waiters yet.","trial",9,"experiment=NPI-env=conditional-npi=inyears-crucial_item=while-licensor=0-scope=0-npi_present=0-paradigm=4896-acceptability=1","While the teachers have known the girls, the cashier will wear the shoes regularly.","trial",16,"experiment=NPI-env=questions-npi=atall-crucial_item=whether-licensor=1-scope=1-npi_present=1-paradigm=3009-acceptability=1","The dancers have wondered whether the girl should walk through grocery stores at all.","trial",4,"experiment=NPI-env=determiner_negation_biclausal-npi=either-crucial_item=no-licensor=1-scope=0-npi_present=1-paradigm=4288-acceptability=0","The doctors have explained either that no waiters had passed the high schools."
4,"trial",20,"experiment=NPI-env=conditional-npi=either-crucial_item=while-licensor=0-scope=0-npi_present=0-paradigm=5253-acceptability=1","While the girl likes the ladies, the customer will escape from the malls on occasion.","trial",4,"experiment=NPI-env=determiner_negation_biclausal-npi=either-crucial_item=no-licensor=1-scope=0-npi_present=1-paradigm=4288-acceptability=0","The doctors have explained either that no waiters had passed the high schools.","trial",12,"experiment=NPI-env=quantifier-npi=ever-crucial_item=a lot of-licensor=0-scope=1-npi_present=1-paradigm=1514-acceptability=0","A lot of adults who have ever boycotted public parks can drop by many museums.","trial",22,"attention_check_item_2-acceptability=0","Select two for this answer to show that you are being attentive.","trial",1,"experiment=NPI-env=adverbs-npi=inyears-crucial_item=rarely-licensor=1-scope=0-npi_present=0-paradigm=3865-acceptability=1","The patient who had rarely changed has worried as well.","trial",10,"experiment=NPI-env=determiner_negation_biclausal-npi=ever-crucial_item=none of the-licensor=1-scope=1-npi_present=0-paradigm=480-acceptability=1","None of the gals might often think that the gloves would resemble the grocery store.","trial",6,"experiment=NPI-env=only-npi=inyears-crucial_item=even-licensor=0-scope=0-npi_present=0-paradigm=4731-acceptability=1","The men watched actresses as well even at the school.","trial",11,"experiment=NPI-env=sentential_negation_biclausal-npi=ever-crucial_item=really-licensor=0-scope=1-npi_present=0-paradigm=714-acceptability=1","The waiter has really also imagined that the cars do resemble a book.","trial",3,"experiment=NPI-env=superlative-npi=either-crucial_item=popular-licensor=0-scope=1-npi_present=1-paradigm=5396-acceptability=0","A teacher who disliked the popular pedestrian either ran around museums.","trial",17,"experiment=NPI-env=only-npi=yet-crucial_item=only-licensor=1-scope=0-npi_present=0-paradigm=3538-acceptability=1","A boy is worrying regularly only at the cafe.","trial",18,"experiment=NPI-env=only-npi=atall-crucial_item=only-licensor=1-scope=1-npi_present=0-paradigm=2586-acceptability=1","Only the guest can buy forks as well at the grocery store.","trial",5,"experiment=NPI-env=questions-npi=either-crucial_item=whether-licensor=0-scope=1-npi_present=0-paradigm=5312-acceptability=1","The men have said that the student has escaped from the banks on weekends.","trial",7,"experiment=NPI-env=simplequestions-npi=ever-crucial_item=?-licensor=1-scope=1-npi_present=0-paradigm=301-acceptability=1","Were the senators clearly talking about the guys?","trial",8,"experiment=NPI-env=simplequestions-npi=either-crucial_item=?-licensor=0-scope=1-npi_present=1-paradigm=5836-acceptability=0","The ladies were admiring the men either.","trial",16,"experiment=NPI-env=questions-npi=atall-crucial_item=whether-licensor=1-scope=1-npi_present=1-paradigm=3009-acceptability=1","The dancers have wondered whether the girl should walk through grocery stores at all.","trial",2,"experiment=NPI-env=superlative-npi=inyears-crucial_item=fast-licensor=0-scope=0-npi_present=1-paradigm=4989-acceptability=0","A person who described the fast adults has boycotted museums in years.","trial",15,"experiment=NPI-env=sentential_negation_biclausal-npi=any-crucial_item=not-licensor=1-scope=1-npi_present=0-paradigm=5806-acceptability=1","Those cashiers are not saying that the grocery stores might resemble the hair.","trial",9,"experiment=NPI-env=conditional-npi=inyears-crucial_item=while-licensor=0-scope=0-npi_present=0-paradigm=4896-acceptability=1","While the teachers have known the girls, the cashier will wear the shoes regularly.","trial",13,"experiment=NPI-env=adverbs-npi=ever-crucial_item=seldom-licensor=1-scope=1-npi_present=0-paradigm=309-acceptability=1","The actors seldom also imagine that the girls had lifted the cars.","trial",21,"attention_check_item_6-acceptability=1","Show that you are paying attention by choosing the highest number on the scale.","trial",14,"experiment=NPI-env=quantifier-npi=atall-crucial_item=any-licensor=1-scope=0-npi_present=1-paradigm=3423-acceptability=0","Any students who did run around the movie theaters discussed a lot of girls at all.","trial",19,"experiment=NPI-env=questions-npi=yet-crucial_item=whether-licensor=1-scope=1-npi_present=1-paradigm=2543-acceptability=1","The girls have wondered whether the patients have referenced waiters yet."
