15,"trial",7,"experiment=NPI-env=simplequestions-npi=ever-crucial_item=?-licensor=1-scope=1-npi_present=0-paradigm=301-acceptability=1","Were the senators clearly talking about the guys?","trial",6,"experiment=NPI-env=only-npi=inyears-crucial_item=even-licensor=0-scope=0-npi_present=0-paradigm=4731-acceptability=1","The men watched actresses as well even at the school.","trial",10,"experiment=NPI-env=determiner_negation_biclausal-npi=ever-crucial_item=none of the-licensor=1-scope=1-npi_present=0-paradigm=480-acceptability=1","None of the gals might often think that the gloves would resemble the grocery store.","trial",9,"experiment=NPI-env=conditional-npi=inyears-crucial_item=while-licensor=0-scope=0-npi_present=0-paradigm=4896-acceptability=1","While the teachers have known the girls, the cashier will wear the shoes regularly.","trial",1,"experiment=NPI-env=adverbs-npi=inyears-crucial_item=rarely-licensor=1-scope=0-npi_present=0-paradigm=3865-acceptability=1","The patient who had rarely changed has worried as well.","trial",13,"experiment=NPI-env=adverbs-npi=ever-crucial_item=seldom-licensor=1-scope=1-npi_present=0-paradigm=309-acceptability=1","The actors seldom also imagine that the girls had lifted the cars.","trial",20,"experiment=NPI-env=conditional-npi=either-crucial_item=while-licensor=0-scope=0-npi_present=0-paradigm=5253-acceptability=1","While the girl likes the ladies, the customer will escape from the malls on occasion.","trial",4,"experiment=NPI-env=determiner_negation_biclausal-npi=either-crucial_item=no-licensor=1-scope=0-npi_present=1-paradigm=4288-acceptability=0","The doctors have explained either that no waiters had passed the high schools.","trial",11,"experiment=NPI-env=sentential_negation_biclausal-npi=ever-crucial_item=really-licensor=0-scope=1-npi_present=0-paradigm=714-acceptability=1","The waiter has really also imagined that the cars do resemble a book.","trial",5,"experiment=NPI-env=questions-npi=either-crucial_item=whether-licensor=0-scope=1-npi_present=0-paradigm=5312-acceptability=1","The men have said that the student has escaped from the banks on weekends.","trial",16,"experiment=NPI-env=questions-npi=atall-crucial_item=whether-licensor=1-scope=1-npi_present=1-paradigm=3009-acceptability=1","The dancers have wondered whether the girl should walk through grocery stores at all.","trial",12,"experiment=NPI-env=quantifier-npi=ever-crucial_item=a lot of-licensor=0-scope=1-npi_present=1-paradigm=1514-acceptability=0","A lot of adults who have ever boycotted public parks can drop by many museums.","trial",17,"experiment=NPI-env=only-npi=yet-crucial_item=only-licensor=1-scope=0-npi_present=0-paradigm=3538-acceptability=1","A boy is worrying regularly only at the cafe.","trial",21,"attention_check_item_6-acceptability=1","Show that you are paying attention by choosing the highest number on the scale.","trial",18,"experiment=NPI-env=only-npi=atall-crucial_item=only-licensor=1-scope=1-npi_present=0-paradigm=2586-acceptability=1","Only the guest can buy forks as well at the grocery store.","trial",22,"attention_check_item_2-acceptability=0","Select two for this answer to show that you are being attentive.","trial",15,"experiment=NPI-env=sentential_negation_biclausal-npi=any-crucial_item=not-licensor=1-scope=1-npi_present=0-paradigm=5806-acceptability=1","Those cashiers are not saying that the grocery stores might resemble the hair.","trial",2,"experiment=NPI-env=superlative-npi=inyears-crucial_item=fast-licensor=0-scope=0-npi_present=1-paradigm=4989-acceptability=0","A person who described the fast adults has boycotted museums in years.","trial",14,"experiment=NPI-env=quantifier-npi=atall-crucial_item=any-licensor=1-scope=0-npi_present=1-paradigm=3423-acceptability=0","Any students who did run around the movie theaters discussed a lot of girls at all.","trial",19,"experiment=NPI-env=questions-npi=yet-crucial_item=whether-licensor=1-scope=1-npi_present=1-paradigm=2543-acceptability=1","The girls have wondered whether the patients have referenced waiters yet.","trial",8,"experiment=NPI-env=simplequestions-npi=either-crucial_item=?-licensor=0-scope=1-npi_present=1-paradigm=5836-acceptability=0","The ladies were admiring the men either.","trial",3,"experiment=NPI-env=superlative-npi=either-crucial_item=popular-licensor=0-scope=1-npi_present=1-paradigm=5396-acceptability=0","A teacher who disliked the popular pedestrian either ran around museums."
16,"trial",21,"attention_check_item_6-acceptability=1","Show that you are paying attention by choosing the highest number on the scale.","trial",9,"experiment=NPI-env=conditional-npi=inyears-crucial_item=while-licensor=0-scope=0-npi_present=0-paradigm=4896-acceptability=1","While the teachers have known the girls, the cashier will wear the shoes regularly.","trial",15,"experiment=NPI-env=sentential_negation_biclausal-npi=any-crucial_item=not-licensor=1-scope=1-npi_present=0-paradigm=5806-acceptability=1","Those cashiers are not saying that the grocery stores might resemble the hair.","trial",1,"experiment=NPI-env=adverbs-npi=inyears-crucial_item=rarely-licensor=1-scope=0-npi_present=0-paradigm=3865-acceptability=1","The patient who had rarely changed has worried as well.","trial",14,"experiment=NPI-env=quantifier-npi=atall-crucial_item=any-licensor=1-scope=0-npi_present=1-paradigm=3423-acceptability=0","Any students who did run around the movie theaters discussed a lot of girls at all.","trial",5,"experiment=NPI-env=questions-npi=either-crucial_item=whether-licensor=0-scope=1-npi_present=0-paradigm=5312-acceptability=1","The men have said that the student has escaped from the banks on weekends.","trial",3,"experiment=NPI-env=superlative-npi=either-crucial_item=popular-licensor=0-scope=1-npi_present=1-paradigm=5396-acceptability=0","A teacher who disliked the popular pedestrian either ran around museums.","trial",6,"experiment=NPI-env=only-npi=inyears-crucial_item=even-licensor=0-scope=0-npi_present=0-paradigm=4731-acceptability=1","The men watched actresses as well even at the school.","trial",13,"experiment=NPI-env=adverbs-npi=ever-crucial_item=seldom-licensor=1-scope=1-npi_present=0-paradigm=309-acceptability=1","The actors seldom also imagine that the girls had lifted the cars.","trial",2,"experiment=NPI-env=superlative-npi=inyears-crucial_item=fast-licensor=0-scope=0-npi_present=1-paradigm=4989-acceptability=0","A person who described the fast adults has boycotted museums in years.","trial",4,"experiment=NPI-env=determiner_negation_biclausal-npi=either-crucial_item=no-licensor=1-scope=0-npi_present=1-paradigm=4288-acceptability=0","The doctors have explained either that no waiters had passed the high schools.","trial",12,"experiment=NPI-env=quantifier-npi=ever-crucial_item=a lot of-licensor=0-scope=1-npi_present=1-paradigm=1514-acceptability=0","A lot of adults who have ever boycotted public parks can drop by many museums.","trial",10,"experiment=NPI-env=determiner_negation_biclausal-npi=ever-crucial_item=none of the-licensor=1-scope=1-npi_present=0-paradigm=480-acceptability=1","None of the gals might often think that the gloves would resemble the grocery store.","trial",18,"experiment=NPI-env=only-npi=atall-crucial_item=only-licensor=1-scope=1-npi_present=0-paradigm=2586-acceptability=1","Only the guest can buy forks as well at the grocery store.","trial",16,"experiment=NPI-env=questions-npi=atall-crucial_item=whether-licensor=1-scope=1-npi_present=1-paradigm=3009-acceptability=1","The dancers have wondered whether the girl should walk through grocery stores at all.","trial",20,"experiment=NPI-env=conditional-npi=either-crucial_item=while-licensor=0-scope=0-npi_present=0-paradigm=5253-acceptability=1","While the girl likes the ladies, the customer will escape from the malls on occasion.","trial",8,"experiment=NPI-env=simplequestions-npi=either-crucial_item=?-licensor=0-scope=1-npi_present=1-paradigm=5836-acceptability=0","The ladies were admiring the men either.","trial",7,"experiment=NPI-env=simplequestions-npi=ever-crucial_item=?-licensor=1-scope=1-npi_present=0-paradigm=301-acceptability=1","Were the senators clearly talking about the guys?","trial",19,"experiment=NPI-env=questions-npi=yet-crucial_item=whether-licensor=1-scope=1-npi_present=1-paradigm=2543-acceptability=1","The girls have wondered whether the patients have referenced waiters yet.","trial",17,"experiment=NPI-env=only-npi=yet-crucial_item=only-licensor=1-scope=0-npi_present=0-paradigm=3538-acceptability=1","A boy is worrying regularly only at the cafe.","trial",11,"experiment=NPI-env=sentential_negation_biclausal-npi=ever-crucial_item=really-licensor=0-scope=1-npi_present=0-paradigm=714-acceptability=1","The waiter has really also imagined that the cars do resemble a book.","trial",22,"attention_check_item_2-acceptability=0","Select two for this answer to show that you are being attentive."
17,"trial",8,"experiment=NPI-env=simplequestions-npi=either-crucial_item=?-licensor=0-scope=1-npi_present=1-paradigm=5836-acceptability=0","The ladies were admiring the men either.","trial",9,"experiment=NPI-env=conditional-npi=inyears-crucial_item=while-licensor=0-scope=0-npi_present=0-paradigm=4896-acceptability=1","While the teachers have known the girls, the cashier will wear the shoes regularly.","trial",11,"experiment=NPI-env=sentential_negation_biclausal-npi=ever-crucial_item=really-licensor=0-scope=1-npi_present=0-paradigm=714-acceptability=1","The waiter has really also imagined that the cars do resemble a book.","trial",12,"experiment=NPI-env=quantifier-npi=ever-crucial_item=a lot of-licensor=0-scope=1-npi_present=1-paradigm=1514-acceptability=0","A lot of adults who have ever boycotted public parks can drop by many museums.","trial",6,"experiment=NPI-env=only-npi=inyears-crucial_item=even-licensor=0-scope=0-npi_present=0-paradigm=4731-acceptability=1","The men watched actresses as well even at the school.","trial",10,"experiment=NPI-env=determiner_negation_biclausal-npi=ever-crucial_item=none of the-licensor=1-scope=1-npi_present=0-paradigm=480-acceptability=1","None of the gals might often think that the gloves would resemble the grocery store.","trial",4,"experiment=NPI-env=determiner_negation_biclausal-npi=either-crucial_item=no-licensor=1-scope=0-npi_present=1-paradigm=4288-acceptability=0","The doctors have explained either that no waiters had passed the high schools.","trial",1,"experiment=NPI-env=adverbs-npi=inyears-crucial_item=rarely-licensor=1-scope=0-npi_present=0-paradigm=3865-acceptability=1","The patient who had rarely changed has worried as well.","trial",17,"experiment=NPI-env=only-npi=yet-crucial_item=only-licensor=1-scope=0-npi_present=0-paradigm=3538-acceptability=1","A boy is worrying regularly only at the cafe.","trial",22,"attention_check_item_2-acceptability=0","Select two for this answer to show that you are being attentive.","trial",16,"experiment=NPI-env=questions-npi=atall-crucial_item=whether-licensor=1-scope=1-npi_present=1-paradigm=3009-acceptability=1","The dancers have wondered whether the girl should walk through grocery stores at all.","trial",14,"experiment=NPI-env=quantifier-npi=atall-crucial_item=any-licensor=1-scope=0-npi_present=1-paradigm=3423-acceptability=0","Any students who did run around the movie theaters discussed a lot of girls at all.","trial",21,"attention_check_item_6-acceptability=1","Show that you are paying attention by choosing the highest number on the scale.","trial",15,"experiment=NPI-env=sentential_negation_biclausal-npi=any-crucial_item=not-licensor=1-scope=1-npi_present=0-paradigm=5806-acceptability=1","Those cashiers are not saying that the grocery stores might resemble the hair.","trial",7,"experiment=NPI-env=simplequestions-npi=ever-crucial_item=?-licensor=1-scope=1-npi_present=0-paradigm=301-acceptability=1","Were the senators clearly talking about the guys?","trial",20,"experiment=NPI-env=conditional-npi=either-crucial_item=while-licensor=0-scope=0-npi_present=0-paradigm=5253-acceptability=1","While the girl likes the ladies, the customer will escape from the malls on occasion.","trial",2,"experiment=NPI-env=superlative-npi=inyears-crucial_item=fast-licensor=0-scope=0-npi_present=1-paradigm=4989-acceptability=0","A person who described the fast adults has boycotted museums in years.","trial",19,"experiment=NPI-env=questions-npi=yet-crucial_item=whether-licensor=1-scope=1-npi_present=1-paradigm=2543-acceptability=1","The girls have wondered whether the patients have referenced waiters yet.","trial",5,"experiment=NPI-env=questions-npi=either-crucial_item=whether-licensor=0-scope=1-npi_present=0-paradigm=5312-acceptability=1","The men have said that the student has escaped from the banks on weekends.","trial",3,"experiment=NPI-env=superlative-npi=either-crucial_item=popular-licensor=0-scope=1-npi_present=1-paradigm=5396-acceptability=0","A teacher who disliked the popular pedestrian either ran around museums.","trial",18,"experiment=NPI-env=only-npi=atall-crucial_item=only-licensor=1-scope=1-npi_present=0-paradigm=2586-acceptability=1","Only the guest can buy forks as well at the grocery store.","trial",13,"experiment=NPI-env=adverbs-npi=ever-crucial_item=seldom-licensor=1-scope=1-npi_present=0-paradigm=309-acceptability=1","The actors seldom also imagine that the girls had lifted the cars."
18,"trial",5,"experiment=NPI-env=questions-npi=either-crucial_item=whether-licensor=0-scope=1-npi_present=0-paradigm=5312-acceptability=1","The men have said that the student has escaped from the banks on weekends.","trial",15,"experiment=NPI-env=sentential_negation_biclausal-npi=any-crucial_item=not-licensor=1-scope=1-npi_present=0-paradigm=5806-acceptability=1","Those cashiers are not saying that the grocery stores might resemble the hair.","trial",4,"experiment=NPI-env=determiner_negation_biclausal-npi=either-crucial_item=no-licensor=1-scope=0-npi_present=1-paradigm=4288-acceptability=0","The doctors have explained either that no waiters had passed the high schools.","trial",19,"experiment=NPI-env=questions-npi=yet-crucial_item=whether-licensor=1-scope=1-npi_present=1-paradigm=2543-acceptability=1","The girls have wondered whether the patients have referenced waiters yet.","trial",3,"experiment=NPI-env=superlative-npi=either-crucial_item=popular-licensor=0-scope=1-npi_present=1-paradigm=5396-acceptability=0","A teacher who disliked the popular pedestrian either ran around museums.","trial",10,"experiment=NPI-env=determiner_negation_biclausal-npi=ever-crucial_item=none of the-licensor=1-scope=1-npi_present=0-paradigm=480-acceptability=1","None of the gals might often think that the gloves would resemble the grocery store.","trial",21,"attention_check_item_6-acceptability=1","Show that you are paying attention by choosing the highest number on the scale.","trial",11,"experiment=NPI-env=sentential_negation_biclausal-npi=ever-crucial_item=really-licensor=0-scope=1-npi_present=0-paradigm=714-acceptability=1","The waiter has really also imagined that the cars do resemble a book.","trial",9,"experiment=NPI-env=conditional-npi=inyears-crucial_item=while-licensor=0-scope=0-npi_present=0-paradigm=4896-acceptability=1","While the teachers have known the girls, the cashier will wear the shoes regularly.","trial",6,"experiment=NPI-env=only-npi=inyears-crucial_item=even-licensor=0-scope=0-npi_present=0-paradigm=4731-acceptability=1","The men watched actresses as well even at the school.","trial",12,"experiment=NPI-env=quantifier-npi=ever-crucial_item=a lot of-licensor=0-scope=1-npi_present=1-paradigm=1514-acceptability=0","A lot of adults who have ever boycotted public parks can drop by many museums.","trial",17,"experiment=NPI-env=only-npi=yet-crucial_item=only-licensor=1-scope=0-npi_present=0-paradigm=3538-acceptability=1","A boy is worrying regularly only at the cafe.","trial",22,"attention_check_item_2-acceptability=0","Select two for this answer to show that you are being attentive.","trial",14,"experiment=NPI-env=quantifier-npi=atall-crucial_item=any-licensor=1-scope=0-npi_present=1-paradigm=3423-acceptability=0","Any students who did run around the movie theaters discussed a lot of girls at all.","trial",8,"experiment=NPI-env=simplequestions-npi=either-crucial_item=?-licensor=0-scope=1-npi_present=1-paradigm=5836-acceptability=0","The ladies were admiring the men either.","trial",18,"experiment=NPI-env=only-npi=atall-crucial_item=only-licensor=1-scope=1-npi_present=0-paradigm=2586-acceptability=1","Only the guest can buy forks as well at the grocery store.","trial",20,"experiment=NPI-env=conditional-npi=either-crucial_item=while-licensor=0-scope=0-npi_present=0-paradigm=5253-acceptability=1","While the girl likes the ladies, the customer will escape from the malls on occasion.","trial",13,"experiment=NPI-env=adverbs-npi=ever-crucial_item=seldom-licensor=1-scope=1-npi_present=0-paradigm=309-acceptability=1","The actors seldom also imagine that the girls had lifted the cars.","trial",16,"experiment=NPI-env=questions-npi=atall-crucial_item=whether-licensor=1-scope=1-npi_present=1-paradigm=3009-acceptability=1","The dancers have wondered whether the girl should walk through grocery stores at all.","trial",1,"experiment=NPI-env=adverbs-npi=inyears-crucial_item=rarely-licensor=1-scope=0-npi_present=0-paradigm=3865-acceptability=1","The patient who had rarely changed has worried as well.","trial",7,"experiment=NPI-env=simplequestions-npi=ever-crucial_item=?-licensor=1-scope=1-npi_present=0-paradigm=301-acceptability=1","Were the senators clearly talking about the guys?","trial",2,"experiment=NPI-env=superlative-npi=inyears-crucial_item=fast-licensor=0-scope=0-npi_present=1-paradigm=4989-acceptability=0","A person who described the fast adults has boycotted museums in years."
19,"trial",22,"attention_check_item_2-acceptability=0","Select two for this answer to show that you are being attentive.","trial",15,"experiment=NPI-env=sentential_negation_biclausal-npi=any-crucial_item=not-licensor=1-scope=1-npi_present=0-paradigm=5806-acceptability=1","Those cashiers are not saying that the grocery stores might resemble the hair.","trial",13,"experiment=NPI-env=adverbs-npi=ever-crucial_item=seldom-licensor=1-scope=1-npi_present=0-paradigm=309-acceptability=1","The actors seldom also imagine that the girls had lifted the cars.","trial",19,"experiment=NPI-env=questions-npi=yet-crucial_item=whether-licensor=1-scope=1-npi_present=1-paradigm=2543-acceptability=1","The girls have wondered whether the patients have referenced waiters yet.","trial",5,"experiment=NPI-env=questions-npi=either-crucial_item=whether-licensor=0-scope=1-npi_present=0-paradigm=5312-acceptability=1","The men have said that the student has escaped from the banks on weekends.","trial",11,"experiment=NPI-env=sentential_negation_biclausal-npi=ever-crucial_item=really-licensor=0-scope=1-npi_present=0-paradigm=714-acceptability=1","The waiter has really also imagined that the cars do resemble a book.","trial",21,"attention_check_item_6-acceptability=1","Show that you are paying attention by choosing the highest number on the scale.","trial",4,"experiment=NPI-env=determiner_negation_biclausal-npi=either-crucial_item=no-licensor=1-scope=0-npi_present=1-paradigm=4288-acceptability=0","The doctors have explained either that no waiters had passed the high schools.","trial",6,"experiment=NPI-env=only-npi=inyears-crucial_item=even-licensor=0-scope=0-npi_present=0-paradigm=4731-acceptability=1","The men watched actresses as well even at the school.","trial",12,"experiment=NPI-env=quantifier-npi=ever-crucial_item=a lot of-licensor=0-scope=1-npi_present=1-paradigm=1514-acceptability=0","A lot of adults who have ever boycotted public parks can drop by many museums.","trial",10,"experiment=NPI-env=determiner_negation_biclausal-npi=ever-crucial_item=none of the-licensor=1-scope=1-npi_present=0-paradigm=480-acceptability=1","None of the gals might often think that the gloves would resemble the grocery store.","trial",20,"experiment=NPI-env=conditional-npi=either-crucial_item=while-licensor=0-scope=0-npi_present=0-paradigm=5253-acceptability=1","While the girl likes the ladies, the customer will escape from the malls on occasion.","trial",1,"experiment=NPI-env=adverbs-npi=inyears-crucial_item=rarely-licensor=1-scope=0-npi_present=0-paradigm=3865-acceptability=1","The patient who had rarely changed has worried as well.","trial",16,"experiment=NPI-env=questions-npi=atall-crucial_item=whether-licensor=1-scope=1-npi_present=1-paradigm=3009-acceptability=1","The dancers have wondered whether the girl should walk through grocery stores at all.","trial",3,"experiment=NPI-env=superlative-npi=either-crucial_item=popular-licensor=0-scope=1-npi_present=1-paradigm=5396-acceptability=0","A teacher who disliked the popular pedestrian either ran around museums.","trial",18,"experiment=NPI-env=only-npi=atall-crucial_item=only-licensor=1-scope=1-npi_present=0-paradigm=2586-acceptability=1","Only the guest can buy forks as well at the grocery store.","trial",17,"experiment=NPI-env=only-npi=yet-crucial_item=only-licensor=1-scope=0-npi_present=0-paradigm=3538-acceptability=1","A boy is worrying regularly only at the cafe.","trial",9,"experiment=NPI-env=conditional-npi=inyears-crucial_item=while-licensor=0-scope=0-npi_present=0-paradigm=4896-acceptability=1","While the teachers have known the girls, the cashier will wear the shoes regularly.","trial",8,"experiment=NPI-env=simplequestions-npi=either-crucial_item=?-licensor=0-scope=1-npi_present=1-paradigm=5836-acceptability=0","The ladies were admiring the men either.","trial",7,"experiment=NPI-env=simplequestions-npi=ever-crucial_item=?-licensor=1-scope=1-npi_present=0-paradigm=301-acceptability=1","Were the senators clearly talking about the guys?","trial",2,"experiment=NPI-env=superlative-npi=inyears-crucial_item=fast-licensor=0-scope=0-npi_present=1-paradigm=4989-acceptability=0","A person who described the fast adults has boycotted museums in years.","trial",14,"experiment=NPI-env=quantifier-npi=atall-crucial_item=any-licensor=1-scope=0-npi_present=1-paradigm=3423-acceptability=0","Any students who did run around the movie theaters discussed a lot of girls at all."
