"list","item_1_section","item_1_number","item_1_condition","field_1_1","item_2_section","item_2_number","item_2_condition","field_2_1","item_3_section","item_3_number","item_3_condition","field_3_1","item_4_section","item_4_number","item_4_condition","field_4_1","item_5_section","item_5_number","item_5_condition","field_5_1","item_6_section","item_6_number","item_6_condition","field_6_1","item_7_section","item_7_number","item_7_condition","field_7_1","item_8_section","item_8_number","item_8_condition","field_8_1","item_9_section","item_9_number","item_9_condition","field_9_1","item_10_section","item_10_number","item_10_condition","field_10_1","item_11_section","item_11_number","item_11_condition","field_11_1","item_12_section","item_12_number","item_12_condition","field_12_1","item_13_section","item_13_number","item_13_condition","field_13_1","item_14_section","item_14_number","item_14_condition","field_14_1","item_15_section","item_15_number","item_15_condition","field_15_1","item_16_section","item_16_number","item_16_condition","field_16_1","item_17_section","item_17_number","item_17_condition","field_17_1","item_18_section","item_18_number","item_18_condition","field_18_1","item_19_section","item_19_number","item_19_condition","field_19_1","item_20_section","item_20_number","item_20_condition","field_20_1","item_21_section","item_21_number","item_21_condition","field_21_1","item_22_section","item_22_number","item_22_condition","field_22_1"
0,"trial",3,"experiment=NPI-env=adverbs-npi=atall-crucial_item=sometimes-licensor=0-scope=0-npi_present=1-paradigm=2057-acceptability=0","The children who can sometimes approach students won at all.","trial",11,"experiment=NPI-env=conditional-npi=any-crucial_item=while-licensor=0-scope=0-npi_present=1-paradigm=1201-acceptability=0","While the senator exits the banks, the students will dislike any college campuses.","trial",12,"experiment=NPI-env=only-npi=atall-crucial_item=even-licensor=0-scope=1-npi_present=1-paradigm=2997-acceptability=0","Even a customer was arriving at hospitals at all at the hospital.","trial",21,"attention_check_item_6-acceptability=1","Show that you are paying attention by choosing the highest number on the scale.","trial",18,"experiment=NPI-env=sentential_negation_biclausal-npi=either-crucial_item=not-licensor=1-scope=1-npi_present=1-paradigm=4261-acceptability=1","The girls had not explained that an essay was winning either.","trial",6,"experiment=NPI-env=questions-npi=ever-crucial_item=whether-licensor=0-scope=1-npi_present=0-paradigm=778-acceptability=1","The people say that the senator fortunately knew the senators.","trial",20,"experiment=NPI-env=sentential_negation_biclausal-npi=at all-crucial_item=not-licensor=1-scope=1-npi_present=0-paradigm=2783-acceptability=1","The actor was not imagining that the senators had cried regularly.","trial",16,"experiment=NPI-env=quantifier-npi=either-crucial_item=any-licensor=1-scope=0-npi_present=1-paradigm=5471-acceptability=0","Any guys who lifted a lot of reports were discussing some malls either.","trial",14,"experiment=NPI-env=adverbs-npi=any-crucial_item=seldom-licensor=1-scope=1-npi_present=0-paradigm=1272-acceptability=1","A customer who seldom returned to the actors remembers newspaper articles.","trial",19,"experiment=NPI-env=quantifier-npi=inyears-crucial_item=some-licensor=0-scope=0-npi_present=0-paradigm=4726-acceptability=1","Some customer who had been at the schools went to many museums on weekends.","trial",4,"experiment=NPI-env=superlative-npi=ever-crucial_item=best-licensor=1-scope=1-npi_present=1-paradigm=970-acceptability=1","The people can drop by the best museums that the teacher has ever remembered.","trial",22,"attention_check_item_2-acceptability=0","Select two for this answer to show that you are being attentive.","trial",7,"experiment=NPI-env=determiner_negation_biclausal-npi=ever-crucial_item=some-licensor=0-scope=1-npi_present=1-paradigm=643-acceptability=0","Some patients can ever explain that the doctors knew the adults.","trial",15,"experiment=NPI-env=questions-npi=yet-crucial_item=whether-licensor=1-scope=0-npi_present=0-paradigm=2683-acceptability=1","The teenagers have wondered on weekends whether the students are working with ladies.","trial",10,"experiment=NPI-env=questions-npi=any-crucial_item=whether-licensor=0-scope=1-npi_present=1-paradigm=1883-acceptability=0","The customers say that the senators discuss any reports.","trial",8,"experiment=NPI-env=superlative-npi=inyears-crucial_item=most serious-licensor=1-scope=1-npi_present=0-paradigm=4296-acceptability=1","The cashiers who described the most serious child for a while will boycott grocery stores.","trial",5,"experiment=NPI-env=adverbs-npi=ever-crucial_item=sometimes-licensor=0-scope=0-npi_present=1-paradigm=573-acceptability=0","The teachers ever think that the boy could sometimes return to the people.","trial",13,"experiment=NPI-env=quantifier-npi=atall-crucial_item=a lot of-licensor=0-scope=1-npi_present=1-paradigm=3497-acceptability=0","A lot of actors who cleaned more than three reports at all have explored the hospitals.","trial",2,"experiment=NPI-env=conditional-npi=atall-crucial_item=while-licensor=0-scope=0-npi_present=1-paradigm=3602-acceptability=0","While the doctors insult the schools, the drivers will remember the dancers at all.","trial",17,"experiment=NPI-env=determiner_negation_biclausal-npi=in years-crucial_item=none of the-licensor=1-scope=0-npi_present=1-paradigm=3768-acceptability=0","A woman explained in years that no teenagers have won.","trial",1,"experiment=NPI-env=adverbs-npi=inyears-crucial_item=rarely-licensor=1-scope=1-npi_present=0-paradigm=3590-acceptability=1","The girls who rarely chatted regularly have interacted.","trial",9,"experiment=NPI-env=only-npi=yet-crucial_item=only-licensor=1-scope=1-npi_present=0-paradigm=3982-acceptability=1","Only the customers attack adults on occasion at the high school."
1,"trial",15,"experiment=NPI-env=questions-npi=yet-crucial_item=whether-licensor=1-scope=0-npi_present=0-paradigm=2683-acceptability=1","The teenagers have wondered on weekends whether the students are working with ladies.","trial",7,"experiment=NPI-env=determiner_negation_biclausal-npi=ever-crucial_item=some-licensor=0-scope=1-npi_present=1-paradigm=643-acceptability=0","Some patients can ever explain that the doctors knew the adults.","trial",1,"experiment=NPI-env=adverbs-npi=inyears-crucial_item=rarely-licensor=1-scope=1-npi_present=0-paradigm=3590-acceptability=1","The girls who rarely chatted regularly have interacted.","trial",2,"experiment=NPI-env=conditional-npi=atall-crucial_item=while-licensor=0-scope=0-npi_present=1-paradigm=3602-acceptability=0","While the doctors insult the schools, the drivers will remember the dancers at all.","trial",13,"experiment=NPI-env=quantifier-npi=atall-crucial_item=a lot of-licensor=0-scope=1-npi_present=1-paradigm=3497-acceptability=0","A lot of actors who cleaned more than three reports at all have explored the hospitals.","trial",12,"experiment=NPI-env=only-npi=atall-crucial_item=even-licensor=0-scope=1-npi_present=1-paradigm=2997-acceptability=0","Even a customer was arriving at hospitals at all at the hospital.","trial",6,"experiment=NPI-env=questions-npi=ever-crucial_item=whether-licensor=0-scope=1-npi_present=0-paradigm=778-acceptability=1","The people say that the senator fortunately knew the senators.","trial",3,"experiment=NPI-env=adverbs-npi=atall-crucial_item=sometimes-licensor=0-scope=0-npi_present=1-paradigm=2057-acceptability=0","The children who can sometimes approach students won at all.","trial",11,"experiment=NPI-env=conditional-npi=any-crucial_item=while-licensor=0-scope=0-npi_present=1-paradigm=1201-acceptability=0","While the senator exits the banks, the students will dislike any college campuses.","trial",14,"experiment=NPI-env=adverbs-npi=any-crucial_item=seldom-licensor=1-scope=1-npi_present=0-paradigm=1272-acceptability=1","A customer who seldom returned to the actors remembers newspaper articles.","trial",19,"experiment=NPI-env=quantifier-npi=inyears-crucial_item=some-licensor=0-scope=0-npi_present=0-paradigm=4726-acceptability=1","Some customer who had been at the schools went to many museums on weekends.","trial",9,"experiment=NPI-env=only-npi=yet-crucial_item=only-licensor=1-scope=1-npi_present=0-paradigm=3982-acceptability=1","Only the customers attack adults on occasion at the high school.","trial",10,"experiment=NPI-env=questions-npi=any-crucial_item=whether-licensor=0-scope=1-npi_present=1-paradigm=1883-acceptability=0","The customers say that the senators discuss any reports.","trial",20,"experiment=NPI-env=sentential_negation_biclausal-npi=at all-crucial_item=not-licensor=1-scope=1-npi_present=0-paradigm=2783-acceptability=1","The actor was not imagining that the senators had cried regularly.","trial",5,"experiment=NPI-env=adverbs-npi=ever-crucial_item=sometimes-licensor=0-scope=0-npi_present=1-paradigm=573-acceptability=0","The teachers ever think that the boy could sometimes return to the people.","trial",8,"experiment=NPI-env=superlative-npi=inyears-crucial_item=most serious-licensor=1-scope=1-npi_present=0-paradigm=4296-acceptability=1","The cashiers who described the most serious child for a while will boycott grocery stores.","trial",4,"experiment=NPI-env=superlative-npi=ever-crucial_item=best-licensor=1-scope=1-npi_present=1-paradigm=970-acceptability=1","The people can drop by the best museums that the teacher has ever remembered.","trial",21,"attention_check_item_6-acceptability=1","Show that you are paying attention by choosing the highest number on the scale.","trial",16,"experiment=NPI-env=quantifier-npi=either-crucial_item=any-licensor=1-scope=0-npi_present=1-paradigm=5471-acceptability=0","Any guys who lifted a lot of reports were discussing some malls either.","trial",18,"experiment=NPI-env=sentential_negation_biclausal-npi=either-crucial_item=not-licensor=1-scope=1-npi_present=1-paradigm=4261-acceptability=1","The girls had not explained that an essay was winning either.","trial",17,"experiment=NPI-env=determiner_negation_biclausal-npi=in years-crucial_item=none of the-licensor=1-scope=0-npi_present=1-paradigm=3768-acceptability=0","A woman explained in years that no teenagers have won.","trial",22,"attention_check_item_2-acceptability=0","Select two for this answer to show that you are being attentive."
2,"trial",18,"experiment=NPI-env=sentential_negation_biclausal-npi=either-crucial_item=not-licensor=1-scope=1-npi_present=1-paradigm=4261-acceptability=1","The girls had not explained that an essay was winning either.","trial",9,"experiment=NPI-env=only-npi=yet-crucial_item=only-licensor=1-scope=1-npi_present=0-paradigm=3982-acceptability=1","Only the customers attack adults on occasion at the high school.","trial",15,"experiment=NPI-env=questions-npi=yet-crucial_item=whether-licensor=1-scope=0-npi_present=0-paradigm=2683-acceptability=1","The teenagers have wondered on weekends whether the students are working with ladies.","trial",11,"experiment=NPI-env=conditional-npi=any-crucial_item=while-licensor=0-scope=0-npi_present=1-paradigm=1201-acceptability=0","While the senator exits the banks, the students will dislike any college campuses.","trial",13,"experiment=NPI-env=quantifier-npi=atall-crucial_item=a lot of-licensor=0-scope=1-npi_present=1-paradigm=3497-acceptability=0","A lot of actors who cleaned more than three reports at all have explored the hospitals.","trial",12,"experiment=NPI-env=only-npi=atall-crucial_item=even-licensor=0-scope=1-npi_present=1-paradigm=2997-acceptability=0","Even a customer was arriving at hospitals at all at the hospital.","trial",3,"experiment=NPI-env=adverbs-npi=atall-crucial_item=sometimes-licensor=0-scope=0-npi_present=1-paradigm=2057-acceptability=0","The children who can sometimes approach students won at all.","trial",21,"attention_check_item_6-acceptability=1","Show that you are paying attention by choosing the highest number on the scale.","trial",19,"experiment=NPI-env=quantifier-npi=inyears-crucial_item=some-licensor=0-scope=0-npi_present=0-paradigm=4726-acceptability=1","Some customer who had been at the schools went to many museums on weekends.","trial",5,"experiment=NPI-env=adverbs-npi=ever-crucial_item=sometimes-licensor=0-scope=0-npi_present=1-paradigm=573-acceptability=0","The teachers ever think that the boy could sometimes return to the people.","trial",22,"attention_check_item_2-acceptability=0","Select two for this answer to show that you are being attentive.","trial",16,"experiment=NPI-env=quantifier-npi=either-crucial_item=any-licensor=1-scope=0-npi_present=1-paradigm=5471-acceptability=0","Any guys who lifted a lot of reports were discussing some malls either.","trial",17,"experiment=NPI-env=determiner_negation_biclausal-npi=in years-crucial_item=none of the-licensor=1-scope=0-npi_present=1-paradigm=3768-acceptability=0","A woman explained in years that no teenagers have won.","trial",4,"experiment=NPI-env=superlative-npi=ever-crucial_item=best-licensor=1-scope=1-npi_present=1-paradigm=970-acceptability=1","The people can drop by the best museums that the teacher has ever remembered.","trial",8,"experiment=NPI-env=superlative-npi=inyears-crucial_item=most serious-licensor=1-scope=1-npi_present=0-paradigm=4296-acceptability=1","The cashiers who described the most serious child for a while will boycott grocery stores.","trial",1,"experiment=NPI-env=adverbs-npi=inyears-crucial_item=rarely-licensor=1-scope=1-npi_present=0-paradigm=3590-acceptability=1","The girls who rarely chatted regularly have interacted.","trial",6,"experiment=NPI-env=questions-npi=ever-crucial_item=whether-licensor=0-scope=1-npi_present=0-paradigm=778-acceptability=1","The people say that the senator fortunately knew the senators.","trial",10,"experiment=NPI-env=questions-npi=any-crucial_item=whether-licensor=0-scope=1-npi_present=1-paradigm=1883-acceptability=0","The customers say that the senators discuss any reports.","trial",20,"experiment=NPI-env=sentential_negation_biclausal-npi=at all-crucial_item=not-licensor=1-scope=1-npi_present=0-paradigm=2783-acceptability=1","The actor was not imagining that the senators had cried regularly.","trial",2,"experiment=NPI-env=conditional-npi=atall-crucial_item=while-licensor=0-scope=0-npi_present=1-paradigm=3602-acceptability=0","While the doctors insult the schools, the drivers will remember the dancers at all.","trial",14,"experiment=NPI-env=adverbs-npi=any-crucial_item=seldom-licensor=1-scope=1-npi_present=0-paradigm=1272-acceptability=1","A customer who seldom returned to the actors remembers newspaper articles.","trial",7,"experiment=NPI-env=determiner_negation_biclausal-npi=ever-crucial_item=some-licensor=0-scope=1-npi_present=1-paradigm=643-acceptability=0","Some patients can ever explain that the doctors knew the adults."
3,"trial",14,"experiment=NPI-env=adverbs-npi=any-crucial_item=seldom-licensor=1-scope=1-npi_present=0-paradigm=1272-acceptability=1","A customer who seldom returned to the actors remembers newspaper articles.","trial",8,"experiment=NPI-env=superlative-npi=inyears-crucial_item=most serious-licensor=1-scope=1-npi_present=0-paradigm=4296-acceptability=1","The cashiers who described the most serious child for a while will boycott grocery stores.","trial",16,"experiment=NPI-env=quantifier-npi=either-crucial_item=any-licensor=1-scope=0-npi_present=1-paradigm=5471-acceptability=0","Any guys who lifted a lot of reports were discussing some malls either.","trial",18,"experiment=NPI-env=sentential_negation_biclausal-npi=either-crucial_item=not-licensor=1-scope=1-npi_present=1-paradigm=4261-acceptability=1","The girls had not explained that an essay was winning either.","trial",7,"experiment=NPI-env=determiner_negation_biclausal-npi=ever-crucial_item=some-licensor=0-scope=1-npi_present=1-paradigm=643-acceptability=0","Some patients can ever explain that the doctors knew the adults.","trial",6,"experiment=NPI-env=questions-npi=ever-crucial_item=whether-licensor=0-scope=1-npi_present=0-paradigm=778-acceptability=1","The people say that the senator fortunately knew the senators.","trial",17,"experiment=NPI-env=determiner_negation_biclausal-npi=in years-crucial_item=none of the-licensor=1-scope=0-npi_present=1-paradigm=3768-acceptability=0","A woman explained in years that no teenagers have won.","trial",21,"attention_check_item_6-acceptability=1","Show that you are paying attention by choosing the highest number on the scale.","trial",15,"experiment=NPI-env=questions-npi=yet-crucial_item=whether-licensor=1-scope=0-npi_present=0-paradigm=2683-acceptability=1","The teenagers have wondered on weekends whether the students are working with ladies.","trial",1,"experiment=NPI-env=adverbs-npi=inyears-crucial_item=rarely-licensor=1-scope=1-npi_present=0-paradigm=3590-acceptability=1","The girls who rarely chatted regularly have interacted.","trial",13,"experiment=NPI-env=quantifier-npi=atall-crucial_item=a lot of-licensor=0-scope=1-npi_present=1-paradigm=3497-acceptability=0","A lot of actors who cleaned more than three reports at all have explored the hospitals.","trial",10,"experiment=NPI-env=questions-npi=any-crucial_item=whether-licensor=0-scope=1-npi_present=1-paradigm=1883-acceptability=0","The customers say that the senators discuss any reports.","trial",4,"experiment=NPI-env=superlative-npi=ever-crucial_item=best-licensor=1-scope=1-npi_present=1-paradigm=970-acceptability=1","The people can drop by the best museums that the teacher has ever remembered.","trial",12,"experiment=NPI-env=only-npi=atall-crucial_item=even-licensor=0-scope=1-npi_present=1-paradigm=2997-acceptability=0","Even a customer was arriving at hospitals at all at the hospital.","trial",11,"experiment=NPI-env=conditional-npi=any-crucial_item=while-licensor=0-scope=0-npi_present=1-paradigm=1201-acceptability=0","While the senator exits the banks, the students will dislike any college campuses.","trial",3,"experiment=NPI-env=adverbs-npi=atall-crucial_item=sometimes-licensor=0-scope=0-npi_present=1-paradigm=2057-acceptability=0","The children who can sometimes approach students won at all.","trial",22,"attention_check_item_2-acceptability=0","Select two for this answer to show that you are being attentive.","trial",19,"experiment=NPI-env=quantifier-npi=inyears-crucial_item=some-licensor=0-scope=0-npi_present=0-paradigm=4726-acceptability=1","Some customer who had been at the schools went to many museums on weekends.","trial",9,"experiment=NPI-env=only-npi=yet-crucial_item=only-licensor=1-scope=1-npi_present=0-paradigm=3982-acceptability=1","Only the customers attack adults on occasion at the high school.","trial",2,"experiment=NPI-env=conditional-npi=atall-crucial_item=while-licensor=0-scope=0-npi_present=1-paradigm=3602-acceptability=0","While the doctors insult the schools, the drivers will remember the dancers at all.","trial",5,"experiment=NPI-env=adverbs-npi=ever-crucial_item=sometimes-licensor=0-scope=0-npi_present=1-paradigm=573-acceptability=0","The teachers ever think that the boy could sometimes return to the people.","trial",20,"experiment=NPI-env=sentential_negation_biclausal-npi=at all-crucial_item=not-licensor=1-scope=1-npi_present=0-paradigm=2783-acceptability=1","The actor was not imagining that the senators had cried regularly."
4,"trial",10,"experiment=NPI-env=questions-npi=any-crucial_item=whether-licensor=0-scope=1-npi_present=1-paradigm=1883-acceptability=0","The customers say that the senators discuss any reports.","trial",16,"experiment=NPI-env=quantifier-npi=either-crucial_item=any-licensor=1-scope=0-npi_present=1-paradigm=5471-acceptability=0","Any guys who lifted a lot of reports were discussing some malls either.","trial",11,"experiment=NPI-env=conditional-npi=any-crucial_item=while-licensor=0-scope=0-npi_present=1-paradigm=1201-acceptability=0","While the senator exits the banks, the students will dislike any college campuses.","trial",5,"experiment=NPI-env=adverbs-npi=ever-crucial_item=sometimes-licensor=0-scope=0-npi_present=1-paradigm=573-acceptability=0","The teachers ever think that the boy could sometimes return to the people.","trial",22,"attention_check_item_2-acceptability=0","Select two for this answer to show that you are being attentive.","trial",20,"experiment=NPI-env=sentential_negation_biclausal-npi=at all-crucial_item=not-licensor=1-scope=1-npi_present=0-paradigm=2783-acceptability=1","The actor was not imagining that the senators had cried regularly.","trial",4,"experiment=NPI-env=superlative-npi=ever-crucial_item=best-licensor=1-scope=1-npi_present=1-paradigm=970-acceptability=1","The people can drop by the best museums that the teacher has ever remembered.","trial",12,"experiment=NPI-env=only-npi=atall-crucial_item=even-licensor=0-scope=1-npi_present=1-paradigm=2997-acceptability=0","Even a customer was arriving at hospitals at all at the hospital.","trial",17,"experiment=NPI-env=determiner_negation_biclausal-npi=in years-crucial_item=none of the-licensor=1-scope=0-npi_present=1-paradigm=3768-acceptability=0","A woman explained in years that no teenagers have won.","trial",18,"experiment=NPI-env=sentential_negation_biclausal-npi=either-crucial_item=not-licensor=1-scope=1-npi_present=1-paradigm=4261-acceptability=1","The girls had not explained that an essay was winning either.","trial",9,"experiment=NPI-env=only-npi=yet-crucial_item=only-licensor=1-scope=1-npi_present=0-paradigm=3982-acceptability=1","Only the customers attack adults on occasion at the high school.","trial",14,"experiment=NPI-env=adverbs-npi=any-crucial_item=seldom-licensor=1-scope=1-npi_present=0-paradigm=1272-acceptability=1","A customer who seldom returned to the actors remembers newspaper articles.","trial",2,"experiment=NPI-env=conditional-npi=atall-crucial_item=while-licensor=0-scope=0-npi_present=1-paradigm=3602-acceptability=0","While the doctors insult the schools, the drivers will remember the dancers at all.","trial",7,"experiment=NPI-env=determiner_negation_biclausal-npi=ever-crucial_item=some-licensor=0-scope=1-npi_present=1-paradigm=643-acceptability=0","Some patients can ever explain that the doctors knew the adults.","trial",15,"experiment=NPI-env=questions-npi=yet-crucial_item=whether-licensor=1-scope=0-npi_present=0-paradigm=2683-acceptability=1","The teenagers have wondered on weekends whether the students are working with ladies.","trial",6,"experiment=NPI-env=questions-npi=ever-crucial_item=whether-licensor=0-scope=1-npi_present=0-paradigm=778-acceptability=1","The people say that the senator fortunately knew the senators.","trial",1,"experiment=NPI-env=adverbs-npi=inyears-crucial_item=rarely-licensor=1-scope=1-npi_present=0-paradigm=3590-acceptability=1","The girls who rarely chatted regularly have interacted.","trial",3,"experiment=NPI-env=adverbs-npi=atall-crucial_item=sometimes-licensor=0-scope=0-npi_present=1-paradigm=2057-acceptability=0","The children who can sometimes approach students won at all.","trial",8,"experiment=NPI-env=superlative-npi=inyears-crucial_item=most serious-licensor=1-scope=1-npi_present=0-paradigm=4296-acceptability=1","The cashiers who described the most serious child for a while will boycott grocery stores.","trial",19,"experiment=NPI-env=quantifier-npi=inyears-crucial_item=some-licensor=0-scope=0-npi_present=0-paradigm=4726-acceptability=1","Some customer who had been at the schools went to many museums on weekends.","trial",13,"experiment=NPI-env=quantifier-npi=atall-crucial_item=a lot of-licensor=0-scope=1-npi_present=1-paradigm=3497-acceptability=0","A lot of actors who cleaned more than three reports at all have explored the hospitals.","trial",21,"attention_check_item_6-acceptability=1","Show that you are paying attention by choosing the highest number on the scale."
