15,"trial",1,"experiment=NPI-env=adverbs-npi=inyears-crucial_item=rarely-licensor=1-scope=1-npi_present=0-paradigm=3590-acceptability=1","The girls who rarely chatted regularly have interacted.","trial",5,"experiment=NPI-env=adverbs-npi=ever-crucial_item=sometimes-licensor=0-scope=0-npi_present=1-paradigm=573-acceptability=0","The teachers ever think that the boy could sometimes return to the people.","trial",15,"experiment=NPI-env=questions-npi=yet-crucial_item=whether-licensor=1-scope=0-npi_present=0-paradigm=2683-acceptability=1","The teenagers have wondered on weekends whether the students are working with ladies.","trial",16,"experiment=NPI-env=quantifier-npi=either-crucial_item=any-licensor=1-scope=0-npi_present=1-paradigm=5471-acceptability=0","Any guys who lifted a lot of reports were discussing some malls either.","trial",19,"experiment=NPI-env=quantifier-npi=inyears-crucial_item=some-licensor=0-scope=0-npi_present=0-paradigm=4726-acceptability=1","Some customer who had been at the schools went to many museums on weekends.","trial",20,"experiment=NPI-env=sentential_negation_biclausal-npi=at all-crucial_item=not-licensor=1-scope=1-npi_present=0-paradigm=2783-acceptability=1","The actor was not imagining that the senators had cried regularly.","trial",8,"experiment=NPI-env=superlative-npi=inyears-crucial_item=most serious-licensor=1-scope=1-npi_present=0-paradigm=4296-acceptability=1","The cashiers who described the most serious child for a while will boycott grocery stores.","trial",12,"experiment=NPI-env=only-npi=atall-crucial_item=even-licensor=0-scope=1-npi_present=1-paradigm=2997-acceptability=0","Even a customer was arriving at hospitals at all at the hospital.","trial",7,"experiment=NPI-env=determiner_negation_biclausal-npi=ever-crucial_item=some-licensor=0-scope=1-npi_present=1-paradigm=643-acceptability=0","Some patients can ever explain that the doctors knew the adults.","trial",10,"experiment=NPI-env=questions-npi=any-crucial_item=whether-licensor=0-scope=1-npi_present=1-paradigm=1883-acceptability=0","The customers say that the senators discuss any reports.","trial",4,"experiment=NPI-env=superlative-npi=ever-crucial_item=best-licensor=1-scope=1-npi_present=1-paradigm=970-acceptability=1","The people can drop by the best museums that the teacher has ever remembered.","trial",9,"experiment=NPI-env=only-npi=yet-crucial_item=only-licensor=1-scope=1-npi_present=0-paradigm=3982-acceptability=1","Only the customers attack adults on occasion at the high school.","trial",6,"experiment=NPI-env=questions-npi=ever-crucial_item=whether-licensor=0-scope=1-npi_present=0-paradigm=778-acceptability=1","The people say that the senator fortunately knew the senators.","trial",17,"experiment=NPI-env=determiner_negation_biclausal-npi=in years-crucial_item=none of the-licensor=1-scope=0-npi_present=1-paradigm=3768-acceptability=0","A woman explained in years that no teenagers have won.","trial",13,"experiment=NPI-env=quantifier-npi=atall-crucial_item=a lot of-licensor=0-scope=1-npi_present=1-paradigm=3497-acceptability=0","A lot of actors who cleaned more than three reports at all have explored the hospitals.","trial",11,"experiment=NPI-env=conditional-npi=any-crucial_item=while-licensor=0-scope=0-npi_present=1-paradigm=1201-acceptability=0","While the senator exits the banks, the students will dislike any college campuses.","trial",14,"experiment=NPI-env=adverbs-npi=any-crucial_item=seldom-licensor=1-scope=1-npi_present=0-paradigm=1272-acceptability=1","A customer who seldom returned to the actors remembers newspaper articles.","trial",21,"attention_check_item_6-acceptability=1","Show that you are paying attention by choosing the highest number on the scale.","trial",18,"experiment=NPI-env=sentential_negation_biclausal-npi=either-crucial_item=not-licensor=1-scope=1-npi_present=1-paradigm=4261-acceptability=1","The girls had not explained that an essay was winning either.","trial",3,"experiment=NPI-env=adverbs-npi=atall-crucial_item=sometimes-licensor=0-scope=0-npi_present=1-paradigm=2057-acceptability=0","The children who can sometimes approach students won at all.","trial",2,"experiment=NPI-env=conditional-npi=atall-crucial_item=while-licensor=0-scope=0-npi_present=1-paradigm=3602-acceptability=0","While the doctors insult the schools, the drivers will remember the dancers at all.","trial",22,"attention_check_item_2-acceptability=0","Select two for this answer to show that you are being attentive."
16,"trial",18,"experiment=NPI-env=sentential_negation_biclausal-npi=either-crucial_item=not-licensor=1-scope=1-npi_present=1-paradigm=4261-acceptability=1","The girls had not explained that an essay was winning either.","trial",2,"experiment=NPI-env=conditional-npi=atall-crucial_item=while-licensor=0-scope=0-npi_present=1-paradigm=3602-acceptability=0","While the doctors insult the schools, the drivers will remember the dancers at all.","trial",8,"experiment=NPI-env=superlative-npi=inyears-crucial_item=most serious-licensor=1-scope=1-npi_present=0-paradigm=4296-acceptability=1","The cashiers who described the most serious child for a while will boycott grocery stores.","trial",7,"experiment=NPI-env=determiner_negation_biclausal-npi=ever-crucial_item=some-licensor=0-scope=1-npi_present=1-paradigm=643-acceptability=0","Some patients can ever explain that the doctors knew the adults.","trial",12,"experiment=NPI-env=only-npi=atall-crucial_item=even-licensor=0-scope=1-npi_present=1-paradigm=2997-acceptability=0","Even a customer was arriving at hospitals at all at the hospital.","trial",20,"experiment=NPI-env=sentential_negation_biclausal-npi=at all-crucial_item=not-licensor=1-scope=1-npi_present=0-paradigm=2783-acceptability=1","The actor was not imagining that the senators had cried regularly.","trial",6,"experiment=NPI-env=questions-npi=ever-crucial_item=whether-licensor=0-scope=1-npi_present=0-paradigm=778-acceptability=1","The people say that the senator fortunately knew the senators.","trial",4,"experiment=NPI-env=superlative-npi=ever-crucial_item=best-licensor=1-scope=1-npi_present=1-paradigm=970-acceptability=1","The people can drop by the best museums that the teacher has ever remembered.","trial",22,"attention_check_item_2-acceptability=0","Select two for this answer to show that you are being attentive.","trial",9,"experiment=NPI-env=only-npi=yet-crucial_item=only-licensor=1-scope=1-npi_present=0-paradigm=3982-acceptability=1","Only the customers attack adults on occasion at the high school.","trial",3,"experiment=NPI-env=adverbs-npi=atall-crucial_item=sometimes-licensor=0-scope=0-npi_present=1-paradigm=2057-acceptability=0","The children who can sometimes approach students won at all.","trial",17,"experiment=NPI-env=determiner_negation_biclausal-npi=in years-crucial_item=none of the-licensor=1-scope=0-npi_present=1-paradigm=3768-acceptability=0","A woman explained in years that no teenagers have won.","trial",16,"experiment=NPI-env=quantifier-npi=either-crucial_item=any-licensor=1-scope=0-npi_present=1-paradigm=5471-acceptability=0","Any guys who lifted a lot of reports were discussing some malls either.","trial",10,"experiment=NPI-env=questions-npi=any-crucial_item=whether-licensor=0-scope=1-npi_present=1-paradigm=1883-acceptability=0","The customers say that the senators discuss any reports.","trial",13,"experiment=NPI-env=quantifier-npi=atall-crucial_item=a lot of-licensor=0-scope=1-npi_present=1-paradigm=3497-acceptability=0","A lot of actors who cleaned more than three reports at all have explored the hospitals.","trial",11,"experiment=NPI-env=conditional-npi=any-crucial_item=while-licensor=0-scope=0-npi_present=1-paradigm=1201-acceptability=0","While the senator exits the banks, the students will dislike any college campuses.","trial",1,"experiment=NPI-env=adverbs-npi=inyears-crucial_item=rarely-licensor=1-scope=1-npi_present=0-paradigm=3590-acceptability=1","The girls who rarely chatted regularly have interacted.","trial",5,"experiment=NPI-env=adverbs-npi=ever-crucial_item=sometimes-licensor=0-scope=0-npi_present=1-paradigm=573-acceptability=0","The teachers ever think that the boy could sometimes return to the people.","trial",15,"experiment=NPI-env=questions-npi=yet-crucial_item=whether-licensor=1-scope=0-npi_present=0-paradigm=2683-acceptability=1","The teenagers have wondered on weekends whether the students are working with ladies.","trial",14,"experiment=NPI-env=adverbs-npi=any-crucial_item=seldom-licensor=1-scope=1-npi_present=0-paradigm=1272-acceptability=1","A customer who seldom returned to the actors remembers newspaper articles.","trial",21,"attention_check_item_6-acceptability=1","Show that you are paying attention by choosing the highest number on the scale.","trial",19,"experiment=NPI-env=quantifier-npi=inyears-crucial_item=some-licensor=0-scope=0-npi_present=0-paradigm=4726-acceptability=1","Some customer who had been at the schools went to many museums on weekends."
17,"trial",22,"attention_check_item_2-acceptability=0","Select two for this answer to show that you are being attentive.","trial",18,"experiment=NPI-env=sentential_negation_biclausal-npi=either-crucial_item=not-licensor=1-scope=1-npi_present=1-paradigm=4261-acceptability=1","The girls had not explained that an essay was winning either.","trial",1,"experiment=NPI-env=adverbs-npi=inyears-crucial_item=rarely-licensor=1-scope=1-npi_present=0-paradigm=3590-acceptability=1","The girls who rarely chatted regularly have interacted.","trial",13,"experiment=NPI-env=quantifier-npi=atall-crucial_item=a lot of-licensor=0-scope=1-npi_present=1-paradigm=3497-acceptability=0","A lot of actors who cleaned more than three reports at all have explored the hospitals.","trial",20,"experiment=NPI-env=sentential_negation_biclausal-npi=at all-crucial_item=not-licensor=1-scope=1-npi_present=0-paradigm=2783-acceptability=1","The actor was not imagining that the senators had cried regularly.","trial",9,"experiment=NPI-env=only-npi=yet-crucial_item=only-licensor=1-scope=1-npi_present=0-paradigm=3982-acceptability=1","Only the customers attack adults on occasion at the high school.","trial",16,"experiment=NPI-env=quantifier-npi=either-crucial_item=any-licensor=1-scope=0-npi_present=1-paradigm=5471-acceptability=0","Any guys who lifted a lot of reports were discussing some malls either.","trial",5,"experiment=NPI-env=adverbs-npi=ever-crucial_item=sometimes-licensor=0-scope=0-npi_present=1-paradigm=573-acceptability=0","The teachers ever think that the boy could sometimes return to the people.","trial",14,"experiment=NPI-env=adverbs-npi=any-crucial_item=seldom-licensor=1-scope=1-npi_present=0-paradigm=1272-acceptability=1","A customer who seldom returned to the actors remembers newspaper articles.","trial",17,"experiment=NPI-env=determiner_negation_biclausal-npi=in years-crucial_item=none of the-licensor=1-scope=0-npi_present=1-paradigm=3768-acceptability=0","A woman explained in years that no teenagers have won.","trial",2,"experiment=NPI-env=conditional-npi=atall-crucial_item=while-licensor=0-scope=0-npi_present=1-paradigm=3602-acceptability=0","While the doctors insult the schools, the drivers will remember the dancers at all.","trial",8,"experiment=NPI-env=superlative-npi=inyears-crucial_item=most serious-licensor=1-scope=1-npi_present=0-paradigm=4296-acceptability=1","The cashiers who described the most serious child for a while will boycott grocery stores.","trial",19,"experiment=NPI-env=quantifier-npi=inyears-crucial_item=some-licensor=0-scope=0-npi_present=0-paradigm=4726-acceptability=1","Some customer who had been at the schools went to many museums on weekends.","trial",15,"experiment=NPI-env=questions-npi=yet-crucial_item=whether-licensor=1-scope=0-npi_present=0-paradigm=2683-acceptability=1","The teenagers have wondered on weekends whether the students are working with ladies.","trial",4,"experiment=NPI-env=superlative-npi=ever-crucial_item=best-licensor=1-scope=1-npi_present=1-paradigm=970-acceptability=1","The people can drop by the best museums that the teacher has ever remembered.","trial",7,"experiment=NPI-env=determiner_negation_biclausal-npi=ever-crucial_item=some-licensor=0-scope=1-npi_present=1-paradigm=643-acceptability=0","Some patients can ever explain that the doctors knew the adults.","trial",6,"experiment=NPI-env=questions-npi=ever-crucial_item=whether-licensor=0-scope=1-npi_present=0-paradigm=778-acceptability=1","The people say that the senator fortunately knew the senators.","trial",11,"experiment=NPI-env=conditional-npi=any-crucial_item=while-licensor=0-scope=0-npi_present=1-paradigm=1201-acceptability=0","While the senator exits the banks, the students will dislike any college campuses.","trial",10,"experiment=NPI-env=questions-npi=any-crucial_item=whether-licensor=0-scope=1-npi_present=1-paradigm=1883-acceptability=0","The customers say that the senators discuss any reports.","trial",12,"experiment=NPI-env=only-npi=atall-crucial_item=even-licensor=0-scope=1-npi_present=1-paradigm=2997-acceptability=0","Even a customer was arriving at hospitals at all at the hospital.","trial",3,"experiment=NPI-env=adverbs-npi=atall-crucial_item=sometimes-licensor=0-scope=0-npi_present=1-paradigm=2057-acceptability=0","The children who can sometimes approach students won at all.","trial",21,"attention_check_item_6-acceptability=1","Show that you are paying attention by choosing the highest number on the scale."
18,"trial",9,"experiment=NPI-env=only-npi=yet-crucial_item=only-licensor=1-scope=1-npi_present=0-paradigm=3982-acceptability=1","Only the customers attack adults on occasion at the high school.","trial",15,"experiment=NPI-env=questions-npi=yet-crucial_item=whether-licensor=1-scope=0-npi_present=0-paradigm=2683-acceptability=1","The teenagers have wondered on weekends whether the students are working with ladies.","trial",21,"attention_check_item_6-acceptability=1","Show that you are paying attention by choosing the highest number on the scale.","trial",17,"experiment=NPI-env=determiner_negation_biclausal-npi=in years-crucial_item=none of the-licensor=1-scope=0-npi_present=1-paradigm=3768-acceptability=0","A woman explained in years that no teenagers have won.","trial",13,"experiment=NPI-env=quantifier-npi=atall-crucial_item=a lot of-licensor=0-scope=1-npi_present=1-paradigm=3497-acceptability=0","A lot of actors who cleaned more than three reports at all have explored the hospitals.","trial",11,"experiment=NPI-env=conditional-npi=any-crucial_item=while-licensor=0-scope=0-npi_present=1-paradigm=1201-acceptability=0","While the senator exits the banks, the students will dislike any college campuses.","trial",10,"experiment=NPI-env=questions-npi=any-crucial_item=whether-licensor=0-scope=1-npi_present=1-paradigm=1883-acceptability=0","The customers say that the senators discuss any reports.","trial",6,"experiment=NPI-env=questions-npi=ever-crucial_item=whether-licensor=0-scope=1-npi_present=0-paradigm=778-acceptability=1","The people say that the senator fortunately knew the senators.","trial",7,"experiment=NPI-env=determiner_negation_biclausal-npi=ever-crucial_item=some-licensor=0-scope=1-npi_present=1-paradigm=643-acceptability=0","Some patients can ever explain that the doctors knew the adults.","trial",20,"experiment=NPI-env=sentential_negation_biclausal-npi=at all-crucial_item=not-licensor=1-scope=1-npi_present=0-paradigm=2783-acceptability=1","The actor was not imagining that the senators had cried regularly.","trial",3,"experiment=NPI-env=adverbs-npi=atall-crucial_item=sometimes-licensor=0-scope=0-npi_present=1-paradigm=2057-acceptability=0","The children who can sometimes approach students won at all.","trial",12,"experiment=NPI-env=only-npi=atall-crucial_item=even-licensor=0-scope=1-npi_present=1-paradigm=2997-acceptability=0","Even a customer was arriving at hospitals at all at the hospital.","trial",18,"experiment=NPI-env=sentential_negation_biclausal-npi=either-crucial_item=not-licensor=1-scope=1-npi_present=1-paradigm=4261-acceptability=1","The girls had not explained that an essay was winning either.","trial",1,"experiment=NPI-env=adverbs-npi=inyears-crucial_item=rarely-licensor=1-scope=1-npi_present=0-paradigm=3590-acceptability=1","The girls who rarely chatted regularly have interacted.","trial",8,"experiment=NPI-env=superlative-npi=inyears-crucial_item=most serious-licensor=1-scope=1-npi_present=0-paradigm=4296-acceptability=1","The cashiers who described the most serious child for a while will boycott grocery stores.","trial",2,"experiment=NPI-env=conditional-npi=atall-crucial_item=while-licensor=0-scope=0-npi_present=1-paradigm=3602-acceptability=0","While the doctors insult the schools, the drivers will remember the dancers at all.","trial",16,"experiment=NPI-env=quantifier-npi=either-crucial_item=any-licensor=1-scope=0-npi_present=1-paradigm=5471-acceptability=0","Any guys who lifted a lot of reports were discussing some malls either.","trial",14,"experiment=NPI-env=adverbs-npi=any-crucial_item=seldom-licensor=1-scope=1-npi_present=0-paradigm=1272-acceptability=1","A customer who seldom returned to the actors remembers newspaper articles.","trial",4,"experiment=NPI-env=superlative-npi=ever-crucial_item=best-licensor=1-scope=1-npi_present=1-paradigm=970-acceptability=1","The people can drop by the best museums that the teacher has ever remembered.","trial",19,"experiment=NPI-env=quantifier-npi=inyears-crucial_item=some-licensor=0-scope=0-npi_present=0-paradigm=4726-acceptability=1","Some customer who had been at the schools went to many museums on weekends.","trial",5,"experiment=NPI-env=adverbs-npi=ever-crucial_item=sometimes-licensor=0-scope=0-npi_present=1-paradigm=573-acceptability=0","The teachers ever think that the boy could sometimes return to the people.","trial",22,"attention_check_item_2-acceptability=0","Select two for this answer to show that you are being attentive."
19,"trial",18,"experiment=NPI-env=sentential_negation_biclausal-npi=either-crucial_item=not-licensor=1-scope=1-npi_present=1-paradigm=4261-acceptability=1","The girls had not explained that an essay was winning either.","trial",6,"experiment=NPI-env=questions-npi=ever-crucial_item=whether-licensor=0-scope=1-npi_present=0-paradigm=778-acceptability=1","The people say that the senator fortunately knew the senators.","trial",16,"experiment=NPI-env=quantifier-npi=either-crucial_item=any-licensor=1-scope=0-npi_present=1-paradigm=5471-acceptability=0","Any guys who lifted a lot of reports were discussing some malls either.","trial",14,"experiment=NPI-env=adverbs-npi=any-crucial_item=seldom-licensor=1-scope=1-npi_present=0-paradigm=1272-acceptability=1","A customer who seldom returned to the actors remembers newspaper articles.","trial",3,"experiment=NPI-env=adverbs-npi=atall-crucial_item=sometimes-licensor=0-scope=0-npi_present=1-paradigm=2057-acceptability=0","The children who can sometimes approach students won at all.","trial",22,"attention_check_item_2-acceptability=0","Select two for this answer to show that you are being attentive.","trial",15,"experiment=NPI-env=questions-npi=yet-crucial_item=whether-licensor=1-scope=0-npi_present=0-paradigm=2683-acceptability=1","The teenagers have wondered on weekends whether the students are working with ladies.","trial",7,"experiment=NPI-env=determiner_negation_biclausal-npi=ever-crucial_item=some-licensor=0-scope=1-npi_present=1-paradigm=643-acceptability=0","Some patients can ever explain that the doctors knew the adults.","trial",21,"attention_check_item_6-acceptability=1","Show that you are paying attention by choosing the highest number on the scale.","trial",9,"experiment=NPI-env=only-npi=yet-crucial_item=only-licensor=1-scope=1-npi_present=0-paradigm=3982-acceptability=1","Only the customers attack adults on occasion at the high school.","trial",13,"experiment=NPI-env=quantifier-npi=atall-crucial_item=a lot of-licensor=0-scope=1-npi_present=1-paradigm=3497-acceptability=0","A lot of actors who cleaned more than three reports at all have explored the hospitals.","trial",19,"experiment=NPI-env=quantifier-npi=inyears-crucial_item=some-licensor=0-scope=0-npi_present=0-paradigm=4726-acceptability=1","Some customer who had been at the schools went to many museums on weekends.","trial",5,"experiment=NPI-env=adverbs-npi=ever-crucial_item=sometimes-licensor=0-scope=0-npi_present=1-paradigm=573-acceptability=0","The teachers ever think that the boy could sometimes return to the people.","trial",17,"experiment=NPI-env=determiner_negation_biclausal-npi=in years-crucial_item=none of the-licensor=1-scope=0-npi_present=1-paradigm=3768-acceptability=0","A woman explained in years that no teenagers have won.","trial",2,"experiment=NPI-env=conditional-npi=atall-crucial_item=while-licensor=0-scope=0-npi_present=1-paradigm=3602-acceptability=0","While the doctors insult the schools, the drivers will remember the dancers at all.","trial",4,"experiment=NPI-env=superlative-npi=ever-crucial_item=best-licensor=1-scope=1-npi_present=1-paradigm=970-acceptability=1","The people can drop by the best museums that the teacher has ever remembered.","trial",11,"experiment=NPI-env=conditional-npi=any-crucial_item=while-licensor=0-scope=0-npi_present=1-paradigm=1201-acceptability=0","While the senator exits the banks, the students will dislike any college campuses.","trial",12,"experiment=NPI-env=only-npi=atall-crucial_item=even-licensor=0-scope=1-npi_present=1-paradigm=2997-acceptability=0","Even a customer was arriving at hospitals at all at the hospital.","trial",20,"experiment=NPI-env=sentential_negation_biclausal-npi=at all-crucial_item=not-licensor=1-scope=1-npi_present=0-paradigm=2783-acceptability=1","The actor was not imagining that the senators had cried regularly.","trial",10,"experiment=NPI-env=questions-npi=any-crucial_item=whether-licensor=0-scope=1-npi_present=1-paradigm=1883-acceptability=0","The customers say that the senators discuss any reports.","trial",8,"experiment=NPI-env=superlative-npi=inyears-crucial_item=most serious-licensor=1-scope=1-npi_present=0-paradigm=4296-acceptability=1","The cashiers who described the most serious child for a while will boycott grocery stores.","trial",1,"experiment=NPI-env=adverbs-npi=inyears-crucial_item=rarely-licensor=1-scope=1-npi_present=0-paradigm=3590-acceptability=1","The girls who rarely chatted regularly have interacted."
