"list","item_1_section","item_1_number","item_1_condition","field_1_1","item_2_section","item_2_number","item_2_condition","field_2_1","item_3_section","item_3_number","item_3_condition","field_3_1","item_4_section","item_4_number","item_4_condition","field_4_1","item_5_section","item_5_number","item_5_condition","field_5_1","item_6_section","item_6_number","item_6_condition","field_6_1","item_7_section","item_7_number","item_7_condition","field_7_1","item_8_section","item_8_number","item_8_condition","field_8_1","item_9_section","item_9_number","item_9_condition","field_9_1","item_10_section","item_10_number","item_10_condition","field_10_1","item_11_section","item_11_number","item_11_condition","field_11_1","item_12_section","item_12_number","item_12_condition","field_12_1","item_13_section","item_13_number","item_13_condition","field_13_1","item_14_section","item_14_number","item_14_condition","field_14_1","item_15_section","item_15_number","item_15_condition","field_15_1","item_16_section","item_16_number","item_16_condition","field_16_1","item_17_section","item_17_number","item_17_condition","field_17_1","item_18_section","item_18_number","item_18_condition","field_18_1","item_19_section","item_19_number","item_19_condition","field_19_1","item_20_section","item_20_number","item_20_condition","field_20_1","item_21_section","item_21_number","item_21_condition","field_21_1","item_22_section","item_22_number","item_22_condition","field_22_1"
0,"trial",17,"experiment=NPI-env=adverbs-npi=inyears-crucial_item=often-licensor=0-scope=1-npi_present=0-paradigm=3441-acceptability=1","An actor who often cleaned glasses on occasion had studied.","trial",15,"experiment=NPI-env=determiner_negation_biclausal-npi=at all-crucial_item=none of the-licensor=1-scope=1-npi_present=0-paradigm=2493-acceptability=1","None of the guests said that the couches resemble the movie theaters on occasion.","trial",5,"experiment=NPI-env=sentential_negation_biclausal-npi=any-crucial_item=really-licensor=0-scope=1-npi_present=1-paradigm=5707-acceptability=0","These teenagers did really say that any cups might resemble a hat.","trial",20,"experiment=NPI-env=superlative-npi=either-crucial_item=happy-licensor=0-scope=1-npi_present=0-paradigm=5744-acceptability=1","The patient who saw the happy women for a while observed actresses.","trial",7,"experiment=NPI-env=sentential_negation_biclausal-npi=yet-crucial_item=really-licensor=0-scope=0-npi_present=1-paradigm=1473-acceptability=0","A patient had said yet that the museums could really resemble a play.","trial",4,"experiment=NPI-env=only-npi=ever-crucial_item=even-licensor=0-scope=0-npi_present=1-paradigm=608-acceptability=0","A waitress does ever love even the men.","trial",8,"experiment=NPI-env=quantifier-npi=yet-crucial_item=every-licensor=1-scope=0-npi_present=0-paradigm=2274-acceptability=1","Every actress who flees from more than three students knows more than three women for a while.","trial",12,"experiment=NPI-env=superlative-npi=atall-crucial_item=important-licensor=0-scope=1-npi_present=1-paradigm=2229-acceptability=0","The boys who forgot the important report at all toured schools.","trial",6,"experiment=NPI-env=simplequestions-npi=any-crucial_item=?-licensor=0-scope=1-npi_present=0-paradigm=1292-acceptability=1","The actresses were discussing the hospitals.","trial",3,"experiment=NPI-env=adverbs-npi=either-crucial_item=often-licensor=0-scope=0-npi_present=1-paradigm=4444-acceptability=0","The waitresses who often did bring glasses had conferred either.","trial",11,"experiment=NPI-env=only-npi=yet-crucial_item=even-licensor=0-scope=1-npi_present=1-paradigm=3782-acceptability=0","Even a guy had described schools yet at the restaurant.","trial",9,"experiment=NPI-env=simplequestions-npi=atall-crucial_item=?-licensor=1-scope=1-npi_present=1-paradigm=2950-acceptability=1","Had the waiters cared for the people at all?","trial",2,"experiment=NPI-env=superlative-npi=any-crucial_item=new-licensor=0-scope=1-npi_present=1-paradigm=1046-acceptability=0","The guests were bringing the new glasses that any waiters have brought.","trial",16,"experiment=NPI-env=adverbs-npi=atall-crucial_item=seldom-licensor=1-scope=1-npi_present=1-paradigm=2403-acceptability=1","The children who could seldom collaborate at all flirted.","trial",10,"experiment=NPI-env=questions-npi=yet-crucial_item=whether-licensor=0-scope=0-npi_present=1-paradigm=2025-acceptability=0","The teenagers have said yet that the students will like the plates.","trial",18,"experiment=NPI-env=sentential_negation_biclausal-npi=ever-crucial_item=not-licensor=1-scope=1-npi_present=0-paradigm=334-acceptability=1","The men will not clearly say that a person can wash.","trial",14,"experiment=NPI-env=only-npi=either-crucial_item=even-licensor=0-scope=0-npi_present=1-paradigm=5675-acceptability=0","The senator can see either even at the art gallery.","trial",22,"attention_check_item_2-acceptability=0","Select two for this answer to show that you are being attentive.","trial",13,"experiment=NPI-env=sentential_negation_biclausal-npi=at all-crucial_item=not-licensor=1-scope=0-npi_present=0-paradigm=2264-acceptability=1","The customer had thought on weekends that the girls had not kissed the adults.","trial",21,"attention_check_item_6-acceptability=1","Show that you are paying attention by choosing the highest number on the scale.","trial",1,"experiment=NPI-env=superlative-npi=yet-crucial_item=worst-licensor=1-scope=1-npi_present=1-paradigm=3237-acceptability=1","The dancers who investigated the worst patient yet pass art galleries.","trial",19,"experiment=NPI-env=adverbs-npi=any-crucial_item=always-licensor=0-scope=0-npi_present=1-paradigm=1552-acceptability=0","A customer who has always arrived at schools discusses any cashiers."
1,"trial",19,"experiment=NPI-env=adverbs-npi=any-crucial_item=always-licensor=0-scope=0-npi_present=1-paradigm=1552-acceptability=0","A customer who has always arrived at schools discusses any cashiers.","trial",1,"experiment=NPI-env=superlative-npi=yet-crucial_item=worst-licensor=1-scope=1-npi_present=1-paradigm=3237-acceptability=1","The dancers who investigated the worst patient yet pass art galleries.","trial",6,"experiment=NPI-env=simplequestions-npi=any-crucial_item=?-licensor=0-scope=1-npi_present=0-paradigm=1292-acceptability=1","The actresses were discussing the hospitals.","trial",15,"experiment=NPI-env=determiner_negation_biclausal-npi=at all-crucial_item=none of the-licensor=1-scope=1-npi_present=0-paradigm=2493-acceptability=1","None of the guests said that the couches resemble the movie theaters on occasion.","trial",17,"experiment=NPI-env=adverbs-npi=inyears-crucial_item=often-licensor=0-scope=1-npi_present=0-paradigm=3441-acceptability=1","An actor who often cleaned glasses on occasion had studied.","trial",10,"experiment=NPI-env=questions-npi=yet-crucial_item=whether-licensor=0-scope=0-npi_present=1-paradigm=2025-acceptability=0","The teenagers have said yet that the students will like the plates.","trial",20,"experiment=NPI-env=superlative-npi=either-crucial_item=happy-licensor=0-scope=1-npi_present=0-paradigm=5744-acceptability=1","The patient who saw the happy women for a while observed actresses.","trial",21,"attention_check_item_6-acceptability=1","Show that you are paying attention by choosing the highest number on the scale.","trial",18,"experiment=NPI-env=sentential_negation_biclausal-npi=ever-crucial_item=not-licensor=1-scope=1-npi_present=0-paradigm=334-acceptability=1","The men will not clearly say that a person can wash.","trial",9,"experiment=NPI-env=simplequestions-npi=atall-crucial_item=?-licensor=1-scope=1-npi_present=1-paradigm=2950-acceptability=1","Had the waiters cared for the people at all?","trial",5,"experiment=NPI-env=sentential_negation_biclausal-npi=any-crucial_item=really-licensor=0-scope=1-npi_present=1-paradigm=5707-acceptability=0","These teenagers did really say that any cups might resemble a hat.","trial",2,"experiment=NPI-env=superlative-npi=any-crucial_item=new-licensor=0-scope=1-npi_present=1-paradigm=1046-acceptability=0","The guests were bringing the new glasses that any waiters have brought.","trial",7,"experiment=NPI-env=sentential_negation_biclausal-npi=yet-crucial_item=really-licensor=0-scope=0-npi_present=1-paradigm=1473-acceptability=0","A patient had said yet that the museums could really resemble a play.","trial",12,"experiment=NPI-env=superlative-npi=atall-crucial_item=important-licensor=0-scope=1-npi_present=1-paradigm=2229-acceptability=0","The boys who forgot the important report at all toured schools.","trial",22,"attention_check_item_2-acceptability=0","Select two for this answer to show that you are being attentive.","trial",13,"experiment=NPI-env=sentential_negation_biclausal-npi=at all-crucial_item=not-licensor=1-scope=0-npi_present=0-paradigm=2264-acceptability=1","The customer had thought on weekends that the girls had not kissed the adults.","trial",11,"experiment=NPI-env=only-npi=yet-crucial_item=even-licensor=0-scope=1-npi_present=1-paradigm=3782-acceptability=0","Even a guy had described schools yet at the restaurant.","trial",3,"experiment=NPI-env=adverbs-npi=either-crucial_item=often-licensor=0-scope=0-npi_present=1-paradigm=4444-acceptability=0","The waitresses who often did bring glasses had conferred either.","trial",16,"experiment=NPI-env=adverbs-npi=atall-crucial_item=seldom-licensor=1-scope=1-npi_present=1-paradigm=2403-acceptability=1","The children who could seldom collaborate at all flirted.","trial",14,"experiment=NPI-env=only-npi=either-crucial_item=even-licensor=0-scope=0-npi_present=1-paradigm=5675-acceptability=0","The senator can see either even at the art gallery.","trial",8,"experiment=NPI-env=quantifier-npi=yet-crucial_item=every-licensor=1-scope=0-npi_present=0-paradigm=2274-acceptability=1","Every actress who flees from more than three students knows more than three women for a while.","trial",4,"experiment=NPI-env=only-npi=ever-crucial_item=even-licensor=0-scope=0-npi_present=1-paradigm=608-acceptability=0","A waitress does ever love even the men."
2,"trial",18,"experiment=NPI-env=sentential_negation_biclausal-npi=ever-crucial_item=not-licensor=1-scope=1-npi_present=0-paradigm=334-acceptability=1","The men will not clearly say that a person can wash.","trial",6,"experiment=NPI-env=simplequestions-npi=any-crucial_item=?-licensor=0-scope=1-npi_present=0-paradigm=1292-acceptability=1","The actresses were discussing the hospitals.","trial",15,"experiment=NPI-env=determiner_negation_biclausal-npi=at all-crucial_item=none of the-licensor=1-scope=1-npi_present=0-paradigm=2493-acceptability=1","None of the guests said that the couches resemble the movie theaters on occasion.","trial",3,"experiment=NPI-env=adverbs-npi=either-crucial_item=often-licensor=0-scope=0-npi_present=1-paradigm=4444-acceptability=0","The waitresses who often did bring glasses had conferred either.","trial",16,"experiment=NPI-env=adverbs-npi=atall-crucial_item=seldom-licensor=1-scope=1-npi_present=1-paradigm=2403-acceptability=1","The children who could seldom collaborate at all flirted.","trial",5,"experiment=NPI-env=sentential_negation_biclausal-npi=any-crucial_item=really-licensor=0-scope=1-npi_present=1-paradigm=5707-acceptability=0","These teenagers did really say that any cups might resemble a hat.","trial",8,"experiment=NPI-env=quantifier-npi=yet-crucial_item=every-licensor=1-scope=0-npi_present=0-paradigm=2274-acceptability=1","Every actress who flees from more than three students knows more than three women for a while.","trial",10,"experiment=NPI-env=questions-npi=yet-crucial_item=whether-licensor=0-scope=0-npi_present=1-paradigm=2025-acceptability=0","The teenagers have said yet that the students will like the plates.","trial",9,"experiment=NPI-env=simplequestions-npi=atall-crucial_item=?-licensor=1-scope=1-npi_present=1-paradigm=2950-acceptability=1","Had the waiters cared for the people at all?","trial",14,"experiment=NPI-env=only-npi=either-crucial_item=even-licensor=0-scope=0-npi_present=1-paradigm=5675-acceptability=0","The senator can see either even at the art gallery.","trial",19,"experiment=NPI-env=adverbs-npi=any-crucial_item=always-licensor=0-scope=0-npi_present=1-paradigm=1552-acceptability=0","A customer who has always arrived at schools discusses any cashiers.","trial",11,"experiment=NPI-env=only-npi=yet-crucial_item=even-licensor=0-scope=1-npi_present=1-paradigm=3782-acceptability=0","Even a guy had described schools yet at the restaurant.","trial",1,"experiment=NPI-env=superlative-npi=yet-crucial_item=worst-licensor=1-scope=1-npi_present=1-paradigm=3237-acceptability=1","The dancers who investigated the worst patient yet pass art galleries.","trial",13,"experiment=NPI-env=sentential_negation_biclausal-npi=at all-crucial_item=not-licensor=1-scope=0-npi_present=0-paradigm=2264-acceptability=1","The customer had thought on weekends that the girls had not kissed the adults.","trial",21,"attention_check_item_6-acceptability=1","Show that you are paying attention by choosing the highest number on the scale.","trial",22,"attention_check_item_2-acceptability=0","Select two for this answer to show that you are being attentive.","trial",2,"experiment=NPI-env=superlative-npi=any-crucial_item=new-licensor=0-scope=1-npi_present=1-paradigm=1046-acceptability=0","The guests were bringing the new glasses that any waiters have brought.","trial",20,"experiment=NPI-env=superlative-npi=either-crucial_item=happy-licensor=0-scope=1-npi_present=0-paradigm=5744-acceptability=1","The patient who saw the happy women for a while observed actresses.","trial",4,"experiment=NPI-env=only-npi=ever-crucial_item=even-licensor=0-scope=0-npi_present=1-paradigm=608-acceptability=0","A waitress does ever love even the men.","trial",17,"experiment=NPI-env=adverbs-npi=inyears-crucial_item=often-licensor=0-scope=1-npi_present=0-paradigm=3441-acceptability=1","An actor who often cleaned glasses on occasion had studied.","trial",7,"experiment=NPI-env=sentential_negation_biclausal-npi=yet-crucial_item=really-licensor=0-scope=0-npi_present=1-paradigm=1473-acceptability=0","A patient had said yet that the museums could really resemble a play.","trial",12,"experiment=NPI-env=superlative-npi=atall-crucial_item=important-licensor=0-scope=1-npi_present=1-paradigm=2229-acceptability=0","The boys who forgot the important report at all toured schools."
3,"trial",7,"experiment=NPI-env=sentential_negation_biclausal-npi=yet-crucial_item=really-licensor=0-scope=0-npi_present=1-paradigm=1473-acceptability=0","A patient had said yet that the museums could really resemble a play.","trial",6,"experiment=NPI-env=simplequestions-npi=any-crucial_item=?-licensor=0-scope=1-npi_present=0-paradigm=1292-acceptability=1","The actresses were discussing the hospitals.","trial",17,"experiment=NPI-env=adverbs-npi=inyears-crucial_item=often-licensor=0-scope=1-npi_present=0-paradigm=3441-acceptability=1","An actor who often cleaned glasses on occasion had studied.","trial",20,"experiment=NPI-env=superlative-npi=either-crucial_item=happy-licensor=0-scope=1-npi_present=0-paradigm=5744-acceptability=1","The patient who saw the happy women for a while observed actresses.","trial",14,"experiment=NPI-env=only-npi=either-crucial_item=even-licensor=0-scope=0-npi_present=1-paradigm=5675-acceptability=0","The senator can see either even at the art gallery.","trial",12,"experiment=NPI-env=superlative-npi=atall-crucial_item=important-licensor=0-scope=1-npi_present=1-paradigm=2229-acceptability=0","The boys who forgot the important report at all toured schools.","trial",2,"experiment=NPI-env=superlative-npi=any-crucial_item=new-licensor=0-scope=1-npi_present=1-paradigm=1046-acceptability=0","The guests were bringing the new glasses that any waiters have brought.","trial",5,"experiment=NPI-env=sentential_negation_biclausal-npi=any-crucial_item=really-licensor=0-scope=1-npi_present=1-paradigm=5707-acceptability=0","These teenagers did really say that any cups might resemble a hat.","trial",4,"experiment=NPI-env=only-npi=ever-crucial_item=even-licensor=0-scope=0-npi_present=1-paradigm=608-acceptability=0","A waitress does ever love even the men.","trial",3,"experiment=NPI-env=adverbs-npi=either-crucial_item=often-licensor=0-scope=0-npi_present=1-paradigm=4444-acceptability=0","The waitresses who often did bring glasses had conferred either.","trial",19,"experiment=NPI-env=adverbs-npi=any-crucial_item=always-licensor=0-scope=0-npi_present=1-paradigm=1552-acceptability=0","A customer who has always arrived at schools discusses any cashiers.","trial",21,"attention_check_item_6-acceptability=1","Show that you are paying attention by choosing the highest number on the scale.","trial",8,"experiment=NPI-env=quantifier-npi=yet-crucial_item=every-licensor=1-scope=0-npi_present=0-paradigm=2274-acceptability=1","Every actress who flees from more than three students knows more than three women for a while.","trial",18,"experiment=NPI-env=sentential_negation_biclausal-npi=ever-crucial_item=not-licensor=1-scope=1-npi_present=0-paradigm=334-acceptability=1","The men will not clearly say that a person can wash.","trial",15,"experiment=NPI-env=determiner_negation_biclausal-npi=at all-crucial_item=none of the-licensor=1-scope=1-npi_present=0-paradigm=2493-acceptability=1","None of the guests said that the couches resemble the movie theaters on occasion.","trial",10,"experiment=NPI-env=questions-npi=yet-crucial_item=whether-licensor=0-scope=0-npi_present=1-paradigm=2025-acceptability=0","The teenagers have said yet that the students will like the plates.","trial",1,"experiment=NPI-env=superlative-npi=yet-crucial_item=worst-licensor=1-scope=1-npi_present=1-paradigm=3237-acceptability=1","The dancers who investigated the worst patient yet pass art galleries.","trial",11,"experiment=NPI-env=only-npi=yet-crucial_item=even-licensor=0-scope=1-npi_present=1-paradigm=3782-acceptability=0","Even a guy had described schools yet at the restaurant.","trial",16,"experiment=NPI-env=adverbs-npi=atall-crucial_item=seldom-licensor=1-scope=1-npi_present=1-paradigm=2403-acceptability=1","The children who could seldom collaborate at all flirted.","trial",22,"attention_check_item_2-acceptability=0","Select two for this answer to show that you are being attentive.","trial",13,"experiment=NPI-env=sentential_negation_biclausal-npi=at all-crucial_item=not-licensor=1-scope=0-npi_present=0-paradigm=2264-acceptability=1","The customer had thought on weekends that the girls had not kissed the adults.","trial",9,"experiment=NPI-env=simplequestions-npi=atall-crucial_item=?-licensor=1-scope=1-npi_present=1-paradigm=2950-acceptability=1","Had the waiters cared for the people at all?"
4,"trial",14,"experiment=NPI-env=only-npi=either-crucial_item=even-licensor=0-scope=0-npi_present=1-paradigm=5675-acceptability=0","The senator can see either even at the art gallery.","trial",2,"experiment=NPI-env=superlative-npi=any-crucial_item=new-licensor=0-scope=1-npi_present=1-paradigm=1046-acceptability=0","The guests were bringing the new glasses that any waiters have brought.","trial",19,"experiment=NPI-env=adverbs-npi=any-crucial_item=always-licensor=0-scope=0-npi_present=1-paradigm=1552-acceptability=0","A customer who has always arrived at schools discusses any cashiers.","trial",7,"experiment=NPI-env=sentential_negation_biclausal-npi=yet-crucial_item=really-licensor=0-scope=0-npi_present=1-paradigm=1473-acceptability=0","A patient had said yet that the museums could really resemble a play.","trial",6,"experiment=NPI-env=simplequestions-npi=any-crucial_item=?-licensor=0-scope=1-npi_present=0-paradigm=1292-acceptability=1","The actresses were discussing the hospitals.","trial",12,"experiment=NPI-env=superlative-npi=atall-crucial_item=important-licensor=0-scope=1-npi_present=1-paradigm=2229-acceptability=0","The boys who forgot the important report at all toured schools.","trial",22,"attention_check_item_2-acceptability=0","Select two for this answer to show that you are being attentive.","trial",5,"experiment=NPI-env=sentential_negation_biclausal-npi=any-crucial_item=really-licensor=0-scope=1-npi_present=1-paradigm=5707-acceptability=0","These teenagers did really say that any cups might resemble a hat.","trial",8,"experiment=NPI-env=quantifier-npi=yet-crucial_item=every-licensor=1-scope=0-npi_present=0-paradigm=2274-acceptability=1","Every actress who flees from more than three students knows more than three women for a while.","trial",21,"attention_check_item_6-acceptability=1","Show that you are paying attention by choosing the highest number on the scale.","trial",13,"experiment=NPI-env=sentential_negation_biclausal-npi=at all-crucial_item=not-licensor=1-scope=0-npi_present=0-paradigm=2264-acceptability=1","The customer had thought on weekends that the girls had not kissed the adults.","trial",18,"experiment=NPI-env=sentential_negation_biclausal-npi=ever-crucial_item=not-licensor=1-scope=1-npi_present=0-paradigm=334-acceptability=1","The men will not clearly say that a person can wash.","trial",17,"experiment=NPI-env=adverbs-npi=inyears-crucial_item=often-licensor=0-scope=1-npi_present=0-paradigm=3441-acceptability=1","An actor who often cleaned glasses on occasion had studied.","trial",10,"experiment=NPI-env=questions-npi=yet-crucial_item=whether-licensor=0-scope=0-npi_present=1-paradigm=2025-acceptability=0","The teenagers have said yet that the students will like the plates.","trial",4,"experiment=NPI-env=only-npi=ever-crucial_item=even-licensor=0-scope=0-npi_present=1-paradigm=608-acceptability=0","A waitress does ever love even the men.","trial",11,"experiment=NPI-env=only-npi=yet-crucial_item=even-licensor=0-scope=1-npi_present=1-paradigm=3782-acceptability=0","Even a guy had described schools yet at the restaurant.","trial",9,"experiment=NPI-env=simplequestions-npi=atall-crucial_item=?-licensor=1-scope=1-npi_present=1-paradigm=2950-acceptability=1","Had the waiters cared for the people at all?","trial",20,"experiment=NPI-env=superlative-npi=either-crucial_item=happy-licensor=0-scope=1-npi_present=0-paradigm=5744-acceptability=1","The patient who saw the happy women for a while observed actresses.","trial",15,"experiment=NPI-env=determiner_negation_biclausal-npi=at all-crucial_item=none of the-licensor=1-scope=1-npi_present=0-paradigm=2493-acceptability=1","None of the guests said that the couches resemble the movie theaters on occasion.","trial",3,"experiment=NPI-env=adverbs-npi=either-crucial_item=often-licensor=0-scope=0-npi_present=1-paradigm=4444-acceptability=0","The waitresses who often did bring glasses had conferred either.","trial",16,"experiment=NPI-env=adverbs-npi=atall-crucial_item=seldom-licensor=1-scope=1-npi_present=1-paradigm=2403-acceptability=1","The children who could seldom collaborate at all flirted.","trial",1,"experiment=NPI-env=superlative-npi=yet-crucial_item=worst-licensor=1-scope=1-npi_present=1-paradigm=3237-acceptability=1","The dancers who investigated the worst patient yet pass art galleries."
