experiment=NPI-env=negation-npi=ever-crucial_item=some-licensor=0-scope=1-npi_present=1	0		Some waitress ever imagines that the humans have struggled .
experiment=NPI-env=negation-npi=ever-crucial_item=no-licensor=1-scope=1-npi_present=1	1		no driver ever says that the humans drop by the high school .
experiment=NPI-env=negation-npi=ever-crucial_item=some-licensor=0-scope=0-npi_present=1	0		a driver ever says that some humans drop by the high school .
experiment=NPI-env=negation-npi=ever-crucial_item=no-licensor=1-scope=1-npi_present=1	1		no actors did ever explain that the ladies describe the cafes .
experiment=NPI-env=negation-npi=ever-crucial_item=some-licensor=0-scope=1-npi_present=1	0		Some actors did ever explain that the ladies describe the cafes .
experiment=NPI-env=negation-npi=ever-crucial_item=some-licensor=0-scope=1-npi_present=0	1		Some actors did often explain that the ladies describe the cafes .
experiment=NPI-env=negation-npi=ever-crucial_item=some-licensor=0-scope=0-npi_present=1	0		the actors did ever explain that some ladies describe the cafes .
experiment=NPI-env=negation-npi=ever-crucial_item=some-licensor=0-scope=0-npi_present=0	1		the actors did often explain that some ladies describe the cafes .
experiment=NPI-env=negation-npi=ever-crucial_item=no-licensor=1-scope=0-npi_present=0	1		a boy does often imagine that no pedestrians were hunting .
experiment=NPI-env=negation-npi=ever-crucial_item=some-licensor=0-scope=1-npi_present=1	0		Some boy does ever imagine that the pedestrians were hunting .
experiment=NPI-env=negation-npi=ever-crucial_item=no-licensor=1-scope=1-npi_present=0	1		no guys are often thinking that an actor skated around the art galleries .
experiment=NPI-env=negation-npi=ever-crucial_item=no-licensor=1-scope=0-npi_present=1	0		the guys are ever thinking that no actor skated around the art galleries .
experiment=NPI-env=negation-npi=ever-crucial_item=no-licensor=1-scope=0-npi_present=0	1		the guys are often thinking that no actor skated around the art galleries .
experiment=NPI-env=negation-npi=ever-crucial_item=some-licensor=0-scope=1-npi_present=0	1		Some guys are often thinking that an actor skated around the art galleries .
experiment=NPI-env=negation-npi=ever-crucial_item=no-licensor=1-scope=1-npi_present=0	1		no man often says that an actor admires the drivers .
experiment=NPI-env=negation-npi=ever-crucial_item=some-licensor=0-scope=1-npi_present=1	0		Some man ever says that an actor admires the drivers .
experiment=NPI-env=negation-npi=ever-crucial_item=some-licensor=0-scope=0-npi_present=0	1		the man often says that some actor admires the drivers .
experiment=NPI-env=negation-npi=ever-crucial_item=no-licensor=1-scope=0-npi_present=1	0		the customers ever explained that no guy did be at the college campuses .
experiment=NPI-env=negation-npi=ever-crucial_item=some-licensor=0-scope=1-npi_present=1	0		Some customers ever explained that the guy did be at the college campuses .
experiment=NPI-env=negation-npi=ever-crucial_item=some-licensor=0-scope=0-npi_present=1	0		the customers ever explained that some guy did be at the college campuses .
experiment=NPI-env=negation-npi=ever-crucial_item=some-licensor=0-scope=0-npi_present=0	1		the customers often explained that some guy did be at the college campuses .
experiment=NPI-env=negation-npi=ever-crucial_item=no-licensor=1-scope=1-npi_present=0	1		no teachers did often think that the actor had fled from the children .
experiment=NPI-env=negation-npi=ever-crucial_item=no-licensor=1-scope=0-npi_present=1	0		the teachers did ever think that no actor had fled from the children .
experiment=NPI-env=negation-npi=ever-crucial_item=no-licensor=1-scope=0-npi_present=0	1		the teachers did often think that no actor had fled from the children .
experiment=NPI-env=negation-npi=ever-crucial_item=some-licensor=0-scope=1-npi_present=1	0		Some teachers did ever think that the actor had fled from the children .
experiment=NPI-env=negation-npi=ever-crucial_item=some-licensor=0-scope=1-npi_present=0	1		Some teachers did often think that the actor had fled from the children .
experiment=NPI-env=negation-npi=ever-crucial_item=no-licensor=1-scope=1-npi_present=1	1		no actor ever thought that the guests remember a man .
experiment=NPI-env=negation-npi=ever-crucial_item=no-licensor=1-scope=0-npi_present=1	0		the actor ever thought that no guests remember a man .
experiment=NPI-env=negation-npi=ever-crucial_item=some-licensor=0-scope=1-npi_present=1	0		Some actor ever thought that the guests remember a man .
experiment=NPI-env=negation-npi=ever-crucial_item=some-licensor=0-scope=1-npi_present=0	1		Some actor often thought that the guests remember a man .
experiment=NPI-env=negation-npi=ever-crucial_item=some-licensor=0-scope=0-npi_present=0	1		the actor often thought that some guests remember a man .
experiment=NPI-env=negation-npi=ever-crucial_item=no-licensor=1-scope=0-npi_present=1	0		a teacher had ever thought that no doctors will admire the chairs .
experiment=NPI-env=negation-npi=ever-crucial_item=no-licensor=1-scope=0-npi_present=1	0		the driver is ever saying that no patient criticizes the ladies .
experiment=NPI-env=negation-npi=ever-crucial_item=no-licensor=1-scope=0-npi_present=0	1		the driver is often saying that no patient criticizes the ladies .
experiment=NPI-env=negation-npi=ever-crucial_item=some-licensor=0-scope=0-npi_present=1	0		the driver is ever saying that some patient criticizes the ladies .
experiment=NPI-env=negation-npi=ever-crucial_item=no-licensor=1-scope=1-npi_present=1	1		no boys ever imagine that the driver would investigate the mice .
experiment=NPI-env=negation-npi=ever-crucial_item=no-licensor=1-scope=1-npi_present=0	1		no boys often imagine that the driver would investigate the mice .
experiment=NPI-env=negation-npi=ever-crucial_item=some-licensor=0-scope=1-npi_present=1	0		Some boys ever imagine that the driver would investigate the mice .
experiment=NPI-env=negation-npi=ever-crucial_item=some-licensor=0-scope=0-npi_present=1	0		the boys ever imagine that some driver would investigate the mice .
experiment=NPI-env=negation-npi=ever-crucial_item=some-licensor=0-scope=0-npi_present=0	1		the boys often imagine that some driver would investigate the mice .
experiment=NPI-env=negation-npi=ever-crucial_item=no-licensor=1-scope=0-npi_present=0	1		the humans have often said that no cashiers did wear a hat .
experiment=NPI-env=negation-npi=ever-crucial_item=some-licensor=0-scope=1-npi_present=0	1		Some ladies often thought that the doctors were scanning the reports .
experiment=NPI-env=negation-npi=ever-crucial_item=no-licensor=1-scope=0-npi_present=1	0		the actors should ever explain that no teachers would remember the humans .
experiment=NPI-env=negation-npi=ever-crucial_item=no-licensor=1-scope=0-npi_present=0	1		the actors should often explain that no teachers would remember the humans .
experiment=NPI-env=negation-npi=ever-crucial_item=some-licensor=0-scope=1-npi_present=1	0		Some actors should ever explain that the teachers would remember the humans .
experiment=NPI-env=negation-npi=ever-crucial_item=some-licensor=0-scope=0-npi_present=0	1		the actors should often explain that some teachers would remember the humans .
experiment=NPI-env=negation-npi=ever-crucial_item=no-licensor=1-scope=1-npi_present=0	1		no people could often think that the customer will exit the schools .
experiment=NPI-env=negation-npi=ever-crucial_item=no-licensor=1-scope=1-npi_present=1	1		no actress has ever imagined that the doctors are chatting .
experiment=NPI-env=negation-npi=ever-crucial_item=no-licensor=1-scope=0-npi_present=1	0		the actress has ever imagined that no doctors are chatting .
experiment=NPI-env=negation-npi=ever-crucial_item=some-licensor=0-scope=1-npi_present=0	1		Some actress has often imagined that the doctors are chatting .
experiment=NPI-env=negation-npi=ever-crucial_item=some-licensor=0-scope=0-npi_present=0	1		the actress has often imagined that some doctors are chatting .
experiment=NPI-env=negation-npi=ever-crucial_item=no-licensor=1-scope=0-npi_present=0	1		the waitress often imagines that no waiter could reply .
experiment=NPI-env=negation-npi=ever-crucial_item=some-licensor=0-scope=1-npi_present=1	0		Some waitress ever imagines that the waiter could reply .
experiment=NPI-env=negation-npi=ever-crucial_item=no-licensor=1-scope=0-npi_present=1	0		the actors ever think that no people criticized the essays .
experiment=NPI-env=negation-npi=ever-crucial_item=some-licensor=0-scope=0-npi_present=1	0		the actors ever think that some people criticized the essays .
experiment=NPI-env=negation-npi=ever-crucial_item=no-licensor=1-scope=1-npi_present=1	1		no people ever think that the gals remembered the museum .
experiment=NPI-env=negation-npi=ever-crucial_item=some-licensor=0-scope=1-npi_present=0	1		Some people often think that the gals remembered the museum .
experiment=NPI-env=negation-npi=ever-crucial_item=some-licensor=0-scope=0-npi_present=1	0		the people ever think that some gals remembered the museum .
experiment=NPI-env=negation-npi=ever-crucial_item=some-licensor=0-scope=0-npi_present=0	1		the people often think that some gals remembered the museum .
experiment=NPI-env=negation-npi=ever-crucial_item=no-licensor=1-scope=1-npi_present=1	1		no guys ever say that the patients respected the child .
experiment=NPI-env=negation-npi=ever-crucial_item=some-licensor=0-scope=1-npi_present=0	1		Some guys often say that the patients respected the child .
experiment=NPI-env=negation-npi=ever-crucial_item=some-licensor=0-scope=0-npi_present=1	0		the guys ever say that some patients respected the child .
experiment=NPI-env=negation-npi=ever-crucial_item=no-licensor=1-scope=0-npi_present=1	0		a patient has ever explained that no patients are succeeding .
experiment=NPI-env=negation-npi=ever-crucial_item=some-licensor=0-scope=1-npi_present=1	0		Some driver has ever imagined that the teachers whisper .
experiment=NPI-env=negation-npi=ever-crucial_item=no-licensor=1-scope=1-npi_present=1	1		no children were ever thinking that the waitress should scratch .
experiment=NPI-env=negation-npi=ever-crucial_item=no-licensor=1-scope=1-npi_present=0	1		no children were often thinking that the waitress should scratch .
experiment=NPI-env=negation-npi=ever-crucial_item=no-licensor=1-scope=0-npi_present=1	0		the children were ever thinking that no waitress should scratch .
experiment=NPI-env=negation-npi=ever-crucial_item=no-licensor=1-scope=0-npi_present=0	1		the children were often thinking that no waitress should scratch .
experiment=NPI-env=negation-npi=ever-crucial_item=some-licensor=0-scope=1-npi_present=0	1		Some children were often thinking that the waitress should scratch .
experiment=NPI-env=negation-npi=ever-crucial_item=no-licensor=1-scope=1-npi_present=1	1		no pedestrian was ever explaining that the women had grinned .
experiment=NPI-env=negation-npi=ever-crucial_item=some-licensor=0-scope=1-npi_present=1	0		Some pedestrian was ever explaining that the women had grinned .
experiment=NPI-env=negation-npi=ever-crucial_item=some-licensor=0-scope=0-npi_present=0	1		a pedestrian was often explaining that some women had grinned .
experiment=NPI-env=negation-npi=ever-crucial_item=no-licensor=1-scope=0-npi_present=1	0		a patient ever said that no people were admiring the guy .
experiment=NPI-env=negation-npi=ever-crucial_item=no-licensor=1-scope=1-npi_present=1	1		no teacher had ever thought that the gals scratched .
experiment=NPI-env=negation-npi=ever-crucial_item=some-licensor=0-scope=0-npi_present=0	1		the teacher had often thought that some gals scratched .
experiment=NPI-env=negation-npi=ever-crucial_item=no-licensor=1-scope=0-npi_present=1	0		an adult was ever explaining that no humans would praise the mice .
experiment=NPI-env=negation-npi=ever-crucial_item=no-licensor=1-scope=0-npi_present=0	1		an adult was often explaining that no humans would praise the mice .
experiment=NPI-env=negation-npi=ever-crucial_item=some-licensor=0-scope=1-npi_present=1	0		Some adult was ever explaining that the humans would praise the mice .
experiment=NPI-env=negation-npi=ever-crucial_item=no-licensor=1-scope=1-npi_present=1	1		no boys are ever explaining that the students are cleaning the books .
experiment=NPI-env=negation-npi=ever-crucial_item=some-licensor=0-scope=1-npi_present=0	1		Some boys are often explaining that the students are cleaning the books .
experiment=NPI-env=negation-npi=ever-crucial_item=some-licensor=0-scope=1-npi_present=0	1		Some waiter often said that the guests can reference the actress .
experiment=NPI-env=negation-npi=ever-crucial_item=some-licensor=0-scope=0-npi_present=0	1		the waiter often said that some guests can reference the actress .
experiment=NPI-env=negation-npi=ever-crucial_item=no-licensor=1-scope=1-npi_present=0	1		no lady often says that the ladies will mutter .
experiment=NPI-env=negation-npi=ever-crucial_item=some-licensor=0-scope=1-npi_present=0	1		Some lady often says that the ladies will mutter .
experiment=NPI-env=negation-npi=ever-crucial_item=some-licensor=0-scope=0-npi_present=0	1		a lady often says that some ladies will mutter .
experiment=NPI-env=negation-npi=ever-crucial_item=no-licensor=1-scope=1-npi_present=1	1		no actor ever thinks that a human was criticizing the cafe .
experiment=NPI-env=negation-npi=ever-crucial_item=no-licensor=1-scope=1-npi_present=0	1		no actor often thinks that a human was criticizing the cafe .
experiment=NPI-env=negation-npi=ever-crucial_item=no-licensor=1-scope=0-npi_present=0	1		the actor often thinks that no human was criticizing the cafe .
experiment=NPI-env=negation-npi=ever-crucial_item=no-licensor=1-scope=1-npi_present=1	1		no pedestrians have ever explained that a student had admired a car .
experiment=NPI-env=negation-npi=ever-crucial_item=no-licensor=1-scope=1-npi_present=0	1		no pedestrians have often explained that a student had admired a car .
experiment=NPI-env=negation-npi=ever-crucial_item=no-licensor=1-scope=1-npi_present=1	1		no actress ever thought that a person sells a couch .
experiment=NPI-env=negation-npi=ever-crucial_item=some-licensor=0-scope=1-npi_present=1	0		Some actress ever thought that a person sells a couch .
experiment=NPI-env=negation-npi=ever-crucial_item=no-licensor=1-scope=0-npi_present=1	0		the man is ever saying that no actresses had stood up .
experiment=NPI-env=negation-npi=ever-crucial_item=some-licensor=0-scope=1-npi_present=1	0		Some man is ever saying that the actresses had stood up .
experiment=NPI-env=negation-npi=ever-crucial_item=no-licensor=1-scope=0-npi_present=1	0		the woman ever thinks that no adults had lifted the cup .
experiment=NPI-env=negation-npi=ever-crucial_item=no-licensor=1-scope=0-npi_present=0	1		the woman often thinks that no adults had lifted the cup .
experiment=NPI-env=negation-npi=ever-crucial_item=no-licensor=1-scope=1-npi_present=1	1		no teenager is ever thinking that the human had hunted .
experiment=NPI-env=negation-npi=ever-crucial_item=some-licensor=0-scope=1-npi_present=0	1		Some teenager is often thinking that the human had hunted .
experiment=NPI-env=negation-npi=ever-crucial_item=some-licensor=0-scope=0-npi_present=1	0		a teenager is ever thinking that some human had hunted .
experiment=NPI-env=negation-npi=ever-crucial_item=no-licensor=1-scope=1-npi_present=0	1		no adults have often explained that a guest was talking to the adult .
experiment=NPI-env=negation-npi=ever-crucial_item=no-licensor=1-scope=0-npi_present=0	1		the adults have often explained that no guest was talking to the adult .
experiment=NPI-env=negation-npi=ever-crucial_item=some-licensor=0-scope=1-npi_present=1	0		Some adults have ever explained that a guest was talking to the adult .
experiment=NPI-env=negation-npi=ever-crucial_item=some-licensor=0-scope=1-npi_present=0	1		Some adults have often explained that a guest was talking to the adult .
experiment=NPI-env=negation-npi=ever-crucial_item=no-licensor=1-scope=0-npi_present=1	0		a waitress had ever said that no pedestrians scream .
experiment=NPI-env=negation-npi=ever-crucial_item=some-licensor=0-scope=1-npi_present=1	0		Some waitress had ever said that the pedestrians scream .
experiment=NPI-env=negation-npi=ever-crucial_item=some-licensor=0-scope=0-npi_present=1	0		a waitress had ever said that some pedestrians scream .
experiment=NPI-env=negation-npi=ever-crucial_item=no-licensor=1-scope=1-npi_present=1	1		no girls would ever say that the actors will bike to the bank .
experiment=NPI-env=negation-npi=ever-crucial_item=no-licensor=1-scope=1-npi_present=0	1		no girls would often say that the actors will bike to the bank .
experiment=NPI-env=negation-npi=ever-crucial_item=some-licensor=0-scope=1-npi_present=0	1		Some girls would often say that the actors will bike to the bank .
experiment=NPI-env=negation-npi=ever-crucial_item=no-licensor=1-scope=0-npi_present=1	0		the gal did ever think that no guys have worried .
experiment=NPI-env=negation-npi=ever-crucial_item=no-licensor=1-scope=0-npi_present=0	1		the gal did often think that no guys have worried .
experiment=NPI-env=negation-npi=ever-crucial_item=some-licensor=0-scope=1-npi_present=1	0		Some gal did ever think that the guys have worried .
experiment=NPI-env=negation-npi=ever-crucial_item=some-licensor=0-scope=0-npi_present=1	0		the gal did ever think that some guys have worried .
experiment=NPI-env=negation-npi=ever-crucial_item=no-licensor=1-scope=1-npi_present=0	1		no pedestrians were often imagining that the doctor was running around the school .
experiment=NPI-env=negation-npi=ever-crucial_item=some-licensor=0-scope=1-npi_present=1	0		Some pedestrians were ever imagining that the doctor was running around the school .
experiment=NPI-env=negation-npi=ever-crucial_item=some-licensor=0-scope=0-npi_present=1	0		the pedestrians were ever imagining that some doctor was running around the school .
experiment=NPI-env=negation-npi=ever-crucial_item=no-licensor=1-scope=1-npi_present=0	1		no patients had often thought that the students toured the movie theater .
experiment=NPI-env=negation-npi=ever-crucial_item=no-licensor=1-scope=0-npi_present=1	0		the patients had ever thought that no students toured the movie theater .
experiment=NPI-env=negation-npi=ever-crucial_item=some-licensor=0-scope=0-npi_present=1	0		the patients had ever thought that some students toured the movie theater .
experiment=NPI-env=negation-npi=ever-crucial_item=some-licensor=0-scope=0-npi_present=0	1		the patients had often thought that some students toured the movie theater .
experiment=NPI-env=negation-npi=ever-crucial_item=some-licensor=0-scope=1-npi_present=1	0		Some guys ever think that the ladies are dating .
experiment=NPI-env=negation-npi=ever-crucial_item=some-licensor=0-scope=1-npi_present=0	1		Some guys often think that the ladies are dating .
experiment=NPI-env=negation-npi=ever-crucial_item=some-licensor=0-scope=0-npi_present=0	1		the guys often think that some ladies are dating .
experiment=NPI-env=negation-npi=ever-crucial_item=no-licensor=1-scope=0-npi_present=0	1		the students often imagined that no men kiss .
experiment=NPI-env=negation-npi=ever-crucial_item=no-licensor=1-scope=1-npi_present=1	1		no waitresses ever imagined that the doctor would scratch .
experiment=NPI-env=negation-npi=ever-crucial_item=no-licensor=1-scope=1-npi_present=0	1		no waitresses often imagined that the doctor would scratch .
experiment=NPI-env=negation-npi=ever-crucial_item=some-licensor=0-scope=1-npi_present=1	0		Some waitresses ever imagined that the doctor would scratch .
experiment=NPI-env=negation-npi=ever-crucial_item=no-licensor=1-scope=1-npi_present=0	1		no teenagers would often imagine that a child has disliked the people .
experiment=NPI-env=negation-npi=ever-crucial_item=some-licensor=0-scope=1-npi_present=0	1		Some teenagers would often imagine that a child has disliked the people .
experiment=NPI-env=negation-npi=ever-crucial_item=some-licensor=0-scope=0-npi_present=1	0		the teenagers would ever imagine that some child has disliked the people .
experiment=NPI-env=negation-npi=ever-crucial_item=some-licensor=0-scope=0-npi_present=1	0		the girls ever explain that some guys approach the children .
experiment=NPI-env=negation-npi=ever-crucial_item=no-licensor=1-scope=1-npi_present=1	1		no boys have ever explained that the boy has shouted .
experiment=NPI-env=negation-npi=ever-crucial_item=no-licensor=1-scope=1-npi_present=0	1		no boys have often explained that the boy has shouted .
experiment=NPI-env=negation-npi=ever-crucial_item=some-licensor=0-scope=1-npi_present=0	1		Some boys have often explained that the boy has shouted .
experiment=NPI-env=negation-npi=ever-crucial_item=no-licensor=1-scope=1-npi_present=0	1		no guy is often thinking that a girl fled from the high schools .
experiment=NPI-env=negation-npi=ever-crucial_item=no-licensor=1-scope=0-npi_present=1	0		the guy is ever thinking that no girl fled from the high schools .
experiment=NPI-env=negation-npi=ever-crucial_item=no-licensor=1-scope=0-npi_present=0	1		the guy is often thinking that no girl fled from the high schools .
experiment=NPI-env=negation-npi=ever-crucial_item=no-licensor=1-scope=1-npi_present=1	1		no guys will ever think that the children boasted .
experiment=NPI-env=negation-npi=ever-crucial_item=no-licensor=1-scope=1-npi_present=1	1		no actresses have ever explained that the actresses have remembered an commentary .
experiment=NPI-env=negation-npi=ever-crucial_item=no-licensor=1-scope=0-npi_present=1	0		the actresses have ever explained that no actresses have remembered an commentary .
experiment=NPI-env=negation-npi=ever-crucial_item=some-licensor=0-scope=1-npi_present=0	1		Some actresses have often explained that the actresses have remembered an commentary .
experiment=NPI-env=negation-npi=ever-crucial_item=no-licensor=1-scope=0-npi_present=1	0		a waitress has ever imagined that no customers were boycotting the art galleries .
experiment=NPI-env=negation-npi=ever-crucial_item=some-licensor=0-scope=1-npi_present=0	1		Some waitress has often imagined that the customers were boycotting the art galleries .
experiment=NPI-env=negation-npi=ever-crucial_item=some-licensor=0-scope=0-npi_present=1	0		a waitress has ever imagined that some customers were boycotting the art galleries .
experiment=NPI-env=negation-npi=in years-crucial_item=no-licensor=1-scope=1-npi_present=1	1		no cashier has thought that the humans walk through the public parks in years .
experiment=NPI-env=negation-npi=in years-crucial_item=no-licensor=1-scope=0-npi_present=1	0		the cashier has thought that no humans walk through the public parks in years .
experiment=NPI-env=negation-npi=in years-crucial_item=some-licensor=0-scope=1-npi_present=0	1		Some cashier has thought that the humans walk through the public parks sometimes .
experiment=NPI-env=negation-npi=in years-crucial_item=some-licensor=0-scope=0-npi_present=1	0		the cashier has thought that some humans walk through the public parks in years .
experiment=NPI-env=negation-npi=in years-crucial_item=some-licensor=0-scope=0-npi_present=0	1		the cashier has thought that some humans walk through the public parks sometimes .
experiment=NPI-env=negation-npi=yet-crucial_item=no-licensor=1-scope=1-npi_present=1	1		no patient imagines that the man nodded yet .
experiment=NPI-env=negation-npi=yet-crucial_item=some-licensor=0-scope=1-npi_present=0	1		Some patient imagines that the man nodded sometimes .
experiment=NPI-env=negation-npi=in years-crucial_item=no-licensor=1-scope=1-npi_present=0	1		no doctor is thinking that a guy does approve regularly .
experiment=NPI-env=negation-npi=in years-crucial_item=no-licensor=1-scope=0-npi_present=0	1		a doctor is thinking that no guy does approve regularly .
experiment=NPI-env=negation-npi=in years-crucial_item=some-licensor=0-scope=0-npi_present=1	0		a doctor is thinking that some guy does approve in years .
experiment=NPI-env=negation-npi=in years-crucial_item=no-licensor=1-scope=0-npi_present=0	1		the patients imagine that no lady retaliated sometimes .
experiment=NPI-env=negation-npi=in years-crucial_item=some-licensor=0-scope=0-npi_present=0	1		the patients imagine that some lady retaliated sometimes .
experiment=NPI-env=negation-npi=at all-crucial_item=no-licensor=1-scope=0-npi_present=0	1		the patients should think that no actors have lifted the pamphlet regularly .
experiment=NPI-env=negation-npi=at all-crucial_item=some-licensor=0-scope=1-npi_present=0	1		Some patients should think that the actors have lifted the pamphlet regularly .
experiment=NPI-env=negation-npi=at all-crucial_item=some-licensor=0-scope=0-npi_present=0	1		the patients should think that some actors have lifted the pamphlet regularly .
experiment=NPI-env=negation-npi=at all-crucial_item=no-licensor=1-scope=0-npi_present=0	1		the girls think that no guests had explored the hospitals sometimes .
experiment=NPI-env=negation-npi=at all-crucial_item=no-licensor=1-scope=1-npi_present=0	1		no doctor could explain that the people could wear the shoes on weekends .
experiment=NPI-env=negation-npi=at all-crucial_item=some-licensor=0-scope=0-npi_present=1	0		the doctor could explain that some people could wear the shoes at all .
experiment=NPI-env=negation-npi=at all-crucial_item=some-licensor=0-scope=0-npi_present=0	1		the doctor could explain that some people could wear the shoes on weekends .
experiment=NPI-env=negation-npi=at all-crucial_item=no-licensor=1-scope=0-npi_present=0	1		the cashiers say that no man yelled sometimes .
experiment=NPI-env=negation-npi=in years-crucial_item=no-licensor=1-scope=1-npi_present=0	1		no patient said that a man is slumping over regularly .
experiment=NPI-env=negation-npi=in years-crucial_item=no-licensor=1-scope=0-npi_present=0	1		a patient said that no man is slumping over regularly .
