experiment=NPI-env=negation-npi=yet-crucial_item=some-licensor=0-scope=1-npi_present=1	0		Some women have dropped by the teachers yet .
experiment=NPI-env=negation-npi=yet-crucial_item=some-licensor=0-scope=1-npi_present=0	1		Some women have dropped by the teachers sometimes .
experiment=NPI-env=negation-npi=in years-crucial_item=no-licensor=1-scope=1-npi_present=0	1		no pedestrian has loved the guests sometimes .
experiment=NPI-env=negation-npi=in years-crucial_item=no-licensor=1-scope=0-npi_present=0	1		a pedestrian has loved no guests sometimes .
experiment=NPI-env=negation-npi=in years-crucial_item=some-licensor=0-scope=0-npi_present=1	0		a pedestrian has loved some guests in years .
experiment=NPI-env=negation-npi=yet-crucial_item=no-licensor=1-scope=1-npi_present=1	1		no girl boycotted the boys yet .
experiment=NPI-env=negation-npi=yet-crucial_item=some-licensor=0-scope=1-npi_present=1	0		Some girl boycotted the boys yet .
experiment=NPI-env=negation-npi=yet-crucial_item=some-licensor=0-scope=1-npi_present=0	1		Some girl boycotted the boys sometimes .
experiment=NPI-env=negation-npi=yet-crucial_item=some-licensor=0-scope=0-npi_present=0	1		the girl boycotted some boys sometimes .
experiment=NPI-env=negation-npi=at all-crucial_item=no-licensor=1-scope=0-npi_present=0	1		the students have seen no doctor sometimes .
experiment=NPI-env=negation-npi=at all-crucial_item=some-licensor=0-scope=1-npi_present=0	1		Some students have seen the doctor sometimes .
experiment=NPI-env=negation-npi=at all-crucial_item=some-licensor=0-scope=0-npi_present=0	1		the students have seen some doctor sometimes .
experiment=NPI-env=negation-npi=yet-crucial_item=no-licensor=1-scope=1-npi_present=1	1		no girl did examine the teachers yet .
experiment=NPI-env=negation-npi=yet-crucial_item=no-licensor=1-scope=0-npi_present=0	1		a girl did examine no teachers sometimes .
experiment=NPI-env=negation-npi=yet-crucial_item=some-licensor=0-scope=0-npi_present=1	0		a girl did examine some teachers yet .
experiment=NPI-env=negation-npi=at all-crucial_item=no-licensor=1-scope=1-npi_present=0	1		no person observes a teenager sometimes .
experiment=NPI-env=negation-npi=at all-crucial_item=some-licensor=0-scope=1-npi_present=0	1		Some person observes a teenager sometimes .
experiment=NPI-env=negation-npi=at all-crucial_item=some-licensor=0-scope=0-npi_present=1	0		the person observes some teenager at all .
experiment=NPI-env=negation-npi=in years-crucial_item=no-licensor=1-scope=0-npi_present=0	1		a woman should praise no child sometimes .
experiment=NPI-env=negation-npi=in years-crucial_item=no-licensor=1-scope=1-npi_present=1	1		no woman attacks the children in years .
experiment=NPI-env=negation-npi=in years-crucial_item=no-licensor=1-scope=0-npi_present=1	1		a woman attacks no children in years .
experiment=NPI-env=negation-npi=in years-crucial_item=some-licensor=0-scope=1-npi_present=1	0		Some woman attacks the children in years .
experiment=NPI-env=negation-npi=yet-crucial_item=some-licensor=0-scope=1-npi_present=1	0		Some doctors leave the guests yet .
experiment=NPI-env=negation-npi=yet-crucial_item=some-licensor=0-scope=1-npi_present=0	1		Some doctors leave the guests sometimes .
experiment=NPI-env=negation-npi=in years-crucial_item=no-licensor=1-scope=1-npi_present=1	1		no girls would drop by a woman in years .
experiment=NPI-env=negation-npi=in years-crucial_item=no-licensor=1-scope=1-npi_present=0	1		no girls would drop by a woman sometimes .
experiment=NPI-env=negation-npi=in years-crucial_item=some-licensor=0-scope=0-npi_present=1	0		the girls would drop by some woman in years .
experiment=NPI-env=negation-npi=yet-crucial_item=no-licensor=1-scope=1-npi_present=0	1		no boys listen to the children sometimes .
experiment=NPI-env=negation-npi=yet-crucial_item=some-licensor=0-scope=1-npi_present=1	0		Some boys listen to the children yet .
experiment=NPI-env=negation-npi=yet-crucial_item=some-licensor=0-scope=0-npi_present=1	0		the boys listen to some children yet .
experiment=NPI-env=negation-npi=yet-crucial_item=some-licensor=0-scope=0-npi_present=0	1		the boys listen to some children sometimes .
experiment=NPI-env=negation-npi=at all-crucial_item=no-licensor=1-scope=1-npi_present=0	1		no girls visited the waiters sometimes .
experiment=NPI-env=negation-npi=at all-crucial_item=some-licensor=0-scope=0-npi_present=0	1		the girls visited some waiters sometimes .
experiment=NPI-env=negation-npi=yet-crucial_item=no-licensor=1-scope=1-npi_present=1	1		no guests dislike the men yet .
experiment=NPI-env=negation-npi=yet-crucial_item=no-licensor=1-scope=0-npi_present=0	1		the guests dislike no men sometimes .
experiment=NPI-env=negation-npi=yet-crucial_item=some-licensor=0-scope=1-npi_present=0	1		Some guests dislike the men sometimes .
experiment=NPI-env=negation-npi=yet-crucial_item=some-licensor=0-scope=0-npi_present=0	1		the guests dislike some men sometimes .
experiment=NPI-env=negation-npi=ever-crucial_item=not-licensor=1-scope=1-npi_present=1	1		the guys were not ever thinking that the waiters have dropped by the cafes .
experiment=NPI-env=negation-npi=ever-crucial_item=really-licensor=0-scope=0-npi_present=1	0		the guys were ever thinking that the waiters have really dropped by the cafes .
experiment=NPI-env=negation-npi=ever-crucial_item=not-licensor=1-scope=1-npi_present=1	1		the pedestrian not ever explained that a girl approaches the alumnus .
experiment=NPI-env=negation-npi=ever-crucial_item=not-licensor=1-scope=0-npi_present=1	0		the pedestrian ever explained that a girl not approaches the alumnus .
experiment=NPI-env=negation-npi=ever-crucial_item=really-licensor=0-scope=1-npi_present=1	0		the pedestrian really ever explained that a girl approaches the alumnus .
experiment=NPI-env=negation-npi=ever-crucial_item=really-licensor=0-scope=0-npi_present=0	1		the pedestrian often explained that a girl approaches really the alumnus .
experiment=NPI-env=negation-npi=ever-crucial_item=really-licensor=0-scope=1-npi_present=0	1		the girls have really often imagined that a doctor benefited .
experiment=NPI-env=negation-npi=ever-crucial_item=really-licensor=0-scope=0-npi_present=1	0		the girls have ever imagined that a doctor really benefited .
experiment=NPI-env=negation-npi=ever-crucial_item=not-licensor=1-scope=1-npi_present=0	1		a human not often thinks that a patient is helping the oxen .
experiment=NPI-env=negation-npi=ever-crucial_item=not-licensor=1-scope=0-npi_present=1	0		a human ever thinks that a patient is not helping the oxen .
experiment=NPI-env=negation-npi=ever-crucial_item=not-licensor=1-scope=0-npi_present=0	1		a human often thinks that a patient is not helping the oxen .
experiment=NPI-env=negation-npi=ever-crucial_item=really-licensor=0-scope=0-npi_present=1	0		a human ever thinks that a patient is really helping the oxen .
experiment=NPI-env=negation-npi=ever-crucial_item=not-licensor=1-scope=0-npi_present=1	0		the patients had ever thought that the waitresses might not drop by the schools .
experiment=NPI-env=negation-npi=ever-crucial_item=really-licensor=0-scope=1-npi_present=1	0		the patients had really ever thought that the waitresses might drop by the schools .
experiment=NPI-env=negation-npi=ever-crucial_item=really-licensor=0-scope=1-npi_present=0	1		the patients had really often thought that the waitresses might drop by the schools .
experiment=NPI-env=negation-npi=ever-crucial_item=really-licensor=0-scope=0-npi_present=0	1		the patients had often thought that the waitresses might drop by really the schools .
experiment=NPI-env=negation-npi=ever-crucial_item=not-licensor=1-scope=1-npi_present=1	1		an actor not ever thought that the guy does pass the museums .
experiment=NPI-env=negation-npi=ever-crucial_item=not-licensor=1-scope=1-npi_present=0	1		an actor not often thought that the guy does pass the museums .
experiment=NPI-env=negation-npi=ever-crucial_item=not-licensor=1-scope=0-npi_present=1	0		an actor ever thought that the guy does not pass the museums .
experiment=NPI-env=negation-npi=ever-crucial_item=really-licensor=0-scope=0-npi_present=1	0		an actor ever thought that the guy does really pass the museums .
experiment=NPI-env=negation-npi=ever-crucial_item=not-licensor=1-scope=1-npi_present=1	1		the guy is not ever thinking that the cashiers explore the public parks .
experiment=NPI-env=negation-npi=ever-crucial_item=not-licensor=1-scope=1-npi_present=0	1		the guy is not often thinking that the cashiers explore the public parks .
experiment=NPI-env=negation-npi=ever-crucial_item=really-licensor=0-scope=0-npi_present=1	0		the guy is ever thinking that the cashiers really explore the public parks .
experiment=NPI-env=negation-npi=ever-crucial_item=really-licensor=0-scope=0-npi_present=0	1		the guy is often thinking that the cashiers explore really the public parks .
experiment=NPI-env=negation-npi=ever-crucial_item=not-licensor=1-scope=1-npi_present=1	1		the actor will not ever explain that the patients sit down .
experiment=NPI-env=negation-npi=ever-crucial_item=really-licensor=0-scope=0-npi_present=0	1		the actor will often explain that the patients sit down really .
experiment=NPI-env=negation-npi=ever-crucial_item=not-licensor=1-scope=1-npi_present=1	1		the teenager could not ever think that the women nodded .
experiment=NPI-env=negation-npi=ever-crucial_item=really-licensor=0-scope=1-npi_present=1	0		the teenager could really ever think that the women nodded .
experiment=NPI-env=negation-npi=ever-crucial_item=really-licensor=0-scope=0-npi_present=1	0		the teenager could ever think that the women really nodded .
experiment=NPI-env=negation-npi=ever-crucial_item=really-licensor=0-scope=0-npi_present=0	1		the teenager could often think that the women nodded really .
experiment=NPI-env=negation-npi=ever-crucial_item=not-licensor=1-scope=1-npi_present=0	1		the students were not often imagining that a doctor could arrive at the movie theaters .
experiment=NPI-env=negation-npi=ever-crucial_item=really-licensor=0-scope=1-npi_present=1	0		the students were really ever imagining that a doctor could arrive at the movie theaters .
experiment=NPI-env=negation-npi=ever-crucial_item=really-licensor=0-scope=1-npi_present=0	1		the students were really often imagining that a doctor could arrive at the movie theaters .
experiment=NPI-env=negation-npi=ever-crucial_item=not-licensor=1-scope=1-npi_present=1	1		the humans had not ever thought that the guests should approve .
experiment=NPI-env=negation-npi=ever-crucial_item=not-licensor=1-scope=1-npi_present=0	1		the humans had not often thought that the guests should approve .
experiment=NPI-env=negation-npi=ever-crucial_item=not-licensor=1-scope=0-npi_present=0	1		the humans had often thought that the guests should not approve .
experiment=NPI-env=negation-npi=ever-crucial_item=really-licensor=0-scope=1-npi_present=0	1		the humans had really often thought that the guests should approve .
experiment=NPI-env=negation-npi=ever-crucial_item=really-licensor=0-scope=0-npi_present=1	0		the humans had ever thought that the guests should really approve .
experiment=NPI-env=negation-npi=ever-crucial_item=not-licensor=1-scope=1-npi_present=1	1		the man has not ever imagined that the waiter slumps over .
experiment=NPI-env=negation-npi=ever-crucial_item=not-licensor=1-scope=1-npi_present=0	1		a teacher not often imagines that a driver had the brochures .
experiment=NPI-env=negation-npi=ever-crucial_item=not-licensor=1-scope=0-npi_present=1	0		a teacher ever imagines that a driver not had the brochures .
experiment=NPI-env=negation-npi=ever-crucial_item=not-licensor=1-scope=0-npi_present=0	1		a teacher often imagines that a driver not had the brochures .
experiment=NPI-env=negation-npi=ever-crucial_item=really-licensor=0-scope=1-npi_present=0	1		a teacher really often imagines that a driver had the brochures .
experiment=NPI-env=negation-npi=ever-crucial_item=really-licensor=0-scope=0-npi_present=1	0		the gal ever explains that the drivers were really reacting .
experiment=NPI-env=negation-npi=ever-crucial_item=not-licensor=1-scope=1-npi_present=1	1		the pedestrian not ever imagined that the children have nodded .
experiment=NPI-env=negation-npi=ever-crucial_item=not-licensor=1-scope=1-npi_present=0	1		the pedestrian not often imagined that the children have nodded .
experiment=NPI-env=negation-npi=ever-crucial_item=really-licensor=0-scope=1-npi_present=1	0		the pedestrian really ever imagined that the children have nodded .
experiment=NPI-env=negation-npi=ever-crucial_item=really-licensor=0-scope=0-npi_present=0	1		the pedestrian often imagined that the children have nodded really .
experiment=NPI-env=negation-npi=ever-crucial_item=not-licensor=1-scope=0-npi_present=0	1		the guests often imagined that the people not insulted the high schools .
experiment=NPI-env=negation-npi=ever-crucial_item=really-licensor=0-scope=1-npi_present=0	1		the guests really often imagined that the people insulted the high schools .
experiment=NPI-env=negation-npi=ever-crucial_item=not-licensor=1-scope=1-npi_present=0	1		a guest was not often saying that the actors have worked with the children .
experiment=NPI-env=negation-npi=ever-crucial_item=not-licensor=1-scope=0-npi_present=1	0		a guest was ever saying that the actors have not worked with the children .
experiment=NPI-env=negation-npi=ever-crucial_item=really-licensor=0-scope=0-npi_present=0	1		a guest was often saying that the actors have worked with really the children .
experiment=NPI-env=negation-npi=ever-crucial_item=not-licensor=1-scope=1-npi_present=1	1		the girls might not ever say that the patients tour the art galleries .
experiment=NPI-env=negation-npi=ever-crucial_item=not-licensor=1-scope=0-npi_present=1	0		the girls might ever say that the patients not tour the art galleries .
experiment=NPI-env=negation-npi=ever-crucial_item=not-licensor=1-scope=0-npi_present=1	0		a lady was ever explaining that the waitresses had not known the students .
experiment=NPI-env=negation-npi=ever-crucial_item=not-licensor=1-scope=0-npi_present=0	1		a lady was often explaining that the waitresses had not known the students .
experiment=NPI-env=negation-npi=ever-crucial_item=not-licensor=1-scope=0-npi_present=0	1		a doctor will often say that the doctors were not exiting the mall .
experiment=NPI-env=negation-npi=ever-crucial_item=really-licensor=0-scope=1-npi_present=0	1		a doctor will really often say that the doctors were exiting the mall .
experiment=NPI-env=negation-npi=ever-crucial_item=really-licensor=0-scope=1-npi_present=1	0		a waitress really ever explains that the students had collaborated .
experiment=NPI-env=negation-npi=ever-crucial_item=really-licensor=0-scope=0-npi_present=1	0		a waitress ever explains that the students had really collaborated .
experiment=NPI-env=negation-npi=ever-crucial_item=really-licensor=0-scope=0-npi_present=0	1		a waitress often explains that the students had collaborated really .
experiment=NPI-env=negation-npi=ever-crucial_item=not-licensor=1-scope=0-npi_present=1	0		the doctors are ever saying that the gals are not approving .
experiment=NPI-env=negation-npi=ever-crucial_item=really-licensor=0-scope=0-npi_present=1	0		the doctors are ever saying that the gals are really approving .
experiment=NPI-env=negation-npi=ever-crucial_item=really-licensor=0-scope=0-npi_present=0	1		the doctors are often saying that the gals are approving really .
experiment=NPI-env=negation-npi=ever-crucial_item=not-licensor=1-scope=0-npi_present=1	0		the man has ever explained that the guests did not learn .
experiment=NPI-env=negation-npi=ever-crucial_item=really-licensor=0-scope=1-npi_present=0	1		the man has really often explained that the guests did learn .
experiment=NPI-env=negation-npi=ever-crucial_item=not-licensor=1-scope=0-npi_present=0	1		the drivers would often explain that the actress not walks through the cafe .
experiment=NPI-env=negation-npi=ever-crucial_item=not-licensor=1-scope=1-npi_present=0	1		the boys have not often imagined that the guests practice .
experiment=NPI-env=negation-npi=ever-crucial_item=really-licensor=0-scope=1-npi_present=1	0		the boys have really ever imagined that the guests practice .
experiment=NPI-env=negation-npi=ever-crucial_item=really-licensor=0-scope=1-npi_present=0	1		the boys have really often imagined that the guests practice .
experiment=NPI-env=negation-npi=ever-crucial_item=really-licensor=0-scope=1-npi_present=1	0		the patient has really ever said that the guys will bring the forks .
experiment=NPI-env=negation-npi=ever-crucial_item=really-licensor=0-scope=0-npi_present=1	0		the patient has ever said that the guys will really bring the forks .
experiment=NPI-env=negation-npi=ever-crucial_item=not-licensor=1-scope=1-npi_present=1	1		the man was not ever explaining that the cashiers are approaching the lady .
experiment=NPI-env=negation-npi=ever-crucial_item=not-licensor=1-scope=1-npi_present=0	1		the man was not often explaining that the cashiers are approaching the lady .
experiment=NPI-env=negation-npi=ever-crucial_item=not-licensor=1-scope=0-npi_present=1	0		the man was ever explaining that the cashiers are not approaching the lady .
experiment=NPI-env=negation-npi=ever-crucial_item=not-licensor=1-scope=0-npi_present=0	1		the man was often explaining that the cashiers are not approaching the lady .
experiment=NPI-env=negation-npi=ever-crucial_item=really-licensor=0-scope=1-npi_present=1	0		the man was really ever explaining that the cashiers are approaching the lady .
experiment=NPI-env=negation-npi=ever-crucial_item=really-licensor=0-scope=0-npi_present=1	0		the man was ever explaining that the cashiers are really approaching the lady .
experiment=NPI-env=negation-npi=ever-crucial_item=really-licensor=0-scope=0-npi_present=0	1		the man was often explaining that the cashiers are approaching really the lady .
experiment=NPI-env=negation-npi=ever-crucial_item=not-licensor=1-scope=1-npi_present=0	1		the humans not often say that the patients have conspired .
experiment=NPI-env=negation-npi=ever-crucial_item=really-licensor=0-scope=1-npi_present=0	1		the humans really often say that the patients have conspired .
experiment=NPI-env=negation-npi=ever-crucial_item=really-licensor=0-scope=0-npi_present=0	1		the humans often say that the patients have conspired really .
experiment=NPI-env=negation-npi=ever-crucial_item=not-licensor=1-scope=1-npi_present=1	1		the girls were not ever imagining that the guests had exited the college campuses .
experiment=NPI-env=negation-npi=ever-crucial_item=not-licensor=1-scope=0-npi_present=1	0		the girls were ever imagining that the guests had not exited the college campuses .
experiment=NPI-env=negation-npi=ever-crucial_item=not-licensor=1-scope=0-npi_present=0	1		the girls were often imagining that the guests had not exited the college campuses .
experiment=NPI-env=negation-npi=ever-crucial_item=really-licensor=0-scope=0-npi_present=0	1		the girls were often imagining that the guests had exited really the college campuses .
experiment=NPI-env=negation-npi=ever-crucial_item=not-licensor=1-scope=1-npi_present=1	1		the humans could not ever say that the guest could blink .
experiment=NPI-env=negation-npi=ever-crucial_item=really-licensor=0-scope=1-npi_present=0	1		the humans could really often say that the guest could blink .
experiment=NPI-env=negation-npi=ever-crucial_item=really-licensor=0-scope=0-npi_present=1	0		the humans could ever say that the guest could really blink .
experiment=NPI-env=negation-npi=ever-crucial_item=really-licensor=0-scope=0-npi_present=0	1		the humans could often say that the guest could blink really .
experiment=NPI-env=negation-npi=ever-crucial_item=not-licensor=1-scope=1-npi_present=0	1		the women not often say that the humans stood up .
experiment=NPI-env=negation-npi=ever-crucial_item=not-licensor=1-scope=0-npi_present=0	1		the women often say that the humans not stood up .
experiment=NPI-env=negation-npi=ever-crucial_item=really-licensor=0-scope=1-npi_present=0	1		the women really often say that the humans stood up .
experiment=NPI-env=negation-npi=ever-crucial_item=really-licensor=0-scope=0-npi_present=0	1		the women often say that the humans stood up really .
experiment=NPI-env=negation-npi=ever-crucial_item=not-licensor=1-scope=1-npi_present=1	1		the gals not ever said that the patients had praised the cashier .
experiment=NPI-env=negation-npi=ever-crucial_item=really-licensor=0-scope=1-npi_present=0	1		the gals really often said that the patients had praised the cashier .
experiment=NPI-env=negation-npi=ever-crucial_item=really-licensor=0-scope=0-npi_present=0	1		the gals often said that the patients had praised really the cashier .
experiment=NPI-env=negation-npi=ever-crucial_item=not-licensor=1-scope=1-npi_present=1	1		the boy was not ever thinking that a girl coped .
experiment=NPI-env=negation-npi=ever-crucial_item=not-licensor=1-scope=0-npi_present=0	1		the boy was often thinking that a girl not coped .
experiment=NPI-env=negation-npi=ever-crucial_item=really-licensor=0-scope=0-npi_present=1	0		the boy was ever thinking that a girl really coped .
experiment=NPI-env=negation-npi=ever-crucial_item=really-licensor=0-scope=0-npi_present=0	1		the boy was often thinking that a girl coped really .
experiment=NPI-env=negation-npi=ever-crucial_item=not-licensor=1-scope=1-npi_present=0	1		an actor not often thought that the drivers were forfeiting .
experiment=NPI-env=negation-npi=ever-crucial_item=not-licensor=1-scope=1-npi_present=1	1		the ladies not ever imagined that a person hugged the driver .
experiment=NPI-env=negation-npi=ever-crucial_item=really-licensor=0-scope=1-npi_present=0	1		the ladies really often imagined that a person hugged the driver .
experiment=NPI-env=negation-npi=ever-crucial_item=not-licensor=1-scope=0-npi_present=1	0		the teacher should ever say that the pedestrian not yells .
experiment=NPI-env=negation-npi=ever-crucial_item=really-licensor=0-scope=0-npi_present=1	0		the teacher should ever say that the pedestrian really yells .
experiment=NPI-env=negation-npi=ever-crucial_item=really-licensor=0-scope=0-npi_present=0	1		the teacher should often say that the pedestrian yells really .
experiment=NPI-env=negation-npi=ever-crucial_item=really-licensor=0-scope=0-npi_present=1	0		the waiters have ever explained that a driver is really seeing .
experiment=NPI-env=negation-npi=ever-crucial_item=really-licensor=0-scope=0-npi_present=0	1		the waiters have often explained that a driver is seeing really .
experiment=NPI-env=negation-npi=ever-crucial_item=not-licensor=1-scope=1-npi_present=1	1		the ladies are not ever thinking that the pedestrian grins .
experiment=NPI-env=negation-npi=ever-crucial_item=not-licensor=1-scope=0-npi_present=1	0		the ladies are ever thinking that the pedestrian not grins .
experiment=NPI-env=negation-npi=ever-crucial_item=not-licensor=1-scope=0-npi_present=1	0		the waiter was ever explaining that the doctor not donates .
experiment=NPI-env=negation-npi=ever-crucial_item=not-licensor=1-scope=1-npi_present=0	1		the teenagers will not often say that the children should grin .
experiment=NPI-env=negation-npi=ever-crucial_item=not-licensor=1-scope=0-npi_present=0	1		the customer often imagined that the adults not observe the teenagers .
experiment=NPI-env=negation-npi=ever-crucial_item=really-licensor=0-scope=1-npi_present=0	1		the customer really often imagined that the adults observe the teenagers .
experiment=NPI-env=negation-npi=ever-crucial_item=really-licensor=0-scope=0-npi_present=1	0		the customer ever imagined that the adults really observe the teenagers .
experiment=NPI-env=negation-npi=ever-crucial_item=not-licensor=1-scope=1-npi_present=1	1		a teacher is not ever saying that the children had watched the men .
experiment=NPI-env=negation-npi=ever-crucial_item=not-licensor=1-scope=0-npi_present=1	0		a teacher is ever saying that the children had not watched the men .
experiment=NPI-env=negation-npi=ever-crucial_item=really-licensor=0-scope=1-npi_present=1	0		a teacher is really ever saying that the children had watched the men .
experiment=NPI-env=negation-npi=ever-crucial_item=really-licensor=0-scope=1-npi_present=0	1		a teacher is really often saying that the children had watched the men .
experiment=NPI-env=negation-npi=ever-crucial_item=really-licensor=0-scope=0-npi_present=1	0		a teacher is ever saying that the children had really watched the men .
experiment=NPI-env=negation-npi=ever-crucial_item=really-licensor=0-scope=0-npi_present=0	1		a teacher is often saying that the children had watched really the men .
experiment=NPI-env=negation-npi=ever-crucial_item=not-licensor=1-scope=1-npi_present=0	1		the students were not often saying that the doctor had scanned the play .
experiment=NPI-env=negation-npi=ever-crucial_item=not-licensor=1-scope=0-npi_present=0	1		the students were often saying that the doctor had not scanned the play .
experiment=NPI-env=negation-npi=ever-crucial_item=really-licensor=0-scope=1-npi_present=1	0		the students were really ever saying that the doctor had scanned the play .
experiment=NPI-env=negation-npi=ever-crucial_item=really-licensor=0-scope=1-npi_present=0	1		the students were really often saying that the doctor had scanned the play .
experiment=NPI-env=negation-npi=ever-crucial_item=really-licensor=0-scope=0-npi_present=1	0		the students were ever saying that the doctor had really scanned the play .
experiment=NPI-env=negation-npi=ever-crucial_item=not-licensor=1-scope=0-npi_present=1	0		the waitresses had ever thought that a student not stretched .
experiment=NPI-env=negation-npi=ever-crucial_item=really-licensor=0-scope=1-npi_present=1	0		the waitresses had really ever thought that a student stretched .
experiment=NPI-env=negation-npi=ever-crucial_item=really-licensor=0-scope=0-npi_present=1	0		the waitresses had ever thought that a student really stretched .
