experiment=NPI-env=superlative-npi=ever-crucial_item=old-licensor=0-scope=1-npi_present=1	0		the adult references the old teacher that the lady had ever cared for .
experiment=NPI-env=superlative-npi=ever-crucial_item=old-licensor=0-scope=0-npi_present=1	0		the customers have ever criticized the old girls that the actress has respected .
experiment=NPI-env=superlative-npi=ever-crucial_item=old-licensor=1-scope=0-npi_present=0	1		the customers have also criticized the oldest girls that the actress has respected .
experiment=NPI-env=superlative-npi=ever-crucial_item=good-licensor=0-scope=1-npi_present=0	1		the customer had seen the good forks that the guy has also sold .
experiment=NPI-env=superlative-npi=ever-crucial_item=good-licensor=0-scope=0-npi_present=0	1		the customer had also seen the good forks that the guy has sold .
experiment=NPI-env=superlative-npi=ever-crucial_item=good-licensor=1-scope=0-npi_present=0	1		the customer had also seen the best forks that the guy has sold .
experiment=NPI-env=superlative-npi=ever-crucial_item=cheap-licensor=1-scope=1-npi_present=1	1		the drivers had passed the cheapest hospital that the doctors had ever returned to .
experiment=NPI-env=superlative-npi=ever-crucial_item=long-licensor=0-scope=0-npi_present=1	0		the child has ever sold the long books that the play had referenced .
experiment=NPI-env=superlative-npi=ever-crucial_item=good-licensor=0-scope=1-npi_present=1	0		the driver has referenced the good commentary that the people have ever loved .
experiment=NPI-env=superlative-npi=ever-crucial_item=good-licensor=0-scope=0-npi_present=1	0		the driver has ever referenced the good commentary that the people have loved .
experiment=NPI-env=superlative-npi=ever-crucial_item=good-licensor=0-scope=0-npi_present=0	1		the driver has also referenced the good commentary that the people have loved .
experiment=NPI-env=superlative-npi=ever-crucial_item=good-licensor=1-scope=0-npi_present=0	1		the driver has also referenced the best commentary that the people have loved .
experiment=NPI-env=superlative-npi=ever-crucial_item=important-licensor=0-scope=1-npi_present=0	1		the students resemble the important museum that the children have also visited .
experiment=NPI-env=superlative-npi=ever-crucial_item=important-licensor=0-scope=0-npi_present=0	1		the students also resemble the important museum that the children have visited .
experiment=NPI-env=superlative-npi=ever-crucial_item=important-licensor=1-scope=0-npi_present=1	0		the students ever resemble the most important museum that the children have visited .
experiment=NPI-env=superlative-npi=ever-crucial_item=cheap-licensor=0-scope=1-npi_present=0	1		the girls broke the cheap chairs that the patients have also taken .
experiment=NPI-env=superlative-npi=ever-crucial_item=cheap-licensor=0-scope=0-npi_present=1	0		the girls ever broke the cheap chairs that the patients have taken .
experiment=NPI-env=superlative-npi=ever-crucial_item=cheap-licensor=0-scope=0-npi_present=0	1		the girls also broke the cheap chairs that the patients have taken .
experiment=NPI-env=superlative-npi=ever-crucial_item=cheap-licensor=1-scope=1-npi_present=0	1		the girls broke the cheapest chairs that the patients have also taken .
experiment=NPI-env=superlative-npi=ever-crucial_item=cheap-licensor=1-scope=0-npi_present=1	0		the girls ever broke the cheapest chairs that the patients have taken .
experiment=NPI-env=superlative-npi=ever-crucial_item=fast-licensor=0-scope=1-npi_present=1	0		a cashier had visited the fast boy that the adults had ever cared for .
experiment=NPI-env=superlative-npi=ever-crucial_item=fast-licensor=1-scope=1-npi_present=1	1		a cashier had visited the fastest boy that the adults had ever cared for .
experiment=NPI-env=superlative-npi=ever-crucial_item=fast-licensor=1-scope=1-npi_present=0	1		a cashier had visited the fastest boy that the adults had also cared for .
experiment=NPI-env=superlative-npi=ever-crucial_item=old-licensor=0-scope=0-npi_present=0	1		the patients should also kiss the old girls that the guy has loved .
experiment=NPI-env=superlative-npi=ever-crucial_item=old-licensor=1-scope=0-npi_present=1	0		the patients should ever kiss the oldest girls that the guy has loved .
experiment=NPI-env=superlative-npi=ever-crucial_item=old-licensor=1-scope=0-npi_present=0	1		the patients should also kiss the oldest girls that the guy has loved .
experiment=NPI-env=superlative-npi=ever-crucial_item=fast-licensor=0-scope=0-npi_present=0	1		the doctors had also described the fast teachers that the cashier has watched .
experiment=NPI-env=superlative-npi=ever-crucial_item=fast-licensor=1-scope=1-npi_present=0	1		the doctors had described the fastest teachers that the cashier has also watched .
experiment=NPI-env=superlative-npi=ever-crucial_item=fast-licensor=1-scope=0-npi_present=0	1		the doctors had also described the fastest teachers that the cashier has watched .
experiment=NPI-env=superlative-npi=ever-crucial_item=popular-licensor=0-scope=0-npi_present=1	0		the person had ever described the popular public park that the actress has disliked .
experiment=NPI-env=superlative-npi=ever-crucial_item=popular-licensor=1-scope=1-npi_present=1	1		the person had described the most popular public park that the actress has ever disliked .
experiment=NPI-env=superlative-npi=ever-crucial_item=small-licensor=0-scope=0-npi_present=1	0		a child ever visited the small waitresses that the pedestrians have kissed .
experiment=NPI-env=superlative-npi=ever-crucial_item=small-licensor=0-scope=0-npi_present=0	1		a child also visited the small waitresses that the pedestrians have kissed .
experiment=NPI-env=superlative-npi=ever-crucial_item=small-licensor=1-scope=1-npi_present=0	1		a child visited the smallest waitresses that the pedestrians have also kissed .
experiment=NPI-env=superlative-npi=ever-crucial_item=small-licensor=1-scope=0-npi_present=0	1		a child also visited the smallest waitresses that the pedestrians have kissed .
experiment=NPI-env=superlative-npi=ever-crucial_item=bad-licensor=0-scope=1-npi_present=0	1		a person could buy the bad dishes that the guy has also admired .
experiment=NPI-env=superlative-npi=ever-crucial_item=bad-licensor=1-scope=0-npi_present=1	0		a person could ever buy the worst dishes that the guy has admired .
experiment=NPI-env=superlative-npi=ever-crucial_item=bad-licensor=1-scope=0-npi_present=0	1		a person could also buy the worst dishes that the guy has admired .
experiment=NPI-env=superlative-npi=ever-crucial_item=new-licensor=0-scope=1-npi_present=0	1		the lady cleans the new dishes that the doctor has also cleaned .
experiment=NPI-env=superlative-npi=ever-crucial_item=new-licensor=1-scope=1-npi_present=0	1		the lady cleans the newest dishes that the doctor has also cleaned .
experiment=NPI-env=superlative-npi=ever-crucial_item=fast-licensor=0-scope=1-npi_present=1	0		the students kissed the fast boys that the girl had ever returned to .
experiment=NPI-env=superlative-npi=ever-crucial_item=fast-licensor=0-scope=0-npi_present=1	0		the students ever kissed the fast boys that the girl had returned to .
experiment=NPI-env=superlative-npi=ever-crucial_item=fast-licensor=1-scope=1-npi_present=1	1		the students kissed the fastest boys that the girl had ever returned to .
experiment=NPI-env=superlative-npi=ever-crucial_item=fast-licensor=1-scope=0-npi_present=1	0		the students ever kissed the fastest boys that the girl had returned to .
experiment=NPI-env=superlative-npi=ever-crucial_item=serious-licensor=1-scope=0-npi_present=1	0		the teenager ever disliked the most serious ladies that the boy had investigated .
experiment=NPI-env=superlative-npi=ever-crucial_item=serious-licensor=1-scope=0-npi_present=0	1		the teenager also disliked the most serious ladies that the boy had investigated .
experiment=NPI-env=superlative-npi=ever-crucial_item=happy-licensor=1-scope=0-npi_present=1	0		the teachers should ever visit the happiest driver that the human had escaped from .
experiment=NPI-env=superlative-npi=ever-crucial_item=young-licensor=0-scope=1-npi_present=1	0		the pedestrians escaped from the young waitresses that the boys have ever talked to .
experiment=NPI-env=superlative-npi=ever-crucial_item=young-licensor=0-scope=1-npi_present=0	1		the pedestrians escaped from the young waitresses that the boys have also talked to .
experiment=NPI-env=superlative-npi=ever-crucial_item=young-licensor=0-scope=0-npi_present=0	1		the pedestrians also escaped from the young waitresses that the boys have talked to .
experiment=NPI-env=superlative-npi=ever-crucial_item=young-licensor=1-scope=1-npi_present=1	1		the pedestrians escaped from the youngest waitresses that the boys have ever talked to .
experiment=NPI-env=superlative-npi=ever-crucial_item=young-licensor=1-scope=0-npi_present=0	1		the pedestrians also escaped from the youngest waitresses that the boys have talked to .
experiment=NPI-env=superlative-npi=ever-crucial_item=serious-licensor=0-scope=0-npi_present=1	0		the man ever approaches the serious students that the teenager had criticized .
experiment=NPI-env=superlative-npi=ever-crucial_item=serious-licensor=0-scope=0-npi_present=0	1		the man also approaches the serious students that the teenager had criticized .
experiment=NPI-env=superlative-npi=ever-crucial_item=serious-licensor=1-scope=1-npi_present=0	1		the man approaches the most serious students that the teenager had also criticized .
experiment=NPI-env=superlative-npi=ever-crucial_item=bad-licensor=1-scope=1-npi_present=1	1		the person has described the worst hospital that the men had ever insulted .
experiment=NPI-env=superlative-npi=ever-crucial_item=bad-licensor=1-scope=0-npi_present=1	0		the person has ever described the worst hospital that the men had insulted .
experiment=NPI-env=superlative-npi=ever-crucial_item=nice-licensor=1-scope=0-npi_present=1	0		the adult ever saw the nicest waiters that the cashier had discussed .
experiment=NPI-env=superlative-npi=ever-crucial_item=big-licensor=0-scope=0-npi_present=1	0		the teenager ever described the big people that the driver has praised .
experiment=NPI-env=superlative-npi=ever-crucial_item=big-licensor=1-scope=1-npi_present=1	1		the teenager described the biggest people that the driver has ever praised .
experiment=NPI-env=superlative-npi=ever-crucial_item=big-licensor=1-scope=0-npi_present=1	0		the teenager ever described the biggest people that the driver has praised .
experiment=NPI-env=superlative-npi=ever-crucial_item=big-licensor=1-scope=0-npi_present=0	1		the teenager also described the biggest people that the driver has praised .
experiment=NPI-env=only-npi=ever-crucial_item=_-licensor=0-scope=0-npi_present=1	0		a customer had ever also lifted the plates .
experiment=NPI-env=only-npi=ever-crucial_item=_-licensor=0-scope=0-npi_present=0	1		a customer had often also lifted the plates .
experiment=NPI-env=only-npi=ever-crucial_item=_-licensor=1-scope=1-npi_present=1	1		only the teenager had ever watched the teenagers .
experiment=NPI-env=only-npi=ever-crucial_item=_-licensor=1-scope=0-npi_present=0	1		the teenager had often watched only the teenagers .
experiment=NPI-env=only-npi=ever-crucial_item=_-licensor=0-scope=1-npi_present=0	1		the patient might also sometimes love the children .
experiment=NPI-env=only-npi=ever-crucial_item=_-licensor=1-scope=1-npi_present=1	1		only the adult ever discusses the drivers .
experiment=NPI-env=only-npi=ever-crucial_item=_-licensor=0-scope=1-npi_present=0	1		the adult also sometimes discusses the drivers .
experiment=NPI-env=only-npi=ever-crucial_item=_-licensor=0-scope=0-npi_present=0	1		the adult sometimes also discusses the drivers .
experiment=NPI-env=only-npi=ever-crucial_item=_-licensor=1-scope=1-npi_present=0	1		only the student sometimes cleans the plates .
experiment=NPI-env=only-npi=ever-crucial_item=_-licensor=0-scope=1-npi_present=1	0		the humans also ever passed the high schools .
experiment=NPI-env=only-npi=ever-crucial_item=_-licensor=1-scope=1-npi_present=0	1		only the customer has now forgotten the doctors .
experiment=NPI-env=only-npi=ever-crucial_item=_-licensor=0-scope=1-npi_present=1	0		the customer has also ever forgotten the doctors .
experiment=NPI-env=only-npi=ever-crucial_item=_-licensor=0-scope=0-npi_present=1	0		the customer has ever also forgotten the doctors .
experiment=NPI-env=only-npi=ever-crucial_item=_-licensor=0-scope=0-npi_present=0	1		the customer has now also forgotten the doctors .
experiment=NPI-env=only-npi=ever-crucial_item=_-licensor=1-scope=1-npi_present=1	1		only a gal does ever pass the college campuses .
experiment=NPI-env=only-npi=ever-crucial_item=_-licensor=1-scope=1-npi_present=0	1		only a gal does always pass the college campuses .
experiment=NPI-env=only-npi=ever-crucial_item=_-licensor=0-scope=1-npi_present=1	0		a gal does also ever pass the college campuses .
experiment=NPI-env=only-npi=ever-crucial_item=_-licensor=0-scope=1-npi_present=0	1		a gal does also always pass the college campuses .
experiment=NPI-env=only-npi=ever-crucial_item=_-licensor=1-scope=1-npi_present=0	1		only the people do now examine the books .
experiment=NPI-env=only-npi=ever-crucial_item=_-licensor=1-scope=0-npi_present=1	0		the pedestrian ever remembers only the grocery stores .
experiment=NPI-env=only-npi=ever-crucial_item=_-licensor=1-scope=0-npi_present=0	1		the pedestrian sometimes remembers only the grocery stores .
experiment=NPI-env=only-npi=ever-crucial_item=_-licensor=0-scope=1-npi_present=0	1		the pedestrian also sometimes remembers the grocery stores .
experiment=NPI-env=only-npi=ever-crucial_item=_-licensor=0-scope=0-npi_present=1	0		the pedestrian ever also remembers the grocery stores .
experiment=NPI-env=only-npi=ever-crucial_item=_-licensor=1-scope=1-npi_present=1	1		only the patients have ever hugged the teenagers .
experiment=NPI-env=only-npi=ever-crucial_item=_-licensor=1-scope=1-npi_present=0	1		only the patients have sometimes hugged the teenagers .
experiment=NPI-env=only-npi=ever-crucial_item=_-licensor=1-scope=0-npi_present=1	0		the patients have ever hugged only the teenagers .
experiment=NPI-env=only-npi=ever-crucial_item=_-licensor=1-scope=0-npi_present=0	1		the patients have sometimes hugged only the teenagers .
experiment=NPI-env=only-npi=ever-crucial_item=_-licensor=0-scope=1-npi_present=0	1		the patients have also sometimes hugged the teenagers .
experiment=NPI-env=only-npi=ever-crucial_item=_-licensor=0-scope=0-npi_present=1	0		the girls have ever also kissed the girls .
experiment=NPI-env=only-npi=ever-crucial_item=_-licensor=1-scope=0-npi_present=1	0		the waitresses have ever observed only the gals .
experiment=NPI-env=only-npi=ever-crucial_item=_-licensor=1-scope=0-npi_present=1	0		a girl ever loves only the gals .
experiment=NPI-env=only-npi=ever-crucial_item=_-licensor=0-scope=1-npi_present=0	1		a girl also sometimes loves the gals .
experiment=NPI-env=only-npi=ever-crucial_item=_-licensor=0-scope=0-npi_present=1	0		a girl ever also loves the gals .
experiment=NPI-env=only-npi=ever-crucial_item=_-licensor=1-scope=1-npi_present=1	1		only the customer had ever passed the schools .
experiment=NPI-env=only-npi=ever-crucial_item=_-licensor=0-scope=1-npi_present=1	0		the customer had also ever passed the schools .
experiment=NPI-env=only-npi=ever-crucial_item=_-licensor=0-scope=1-npi_present=0	1		the customer had also often passed the schools .
experiment=NPI-env=only-npi=ever-crucial_item=_-licensor=0-scope=1-npi_present=1	0		a doctor had also ever dropped by the restaurants .
experiment=NPI-env=only-npi=ever-crucial_item=_-licensor=1-scope=1-npi_present=0	1		only the boy now talks about the college campuses .
experiment=NPI-env=only-npi=ever-crucial_item=_-licensor=1-scope=0-npi_present=0	1		the boy now talks about only the college campuses .
experiment=NPI-env=only-npi=ever-crucial_item=_-licensor=0-scope=1-npi_present=1	0		the boy also ever talks about the college campuses .
experiment=NPI-env=only-npi=ever-crucial_item=_-licensor=1-scope=1-npi_present=0	1		only the actors often loved the teachers .
experiment=NPI-env=only-npi=ever-crucial_item=_-licensor=1-scope=0-npi_present=1	0		the actors ever loved only the teachers .
experiment=NPI-env=only-npi=ever-crucial_item=_-licensor=0-scope=1-npi_present=0	1		the actors also often loved the teachers .
experiment=NPI-env=only-npi=ever-crucial_item=_-licensor=0-scope=0-npi_present=0	1		the actors often also loved the teachers .
experiment=NPI-env=only-npi=ever-crucial_item=_-licensor=0-scope=0-npi_present=1	0		the girls had ever also loved the actresses .
experiment=NPI-env=only-npi=ever-crucial_item=_-licensor=1-scope=0-npi_present=0	1		a woman had sometimes toured only the restaurants .
experiment=NPI-env=only-npi=ever-crucial_item=_-licensor=0-scope=1-npi_present=1	0		a woman had also ever toured the restaurants .
experiment=NPI-env=only-npi=ever-crucial_item=_-licensor=0-scope=1-npi_present=0	1		a woman had also sometimes toured the restaurants .
experiment=NPI-env=only-npi=ever-crucial_item=_-licensor=1-scope=1-npi_present=0	1		only the adult now drove to the grocery stores .
experiment=NPI-env=only-npi=ever-crucial_item=_-licensor=1-scope=0-npi_present=1	0		the adult ever drove to only the grocery stores .
experiment=NPI-env=only-npi=ever-crucial_item=_-licensor=0-scope=1-npi_present=0	1		the adult also now drove to the grocery stores .
experiment=NPI-env=only-npi=ever-crucial_item=_-licensor=0-scope=0-npi_present=0	1		the adult now also drove to the grocery stores .
experiment=NPI-env=only-npi=ever-crucial_item=_-licensor=1-scope=1-npi_present=1	1		only the cashiers could ever watch the waitresses .
experiment=NPI-env=only-npi=ever-crucial_item=_-licensor=0-scope=0-npi_present=1	0		the cashiers could ever also watch the waitresses .
experiment=NPI-env=only-npi=ever-crucial_item=_-licensor=1-scope=1-npi_present=0	1		only a guest could now have the books .
experiment=NPI-env=only-npi=ever-crucial_item=_-licensor=1-scope=0-npi_present=0	1		a guest could now have only the books .
experiment=NPI-env=only-npi=ever-crucial_item=_-licensor=0-scope=0-npi_present=1	0		a guest could ever also have the books .
experiment=NPI-env=only-npi=ever-crucial_item=_-licensor=0-scope=0-npi_present=0	1		a guest could now also have the books .
experiment=NPI-env=only-npi=ever-crucial_item=_-licensor=0-scope=1-npi_present=1	0		a man also ever listened to the guys .
experiment=NPI-env=only-npi=ever-crucial_item=_-licensor=0-scope=1-npi_present=0	1		a man also often listened to the guys .
experiment=NPI-env=only-npi=ever-crucial_item=_-licensor=0-scope=0-npi_present=1	0		a man ever also listened to the guys .
experiment=NPI-env=only-npi=ever-crucial_item=_-licensor=1-scope=0-npi_present=1	0		a guy ever describes only the actors .
experiment=NPI-env=only-npi=ever-crucial_item=_-licensor=0-scope=0-npi_present=0	1		a guy sometimes also describes the actors .
experiment=NPI-env=only-npi=ever-crucial_item=_-licensor=1-scope=1-npi_present=1	1		only the humans might ever attack the teachers .
experiment=NPI-env=only-npi=ever-crucial_item=_-licensor=1-scope=0-npi_present=1	0		the humans might ever attack only the teachers .
experiment=NPI-env=only-npi=ever-crucial_item=_-licensor=0-scope=1-npi_present=1	0		the humans might also ever attack the teachers .
experiment=NPI-env=only-npi=ever-crucial_item=_-licensor=1-scope=1-npi_present=1	1		only a person ever attacked the people .
experiment=NPI-env=only-npi=ever-crucial_item=_-licensor=1-scope=0-npi_present=0	1		a person always attacked only the people .
experiment=NPI-env=only-npi=ever-crucial_item=_-licensor=0-scope=0-npi_present=1	0		a person ever also attacked the people .
experiment=NPI-env=only-npi=ever-crucial_item=_-licensor=0-scope=1-npi_present=1	0		the teenagers also ever discuss the museums .
experiment=NPI-env=only-npi=ever-crucial_item=_-licensor=0-scope=1-npi_present=0	1		the teenagers also always discuss the museums .
experiment=NPI-env=only-npi=ever-crucial_item=_-licensor=0-scope=0-npi_present=1	0		the teenagers ever also discuss the museums .
experiment=NPI-env=only-npi=ever-crucial_item=_-licensor=1-scope=1-npi_present=0	1		only the teacher now escapes from the pedestrians .
experiment=NPI-env=only-npi=ever-crucial_item=_-licensor=1-scope=0-npi_present=1	0		the teacher ever escapes from only the pedestrians .
experiment=NPI-env=only-npi=ever-crucial_item=_-licensor=0-scope=0-npi_present=1	0		the teacher ever also escapes from the pedestrians .
experiment=NPI-env=only-npi=ever-crucial_item=_-licensor=1-scope=1-npi_present=1	1		only the boys do ever flee from the people .
experiment=NPI-env=only-npi=ever-crucial_item=_-licensor=1-scope=1-npi_present=0	1		only the people could always drop by the libraries .
experiment=NPI-env=only-npi=ever-crucial_item=_-licensor=0-scope=0-npi_present=0	1		the people could always also drop by the libraries .
experiment=NPI-env=only-npi=ever-crucial_item=_-licensor=1-scope=1-npi_present=0	1		only the child had now sold the reports .
experiment=NPI-env=only-npi=ever-crucial_item=_-licensor=1-scope=0-npi_present=0	1		the child had now sold only the reports .
experiment=NPI-env=only-npi=ever-crucial_item=_-licensor=0-scope=1-npi_present=1	0		the child had also ever sold the reports .
experiment=NPI-env=only-npi=ever-crucial_item=_-licensor=1-scope=1-npi_present=1	1		only the actor ever exits the libraries .
experiment=NPI-env=only-npi=ever-crucial_item=_-licensor=1-scope=1-npi_present=0	1		only the actor sometimes exits the libraries .
experiment=NPI-env=only-npi=ever-crucial_item=_-licensor=0-scope=1-npi_present=1	0		the actor also ever exits the libraries .
experiment=NPI-env=only-npi=ever-crucial_item=_-licensor=0-scope=0-npi_present=1	0		the actor ever also exits the libraries .
experiment=NPI-env=only-npi=ever-crucial_item=_-licensor=1-scope=1-npi_present=0	1		only the cashiers now exited the high schools .
experiment=NPI-env=only-npi=ever-crucial_item=_-licensor=0-scope=0-npi_present=0	1		the cashiers now also exited the high schools .
experiment=NPI-env=only-npi=ever-crucial_item=_-licensor=1-scope=1-npi_present=1	1		only the girls ever attacked the gals .
experiment=NPI-env=only-npi=ever-crucial_item=_-licensor=1-scope=0-npi_present=1	0		the girls ever attacked only the gals .
experiment=NPI-env=only-npi=ever-crucial_item=_-licensor=1-scope=0-npi_present=0	1		the person would sometimes reference only the movies .
experiment=NPI-env=only-npi=ever-crucial_item=_-licensor=1-scope=1-npi_present=0	1		only the actors often helped the children .
experiment=NPI-env=only-npi=ever-crucial_item=_-licensor=1-scope=0-npi_present=1	0		the actors ever helped only the children .
experiment=NPI-env=only-npi=ever-crucial_item=_-licensor=0-scope=0-npi_present=0	1		the actors often also helped the children .
experiment=NPI-env=only-npi=ever-crucial_item=_-licensor=1-scope=0-npi_present=0	1		the waiters sometimes insulted only the waitresses .
experiment=NPI-env=only-npi=ever-crucial_item=_-licensor=0-scope=1-npi_present=1	0		the waiters also ever insulted the waitresses .
experiment=NPI-env=only-npi=ever-crucial_item=_-licensor=0-scope=0-npi_present=1	0		the waiters ever also insulted the waitresses .
experiment=NPI-env=only-npi=ever-crucial_item=_-licensor=1-scope=0-npi_present=0	1		the men often respect only the boys .
experiment=NPI-env=only-npi=ever-crucial_item=_-licensor=0-scope=0-npi_present=0	1		the men often also respect the boys .
experiment=NPI-env=only-npi=ever-crucial_item=_-licensor=1-scope=0-npi_present=0	1		the teachers do sometimes talk about only the guys .
experiment=NPI-env=only-npi=ever-crucial_item=_-licensor=0-scope=1-npi_present=1	0		the teachers do also ever talk about the guys .
experiment=NPI-env=only-npi=ever-crucial_item=_-licensor=1-scope=0-npi_present=0	1		the teenagers always had only the newspaper articles .
experiment=NPI-env=only-npi=ever-crucial_item=_-licensor=0-scope=1-npi_present=1	0		the teenagers also ever had the newspaper articles .
experiment=NPI-env=only-npi=ever-crucial_item=_-licensor=0-scope=0-npi_present=0	1		the teenagers always also had the newspaper articles .
experiment=NPI-env=only-npi=ever-crucial_item=_-licensor=1-scope=1-npi_present=1	1		only the students ever listen to the gals .
experiment=NPI-env=only-npi=ever-crucial_item=_-licensor=0-scope=0-npi_present=1	0		the students ever also listen to the gals .
experiment=NPI-env=only-npi=ever-crucial_item=_-licensor=0-scope=0-npi_present=0	1		the students sometimes also listen to the gals .
experiment=NPI-env=only-npi=ever-crucial_item=_-licensor=1-scope=1-npi_present=0	1		only the guests might now bring the forks .
experiment=NPI-env=only-npi=ever-crucial_item=_-licensor=0-scope=1-npi_present=1	0		the guests might also ever bring the forks .
experiment=NPI-env=only-npi=ever-crucial_item=_-licensor=0-scope=0-npi_present=1	0		the guests might ever also bring the forks .
experiment=NPI-env=only-npi=ever-crucial_item=_-licensor=0-scope=0-npi_present=0	1		the guests might now also bring the forks .
experiment=NPI-env=only-npi=ever-crucial_item=_-licensor=1-scope=1-npi_present=1	1		only the boys ever insulted the public parks .
experiment=NPI-env=only-npi=ever-crucial_item=_-licensor=1-scope=0-npi_present=0	1		the boys now insulted only the public parks .
experiment=NPI-env=only-npi=ever-crucial_item=_-licensor=0-scope=1-npi_present=0	1		the boys also now insulted the public parks .
experiment=NPI-env=only-npi=ever-crucial_item=_-licensor=1-scope=1-npi_present=1	1		only an adult ever runs around the art galleries .
experiment=NPI-env=only-npi=ever-crucial_item=_-licensor=1-scope=0-npi_present=0	1		an adult often runs around only the art galleries .
experiment=NPI-env=only-npi=ever-crucial_item=_-licensor=0-scope=1-npi_present=1	0		an adult also ever runs around the art galleries .
