experiment=NPI-env=quantifier-npi=ever-crucial_item=some-licensor=0-scope=1-npi_present=1	0		some actresses who ever went to more than three high schools do visit many students .
experiment=NPI-env=quantifier-npi=ever-crucial_item=some-licensor=0-scope=1-npi_present=0	1		some actresses who once went to more than three high schools do visit many students .
experiment=NPI-env=quantifier-npi=ever-crucial_item=any-licensor=1-scope=1-npi_present=1	1		any actresses who ever went to more than three high schools do visit many students .
experiment=NPI-env=quantifier-npi=ever-crucial_item=many-licensor=0-scope=1-npi_present=0	1		many guests who once wore pants criticized a lot of movies .
experiment=NPI-env=quantifier-npi=ever-crucial_item=any-licensor=1-scope=1-npi_present=1	1		any guests who ever wore pants criticized a lot of movies .
experiment=NPI-env=quantifier-npi=ever-crucial_item=any-licensor=1-scope=1-npi_present=0	1		any guests who once wore pants criticized a lot of movies .
experiment=NPI-env=quantifier-npi=ever-crucial_item=any-licensor=1-scope=0-npi_present=0	1		any guests who wore pants once criticized a lot of movies .
experiment=NPI-env=quantifier-npi=ever-crucial_item=some-licensor=0-scope=1-npi_present=1	0		some cashier who ever watches the patients tours the banks .
experiment=NPI-env=quantifier-npi=ever-crucial_item=some-licensor=0-scope=1-npi_present=0	1		some cashier who now watches the patients tours the banks .
experiment=NPI-env=quantifier-npi=ever-crucial_item=some-licensor=0-scope=0-npi_present=0	1		some cashier who watches the patients now tours the banks .
experiment=NPI-env=quantifier-npi=ever-crucial_item=every-licensor=1-scope=1-npi_present=1	1		every cashier who ever watches the patients tours the banks .
experiment=NPI-env=quantifier-npi=ever-crucial_item=every-licensor=1-scope=1-npi_present=0	1		every cashier who now watches the patients tours the banks .
experiment=NPI-env=quantifier-npi=ever-crucial_item=every-licensor=1-scope=0-npi_present=1	0		every cashier who watches the patients ever tours the banks .
experiment=NPI-env=quantifier-npi=ever-crucial_item=the-licensor=0-scope=1-npi_present=1	0		the actor who ever skates around grocery stores attacks more than three doctors .
experiment=NPI-env=quantifier-npi=ever-crucial_item=the-licensor=0-scope=0-npi_present=1	0		the actor who skates around grocery stores ever attacks more than three doctors .
experiment=NPI-env=quantifier-npi=ever-crucial_item=the-licensor=0-scope=1-npi_present=1	0		the teenager who ever exits more than three malls are at a lot of public parks .
experiment=NPI-env=quantifier-npi=ever-crucial_item=the-licensor=0-scope=0-npi_present=0	1		the teenager who exits more than three malls now are at a lot of public parks .
experiment=NPI-env=quantifier-npi=ever-crucial_item=every-licensor=1-scope=1-npi_present=1	1		every teenager who ever exits more than three malls are at a lot of public parks .
experiment=NPI-env=quantifier-npi=ever-crucial_item=every-licensor=1-scope=0-npi_present=1	0		every teenager who exits more than three malls ever are at a lot of public parks .
experiment=NPI-env=quantifier-npi=ever-crucial_item=many-licensor=0-scope=1-npi_present=0	1		many adults who should now be at some schools knew some students .
experiment=NPI-env=quantifier-npi=ever-crucial_item=many-licensor=0-scope=0-npi_present=1	0		many adults who should be at some schools ever knew some students .
experiment=NPI-env=quantifier-npi=ever-crucial_item=all-licensor=1-scope=0-npi_present=1	0		all adults who should be at some schools ever knew some students .
experiment=NPI-env=quantifier-npi=ever-crucial_item=more than three-licensor=0-scope=0-npi_present=1	0		more than three boys who have attacked many actresses had ever sold many rugs .
experiment=NPI-env=quantifier-npi=ever-crucial_item=any-licensor=1-scope=1-npi_present=1	1		any boys who have ever attacked many actresses had sold many rugs .
experiment=NPI-env=quantifier-npi=ever-crucial_item=a-licensor=0-scope=0-npi_present=1	0		a person who has some shoes ever biked to the movie theaters .
experiment=NPI-env=quantifier-npi=ever-crucial_item=every-licensor=1-scope=0-npi_present=1	0		every person who has some shoes ever biked to the movie theaters .
experiment=NPI-env=quantifier-npi=ever-crucial_item=the-licensor=0-scope=1-npi_present=0	1		the man who had once lifted many couches works with more than three pedestrians .
experiment=NPI-env=quantifier-npi=ever-crucial_item=every-licensor=1-scope=1-npi_present=1	1		every man who had ever lifted many couches works with more than three pedestrians .
experiment=NPI-env=quantifier-npi=ever-crucial_item=the-licensor=0-scope=0-npi_present=1	0		the guests who have cared for many girls ever dislike a lot of adults .
experiment=NPI-env=quantifier-npi=ever-crucial_item=any-licensor=1-scope=1-npi_present=1	1		any guests who have ever cared for many girls dislike a lot of adults .
experiment=NPI-env=quantifier-npi=ever-crucial_item=any-licensor=1-scope=1-npi_present=0	1		any guests who have now cared for many girls dislike a lot of adults .
experiment=NPI-env=quantifier-npi=ever-crucial_item=every-licensor=1-scope=1-npi_present=1	1		every teenager who might ever drive to many restaurants does praise more than three boys .
experiment=NPI-env=quantifier-npi=ever-crucial_item=every-licensor=1-scope=1-npi_present=0	1		every teenager who might now drive to many restaurants does praise more than three boys .
experiment=NPI-env=quantifier-npi=ever-crucial_item=every-licensor=1-scope=0-npi_present=0	1		every teenager who might drive to many restaurants now does praise more than three boys .
experiment=NPI-env=quantifier-npi=ever-crucial_item=more than three-licensor=0-scope=1-npi_present=1	0		more than three waiters who ever listened to many gals scanned reports .
experiment=NPI-env=quantifier-npi=ever-crucial_item=more than three-licensor=0-scope=0-npi_present=0	1		more than three waiters who listened to many gals once scanned reports .
experiment=NPI-env=quantifier-npi=ever-crucial_item=many-licensor=0-scope=1-npi_present=0	1		many customers who now bike to more than three grocery stores had driven to some cafes .
experiment=NPI-env=quantifier-npi=ever-crucial_item=many-licensor=0-scope=0-npi_present=1	0		many customers who bike to more than three grocery stores had ever driven to some cafes .
experiment=NPI-env=quantifier-npi=ever-crucial_item=any-licensor=1-scope=1-npi_present=1	1		any customers who ever bike to more than three grocery stores had driven to some cafes .
experiment=NPI-env=quantifier-npi=ever-crucial_item=any-licensor=1-scope=0-npi_present=1	0		any customers who bike to more than three grocery stores had ever driven to some cafes .
experiment=NPI-env=quantifier-npi=ever-crucial_item=-licensor=0-scope=1-npi_present=0	1		girls who now see the plates visit many boys .
experiment=NPI-env=quantifier-npi=ever-crucial_item=-licensor=0-scope=0-npi_present=1	0		girls who see the plates ever visit many boys .
experiment=NPI-env=quantifier-npi=ever-crucial_item=all-licensor=1-scope=1-npi_present=1	1		all girls who ever see the plates visit many boys .
experiment=NPI-env=quantifier-npi=ever-crucial_item=all-licensor=1-scope=0-npi_present=0	1		all girls who see the plates now visit many boys .
experiment=NPI-env=quantifier-npi=ever-crucial_item=some-licensor=0-scope=0-npi_present=0	1		some waiter who examines newspaper articles once skated around a lot of restaurants .
experiment=NPI-env=quantifier-npi=ever-crucial_item=every-licensor=1-scope=0-npi_present=1	0		every waiter who examines newspaper articles ever skated around a lot of restaurants .
experiment=NPI-env=quantifier-npi=ever-crucial_item=every-licensor=1-scope=0-npi_present=0	1		every waiter who examines newspaper articles once skated around a lot of restaurants .
experiment=NPI-env=quantifier-npi=ever-crucial_item=the-licensor=0-scope=0-npi_present=0	1		the waitresses who kiss many cashiers might now sell newspaper articles .
experiment=NPI-env=quantifier-npi=ever-crucial_item=any-licensor=1-scope=1-npi_present=1	1		any waitresses who ever kiss many cashiers might sell newspaper articles .
experiment=NPI-env=quantifier-npi=ever-crucial_item=the-licensor=0-scope=1-npi_present=1	0		the waitresses who ever loved many customers praise some guys .
experiment=NPI-env=quantifier-npi=ever-crucial_item=the-licensor=0-scope=1-npi_present=0	1		the waitresses who once loved many customers praise some guys .
experiment=NPI-env=quantifier-npi=ever-crucial_item=the-licensor=0-scope=0-npi_present=0	1		the waitresses who loved many customers now praise some guys .
experiment=NPI-env=quantifier-npi=ever-crucial_item=any-licensor=1-scope=1-npi_present=0	1		any waitresses who once loved many customers praise some guys .
experiment=NPI-env=quantifier-npi=ever-crucial_item=any-licensor=1-scope=1-npi_present=0	1		any guests who can now talk to the boys praised the pedestrians .
experiment=NPI-env=quantifier-npi=ever-crucial_item=any-licensor=1-scope=1-npi_present=1	1		any ladies who could ever explore the banks arrive at some libraries .
experiment=NPI-env=quantifier-npi=ever-crucial_item=any-licensor=1-scope=0-npi_present=1	0		any ladies who could explore the banks ever arrive at some libraries .
experiment=NPI-env=quantifier-npi=ever-crucial_item=any-licensor=1-scope=0-npi_present=0	1		any ladies who could explore the banks now arrive at some libraries .
experiment=NPI-env=quantifier-npi=ever-crucial_item=every-licensor=1-scope=1-npi_present=1	1		every woman who ever respected many schools approached more than three waitresses .
experiment=NPI-env=quantifier-npi=ever-crucial_item=every-licensor=1-scope=0-npi_present=1	0		every woman who respected many schools ever approached more than three waitresses .
experiment=NPI-env=quantifier-npi=ever-crucial_item=every-licensor=1-scope=0-npi_present=0	1		every woman who respected many schools once approached more than three waitresses .
experiment=NPI-env=quantifier-npi=ever-crucial_item=-licensor=0-scope=1-npi_present=0	1		ladies who now go to the public parks respect some patients .
experiment=NPI-env=quantifier-npi=ever-crucial_item=-licensor=0-scope=0-npi_present=1	0		ladies who go to the public parks ever respect some patients .
experiment=NPI-env=quantifier-npi=ever-crucial_item=many-licensor=0-scope=0-npi_present=0	1		many waitresses who have attacked a lot of actresses have now biked to the libraries .
experiment=NPI-env=quantifier-npi=ever-crucial_item=all-licensor=1-scope=1-npi_present=0	1		all waitresses who have now attacked a lot of actresses have biked to the libraries .
experiment=NPI-env=quantifier-npi=ever-crucial_item=some-licensor=0-scope=1-npi_present=0	1		some pedestrian who once loved many gals investigated a lot of libraries .
experiment=NPI-env=quantifier-npi=ever-crucial_item=some-licensor=0-scope=0-npi_present=0	1		some pedestrian who loved many gals once investigated a lot of libraries .
experiment=NPI-env=quantifier-npi=ever-crucial_item=every-licensor=1-scope=1-npi_present=0	1		every pedestrian who once loved many gals investigated a lot of libraries .
experiment=NPI-env=quantifier-npi=ever-crucial_item=every-licensor=1-scope=0-npi_present=1	0		every pedestrian who loved many gals ever investigated a lot of libraries .
experiment=NPI-env=quantifier-npi=ever-crucial_item=some-licensor=0-scope=0-npi_present=1	0		some doctor who has insulted ladies will ever hate a lot of guys .
experiment=NPI-env=quantifier-npi=ever-crucial_item=every-licensor=1-scope=1-npi_present=1	1		every doctor who has ever insulted ladies will hate a lot of guys .
experiment=NPI-env=quantifier-npi=ever-crucial_item=every-licensor=1-scope=0-npi_present=1	0		every doctor who has insulted ladies will ever hate a lot of guys .
experiment=NPI-env=quantifier-npi=ever-crucial_item=some-licensor=0-scope=1-npi_present=1	0		some adult who ever did clean cups has left many libraries .
experiment=NPI-env=quantifier-npi=ever-crucial_item=some-licensor=0-scope=1-npi_present=0	1		some adult who once did clean cups has left many libraries .
experiment=NPI-env=quantifier-npi=ever-crucial_item=some-licensor=0-scope=0-npi_present=1	0		some adult who did clean cups has ever left many libraries .
experiment=NPI-env=quantifier-npi=ever-crucial_item=every-licensor=1-scope=1-npi_present=0	1		every adult who once did clean cups has left many libraries .
experiment=NPI-env=quantifier-npi=ever-crucial_item=many-licensor=0-scope=0-npi_present=1	0		many customers who disliked the children ever have some books .
experiment=NPI-env=quantifier-npi=ever-crucial_item=many-licensor=0-scope=0-npi_present=0	1		many customers who disliked the children now have some books .
experiment=NPI-env=quantifier-npi=ever-crucial_item=all-licensor=1-scope=1-npi_present=1	1		all customers who ever disliked the children have some books .
experiment=NPI-env=quantifier-npi=ever-crucial_item=all-licensor=1-scope=0-npi_present=0	1		all customers who disliked the children now have some books .
experiment=NPI-env=quantifier-npi=ever-crucial_item=the-licensor=0-scope=1-npi_present=0	1		the girl who once went to a lot of restaurants did reference actors .
experiment=NPI-env=quantifier-npi=ever-crucial_item=every-licensor=1-scope=1-npi_present=0	1		every girl who once went to a lot of restaurants did reference actors .
experiment=NPI-env=quantifier-npi=ever-crucial_item=every-licensor=1-scope=0-npi_present=1	0		every girl who went to a lot of restaurants ever did reference actors .
experiment=NPI-env=quantifier-npi=ever-crucial_item=every-licensor=1-scope=1-npi_present=1	1		every doctor who ever insulted a lot of people has sold a lot of plates .
experiment=NPI-env=quantifier-npi=ever-crucial_item=a lot of-licensor=0-scope=1-npi_present=1	0		a lot of girls who ever visit the high schools see some humans .
experiment=NPI-env=quantifier-npi=ever-crucial_item=a lot of-licensor=0-scope=1-npi_present=0	1		a lot of girls who now visit the high schools see some humans .
experiment=NPI-env=quantifier-npi=ever-crucial_item=a lot of-licensor=0-scope=0-npi_present=1	0		a lot of girls who visit the high schools ever see some humans .
experiment=NPI-env=quantifier-npi=ever-crucial_item=any-licensor=1-scope=1-npi_present=0	1		any girls who now visit the high schools see some humans .
experiment=NPI-env=quantifier-npi=ever-crucial_item=any-licensor=1-scope=0-npi_present=1	0		any girls who visit the high schools ever see some humans .
experiment=NPI-env=quantifier-npi=ever-crucial_item=more than three-licensor=0-scope=0-npi_present=1	0		more than three children who had approached the customers might ever see a lot of couches .
experiment=NPI-env=quantifier-npi=ever-crucial_item=more than three-licensor=0-scope=0-npi_present=0	1		more than three children who had approached the customers might now see a lot of couches .
experiment=NPI-env=quantifier-npi=ever-crucial_item=any-licensor=1-scope=1-npi_present=1	1		any children who had ever approached the customers might see a lot of couches .
experiment=NPI-env=quantifier-npi=ever-crucial_item=any-licensor=1-scope=1-npi_present=0	1		any children who had once approached the customers might see a lot of couches .
experiment=NPI-env=quantifier-npi=ever-crucial_item=any-licensor=1-scope=0-npi_present=0	1		any children who had approached the customers might now see a lot of couches .
experiment=NPI-env=quantifier-npi=ever-crucial_item=a lot of-licensor=0-scope=0-npi_present=1	0		a lot of customers who boycott many museums had ever helped many cashiers .
experiment=NPI-env=quantifier-npi=ever-crucial_item=all-licensor=1-scope=1-npi_present=1	1		all customers who ever boycott many museums had helped many cashiers .
experiment=NPI-env=quantifier-npi=ever-crucial_item=all-licensor=1-scope=0-npi_present=0	1		all customers who boycott many museums had once helped many cashiers .
experiment=NPI-env=quantifier-npi=ever-crucial_item=some-licensor=0-scope=1-npi_present=1	0		some man who had ever respected actors can see a lot of ladies .
experiment=NPI-env=quantifier-npi=ever-crucial_item=every-licensor=1-scope=1-npi_present=1	1		every man who had ever respected actors can see a lot of ladies .
experiment=NPI-env=quantifier-npi=ever-crucial_item=more than three-licensor=0-scope=0-npi_present=1	0		more than three boys who have boycotted many cafes had ever sold many plates .
experiment=NPI-env=quantifier-npi=ever-crucial_item=all-licensor=1-scope=1-npi_present=0	1		all boys who have now boycotted many cafes had sold many plates .
experiment=NPI-env=quantifier-npi=ever-crucial_item=all-licensor=1-scope=0-npi_present=1	0		all boys who have boycotted many cafes had ever sold many plates .
experiment=NPI-env=quantifier-npi=ever-crucial_item=all-licensor=1-scope=0-npi_present=0	1		all boys who have boycotted many cafes had once sold many plates .
experiment=NPI-env=quantifier-npi=ever-crucial_item=all-licensor=1-scope=1-npi_present=0	1		all ladies who had once returned to some cashiers should escape from many restaurants .
experiment=NPI-env=quantifier-npi=ever-crucial_item=the-licensor=0-scope=1-npi_present=1	0		the actresses who ever hug some cashiers have more than three glasses .
experiment=NPI-env=quantifier-npi=ever-crucial_item=the-licensor=0-scope=1-npi_present=0	1		the actresses who now hug some cashiers have more than three glasses .
experiment=NPI-env=quantifier-npi=ever-crucial_item=the-licensor=0-scope=0-npi_present=0	1		the actresses who hug some cashiers now have more than three glasses .
experiment=NPI-env=quantifier-npi=ever-crucial_item=any-licensor=1-scope=1-npi_present=1	1		any actresses who ever hug some cashiers have more than three glasses .
experiment=NPI-env=quantifier-npi=ever-crucial_item=any-licensor=1-scope=1-npi_present=0	1		any actresses who now hug some cashiers have more than three glasses .
experiment=NPI-env=quantifier-npi=ever-crucial_item=any-licensor=1-scope=0-npi_present=1	0		any actresses who hug some cashiers ever have more than three glasses .
experiment=NPI-env=quantifier-npi=ever-crucial_item=a-licensor=0-scope=1-npi_present=0	1		a cashier who has now disliked more than three stories had worn many pants .
experiment=NPI-env=quantifier-npi=ever-crucial_item=a-licensor=0-scope=0-npi_present=1	0		a cashier who has disliked more than three stories had ever worn many pants .
experiment=NPI-env=quantifier-npi=ever-crucial_item=every-licensor=1-scope=1-npi_present=0	1		every cashier who has now disliked more than three stories had worn many pants .
experiment=NPI-env=quantifier-npi=ever-crucial_item=every-licensor=1-scope=1-npi_present=1	1		every adult who will ever go to a lot of college campuses has returned to the boys .
experiment=NPI-env=quantifier-npi=ever-crucial_item=every-licensor=1-scope=1-npi_present=0	1		every adult who will now go to a lot of college campuses has returned to the boys .
experiment=NPI-env=quantifier-npi=ever-crucial_item=every-licensor=1-scope=0-npi_present=1	0		every adult who will go to a lot of college campuses has ever returned to the boys .
experiment=NPI-env=quantifier-npi=ever-crucial_item=more than three-licensor=0-scope=1-npi_present=1	0		more than three actresses who ever do skate around the high schools went to many banks .
experiment=NPI-env=quantifier-npi=ever-crucial_item=more than three-licensor=0-scope=1-npi_present=0	1		more than three actresses who now do skate around the high schools went to many banks .
experiment=NPI-env=quantifier-npi=ever-crucial_item=more than three-licensor=0-scope=0-npi_present=0	1		more than three actresses who do skate around the high schools once went to many banks .
experiment=NPI-env=quantifier-npi=ever-crucial_item=any-licensor=1-scope=1-npi_present=1	1		any actresses who ever do skate around the high schools went to many banks .
experiment=NPI-env=quantifier-npi=ever-crucial_item=any-licensor=1-scope=0-npi_present=0	1		any actresses who do skate around the high schools once went to many banks .
experiment=NPI-env=quantifier-npi=ever-crucial_item=some-licensor=0-scope=1-npi_present=0	1		some girls who have now listened to the boys have arrived at public parks .
experiment=NPI-env=quantifier-npi=ever-crucial_item=the-licensor=0-scope=1-npi_present=1	0		the person who had ever loved some essays has broken forks .
experiment=NPI-env=quantifier-npi=ever-crucial_item=every-licensor=1-scope=0-npi_present=1	0		every person who had loved some essays has ever broken forks .
experiment=NPI-env=quantifier-npi=ever-crucial_item=a-licensor=0-scope=0-npi_present=1	0		a driver who had kissed many adults ever are at some schools .
experiment=NPI-env=quantifier-npi=ever-crucial_item=every-licensor=1-scope=1-npi_present=0	1		every driver who had once kissed many adults are at some schools .
experiment=NPI-env=quantifier-npi=ever-crucial_item=every-licensor=1-scope=0-npi_present=0	1		every driver who had kissed many adults now are at some schools .
experiment=NPI-env=quantifier-npi=ever-crucial_item=some-licensor=0-scope=1-npi_present=1	0		some patient who ever respected patients can resemble the dishes .
experiment=NPI-env=quantifier-npi=ever-crucial_item=some-licensor=0-scope=1-npi_present=0	1		some patient who once respected patients can resemble the dishes .
experiment=NPI-env=quantifier-npi=ever-crucial_item=some-licensor=0-scope=0-npi_present=0	1		some patient who respected patients can now resemble the dishes .
experiment=NPI-env=quantifier-npi=ever-crucial_item=every-licensor=1-scope=0-npi_present=1	0		every patient who respected patients can ever resemble the dishes .
experiment=NPI-env=quantifier-npi=ever-crucial_item=a-licensor=0-scope=1-npi_present=1	0		a child who ever remembers doctors loved more than three pedestrians .
experiment=NPI-env=quantifier-npi=ever-crucial_item=every-licensor=1-scope=1-npi_present=0	1		every child who now remembers doctors loved more than three pedestrians .
experiment=NPI-env=quantifier-npi=ever-crucial_item=every-licensor=1-scope=0-npi_present=1	0		every child who remembers doctors ever loved more than three pedestrians .
experiment=NPI-env=quantifier-npi=ever-crucial_item=the-licensor=0-scope=1-npi_present=0	1		the driver who now resembles a lot of drivers exited many grocery stores .
experiment=NPI-env=quantifier-npi=ever-crucial_item=the-licensor=0-scope=0-npi_present=1	0		the driver who resembles a lot of drivers ever exited many grocery stores .
experiment=NPI-env=quantifier-npi=ever-crucial_item=many-licensor=0-scope=1-npi_present=0	1		many teachers who can now attack gals investigate more than three hospitals .
experiment=NPI-env=quantifier-npi=ever-crucial_item=-licensor=0-scope=0-npi_present=1	0		men who would dislike some cafes had ever talked about a lot of girls .
experiment=NPI-env=quantifier-npi=ever-crucial_item=any-licensor=1-scope=0-npi_present=0	1		any men who would dislike some cafes had once talked about a lot of girls .
experiment=NPI-env=quantifier-npi=ever-crucial_item=more than three-licensor=0-scope=1-npi_present=1	0		more than three guys who might ever scan a lot of plays should sell many couches .
experiment=NPI-env=quantifier-npi=ever-crucial_item=more than three-licensor=0-scope=0-npi_present=0	1		more than three guys who might scan a lot of plays should now sell many couches .
experiment=NPI-env=quantifier-npi=ever-crucial_item=all-licensor=1-scope=1-npi_present=1	1		all guys who might ever scan a lot of plays should sell many couches .
experiment=NPI-env=quantifier-npi=ever-crucial_item=all-licensor=1-scope=0-npi_present=1	0		all guys who might scan a lot of plays should ever sell many couches .
experiment=NPI-env=quantifier-npi=ever-crucial_item=all-licensor=1-scope=0-npi_present=0	1		all guys who might scan a lot of plays should now sell many couches .
experiment=NPI-env=quantifier-npi=ever-crucial_item=a lot of-licensor=0-scope=0-npi_present=1	0		a lot of men who scan more than three documentaries ever listened to pedestrians .
experiment=NPI-env=quantifier-npi=ever-crucial_item=all-licensor=1-scope=1-npi_present=1	1		all men who ever scan more than three documentaries listened to pedestrians .
experiment=NPI-env=quantifier-npi=ever-crucial_item=all-licensor=1-scope=0-npi_present=1	0		all men who scan more than three documentaries ever listened to pedestrians .
experiment=NPI-env=quantifier-npi=ever-crucial_item=all-licensor=1-scope=0-npi_present=0	1		all men who scan more than three documentaries once listened to pedestrians .
experiment=NPI-env=quantifier-npi=ever-crucial_item=every-licensor=1-scope=0-npi_present=1	0		every girl who did drive to more than three hospitals ever toured some movie theaters .
experiment=NPI-env=quantifier-npi=ever-crucial_item=many-licensor=0-scope=0-npi_present=1	0		many people who attacked some children have ever been at more than three libraries .
experiment=NPI-env=quantifier-npi=ever-crucial_item=the-licensor=0-scope=1-npi_present=0	1		the humans who once sold many cups been at a lot of museums .
experiment=NPI-env=quantifier-npi=ever-crucial_item=all-licensor=1-scope=1-npi_present=1	1		all children who ever hate more than three documentaries had taken some chairs .
experiment=NPI-env=quantifier-npi=ever-crucial_item=all-licensor=1-scope=0-npi_present=0	1		all children who hate more than three documentaries had once taken some chairs .
experiment=NPI-env=quantifier-npi=ever-crucial_item=some-licensor=0-scope=1-npi_present=1	0		some teenager who had ever driven to many restaurants might listen to students .
experiment=NPI-env=quantifier-npi=ever-crucial_item=some-licensor=0-scope=0-npi_present=0	1		some teenager who had driven to many restaurants might now listen to students .
experiment=NPI-env=quantifier-npi=ever-crucial_item=a lot of-licensor=0-scope=1-npi_present=1	0		a lot of guys who ever scanned some essays forget humans .
experiment=NPI-env=quantifier-npi=ever-crucial_item=a lot of-licensor=0-scope=1-npi_present=0	1		a lot of guys who once scanned some essays forget humans .
