experiment=NPI-env=quantifier-npi=any-crucial_item=any-licensor=1-scope=1-npi_present=0	1		any ladies who discussed the students are investigating some libraries .
experiment=NPI-env=quantifier-npi=any-crucial_item=any-licensor=1-scope=0-npi_present=0	1		any ladies who discussed the students are investigating the libraries .
experiment=NPI-env=quantifier-npi=any-crucial_item=an-licensor=0-scope=1-npi_present=0	1		an actress who was walking through the schools had visited some grocery stores .
experiment=NPI-env=quantifier-npi=any-crucial_item=an-licensor=0-scope=0-npi_present=1	0		an actress who was walking through a lot of schools had visited any grocery stores .
experiment=NPI-env=quantifier-npi=any-crucial_item=every-licensor=1-scope=1-npi_present=1	1		every actress who was walking through any schools had visited some grocery stores .
experiment=NPI-env=quantifier-npi=any-crucial_item=every-licensor=1-scope=1-npi_present=0	1		every actress who was walking through the schools had visited some grocery stores .
experiment=NPI-env=quantifier-npi=any-crucial_item=every-licensor=1-scope=0-npi_present=0	1		every actress who was walking through a lot of schools had visited the grocery stores .
experiment=NPI-env=quantifier-npi=any-crucial_item=every-licensor=1-scope=0-npi_present=1	0		every waitress who was fleeing from many grocery stores investigates any customers .
experiment=NPI-env=quantifier-npi=any-crucial_item=-licensor=0-scope=1-npi_present=1	0		people who tour any grocery stores walk through some libraries .
experiment=NPI-env=quantifier-npi=any-crucial_item=-licensor=0-scope=0-npi_present=0	1		people who tour many grocery stores walk through the libraries .
experiment=NPI-env=quantifier-npi=any-crucial_item=any-licensor=1-scope=0-npi_present=1	0		any people who tour many grocery stores walk through any libraries .
experiment=NPI-env=quantifier-npi=any-crucial_item=the-licensor=0-scope=1-npi_present=1	0		the pedestrians who did lift any reports had dropped by more than three libraries .
experiment=NPI-env=quantifier-npi=any-crucial_item=any-licensor=1-scope=0-npi_present=1	0		any pedestrians who did lift a lot of reports had dropped by any libraries .
experiment=NPI-env=quantifier-npi=any-crucial_item=the-licensor=0-scope=0-npi_present=1	0		the waitress who had brought a lot of shoes is escaping from any hospitals .
experiment=NPI-env=quantifier-npi=any-crucial_item=every-licensor=1-scope=0-npi_present=1	0		every waitress who had brought a lot of shoes is escaping from any hospitals .
experiment=NPI-env=quantifier-npi=any-crucial_item=more than three-licensor=0-scope=1-npi_present=1	0		more than three waiters who can observe any cashiers could see books .
experiment=NPI-env=quantifier-npi=any-crucial_item=more than three-licensor=0-scope=0-npi_present=1	0		more than three waiters who can observe a lot of cashiers could see any books .
experiment=NPI-env=quantifier-npi=any-crucial_item=more than three-licensor=0-scope=0-npi_present=0	1		more than three waiters who can observe a lot of cashiers could see the books .
experiment=NPI-env=quantifier-npi=any-crucial_item=any-licensor=1-scope=1-npi_present=0	1		any waiters who can observe the cashiers could see books .
experiment=NPI-env=quantifier-npi=any-crucial_item=any-licensor=1-scope=0-npi_present=1	0		any waiters who can observe a lot of cashiers could see any books .
experiment=NPI-env=quantifier-npi=any-crucial_item=any-licensor=1-scope=0-npi_present=0	1		any waiters who can observe a lot of cashiers could see the books .
experiment=NPI-env=quantifier-npi=any-crucial_item=some-licensor=0-scope=0-npi_present=1	0		some teacher who was cleaning more than three cups did explore any libraries .
experiment=NPI-env=quantifier-npi=any-crucial_item=every-licensor=1-scope=0-npi_present=0	1		every teacher who was cleaning more than three cups did explore the libraries .
experiment=NPI-env=quantifier-npi=any-crucial_item=every-licensor=1-scope=1-npi_present=1	1		every boy who has hugged any gals remembered more than three guys .
experiment=NPI-env=quantifier-npi=any-crucial_item=every-licensor=1-scope=1-npi_present=0	1		every boy who has hugged the gals remembered more than three guys .
experiment=NPI-env=quantifier-npi=any-crucial_item=every-licensor=1-scope=0-npi_present=1	0		every boy who has hugged gals remembered any guys .
experiment=NPI-env=quantifier-npi=any-crucial_item=every-licensor=1-scope=0-npi_present=0	1		every boy who has hugged gals remembered the guys .
experiment=NPI-env=quantifier-npi=any-crucial_item=more than three-licensor=0-scope=1-npi_present=1	0		more than three teachers who are leaving any banks return to many students .
experiment=NPI-env=quantifier-npi=any-crucial_item=more than three-licensor=0-scope=0-npi_present=1	0		more than three teachers who are leaving a lot of banks return to any students .
experiment=NPI-env=quantifier-npi=any-crucial_item=more than three-licensor=0-scope=0-npi_present=0	1		more than three teachers who are leaving a lot of banks return to the students .
experiment=NPI-env=quantifier-npi=any-crucial_item=all-licensor=1-scope=1-npi_present=1	1		all teachers who are leaving any banks return to many students .
experiment=NPI-env=quantifier-npi=any-crucial_item=all-licensor=1-scope=1-npi_present=0	1		all teachers who are leaving the banks return to many students .
experiment=NPI-env=quantifier-npi=any-crucial_item=a-licensor=0-scope=1-npi_present=1	0		a guy who lifted any forks might admire the customers .
experiment=NPI-env=quantifier-npi=any-crucial_item=a-licensor=0-scope=1-npi_present=0	1		a guy who lifted the forks might admire the customers .
experiment=NPI-env=quantifier-npi=any-crucial_item=a-licensor=0-scope=0-npi_present=0	1		a guy who lifted forks might admire the customers .
experiment=NPI-env=quantifier-npi=any-crucial_item=every-licensor=1-scope=1-npi_present=1	1		every guy who lifted any forks might admire the customers .
experiment=NPI-env=quantifier-npi=any-crucial_item=all-licensor=1-scope=1-npi_present=1	1		all children who had talked about any stories had talked to a lot of cashiers .
experiment=NPI-env=quantifier-npi=any-crucial_item=every-licensor=1-scope=1-npi_present=1	1		every actor who did forget any newspaper articles had left hospitals .
experiment=NPI-env=quantifier-npi=any-crucial_item=every-licensor=1-scope=1-npi_present=0	1		every actor who did forget the newspaper articles had left hospitals .
experiment=NPI-env=quantifier-npi=any-crucial_item=every-licensor=1-scope=0-npi_present=0	1		every actor who did forget more than three newspaper articles had left the hospitals .
experiment=NPI-env=quantifier-npi=any-crucial_item=-licensor=0-scope=0-npi_present=1	0		actresses who bike to some art galleries could tour any cafes .
experiment=NPI-env=quantifier-npi=any-crucial_item=all-licensor=1-scope=0-npi_present=1	0		all actresses who bike to some art galleries could tour any cafes .
experiment=NPI-env=quantifier-npi=any-crucial_item=many-licensor=0-scope=1-npi_present=1	0		many teachers who had known any pedestrians have escaped from some teenagers .
experiment=NPI-env=quantifier-npi=any-crucial_item=many-licensor=0-scope=0-npi_present=1	0		many teachers who had known a lot of pedestrians have escaped from any teenagers .
experiment=NPI-env=quantifier-npi=any-crucial_item=many-licensor=0-scope=0-npi_present=0	1		many teachers who had known a lot of pedestrians have escaped from the teenagers .
experiment=NPI-env=quantifier-npi=any-crucial_item=the-licensor=0-scope=0-npi_present=1	0		the patient who has approached guests insulted any patients .
experiment=NPI-env=quantifier-npi=any-crucial_item=every-licensor=1-scope=1-npi_present=0	1		every patient who has approached the guests insulted patients .
experiment=NPI-env=quantifier-npi=any-crucial_item=a-licensor=0-scope=1-npi_present=1	0		a pedestrian who was admiring any girls will listen to some doctors .
experiment=NPI-env=quantifier-npi=any-crucial_item=a-licensor=0-scope=0-npi_present=1	0		a pedestrian who was admiring a lot of girls will listen to any doctors .
experiment=NPI-env=quantifier-npi=any-crucial_item=a-licensor=0-scope=0-npi_present=0	1		a pedestrian who was admiring a lot of girls will listen to the doctors .
experiment=NPI-env=quantifier-npi=any-crucial_item=every-licensor=1-scope=1-npi_present=1	1		every pedestrian who was admiring any girls will listen to some doctors .
experiment=NPI-env=quantifier-npi=any-crucial_item=every-licensor=1-scope=0-npi_present=1	0		every pedestrian who was admiring a lot of girls will listen to any doctors .
experiment=NPI-env=quantifier-npi=any-crucial_item=some-licensor=0-scope=1-npi_present=1	0		some ladies who would listen to any humans praised a lot of drivers .
experiment=NPI-env=quantifier-npi=any-crucial_item=some-licensor=0-scope=1-npi_present=0	1		some ladies who would listen to the humans praised a lot of drivers .
experiment=NPI-env=quantifier-npi=any-crucial_item=some-licensor=0-scope=0-npi_present=0	1		some ladies who would listen to more than three humans praised the drivers .
experiment=NPI-env=quantifier-npi=any-crucial_item=all-licensor=1-scope=1-npi_present=1	1		all ladies who would listen to any humans praised a lot of drivers .
experiment=NPI-env=quantifier-npi=any-crucial_item=all-licensor=1-scope=0-npi_present=1	0		all ladies who would listen to more than three humans praised any drivers .
experiment=NPI-env=quantifier-npi=any-crucial_item=a-licensor=0-scope=0-npi_present=0	1		a driver who can respect many pedestrians was kissing the actors .
experiment=NPI-env=quantifier-npi=any-crucial_item=every-licensor=1-scope=1-npi_present=0	1		every driver who can respect the pedestrians was kissing some actors .
experiment=NPI-env=quantifier-npi=any-crucial_item=every-licensor=1-scope=1-npi_present=1	1		every person who hates any waiters left some museums .
experiment=NPI-env=quantifier-npi=any-crucial_item=every-licensor=1-scope=0-npi_present=0	1		every person who hates waiters left the museums .
experiment=NPI-env=quantifier-npi=any-crucial_item=a lot of-licensor=0-scope=0-npi_present=0	1		a lot of guys who might describe some art galleries would clean the cars .
experiment=NPI-env=quantifier-npi=any-crucial_item=all-licensor=1-scope=1-npi_present=0	1		all guys who might describe the art galleries would clean some cars .
experiment=NPI-env=quantifier-npi=any-crucial_item=all-licensor=1-scope=0-npi_present=1	0		all guys who might describe some art galleries would clean any cars .
experiment=NPI-env=quantifier-npi=any-crucial_item=-licensor=0-scope=0-npi_present=0	1		teachers who knew more than three waiters were dropping by the art galleries .
experiment=NPI-env=quantifier-npi=any-crucial_item=any-licensor=1-scope=1-npi_present=0	1		any teachers who knew the waiters were dropping by more than three art galleries .
experiment=NPI-env=quantifier-npi=any-crucial_item=any-licensor=1-scope=0-npi_present=1	0		any teachers who knew more than three waiters were dropping by any art galleries .
experiment=NPI-env=quantifier-npi=any-crucial_item=a-licensor=0-scope=0-npi_present=1	0		a lady who has known more than three men should describe any girls .
experiment=NPI-env=quantifier-npi=any-crucial_item=every-licensor=1-scope=1-npi_present=1	1		every lady who has known any men should describe the girls .
experiment=NPI-env=quantifier-npi=any-crucial_item=the-licensor=0-scope=1-npi_present=0	1		the gal who has kissed the ladies was wearing a lot of pants .
experiment=NPI-env=quantifier-npi=any-crucial_item=the-licensor=0-scope=0-npi_present=0	1		the gal who has kissed some ladies was wearing the pants .
experiment=NPI-env=quantifier-npi=any-crucial_item=every-licensor=1-scope=1-npi_present=1	1		every gal who has kissed any ladies was wearing a lot of pants .
experiment=NPI-env=quantifier-npi=any-crucial_item=a-licensor=0-scope=0-npi_present=0	1		a lady who fled from some hospitals will describe the drivers .
experiment=NPI-env=quantifier-npi=any-crucial_item=every-licensor=1-scope=1-npi_present=1	1		every lady who fled from any hospitals will describe some drivers .
experiment=NPI-env=quantifier-npi=any-crucial_item=any-licensor=1-scope=0-npi_present=1	0		any teenagers who lifted many reports have attacked any humans .
experiment=NPI-env=quantifier-npi=any-crucial_item=all-licensor=1-scope=1-npi_present=1	1		all adults who had explored any grocery stores had worn glasses .
experiment=NPI-env=quantifier-npi=any-crucial_item=the-licensor=0-scope=1-npi_present=0	1		the person who goes to the cafes does hate many adults .
experiment=NPI-env=quantifier-npi=any-crucial_item=the-licensor=0-scope=1-npi_present=0	1		the people who are dropping by the schools approached patients .
experiment=NPI-env=quantifier-npi=any-crucial_item=all-licensor=1-scope=1-npi_present=1	1		all people who are dropping by any schools approached patients .
experiment=NPI-env=quantifier-npi=any-crucial_item=all-licensor=1-scope=1-npi_present=0	1		all people who are dropping by the schools approached patients .
experiment=NPI-env=quantifier-npi=any-crucial_item=all-licensor=1-scope=0-npi_present=0	1		all guests who approach some women are exploring the schools .
experiment=NPI-env=quantifier-npi=any-crucial_item=some-licensor=0-scope=0-npi_present=1	0		some lady who goes to more than three schools might remember any plays .
experiment=NPI-env=quantifier-npi=any-crucial_item=every-licensor=1-scope=1-npi_present=1	1		every lady who goes to any schools might remember plays .
experiment=NPI-env=quantifier-npi=any-crucial_item=an-licensor=0-scope=1-npi_present=1	0		an actress who had discussed any customers bought many newspaper articles .
experiment=NPI-env=quantifier-npi=any-crucial_item=an-licensor=0-scope=1-npi_present=0	1		an actress who had discussed the customers bought many newspaper articles .
experiment=NPI-env=quantifier-npi=any-crucial_item=an-licensor=0-scope=0-npi_present=0	1		an actress who had discussed some customers bought the newspaper articles .
experiment=NPI-env=quantifier-npi=any-crucial_item=every-licensor=1-scope=1-npi_present=1	1		every actress who had discussed any customers bought many newspaper articles .
experiment=NPI-env=quantifier-npi=any-crucial_item=the-licensor=0-scope=1-npi_present=0	1		the waiter who had approached the adults is investigating many restaurants .
experiment=NPI-env=quantifier-npi=any-crucial_item=the-licensor=0-scope=0-npi_present=1	0		the waiter who had approached many adults is investigating any restaurants .
experiment=NPI-env=quantifier-npi=any-crucial_item=every-licensor=1-scope=1-npi_present=1	1		every waiter who had approached any adults is investigating many restaurants .
experiment=NPI-env=quantifier-npi=any-crucial_item=every-licensor=1-scope=1-npi_present=0	1		every waiter who had approached the adults is investigating many restaurants .
experiment=NPI-env=quantifier-npi=any-crucial_item=a-licensor=0-scope=1-npi_present=1	0		a human who had been at any hospitals was selling the couches .
experiment=NPI-env=quantifier-npi=any-crucial_item=every-licensor=1-scope=1-npi_present=1	1		every human who had been at any hospitals was selling the couches .
experiment=NPI-env=quantifier-npi=any-crucial_item=every-licensor=1-scope=0-npi_present=0	1		every human who had been at hospitals was selling the couches .
experiment=NPI-env=quantifier-npi=any-crucial_item=some-licensor=0-scope=1-npi_present=0	1		some pedestrian who admires the pants cared for more than three boys .
experiment=NPI-env=quantifier-npi=any-crucial_item=some-licensor=0-scope=0-npi_present=1	0		some pedestrian who admires pants cared for any boys .
experiment=NPI-env=quantifier-npi=any-crucial_item=a-licensor=0-scope=0-npi_present=1	0		a guy who will see some reports broke any chairs .
experiment=NPI-env=quantifier-npi=any-crucial_item=a-licensor=0-scope=0-npi_present=0	1		a guy who will see some reports broke the chairs .
experiment=NPI-env=quantifier-npi=any-crucial_item=a-licensor=0-scope=1-npi_present=0	1		a child who did escape from the museums has remembered some banks .
experiment=NPI-env=quantifier-npi=any-crucial_item=every-licensor=1-scope=1-npi_present=0	1		every child who did escape from the museums has remembered some banks .
experiment=NPI-env=quantifier-npi=any-crucial_item=every-licensor=1-scope=0-npi_present=1	0		every child who did escape from museums has remembered any banks .
experiment=NPI-env=quantifier-npi=any-crucial_item=some-licensor=0-scope=1-npi_present=1	0		some waitress who ran around any art galleries is hugging the boys .
experiment=NPI-env=quantifier-npi=any-crucial_item=some-licensor=0-scope=0-npi_present=1	0		some waitress who ran around art galleries is hugging any boys .
experiment=NPI-env=quantifier-npi=any-crucial_item=every-licensor=1-scope=1-npi_present=1	1		every waitress who ran around any art galleries is hugging the boys .
experiment=NPI-env=quantifier-npi=any-crucial_item=every-licensor=1-scope=1-npi_present=0	1		every waitress who ran around the art galleries is hugging the boys .
experiment=NPI-env=quantifier-npi=any-crucial_item=some-licensor=0-scope=1-npi_present=1	0		some customers who had hated any documentaries could visit drivers .
experiment=NPI-env=quantifier-npi=any-crucial_item=any-licensor=1-scope=1-npi_present=0	1		any customers who had hated the documentaries could visit drivers .
experiment=NPI-env=quantifier-npi=any-crucial_item=all-licensor=1-scope=1-npi_present=0	1		all girls who dropped by the banks discuss the gals .
experiment=NPI-env=quantifier-npi=any-crucial_item=all-licensor=1-scope=0-npi_present=1	0		all girls who dropped by banks discuss any gals .
experiment=NPI-env=quantifier-npi=any-crucial_item=all-licensor=1-scope=0-npi_present=0	1		all girls who dropped by banks discuss the gals .
experiment=NPI-env=quantifier-npi=any-crucial_item=some-licensor=0-scope=0-npi_present=0	1		some patient who should leave girls bought the shoes .
experiment=NPI-env=quantifier-npi=any-crucial_item=every-licensor=1-scope=1-npi_present=0	1		every patient who should leave the girls bought the shoes .
experiment=NPI-env=quantifier-npi=any-crucial_item=every-licensor=1-scope=0-npi_present=0	1		every patient who should leave girls bought the shoes .
experiment=NPI-env=quantifier-npi=any-crucial_item=some-licensor=0-scope=1-npi_present=0	1		some guest who watches the cashiers listens to humans .
experiment=NPI-env=quantifier-npi=any-crucial_item=every-licensor=1-scope=1-npi_present=0	1		every guest who watches the cashiers listens to humans .
experiment=NPI-env=quantifier-npi=any-crucial_item=the-licensor=0-scope=1-npi_present=0	1		the guys who will remember the movies did bike to some grocery stores .
experiment=NPI-env=quantifier-npi=any-crucial_item=some-licensor=0-scope=0-npi_present=0	1		some doctor who works with many waitresses might flee from the actresses .
experiment=NPI-env=quantifier-npi=any-crucial_item=every-licensor=1-scope=1-npi_present=0	1		every doctor who works with the waitresses might flee from more than three actresses .
experiment=NPI-env=quantifier-npi=any-crucial_item=some-licensor=0-scope=1-npi_present=0	1		some adult who had been at the grocery stores should watch many men .
experiment=NPI-env=quantifier-npi=any-crucial_item=every-licensor=1-scope=0-npi_present=1	0		every adult who had been at a lot of grocery stores should watch any men .
experiment=NPI-env=quantifier-npi=any-crucial_item=every-licensor=1-scope=0-npi_present=0	1		every adult who had been at a lot of grocery stores should watch the men .
experiment=NPI-env=quantifier-npi=any-crucial_item=any-licensor=1-scope=1-npi_present=1	1		any waiters who describe any newspaper articles had been at many movie theaters .
experiment=NPI-env=quantifier-npi=any-crucial_item=any-licensor=1-scope=0-npi_present=1	0		any waiters who describe more than three newspaper articles had been at any movie theaters .
experiment=NPI-env=quantifier-npi=any-crucial_item=some-licensor=0-scope=1-npi_present=1	0		some woman who kisses any women worked with a lot of students .
experiment=NPI-env=quantifier-npi=any-crucial_item=some-licensor=0-scope=1-npi_present=0	1		some woman who kisses the women worked with a lot of students .
experiment=NPI-env=quantifier-npi=any-crucial_item=every-licensor=1-scope=1-npi_present=0	1		every woman who kisses the women worked with a lot of students .
experiment=NPI-env=quantifier-npi=any-crucial_item=every-licensor=1-scope=0-npi_present=1	0		every woman who kisses more than three women worked with any students .
experiment=NPI-env=quantifier-npi=any-crucial_item=some-licensor=0-scope=0-npi_present=0	1		some teacher who worked with a lot of drivers should talk to the teenagers .
experiment=NPI-env=quantifier-npi=any-crucial_item=every-licensor=1-scope=1-npi_present=1	1		every teacher who worked with any drivers should talk to a lot of teenagers .
experiment=NPI-env=quantifier-npi=any-crucial_item=every-licensor=1-scope=0-npi_present=0	1		every teacher who worked with a lot of drivers should talk to the teenagers .
experiment=NPI-env=quantifier-npi=any-crucial_item=-licensor=0-scope=1-npi_present=0	1		students who like the guests have a lot of pants .
experiment=NPI-env=quantifier-npi=any-crucial_item=-licensor=0-scope=0-npi_present=0	1		students who like a lot of guests have the pants .
experiment=NPI-env=quantifier-npi=any-crucial_item=any-licensor=1-scope=1-npi_present=1	1		any students who like any guests have a lot of pants .
experiment=NPI-env=quantifier-npi=any-crucial_item=any-licensor=1-scope=0-npi_present=0	1		any students who like a lot of guests have the pants .
experiment=NPI-env=quantifier-npi=any-crucial_item=-licensor=0-scope=1-npi_present=1	0		gals who cleaned any plates have visited many grocery stores .
experiment=NPI-env=quantifier-npi=any-crucial_item=all-licensor=1-scope=0-npi_present=0	1		all gals who cleaned some plates have visited the grocery stores .
experiment=NPI-env=quantifier-npi=any-crucial_item=all-licensor=1-scope=0-npi_present=0	1		all cashiers who love some drivers skate around the high schools .
experiment=NPI-env=quantifier-npi=any-crucial_item=any-licensor=1-scope=1-npi_present=1	1		any people who had sold any chairs have hugged some drivers .
experiment=NPI-env=quantifier-npi=any-crucial_item=any-licensor=1-scope=0-npi_present=1	0		any people who had sold more than three chairs have hugged any drivers .
experiment=NPI-env=quantifier-npi=any-crucial_item=any-licensor=1-scope=0-npi_present=0	1		any people who had sold more than three chairs have hugged the drivers .
experiment=NPI-env=quantifier-npi=any-crucial_item=many-licensor=0-scope=0-npi_present=1	0		many waitresses who were criticizing more than three commentaries had respected any banks .
experiment=NPI-env=quantifier-npi=any-crucial_item=some-licensor=0-scope=1-npi_present=0	1		some patient who might bring the forks disliked men .
experiment=NPI-env=quantifier-npi=any-crucial_item=some-licensor=0-scope=0-npi_present=0	1		some patient who might bring a lot of forks disliked the men .
experiment=NPI-env=quantifier-npi=any-crucial_item=every-licensor=1-scope=1-npi_present=0	1		every patient who might bring the forks disliked men .
experiment=NPI-env=quantifier-npi=any-crucial_item=a lot of-licensor=0-scope=0-npi_present=0	1		a lot of women who scanned many documentaries lift the dishes .
experiment=NPI-env=quantifier-npi=any-crucial_item=all-licensor=1-scope=0-npi_present=1	0		all women who scanned many documentaries lift any dishes .
experiment=NPI-env=quantifier-npi=any-crucial_item=some-licensor=0-scope=1-npi_present=1	0		some children who have been at any cafes will wear more than three glasses .
experiment=NPI-env=quantifier-npi=any-crucial_item=some-licensor=0-scope=0-npi_present=0	1		some children who have been at more than three cafes will wear the glasses .
experiment=NPI-env=quantifier-npi=any-crucial_item=any-licensor=1-scope=1-npi_present=0	1		any children who have been at the cafes will wear more than three glasses .
experiment=NPI-env=quantifier-npi=any-crucial_item=any-licensor=1-scope=0-npi_present=0	1		any children who have been at more than three cafes will wear the glasses .
experiment=NPI-env=quantifier-npi=any-crucial_item=a-licensor=0-scope=0-npi_present=1	0		a man who did work with the teachers liked any books .
experiment=NPI-env=quantifier-npi=any-crucial_item=some-licensor=0-scope=0-npi_present=1	0		some boy who was discussing the banks bikes to any schools .
experiment=NPI-env=quantifier-npi=any-crucial_item=some-licensor=0-scope=0-npi_present=0	1		some boy who was discussing the banks bikes to the schools .
experiment=NPI-env=quantifier-npi=any-crucial_item=every-licensor=1-scope=1-npi_present=0	1		every boy who was discussing the banks bikes to the schools .
experiment=NPI-env=quantifier-npi=any-crucial_item=any-licensor=1-scope=1-npi_present=1	1		any people who scan any plays did flee from more than three humans .
experiment=NPI-env=quantifier-npi=any-crucial_item=a-licensor=0-scope=1-npi_present=0	1		a student who is examining the reports insulted some newspaper articles .
experiment=NPI-env=quantifier-npi=any-crucial_item=a-licensor=0-scope=0-npi_present=1	0		a student who is examining more than three reports insulted any newspaper articles .
experiment=NPI-env=quantifier-npi=any-crucial_item=every-licensor=1-scope=1-npi_present=1	1		every student who is examining any reports insulted some newspaper articles .
experiment=NPI-env=quantifier-npi=any-crucial_item=every-licensor=1-scope=1-npi_present=0	1		every student who is examining the reports insulted some newspaper articles .
experiment=NPI-env=quantifier-npi=any-crucial_item=every-licensor=1-scope=0-npi_present=1	0		every student who is examining more than three reports insulted any newspaper articles .
experiment=NPI-env=quantifier-npi=any-crucial_item=every-licensor=1-scope=0-npi_present=0	1		every student who is examining more than three reports insulted the newspaper articles .
