experiment=NPI-env=conditional-npi=ever-crucial_item=if-licensor=1-scope=0-npi_present=0	0		never if the man scanning the newspaper articles , the man can concur .
experiment=NPI-env=conditional-npi=ever-crucial_item=while-licensor=0-scope=1-npi_present=0	1		while the man never scanning the newspaper articles , the man can concur .
experiment=NPI-env=conditional-npi=ever-crucial_item=while-licensor=0-scope=0-npi_present=1	0		ever while the man scanning the newspaper articles , the man can concur .
experiment=NPI-env=conditional-npi=ever-crucial_item=if-licensor=1-scope=1-npi_present=0	1		if a person never sell the cars , a person could read .
experiment=NPI-env=conditional-npi=ever-crucial_item=if-licensor=1-scope=0-npi_present=0	0		never if a person sell the cars , a person could read .
experiment=NPI-env=conditional-npi=ever-crucial_item=if-licensor=1-scope=1-npi_present=0	1		if the women never dislike the alumni , the women will practice .
experiment=NPI-env=conditional-npi=ever-crucial_item=while-licensor=0-scope=1-npi_present=1	0		while the women ever dislike the alumni , the women will practice .
experiment=NPI-env=conditional-npi=ever-crucial_item=if-licensor=1-scope=1-npi_present=0	1		if a lady never explore the movie theaters , a lady might grin .
experiment=NPI-env=conditional-npi=ever-crucial_item=if-licensor=1-scope=0-npi_present=0	0		never if a lady explore the movie theaters , a lady might grin .
experiment=NPI-env=conditional-npi=ever-crucial_item=while-licensor=0-scope=0-npi_present=1	0		ever while a lady explore the movie theaters , a lady might grin .
experiment=NPI-env=conditional-npi=ever-crucial_item=while-licensor=0-scope=0-npi_present=0	0		never while a lady explore the movie theaters , a lady might grin .
experiment=NPI-env=conditional-npi=ever-crucial_item=if-licensor=1-scope=0-npi_present=0	0		never if the humans worked with the sheep , the humans might slump over .
experiment=NPI-env=conditional-npi=ever-crucial_item=while-licensor=0-scope=0-npi_present=0	0		never while the waiters attacked the children , the waiters might practice .
experiment=NPI-env=conditional-npi=ever-crucial_item=if-licensor=1-scope=0-npi_present=1	0		ever if the teacher hates the drivers , the teacher can sit down .
experiment=NPI-env=conditional-npi=ever-crucial_item=while-licensor=0-scope=1-npi_present=1	0		while the teacher ever hates the drivers , the teacher can sit down .
experiment=NPI-env=conditional-npi=ever-crucial_item=while-licensor=0-scope=1-npi_present=0	1		while the teacher never hates the drivers , the teacher can sit down .
experiment=NPI-env=conditional-npi=ever-crucial_item=if-licensor=1-scope=1-npi_present=1	1		if a guy ever sells the brochures , a guy would examine movies .
experiment=NPI-env=conditional-npi=ever-crucial_item=if-licensor=1-scope=0-npi_present=1	0		ever if a guy sells the brochures , a guy would examine movies .
experiment=NPI-env=conditional-npi=ever-crucial_item=while-licensor=0-scope=0-npi_present=0	0		never while a guy sells the brochures , a guy would examine movies .
experiment=NPI-env=conditional-npi=ever-crucial_item=if-licensor=1-scope=1-npi_present=1	1		if the actress ever escaping from the adults , the actress can talk .
experiment=NPI-env=conditional-npi=ever-crucial_item=if-licensor=1-scope=0-npi_present=0	0		never if the actress escaping from the adults , the actress can talk .
experiment=NPI-env=conditional-npi=ever-crucial_item=while-licensor=0-scope=1-npi_present=1	0		while the actress ever escaping from the adults , the actress can talk .
experiment=NPI-env=conditional-npi=ever-crucial_item=if-licensor=1-scope=1-npi_present=1	1		if a person ever respect the fish , a person might skate around museums .
experiment=NPI-env=conditional-npi=ever-crucial_item=if-licensor=1-scope=1-npi_present=0	1		if a person never respect the fish , a person might skate around museums .
experiment=NPI-env=conditional-npi=ever-crucial_item=if-licensor=1-scope=0-npi_present=1	0		ever if a person respect the fish , a person might skate around museums .
experiment=NPI-env=conditional-npi=ever-crucial_item=if-licensor=1-scope=0-npi_present=0	0		never if a person respect the fish , a person might skate around museums .
experiment=NPI-env=conditional-npi=ever-crucial_item=while-licensor=0-scope=1-npi_present=1	0		while a person ever respect the fish , a person might skate around museums .
experiment=NPI-env=conditional-npi=ever-crucial_item=while-licensor=0-scope=1-npi_present=0	1		while a person never respect the fish , a person might skate around museums .
experiment=NPI-env=conditional-npi=ever-crucial_item=if-licensor=1-scope=0-npi_present=1	0		ever if the teachers wearing the glasses , the teachers would sell reports .
experiment=NPI-env=conditional-npi=ever-crucial_item=while-licensor=0-scope=0-npi_present=1	0		ever while the teachers wearing the glasses , the teachers would sell reports .
experiment=NPI-env=conditional-npi=ever-crucial_item=while-licensor=0-scope=0-npi_present=0	0		never while the teachers wearing the glasses , the teachers would sell reports .
experiment=NPI-env=conditional-npi=ever-crucial_item=if-licensor=1-scope=1-npi_present=0	1		if the doctors never scanning the commentaries , the doctors should love actors .
experiment=NPI-env=conditional-npi=ever-crucial_item=while-licensor=0-scope=1-npi_present=0	1		while the doctors never scanning the commentaries , the doctors should love actors .
experiment=NPI-env=conditional-npi=ever-crucial_item=if-licensor=1-scope=1-npi_present=1	1		if the pedestrians ever explore the malls , the pedestrians might win .
experiment=NPI-env=conditional-npi=ever-crucial_item=if-licensor=1-scope=1-npi_present=0	1		if the pedestrians never explore the malls , the pedestrians might win .
experiment=NPI-env=conditional-npi=ever-crucial_item=if-licensor=1-scope=0-npi_present=1	0		ever if the pedestrians explore the malls , the pedestrians might win .
experiment=NPI-env=conditional-npi=ever-crucial_item=while-licensor=0-scope=1-npi_present=1	0		while the pedestrians ever explore the malls , the pedestrians might win .
experiment=NPI-env=conditional-npi=ever-crucial_item=while-licensor=0-scope=1-npi_present=0	1		while the pedestrians never explore the malls , the pedestrians might win .
experiment=NPI-env=conditional-npi=ever-crucial_item=if-licensor=1-scope=1-npi_present=0	1		if the actors never breaking the plates , the actors could conspire .
experiment=NPI-env=conditional-npi=ever-crucial_item=while-licensor=0-scope=0-npi_present=1	0		ever while the actors breaking the plates , the actors could conspire .
experiment=NPI-env=conditional-npi=ever-crucial_item=if-licensor=1-scope=1-npi_present=0	1		if a guy never passed the cafes , a guy should hug humans .
experiment=NPI-env=conditional-npi=ever-crucial_item=if-licensor=1-scope=0-npi_present=1	0		ever if a guy passed the cafes , a guy should hug humans .
experiment=NPI-env=conditional-npi=ever-crucial_item=while-licensor=0-scope=0-npi_present=0	0		never while a guy passed the cafes , a guy should hug humans .
experiment=NPI-env=conditional-npi=ever-crucial_item=while-licensor=0-scope=1-npi_present=0	1		while a cashier never dislike the sheep , a cashier can spin around .
experiment=NPI-env=conditional-npi=ever-crucial_item=while-licensor=0-scope=0-npi_present=1	0		ever while a cashier dislike the sheep , a cashier can spin around .
experiment=NPI-env=conditional-npi=ever-crucial_item=while-licensor=0-scope=0-npi_present=0	0		never while a cashier dislike the sheep , a cashier can spin around .
experiment=NPI-env=conditional-npi=ever-crucial_item=if-licensor=1-scope=1-npi_present=0	1		if the adult never describes the banks , the adult should listen to children .
experiment=NPI-env=conditional-npi=ever-crucial_item=if-licensor=1-scope=0-npi_present=0	0		never if the adult describes the banks , the adult should listen to children .
experiment=NPI-env=conditional-npi=ever-crucial_item=while-licensor=0-scope=0-npi_present=1	0		ever while the adult describes the banks , the adult should listen to children .
experiment=NPI-env=conditional-npi=ever-crucial_item=while-licensor=0-scope=0-npi_present=0	0		never while the adult describes the banks , the adult should listen to children .
experiment=NPI-env=conditional-npi=ever-crucial_item=if-licensor=1-scope=1-npi_present=1	1		if the students ever watched the drivers , the students should die .
experiment=NPI-env=conditional-npi=ever-crucial_item=while-licensor=0-scope=1-npi_present=0	1		while a guest never listened to the guys , a guest could cheer .
experiment=NPI-env=conditional-npi=ever-crucial_item=if-licensor=1-scope=0-npi_present=1	0		ever if the gal bringing the rugs , the gal will forfeit .
experiment=NPI-env=conditional-npi=ever-crucial_item=if-licensor=1-scope=0-npi_present=0	0		never if the gal bringing the rugs , the gal will forfeit .
experiment=NPI-env=conditional-npi=ever-crucial_item=while-licensor=0-scope=1-npi_present=1	0		while the driver ever visits the museums , the driver would wear glasses .
experiment=NPI-env=conditional-npi=ever-crucial_item=while-licensor=0-scope=1-npi_present=0	1		while the driver never visits the museums , the driver would wear glasses .
experiment=NPI-env=conditional-npi=ever-crucial_item=while-licensor=0-scope=0-npi_present=1	0		ever while the driver visits the museums , the driver would wear glasses .
experiment=NPI-env=conditional-npi=ever-crucial_item=if-licensor=1-scope=1-npi_present=1	1		if the teacher ever known the cashiers , the teacher might negotiate .
experiment=NPI-env=conditional-npi=ever-crucial_item=if-licensor=1-scope=0-npi_present=1	0		ever if the teacher known the cashiers , the teacher might negotiate .
experiment=NPI-env=conditional-npi=ever-crucial_item=if-licensor=1-scope=1-npi_present=1	1		if the waitresses ever attack the alumni , the waitresses could be at grocery stores .
experiment=NPI-env=conditional-npi=ever-crucial_item=if-licensor=1-scope=0-npi_present=0	0		never if the waitresses attack the alumni , the waitresses could be at grocery stores .
experiment=NPI-env=conditional-npi=ever-crucial_item=while-licensor=0-scope=1-npi_present=1	0		while the waitresses ever attack the alumni , the waitresses could be at grocery stores .
experiment=NPI-env=conditional-npi=ever-crucial_item=if-licensor=1-scope=0-npi_present=1	0		ever if a waiter criticizing the restaurants , a waiter would blink .
experiment=NPI-env=conditional-npi=ever-crucial_item=while-licensor=0-scope=1-npi_present=1	0		while a waiter ever criticizing the restaurants , a waiter would blink .
experiment=NPI-env=conditional-npi=ever-crucial_item=while-licensor=0-scope=0-npi_present=0	0		never while a waiter criticizing the restaurants , a waiter would blink .
experiment=NPI-env=conditional-npi=ever-crucial_item=if-licensor=1-scope=0-npi_present=1	0		ever if the woman returned to the women , the woman might mutter .
experiment=NPI-env=conditional-npi=ever-crucial_item=if-licensor=1-scope=0-npi_present=0	0		never if the woman returned to the women , the woman might mutter .
experiment=NPI-env=conditional-npi=ever-crucial_item=while-licensor=0-scope=1-npi_present=1	0		while the woman ever returned to the women , the woman might mutter .
experiment=NPI-env=conditional-npi=ever-crucial_item=while-licensor=0-scope=0-npi_present=1	0		ever while the woman returned to the women , the woman might mutter .
experiment=NPI-env=conditional-npi=ever-crucial_item=if-licensor=1-scope=1-npi_present=1	1		if a boy ever visited the guests , a boy can boast .
experiment=NPI-env=conditional-npi=ever-crucial_item=if-licensor=1-scope=1-npi_present=0	1		if a boy never visited the guests , a boy can boast .
experiment=NPI-env=conditional-npi=ever-crucial_item=if-licensor=1-scope=0-npi_present=0	0		never if a boy visited the guests , a boy can boast .
experiment=NPI-env=conditional-npi=ever-crucial_item=if-licensor=1-scope=1-npi_present=0	1		if the patient never left the waitresses , the patient can talk about movie theaters .
experiment=NPI-env=conditional-npi=ever-crucial_item=if-licensor=1-scope=0-npi_present=1	0		ever if the patient left the waitresses , the patient can talk about movie theaters .
experiment=NPI-env=conditional-npi=ever-crucial_item=if-licensor=1-scope=0-npi_present=0	0		never if the patient left the waitresses , the patient can talk about movie theaters .
experiment=NPI-env=conditional-npi=ever-crucial_item=while-licensor=0-scope=1-npi_present=1	0		while the patient ever left the waitresses , the patient can talk about movie theaters .
experiment=NPI-env=conditional-npi=ever-crucial_item=if-licensor=1-scope=1-npi_present=1	1		if the actresses ever clean the books , the actresses will stretch .
experiment=NPI-env=conditional-npi=ever-crucial_item=if-licensor=1-scope=1-npi_present=0	1		if the actresses never clean the books , the actresses will stretch .
experiment=NPI-env=conditional-npi=ever-crucial_item=if-licensor=1-scope=0-npi_present=0	0		never if the actresses clean the books , the actresses will stretch .
experiment=NPI-env=conditional-npi=ever-crucial_item=while-licensor=0-scope=1-npi_present=1	0		while the actresses ever clean the books , the actresses will stretch .
experiment=NPI-env=conditional-npi=ever-crucial_item=while-licensor=0-scope=0-npi_present=0	0		never while the actresses clean the books , the actresses will stretch .
experiment=NPI-env=conditional-npi=ever-crucial_item=if-licensor=1-scope=1-npi_present=0	1		if the teacher never walked through the banks , the teacher can be at grocery stores .
experiment=NPI-env=conditional-npi=ever-crucial_item=while-licensor=0-scope=1-npi_present=1	0		while the teacher ever walked through the banks , the teacher can be at grocery stores .
experiment=NPI-env=conditional-npi=ever-crucial_item=if-licensor=1-scope=1-npi_present=0	1		if the adults never broken the books , the adults will kiss .
experiment=NPI-env=conditional-npi=ever-crucial_item=if-licensor=1-scope=0-npi_present=1	0		ever if the adults broken the books , the adults will kiss .
experiment=NPI-env=conditional-npi=ever-crucial_item=while-licensor=0-scope=0-npi_present=0	0		never while the adults broken the books , the adults will kiss .
experiment=NPI-env=conditional-npi=ever-crucial_item=if-licensor=1-scope=1-npi_present=1	1		if the adult ever examined the movies , the adult might break glasses .
experiment=NPI-env=conditional-npi=ever-crucial_item=if-licensor=1-scope=1-npi_present=0	1		if the adult never examined the movies , the adult might break glasses .
experiment=NPI-env=conditional-npi=ever-crucial_item=while-licensor=0-scope=1-npi_present=1	0		while the adult ever examined the movies , the adult might break glasses .
experiment=NPI-env=conditional-npi=ever-crucial_item=while-licensor=0-scope=0-npi_present=1	0		ever while the adult examined the movies , the adult might break glasses .
experiment=NPI-env=conditional-npi=ever-crucial_item=while-licensor=0-scope=0-npi_present=0	0		never while the adult examined the movies , the adult might break glasses .
experiment=NPI-env=conditional-npi=ever-crucial_item=if-licensor=1-scope=1-npi_present=0	1		if the men never bought the brochures , the men could drink .
experiment=NPI-env=conditional-npi=ever-crucial_item=while-licensor=0-scope=1-npi_present=1	0		while the men ever bought the brochures , the men could drink .
experiment=NPI-env=conditional-npi=ever-crucial_item=if-licensor=1-scope=1-npi_present=0	1		if the human never escapes from the grocery stores , the human might go to public parks .
experiment=NPI-env=conditional-npi=ever-crucial_item=if-licensor=1-scope=0-npi_present=1	0		ever if the human escapes from the grocery stores , the human might go to public parks .
experiment=NPI-env=conditional-npi=ever-crucial_item=if-licensor=1-scope=0-npi_present=0	0		never if the waitresses talking to the deer , the waitresses might succeed .
experiment=NPI-env=conditional-npi=ever-crucial_item=while-licensor=0-scope=1-npi_present=1	0		while the waitresses ever talking to the deer , the waitresses might succeed .
experiment=NPI-env=conditional-npi=ever-crucial_item=while-licensor=0-scope=0-npi_present=1	0		ever while the waitresses talking to the deer , the waitresses might succeed .
experiment=NPI-env=conditional-npi=ever-crucial_item=if-licensor=1-scope=1-npi_present=0	1		if a pedestrian never likes the pants , a pedestrian should explain everything .
experiment=NPI-env=conditional-npi=ever-crucial_item=if-licensor=1-scope=0-npi_present=1	0		ever if a pedestrian likes the pants , a pedestrian should explain everything .
experiment=NPI-env=conditional-npi=ever-crucial_item=while-licensor=0-scope=1-npi_present=1	0		while a pedestrian ever likes the pants , a pedestrian should explain everything .
experiment=NPI-env=conditional-npi=ever-crucial_item=while-licensor=0-scope=1-npi_present=0	1		while a pedestrian never likes the pants , a pedestrian should explain everything .
experiment=NPI-env=conditional-npi=ever-crucial_item=while-licensor=0-scope=1-npi_present=1	0		while a man ever boycotts the public parks , a man would go fishing .
experiment=NPI-env=conditional-npi=ever-crucial_item=while-licensor=0-scope=0-npi_present=1	0		ever while a man boycotts the public parks , a man would go fishing .
experiment=NPI-env=conditional-npi=ever-crucial_item=if-licensor=1-scope=0-npi_present=1	0		ever if the boys like the ladies , the boys would approve .
experiment=NPI-env=conditional-npi=ever-crucial_item=while-licensor=0-scope=1-npi_present=1	0		while the boys ever like the ladies , the boys would approve .
experiment=NPI-env=conditional-npi=ever-crucial_item=while-licensor=0-scope=1-npi_present=0	1		while the boys never like the ladies , the boys would approve .
experiment=NPI-env=conditional-npi=ever-crucial_item=if-licensor=1-scope=0-npi_present=1	0		ever if a customer loves the documentaries , a customer might shrug .
experiment=NPI-env=conditional-npi=ever-crucial_item=while-licensor=0-scope=1-npi_present=0	1		while a customer never loves the documentaries , a customer might shrug .
experiment=NPI-env=conditional-npi=ever-crucial_item=while-licensor=0-scope=0-npi_present=0	0		never while a customer loves the documentaries , a customer might shrug .
experiment=NPI-env=conditional-npi=ever-crucial_item=if-licensor=1-scope=1-npi_present=1	1		if the lady ever has the cars , the lady could respond .
experiment=NPI-env=conditional-npi=ever-crucial_item=if-licensor=1-scope=0-npi_present=1	0		ever if the lady has the cars , the lady could respond .
experiment=NPI-env=conditional-npi=ever-crucial_item=if-licensor=1-scope=0-npi_present=0	0		never if the lady has the cars , the lady could respond .
experiment=NPI-env=conditional-npi=ever-crucial_item=while-licensor=0-scope=1-npi_present=1	0		while the lady ever has the cars , the lady could respond .
experiment=NPI-env=conditional-npi=ever-crucial_item=while-licensor=0-scope=1-npi_present=0	1		while the actor never exited the grocery stores , the actor might work with teenagers .
experiment=NPI-env=conditional-npi=ever-crucial_item=while-licensor=0-scope=0-npi_present=0	0		never while the actor exited the grocery stores , the actor might work with teenagers .
experiment=NPI-env=conditional-npi=ever-crucial_item=if-licensor=1-scope=0-npi_present=1	0		ever if the driver lifting the gloves , the driver could worry .
experiment=NPI-env=conditional-npi=ever-crucial_item=while-licensor=0-scope=1-npi_present=1	0		while the driver ever lifting the gloves , the driver could worry .
experiment=NPI-env=conditional-npi=ever-crucial_item=if-licensor=1-scope=0-npi_present=1	0		ever if the drivers drop by the art galleries , the drivers will clean dishes .
experiment=NPI-env=conditional-npi=ever-crucial_item=if-licensor=1-scope=0-npi_present=0	0		never if the drivers drop by the art galleries , the drivers will clean dishes .
experiment=NPI-env=conditional-npi=ever-crucial_item=if-licensor=1-scope=0-npi_present=1	0		ever if the actors investigating the libraries , the actors can reply .
experiment=NPI-env=conditional-npi=ever-crucial_item=if-licensor=1-scope=0-npi_present=0	0		never if the actors investigating the libraries , the actors can reply .
experiment=NPI-env=conditional-npi=ever-crucial_item=if-licensor=1-scope=1-npi_present=1	1		if the people ever exit the banks , the people would win .
experiment=NPI-env=conditional-npi=ever-crucial_item=if-licensor=1-scope=0-npi_present=1	0		ever if the people exit the banks , the people would win .
experiment=NPI-env=conditional-npi=ever-crucial_item=if-licensor=1-scope=0-npi_present=0	0		never if the people exit the banks , the people would win .
experiment=NPI-env=conditional-npi=ever-crucial_item=while-licensor=0-scope=0-npi_present=0	0		never while the people exit the banks , the people would win .
experiment=NPI-env=conditional-npi=ever-crucial_item=if-licensor=1-scope=1-npi_present=0	1		if a man never criticizing the alumni , a man can observe actors .
experiment=NPI-env=conditional-npi=ever-crucial_item=if-licensor=1-scope=0-npi_present=1	0		ever if a man criticizing the alumni , a man can observe actors .
experiment=NPI-env=conditional-npi=ever-crucial_item=if-licensor=1-scope=0-npi_present=0	0		never if a man criticizing the alumni , a man can observe actors .
experiment=NPI-env=conditional-npi=ever-crucial_item=while-licensor=0-scope=1-npi_present=1	0		while a man ever criticizing the alumni , a man can observe actors .
experiment=NPI-env=conditional-npi=ever-crucial_item=while-licensor=0-scope=0-npi_present=1	0		ever while a man criticizing the alumni , a man can observe actors .
experiment=NPI-env=conditional-npi=ever-crucial_item=if-licensor=1-scope=1-npi_present=1	1		if the guy ever fled from the grocery stores , the guy could run around malls .
experiment=NPI-env=conditional-npi=ever-crucial_item=if-licensor=1-scope=0-npi_present=1	0		ever if the guy fled from the grocery stores , the guy could run around malls .
experiment=NPI-env=conditional-npi=ever-crucial_item=while-licensor=0-scope=1-npi_present=0	1		while the guy never fled from the grocery stores , the guy could run around malls .
experiment=NPI-env=conditional-npi=ever-crucial_item=while-licensor=0-scope=0-npi_present=1	0		ever while the guy fled from the grocery stores , the guy could run around malls .
experiment=NPI-env=conditional-npi=ever-crucial_item=if-licensor=1-scope=1-npi_present=1	1		if the gals ever listening to the customers , the gals can flee from doctors .
experiment=NPI-env=conditional-npi=ever-crucial_item=if-licensor=1-scope=1-npi_present=0	1		if the gals never listening to the customers , the gals can flee from doctors .
experiment=NPI-env=conditional-npi=ever-crucial_item=if-licensor=1-scope=0-npi_present=0	0		never if the gals listening to the customers , the gals can flee from doctors .
experiment=NPI-env=conditional-npi=ever-crucial_item=if-licensor=1-scope=1-npi_present=1	1		if the gal ever be at the malls , the gal can talk about grocery stores .
experiment=NPI-env=conditional-npi=ever-crucial_item=while-licensor=0-scope=1-npi_present=0	1		while the gal never be at the malls , the gal can talk about grocery stores .
experiment=NPI-env=conditional-npi=ever-crucial_item=while-licensor=0-scope=0-npi_present=0	0		never while the gal be at the malls , the gal can talk about grocery stores .
experiment=NPI-env=conditional-npi=ever-crucial_item=if-licensor=1-scope=1-npi_present=1	1		if the actresses ever kissing the guys , the actresses should forget mice .
experiment=NPI-env=conditional-npi=ever-crucial_item=if-licensor=1-scope=0-npi_present=1	0		ever if the actresses kissing the guys , the actresses should forget mice .
experiment=NPI-env=conditional-npi=ever-crucial_item=while-licensor=0-scope=1-npi_present=1	0		while the actresses ever kissing the guys , the actresses should forget mice .
experiment=NPI-env=conditional-npi=ever-crucial_item=while-licensor=0-scope=0-npi_present=0	0		never while the actresses kissing the guys , the actresses should forget mice .
experiment=NPI-env=conditional-npi=ever-crucial_item=if-licensor=1-scope=1-npi_present=0	1		if the cashiers never love the brochures , the cashiers can write hard .
experiment=NPI-env=conditional-npi=ever-crucial_item=if-licensor=1-scope=0-npi_present=0	0		never if the cashiers love the brochures , the cashiers can write hard .
experiment=NPI-env=conditional-npi=ever-crucial_item=while-licensor=0-scope=1-npi_present=1	0		while the cashiers ever love the brochures , the cashiers can write hard .
experiment=NPI-env=conditional-npi=ever-crucial_item=if-licensor=1-scope=1-npi_present=0	1		if the humans never escape from the restaurants , the humans can write hard .
experiment=NPI-env=conditional-npi=ever-crucial_item=if-licensor=1-scope=0-npi_present=1	0		ever if the humans escape from the restaurants , the humans can write hard .
experiment=NPI-env=conditional-npi=ever-crucial_item=while-licensor=0-scope=1-npi_present=1	0		while the humans ever escape from the restaurants , the humans can write hard .
experiment=NPI-env=conditional-npi=ever-crucial_item=while-licensor=0-scope=0-npi_present=0	0		never while the humans escape from the restaurants , the humans can write hard .
experiment=NPI-env=conditional-npi=ever-crucial_item=if-licensor=1-scope=1-npi_present=0	1		if a child never touring the libraries , a child can investigate high schools .
experiment=NPI-env=conditional-npi=ever-crucial_item=while-licensor=0-scope=1-npi_present=1	0		while a child ever touring the libraries , a child can investigate high schools .
experiment=NPI-env=conditional-npi=ever-crucial_item=if-licensor=1-scope=0-npi_present=1	0		ever if the guests respected the waitresses , the guests will bike to schools .
experiment=NPI-env=conditional-npi=ever-crucial_item=if-licensor=1-scope=0-npi_present=0	0		never if the guests respected the waitresses , the guests will bike to schools .
