experiment=NPI-env=only-npi=any-crucial_item=_-licensor=1-scope=0-npi_present=1	0		any ladies can only approach the girls .
experiment=NPI-env=only-npi=any-crucial_item=_-licensor=1-scope=0-npi_present=0	1		some ladies can only approach the girls .
experiment=NPI-env=only-npi=any-crucial_item=_-licensor=0-scope=0-npi_present=0	1		some ladies can also approach the girls .
experiment=NPI-env=only-npi=any-crucial_item=_-licensor=1-scope=1-npi_present=1	1		only a patient exits any public parks .
experiment=NPI-env=only-npi=any-crucial_item=_-licensor=0-scope=1-npi_present=1	0		a patient also exits any public parks .
experiment=NPI-env=only-npi=any-crucial_item=_-licensor=1-scope=0-npi_present=0	1		some guest can only hate the men .
experiment=NPI-env=only-npi=any-crucial_item=_-licensor=0-scope=1-npi_present=1	0		the guest can also hate any men .
experiment=NPI-env=only-npi=any-crucial_item=_-licensor=0-scope=1-npi_present=0	1		the guest can also hate some men .
experiment=NPI-env=only-npi=any-crucial_item=_-licensor=0-scope=0-npi_present=0	1		some guest can also hate the men .
experiment=NPI-env=only-npi=any-crucial_item=_-licensor=1-scope=1-npi_present=0	1		only the women arrived at some restaurants .
experiment=NPI-env=only-npi=any-crucial_item=_-licensor=0-scope=0-npi_present=0	1		some women also arrived at the restaurants .
experiment=NPI-env=only-npi=any-crucial_item=_-licensor=1-scope=1-npi_present=0	1		only the teenagers have driven to some art galleries .
experiment=NPI-env=only-npi=any-crucial_item=_-licensor=0-scope=1-npi_present=1	0		the teenagers have also driven to any art galleries .
experiment=NPI-env=only-npi=any-crucial_item=_-licensor=0-scope=1-npi_present=0	1		the teenagers have also driven to some art galleries .
experiment=NPI-env=only-npi=any-crucial_item=_-licensor=0-scope=0-npi_present=1	0		any teenagers have also driven to the art galleries .
experiment=NPI-env=only-npi=any-crucial_item=_-licensor=0-scope=0-npi_present=0	1		some teenagers have also driven to the art galleries .
experiment=NPI-env=only-npi=any-crucial_item=_-licensor=0-scope=0-npi_present=0	1		some adults have also attacked the teenagers .
experiment=NPI-env=only-npi=any-crucial_item=_-licensor=0-scope=1-npi_present=0	1		the lady also talks to some cashiers .
experiment=NPI-env=only-npi=any-crucial_item=_-licensor=0-scope=0-npi_present=1	0		any lady also talks to the cashiers .
experiment=NPI-env=only-npi=any-crucial_item=_-licensor=1-scope=0-npi_present=1	0		any girl had only been at the restaurants .
experiment=NPI-env=only-npi=any-crucial_item=_-licensor=1-scope=0-npi_present=0	1		some girl had only been at the restaurants .
experiment=NPI-env=only-npi=any-crucial_item=_-licensor=0-scope=1-npi_present=0	1		the girl had also been at some restaurants .
experiment=NPI-env=only-npi=any-crucial_item=_-licensor=0-scope=0-npi_present=0	1		some girl had also been at the restaurants .
experiment=NPI-env=only-npi=any-crucial_item=_-licensor=1-scope=1-npi_present=0	1		only the customers have investigated some doctors .
experiment=NPI-env=only-npi=any-crucial_item=_-licensor=0-scope=0-npi_present=1	0		any customers have also investigated the doctors .
experiment=NPI-env=only-npi=any-crucial_item=_-licensor=1-scope=0-npi_present=0	1		some boy had only been at the high schools .
experiment=NPI-env=only-npi=any-crucial_item=_-licensor=1-scope=1-npi_present=1	1		only the woman saw any people .
experiment=NPI-env=only-npi=any-crucial_item=_-licensor=1-scope=1-npi_present=0	1		only the woman saw some people .
experiment=NPI-env=only-npi=any-crucial_item=_-licensor=1-scope=0-npi_present=1	0		any woman only saw the people .
experiment=NPI-env=only-npi=any-crucial_item=_-licensor=0-scope=1-npi_present=1	0		the woman also saw any people .
experiment=NPI-env=only-npi=any-crucial_item=_-licensor=0-scope=1-npi_present=0	1		the woman also saw some people .
experiment=NPI-env=only-npi=any-crucial_item=_-licensor=1-scope=0-npi_present=0	1		some patient will only pass the malls .
experiment=NPI-env=only-npi=any-crucial_item=_-licensor=0-scope=0-npi_present=1	0		any patient will also pass the malls .
experiment=NPI-env=only-npi=any-crucial_item=_-licensor=1-scope=0-npi_present=1	0		any waiters only is at the restaurants .
experiment=NPI-env=only-npi=any-crucial_item=_-licensor=0-scope=0-npi_present=0	1		some waiters also is at the restaurants .
experiment=NPI-env=only-npi=any-crucial_item=_-licensor=1-scope=0-npi_present=1	0		any ladies could only hate the movies .
experiment=NPI-env=only-npi=any-crucial_item=_-licensor=1-scope=0-npi_present=0	1		some ladies could only hate the movies .
experiment=NPI-env=only-npi=any-crucial_item=_-licensor=0-scope=1-npi_present=1	0		the ladies could also hate any movies .
experiment=NPI-env=only-npi=any-crucial_item=_-licensor=0-scope=1-npi_present=0	1		the ladies could also hate some movies .
experiment=NPI-env=only-npi=any-crucial_item=_-licensor=0-scope=0-npi_present=0	1		some ladies could also hate the movies .
experiment=NPI-env=only-npi=any-crucial_item=_-licensor=0-scope=0-npi_present=1	0		any drivers should also drive to the movie theaters .
experiment=NPI-env=only-npi=any-crucial_item=_-licensor=0-scope=0-npi_present=0	1		some drivers should also drive to the movie theaters .
experiment=NPI-env=only-npi=any-crucial_item=_-licensor=1-scope=1-npi_present=1	1		only a teenager has forgotten any women .
experiment=NPI-env=only-npi=any-crucial_item=_-licensor=1-scope=1-npi_present=0	1		only a teenager has forgotten some women .
experiment=NPI-env=only-npi=any-crucial_item=_-licensor=1-scope=0-npi_present=0	1		some teenager has only forgotten the women .
experiment=NPI-env=only-npi=any-crucial_item=_-licensor=0-scope=1-npi_present=0	1		a teenager has also forgotten some women .
experiment=NPI-env=only-npi=any-crucial_item=_-licensor=0-scope=0-npi_present=1	0		any teenager has also forgotten the women .
experiment=NPI-env=only-npi=any-crucial_item=_-licensor=1-scope=1-npi_present=1	1		only the drivers had attacked any waiters .
experiment=NPI-env=only-npi=any-crucial_item=_-licensor=1-scope=0-npi_present=1	0		any drivers had only attacked the waiters .
experiment=NPI-env=only-npi=any-crucial_item=_-licensor=1-scope=0-npi_present=0	1		some drivers had only attacked the waiters .
experiment=NPI-env=only-npi=any-crucial_item=_-licensor=0-scope=1-npi_present=1	0		the drivers had also attacked any waiters .
experiment=NPI-env=only-npi=any-crucial_item=_-licensor=0-scope=0-npi_present=1	0		any drivers had also attacked the waiters .
experiment=NPI-env=only-npi=any-crucial_item=_-licensor=0-scope=0-npi_present=0	1		some drivers had also attacked the waiters .
experiment=NPI-env=only-npi=any-crucial_item=_-licensor=1-scope=1-npi_present=0	1		only the human references some customers .
experiment=NPI-env=only-npi=any-crucial_item=_-licensor=1-scope=0-npi_present=0	1		some human only references the customers .
experiment=NPI-env=only-npi=any-crucial_item=_-licensor=0-scope=0-npi_present=1	0		any human also references the customers .
experiment=NPI-env=only-npi=any-crucial_item=_-licensor=0-scope=0-npi_present=0	1		some human also references the customers .
experiment=NPI-env=only-npi=any-crucial_item=_-licensor=1-scope=1-npi_present=1	1		only an actress references any ladies .
experiment=NPI-env=only-npi=any-crucial_item=_-licensor=1-scope=1-npi_present=0	1		only an actress references some ladies .
experiment=NPI-env=only-npi=any-crucial_item=_-licensor=1-scope=1-npi_present=1	1		only a waiter will exit any high schools .
experiment=NPI-env=only-npi=any-crucial_item=_-licensor=1-scope=0-npi_present=0	1		some waiter will only exit the high schools .
experiment=NPI-env=only-npi=any-crucial_item=_-licensor=1-scope=1-npi_present=1	1		only the cashiers will resemble any movies .
experiment=NPI-env=only-npi=any-crucial_item=_-licensor=0-scope=0-npi_present=1	0		any cashiers will also resemble the movies .
experiment=NPI-env=only-npi=any-crucial_item=_-licensor=0-scope=1-npi_present=0	1		a guest has also worked with some women .
experiment=NPI-env=only-npi=any-crucial_item=_-licensor=0-scope=0-npi_present=0	1		some guest has also worked with the women .
experiment=NPI-env=only-npi=any-crucial_item=_-licensor=1-scope=1-npi_present=1	1		only the cashiers kissed any actresses .
experiment=NPI-env=only-npi=any-crucial_item=_-licensor=1-scope=1-npi_present=0	1		only the cashiers kissed some actresses .
experiment=NPI-env=only-npi=any-crucial_item=_-licensor=0-scope=1-npi_present=0	1		the cashiers also kissed some actresses .
experiment=NPI-env=only-npi=any-crucial_item=_-licensor=0-scope=0-npi_present=1	0		any cashiers also kissed the actresses .
experiment=NPI-env=only-npi=any-crucial_item=_-licensor=1-scope=1-npi_present=0	1		only the actresses have investigated some drivers .
experiment=NPI-env=only-npi=any-crucial_item=_-licensor=1-scope=0-npi_present=1	0		any actresses have only investigated the drivers .
experiment=NPI-env=only-npi=any-crucial_item=_-licensor=1-scope=0-npi_present=0	1		some actresses have only investigated the drivers .
experiment=NPI-env=only-npi=any-crucial_item=_-licensor=1-scope=1-npi_present=1	1		only the guest might like any gals .
experiment=NPI-env=only-npi=any-crucial_item=_-licensor=0-scope=1-npi_present=1	0		the guest might also like any gals .
experiment=NPI-env=only-npi=any-crucial_item=_-licensor=1-scope=1-npi_present=0	1		only a guy resembled some cashiers .
experiment=NPI-env=only-npi=any-crucial_item=_-licensor=1-scope=0-npi_present=1	0		any guy only resembled the cashiers .
experiment=NPI-env=only-npi=any-crucial_item=_-licensor=0-scope=1-npi_present=1	0		a guy also resembled any cashiers .
experiment=NPI-env=only-npi=any-crucial_item=_-licensor=0-scope=1-npi_present=0	1		a guy also resembled some cashiers .
experiment=NPI-env=only-npi=any-crucial_item=_-licensor=1-scope=1-npi_present=1	1		only a cashier watches any people .
experiment=NPI-env=only-npi=any-crucial_item=_-licensor=1-scope=1-npi_present=0	1		only a cashier watches some people .
experiment=NPI-env=only-npi=any-crucial_item=_-licensor=0-scope=1-npi_present=1	0		a cashier also watches any people .
experiment=NPI-env=only-npi=any-crucial_item=_-licensor=1-scope=1-npi_present=1	1		only the humans have gone to any museums .
experiment=NPI-env=only-npi=any-crucial_item=_-licensor=1-scope=1-npi_present=0	1		only the humans have gone to some museums .
experiment=NPI-env=only-npi=any-crucial_item=_-licensor=1-scope=0-npi_present=0	1		some humans have only gone to the museums .
experiment=NPI-env=only-npi=any-crucial_item=_-licensor=0-scope=1-npi_present=1	0		the humans have also gone to any museums .
experiment=NPI-env=only-npi=any-crucial_item=_-licensor=0-scope=1-npi_present=0	1		the humans have also gone to some museums .
experiment=NPI-env=only-npi=any-crucial_item=_-licensor=1-scope=1-npi_present=1	1		only the child would walk through any high schools .
experiment=NPI-env=only-npi=any-crucial_item=_-licensor=1-scope=1-npi_present=1	1		only the teacher can forget any reports .
experiment=NPI-env=only-npi=any-crucial_item=_-licensor=1-scope=1-npi_present=0	1		only the teacher can forget some reports .
experiment=NPI-env=only-npi=any-crucial_item=_-licensor=1-scope=0-npi_present=1	0		any teacher can only forget the reports .
experiment=NPI-env=only-npi=any-crucial_item=_-licensor=1-scope=0-npi_present=0	1		some teacher can only forget the reports .
experiment=NPI-env=only-npi=any-crucial_item=_-licensor=0-scope=1-npi_present=0	1		the teacher can also forget some reports .
experiment=NPI-env=only-npi=any-crucial_item=_-licensor=1-scope=1-npi_present=1	1		only an adult does arrive at any public parks .
experiment=NPI-env=only-npi=any-crucial_item=_-licensor=1-scope=0-npi_present=1	0		any adult does only arrive at the public parks .
experiment=NPI-env=only-npi=any-crucial_item=_-licensor=0-scope=1-npi_present=1	0		an adult does also arrive at any public parks .
experiment=NPI-env=only-npi=any-crucial_item=_-licensor=1-scope=1-npi_present=0	1		only the boys could respect some grocery stores .
experiment=NPI-env=only-npi=any-crucial_item=_-licensor=1-scope=0-npi_present=1	0		any boys could only respect the grocery stores .
experiment=NPI-env=only-npi=any-crucial_item=_-licensor=1-scope=0-npi_present=0	1		some boys could only respect the grocery stores .
experiment=NPI-env=only-npi=any-crucial_item=_-licensor=1-scope=1-npi_present=0	1		only the driver insults some cashiers .
experiment=NPI-env=only-npi=any-crucial_item=_-licensor=0-scope=1-npi_present=0	1		the driver also insults some cashiers .
experiment=NPI-env=only-npi=any-crucial_item=_-licensor=1-scope=0-npi_present=0	1		some students did only bring the glasses .
experiment=NPI-env=only-npi=any-crucial_item=_-licensor=0-scope=1-npi_present=1	0		the students did also bring any glasses .
experiment=NPI-env=only-npi=any-crucial_item=_-licensor=0-scope=1-npi_present=0	1		the students did also bring some glasses .
experiment=NPI-env=only-npi=any-crucial_item=_-licensor=0-scope=0-npi_present=1	0		any students did also bring the glasses .
experiment=NPI-env=only-npi=any-crucial_item=_-licensor=1-scope=1-npi_present=1	1		only a woman walks through any college campuses .
experiment=NPI-env=only-npi=any-crucial_item=_-licensor=1-scope=1-npi_present=0	1		only a woman walks through some college campuses .
experiment=NPI-env=only-npi=any-crucial_item=_-licensor=1-scope=0-npi_present=1	0		any woman only walks through the college campuses .
experiment=NPI-env=only-npi=any-crucial_item=_-licensor=0-scope=0-npi_present=1	0		any people would also take the newspaper articles .
experiment=NPI-env=only-npi=any-crucial_item=_-licensor=1-scope=1-npi_present=1	1		only the students lifted any dishes .
experiment=NPI-env=only-npi=any-crucial_item=_-licensor=1-scope=0-npi_present=1	0		any students only lifted the dishes .
experiment=NPI-env=only-npi=any-crucial_item=_-licensor=1-scope=0-npi_present=0	1		some students only lifted the dishes .
experiment=NPI-env=only-npi=any-crucial_item=_-licensor=0-scope=1-npi_present=0	1		the students also lifted some dishes .
experiment=NPI-env=only-npi=any-crucial_item=_-licensor=1-scope=0-npi_present=1	0		any waiter only kisses the girls .
experiment=NPI-env=only-npi=any-crucial_item=_-licensor=0-scope=1-npi_present=1	0		the cashiers could also clean any pants .
experiment=NPI-env=only-npi=any-crucial_item=_-licensor=0-scope=1-npi_present=0	1		the cashiers could also clean some pants .
experiment=NPI-env=only-npi=any-crucial_item=_-licensor=0-scope=0-npi_present=0	1		some cashiers could also clean the pants .
experiment=NPI-env=only-npi=any-crucial_item=_-licensor=1-scope=0-npi_present=1	0		any adult did only bike to the museums .
experiment=NPI-env=only-npi=any-crucial_item=_-licensor=1-scope=0-npi_present=0	1		some adult did only bike to the museums .
experiment=NPI-env=only-npi=any-crucial_item=_-licensor=0-scope=1-npi_present=1	0		an adult did also bike to any museums .
experiment=NPI-env=only-npi=any-crucial_item=_-licensor=0-scope=0-npi_present=1	0		any adult did also bike to the museums .
experiment=NPI-env=only-npi=any-crucial_item=_-licensor=1-scope=1-npi_present=1	1		only the guy did sell any gloves .
experiment=NPI-env=only-npi=any-crucial_item=_-licensor=1-scope=0-npi_present=1	0		any guy did only sell the gloves .
experiment=NPI-env=only-npi=any-crucial_item=_-licensor=1-scope=0-npi_present=0	1		some guy did only sell the gloves .
experiment=NPI-env=only-npi=any-crucial_item=_-licensor=0-scope=1-npi_present=1	0		the guy did also sell any gloves .
experiment=NPI-env=only-npi=any-crucial_item=_-licensor=0-scope=0-npi_present=1	0		any guy did also sell the gloves .
experiment=NPI-env=only-npi=any-crucial_item=_-licensor=0-scope=1-npi_present=1	0		the people can also drop by any restaurants .
experiment=NPI-env=only-npi=any-crucial_item=_-licensor=0-scope=1-npi_present=0	1		the people can also drop by some restaurants .
experiment=NPI-env=only-npi=any-crucial_item=_-licensor=0-scope=0-npi_present=1	0		any people can also drop by the restaurants .
experiment=NPI-env=only-npi=any-crucial_item=_-licensor=1-scope=1-npi_present=1	1		only the customers hug any actresses .
experiment=NPI-env=only-npi=any-crucial_item=_-licensor=1-scope=1-npi_present=0	1		only the customers hug some actresses .
experiment=NPI-env=only-npi=any-crucial_item=_-licensor=1-scope=0-npi_present=0	1		some customers only hug the actresses .
experiment=NPI-env=only-npi=any-crucial_item=_-licensor=0-scope=1-npi_present=0	1		the customers also hug some actresses .
experiment=NPI-env=only-npi=any-crucial_item=_-licensor=0-scope=0-npi_present=1	0		any customers also hug the actresses .
experiment=NPI-env=only-npi=any-crucial_item=_-licensor=0-scope=1-npi_present=0	1		the actresses also brought some rugs .
experiment=NPI-env=only-npi=any-crucial_item=_-licensor=0-scope=0-npi_present=1	0		any girls have also kissed the actors .
experiment=NPI-env=only-npi=any-crucial_item=_-licensor=0-scope=0-npi_present=0	1		some girls have also kissed the actors .
experiment=NPI-env=only-npi=any-crucial_item=_-licensor=1-scope=1-npi_present=1	1		only the student has cared for any teachers .
experiment=NPI-env=only-npi=any-crucial_item=_-licensor=1-scope=0-npi_present=0	1		some student has only cared for the teachers .
experiment=NPI-env=only-npi=any-crucial_item=_-licensor=1-scope=1-npi_present=1	1		only a waiter has worn any gloves .
experiment=NPI-env=only-npi=any-crucial_item=_-licensor=0-scope=1-npi_present=0	1		a woman also boycotts some public parks .
experiment=NPI-env=only-npi=any-crucial_item=_-licensor=1-scope=1-npi_present=1	1		only a guest discussed any customers .
experiment=NPI-env=only-npi=any-crucial_item=_-licensor=1-scope=0-npi_present=1	0		any guest only discussed the customers .
experiment=NPI-env=only-npi=any-crucial_item=_-licensor=0-scope=0-npi_present=1	0		any guest also discussed the customers .
experiment=NPI-env=only-npi=any-crucial_item=_-licensor=0-scope=0-npi_present=0	1		some guest also discussed the customers .
experiment=NPI-env=only-npi=any-crucial_item=_-licensor=1-scope=0-npi_present=1	0		any actors only boycott the hospitals .
experiment=NPI-env=only-npi=any-crucial_item=_-licensor=0-scope=0-npi_present=1	0		any actors also boycott the hospitals .
experiment=NPI-env=only-npi=any-crucial_item=_-licensor=1-scope=1-npi_present=1	1		only the doctors disliked any newspaper articles .
experiment=NPI-env=only-npi=any-crucial_item=_-licensor=1-scope=0-npi_present=0	1		some doctors only disliked the newspaper articles .
experiment=NPI-env=only-npi=any-crucial_item=_-licensor=0-scope=1-npi_present=0	1		the doctors also disliked some newspaper articles .
experiment=NPI-env=only-npi=any-crucial_item=_-licensor=0-scope=1-npi_present=1	0		the customer also attacked any actors .
experiment=NPI-env=only-npi=any-crucial_item=_-licensor=0-scope=0-npi_present=1	0		any customer also attacked the actors .
experiment=NPI-env=only-npi=yet-crucial_item=_-licensor=1-scope=0-npi_present=1	0		the humans escape from the women at all only this week .
experiment=NPI-env=only-npi=yet-crucial_item=_-licensor=0-scope=0-npi_present=0	1		the humans escape from the women appropriately also this week .
experiment=NPI-env=only-npi=yet-crucial_item=_-licensor=0-scope=0-npi_present=0	1		the teenagers had cleaned the glasses angrily also this year .
experiment=NPI-env=only-npi=yet-crucial_item=_-licensor=1-scope=1-npi_present=1	1		only the man has walked through the public parks at all this week .
experiment=NPI-env=only-npi=yet-crucial_item=_-licensor=1-scope=1-npi_present=0	1		only the man has walked through the public parks happily this week .
experiment=NPI-env=only-npi=yet-crucial_item=_-licensor=1-scope=0-npi_present=0	1		the man has walked through the public parks happily only this week .
experiment=NPI-env=only-npi=yet-crucial_item=_-licensor=0-scope=0-npi_present=1	0		the man has walked through the public parks at all also this week .
experiment=NPI-env=only-npi=yet-crucial_item=_-licensor=0-scope=0-npi_present=0	1		the man has walked through the public parks happily also this week .
experiment=NPI-env=only-npi=yet-crucial_item=_-licensor=1-scope=1-npi_present=1	1		only a customer explores the banks at all today .
experiment=NPI-env=only-npi=yet-crucial_item=_-licensor=1-scope=1-npi_present=0	1		only a customer explores the banks happily today .
experiment=NPI-env=only-npi=yet-crucial_item=_-licensor=0-scope=0-npi_present=1	0		a customer explores the banks at all also today .
experiment=NPI-env=only-npi=yet-crucial_item=_-licensor=1-scope=1-npi_present=1	1		only the guy might lift the rugs at all sometimes .
experiment=NPI-env=only-npi=yet-crucial_item=_-licensor=0-scope=0-npi_present=1	0		the guy might lift the rugs at all also sometimes .
experiment=NPI-env=only-npi=yet-crucial_item=_-licensor=1-scope=1-npi_present=1	1		only a driver can talk about the adults at all this year .
experiment=NPI-env=only-npi=yet-crucial_item=_-licensor=1-scope=1-npi_present=0	1		only a driver can talk about the adults happily this year .
experiment=NPI-env=only-npi=yet-crucial_item=_-licensor=0-scope=1-npi_present=1	0		a driver can also talk about the adults at all this year .
experiment=NPI-env=only-npi=yet-crucial_item=_-licensor=0-scope=0-npi_present=1	0		a driver can talk about the adults at all also this year .
experiment=NPI-env=only-npi=yet-crucial_item=_-licensor=1-scope=1-npi_present=0	1		only the children explored the high schools inappropriately sometimes .
experiment=NPI-env=only-npi=yet-crucial_item=_-licensor=1-scope=0-npi_present=1	0		the children explored the high schools at all only sometimes .
experiment=NPI-env=only-npi=yet-crucial_item=_-licensor=1-scope=0-npi_present=0	1		the children explored the high schools inappropriately only sometimes .
experiment=NPI-env=only-npi=yet-crucial_item=_-licensor=1-scope=1-npi_present=0	1		only the driver admired the guys inappropriately sometimes .
experiment=NPI-env=only-npi=yet-crucial_item=_-licensor=1-scope=0-npi_present=0	1		the driver admired the guys inappropriately only sometimes .
experiment=NPI-env=only-npi=yet-crucial_item=_-licensor=0-scope=1-npi_present=0	1		the driver also admired the guys inappropriately sometimes .
experiment=NPI-env=only-npi=yet-crucial_item=_-licensor=1-scope=0-npi_present=1	0		the woman could go to the museums at all only today .
experiment=NPI-env=only-npi=yet-crucial_item=_-licensor=1-scope=0-npi_present=0	1		the woman could go to the museums inappropriately only today .
experiment=NPI-env=only-npi=yet-crucial_item=_-licensor=0-scope=0-npi_present=1	0		the woman could go to the museums at all also today .
experiment=NPI-env=only-npi=yet-crucial_item=_-licensor=1-scope=0-npi_present=1	0		the doctors know the actors at all only this year .
experiment=NPI-env=only-npi=yet-crucial_item=_-licensor=0-scope=1-npi_present=0	1		the doctors also know the actors happily this year .
experiment=NPI-env=only-npi=yet-crucial_item=_-licensor=0-scope=1-npi_present=1	0		the guys had also seen the shoes at all this week .
experiment=NPI-env=only-npi=yet-crucial_item=_-licensor=1-scope=0-npi_present=1	0		a customer talked to the gals at all only today .
experiment=NPI-env=only-npi=yet-crucial_item=_-licensor=0-scope=1-npi_present=1	0		a customer also talked to the gals at all today .
experiment=NPI-env=only-npi=yet-crucial_item=_-licensor=1-scope=0-npi_present=1	0		a child bikes to the cafes at all only this year .
experiment=NPI-env=only-npi=yet-crucial_item=_-licensor=0-scope=0-npi_present=0	1		a child bikes to the cafes appropriately also this year .
experiment=NPI-env=only-npi=yet-crucial_item=_-licensor=1-scope=1-npi_present=1	1		only a cashier bought the shoes at all sometimes .
experiment=NPI-env=only-npi=yet-crucial_item=_-licensor=1-scope=0-npi_present=1	0		a cashier bought the shoes at all only sometimes .
experiment=NPI-env=only-npi=yet-crucial_item=_-licensor=0-scope=1-npi_present=1	0		a cashier also bought the shoes at all sometimes .
experiment=NPI-env=only-npi=yet-crucial_item=_-licensor=1-scope=1-npi_present=1	1		only the teenagers broke the chairs at all this week .
experiment=NPI-env=only-npi=yet-crucial_item=_-licensor=1-scope=0-npi_present=0	1		the teenagers broke the chairs appropriately only this week .
experiment=NPI-env=only-npi=yet-crucial_item=_-licensor=0-scope=0-npi_present=0	1		the teenagers broke the chairs appropriately also this week .
experiment=NPI-env=only-npi=yet-crucial_item=_-licensor=1-scope=1-npi_present=0	1		only the ladies disliked the teenagers appropriately sometimes .
experiment=NPI-env=only-npi=yet-crucial_item=_-licensor=1-scope=0-npi_present=1	0		the ladies disliked the teenagers at all only sometimes .
experiment=NPI-env=only-npi=yet-crucial_item=_-licensor=0-scope=0-npi_present=1	0		the ladies disliked the teenagers at all also sometimes .
experiment=NPI-env=only-npi=yet-crucial_item=_-licensor=0-scope=0-npi_present=0	1		the ladies disliked the teenagers appropriately also sometimes .
experiment=NPI-env=only-npi=yet-crucial_item=_-licensor=0-scope=1-npi_present=1	0		a patient also talks to the customers at all sometimes .
experiment=NPI-env=only-npi=yet-crucial_item=_-licensor=1-scope=1-npi_present=1	1		only a human listens to the doctors at all this year .
experiment=NPI-env=only-npi=yet-crucial_item=_-licensor=1-scope=1-npi_present=0	1		only a human listens to the doctors inappropriately this year .
experiment=NPI-env=only-npi=yet-crucial_item=_-licensor=1-scope=0-npi_present=1	0		a human listens to the doctors at all only this year .
experiment=NPI-env=only-npi=yet-crucial_item=_-licensor=0-scope=1-npi_present=0	1		a human also listens to the doctors inappropriately this year .
experiment=NPI-env=only-npi=yet-crucial_item=_-licensor=1-scope=0-npi_present=1	0		the pedestrians boycott the malls at all only this week .
