reflexive	That boy that didn't escape from himself is hugging some children.	That boy that didn't escape from themselves is hugging some children.	1
reflexive	The gals who had discussed himself haven't approached every guy.	The gals who had discussed themselves haven't approached every guy.	0
reflexive	A lot of men that work with himself hadn't disliked this man.	A lot of men that work with themselves hadn't disliked this man.	0
reflexive	The man that hadn't left themselves does approach these children.	The man that hadn't left himself does approach these children.	0
reflexive	Every woman who has investigated herself resembled this story.	Every woman who has investigated itself resembled this story.	1
reflexive	Drivers that haven't listened to herself aren't attacking some girl.	Drivers that haven't listened to themselves aren't attacking some girl.	0
reflexive	All drivers that won't talk about themselves were discussing every movie theater.	All drivers that won't talk about itself were discussing every movie theater.	1
reflexive	Some humans who hadn't approached itself were returning to every bank.	Some humans who hadn't approached themselves were returning to every bank.	0
reflexive	All plays that aren't criticizing themselves discuss some mall.	All plays that aren't criticizing itself discuss some mall.	1
reflexive	The lady who liked itself visited some grocery store.	The lady who liked herself visited some grocery store.	0
reflexive	Some drivers that were working with herself have visited a lady.	Some drivers that were working with themselves have visited a lady.	0
reflexive	All people that haven't criticized herself aren't working with the actress.	All people that haven't criticized themselves aren't working with the actress.	0
reflexive	A lot of waiters who hadn't criticized himself had watched a guy.	A lot of waiters who hadn't criticized themselves had watched a guy.	0
reflexive	These boys that won't talk about themselves approach some actress.	These boys that won't talk about herself approach some actress.	1
reflexive	Guests that see himself do investigate every boy.	Guests that see themselves do investigate every boy.	0
reflexive	The adults that work with itself don't dislike every art gallery.	The adults that work with themselves don't dislike every art gallery.	0
reflexive	Some teenagers that couldn't forget herself hadn't known every woman.	Some teenagers that couldn't forget themselves hadn't known every woman.	0
reflexive	Doctors that escape from herself escaped from the gal.	Doctors that escape from themselves escaped from the gal.	0
reflexive	Students who could return to itself could discuss this cafe .	Students who could return to themselves could discuss this cafe .	0
reflexive	A story that references themselves praised movies.	A story that references itself praised movies.	0
reflexive	All women who criticize themselves are investigating every gal.	All women who criticize herself are investigating every gal.	1
reflexive	Some guy who resembled themselves has referenced some waiters.	Some guy who resembled himself has referenced some waiters.	0
reflexive	A lot of students who had remembered themselves visited the high school.	A lot of students who had remembered itself visited the high school.	1
reflexive	These adults who hadn't disliked themselves reference that girl.	These adults who hadn't disliked herself reference that girl.	1
reflexive	An actress who wasn't talking to herself will love the commentaries.	An actress who wasn't talking to themselves will love the commentaries.	1
reflexive	Teenagers who love themselves admire a boy.	Teenagers who love himself admire a boy.	1
reflexive	A lot of teenagers that should dislike themselves hated that play.	A lot of teenagers that should dislike itself hated that play.	1
reflexive	A lot of ladies who work with themselves attacked every woman.	A lot of ladies who work with herself attacked every woman.	1
reflexive	These patients that observed themselves forget every girl.	These patients that observed herself forget every girl.	1
reflexive	Some essays that would insult itself are insulting a story.	Some essays that would insult themselves are insulting a story.	0
reflexive	The customers that were escaping from itself couldn't insult some commentary.	The customers that were escaping from themselves couldn't insult some commentary.	0
reflexive	All waiters that have visited itself left the high school.	All waiters that have visited themselves left the high school.	0
reflexive	These ladies who left herself attack some woman.	These ladies who left themselves attack some woman.	0
reflexive	All people who listen to itself are talking about the hospital.	All people who listen to themselves are talking about the hospital.	0
reflexive	All guys who can't praise themselves visit every girl.	All guys who can't praise herself visit every girl.	1
reflexive	Some patients that watch herself should approach a lady.	Some patients that watch themselves should approach a lady.	0
reflexive	All customers who weren't watching herself kiss this waitress.	All customers who weren't watching themselves kiss this waitress.	0
reflexive	All people who can't love themselves didn't visit that high school.	All people who can't love itself didn't visit that high school.	1
reflexive	The students that like herself watch every girl.	The students that like themselves watch every girl.	0
reflexive	Some humans who help themselves liked some lady.	Some humans who help herself liked some lady.	1
reflexive	That waitress that left herself is talking about these commentaries.	That waitress that left themselves is talking about these commentaries.	1
reflexive	All waitresses who wouldn't praise themselves might help this guy.	All waitresses who wouldn't praise himself might help this guy.	1
reflexive	A woman that isn't praising themselves is investigating many adults.	A woman that isn't praising herself is investigating many adults.	0
reflexive	A lot of women who forget herself hadn't admired some girl.	A lot of women who forget themselves hadn't admired some girl.	0
reflexive	Many adults that investigated herself approached every waitress.	Many adults that investigated themselves approached every waitress.	0
reflexive	Some children that weren't attacking themselves have referenced every guy.	Some children that weren't attacking himself have referenced every guy.	1
reflexive	That girl that criticized themselves couldn't approach some cashiers.	That girl that criticized herself couldn't approach some cashiers.	0
reflexive	A gal who had respected herself remembered these humans.	A gal who had respected themselves remembered these humans.	1
reflexive	Teenagers who talk to themselves aren't attacking the man.	Teenagers who talk to himself aren't attacking the man.	1
reflexive	Girls who might visit herself aren't insulting every girl.	Girls who might visit themselves aren't insulting every girl.	0
reflexive	The men that won't admire themselves admired this woman.	The men that won't admire herself admired this woman.	1
reflexive	The ladies who had escaped from itself aren't admiring the newspaper article.	The ladies who had escaped from themselves aren't admiring the newspaper article.	0
reflexive	Some women who attacked herself can't insult that actress.	Some women who attacked themselves can't insult that actress.	0
reflexive	These children who aren't escaping from herself attack that woman.	These children who aren't escaping from themselves attack that woman.	0
reflexive	These people that talk about himself praised every boy.	These people that talk about themselves praised every boy.	0
reflexive	Many ladies that are describing herself watch an actress.	Many ladies that are describing themselves watch an actress.	0
reflexive	Many guys that wouldn't leave itself weren't talking about some movie theater.	Many guys that wouldn't leave themselves weren't talking about some movie theater.	0
reflexive	Many drivers that should praise himself observe that guy.	Many drivers that should praise themselves observe that guy.	0
reflexive	Many cashiers who shouldn't work with herself were referencing this lady.	Many cashiers who shouldn't work with themselves were referencing this lady.	0
reflexive	Every commentary that hasn't discussed itself praises some guests.	Every commentary that hasn't discussed themselves praises some guests.	1
reflexive	The boy who isn't working with itself had remembered that play.	The boy who isn't working with himself had remembered that play.	0
reflexive	Some boy who can't work with himself didn't describe the bank.	Some boy who can't work with itself didn't describe the bank.	1
reflexive	Some actress that had fled from themselves cared for many teachers.	Some actress that had fled from herself cared for many teachers.	0
reflexive	Every boy that hasn't approached himself won't insult the woman.	Every boy that hasn't approached herself won't insult the woman.	1
reflexive	Some movie that wasn't praising themselves discussed the guests.	Some movie that wasn't praising itself discussed the guests.	0
reflexive	Adults who did watch itself like this cup.	Adults who did watch themselves like this cup.	0
reflexive	Some waitress who returned to themselves would hug some boys.	Some waitress who returned to herself would hug some boys.	0
reflexive	Some guy who might love itself wasn't talking about this essay.	Some guy who might love himself wasn't talking about this essay.	0
reflexive	A lot of adults who approached themselves haven't helped this girl.	A lot of adults who approached herself haven't helped this girl.	1
reflexive	Some lady who can't love herself hugged the women.	Some lady who can't love themselves hugged the women.	1
reflexive	Some actress who worked with herself won't admire these girls.	Some actress who worked with themselves won't admire these girls.	1
reflexive	These adults that visited itself discuss every report.	These adults that visited themselves discuss every report.	0
reflexive	The guests who dislike itself aren't referencing this commentary.	The guests who dislike themselves aren't referencing this commentary.	0
reflexive	A lot of people who had talked about themselves know this actress.	A lot of people who had talked about herself know this actress.	1
reflexive	Some children who haven't hated themselves fled from that actress.	Some children who haven't hated herself fled from that actress.	1
reflexive	The documentary that insulted themselves would criticize these guests.	The documentary that insulted itself would criticize these guests.	0
reflexive	The lady that could kiss themselves hadn't escaped from some customers.	The lady that could kiss herself hadn't escaped from some customers.	0
reflexive	A lot of gals that are approaching herself had escaped from that woman.	A lot of gals that are approaching themselves had escaped from that woman.	0
reflexive	Every man who approached himself praised the essays.	Every man who approached themselves praised the essays.	1
reflexive	Some women that listened to herself talk to a girl.	Some women that listened to themselves talk to a girl.	0
reflexive	All customers that were observing herself praised that actress.	All customers that were observing themselves praised that actress.	0
reflexive	Many waitresses who insulted itself can see a rug.	Many waitresses who insulted themselves can see a rug.	0
reflexive	A lot of waitresses who hate themselves are observing the actress.	A lot of waitresses who hate herself are observing the actress.	1
reflexive	A lot of adults that watch herself were helping that lady.	A lot of adults that watch themselves were helping that lady.	0
reflexive	The woman that should help herself talks about the women.	The woman that should help themselves talks about the women.	1
reflexive	Some customers who respected themselves return to that library.	Some customers who respected itself return to that library.	1
reflexive	Some adults that had remembered herself attack every actress.	Some adults that had remembered themselves attack every actress.	0
reflexive	The women that loved themselves are insulting that guy.	The women that loved himself are insulting that guy.	1
reflexive	Some students who shouldn't hate themselves didn't return to this cafe .	Some students who shouldn't hate itself didn't return to this cafe .	1
reflexive	Children who will watch themselves had talked about an commentary.	Children who will watch itself had talked about an commentary.	1
reflexive	All patients that might observe herself cared for this waitress.	All patients that might observe themselves cared for this waitress.	0
reflexive	A lot of pedestrians who remember himself are observing a boy.	A lot of pedestrians who remember themselves are observing a boy.	0
reflexive	That man that was hugging themselves wouldn't return to the guests.	That man that was hugging himself wouldn't return to the guests.	0
reflexive	Many actresses who worked with itself returned to the grocery store.	Many actresses who worked with themselves returned to the grocery store.	0
reflexive	The teachers that are hugging herself haven't observed the gal.	The teachers that are hugging themselves haven't observed the gal.	0
reflexive	This movie that references themselves criticized guys.	This movie that references itself criticized guys.	0
reflexive	All guys that weren't admiring itself did remember some library.	All guys that weren't admiring themselves did remember some library.	0
reflexive	These pedestrians that listened to itself hadn't remembered the grocery store.	These pedestrians that listened to themselves hadn't remembered the grocery store.	0
reflexive	These ladies that had forgotten herself respect a lady.	These ladies that had forgotten themselves respect a lady.	0
reflexive	An actress that references themselves approached these students.	An actress that references herself approached these students.	0
reflexive	Pedestrians who approach themselves hadn't talked to this woman.	Pedestrians who approach herself hadn't talked to this woman.	1
reflexive	The girls that haven't cared for themselves do reference some gal.	The girls that haven't cared for herself do reference some gal.	1
reflexive	Some guests who had listened to herself hugged that lady.	Some guests who had listened to themselves hugged that lady.	0
reflexive	Some waitresses who hug themselves knew a man.	Some waitresses who hug himself knew a man.	1
reflexive	A boy who helped himself couldn't leave many waiters.	A boy who helped themselves couldn't leave many waiters.	1
reflexive	Teenagers that visited themselves described some essay.	Teenagers that visited itself described some essay.	1
reflexive	Some adults who were talking to themselves haven't talked about every man.	Some adults who were talking to himself haven't talked about every man.	1
reflexive	All boys that forgot themselves kiss the gal.	All boys that forgot herself kiss the gal.	1
reflexive	The gals who flee from themselves had insulted every hospital.	The gals who flee from itself had insulted every hospital.	1
reflexive	These doctors that have talked to themselves attacked a lady.	These doctors that have talked to herself attacked a lady.	1
reflexive	The waiters who like themselves were admiring this gal.	The waiters who like herself were admiring this gal.	1
reflexive	These actors that have forgotten itself hadn't talked about this essay.	These actors that have forgotten themselves hadn't talked about this essay.	0
reflexive	Some essays that discussed himself discuss the boy.	Some essays that discussed themselves discuss the boy.	0
reflexive	Some teenagers that shouldn't kiss itself were escaping from the grocery store.	Some teenagers that shouldn't kiss themselves were escaping from the grocery store.	0
reflexive	A lot of teenagers that shouldn't leave themselves discussed some boy.	A lot of teenagers that shouldn't leave himself discussed some boy.	1
reflexive	A lady that resembles themselves hasn't talked to these waitresses.	A lady that resembles herself hasn't talked to these waitresses.	0
reflexive	Guests who knew themselves worked with this man.	Guests who knew himself worked with this man.	1
reflexive	Some gal that isn't admiring herself has forgotten these actresses.	Some gal that isn't admiring themselves has forgotten these actresses.	1
reflexive	Many drivers that kissed itself described some college campus.	Many drivers that kissed themselves described some college campus.	0
reflexive	Children that know herself could like the lady.	Children that know themselves could like the lady.	0
reflexive	The humans that observed itself liked a scarf.	The humans that observed themselves liked a scarf.	0
reflexive	All people that would insult itself won't remember that play.	All people that would insult themselves won't remember that play.	0
reflexive	The lady that hadn't attacked herself hadn't hated the story.	The lady that hadn't attacked itself hadn't hated the story.	1
reflexive	Many humans who like themselves can't listen to the gal.	Many humans who like herself can't listen to the gal.	1
reflexive	Some reports that described themselves reference some play.	Some reports that described itself reference some play.	1
reflexive	A lot of adults who praise themselves hadn't described a book.	A lot of adults who praise itself hadn't described a book.	1
reflexive	All girls who worked with itself resemble that art gallery.	All girls who worked with themselves resemble that art gallery.	0
reflexive	Many waitresses that have referenced themselves haven't discussed that school.	Many waitresses that have referenced itself haven't discussed that school.	1
reflexive	That girl that hasn't remembered himself wasn't helping that man.	That girl that hasn't remembered herself wasn't helping that man.	0
reflexive	A lot of drivers that returned to themselves shouldn't observe some actress.	A lot of drivers that returned to herself shouldn't observe some actress.	1
reflexive	All pedestrians that talk to themselves had helped every actress.	All pedestrians that talk to herself had helped every actress.	1
reflexive	Many students who have praised itself have fled from every bank.	Many students who have praised themselves have fled from every bank.	0
reflexive	All waitresses who might dislike themselves criticized this college campus.	All waitresses who might dislike itself criticized this college campus.	1
reflexive	The gals who had known themselves praised that newspaper article.	The gals who had known itself praised that newspaper article.	1
reflexive	Some pedestrians who observe themselves talked to the girl.	Some pedestrians who observe herself talked to the girl.	1
reflexive	Cashiers who are describing itself liked a chair.	Cashiers who are describing themselves liked a chair.	0
reflexive	Teenagers who hadn't hugged themselves helped some gal.	Teenagers who hadn't hugged herself helped some gal.	1
reflexive	Many people that listen to themselves respect the high school.	Many people that listen to itself respect the high school.	1
reflexive	Some woman that talked to themselves can't admire many newspaper articles.	Some woman that talked to herself can't admire many newspaper articles.	0
reflexive	Many people who hadn't admired itself returned to this museum.	Many people who hadn't admired themselves returned to this museum.	0
reflexive	A lot of cashiers that see themselves saw some lady.	A lot of cashiers that see herself saw some lady.	1
reflexive	Some stories that discuss themselves were criticizing the school.	Some stories that discuss itself were criticizing the school.	1
reflexive	This man who wasn't praising themselves is approaching the children.	This man who wasn't praising himself is approaching the children.	0
reflexive	Many commentaries that insult itself talked about some story.	Many commentaries that insult themselves talked about some story.	0
reflexive	Ladies who forgot itself haven't talked about this play.	Ladies who forgot themselves haven't talked about this play.	0
reflexive	A man that had attacked himself will hug a lot of adults.	A man that had attacked themselves will hug a lot of adults.	1
reflexive	A girl who disliked herself can love waiters.	A girl who disliked themselves can love waiters.	1
reflexive	Many pedestrians that listen to themselves praise every waitress.	Many pedestrians that listen to herself praise every waitress.	1
reflexive	Some humans that hated itself resemble a rug.	Some humans that hated themselves resemble a rug.	0
reflexive	Many waitresses who hug themselves don't attack some waitress.	Many waitresses who hug herself don't attack some waitress.	1
reflexive	These customers that criticized themselves investigated this waitress.	These customers that criticized herself investigated this waitress.	1
reflexive	The gal who was hugging themselves respected all high schools.	The gal who was hugging herself respected all high schools.	0
reflexive	A lot of ladies that were approaching themselves care for a waitress.	A lot of ladies that were approaching herself care for a waitress.	1
reflexive	A lot of humans that hadn't hated themselves describe that cafe .	A lot of humans that hadn't hated itself describe that cafe .	1
reflexive	Many actors who remember herself didn't know some gal.	Many actors who remember themselves didn't know some gal.	0
reflexive	All children who did remember themselves won't help the man.	All children who did remember himself won't help the man.	1
reflexive	The doctors who visit herself had worked with every actress.	The doctors who visit themselves had worked with every actress.	0
reflexive	Many customers who have hated herself wouldn't care for the gal.	Many customers who have hated themselves wouldn't care for the gal.	0
reflexive	All guests that hug themselves did insult some bank.	All guests that hug itself did insult some bank.	1
reflexive	Some boy that wasn't describing himself won't work with customers.	Some boy that wasn't describing themselves won't work with customers.	1
reflexive	Drivers who haven't known themselves hadn't watched every lady.	Drivers who haven't known herself hadn't watched every lady.	1
reflexive	Some gals who have loved herself attack that gal.	Some gals who have loved themselves attack that gal.	0
reflexive	These teenagers who will criticize themselves had praised that commentary.	These teenagers who will criticize itself had praised that commentary.	1
reflexive	The boys who had forgotten themselves respected that public park.	The boys who had forgotten itself respected that public park.	1
reflexive	Every gal that saw herself could insult these cashiers.	Every gal that saw themselves could insult these cashiers.	1
reflexive	Some waitress who is returning to herself shouldn't admire the report.	Some waitress who is returning to itself shouldn't admire the report.	1
reflexive	Many guys that helped themselves insulted this cafe .	Many guys that helped itself insulted this cafe .	1
reflexive	These adults who love himself investigate this guy.	These adults who love themselves investigate this guy.	0
reflexive	That movie that hasn't referenced itself has described a lot of books.	That movie that hasn't referenced themselves has described a lot of books.	1
reflexive	All humans that help herself aren't escaping from some gal.	All humans that help themselves aren't escaping from some gal.	0
reflexive	Some ladies that referenced themselves have seen every actress.	Some ladies that referenced herself have seen every actress.	1
reflexive	A lot of gals who listen to themselves are leaving every library.	A lot of gals who listen to itself are leaving every library.	1
reflexive	These guys who leave themselves helped every boy.	These guys who leave himself helped every boy.	1
reflexive	Many children who hadn't remembered themselves couldn't approach every actress.	Many children who hadn't remembered herself couldn't approach every actress.	1
reflexive	Many men who would dislike itself were criticizing every report.	Many men who would dislike themselves were criticizing every report.	0
reflexive	All actors who can hug themselves are criticizing this newspaper article.	All actors who can hug itself are criticizing this newspaper article.	1
reflexive	All cashiers that reference themselves weren't insulting the school.	All cashiers that reference itself weren't insulting the school.	1
reflexive	Some girl that is fleeing from herself was discussing this hospital.	Some girl that is fleeing from itself was discussing this hospital.	1
reflexive	A lot of customers that hug themselves have watched the lady.	A lot of customers that hug herself have watched the lady.	1
reflexive	All students who investigated himself worked with this guy.	All students who investigated themselves worked with this guy.	0
reflexive	A lot of plays that insult themselves criticized the book.	A lot of plays that insult itself criticized the book.	1
reflexive	These men who listened to themselves loved this girl.	These men who listened to herself loved this girl.	1
reflexive	The actors who haven't described itself should escape from the grocery store.	The actors who haven't described themselves should escape from the grocery store.	0
reflexive	Many cashiers who couldn't visit herself couldn't forget that woman.	Many cashiers who couldn't visit themselves couldn't forget that woman.	0
reflexive	All people that watched themselves hate every documentary.	All people that watched itself hate every documentary.	1
reflexive	All gals who describe itself wouldn't like the chair.	All gals who describe themselves wouldn't like the chair.	0
reflexive	Some reports that praised itself talked about the public park.	Some reports that praised themselves talked about the public park.	0
reflexive	Many humans that do visit herself praised the waitress.	Many humans that do visit themselves praised the waitress.	0
