NPI-quantifiers	every waiter who had approached any adults is investigating many restaurants .	the waiter who had approached any adults is investigating many restaurants .	1
NPI-quantifiers	many teachers who can attack gals ever investigate more than three hospitals .	many teachers who can attack gals now investigate more than three hospitals .	0
NPI-quantifiers	cashiers who love some drivers skate around any high schools .	cashiers who love some drivers skate around the high schools .	0
NPI-quantifiers	any guys who scanned some essays ever forget humans .	any guys who scanned some essays now forget humans .	0
NPI-quantifiers	any customers who had hated any documentaries could visit drivers .	some customers who had hated any documentaries could visit drivers .	1
NPI-quantifiers	more than three teachers who now resemble some couches can escape from the high schools .	more than three teachers who ever resemble some couches can escape from the high schools .	1
NPI-quantifiers	any gals who can forget a lot of people now drop by many high schools .	any gals who can forget a lot of people ever drop by many high schools .	1
NPI-quantifiers	every guest who kisses a lot of drivers was admiring the girls .	every guest who kisses a lot of drivers was admiring any girls .	1
NPI-quantifiers	any teachers who can attack gals now investigate more than three hospitals .	any teachers who can attack gals ever investigate more than three hospitals .	1
NPI-quantifiers	every cashier who has insulted a lot of college campuses might now take some books .	every cashier who has insulted a lot of college campuses might ever take some books .	1
NPI-quantifiers	any customers who bike to more than three grocery stores had once driven to some cafes .	any customers who bike to more than three grocery stores had ever driven to some cafes .	1
NPI-quantifiers	any teenagers who lifted many reports have attacked the humans .	any teenagers who lifted many reports have attacked any humans .	1
NPI-quantifiers	some cashier who watches the patients ever tours the banks .	some cashier who watches the patients now tours the banks .	0
NPI-quantifiers	the doctor who insulted a lot of people has now sold a lot of plates .	the doctor who insulted a lot of people has ever sold a lot of plates .	1
NPI-quantifiers	students who like any guests have a lot of pants .	students who like the guests have a lot of pants .	0
NPI-quantifiers	many waitresses who have attacked a lot of actresses have now biked to the libraries .	many waitresses who have attacked a lot of actresses have ever biked to the libraries .	1
NPI-quantifiers	the girls who praised the students have gone to more than three high schools .	the girls who praised any students have gone to more than three high schools .	1
NPI-quantifiers	some man who attacked students has ever helped many men .	some man who attacked students has now helped many men .	0
NPI-quantifiers	a lot of girls who dropped by any banks discuss the gals .	a lot of girls who dropped by the banks discuss the gals .	0
NPI-quantifiers	all girls who see the plates now visit many boys .	all girls who see the plates ever visit many boys .	1
NPI-quantifiers	every child who did escape from museums has remembered the banks .	every child who did escape from museums has remembered any banks .	1
NPI-quantifiers	some teacher who worked with a lot of drivers should talk to any teenagers .	some teacher who worked with a lot of drivers should talk to the teenagers .	0
NPI-quantifiers	any customers who ever bike to more than three grocery stores had driven to some cafes .	many customers who ever bike to more than three grocery stores had driven to some cafes .	1
NPI-quantifiers	more than three ladies who dropped by the schools would criticize a lot of teenagers .	more than three ladies who dropped by any schools would criticize a lot of teenagers .	1
NPI-quantifiers	many guests who can ever talk to the boys praised the pedestrians .	many guests who can now talk to the boys praised the pedestrians .	0
NPI-quantifiers	the person who hates waiters left any museums .	the person who hates waiters left the museums .	0
NPI-quantifiers	every lady who did drop by banks is breaking any couches .	every lady who did drop by banks is breaking the couches .	0
NPI-quantifiers	every boy who has hugged gals remembered any guys .	every boy who has hugged gals remembered the guys .	0
NPI-quantifiers	every human who had been at hospitals was selling any couches .	every human who had been at hospitals was selling the couches .	0
NPI-quantifiers	some adult who had been at a lot of grocery stores should watch the men .	some adult who had been at a lot of grocery stores should watch any men .	1
NPI-quantifiers	every lady who goes to more than three schools might remember any plays .	every lady who goes to more than three schools might remember the plays .	0
NPI-quantifiers	the boy who attacks more than three doctors did take the dishes .	the boy who attacks more than three doctors did take any dishes .	1
NPI-quantifiers	any guests who can talk to the boys once praised the pedestrians .	any guests who can talk to the boys ever praised the pedestrians .	1
NPI-quantifiers	any customers who had hated the documentaries could visit the drivers .	any customers who had hated the documentaries could visit any drivers .	1
NPI-quantifiers	any guests who attack a lot of adults once left a lot of men .	any guests who attack a lot of adults ever left a lot of men .	1
NPI-quantifiers	a lot of guys who might describe some art galleries would clean any cars .	a lot of guys who might describe some art galleries would clean the cars .	0
NPI-quantifiers	every man who had respected actors can now see a lot of ladies .	every man who had respected actors can ever see a lot of ladies .	1
NPI-quantifiers	all pedestrians who will help many guys had lifted the couches .	all pedestrians who will help many guys had lifted any couches .	1
NPI-quantifiers	any girls who have listened to the boys have now arrived at public parks .	any girls who have listened to the boys have ever arrived at public parks .	1
NPI-quantifiers	any guests who ever wore pants criticized a lot of movies .	many guests who ever wore pants criticized a lot of movies .	1
NPI-quantifiers	some teenagers who lifted any reports have attacked many humans .	some teenagers who lifted the reports have attacked many humans .	0
NPI-quantifiers	drivers who are discussing some children praised the people .	drivers who are discussing some children praised any people .	1
NPI-quantifiers	a girl who ever did drive to more than three hospitals toured some movie theaters .	a girl who once did drive to more than three hospitals toured some movie theaters .	0
NPI-quantifiers	some gals who can forget a lot of people ever drop by many high schools .	some gals who can forget a lot of people now drop by many high schools .	0
NPI-quantifiers	some boy who was discussing the banks bikes to the schools .	some boy who was discussing any banks bikes to the schools .	1
NPI-quantifiers	the person who will admire some cars had ever taken more than three reports .	the person who will admire some cars had once taken more than three reports .	0
NPI-quantifiers	ladies who now go to the public parks respect some patients .	ladies who ever go to the public parks respect some patients .	1
NPI-quantifiers	every woman who had observed many adults forgets any people .	every woman who had observed many adults forgets the people .	0
NPI-quantifiers	any children who had approached the customers might now see a lot of couches .	any children who had approached the customers might ever see a lot of couches .	1
NPI-quantifiers	all gals who will ever clean more than three books wear many glasses .	some gals who will ever clean more than three books wear many glasses .	1
NPI-quantifiers	a student who works with pedestrians ever lifts more than three newspaper articles .	a student who works with pedestrians now lifts more than three newspaper articles .	0
NPI-quantifiers	a human who had been at any hospitals was selling the couches .	a human who had been at the hospitals was selling the couches .	0
NPI-quantifiers	any waitresses who loved many customers ever praise some guys .	any waitresses who loved many customers now praise some guys .	0
NPI-quantifiers	the guys who will remember any movies did bike to some grocery stores .	the guys who will remember the movies did bike to some grocery stores .	0
NPI-quantifiers	every person who goes to cafes does hate any adults .	every person who goes to cafes does hate the adults .	0
NPI-quantifiers	the people who are dropping by schools approached the patients .	the people who are dropping by schools approached any patients .	1
NPI-quantifiers	any girls who visit the high schools now see some humans .	any girls who visit the high schools ever see some humans .	1
NPI-quantifiers	every man who had praised any guys did drop by more than three restaurants .	a man who had praised any guys did drop by more than three restaurants .	1
NPI-quantifiers	every actress who was walking through a lot of schools had visited any grocery stores .	every actress who was walking through a lot of schools had visited the grocery stores .	0
NPI-quantifiers	the teacher who once criticized art galleries cleaned some reports .	the teacher who ever criticized art galleries cleaned some reports .	1
NPI-quantifiers	a driver who had kissed many adults now are at some schools .	a driver who had kissed many adults ever are at some schools .	1
NPI-quantifiers	some driver who kissed the drivers referenced any children .	some driver who kissed the drivers referenced the children .	0
NPI-quantifiers	the guest who has now explored a lot of libraries should boycott many banks .	the guest who has ever explored a lot of libraries should boycott many banks .	1
NPI-quantifiers	an actress who had discussed the customers bought many newspaper articles .	an actress who had discussed any customers bought many newspaper articles .	1
NPI-quantifiers	every pedestrian who admires pants cared for the boys .	every pedestrian who admires pants cared for any boys .	1
NPI-quantifiers	any guests who wore pants once criticized a lot of movies .	any guests who wore pants ever criticized a lot of movies .	1
NPI-quantifiers	the actors who might investigate a lot of malls ever observe adults .	the actors who might investigate a lot of malls now observe adults .	0
NPI-quantifiers	the man who had lifted many couches now works with more than three pedestrians .	the man who had lifted many couches ever works with more than three pedestrians .	1
NPI-quantifiers	a lot of humans who listen to actresses skated around the libraries .	a lot of humans who listen to actresses skated around any libraries .	1
NPI-quantifiers	some guests who do work with the waiters ever insult more than three men .	some guests who do work with the waiters now insult more than three men .	0
NPI-quantifiers	any pedestrians who did lift a lot of reports had dropped by any libraries .	any pedestrians who did lift a lot of reports had dropped by the libraries .	0
NPI-quantifiers	ladies who had returned to some cashiers should ever escape from many restaurants .	ladies who had returned to some cashiers should now escape from many restaurants .	0
NPI-quantifiers	a pedestrian who has now seen the guests respected actors .	a pedestrian who has ever seen the guests respected actors .	1
NPI-quantifiers	every lady who resembles the art galleries once kissed a lot of guys .	every lady who resembles the art galleries ever kissed a lot of guys .	1
NPI-quantifiers	every human who has known many teenagers once saw more than three pedestrians .	every human who has known many teenagers ever saw more than three pedestrians .	1
NPI-quantifiers	a student who is examining the reports insulted some newspaper articles .	a student who is examining any reports insulted some newspaper articles .	1
NPI-quantifiers	the adult who drives to some banks is leaving any high schools .	the adult who drives to some banks is leaving the high schools .	0
NPI-quantifiers	a man who cares for some humans was lifting any couches .	a man who cares for some humans was lifting the couches .	0
NPI-quantifiers	the actress who described drivers loved the commentaries .	the actress who described drivers loved any commentaries .	1
NPI-quantifiers	any teachers who had known a lot of pedestrians have escaped from the teenagers .	any teachers who had known a lot of pedestrians have escaped from any teenagers .	1
NPI-quantifiers	every actress who had discussed some customers bought any newspaper articles .	every actress who had discussed some customers bought the newspaper articles .	0
NPI-quantifiers	every adult who had been at a lot of grocery stores should watch any men .	every adult who had been at a lot of grocery stores should watch the men .	0
NPI-quantifiers	every person who will admire some cars had ever taken more than three reports .	every person who will admire some cars had once taken more than three reports .	0
NPI-quantifiers	any girls who have ever listened to the boys have arrived at public parks .	some girls who have ever listened to the boys have arrived at public parks .	1
NPI-quantifiers	all teachers who are leaving a lot of banks return to the students .	all teachers who are leaving a lot of banks return to any students .	1
NPI-quantifiers	some woman who kisses any women worked with a lot of students .	some woman who kisses the women worked with a lot of students .	0
NPI-quantifiers	every waiter who can remember doctors was watching the guests .	every waiter who can remember doctors was watching any guests .	1
NPI-quantifiers	a child who remembers doctors ever loved more than three pedestrians .	a child who remembers doctors once loved more than three pedestrians .	0
NPI-quantifiers	many people who scan the plays did flee from any humans .	many people who scan the plays did flee from the humans .	0
NPI-quantifiers	actors who fled from the public parks will kiss some guys .	actors who fled from any public parks will kiss some guys .	1
NPI-quantifiers	all gals who cleaned some plates have visited any grocery stores .	all gals who cleaned some plates have visited the grocery stores .	0
NPI-quantifiers	all adults who had explored more than three grocery stores had worn the glasses .	all adults who had explored more than three grocery stores had worn any glasses .	1
NPI-quantifiers	all waitresses who have attacked a lot of actresses have ever biked to the libraries .	all waitresses who have attacked a lot of actresses have now biked to the libraries .	0
NPI-quantifiers	a student who ever works with pedestrians lifts more than three newspaper articles .	every student who ever works with pedestrians lifts more than three newspaper articles .	0
NPI-quantifiers	teachers who knew the waiters were dropping by more than three art galleries .	teachers who knew any waiters were dropping by more than three art galleries .	1
NPI-quantifiers	many waitresses who were criticizing more than three commentaries had respected any banks .	many waitresses who were criticizing more than three commentaries had respected the banks .	0
NPI-quantifiers	every cashier who had skated around many high schools arrives at the movie theaters .	every cashier who had skated around many high schools arrives at any movie theaters .	1
NPI-quantifiers	waiters who have now admired some people forgot some gals .	waiters who have ever admired some people forgot some gals .	1
NPI-quantifiers	all people who are dropping by schools approached the patients .	all people who are dropping by schools approached any patients .	1
NPI-quantifiers	every driver who resembles a lot of drivers ever exited many grocery stores .	every driver who resembles a lot of drivers once exited many grocery stores .	0
NPI-quantifiers	guys who will now exit more than three cafes walked through many malls .	guys who will ever exit more than three cafes walked through many malls .	1
NPI-quantifiers	every teenager who had driven to many restaurants might now listen to students .	every teenager who had driven to many restaurants might ever listen to students .	1
NPI-quantifiers	every teenager who exits more than three malls ever are at a lot of public parks .	every teenager who exits more than three malls now are at a lot of public parks .	0
NPI-quantifiers	some humans who could wear a lot of glasses now run around many public parks .	some humans who could wear a lot of glasses ever run around many public parks .	1
NPI-quantifiers	more than three girls who now boycott the restaurants toured a lot of public parks .	more than three girls who ever boycott the restaurants toured a lot of public parks .	1
NPI-quantifiers	any guests who have cared for many girls now dislike a lot of adults .	any guests who have cared for many girls ever dislike a lot of adults .	1
NPI-quantifiers	any gals who forgot some ladies once remembered more than three waiters .	any gals who forgot some ladies ever remembered more than three waiters .	1
NPI-quantifiers	the boys who would be at more than three college campuses once dropped by some movie theaters .	the boys who would be at more than three college campuses ever dropped by some movie theaters .	1
NPI-quantifiers	every man who did work with the teachers liked any books .	every man who did work with the teachers liked the books .	0
NPI-quantifiers	every boy who would admire a lot of couches has now known children .	every boy who would admire a lot of couches has ever known children .	1
NPI-quantifiers	all adults who should be at some schools once knew some students .	all adults who should be at some schools ever knew some students .	1
NPI-quantifiers	children who ever is at many libraries will clean more than three gloves .	children who now is at many libraries will clean more than three gloves .	0
NPI-quantifiers	some pedestrian who cleaned the shoes could ever resemble the children .	some pedestrian who cleaned the shoes could once resemble the children .	0
NPI-quantifiers	the waitress who was fleeing from many grocery stores investigates any customers .	the waitress who was fleeing from many grocery stores investigates the customers .	0
NPI-quantifiers	any ladies who discussed the students are investigating the libraries .	any ladies who discussed the students are investigating any libraries .	1
NPI-quantifiers	many adults who should be at some schools ever knew some students .	many adults who should be at some schools once knew some students .	0
NPI-quantifiers	some actors who would bike to a lot of malls now leave the actresses .	some actors who would bike to a lot of malls ever leave the actresses .	1
NPI-quantifiers	a lot of ladies who could once explore the banks arrive at some libraries .	a lot of ladies who could ever explore the banks arrive at some libraries .	1
NPI-quantifiers	some human who has known many teenagers once saw more than three pedestrians .	some human who has known many teenagers ever saw more than three pedestrians .	1
NPI-quantifiers	adults who remembered more than three college campuses do hug the students .	adults who remembered more than three college campuses do hug any students .	1
NPI-quantifiers	some actor who did forget more than three newspaper articles had left any hospitals .	some actor who did forget more than three newspaper articles had left the hospitals .	0
NPI-quantifiers	all teachers who resemble some couches can now escape from the high schools .	all teachers who resemble some couches can ever escape from the high schools .	1
NPI-quantifiers	a person who has some shoes ever biked to the movie theaters .	a person who has some shoes once biked to the movie theaters .	0
NPI-quantifiers	any humans who have observed many people break any dishes .	any humans who have observed many people break the dishes .	0
NPI-quantifiers	every guest who describes many teachers now runs around the college campuses .	every guest who describes many teachers ever runs around the college campuses .	1
NPI-quantifiers	some waiter who can remember doctors was watching the guests .	some waiter who can remember doctors was watching any guests .	1
NPI-quantifiers	any pedestrians who criticize many girls boycotted the hospitals .	any pedestrians who criticize many girls boycotted any hospitals .	1
NPI-quantifiers	the actor who skates around grocery stores now attacks more than three doctors .	the actor who skates around grocery stores ever attacks more than three doctors .	1
NPI-quantifiers	every driver who had kissed many adults now are at some schools .	every driver who had kissed many adults ever are at some schools .	1
NPI-quantifiers	some drivers who should clean many books are buying the couches .	some drivers who should clean many books are buying any couches .	1
NPI-quantifiers	many waitresses who have ever attacked a lot of actresses have biked to the libraries .	all waitresses who have ever attacked a lot of actresses have biked to the libraries .	0
NPI-quantifiers	girls who ever see the plates visit many boys .	girls who now see the plates visit many boys .	0
NPI-quantifiers	some guest who describes many teachers now runs around the college campuses .	some guest who describes many teachers ever runs around the college campuses .	1
NPI-quantifiers	many teachers who had known a lot of pedestrians have escaped from any teenagers .	many teachers who had known a lot of pedestrians have escaped from the teenagers .	0
NPI-quantifiers	the guest who has explored a lot of libraries should ever boycott many banks .	the guest who has explored a lot of libraries should now boycott many banks .	0
NPI-quantifiers	every waiter who had approached many adults is investigating the restaurants .	every waiter who had approached many adults is investigating any restaurants .	1
NPI-quantifiers	more than three children who had approached the customers might now see a lot of couches .	more than three children who had approached the customers might ever see a lot of couches .	1
NPI-quantifiers	more than three guys who might scan a lot of plays should now sell many couches .	more than three guys who might scan a lot of plays should ever sell many couches .	1
NPI-quantifiers	all children who hate more than three documentaries had ever taken some chairs .	all children who hate more than three documentaries had once taken some chairs .	0
NPI-quantifiers	some doctor who works with many waitresses might flee from the actresses .	some doctor who works with many waitresses might flee from any actresses .	1
NPI-quantifiers	more than three waiters who listened to many gals once scanned reports .	more than three waiters who listened to many gals ever scanned reports .	1
NPI-quantifiers	more than three children who had ever approached the customers might see a lot of couches .	more than three children who had once approached the customers might see a lot of couches .	0
NPI-quantifiers	many gals who forgot some ladies ever remembered more than three waiters .	many gals who forgot some ladies once remembered more than three waiters .	0
NPI-quantifiers	the person who had loved some essays has now broken forks .	the person who had loved some essays has ever broken forks .	1
NPI-quantifiers	girls who see the plates ever visit many boys .	girls who see the plates now visit many boys .	0
NPI-quantifiers	the actresses who hug some cashiers ever have more than three glasses .	the actresses who hug some cashiers now have more than three glasses .	0
NPI-quantifiers	all guests who ever do work with the waiters insult more than three men .	some guests who ever do work with the waiters insult more than three men .	1
NPI-quantifiers	every child who worked with many drivers has ever scanned documentaries .	every child who worked with many drivers has now scanned documentaries .	0
NPI-quantifiers	every patient who has approached guests insulted any patients .	every patient who has approached guests insulted the patients .	0
NPI-quantifiers	the person who had listened to more than three patients had ever cared for some drivers .	the person who had listened to more than three patients had once cared for some drivers .	0
NPI-quantifiers	any people who attacked some children have ever been at more than three libraries .	any people who attacked some children have now been at more than three libraries .	0
NPI-quantifiers	pedestrians who will help the guys had lifted many couches .	pedestrians who will help any guys had lifted many couches .	1
NPI-quantifiers	some humans who have observed many people break any dishes .	some humans who have observed many people break the dishes .	0
NPI-quantifiers	every girl who went to a lot of restaurants once did reference actors .	every girl who went to a lot of restaurants ever did reference actors .	1
NPI-quantifiers	a man who did work with the teachers liked the books .	a man who did work with the teachers liked any books .	1
NPI-quantifiers	every doctor who has insulted ladies will ever hate a lot of guys .	every doctor who has insulted ladies will now hate a lot of guys .	0
NPI-quantifiers	all customers who disliked the children now have some books .	all customers who disliked the children ever have some books .	1
NPI-quantifiers	some patient who respected patients can now resemble the dishes .	some patient who respected patients can ever resemble the dishes .	1
NPI-quantifiers	any drivers who are discussing some children praised any people .	any drivers who are discussing some children praised the people .	0
NPI-quantifiers	a lot of ladies who described teenagers flee from the hospitals .	a lot of ladies who described teenagers flee from any hospitals .	1
NPI-quantifiers	every person who was running around many cafes did clean any shoes .	every person who was running around many cafes did clean the shoes .	0
