NPI-adverbs	a human sometimes also thought that the cashier would win .	a human sometimes ever thought that the cashier would win .	1
NPI-adverbs	the gals who would hardly attack any girls have approached alumni .	the gals who would often attack any girls have approached alumni .	1
NPI-adverbs	the doctor who had scarcely talked about women resembled the cashiers .	the doctor who had scarcely talked about women resembled any cashiers .	1
NPI-adverbs	the boy scarcely ever imagines that the adults can scream .	the boy sometimes ever imagines that the adults can scream .	1
NPI-adverbs	the drivers who sometimes know children have investigated any lice .	the drivers who sometimes know children have investigated the lice .	0
NPI-adverbs	a patient often imagines that a boy also talks about the art galleries .	a patient often imagines that a boy ever talks about the art galleries .	1
NPI-adverbs	the people who have seldom learned at all scan brochures .	the people who have sometimes learned at all scan brochures .	1
NPI-adverbs	the patients who scarcely biked to high schools had escaped from the pedestrians .	the patients who scarcely biked to high schools had escaped from any pedestrians .	1
NPI-adverbs	the children always ever explain that the teenager wept .	the children always also explain that the teenager wept .	0
NPI-adverbs	a boy who hardly nodded at all admires cups .	a boy who sometimes nodded at all admires cups .	1
NPI-adverbs	the waiters who scarcely drop by museums have criticized the fish .	the waiters who scarcely drop by museums have criticized any fish .	1
NPI-adverbs	the pedestrians seldom ever explain that a driver watches the waiters .	the pedestrians always ever explain that a driver watches the waiters .	1
NPI-adverbs	the waiter always ever thought that the actress does approach the waiters .	the waiter always also thought that the actress does approach the waiters .	0
NPI-adverbs	a pedestrian sometimes also explained that the doctors had attacked the child .	a pedestrian sometimes ever explained that the doctors had attacked the child .	1
NPI-adverbs	the waitresses sometimes imagined that the patients have also donated .	the waitresses sometimes imagined that the patients have ever donated .	1
NPI-adverbs	the ladies who have rarely criticized any children would leave drivers .	the ladies who have always criticized any children would leave drivers .	1
NPI-adverbs	the men who always ran around the high schools hugged humans .	the men who always ran around any high schools hugged humans .	1
NPI-adverbs	the actors who sometimes skate around schools might hug the people .	the actors who sometimes skate around schools might hug any people .	1
NPI-adverbs	the guests who had sometimes hugged alumni at all washed .	the guests who had hardly hugged alumni at all washed .	0
NPI-adverbs	a customer often ever said that a patient chuckled .	a customer barely ever said that a patient chuckled .	0
NPI-adverbs	the waitress sometimes also says that the actresses did drop by the movie theaters .	the waitress sometimes ever says that the actresses did drop by the movie theaters .	1
NPI-adverbs	the women who have often lifted any forks walked through malls .	the women who have often lifted the forks walked through malls .	0
NPI-adverbs	the drivers barely explained that the women should also run around the schools .	the drivers barely explained that the women should ever run around the schools .	1
NPI-adverbs	a doctor who might often sell the reports can discuss libraries .	a doctor who might often sell any reports can discuss libraries .	1
NPI-adverbs	the actor often explains that the guy also grinned .	the actor often explains that the guy ever grinned .	1
NPI-adverbs	the child who barely wore shoes knew the teachers .	the child who barely wore shoes knew any teachers .	1
NPI-adverbs	a woman sometimes also imagined that a driver had investigated the children .	a woman sometimes ever imagined that a driver had investigated the children .	1
NPI-adverbs	the children barely explain that the teenager ever wept .	the children barely explain that the teenager also wept .	0
NPI-adverbs	the patients who often biked to the high schools had escaped from pedestrians .	the patients who often biked to any high schools had escaped from pedestrians .	1
NPI-adverbs	the adults always say that the pedestrians ever surrendered .	the adults always say that the pedestrians also surrendered .	0
NPI-adverbs	the girls who sometimes referenced deer might drop by any public parks .	the girls who sometimes referenced deer might drop by the public parks .	0
NPI-adverbs	the women often ever think that the pedestrian stretched .	the women hardly ever think that the pedestrian stretched .	0
NPI-adverbs	the pedestrians often explained that the teenager also has a cup .	the pedestrians often explained that the teenager ever has a cup .	1
NPI-adverbs	a customer who barely helped drivers tours the restaurants .	a customer who barely helped drivers tours any restaurants .	1
NPI-adverbs	a pedestrian who has always walked through any malls has forgotten mice .	a pedestrian who has always walked through the malls has forgotten mice .	0
NPI-adverbs	the actresses who often escape from any customers admired cups .	the actresses who often escape from the customers admired cups .	0
NPI-adverbs	an adult who often skates around the museums listened to sheep .	an adult who often skates around any museums listened to sheep .	1
NPI-adverbs	the ladies who have rarely disliked any students sold cups .	the ladies who have often disliked any students sold cups .	1
NPI-adverbs	the pedestrian scarcely ever said that the person should watch the humans .	the pedestrian sometimes ever said that the person should watch the humans .	1
NPI-adverbs	the waitresses who scarcely attacked humans at all married .	the waitresses who sometimes attacked humans at all married .	1
NPI-adverbs	the pedestrians seldom explain that a driver also watches the waiters .	the pedestrians seldom explain that a driver ever watches the waiters .	1
NPI-adverbs	the adult who often has any pamphlets had plates .	the adult who hardly has any pamphlets had plates .	0
NPI-adverbs	the patients always thought that an actress has also cooperated .	the patients always thought that an actress has ever cooperated .	1
NPI-adverbs	a human hardly said that the cashier also screams .	a human hardly said that the cashier ever screams .	1
NPI-adverbs	the children who sometimes visited lice have escaped from the cashiers .	the children who sometimes visited lice have escaped from any cashiers .	1
NPI-adverbs	the girls often say that the customers had also muttered .	the girls often say that the customers had ever muttered .	1
NPI-adverbs	a customer scarcely explained that the customer ever ate .	a customer scarcely explained that the customer also ate .	0
NPI-adverbs	the guys who often criticize any boys had escaped from schools .	the guys who often criticize the boys had escaped from schools .	0
NPI-adverbs	the men who can often resemble banks kissed any alumni .	the men who can often resemble banks kissed the alumni .	0
NPI-adverbs	the ladies who sometimes do observe the fish can bike to movie theaters .	the ladies who sometimes do observe any fish can bike to movie theaters .	1
NPI-adverbs	the boy often ever thought that the guys pass the cafes .	the boy barely ever thought that the guys pass the cafes .	0
NPI-adverbs	the children who might barely talk to mice criticize the children .	the children who might barely talk to mice criticize any children .	1
NPI-adverbs	the pedestrian sometimes said that the person should also watch the humans .	the pedestrian sometimes said that the person should ever watch the humans .	1
NPI-adverbs	the women often also say that the men had visited the people .	the women often ever say that the men had visited the people .	1
NPI-adverbs	the waitress sometimes ever says that the women had scanned the report .	the waitress seldom ever says that the women had scanned the report .	0
NPI-adverbs	the gals often ever imagined that a driver changed .	the gals often also imagined that a driver changed .	0
NPI-adverbs	the child who sometimes wore any shoes knew teachers .	the child who barely wore any shoes knew teachers .	0
NPI-adverbs	the ladies who sometimes do observe fish can bike to any movie theaters .	the ladies who sometimes do observe fish can bike to the movie theaters .	0
NPI-adverbs	the students seldom imagined that the people ever corresponded .	the students seldom imagined that the people also corresponded .	0
NPI-adverbs	the woman always ever says that the adults work with a boy .	the woman scarcely ever says that the adults work with a boy .	0
NPI-adverbs	a customer who always wore shoes had described the students .	a customer who always wore shoes had described any students .	1
NPI-adverbs	the children who sometimes remembered girls can clean the gloves .	the children who sometimes remembered girls can clean any gloves .	1
NPI-adverbs	the teenagers who sometimes do like any humans have respected guests .	the teenagers who sometimes do like the humans have respected guests .	0
NPI-adverbs	a guest who barely admires gals drove to the public parks .	a guest who barely admires gals drove to any public parks .	1
NPI-adverbs	a child who always praises the sheep can love guests .	a child who always praises any sheep can love guests .	1
NPI-adverbs	a teenager always thought that the girl also hugged the women .	a teenager always thought that the girl ever hugged the women .	1
NPI-adverbs	the students who have barely criticized banks at all liked children .	the students who have always criticized banks at all liked children .	1
NPI-adverbs	the actress who sometimes leaves college campuses has examined the brochures .	the actress who sometimes leaves college campuses has examined any brochures .	1
NPI-adverbs	the driver who sometimes breaks cups tours any restaurants .	the driver who sometimes breaks cups tours the restaurants .	0
NPI-adverbs	the ladies who hardly do observe fish can bike to the movie theaters .	the ladies who hardly do observe fish can bike to any movie theaters .	1
NPI-adverbs	the students who had always divorced at all have biked to restaurants .	the students who had barely divorced at all have biked to restaurants .	0
NPI-adverbs	the men hardly thought that the guests ever observed a teacher .	the men hardly thought that the guests also observed a teacher .	0
NPI-adverbs	a cashier scarcely explained that the patients would also attack a teenager .	a cashier scarcely explained that the patients would ever attack a teenager .	1
NPI-adverbs	the students sometimes ever imagined that the people corresponded .	the students sometimes also imagined that the people corresponded .	0
NPI-adverbs	the actor often ever explained that a man would speak up .	the actor often also explained that a man would speak up .	0
NPI-adverbs	a child always said that the students ever reunite .	a child always said that the students also reunite .	0
NPI-adverbs	the waiter who rarely had pamphlets bought the shoes .	the waiter who rarely had pamphlets bought any shoes .	1
NPI-adverbs	the drivers who rarely know children have investigated any lice .	the drivers who rarely know children have investigated the lice .	0
NPI-adverbs	the child who has always described any cafes would reference boys .	the child who has always described the cafes would reference boys .	0
NPI-adverbs	the gals sometimes think that a lady had also examined an commentary .	the gals sometimes think that a lady had ever examined an commentary .	1
NPI-adverbs	the gal hardly thinks that the teacher has ever suffered .	the gal hardly thinks that the teacher has also suffered .	0
NPI-adverbs	the humans sometimes ever explain that the gal has exercised .	the humans sometimes also explain that the gal has exercised .	0
NPI-adverbs	the girl always ever thinks that the humans do retaliate .	the girl always also thinks that the humans do retaliate .	0
NPI-adverbs	a person who had always left any libraries might like girls .	a person who had hardly left any libraries might like girls .	0
NPI-adverbs	the student who has always ran around any grocery stores has brought glasses .	the student who has always ran around the grocery stores has brought glasses .	0
NPI-adverbs	an actress who sometimes runs around the grocery stores attacks women .	an actress who sometimes runs around any grocery stores attacks women .	1
NPI-adverbs	the waitresses sometimes also imagined that the patients have donated .	the waitresses sometimes ever imagined that the patients have donated .	1
NPI-adverbs	a customer who always wore any shoes had described students .	a customer who barely wore any shoes had described students .	0
NPI-adverbs	a boy who has seldom talked about hospitals watched the doctors .	a boy who has seldom talked about hospitals watched any doctors .	1
NPI-adverbs	the doctor always says that a patient should also watch the men .	the doctor always says that a patient should ever watch the men .	1
NPI-adverbs	a person sometimes thinks that the cashier ever runs around the libraries .	a person sometimes thinks that the cashier also runs around the libraries .	0
NPI-adverbs	a man sometimes explains that the ladies had ever known the customer .	a man sometimes explains that the ladies had also known the customer .	0
NPI-adverbs	the boys who always retaliate at all testified .	the boys who seldom retaliate at all testified .	0
NPI-adverbs	the adult who seldom insulted patients has cleaned any dishes .	the adult who seldom insulted patients has cleaned the dishes .	0
NPI-adverbs	the drivers who had hardly approached children at all talk about libraries .	the drivers who had often approached children at all talk about libraries .	1
NPI-adverbs	the ladies who can always see any cups could insult girls .	the ladies who can always see the cups could insult girls .	0
NPI-adverbs	the boys always also explained that the girls paint .	the boys always ever explained that the girls paint .	1
NPI-adverbs	the actors seldom explain that the people have ever reunited .	the actors seldom explain that the people have also reunited .	0
NPI-adverbs	the actress always ever says that the guy will tour the schools .	the actress always also says that the guy will tour the schools .	0
NPI-adverbs	the drivers who sometimes know any children have investigated lice .	the drivers who sometimes know the children have investigated lice .	0
NPI-adverbs	the teenagers hardly ever thought that the girls argue .	the teenagers always ever thought that the girls argue .	1
NPI-adverbs	the patient always explained that the waitress ever murmured .	the patient always explained that the waitress also murmured .	0
NPI-adverbs	an adult hardly says that a boy has ever forgotten the woman .	an adult hardly says that a boy has also forgotten the woman .	0
NPI-adverbs	a driver always said that the actresses ever succeed .	a driver always said that the actresses also succeed .	0
NPI-adverbs	the men who can often resemble the banks kissed alumni .	the men who can often resemble any banks kissed alumni .	1
NPI-adverbs	the gals who would hardly attack girls have approached the alumni .	the gals who would hardly attack girls have approached any alumni .	1
NPI-adverbs	an actress who rarely runs around grocery stores attacks any women .	an actress who rarely runs around grocery stores attacks the women .	0
NPI-adverbs	a gal who often observes guys might reference the doctors .	a gal who often observes guys might reference any doctors .	1
NPI-adverbs	the waitresses rarely imagined that the patients have also donated .	the waitresses rarely imagined that the patients have ever donated .	1
NPI-adverbs	the girls who always break cups at all respond .	the girls who rarely break cups at all respond .	0
NPI-adverbs	a cashier often ever explained that the patients would attack a teenager .	a cashier often also explained that the patients would attack a teenager .	0
NPI-adverbs	the women who could often whisper at all could talk about offspring .	the women who could hardly whisper at all could talk about offspring .	0
NPI-adverbs	the actress who has seldom smiled at all answered .	the actress who has sometimes smiled at all answered .	1
NPI-adverbs	the drivers who scarcely investigated any banks should like pants .	the drivers who sometimes investigated any banks should like pants .	1
NPI-adverbs	a gal who always does buy glasses at all saluted .	a gal who scarcely does buy glasses at all saluted .	0
NPI-adverbs	the actors who barely skate around any schools might hug people .	the actors who sometimes skate around any schools might hug people .	1
NPI-adverbs	the pedestrians always explain that a driver also watches the waiters .	the pedestrians always explain that a driver ever watches the waiters .	1
NPI-adverbs	the gal who could always write hard at all sees .	the gal who could scarcely write hard at all sees .	0
NPI-adverbs	the man who often returns to any children would return to doctors .	the man who scarcely returns to any children would return to doctors .	0
NPI-adverbs	a customer who barely helped any drivers tours restaurants .	a customer who often helped any drivers tours restaurants .	1
NPI-adverbs	the adult who seldom insulted any patients has cleaned dishes .	the adult who often insulted any patients has cleaned dishes .	1
NPI-adverbs	the gals who always is at restaurants at all do approach men .	the gals who seldom is at restaurants at all do approach men .	0
NPI-adverbs	the waiter hardly thought that the actress also does approach the waiters .	the waiter hardly thought that the actress ever does approach the waiters .	1
NPI-adverbs	the doctors who might sometimes return to any malls could break forks .	the doctors who might scarcely return to any malls could break forks .	0
NPI-adverbs	the guest sometimes ever imagines that the waitresses observed the actress .	the guest scarcely ever imagines that the waitresses observed the actress .	0
NPI-adverbs	a doctor who sometimes forgets any girls bikes to banks .	a doctor who seldom forgets any girls bikes to banks .	0
NPI-adverbs	the guest who would often nod at all has spoken up .	the guest who would hardly nod at all has spoken up .	0
NPI-adverbs	the waitresses who had often left any children explored hospitals .	the waitresses who had rarely left any children explored hospitals .	0
NPI-adverbs	the teacher who always knows any boys knows oxen .	the teacher who always knows the boys knows oxen .	0
NPI-adverbs	a person who had hardly left libraries might like the girls .	a person who had hardly left libraries might like any girls .	1
NPI-adverbs	a gal who often attacks fish dislikes the adults .	a gal who often attacks fish dislikes any adults .	1
NPI-adverbs	the gals who should sometimes interact at all do hate humans .	the gals who should scarcely interact at all do hate humans .	0
NPI-adverbs	the man who could always describe students are at any art galleries .	the man who could always describe students are at the art galleries .	0
NPI-adverbs	the ladies who can always see cups could insult any girls .	the ladies who can always see cups could insult the girls .	0
NPI-adverbs	an actor who should often forget any documentaries kissed mice .	an actor who should hardly forget any documentaries kissed mice .	0
NPI-adverbs	a lady who always criticizes libraries skates around any museums .	a lady who always criticizes libraries skates around the museums .	0
NPI-adverbs	the customers often ever imagined that a customer has sung .	the customers seldom ever imagined that a customer has sung .	0
NPI-adverbs	a pedestrian seldom explained that the doctors had ever attacked the child .	a pedestrian seldom explained that the doctors had also attacked the child .	0
NPI-adverbs	the girl who will sometimes wave at all cares for people .	the girl who will seldom wave at all cares for people .	0
NPI-adverbs	the children who might always talk to any mice criticize children .	the children who might always talk to the mice criticize children .	0
NPI-adverbs	a gal who might sometimes answer at all baked .	a gal who might hardly answer at all baked .	0
NPI-adverbs	an actor hardly explains that the lady also dislikes the cafe .	an actor hardly explains that the lady ever dislikes the cafe .	1
NPI-adverbs	a human hardly explained that a boy ever exited the banks .	a human hardly explained that a boy also exited the banks .	0
NPI-adverbs	the pedestrians who often did praise any gals examine pamphlets .	the pedestrians who rarely did praise any gals examine pamphlets .	0
NPI-adverbs	the actor always also explains that the man goes fishing .	the actor always ever explains that the man goes fishing .	1
NPI-adverbs	a human barely thought that the cashier would ever win .	a human barely thought that the cashier would also win .	0
NPI-adverbs	an actor who should hardly forget documentaries kissed the mice .	an actor who should hardly forget documentaries kissed any mice .	1
NPI-adverbs	the boys who scarcely dated at all can marry .	the boys who always dated at all can marry .	1
NPI-adverbs	a teacher who has always attacked any doctors listens to patients .	a teacher who has always attacked the doctors listens to patients .	0
NPI-adverbs	the pedestrians often also explained that the teenager has a cup .	the pedestrians often ever explained that the teenager has a cup .	1
NPI-adverbs	an actress barely ever thinks that the woman slumped over .	an actress sometimes ever thinks that the woman slumped over .	1
NPI-adverbs	a customer who seldom suffered at all did win .	a customer who always suffered at all did win .	1
NPI-adverbs	a human who had often seen mice at all has played .	a human who had rarely seen mice at all has played .	0
NPI-adverbs	the women often ever imagined that a customer had skated around the movie theater .	the women rarely ever imagined that a customer had skated around the movie theater .	0
NPI-adverbs	a child who often wore any pants can take books .	a child who often wore the pants can take books .	0
NPI-adverbs	the ladies who rarely return to any sheep drop by art galleries .	the ladies who always return to any sheep drop by art galleries .	1
NPI-adverbs	a person always ever imagined that the woman has responded .	a person hardly ever imagined that the woman has responded .	0
NPI-adverbs	the men who always ran around high schools hugged the humans .	the men who always ran around high schools hugged any humans .	1
NPI-adverbs	a human often also explains that the guys do react .	a human often ever explains that the guys do react .	1
NPI-adverbs	the waitress seldom says that the women had also scanned the report .	the waitress seldom says that the women had ever scanned the report .	1
NPI-adverbs	an adult who rarely resembled radii hates the pedestrians .	an adult who rarely resembled radii hates any pedestrians .	1
NPI-adverbs	the patients always said that the guys would also stand up .	the patients always said that the guys would ever stand up .	1
NPI-adverbs	the driver who sometimes breaks the cups tours restaurants .	the driver who sometimes breaks any cups tours restaurants .	1
NPI-adverbs	a waitress who will scarcely surrender at all dropped by libraries .	a waitress who will often surrender at all dropped by libraries .	1
NPI-adverbs	the gal who sometimes jokes around at all respects teachers .	the gal who rarely jokes around at all respects teachers .	0
NPI-adverbs	the waitress sometimes says that the actresses also did drop by the movie theaters .	the waitress sometimes says that the actresses ever did drop by the movie theaters .	1
NPI-adverbs	the driver often ever imagines that the guys attacked the waitress .	the driver often also imagines that the guys attacked the waitress .	0
NPI-adverbs	a human who will often love adults at all had sung .	a human who will rarely love adults at all had sung .	0
NPI-adverbs	the women who had often loved commentaries drop by the college campuses .	the women who had often loved commentaries drop by any college campuses .	1
NPI-adverbs	the gals seldom thought that a cashier might ever love the customer .	the gals seldom thought that a cashier might also love the customer .	0
NPI-adverbs	the teenagers hardly thought that the girls also argue .	the teenagers hardly thought that the girls ever argue .	1
NPI-adverbs	a boy rarely thought that the guests might ever talk about the documentary .	a boy rarely thought that the guests might also talk about the documentary .	0
NPI-adverbs	an adult sometimes says that a boy has ever forgotten the woman .	an adult sometimes says that a boy has also forgotten the woman .	0
NPI-adverbs	the guests who will sometimes describe any guys examine movies .	the guests who will scarcely describe any guys examine movies .	0
NPI-adverbs	the lady sometimes thought that the men might also collaborate .	the lady sometimes thought that the men might ever collaborate .	1
NPI-adverbs	the children who hardly remembered girls can clean the gloves .	the children who hardly remembered girls can clean any gloves .	1
NPI-adverbs	a waiter often thought that the actors ever communicated .	a waiter often thought that the actors also communicated .	0
NPI-adverbs	a boy who has always talked about hospitals watched the doctors .	a boy who has always talked about hospitals watched any doctors .	1
NPI-adverbs	a child who had hardly boycotted banks had criticized any movies .	a child who had hardly boycotted banks had criticized the movies .	0
NPI-adverbs	an adult who often resembled any radii hates pedestrians .	an adult who rarely resembled any radii hates pedestrians .	0
NPI-adverbs	the doctors always also thought that a waiter murmured .	the doctors always ever thought that a waiter murmured .	1
