NPI-negation	no humans observe a teacher yet .	Some humans observe a teacher yet .	1
NPI-negation	the people had forgotten some men at all .	the people had forgotten no men at all .	0
NPI-negation	the waiter is often imagining that a person was not swallowing .	the waiter is ever imagining that a person was not swallowing .	1
NPI-negation	Some actors did ever explain that the ladies describe the cafes .	no actors did ever explain that the ladies describe the cafes .	0
NPI-negation	Some cashiers criticized the adult sometimes .	Some cashiers criticized the adult yet .	1
NPI-negation	a guest ever approaches some doctor .	a guest often approaches some doctor .	0
NPI-negation	Some waiter does ever attack the man .	Some waiter does often attack the man .	0
NPI-negation	Some adult does ever dislike the girls .	Some adult does often dislike the girls .	0
NPI-negation	the men do really ever say that the children observe the deer .	the men do really often say that the children observe the deer .	0
NPI-negation	Some people like the cashiers yet .	Some people like the cashiers sometimes .	0
NPI-negation	Some customer often sells the guys .	Some customer ever sells the guys .	1
NPI-negation	the girls often explain that no guys approach the children .	the girls ever explain that no guys approach the children .	1
NPI-negation	the guests often imagined that the people not insulted the high schools .	the guests ever imagined that the people not insulted the high schools .	1
NPI-negation	the lady was really thinking that a man is escaping from the libraries yet .	the lady was not thinking that a man is escaping from the libraries yet .	0
NPI-negation	the humans ever imagined that some patients scratched .	the humans often imagined that some patients scratched .	0
NPI-negation	Some student had explained that the waitresses cope at all .	no student had explained that the waitresses cope at all .	0
NPI-negation	the guys often went to no girl .	the guys ever went to no girl .	1
NPI-negation	the women not ever say that the humans stood up .	the women really ever say that the humans stood up .	1
NPI-negation	Some drivers are often thinking that the boy returned to the banks .	Some drivers are ever thinking that the boy returned to the banks .	1
NPI-negation	Some patient ever said that the people were admiring the guy .	Some patient often said that the people were admiring the guy .	0
NPI-negation	an actor often resembles some waitresses .	an actor ever resembles some waitresses .	1
NPI-negation	the girl had ever said that some lady reacted .	the girl had often said that some lady reacted .	0
NPI-negation	Some humans are exiting a woman in years .	no humans are exiting a woman in years .	0
NPI-negation	the cashiers praise no drivers in years .	the cashiers praise some drivers in years .	1
NPI-negation	a girl did examine some teachers sometimes .	a girl did examine some teachers yet .	1
NPI-negation	a driver says that a guest is not cooperating sometimes .	a driver says that a guest is not cooperating yet .	1
NPI-negation	the actress has ever imagined that some doctors are chatting .	the actress has often imagined that some doctors are chatting .	0
NPI-negation	the drivers often thought that some girls could testify .	the drivers ever thought that some girls could testify .	1
NPI-negation	Some guys are ever thinking that an actor skated around the art galleries .	Some guys are often thinking that an actor skated around the art galleries .	0
NPI-negation	a man is often imagining that a driver not muttered .	a man is ever imagining that a driver not muttered .	1
NPI-negation	the boy had ever imagined that no cashier sold a hat .	the boy had often imagined that no cashier sold a hat .	0
NPI-negation	the gal ever explains that the drivers were not reacting .	the gal often explains that the drivers were not reacting .	0
NPI-negation	Some people have explained that the students talked to the alumnus in years .	no people have explained that the students talked to the alumnus in years .	0
NPI-negation	a waiter has said that the teenagers really stretched yet .	a waiter has said that the teenagers really stretched sometimes .	0
NPI-negation	the waitresses often forget no teenager .	the waitresses ever forget no teenager .	1
NPI-negation	no patients cared for the waiters in years .	Some patients cared for the waiters in years .	1
NPI-negation	Some person observes a teenager at all .	no person observes a teenager at all .	0
NPI-negation	a man is really ever imagining that a driver muttered .	a man is really often imagining that a driver muttered .	0
NPI-negation	a gal really ever imagined that the driver had stretched .	a gal really often imagined that the driver had stretched .	0
NPI-negation	a person is ever imagining that no people can attack the customers .	a person is often imagining that no people can attack the customers .	0
NPI-negation	the actors have often said that a driver not speaks up .	the actors have ever said that a driver not speaks up .	1
NPI-negation	Some boys often is at the patients .	Some boys ever is at the patients .	1
NPI-negation	no man imagines that a waitress bikes to the malls yet .	Some man imagines that a waitress bikes to the malls yet .	1
NPI-negation	Some actress often thought that a person sells a couch .	Some actress ever thought that a person sells a couch .	1
NPI-negation	a doctor ever observes some doctors .	a doctor often observes some doctors .	0
NPI-negation	Some gals returned to the student yet .	no gals returned to the student yet .	0
NPI-negation	the human not imagines that the actor scans the newspaper articles in years .	the human really imagines that the actor scans the newspaper articles in years .	1
NPI-negation	Some waiter has been at the teachers at all .	no waiter has been at the teachers at all .	0
NPI-negation	the women often say that the humans not stood up .	the women ever say that the humans not stood up .	1
NPI-negation	Some driver has ever remembered the child .	no driver has ever remembered the child .	0
NPI-negation	the women ever boycott some actress .	the women often boycott some actress .	0
NPI-negation	Some humans often skated around the guests .	Some humans ever skated around the guests .	1
NPI-negation	the boys would explain that the girl was not smiling sometimes .	the boys would explain that the girl was not smiling yet .	1
NPI-negation	the student was often thinking that some ladies hunt .	the student was ever thinking that some ladies hunt .	1
NPI-negation	the actor would imagine that a gal had really visited the pedestrians sometimes .	the actor would imagine that a gal had really visited the pedestrians yet .	1
NPI-negation	a driver really ever explains that the adults are telephoning .	a driver really often explains that the adults are telephoning .	0
NPI-negation	the humans observe some teacher sometimes .	the humans observe some teacher yet .	1
NPI-negation	the cashiers did often bike to some boys .	the cashiers did ever bike to some boys .	1
NPI-negation	the girl will ever say that no people negotiated .	the girl will often say that no people negotiated .	0
NPI-negation	Some girl will ever say that the people negotiated .	Some girl will often say that the people negotiated .	0
NPI-negation	Some patients saw the actors in years .	no patients saw the actors in years .	0
NPI-negation	Some humans ever explain that the guests were explaining everything .	Some humans often explain that the guests were explaining everything .	0
NPI-negation	the guests ever talk about no boys .	the guests often talk about no boys .	0
NPI-negation	the patient was arriving at some student yet .	the patient was arriving at no student yet .	0
NPI-negation	the waitresses have ever said that the students not talk .	the waitresses have often said that the students not talk .	0
NPI-negation	a guest did not say that the actors might drive to the high schools yet .	a guest did really say that the actors might drive to the high schools yet .	1
NPI-negation	a boy does ever imagine that no pedestrians were hunting .	a boy does often imagine that no pedestrians were hunting .	0
NPI-negation	no waitress should ever help the adult .	Some waitress should ever help the adult .	1
NPI-negation	a guy will buy some guests yet .	a guy will buy no guests yet .	0
NPI-negation	the girls were really often imagining that the guests had exited the college campuses .	the girls were really ever imagining that the guests had exited the college campuses .	1
NPI-negation	Some cashiers say that a man yelled at all .	no cashiers say that a man yelled at all .	0
NPI-negation	no women were ever passing the teachers .	Some women were ever passing the teachers .	1
NPI-negation	Some actor has ever praised the students .	no actor has ever praised the students .	0
NPI-negation	Some waitress had ever said that the pedestrians scream .	Some waitress had often said that the pedestrians scream .	0
NPI-negation	Some doctor is ever thinking that the girls criticize the children .	Some doctor is often thinking that the girls criticize the children .	0
NPI-negation	the actresses had really ever said that the gals arrived at the restaurants .	the actresses had not ever said that the gals arrived at the restaurants .	0
NPI-negation	the actress can often imagine that an actress had not escaped from the goose .	the actress can ever imagine that an actress had not escaped from the goose .	1
NPI-negation	no patients had ever thought that the students toured the movie theater .	Some patients had ever thought that the students toured the movie theater .	1
NPI-negation	the drivers not think that the actors should observe the gal in years .	the drivers really think that the actors should observe the gal in years .	1
NPI-negation	the driver really thinks that the customers practiced in years .	the driver not thinks that the customers practiced in years .	0
NPI-negation	the waitresses often imagined that some doctor would scratch .	the waitresses ever imagined that some doctor would scratch .	1
NPI-negation	a guest has thought that an actor not likes a waiter yet .	a guest has thought that an actor not likes a waiter sometimes .	0
NPI-negation	Some boys had loved a guy yet .	Some boys had loved a guy sometimes .	0
NPI-negation	the humans have ever said that some cashiers did wear a hat .	the humans have often said that some cashiers did wear a hat .	0
NPI-negation	the actors did ever explain that no ladies describe the cafes .	the actors did often explain that no ladies describe the cafes .	0
NPI-negation	the teacher had ever thought that some gals scratched .	the teacher had often thought that some gals scratched .	0
NPI-negation	the child often imagined that some pedestrian fled from the actress .	the child ever imagined that some pedestrian fled from the actress .	1
NPI-negation	a teenager ever thinks that no boy did laugh .	a teenager often thinks that no boy did laugh .	0
NPI-negation	the boys often is at no patients .	the boys ever is at no patients .	1
NPI-negation	no human wears the lady in years .	Some human wears the lady in years .	1
NPI-negation	the teachers might explain that a person really liked the doctors yet .	the teachers might explain that a person really liked the doctors sometimes .	0
NPI-negation	a human can ever reference no human .	a human can often reference no human .	0
NPI-negation	no waitress ever imagines that the humans have struggled .	Some waitress ever imagines that the humans have struggled .	1
NPI-negation	the pedestrians were driving to some teachers in years .	the pedestrians were driving to no teachers in years .	0
NPI-negation	Some gals would drop by the adults yet .	Some gals would drop by the adults sometimes .	0
NPI-negation	a human bought no cashiers yet .	a human bought some cashiers yet .	1
NPI-negation	no woman attacks the children in years .	Some woman attacks the children in years .	1
NPI-negation	a child did really think that the guy is skated around the high school at all .	a child did not think that the guy is skated around the high school at all .	0
NPI-negation	Some human bought the cashiers yet .	Some human bought the cashiers sometimes .	0
NPI-negation	the customer ever sells no guys .	the customer often sells no guys .	0
NPI-negation	Some actors had often driven to the adults .	Some actors had ever driven to the adults .	1
NPI-negation	the doctors fled from no customers in years .	the doctors fled from some customers in years .	1
NPI-negation	no student will approach the children in years .	Some student will approach the children in years .	1
NPI-negation	Some women often disliked the customer .	Some women ever disliked the customer .	1
NPI-negation	the girls ever break some teenager .	the girls often break some teenager .	0
NPI-negation	Some child observed a waitress in years .	no child observed a waitress in years .	0
NPI-negation	the gals would drop by some adults yet .	the gals would drop by no adults yet .	0
NPI-negation	a doctor does ever skate around some guy .	a doctor does often skate around some guy .	0
NPI-negation	a doctor has ever biked to no guests .	a doctor has often biked to no guests .	0
NPI-negation	the woman should ever forget some teenager .	the woman should often forget some teenager .	0
NPI-negation	a man is saying that some adults had examined the brochures sometimes .	a man is saying that some adults had examined the brochures yet .	1
NPI-negation	the cashier has really said that an actress approaches the patients at all .	the cashier has not said that an actress approaches the patients at all .	0
NPI-negation	the patient imagines that no man nodded sometimes .	the patient imagines that no man nodded yet .	1
NPI-negation	the teenager could ever think that the women not nodded .	the teenager could often think that the women not nodded .	0
NPI-negation	the students were often imagining that a doctor could not arrive at the movie theaters .	the students were ever imagining that a doctor could not arrive at the movie theaters .	1
NPI-negation	no doctor could talk to the pedestrians at all .	Some doctor could talk to the pedestrians at all .	1
NPI-negation	Some customer ever disliked the teenagers .	no customer ever disliked the teenagers .	0
NPI-negation	the guests have often attacked some ladies .	the guests have ever attacked some ladies .	1
NPI-negation	the cashiers had said that no waitresses took the car yet .	the cashiers had said that no waitresses took the car sometimes .	0
NPI-negation	the actors often exit some child .	the actors ever exit some child .	1
NPI-negation	the doctors were not ever explaining that the waitresses slumped over .	the doctors were really ever explaining that the waitresses slumped over .	1
NPI-negation	the lady will explain that a girl might not drop by the public parks sometimes .	the lady will explain that a girl might not drop by the public parks yet .	1
NPI-negation	an adult was ever boycotting no woman .	an adult was often boycotting no woman .	0
NPI-negation	the waiters will ever drop by no teenager .	the waiters will often drop by no teenager .	0
NPI-negation	the actor ever thought that some guests remember a man .	the actor often thought that some guests remember a man .	0
NPI-negation	the lady has really explained that the adults have kissed a teacher yet .	the lady has not explained that the adults have kissed a teacher yet .	0
NPI-negation	the waitresses are often thinking that some girls forfeit .	the waitresses are ever thinking that some girls forfeit .	1
NPI-negation	Some customers ever imagined that a guy had stretched .	Some customers often imagined that a guy had stretched .	0
NPI-negation	the gal ever said that some person describes the pedestrian .	the gal often said that some person describes the pedestrian .	0
NPI-negation	the patients had often thought that some students toured the movie theater .	the patients had ever thought that some students toured the movie theater .	1
NPI-negation	the teachers are really thinking that the guest replied in years .	the teachers are not thinking that the guest replied in years .	0
NPI-negation	the gal really ever explains that the drivers were reacting .	the gal really often explains that the drivers were reacting .	0
NPI-negation	Some cashiers are walking through a teenager in years .	no cashiers are walking through a teenager in years .	0
NPI-negation	the humans were not explaining that the people can listen to the mice in years .	the humans were really explaining that the people can listen to the mice in years .	1
NPI-negation	Some guests have ever talked about the adults .	no guests have ever talked about the adults .	0
NPI-negation	a teacher is really ever saying that the children had watched the men .	a teacher is not ever saying that the children had watched the men .	0
NPI-negation	no boy does ever imagine that the pedestrians were hunting .	Some boy does ever imagine that the pedestrians were hunting .	1
NPI-negation	the drivers were not explaining that the customers disagree at all .	the drivers were really explaining that the customers disagree at all .	1
NPI-negation	the people ever think that some gals remembered the museum .	the people often think that some gals remembered the museum .	0
NPI-negation	no children do imagine that the children clashed in years .	Some children do imagine that the children clashed in years .	1
NPI-negation	the adults often sold some men .	the adults ever sold some men .	1
NPI-negation	the students had ever arrived at some humans .	the students had often arrived at some humans .	0
NPI-negation	the ladies had not said that the actors did work with a student in years .	the ladies had really said that the actors did work with a student in years .	1
NPI-negation	the men ever said that the women not wore the shirt .	the men often said that the women not wore the shirt .	0
NPI-negation	Some doctor thought that the waitress forfeits at all .	no doctor thought that the waitress forfeits at all .	0
NPI-negation	the woman often imagined that some guests exit the college campus .	the woman ever imagined that some guests exit the college campus .	1
NPI-negation	the man imagines that some waitress bikes to the malls yet .	the man imagines that some waitress bikes to the malls regularly .	0
NPI-negation	an actress is thinking that the teacher was not grinning sometimes .	an actress is thinking that the teacher was not grinning yet .	1
NPI-negation	the waiters think that no doctors are selling the newspaper articles yet .	the waiters think that no doctors are selling the newspaper articles regularly .	0
NPI-negation	Some students were attacking the boy sometimes .	Some students were attacking the boy yet .	1
NPI-negation	the patients had often thought that the waitresses might not drop by the schools .	the patients had ever thought that the waitresses might not drop by the schools .	1
NPI-negation	the actresses have often praised some human .	the actresses have ever praised some human .	1
NPI-negation	the patients ever explained that some child would retaliate .	the patients often explained that some child would retaliate .	0
NPI-negation	the adults had returned to some actors at all .	the adults had returned to no actors at all .	0
NPI-negation	Some people ever think that the gals remembered the museum .	Some people often think that the gals remembered the museum .	0
NPI-negation	the girls really explain that the guys should confer in years .	the girls not explain that the guys should confer in years .	0
NPI-negation	Some teacher can often wear the customer .	Some teacher can ever wear the customer .	1
NPI-negation	the guy was ever explaining that no girl shrugged .	the guy was often explaining that no girl shrugged .	0
NPI-negation	the men ever examined no patient .	the men often examined no patient .	0
NPI-negation	a patient has helped no waitresses at all .	a patient has helped some waitresses at all .	1
NPI-negation	no actresses ever attacked a waitress .	Some actresses ever attacked a waitress .	1
NPI-negation	the waitress should often help no adult .	the waitress should ever help no adult .	1
NPI-negation	Some boys listen to the children yet .	no boys listen to the children yet .	0
NPI-negation	Some student broke a patient sometimes .	Some student broke a patient yet .	1
NPI-negation	the gal often sells some teenager .	the gal ever sells some teenager .	1
NPI-negation	the students were really often saying that the doctor had scanned the play .	the students were really ever saying that the doctor had scanned the play .	1
NPI-negation	Some gal ever said that a person describes the pedestrian .	Some gal often said that a person describes the pedestrian .	0
NPI-negation	a person might ever clean some boy .	a person might often clean some boy .	0
NPI-negation	no adult ever criticizes the actresses .	Some adult ever criticizes the actresses .	1
NPI-negation	the driver ever went to no teenager .	the driver often went to no teenager .	0
NPI-negation	the people have ever thought that no doctors explored the movie theater .	the people have often thought that no doctors explored the movie theater .	0
NPI-negation	no ladies were talking to the waitresses yet .	Some ladies were talking to the waitresses yet .	1
NPI-negation	no boy has explained that the cashiers assemble in years .	Some boy has explained that the cashiers assemble in years .	1
NPI-negation	no actress is boycotting the ladies in years .	Some actress is boycotting the ladies in years .	1
NPI-negation	the children ever passed no guest .	the children often passed no guest .	0
NPI-negation	the gals not imagined that a guest is lying at all .	the gals really imagined that a guest is lying at all .	1
NPI-negation	Some patient imagines that the man nodded sometimes .	Some patient imagines that the man nodded yet .	1
NPI-negation	the teenagers ever fled from some girls .	the teenagers often fled from some girls .	0
NPI-negation	no girl kissed the actor in years .	Some girl kissed the actor in years .	1
NPI-negation	the humans had really ever thought that the guests should approve .	the humans had not ever thought that the guests should approve .	0
NPI-negation	the doctor might ever buy no teenagers .	the doctor might often buy no teenagers .	0
NPI-negation	Some lady was thinking that a person criticizes a person at all .	no lady was thinking that a person criticizes a person at all .	0
NPI-negation	no actor is saying that the boys saluted at all .	Some actor is saying that the boys saluted at all .	1
NPI-negation	the people like some cashiers yet .	the people like no cashiers yet .	0
NPI-negation	the student would really ever explain that the actor has compromised .	the student would not ever explain that the actor has compromised .	0
NPI-negation	the boys had loved some guy yet .	the boys had loved no guy yet .	0
NPI-negation	Some waitresses are ever taking a gal .	Some waitresses are often taking a gal .	0
NPI-negation	Some doctor ever observes the doctors .	Some doctor often observes the doctors .	0
NPI-negation	the lady had toured no girls at all .	the lady had toured some girls at all .	1
NPI-negation	Some girl did examine the teachers sometimes .	Some girl did examine the teachers yet .	1
NPI-negation	the pedestrians had really explained that the teachers salute in years .	the pedestrians had not explained that the teachers salute in years .	0
NPI-negation	a woman not explained that the pedestrian hugs the men at all .	a woman really explained that the pedestrian hugs the men at all .	1
NPI-negation	the teachers forgot no driver in years .	the teachers forgot some driver in years .	1
NPI-negation	the gals thought that no waitresses had examined an report yet .	the gals thought that no waitresses had examined an report regularly .	0
NPI-negation	the pedestrian has said that no man does hunt yet .	the pedestrian has said that no man does hunt sometimes .	0
NPI-negation	no gals are ever visiting the people .	Some gals are ever visiting the people .	1
NPI-negation	the guests were really thinking that the teacher did stand up in years .	the guests were not thinking that the teacher did stand up in years .	0
NPI-negation	no students are ever explaining that the customer benefits .	Some students are ever explaining that the customer benefits .	1
NPI-negation	the gals really ever said that the patients had praised the cashier .	the gals really often said that the patients had praised the cashier .	0
NPI-negation	a patient really thought that the men did go to the public park at all .	a patient not thought that the men did go to the public park at all .	0
NPI-negation	Some adults have often explained that a guest was talking to the adult .	Some adults have ever explained that a guest was talking to the adult .	1
NPI-negation	the driver has ever imagined that some teachers whisper .	the driver has often imagined that some teachers whisper .	0
NPI-negation	the children were ever thinking that some waitress should scratch .	the children were often thinking that some waitress should scratch .	0
NPI-negation	the guys ever think that some ladies are dating .	the guys often think that some ladies are dating .	0
NPI-negation	the doctors are often saying that the gals are not approving .	the doctors are ever saying that the gals are not approving .	1
NPI-negation	the adults really thought that the teenagers arrived at the school in years .	the adults not thought that the teenagers arrived at the school in years .	0
NPI-negation	a person is often imagining that some people can attack the customers .	a person is ever imagining that some people can attack the customers .	1
NPI-negation	a lady often says that no ladies will mutter .	a lady ever says that no ladies will mutter .	1
NPI-negation	Some actors think that the actress should insult the brochures in years .	no actors think that the actress should insult the brochures in years .	0
