experiment=NPI-env=only-npi=any-crucial_item=_-licensor=0-scope=1-npi_present=0	1		the people would also take some newspaper articles .
experiment=NPI-env=only-npi=any-crucial_item=_-licensor=0-scope=0-npi_present=0	1		some people would also take the newspaper articles .
experiment=NPI-env=only-npi=any-crucial_item=_-licensor=1-scope=0-npi_present=0	1		some students only lifted the dishes .
experiment=NPI-env=only-npi=any-crucial_item=_-licensor=0-scope=1-npi_present=0	1		the students also lifted some dishes .
experiment=NPI-env=only-npi=any-crucial_item=_-licensor=1-scope=1-npi_present=0	1		only an adult did bike to some museums .
experiment=NPI-env=only-npi=any-crucial_item=_-licensor=1-scope=0-npi_present=0	1		some adult did only bike to the museums .
experiment=NPI-env=only-npi=any-crucial_item=_-licensor=1-scope=1-npi_present=1	1		only the guy did sell any gloves .
experiment=NPI-env=only-npi=any-crucial_item=_-licensor=1-scope=0-npi_present=1	0		any guy did only sell the gloves .
experiment=NPI-env=only-npi=any-crucial_item=_-licensor=0-scope=1-npi_present=1	0		the people can also drop by any restaurants .
experiment=NPI-env=only-npi=any-crucial_item=_-licensor=0-scope=0-npi_present=1	0		any people can also drop by the restaurants .
experiment=NPI-env=only-npi=any-crucial_item=_-licensor=1-scope=1-npi_present=1	1		only the customers hug any actresses .
experiment=NPI-env=only-npi=any-crucial_item=_-licensor=0-scope=0-npi_present=0	1		some customers also hug the actresses .
experiment=NPI-env=only-npi=any-crucial_item=_-licensor=1-scope=1-npi_present=0	1		only the actresses brought some rugs .
experiment=NPI-env=only-npi=any-crucial_item=_-licensor=1-scope=0-npi_present=1	0		any actresses only brought the rugs .
experiment=NPI-env=only-npi=any-crucial_item=_-licensor=1-scope=0-npi_present=0	1		some actresses only brought the rugs .
experiment=NPI-env=only-npi=any-crucial_item=_-licensor=0-scope=1-npi_present=1	0		the actresses also brought any rugs .
experiment=NPI-env=only-npi=any-crucial_item=_-licensor=1-scope=1-npi_present=0	1		only the girls have kissed some actors .
experiment=NPI-env=only-npi=any-crucial_item=_-licensor=0-scope=0-npi_present=0	1		some girls have also kissed the actors .
experiment=NPI-env=only-npi=any-crucial_item=_-licensor=1-scope=0-npi_present=0	1		some student has only cared for the teachers .
experiment=NPI-env=only-npi=any-crucial_item=_-licensor=0-scope=1-npi_present=1	0		the student has also cared for any teachers .
experiment=NPI-env=only-npi=any-crucial_item=_-licensor=0-scope=1-npi_present=0	1		the student has also cared for some teachers .
experiment=NPI-env=only-npi=any-crucial_item=_-licensor=0-scope=0-npi_present=0	1		some student has also cared for the teachers .
experiment=NPI-env=only-npi=any-crucial_item=_-licensor=1-scope=0-npi_present=1	0		any waiter has only worn the gloves .
experiment=NPI-env=only-npi=any-crucial_item=_-licensor=1-scope=0-npi_present=0	1		some waiter has only worn the gloves .
experiment=NPI-env=only-npi=any-crucial_item=_-licensor=1-scope=1-npi_present=1	1		only a woman boycotts any public parks .
experiment=NPI-env=only-npi=any-crucial_item=_-licensor=1-scope=0-npi_present=1	0		any guest only discussed the customers .
experiment=NPI-env=only-npi=any-crucial_item=_-licensor=0-scope=1-npi_present=0	1		a guest also discussed some customers .
experiment=NPI-env=only-npi=any-crucial_item=_-licensor=0-scope=0-npi_present=0	1		some actors also boycott the hospitals .
experiment=NPI-env=only-npi=any-crucial_item=_-licensor=1-scope=0-npi_present=0	1		some doctors only disliked the newspaper articles .
experiment=NPI-env=only-npi=any-crucial_item=_-licensor=0-scope=1-npi_present=1	0		the doctors also disliked any newspaper articles .
experiment=NPI-env=only-npi=any-crucial_item=_-licensor=0-scope=1-npi_present=0	1		the doctors also disliked some newspaper articles .
experiment=NPI-env=only-npi=any-crucial_item=_-licensor=1-scope=0-npi_present=0	1		some customer only attacked the actors .
experiment=NPI-env=only-npi=any-crucial_item=_-licensor=0-scope=0-npi_present=0	1		some customer also attacked the actors .
experiment=NPI-env=only-npi=yet-crucial_item=_-licensor=1-scope=1-npi_present=1	1		only the humans escape from the women at all this week .
experiment=NPI-env=only-npi=yet-crucial_item=_-licensor=1-scope=0-npi_present=0	1		the humans escape from the women appropriately only this week .
experiment=NPI-env=only-npi=yet-crucial_item=_-licensor=0-scope=1-npi_present=1	0		the humans also escape from the women at all this week .
experiment=NPI-env=only-npi=yet-crucial_item=_-licensor=1-scope=1-npi_present=0	1		only the teenagers had cleaned the glasses angrily this year .
experiment=NPI-env=only-npi=yet-crucial_item=_-licensor=1-scope=0-npi_present=1	0		the teenagers had cleaned the glasses at all only this year .
experiment=NPI-env=only-npi=yet-crucial_item=_-licensor=1-scope=1-npi_present=1	1		only the man has walked through the public parks at all this week .
experiment=NPI-env=only-npi=yet-crucial_item=_-licensor=1-scope=1-npi_present=0	1		only the man has walked through the public parks happily this week .
experiment=NPI-env=only-npi=yet-crucial_item=_-licensor=1-scope=0-npi_present=1	0		a customer explores the banks at all only today .
experiment=NPI-env=only-npi=yet-crucial_item=_-licensor=0-scope=1-npi_present=0	1		a customer also explores the banks happily today .
experiment=NPI-env=only-npi=yet-crucial_item=_-licensor=0-scope=0-npi_present=0	1		a customer explores the banks happily also today .
experiment=NPI-env=only-npi=yet-crucial_item=_-licensor=0-scope=0-npi_present=1	0		a waitress respected the humans at all also today .
experiment=NPI-env=only-npi=yet-crucial_item=_-licensor=1-scope=1-npi_present=1	1		only the guy might lift the rugs at all sometimes .
experiment=NPI-env=only-npi=yet-crucial_item=_-licensor=1-scope=1-npi_present=0	1		only the guy might lift the rugs inappropriately sometimes .
experiment=NPI-env=only-npi=yet-crucial_item=_-licensor=1-scope=1-npi_present=0	1		only a driver can talk about the adults happily this year .
experiment=NPI-env=only-npi=yet-crucial_item=_-licensor=1-scope=0-npi_present=0	1		a driver can talk about the adults happily only this year .
experiment=NPI-env=only-npi=yet-crucial_item=_-licensor=1-scope=1-npi_present=1	1		only the children explored the high schools at all sometimes .
experiment=NPI-env=only-npi=yet-crucial_item=_-licensor=1-scope=1-npi_present=0	1		only the children explored the high schools inappropriately sometimes .
experiment=NPI-env=only-npi=yet-crucial_item=_-licensor=0-scope=0-npi_present=0	1		the children explored the high schools inappropriately also sometimes .
experiment=NPI-env=only-npi=yet-crucial_item=_-licensor=0-scope=0-npi_present=0	1		the driver admired the guys inappropriately also sometimes .
experiment=NPI-env=only-npi=yet-crucial_item=_-licensor=1-scope=1-npi_present=1	1		only the woman could go to the museums at all today .
experiment=NPI-env=only-npi=yet-crucial_item=_-licensor=1-scope=1-npi_present=0	1		only the woman could go to the museums inappropriately today .
experiment=NPI-env=only-npi=yet-crucial_item=_-licensor=1-scope=0-npi_present=0	1		the woman could go to the museums inappropriately only today .
experiment=NPI-env=only-npi=yet-crucial_item=_-licensor=0-scope=1-npi_present=1	0		the woman could also go to the museums at all today .
experiment=NPI-env=only-npi=yet-crucial_item=_-licensor=0-scope=0-npi_present=0	1		the woman could go to the museums inappropriately also today .
experiment=NPI-env=only-npi=yet-crucial_item=_-licensor=1-scope=1-npi_present=0	1		only the doctors know the actors happily this year .
experiment=NPI-env=only-npi=yet-crucial_item=_-licensor=1-scope=0-npi_present=1	0		the doctors know the actors at all only this year .
experiment=NPI-env=only-npi=yet-crucial_item=_-licensor=1-scope=1-npi_present=1	1		only the guys had seen the shoes at all this week .
experiment=NPI-env=only-npi=yet-crucial_item=_-licensor=0-scope=1-npi_present=1	0		the guys had also seen the shoes at all this week .
experiment=NPI-env=only-npi=yet-crucial_item=_-licensor=0-scope=1-npi_present=0	1		the guys had also seen the shoes angrily this week .
experiment=NPI-env=only-npi=yet-crucial_item=_-licensor=0-scope=0-npi_present=1	0		the guys had seen the shoes at all also this week .
experiment=NPI-env=only-npi=yet-crucial_item=_-licensor=1-scope=0-npi_present=0	1		a customer talked to the gals appropriately only today .
experiment=NPI-env=only-npi=yet-crucial_item=_-licensor=0-scope=1-npi_present=0	1		a customer also talked to the gals appropriately today .
experiment=NPI-env=only-npi=yet-crucial_item=_-licensor=1-scope=1-npi_present=0	1		only a child bikes to the cafes appropriately this year .
experiment=NPI-env=only-npi=yet-crucial_item=_-licensor=1-scope=0-npi_present=0	1		a child bikes to the cafes appropriately only this year .
experiment=NPI-env=only-npi=yet-crucial_item=_-licensor=0-scope=0-npi_present=0	1		a child bikes to the cafes appropriately also this year .
experiment=NPI-env=only-npi=yet-crucial_item=_-licensor=1-scope=0-npi_present=1	0		a cashier bought the shoes at all only sometimes .
experiment=NPI-env=only-npi=yet-crucial_item=_-licensor=0-scope=1-npi_present=0	1		a cashier also bought the shoes angrily sometimes .
experiment=NPI-env=only-npi=yet-crucial_item=_-licensor=0-scope=0-npi_present=1	0		a cashier bought the shoes at all also sometimes .
experiment=NPI-env=only-npi=yet-crucial_item=_-licensor=0-scope=0-npi_present=0	1		a cashier bought the shoes angrily also sometimes .
experiment=NPI-env=only-npi=yet-crucial_item=_-licensor=0-scope=0-npi_present=0	1		the teenagers broke the chairs appropriately also this week .
experiment=NPI-env=only-npi=yet-crucial_item=_-licensor=1-scope=0-npi_present=0	1		the ladies disliked the teenagers appropriately only sometimes .
experiment=NPI-env=only-npi=yet-crucial_item=_-licensor=0-scope=1-npi_present=0	1		the ladies also disliked the teenagers appropriately sometimes .
experiment=NPI-env=only-npi=yet-crucial_item=_-licensor=0-scope=0-npi_present=0	1		the ladies disliked the teenagers appropriately also sometimes .
experiment=NPI-env=only-npi=yet-crucial_item=_-licensor=1-scope=1-npi_present=1	1		only a patient talks to the customers at all sometimes .
experiment=NPI-env=only-npi=yet-crucial_item=_-licensor=0-scope=1-npi_present=1	0		a patient also talks to the customers at all sometimes .
experiment=NPI-env=only-npi=yet-crucial_item=_-licensor=0-scope=0-npi_present=0	1		a patient talks to the customers inappropriately also sometimes .
experiment=NPI-env=only-npi=yet-crucial_item=_-licensor=1-scope=0-npi_present=1	0		a human listens to the doctors at all only this year .
experiment=NPI-env=only-npi=yet-crucial_item=_-licensor=1-scope=0-npi_present=0	1		the pedestrians boycott the malls happily only this week .
experiment=NPI-env=only-npi=yet-crucial_item=_-licensor=0-scope=1-npi_present=1	0		the pedestrians also boycott the malls at all this week .
experiment=NPI-env=only-npi=yet-crucial_item=_-licensor=0-scope=0-npi_present=1	0		the pedestrians boycott the malls at all also this week .
experiment=NPI-env=only-npi=yet-crucial_item=_-licensor=0-scope=1-npi_present=0	1		the cashiers had also worn the gloves angrily sometimes .
experiment=NPI-env=only-npi=yet-crucial_item=_-licensor=0-scope=0-npi_present=1	0		the cashiers had worn the gloves at all also sometimes .
experiment=NPI-env=only-npi=yet-crucial_item=_-licensor=0-scope=0-npi_present=0	1		a lady brought the couches inappropriately also sometimes .
experiment=NPI-env=only-npi=yet-crucial_item=_-licensor=0-scope=1-npi_present=1	0		the waitress does also escape from the adults at all sometimes .
experiment=NPI-env=only-npi=yet-crucial_item=_-licensor=0-scope=0-npi_present=0	1		the waitress does escape from the adults happily also sometimes .
experiment=NPI-env=only-npi=yet-crucial_item=_-licensor=1-scope=1-npi_present=0	1		only the teenager should be at the movie theaters angrily this week .
experiment=NPI-env=only-npi=yet-crucial_item=_-licensor=1-scope=0-npi_present=1	0		the teenager should be at the movie theaters at all only this week .
experiment=NPI-env=only-npi=yet-crucial_item=_-licensor=1-scope=0-npi_present=0	1		the teenager should be at the movie theaters angrily only this week .
experiment=NPI-env=only-npi=yet-crucial_item=_-licensor=0-scope=1-npi_present=1	0		the teenager should also be at the movie theaters at all this week .
experiment=NPI-env=only-npi=yet-crucial_item=_-licensor=0-scope=0-npi_present=0	1		the teenager should be at the movie theaters angrily also this week .
experiment=NPI-env=only-npi=yet-crucial_item=_-licensor=1-scope=1-npi_present=1	1		only the adults will investigate the teenagers at all today .
experiment=NPI-env=only-npi=yet-crucial_item=_-licensor=1-scope=0-npi_present=1	0		the adults will investigate the teenagers at all only today .
experiment=NPI-env=only-npi=yet-crucial_item=_-licensor=1-scope=1-npi_present=1	1		only a guy knows the boys at all today .
experiment=NPI-env=only-npi=yet-crucial_item=_-licensor=1-scope=0-npi_present=1	0		a guy knows the boys at all only today .
experiment=NPI-env=only-npi=yet-crucial_item=_-licensor=0-scope=1-npi_present=0	1		a customer had also remembered the customers happily this week .
experiment=NPI-env=only-npi=yet-crucial_item=_-licensor=1-scope=1-npi_present=0	1		only a pedestrian had skated around the banks appropriately this year .
experiment=NPI-env=only-npi=yet-crucial_item=_-licensor=1-scope=0-npi_present=1	0		a pedestrian had skated around the banks at all only this year .
experiment=NPI-env=only-npi=yet-crucial_item=_-licensor=0-scope=0-npi_present=0	1		a pedestrian had skated around the banks appropriately also this year .
experiment=NPI-env=only-npi=yet-crucial_item=_-licensor=1-scope=0-npi_present=1	0		the boys praise the cashiers at all only today .
experiment=NPI-env=only-npi=yet-crucial_item=_-licensor=1-scope=0-npi_present=0	1		the boys praise the cashiers inappropriately only today .
experiment=NPI-env=only-npi=yet-crucial_item=_-licensor=0-scope=1-npi_present=1	0		the boys also praise the cashiers at all today .
experiment=NPI-env=only-npi=yet-crucial_item=_-licensor=0-scope=0-npi_present=0	1		the boys praise the cashiers inappropriately also today .
experiment=NPI-env=only-npi=yet-crucial_item=_-licensor=1-scope=1-npi_present=1	1		only a pedestrian took the pants at all sometimes .
experiment=NPI-env=only-npi=yet-crucial_item=_-licensor=1-scope=1-npi_present=0	1		only a pedestrian took the pants angrily sometimes .
experiment=NPI-env=only-npi=yet-crucial_item=_-licensor=1-scope=0-npi_present=1	0		a pedestrian took the pants at all only sometimes .
experiment=NPI-env=only-npi=yet-crucial_item=_-licensor=0-scope=1-npi_present=1	0		a pedestrian also took the pants at all sometimes .
experiment=NPI-env=only-npi=yet-crucial_item=_-licensor=0-scope=0-npi_present=1	0		a pedestrian took the pants at all also sometimes .
experiment=NPI-env=only-npi=yet-crucial_item=_-licensor=1-scope=1-npi_present=0	1		only the girls had ran around the cafes appropriately this week .
experiment=NPI-env=only-npi=yet-crucial_item=_-licensor=0-scope=0-npi_present=0	1		the girls had ran around the cafes appropriately also this week .
experiment=NPI-env=only-npi=yet-crucial_item=_-licensor=0-scope=1-npi_present=1	0		the women also talked about the students at all today .
experiment=NPI-env=only-npi=yet-crucial_item=_-licensor=1-scope=0-npi_present=0	1		the boys remember the grocery stores happily only today .
experiment=NPI-env=only-npi=yet-crucial_item=_-licensor=0-scope=1-npi_present=0	1		the boys also remember the grocery stores happily today .
experiment=NPI-env=only-npi=yet-crucial_item=_-licensor=0-scope=0-npi_present=1	0		the boys remember the grocery stores at all also today .
experiment=NPI-env=only-npi=yet-crucial_item=_-licensor=0-scope=1-npi_present=1	0		the doctors did also have the chairs at all today .
experiment=NPI-env=only-npi=yet-crucial_item=_-licensor=1-scope=0-npi_present=0	1		the people did watch the people angrily only today .
experiment=NPI-env=only-npi=yet-crucial_item=_-licensor=1-scope=1-npi_present=0	1		only an actor listens to the ladies angrily today .
experiment=NPI-env=only-npi=yet-crucial_item=_-licensor=0-scope=0-npi_present=0	1		an actor listens to the ladies angrily also today .
experiment=NPI-env=only-npi=yet-crucial_item=_-licensor=0-scope=1-npi_present=1	0		the adults also scan the newspaper articles at all this week .
experiment=NPI-env=only-npi=yet-crucial_item=_-licensor=0-scope=0-npi_present=1	0		the adults scan the newspaper articles at all also this week .
experiment=NPI-env=only-npi=yet-crucial_item=_-licensor=0-scope=0-npi_present=0	1		the adults scan the newspaper articles appropriately also this week .
experiment=NPI-env=only-npi=yet-crucial_item=_-licensor=1-scope=0-npi_present=1	0		the patients did reference the guys at all only this week .
experiment=NPI-env=only-npi=yet-crucial_item=_-licensor=1-scope=0-npi_present=0	1		the patients did reference the guys happily only this week .
experiment=NPI-env=only-npi=yet-crucial_item=_-licensor=0-scope=1-npi_present=0	1		the patients did also reference the guys happily this week .
experiment=NPI-env=only-npi=yet-crucial_item=_-licensor=0-scope=0-npi_present=0	1		the patients did reference the guys happily also this week .
experiment=NPI-env=only-npi=yet-crucial_item=_-licensor=0-scope=0-npi_present=0	1		the guy can bike to the grocery stores inappropriately also this year .
experiment=NPI-env=only-npi=yet-crucial_item=_-licensor=1-scope=1-npi_present=1	1		only the humans had attacked the waiters at all sometimes .
experiment=NPI-env=only-npi=yet-crucial_item=_-licensor=1-scope=0-npi_present=1	0		the humans had attacked the waiters at all only sometimes .
experiment=NPI-env=only-npi=yet-crucial_item=_-licensor=1-scope=0-npi_present=0	1		the humans had attacked the waiters angrily only sometimes .
experiment=NPI-env=only-npi=yet-crucial_item=_-licensor=1-scope=1-npi_present=1	1		only the waiter observed the gals at all sometimes .
experiment=NPI-env=only-npi=yet-crucial_item=_-licensor=1-scope=1-npi_present=0	1		only the waiter observed the gals appropriately sometimes .
experiment=NPI-env=only-npi=yet-crucial_item=_-licensor=0-scope=1-npi_present=0	1		the waiter also observed the gals appropriately sometimes .
experiment=NPI-env=only-npi=yet-crucial_item=_-licensor=1-scope=1-npi_present=1	1		only the doctors remember the movies at all today .
experiment=NPI-env=only-npi=yet-crucial_item=_-licensor=1-scope=1-npi_present=1	1		only the drivers should examine the plays at all today .
experiment=NPI-env=only-npi=yet-crucial_item=_-licensor=1-scope=0-npi_present=1	0		the people will drop by the art galleries at all only this week .
experiment=NPI-env=only-npi=yet-crucial_item=_-licensor=0-scope=1-npi_present=1	0		the people will also drop by the art galleries at all this week .
experiment=NPI-env=only-npi=yet-crucial_item=_-licensor=1-scope=1-npi_present=0	1		only the guys could arrive at the libraries angrily this week .
experiment=NPI-env=only-npi=yet-crucial_item=_-licensor=1-scope=0-npi_present=0	1		the guys could arrive at the libraries angrily only this week .
experiment=NPI-env=only-npi=yet-crucial_item=_-licensor=0-scope=1-npi_present=1	0		the guys could also arrive at the libraries at all this week .
experiment=NPI-env=only-npi=yet-crucial_item=_-licensor=0-scope=1-npi_present=0	1		the guys could also arrive at the libraries angrily this week .
experiment=NPI-env=only-npi=yet-crucial_item=_-licensor=0-scope=0-npi_present=0	1		the guys could arrive at the libraries angrily also this week .
experiment=NPI-env=only-npi=yet-crucial_item=_-licensor=1-scope=1-npi_present=1	1		only the pedestrian should bring the plates at all this week .
experiment=NPI-env=only-npi=yet-crucial_item=_-licensor=1-scope=0-npi_present=1	0		the pedestrian should bring the plates at all only this week .
experiment=NPI-env=only-npi=yet-crucial_item=_-licensor=1-scope=1-npi_present=1	1		only the boys watch the pedestrians at all sometimes .
experiment=NPI-env=only-npi=yet-crucial_item=_-licensor=1-scope=1-npi_present=0	1		only the actresses helped the patients appropriately sometimes .
experiment=NPI-env=only-npi=yet-crucial_item=_-licensor=1-scope=0-npi_present=0	1		the actresses helped the patients appropriately only sometimes .
experiment=NPI-env=only-npi=yet-crucial_item=_-licensor=0-scope=1-npi_present=0	1		the actresses also helped the patients appropriately sometimes .
experiment=NPI-env=only-npi=yet-crucial_item=_-licensor=0-scope=0-npi_present=0	1		the actresses helped the patients appropriately also sometimes .
experiment=NPI-env=only-npi=yet-crucial_item=_-licensor=1-scope=1-npi_present=0	1		only the patients did be at the public parks happily this year .
experiment=NPI-env=only-npi=yet-crucial_item=_-licensor=1-scope=1-npi_present=1	1		only a teacher has criticized the doctors at all sometimes .
experiment=NPI-env=only-npi=yet-crucial_item=_-licensor=1-scope=0-npi_present=1	0		a teacher has criticized the doctors at all only sometimes .
experiment=NPI-env=only-npi=yet-crucial_item=_-licensor=0-scope=1-npi_present=1	0		a teacher has also criticized the doctors at all sometimes .
experiment=NPI-env=only-npi=yet-crucial_item=_-licensor=0-scope=0-npi_present=1	0		a teacher has criticized the doctors at all also sometimes .
experiment=NPI-env=only-npi=yet-crucial_item=_-licensor=1-scope=1-npi_present=1	1		only the girls exited the movie theaters at all today .
experiment=NPI-env=only-npi=yet-crucial_item=_-licensor=0-scope=1-npi_present=1	0		a guy also ran around the college campuses at all today .
experiment=NPI-env=only-npi=yet-crucial_item=_-licensor=0-scope=1-npi_present=0	1		a guy also ran around the college campuses angrily today .
experiment=NPI-env=only-npi=yet-crucial_item=_-licensor=0-scope=0-npi_present=0	1		a guy ran around the college campuses angrily also today .
experiment=NPI-env=only-npi=yet-crucial_item=_-licensor=1-scope=0-npi_present=1	0		a guy lifts the plates at all only this week .
experiment=NPI-env=only-npi=yet-crucial_item=_-licensor=0-scope=0-npi_present=1	0		a guy lifts the plates at all also this week .
experiment=NPI-env=only-npi=yet-crucial_item=_-licensor=1-scope=1-npi_present=1	1		only the women will help the guys at all today .
experiment=NPI-env=only-npi=yet-crucial_item=_-licensor=0-scope=0-npi_present=1	0		the adults could discuss the customers at all also sometimes .
experiment=NPI-env=only-npi=yet-crucial_item=_-licensor=1-scope=1-npi_present=1	1		only a driver had passed the public parks at all sometimes .
experiment=NPI-env=only-npi=yet-crucial_item=_-licensor=1-scope=0-npi_present=0	1		a driver had passed the public parks inappropriately only sometimes .
experiment=NPI-env=only-npi=yet-crucial_item=_-licensor=0-scope=1-npi_present=0	1		a driver had also passed the public parks inappropriately sometimes .
experiment=NPI-env=only-npi=yet-crucial_item=_-licensor=0-scope=1-npi_present=0	1		the women also leave the museums appropriately this week .
experiment=NPI-env=only-npi=yet-crucial_item=_-licensor=0-scope=0-npi_present=0	1		the women leave the museums appropriately also this week .
experiment=NPI-env=only-npi=yet-crucial_item=_-licensor=1-scope=1-npi_present=1	1		only the girls can skate around the grocery stores at all this year .
experiment=NPI-env=only-npi=yet-crucial_item=_-licensor=1-scope=0-npi_present=1	0		the girls can skate around the grocery stores at all only this year .
experiment=NPI-env=only-npi=yet-crucial_item=_-licensor=1-scope=1-npi_present=0	1		only the pedestrians arrive at the museums appropriately this year .
experiment=NPI-env=only-npi=yet-crucial_item=_-licensor=1-scope=0-npi_present=1	0		the pedestrians arrive at the museums at all only this year .
experiment=NPI-env=only-npi=yet-crucial_item=_-licensor=1-scope=0-npi_present=0	1		the pedestrians arrive at the museums appropriately only this year .
experiment=NPI-env=only-npi=yet-crucial_item=_-licensor=0-scope=1-npi_present=0	1		the child has also discussed the cafes happily today .
experiment=NPI-env=only-npi=yet-crucial_item=_-licensor=1-scope=1-npi_present=1	1		only a patient should have the dishes at all sometimes .
experiment=NPI-env=only-npi=yet-crucial_item=_-licensor=1-scope=1-npi_present=0	1		only a patient should have the dishes appropriately sometimes .
experiment=NPI-env=only-npi=yet-crucial_item=_-licensor=1-scope=0-npi_present=1	0		a patient should have the dishes at all only sometimes .
experiment=NPI-env=only-npi=yet-crucial_item=_-licensor=0-scope=0-npi_present=1	0		a patient should have the dishes at all also sometimes .
experiment=NPI-env=only-npi=yet-crucial_item=_-licensor=0-scope=0-npi_present=0	1		a patient should have the dishes appropriately also sometimes .
experiment=NPI-env=only-npi=yet-crucial_item=_-licensor=0-scope=0-npi_present=1	0		a cashier had loved the humans at all also today .
experiment=NPI-env=only-npi=yet-crucial_item=_-licensor=0-scope=1-npi_present=1	0		a boy also discussed the college campuses at all sometimes .
experiment=NPI-env=only-npi=yet-crucial_item=_-licensor=0-scope=1-npi_present=0	1		a boy also discussed the college campuses happily sometimes .
experiment=NPI-env=only-npi=yet-crucial_item=_-licensor=0-scope=0-npi_present=0	1		a boy discussed the college campuses happily also sometimes .
experiment=NPI-env=only-npi=yet-crucial_item=_-licensor=1-scope=0-npi_present=0	1		the children have escaped from the guests inappropriately only this week .
experiment=NPI-env=only-npi=yet-crucial_item=_-licensor=0-scope=1-npi_present=1	0		the children have also escaped from the guests at all this week .
