experiment=NPI-env=quantifier-npi=ever-crucial_item=a lot of-licensor=0-scope=1-npi_present=0	1		a lot of girls who now visit the high schools see some humans .
experiment=NPI-env=quantifier-npi=ever-crucial_item=a lot of-licensor=0-scope=0-npi_present=1	0		a lot of girls who visit the high schools ever see some humans .
experiment=NPI-env=quantifier-npi=ever-crucial_item=any-licensor=1-scope=1-npi_present=0	1		any children who had once approached the customers might see a lot of couches .
experiment=NPI-env=quantifier-npi=ever-crucial_item=a lot of-licensor=0-scope=0-npi_present=0	1		a lot of customers who boycott many museums had once helped many cashiers .
experiment=NPI-env=quantifier-npi=ever-crucial_item=all-licensor=1-scope=1-npi_present=1	1		all customers who ever boycott many museums had helped many cashiers .
experiment=NPI-env=quantifier-npi=ever-crucial_item=all-licensor=1-scope=1-npi_present=0	1		all customers who now boycott many museums had helped many cashiers .
experiment=NPI-env=quantifier-npi=ever-crucial_item=all-licensor=1-scope=0-npi_present=1	0		all customers who boycott many museums had ever helped many cashiers .
experiment=NPI-env=quantifier-npi=ever-crucial_item=some-licensor=0-scope=1-npi_present=1	0		some man who had ever respected actors can see a lot of ladies .
experiment=NPI-env=quantifier-npi=ever-crucial_item=some-licensor=0-scope=0-npi_present=0	1		some man who had respected actors can now see a lot of ladies .
experiment=NPI-env=quantifier-npi=ever-crucial_item=every-licensor=1-scope=1-npi_present=0	1		every man who had once respected actors can see a lot of ladies .
experiment=NPI-env=quantifier-npi=ever-crucial_item=every-licensor=1-scope=0-npi_present=1	0		every man who had respected actors can ever see a lot of ladies .
experiment=NPI-env=quantifier-npi=ever-crucial_item=more than three-licensor=0-scope=1-npi_present=1	0		more than three boys who have ever boycotted many cafes had sold many plates .
experiment=NPI-env=quantifier-npi=ever-crucial_item=all-licensor=1-scope=1-npi_present=1	1		all boys who have ever boycotted many cafes had sold many plates .
experiment=NPI-env=quantifier-npi=ever-crucial_item=all-licensor=1-scope=0-npi_present=1	0		all boys who have boycotted many cafes had ever sold many plates .
experiment=NPI-env=quantifier-npi=ever-crucial_item=all-licensor=1-scope=0-npi_present=0	1		all boys who have boycotted many cafes had once sold many plates .
experiment=NPI-env=quantifier-npi=ever-crucial_item=any-licensor=1-scope=1-npi_present=1	1		any actresses who ever hug some cashiers have more than three glasses .
experiment=NPI-env=quantifier-npi=ever-crucial_item=any-licensor=1-scope=1-npi_present=0	1		any actresses who now hug some cashiers have more than three glasses .
experiment=NPI-env=quantifier-npi=ever-crucial_item=any-licensor=1-scope=0-npi_present=1	0		any actresses who hug some cashiers ever have more than three glasses .
experiment=NPI-env=quantifier-npi=ever-crucial_item=any-licensor=1-scope=0-npi_present=0	1		any actresses who hug some cashiers now have more than three glasses .
experiment=NPI-env=quantifier-npi=ever-crucial_item=a-licensor=0-scope=1-npi_present=0	1		a cashier who has now disliked more than three stories had worn many pants .
experiment=NPI-env=quantifier-npi=ever-crucial_item=an-licensor=0-scope=0-npi_present=1	0		an adult who will go to a lot of college campuses has ever returned to the boys .
experiment=NPI-env=quantifier-npi=ever-crucial_item=every-licensor=1-scope=1-npi_present=0	1		every adult who will now go to a lot of college campuses has returned to the boys .
experiment=NPI-env=quantifier-npi=ever-crucial_item=every-licensor=1-scope=0-npi_present=0	1		every adult who will go to a lot of college campuses has now returned to the boys .
experiment=NPI-env=quantifier-npi=ever-crucial_item=more than three-licensor=0-scope=1-npi_present=0	1		more than three actresses who now do skate around the high schools went to many banks .
experiment=NPI-env=quantifier-npi=ever-crucial_item=more than three-licensor=0-scope=0-npi_present=1	0		more than three actresses who do skate around the high schools ever went to many banks .
experiment=NPI-env=quantifier-npi=ever-crucial_item=any-licensor=1-scope=1-npi_present=0	1		any actresses who now do skate around the high schools went to many banks .
experiment=NPI-env=quantifier-npi=ever-crucial_item=some-licensor=0-scope=1-npi_present=1	0		some girls who have ever listened to the boys have arrived at public parks .
experiment=NPI-env=quantifier-npi=ever-crucial_item=some-licensor=0-scope=1-npi_present=0	1		some girls who have now listened to the boys have arrived at public parks .
experiment=NPI-env=quantifier-npi=ever-crucial_item=any-licensor=1-scope=1-npi_present=1	1		any girls who have ever listened to the boys have arrived at public parks .
experiment=NPI-env=quantifier-npi=ever-crucial_item=every-licensor=1-scope=1-npi_present=1	1		every person who had ever loved some essays has broken forks .
experiment=NPI-env=quantifier-npi=ever-crucial_item=a-licensor=0-scope=0-npi_present=1	0		a driver who had kissed many adults ever are at some schools .
experiment=NPI-env=quantifier-npi=ever-crucial_item=every-licensor=1-scope=0-npi_present=1	0		every driver who had kissed many adults ever are at some schools .
experiment=NPI-env=quantifier-npi=ever-crucial_item=every-licensor=1-scope=0-npi_present=0	1		every driver who had kissed many adults now are at some schools .
experiment=NPI-env=quantifier-npi=ever-crucial_item=some-licensor=0-scope=1-npi_present=0	1		some patient who once respected patients can resemble the dishes .
experiment=NPI-env=quantifier-npi=ever-crucial_item=every-licensor=1-scope=0-npi_present=1	0		every patient who respected patients can ever resemble the dishes .
experiment=NPI-env=quantifier-npi=ever-crucial_item=a-licensor=0-scope=1-npi_present=1	0		a child who ever remembers doctors loved more than three pedestrians .
experiment=NPI-env=quantifier-npi=ever-crucial_item=a-licensor=0-scope=0-npi_present=1	0		a child who remembers doctors ever loved more than three pedestrians .
experiment=NPI-env=quantifier-npi=ever-crucial_item=the-licensor=0-scope=1-npi_present=0	1		the driver who now resembles a lot of drivers exited many grocery stores .
experiment=NPI-env=quantifier-npi=ever-crucial_item=the-licensor=0-scope=0-npi_present=1	0		the driver who resembles a lot of drivers ever exited many grocery stores .
experiment=NPI-env=quantifier-npi=ever-crucial_item=the-licensor=0-scope=0-npi_present=0	1		the driver who resembles a lot of drivers once exited many grocery stores .
experiment=NPI-env=quantifier-npi=ever-crucial_item=every-licensor=1-scope=1-npi_present=1	1		every driver who ever resembles a lot of drivers exited many grocery stores .
experiment=NPI-env=quantifier-npi=ever-crucial_item=many-licensor=0-scope=1-npi_present=0	1		many teachers who can now attack gals investigate more than three hospitals .
experiment=NPI-env=quantifier-npi=ever-crucial_item=many-licensor=0-scope=0-npi_present=1	0		many teachers who can attack gals ever investigate more than three hospitals .
experiment=NPI-env=quantifier-npi=ever-crucial_item=many-licensor=0-scope=0-npi_present=0	1		many teachers who can attack gals now investigate more than three hospitals .
experiment=NPI-env=quantifier-npi=ever-crucial_item=any-licensor=1-scope=1-npi_present=1	1		any teachers who can ever attack gals investigate more than three hospitals .
experiment=NPI-env=quantifier-npi=ever-crucial_item=any-licensor=1-scope=0-npi_present=1	0		any teachers who can attack gals ever investigate more than three hospitals .
experiment=NPI-env=quantifier-npi=ever-crucial_item=-licensor=0-scope=1-npi_present=0	1		men who would once dislike some cafes had talked about a lot of girls .
experiment=NPI-env=quantifier-npi=ever-crucial_item=any-licensor=1-scope=1-npi_present=0	1		any men who would once dislike some cafes had talked about a lot of girls .
experiment=NPI-env=quantifier-npi=ever-crucial_item=any-licensor=1-scope=0-npi_present=1	0		any men who would dislike some cafes had ever talked about a lot of girls .
experiment=NPI-env=quantifier-npi=ever-crucial_item=more than three-licensor=0-scope=0-npi_present=1	0		more than three guys who might scan a lot of plays should ever sell many couches .
experiment=NPI-env=quantifier-npi=ever-crucial_item=all-licensor=1-scope=1-npi_present=0	1		all guys who might now scan a lot of plays should sell many couches .
experiment=NPI-env=quantifier-npi=ever-crucial_item=all-licensor=1-scope=0-npi_present=0	1		all guys who might scan a lot of plays should now sell many couches .
experiment=NPI-env=quantifier-npi=ever-crucial_item=a lot of-licensor=0-scope=1-npi_present=1	0		a lot of men who ever scan more than three documentaries listened to pedestrians .
experiment=NPI-env=quantifier-npi=ever-crucial_item=a lot of-licensor=0-scope=0-npi_present=0	1		a lot of men who scan more than three documentaries once listened to pedestrians .
experiment=NPI-env=quantifier-npi=ever-crucial_item=all-licensor=1-scope=1-npi_present=1	1		all men who ever scan more than three documentaries listened to pedestrians .
experiment=NPI-env=quantifier-npi=ever-crucial_item=all-licensor=1-scope=1-npi_present=0	1		all men who now scan more than three documentaries listened to pedestrians .
experiment=NPI-env=quantifier-npi=ever-crucial_item=all-licensor=1-scope=0-npi_present=1	0		all men who scan more than three documentaries ever listened to pedestrians .
experiment=NPI-env=quantifier-npi=ever-crucial_item=a-licensor=0-scope=1-npi_present=1	0		a girl who ever did drive to more than three hospitals toured some movie theaters .
experiment=NPI-env=quantifier-npi=ever-crucial_item=a-licensor=0-scope=1-npi_present=0	1		a girl who once did drive to more than three hospitals toured some movie theaters .
experiment=NPI-env=quantifier-npi=ever-crucial_item=every-licensor=1-scope=1-npi_present=0	1		every girl who once did drive to more than three hospitals toured some movie theaters .
experiment=NPI-env=quantifier-npi=ever-crucial_item=every-licensor=1-scope=0-npi_present=1	0		every girl who did drive to more than three hospitals ever toured some movie theaters .
experiment=NPI-env=quantifier-npi=ever-crucial_item=every-licensor=1-scope=0-npi_present=0	1		every girl who did drive to more than three hospitals once toured some movie theaters .
experiment=NPI-env=quantifier-npi=ever-crucial_item=many-licensor=0-scope=1-npi_present=1	0		many people who ever attacked some children have been at more than three libraries .
experiment=NPI-env=quantifier-npi=ever-crucial_item=any-licensor=1-scope=0-npi_present=1	0		any people who attacked some children have ever been at more than three libraries .
experiment=NPI-env=quantifier-npi=ever-crucial_item=the-licensor=0-scope=1-npi_present=0	1		the humans who once sold many cups been at a lot of museums .
experiment=NPI-env=quantifier-npi=ever-crucial_item=the-licensor=0-scope=0-npi_present=0	1		the humans who sold many cups once been at a lot of museums .
experiment=NPI-env=quantifier-npi=ever-crucial_item=a lot of-licensor=0-scope=0-npi_present=1	0		a lot of children who hate more than three documentaries had ever taken some chairs .
experiment=NPI-env=quantifier-npi=ever-crucial_item=all-licensor=1-scope=1-npi_present=0	1		all children who now hate more than three documentaries had taken some chairs .
experiment=NPI-env=quantifier-npi=ever-crucial_item=some-licensor=0-scope=0-npi_present=1	0		some teenager who had driven to many restaurants might ever listen to students .
experiment=NPI-env=quantifier-npi=ever-crucial_item=some-licensor=0-scope=0-npi_present=0	1		some teenager who had driven to many restaurants might now listen to students .
experiment=NPI-env=quantifier-npi=ever-crucial_item=every-licensor=1-scope=0-npi_present=0	1		every teenager who had driven to many restaurants might now listen to students .
experiment=NPI-env=quantifier-npi=ever-crucial_item=a lot of-licensor=0-scope=1-npi_present=1	0		a lot of guys who ever scanned some essays forget humans .
experiment=NPI-env=quantifier-npi=ever-crucial_item=a lot of-licensor=0-scope=0-npi_present=1	0		a lot of guys who scanned some essays ever forget humans .
experiment=NPI-env=quantifier-npi=ever-crucial_item=every-licensor=1-scope=1-npi_present=1	1		every pedestrian who has ever seen the guests respected actors .
experiment=NPI-env=quantifier-npi=ever-crucial_item=every-licensor=1-scope=1-npi_present=0	1		every pedestrian who has now seen the guests respected actors .
experiment=NPI-env=quantifier-npi=ever-crucial_item=-licensor=0-scope=0-npi_present=0	1		children who is at many libraries will now clean more than three gloves .
experiment=NPI-env=quantifier-npi=ever-crucial_item=any-licensor=1-scope=0-npi_present=0	1		any children who is at many libraries will now clean more than three gloves .
experiment=NPI-env=quantifier-npi=ever-crucial_item=the-licensor=0-scope=1-npi_present=1	0		the guest who ever knew more than three humans will insult some guests .
experiment=NPI-env=quantifier-npi=ever-crucial_item=the-licensor=0-scope=1-npi_present=0	1		the guest who once knew more than three humans will insult some guests .
experiment=NPI-env=quantifier-npi=ever-crucial_item=the-licensor=0-scope=0-npi_present=0	1		the guest who knew more than three humans will now insult some guests .
experiment=NPI-env=quantifier-npi=ever-crucial_item=the-licensor=0-scope=1-npi_present=0	1		the teacher who once criticized art galleries cleaned some reports .
experiment=NPI-env=quantifier-npi=ever-crucial_item=the-licensor=0-scope=0-npi_present=1	0		the teacher who criticized art galleries ever cleaned some reports .
experiment=NPI-env=quantifier-npi=ever-crucial_item=the-licensor=0-scope=0-npi_present=1	0		the waiter who explored many hospitals ever knew pedestrians .
experiment=NPI-env=quantifier-npi=ever-crucial_item=the-licensor=0-scope=0-npi_present=0	1		the waiter who explored many hospitals once knew pedestrians .
experiment=NPI-env=quantifier-npi=ever-crucial_item=every-licensor=1-scope=1-npi_present=1	1		every waiter who ever explored many hospitals knew pedestrians .
experiment=NPI-env=quantifier-npi=ever-crucial_item=the-licensor=0-scope=1-npi_present=1	0		the girl who ever referenced more than three waitresses should go to many malls .
experiment=NPI-env=quantifier-npi=ever-crucial_item=the-licensor=0-scope=1-npi_present=0	1		the girl who once referenced more than three waitresses should go to many malls .
experiment=NPI-env=quantifier-npi=ever-crucial_item=the-licensor=0-scope=0-npi_present=0	1		the girl who referenced more than three waitresses should now go to many malls .
experiment=NPI-env=quantifier-npi=ever-crucial_item=every-licensor=1-scope=1-npi_present=1	1		every girl who ever referenced more than three waitresses should go to many malls .
experiment=NPI-env=quantifier-npi=ever-crucial_item=every-licensor=1-scope=1-npi_present=0	1		every girl who once referenced more than three waitresses should go to many malls .
experiment=NPI-env=only-npi=ever-crucial_item=_-licensor=0-scope=1-npi_present=1	0		a customer had also ever lifted the plates .
experiment=NPI-env=only-npi=ever-crucial_item=_-licensor=0-scope=1-npi_present=0	1		a customer had also often lifted the plates .
experiment=NPI-env=only-npi=ever-crucial_item=_-licensor=0-scope=0-npi_present=1	0		a customer had ever also lifted the plates .
experiment=NPI-env=only-npi=ever-crucial_item=_-licensor=0-scope=0-npi_present=0	1		a customer had often also lifted the plates .
experiment=NPI-env=only-npi=ever-crucial_item=_-licensor=1-scope=1-npi_present=1	1		only the teenager had ever watched the teenagers .
experiment=NPI-env=only-npi=ever-crucial_item=_-licensor=1-scope=0-npi_present=0	1		the teenager had often watched only the teenagers .
experiment=NPI-env=only-npi=ever-crucial_item=_-licensor=0-scope=1-npi_present=0	1		the teenager had also often watched the teenagers .
experiment=NPI-env=only-npi=ever-crucial_item=_-licensor=0-scope=0-npi_present=1	0		the teenager had ever also watched the teenagers .
experiment=NPI-env=only-npi=ever-crucial_item=_-licensor=0-scope=0-npi_present=0	1		the teenager had often also watched the teenagers .
experiment=NPI-env=only-npi=ever-crucial_item=_-licensor=1-scope=0-npi_present=1	0		the patient might ever love only the children .
experiment=NPI-env=only-npi=ever-crucial_item=_-licensor=0-scope=1-npi_present=1	0		the patient might also ever love the children .
experiment=NPI-env=only-npi=ever-crucial_item=_-licensor=0-scope=1-npi_present=0	1		the patient might also sometimes love the children .
experiment=NPI-env=only-npi=ever-crucial_item=_-licensor=0-scope=0-npi_present=1	0		the patient might ever also love the children .
experiment=NPI-env=only-npi=ever-crucial_item=_-licensor=1-scope=1-npi_present=1	1		only the adult ever discusses the drivers .
experiment=NPI-env=only-npi=ever-crucial_item=_-licensor=1-scope=1-npi_present=0	1		only the adult sometimes discusses the drivers .
experiment=NPI-env=only-npi=ever-crucial_item=_-licensor=0-scope=1-npi_present=1	0		the adult also ever discusses the drivers .
experiment=NPI-env=only-npi=ever-crucial_item=_-licensor=0-scope=0-npi_present=1	0		the adult ever also discusses the drivers .
experiment=NPI-env=only-npi=ever-crucial_item=_-licensor=1-scope=0-npi_present=1	0		the student ever cleans only the plates .
experiment=NPI-env=only-npi=ever-crucial_item=_-licensor=1-scope=0-npi_present=0	1		the student sometimes cleans only the plates .
experiment=NPI-env=only-npi=ever-crucial_item=_-licensor=1-scope=1-npi_present=1	1		only the customer has ever forgotten the doctors .
experiment=NPI-env=only-npi=ever-crucial_item=_-licensor=0-scope=1-npi_present=1	0		the customer has also ever forgotten the doctors .
experiment=NPI-env=only-npi=ever-crucial_item=_-licensor=1-scope=1-npi_present=0	1		only a gal does always pass the college campuses .
experiment=NPI-env=only-npi=ever-crucial_item=_-licensor=1-scope=0-npi_present=1	0		a gal does ever pass only the college campuses .
experiment=NPI-env=only-npi=ever-crucial_item=_-licensor=1-scope=0-npi_present=0	1		a gal does always pass only the college campuses .
experiment=NPI-env=only-npi=ever-crucial_item=_-licensor=0-scope=1-npi_present=0	1		a gal does also always pass the college campuses .
experiment=NPI-env=only-npi=ever-crucial_item=_-licensor=0-scope=0-npi_present=1	0		a gal does ever also pass the college campuses .
experiment=NPI-env=only-npi=ever-crucial_item=_-licensor=1-scope=0-npi_present=0	1		the doctors sometimes been at only the college campuses .
experiment=NPI-env=only-npi=ever-crucial_item=_-licensor=0-scope=1-npi_present=1	0		the doctors also ever been at the college campuses .
experiment=NPI-env=only-npi=ever-crucial_item=_-licensor=0-scope=1-npi_present=0	1		the doctors also sometimes been at the college campuses .
experiment=NPI-env=only-npi=ever-crucial_item=_-licensor=0-scope=0-npi_present=0	1		the doctors sometimes also been at the college campuses .
experiment=NPI-env=only-npi=ever-crucial_item=_-licensor=1-scope=1-npi_present=1	1		only the people do ever examine the books .
experiment=NPI-env=only-npi=ever-crucial_item=_-licensor=1-scope=0-npi_present=0	1		the people do now examine only the books .
experiment=NPI-env=only-npi=ever-crucial_item=_-licensor=0-scope=1-npi_present=1	0		the people do also ever examine the books .
experiment=NPI-env=only-npi=ever-crucial_item=_-licensor=0-scope=0-npi_present=1	0		the people do ever also examine the books .
experiment=NPI-env=only-npi=ever-crucial_item=_-licensor=0-scope=0-npi_present=1	0		the pedestrian ever also remembers the grocery stores .
experiment=NPI-env=only-npi=ever-crucial_item=_-licensor=1-scope=1-npi_present=1	1		only the patients have ever hugged the teenagers .
experiment=NPI-env=only-npi=ever-crucial_item=_-licensor=1-scope=0-npi_present=1	0		the patients have ever hugged only the teenagers .
experiment=NPI-env=only-npi=ever-crucial_item=_-licensor=1-scope=0-npi_present=0	1		the patients have sometimes hugged only the teenagers .
experiment=NPI-env=only-npi=ever-crucial_item=_-licensor=1-scope=1-npi_present=1	1		only the girls have ever kissed the girls .
experiment=NPI-env=only-npi=ever-crucial_item=_-licensor=0-scope=0-npi_present=1	0		the waitresses have ever also observed the gals .
experiment=NPI-env=only-npi=ever-crucial_item=_-licensor=0-scope=1-npi_present=0	1		a girl also sometimes loves the gals .
experiment=NPI-env=only-npi=ever-crucial_item=_-licensor=0-scope=0-npi_present=1	0		the customer had ever also passed the schools .
experiment=NPI-env=only-npi=ever-crucial_item=_-licensor=0-scope=0-npi_present=0	1		the customer had often also passed the schools .
experiment=NPI-env=only-npi=ever-crucial_item=_-licensor=1-scope=1-npi_present=1	1		only a doctor had ever dropped by the restaurants .
experiment=NPI-env=only-npi=ever-crucial_item=_-licensor=1-scope=0-npi_present=1	0		a doctor had ever dropped by only the restaurants .
experiment=NPI-env=only-npi=ever-crucial_item=_-licensor=1-scope=0-npi_present=0	1		a doctor had often dropped by only the restaurants .
experiment=NPI-env=only-npi=ever-crucial_item=_-licensor=0-scope=1-npi_present=1	0		a doctor had also ever dropped by the restaurants .
experiment=NPI-env=only-npi=ever-crucial_item=_-licensor=0-scope=1-npi_present=0	1		a doctor had also often dropped by the restaurants .
experiment=NPI-env=only-npi=ever-crucial_item=_-licensor=0-scope=0-npi_present=0	1		a doctor had often also dropped by the restaurants .
experiment=NPI-env=only-npi=ever-crucial_item=_-licensor=0-scope=0-npi_present=1	0		the boy ever also talks about the college campuses .
experiment=NPI-env=only-npi=ever-crucial_item=_-licensor=1-scope=1-npi_present=1	1		only the actors ever loved the teachers .
experiment=NPI-env=only-npi=ever-crucial_item=_-licensor=1-scope=1-npi_present=0	1		only the actors often loved the teachers .
experiment=NPI-env=only-npi=ever-crucial_item=_-licensor=1-scope=0-npi_present=0	1		the actors often loved only the teachers .
experiment=NPI-env=only-npi=ever-crucial_item=_-licensor=0-scope=0-npi_present=0	1		the actors often also loved the teachers .
experiment=NPI-env=only-npi=ever-crucial_item=_-licensor=1-scope=0-npi_present=1	0		the girls had ever loved only the actresses .
experiment=NPI-env=only-npi=ever-crucial_item=_-licensor=1-scope=0-npi_present=0	1		the girls had always loved only the actresses .
experiment=NPI-env=only-npi=ever-crucial_item=_-licensor=0-scope=0-npi_present=1	0		the girls had ever also loved the actresses .
experiment=NPI-env=only-npi=ever-crucial_item=_-licensor=1-scope=0-npi_present=0	1		a woman had sometimes toured only the restaurants .
experiment=NPI-env=only-npi=ever-crucial_item=_-licensor=1-scope=0-npi_present=1	0		the adult ever drove to only the grocery stores .
experiment=NPI-env=only-npi=ever-crucial_item=_-licensor=0-scope=0-npi_present=0	1		the adult now also drove to the grocery stores .
experiment=NPI-env=only-npi=ever-crucial_item=_-licensor=1-scope=1-npi_present=1	1		only the cashiers could ever watch the waitresses .
experiment=NPI-env=only-npi=ever-crucial_item=_-licensor=0-scope=1-npi_present=1	0		the cashiers could also ever watch the waitresses .
experiment=NPI-env=only-npi=ever-crucial_item=_-licensor=1-scope=1-npi_present=1	1		only a guest could ever have the books .
experiment=NPI-env=only-npi=ever-crucial_item=_-licensor=0-scope=0-npi_present=1	0		a guest could ever also have the books .
experiment=NPI-env=only-npi=ever-crucial_item=_-licensor=1-scope=1-npi_present=1	1		only a man ever listened to the guys .
experiment=NPI-env=only-npi=ever-crucial_item=_-licensor=0-scope=0-npi_present=1	0		a man ever also listened to the guys .
experiment=NPI-env=only-npi=ever-crucial_item=_-licensor=1-scope=1-npi_present=0	1		only a guy sometimes describes the actors .
experiment=NPI-env=only-npi=ever-crucial_item=_-licensor=0-scope=0-npi_present=0	1		a guy sometimes also describes the actors .
experiment=NPI-env=only-npi=ever-crucial_item=_-licensor=1-scope=1-npi_present=1	1		only the humans might ever attack the teachers .
experiment=NPI-env=only-npi=ever-crucial_item=_-licensor=0-scope=0-npi_present=0	1		the humans might now also attack the teachers .
experiment=NPI-env=only-npi=ever-crucial_item=_-licensor=1-scope=0-npi_present=1	0		a person ever attacked only the people .
experiment=NPI-env=only-npi=ever-crucial_item=_-licensor=1-scope=1-npi_present=0	1		only the teenagers always discuss the museums .
experiment=NPI-env=only-npi=ever-crucial_item=_-licensor=1-scope=0-npi_present=0	1		the teenagers always discuss only the museums .
experiment=NPI-env=only-npi=ever-crucial_item=_-licensor=1-scope=1-npi_present=1	1		only the teacher ever escapes from the pedestrians .
experiment=NPI-env=only-npi=ever-crucial_item=_-licensor=1-scope=1-npi_present=0	1		only the teacher now escapes from the pedestrians .
experiment=NPI-env=only-npi=ever-crucial_item=_-licensor=1-scope=0-npi_present=0	1		the teacher now escapes from only the pedestrians .
experiment=NPI-env=only-npi=ever-crucial_item=_-licensor=0-scope=1-npi_present=0	1		the teacher also now escapes from the pedestrians .
experiment=NPI-env=only-npi=ever-crucial_item=_-licensor=0-scope=0-npi_present=0	1		the teacher now also escapes from the pedestrians .
experiment=NPI-env=only-npi=ever-crucial_item=_-licensor=1-scope=1-npi_present=1	1		only the boys do ever flee from the people .
experiment=NPI-env=only-npi=ever-crucial_item=_-licensor=1-scope=1-npi_present=0	1		only the boys do often flee from the people .
experiment=NPI-env=only-npi=ever-crucial_item=_-licensor=0-scope=0-npi_present=0	1		the boys do often also flee from the people .
experiment=NPI-env=only-npi=ever-crucial_item=_-licensor=1-scope=1-npi_present=1	1		only the people could ever drop by the libraries .
