experiment=NPI-env=quantifier-npi=any-crucial_item=some-licensor=0-scope=1-npi_present=1	0		some humans who have observed any people break many dishes .
experiment=NPI-env=quantifier-npi=any-crucial_item=some-licensor=0-scope=1-npi_present=0	1		some humans who have observed the people break many dishes .
experiment=NPI-env=quantifier-npi=any-crucial_item=any-licensor=1-scope=0-npi_present=1	0		any humans who have observed many people break any dishes .
experiment=NPI-env=quantifier-npi=any-crucial_item=-licensor=0-scope=0-npi_present=1	0		pedestrians who will help many guys had lifted any couches .
experiment=NPI-env=quantifier-npi=any-crucial_item=-licensor=0-scope=0-npi_present=0	1		pedestrians who will help many guys had lifted the couches .
experiment=NPI-env=quantifier-npi=any-crucial_item=all-licensor=1-scope=1-npi_present=0	1		all pedestrians who will help the guys had lifted many couches .
experiment=NPI-env=quantifier-npi=any-crucial_item=all-licensor=1-scope=0-npi_present=1	0		all pedestrians who will help many guys had lifted any couches .
experiment=NPI-env=quantifier-npi=any-crucial_item=all-licensor=1-scope=0-npi_present=0	1		all pedestrians who will help many guys had lifted the couches .
experiment=NPI-env=quantifier-npi=any-crucial_item=a lot of-licensor=0-scope=1-npi_present=0	1		a lot of teenagers who have talked to the waitresses resemble some reports .
experiment=NPI-env=quantifier-npi=any-crucial_item=a lot of-licensor=0-scope=0-npi_present=1	0		a lot of teenagers who have talked to waitresses resemble any reports .
experiment=NPI-env=quantifier-npi=any-crucial_item=all-licensor=1-scope=1-npi_present=1	1		all teenagers who have talked to any waitresses resemble some reports .
experiment=NPI-env=quantifier-npi=any-crucial_item=all-licensor=1-scope=0-npi_present=1	0		all teenagers who have talked to waitresses resemble any reports .
experiment=NPI-env=quantifier-npi=any-crucial_item=the-licensor=0-scope=1-npi_present=0	1		the adult who drives to the banks is leaving high schools .
experiment=NPI-env=quantifier-npi=any-crucial_item=the-licensor=0-scope=0-npi_present=0	1		the adult who drives to some banks is leaving the high schools .
experiment=NPI-env=quantifier-npi=any-crucial_item=every-licensor=1-scope=1-npi_present=1	1		every adult who drives to any banks is leaving high schools .
experiment=NPI-env=quantifier-npi=any-crucial_item=some-licensor=0-scope=0-npi_present=1	0		some man who are at many cafes breaks any couches .
experiment=NPI-env=quantifier-npi=any-crucial_item=every-licensor=1-scope=1-npi_present=0	1		every man who are at the cafes breaks couches .
experiment=NPI-env=quantifier-npi=any-crucial_item=every-licensor=1-scope=0-npi_present=0	1		every man who are at many cafes breaks the couches .
experiment=NPI-env=quantifier-npi=any-crucial_item=every-licensor=1-scope=1-npi_present=1	1		every driver who kissed any drivers referenced many children .
experiment=NPI-env=quantifier-npi=any-crucial_item=some-licensor=0-scope=1-npi_present=1	0		some guest who kisses any drivers was admiring girls .
experiment=NPI-env=quantifier-npi=any-crucial_item=some-licensor=0-scope=0-npi_present=1	0		some guest who kisses a lot of drivers was admiring any girls .
experiment=NPI-env=quantifier-npi=any-crucial_item=more than three-licensor=0-scope=0-npi_present=0	1		more than three ladies who dropped by the schools would criticize the teenagers .
experiment=NPI-env=quantifier-npi=any-crucial_item=any-licensor=1-scope=1-npi_present=1	1		any ladies who dropped by any schools would criticize a lot of teenagers .
experiment=NPI-env=quantifier-npi=any-crucial_item=any-licensor=1-scope=0-npi_present=1	0		any ladies who dropped by the schools would criticize any teenagers .
experiment=NPI-env=quantifier-npi=any-crucial_item=any-licensor=1-scope=0-npi_present=0	1		any ladies who dropped by the schools would criticize the teenagers .
experiment=NPI-env=quantifier-npi=any-crucial_item=-licensor=0-scope=0-npi_present=1	0		actors who fled from a lot of public parks will kiss any guys .
experiment=NPI-env=quantifier-npi=any-crucial_item=all-licensor=1-scope=1-npi_present=0	1		all actors who fled from the public parks will kiss some guys .
experiment=NPI-env=quantifier-npi=any-crucial_item=a-licensor=0-scope=1-npi_present=1	0		a boy who was fleeing from any adults was skated around more than three cafes .
experiment=NPI-env=quantifier-npi=any-crucial_item=every-licensor=1-scope=1-npi_present=0	1		every boy who was fleeing from the adults was skated around more than three cafes .
experiment=NPI-env=quantifier-npi=any-crucial_item=every-licensor=1-scope=0-npi_present=1	0		every boy who was fleeing from some adults was skated around any cafes .
experiment=NPI-env=quantifier-npi=any-crucial_item=every-licensor=1-scope=0-npi_present=0	1		every boy who was fleeing from some adults was skated around the cafes .
experiment=NPI-env=quantifier-npi=any-crucial_item=more than three-licensor=0-scope=0-npi_present=1	0		more than three pedestrians who criticize many girls boycotted any hospitals .
experiment=NPI-env=quantifier-npi=any-crucial_item=many-licensor=0-scope=1-npi_present=1	0		many pedestrians who dislike any grocery stores boycotted movie theaters .
experiment=NPI-env=quantifier-npi=any-crucial_item=many-licensor=0-scope=1-npi_present=0	1		many pedestrians who dislike the grocery stores boycotted movie theaters .
experiment=NPI-env=quantifier-npi=any-crucial_item=any-licensor=1-scope=0-npi_present=1	0		any ladies who discussed the students are investigating any libraries .
experiment=NPI-env=quantifier-npi=any-crucial_item=an-licensor=0-scope=1-npi_present=1	0		an actress who was walking through any schools had visited some grocery stores .
experiment=NPI-env=quantifier-npi=any-crucial_item=an-licensor=0-scope=1-npi_present=0	1		an actress who was walking through the schools had visited some grocery stores .
experiment=NPI-env=quantifier-npi=any-crucial_item=an-licensor=0-scope=0-npi_present=1	0		an actress who was walking through a lot of schools had visited any grocery stores .
experiment=NPI-env=quantifier-npi=any-crucial_item=an-licensor=0-scope=0-npi_present=0	1		an actress who was walking through a lot of schools had visited the grocery stores .
experiment=NPI-env=quantifier-npi=any-crucial_item=every-licensor=1-scope=1-npi_present=1	1		every actress who was walking through any schools had visited some grocery stores .
experiment=NPI-env=quantifier-npi=any-crucial_item=every-licensor=1-scope=1-npi_present=0	1		every actress who was walking through the schools had visited some grocery stores .
experiment=NPI-env=quantifier-npi=any-crucial_item=every-licensor=1-scope=0-npi_present=0	1		every actress who was walking through a lot of schools had visited the grocery stores .
experiment=NPI-env=quantifier-npi=any-crucial_item=the-licensor=0-scope=1-npi_present=1	0		the waitress who was fleeing from any grocery stores investigates customers .
experiment=NPI-env=quantifier-npi=any-crucial_item=the-licensor=0-scope=1-npi_present=0	1		the waitress who was fleeing from the grocery stores investigates customers .
experiment=NPI-env=quantifier-npi=any-crucial_item=the-licensor=0-scope=0-npi_present=1	0		the waitress who was fleeing from many grocery stores investigates any customers .
experiment=NPI-env=quantifier-npi=any-crucial_item=every-licensor=1-scope=0-npi_present=1	0		every waitress who was fleeing from many grocery stores investigates any customers .
experiment=NPI-env=quantifier-npi=any-crucial_item=the-licensor=0-scope=1-npi_present=1	0		the cashier who had skated around any high schools arrives at a lot of movie theaters .
experiment=NPI-env=quantifier-npi=any-crucial_item=the-licensor=0-scope=1-npi_present=0	1		the cashier who had skated around the high schools arrives at a lot of movie theaters .
experiment=NPI-env=quantifier-npi=any-crucial_item=the-licensor=0-scope=0-npi_present=0	1		the cashier who had skated around many high schools arrives at the movie theaters .
experiment=NPI-env=quantifier-npi=any-crucial_item=every-licensor=1-scope=0-npi_present=1	0		every cashier who had skated around many high schools arrives at any movie theaters .
experiment=NPI-env=quantifier-npi=any-crucial_item=any-licensor=1-scope=1-npi_present=1	1		any people who tour any grocery stores walk through some libraries .
experiment=NPI-env=quantifier-npi=any-crucial_item=any-licensor=1-scope=0-npi_present=1	0		any people who tour many grocery stores walk through any libraries .
experiment=NPI-env=quantifier-npi=any-crucial_item=any-licensor=1-scope=0-npi_present=0	1		any people who tour many grocery stores walk through the libraries .
experiment=NPI-env=quantifier-npi=any-crucial_item=the-licensor=0-scope=1-npi_present=1	0		the pedestrians who did lift any reports had dropped by more than three libraries .
experiment=NPI-env=quantifier-npi=any-crucial_item=any-licensor=1-scope=0-npi_present=0	1		any pedestrians who did lift a lot of reports had dropped by the libraries .
experiment=NPI-env=quantifier-npi=any-crucial_item=the-licensor=0-scope=0-npi_present=1	0		the waitress who had brought a lot of shoes is escaping from any hospitals .
experiment=NPI-env=quantifier-npi=any-crucial_item=every-licensor=1-scope=1-npi_present=1	1		every waitress who had brought any shoes is escaping from a lot of hospitals .
experiment=NPI-env=quantifier-npi=any-crucial_item=more than three-licensor=0-scope=1-npi_present=1	0		more than three waiters who can observe any cashiers could see books .
experiment=NPI-env=quantifier-npi=any-crucial_item=more than three-licensor=0-scope=1-npi_present=0	1		more than three waiters who can observe the cashiers could see books .
experiment=NPI-env=quantifier-npi=any-crucial_item=more than three-licensor=0-scope=0-npi_present=0	1		more than three waiters who can observe a lot of cashiers could see the books .
experiment=NPI-env=quantifier-npi=any-crucial_item=any-licensor=1-scope=1-npi_present=1	1		any waiters who can observe any cashiers could see books .
experiment=NPI-env=quantifier-npi=any-crucial_item=some-licensor=0-scope=0-npi_present=0	1		some teacher who was cleaning more than three cups did explore the libraries .
experiment=NPI-env=quantifier-npi=any-crucial_item=every-licensor=1-scope=0-npi_present=1	0		every teacher who was cleaning more than three cups did explore any libraries .
experiment=NPI-env=quantifier-npi=any-crucial_item=every-licensor=1-scope=0-npi_present=1	0		every boy who has hugged gals remembered any guys .
experiment=NPI-env=quantifier-npi=any-crucial_item=every-licensor=1-scope=0-npi_present=0	1		every boy who has hugged gals remembered the guys .
experiment=NPI-env=quantifier-npi=any-crucial_item=all-licensor=1-scope=1-npi_present=1	1		all teachers who are leaving any banks return to many students .
experiment=NPI-env=quantifier-npi=any-crucial_item=a-licensor=0-scope=1-npi_present=0	1		a guy who lifted the forks might admire the customers .
experiment=NPI-env=quantifier-npi=any-crucial_item=a-licensor=0-scope=0-npi_present=1	0		a guy who lifted forks might admire any customers .
experiment=NPI-env=quantifier-npi=any-crucial_item=every-licensor=1-scope=0-npi_present=1	0		every guy who lifted forks might admire any customers .
experiment=NPI-env=quantifier-npi=any-crucial_item=more than three-licensor=0-scope=1-npi_present=0	1		more than three children who had talked about the stories had talked to a lot of cashiers .
experiment=NPI-env=quantifier-npi=any-crucial_item=all-licensor=1-scope=1-npi_present=0	1		all children who had talked about the stories had talked to a lot of cashiers .
experiment=NPI-env=quantifier-npi=any-crucial_item=all-licensor=1-scope=0-npi_present=1	0		all children who had talked about many stories had talked to any cashiers .
experiment=NPI-env=quantifier-npi=any-crucial_item=some-licensor=0-scope=1-npi_present=0	1		some actor who did forget the newspaper articles had left hospitals .
experiment=NPI-env=quantifier-npi=any-crucial_item=some-licensor=0-scope=0-npi_present=1	0		some actor who did forget more than three newspaper articles had left any hospitals .
experiment=NPI-env=quantifier-npi=any-crucial_item=some-licensor=0-scope=0-npi_present=0	1		some actor who did forget more than three newspaper articles had left the hospitals .
experiment=NPI-env=quantifier-npi=any-crucial_item=every-licensor=1-scope=1-npi_present=1	1		every actor who did forget any newspaper articles had left hospitals .
experiment=NPI-env=quantifier-npi=any-crucial_item=every-licensor=1-scope=0-npi_present=1	0		every actor who did forget more than three newspaper articles had left any hospitals .
experiment=NPI-env=quantifier-npi=any-crucial_item=-licensor=0-scope=1-npi_present=0	1		actresses who bike to the art galleries could tour a lot of cafes .
experiment=NPI-env=quantifier-npi=any-crucial_item=many-licensor=0-scope=1-npi_present=1	0		many teachers who had known any pedestrians have escaped from some teenagers .
experiment=NPI-env=quantifier-npi=any-crucial_item=many-licensor=0-scope=0-npi_present=1	0		many teachers who had known a lot of pedestrians have escaped from any teenagers .
experiment=NPI-env=quantifier-npi=any-crucial_item=many-licensor=0-scope=0-npi_present=0	1		many teachers who had known a lot of pedestrians have escaped from the teenagers .
experiment=NPI-env=quantifier-npi=any-crucial_item=any-licensor=1-scope=1-npi_present=1	1		any teachers who had known any pedestrians have escaped from some teenagers .
experiment=NPI-env=quantifier-npi=any-crucial_item=any-licensor=1-scope=1-npi_present=0	1		any teachers who had known the pedestrians have escaped from some teenagers .
experiment=NPI-env=quantifier-npi=any-crucial_item=any-licensor=1-scope=0-npi_present=0	1		any teachers who had known a lot of pedestrians have escaped from the teenagers .
experiment=NPI-env=quantifier-npi=any-crucial_item=every-licensor=1-scope=0-npi_present=0	1		every patient who has approached guests insulted the patients .
experiment=NPI-env=quantifier-npi=any-crucial_item=every-licensor=1-scope=0-npi_present=0	1		every pedestrian who was admiring a lot of girls will listen to the doctors .
experiment=NPI-env=quantifier-npi=any-crucial_item=some-licensor=0-scope=0-npi_present=1	0		some ladies who would listen to more than three humans praised any drivers .
experiment=NPI-env=quantifier-npi=any-crucial_item=all-licensor=1-scope=1-npi_present=0	1		all ladies who would listen to the humans praised a lot of drivers .
experiment=NPI-env=quantifier-npi=any-crucial_item=all-licensor=1-scope=0-npi_present=1	0		all ladies who would listen to more than three humans praised any drivers .
experiment=NPI-env=quantifier-npi=any-crucial_item=every-licensor=1-scope=0-npi_present=0	1		every driver who can respect many pedestrians was kissing the actors .
experiment=NPI-env=quantifier-npi=any-crucial_item=a lot of-licensor=0-scope=0-npi_present=0	1		a lot of guys who might describe some art galleries would clean the cars .
experiment=NPI-env=quantifier-npi=any-crucial_item=all-licensor=1-scope=1-npi_present=1	1		all guys who might describe any art galleries would clean some cars .
experiment=NPI-env=quantifier-npi=any-crucial_item=all-licensor=1-scope=0-npi_present=1	0		all guys who might describe some art galleries would clean any cars .
experiment=NPI-env=quantifier-npi=any-crucial_item=-licensor=0-scope=1-npi_present=0	1		teachers who knew the waiters were dropping by more than three art galleries .
experiment=NPI-env=quantifier-npi=any-crucial_item=any-licensor=1-scope=1-npi_present=0	1		any teachers who knew the waiters were dropping by more than three art galleries .
experiment=NPI-env=quantifier-npi=any-crucial_item=any-licensor=1-scope=0-npi_present=1	0		any teachers who knew more than three waiters were dropping by any art galleries .
experiment=NPI-env=quantifier-npi=any-crucial_item=a-licensor=0-scope=1-npi_present=1	0		a lady who has known any men should describe the girls .
experiment=NPI-env=quantifier-npi=any-crucial_item=a-licensor=0-scope=1-npi_present=0	1		a lady who has known the men should describe the girls .
experiment=NPI-env=quantifier-npi=any-crucial_item=every-licensor=1-scope=1-npi_present=1	1		every lady who has known any men should describe the girls .
experiment=NPI-env=quantifier-npi=any-crucial_item=every-licensor=1-scope=1-npi_present=0	1		every lady who has known the men should describe the girls .
experiment=NPI-env=quantifier-npi=any-crucial_item=every-licensor=1-scope=0-npi_present=0	1		every lady who has known more than three men should describe the girls .
experiment=NPI-env=quantifier-npi=any-crucial_item=the-licensor=0-scope=1-npi_present=1	0		the gal who has kissed any ladies was wearing a lot of pants .
experiment=NPI-env=quantifier-npi=any-crucial_item=the-licensor=0-scope=0-npi_present=0	1		the gal who has kissed some ladies was wearing the pants .
experiment=NPI-env=quantifier-npi=any-crucial_item=every-licensor=1-scope=1-npi_present=1	1		every gal who has kissed any ladies was wearing a lot of pants .
experiment=NPI-env=quantifier-npi=any-crucial_item=every-licensor=1-scope=0-npi_present=1	0		every gal who has kissed some ladies was wearing any pants .
experiment=NPI-env=quantifier-npi=any-crucial_item=a-licensor=0-scope=1-npi_present=0	1		a lady who fled from the hospitals will describe some drivers .
experiment=NPI-env=quantifier-npi=any-crucial_item=a-licensor=0-scope=0-npi_present=0	1		a lady who fled from some hospitals will describe the drivers .
experiment=NPI-env=quantifier-npi=any-crucial_item=every-licensor=1-scope=1-npi_present=1	1		every lady who fled from any hospitals will describe some drivers .
experiment=NPI-env=quantifier-npi=any-crucial_item=every-licensor=1-scope=1-npi_present=0	1		every lady who fled from the hospitals will describe some drivers .
experiment=NPI-env=quantifier-npi=any-crucial_item=every-licensor=1-scope=0-npi_present=0	1		every lady who fled from some hospitals will describe the drivers .
experiment=NPI-env=quantifier-npi=any-crucial_item=some-licensor=0-scope=1-npi_present=0	1		some adults who had explored the grocery stores had worn glasses .
experiment=NPI-env=quantifier-npi=any-crucial_item=some-licensor=0-scope=0-npi_present=1	0		some adults who had explored more than three grocery stores had worn any glasses .
experiment=NPI-env=quantifier-npi=any-crucial_item=all-licensor=1-scope=1-npi_present=1	1		all adults who had explored any grocery stores had worn glasses .
experiment=NPI-env=quantifier-npi=any-crucial_item=all-licensor=1-scope=1-npi_present=0	1		all adults who had explored the grocery stores had worn glasses .
experiment=NPI-env=quantifier-npi=any-crucial_item=the-licensor=0-scope=1-npi_present=0	1		the person who goes to the cafes does hate many adults .
experiment=NPI-env=quantifier-npi=any-crucial_item=every-licensor=1-scope=0-npi_present=0	1		every person who goes to cafes does hate the adults .
experiment=NPI-env=quantifier-npi=any-crucial_item=the-licensor=0-scope=1-npi_present=0	1		the people who are dropping by the schools approached patients .
experiment=NPI-env=quantifier-npi=any-crucial_item=all-licensor=1-scope=0-npi_present=0	1		all people who are dropping by schools approached the patients .
experiment=NPI-env=quantifier-npi=any-crucial_item=-licensor=0-scope=1-npi_present=1	0		guests who approach any women are exploring the schools .
experiment=NPI-env=quantifier-npi=any-crucial_item=-licensor=0-scope=1-npi_present=0	1		guests who approach the women are exploring the schools .
experiment=NPI-env=quantifier-npi=any-crucial_item=-licensor=0-scope=0-npi_present=1	0		guests who approach some women are exploring any schools .
experiment=NPI-env=quantifier-npi=any-crucial_item=all-licensor=1-scope=1-npi_present=1	1		all guests who approach any women are exploring the schools .
experiment=NPI-env=quantifier-npi=any-crucial_item=some-licensor=0-scope=1-npi_present=0	1		some lady who goes to the schools might remember plays .
experiment=NPI-env=quantifier-npi=any-crucial_item=some-licensor=0-scope=0-npi_present=1	0		some lady who goes to more than three schools might remember any plays .
experiment=NPI-env=quantifier-npi=any-crucial_item=every-licensor=1-scope=1-npi_present=0	1		every lady who goes to the schools might remember plays .
experiment=NPI-env=quantifier-npi=any-crucial_item=every-licensor=1-scope=0-npi_present=1	0		every lady who goes to more than three schools might remember any plays .
experiment=NPI-env=quantifier-npi=any-crucial_item=every-licensor=1-scope=0-npi_present=0	1		every lady who goes to more than three schools might remember the plays .
experiment=NPI-env=quantifier-npi=any-crucial_item=an-licensor=0-scope=1-npi_present=1	0		an actress who had discussed any customers bought many newspaper articles .
experiment=NPI-env=quantifier-npi=any-crucial_item=an-licensor=0-scope=1-npi_present=0	1		an actress who had discussed the customers bought many newspaper articles .
experiment=NPI-env=quantifier-npi=any-crucial_item=an-licensor=0-scope=0-npi_present=1	0		an actress who had discussed some customers bought any newspaper articles .
experiment=NPI-env=quantifier-npi=any-crucial_item=every-licensor=1-scope=1-npi_present=1	1		every actress who had discussed any customers bought many newspaper articles .
experiment=NPI-env=quantifier-npi=any-crucial_item=the-licensor=0-scope=1-npi_present=1	0		the waiter who had approached any adults is investigating many restaurants .
experiment=NPI-env=quantifier-npi=any-crucial_item=the-licensor=0-scope=1-npi_present=0	1		the waiter who had approached the adults is investigating many restaurants .
experiment=NPI-env=quantifier-npi=any-crucial_item=every-licensor=1-scope=1-npi_present=0	1		every waiter who had approached the adults is investigating many restaurants .
experiment=NPI-env=quantifier-npi=any-crucial_item=every-licensor=1-scope=0-npi_present=0	1		every waiter who had approached many adults is investigating the restaurants .
experiment=NPI-env=quantifier-npi=any-crucial_item=a-licensor=0-scope=1-npi_present=1	0		a human who had been at any hospitals was selling the couches .
experiment=NPI-env=quantifier-npi=any-crucial_item=every-licensor=1-scope=0-npi_present=1	0		every human who had been at hospitals was selling any couches .
experiment=NPI-env=quantifier-npi=any-crucial_item=a-licensor=0-scope=0-npi_present=1	0		a guy who will see some reports broke any chairs .
experiment=NPI-env=quantifier-npi=any-crucial_item=every-licensor=1-scope=0-npi_present=1	0		every guy who will see some reports broke any chairs .
experiment=NPI-env=quantifier-npi=any-crucial_item=a-licensor=0-scope=0-npi_present=1	0		a child who did escape from museums has remembered any banks .
experiment=NPI-env=quantifier-npi=any-crucial_item=every-licensor=1-scope=0-npi_present=1	0		every child who did escape from museums has remembered any banks .
experiment=NPI-env=quantifier-npi=any-crucial_item=some-licensor=0-scope=1-npi_present=1	0		some waitress who ran around any art galleries is hugging the boys .
experiment=NPI-env=quantifier-npi=any-crucial_item=some-licensor=0-scope=0-npi_present=0	1		some waitress who ran around art galleries is hugging the boys .
experiment=NPI-env=quantifier-npi=any-crucial_item=some-licensor=0-scope=0-npi_present=1	0		some customers who had hated the documentaries could visit any drivers .
experiment=NPI-env=quantifier-npi=any-crucial_item=any-licensor=1-scope=0-npi_present=1	0		any customers who had hated the documentaries could visit any drivers .
experiment=NPI-env=quantifier-npi=any-crucial_item=any-licensor=1-scope=0-npi_present=0	1		any customers who had hated the documentaries could visit the drivers .
experiment=NPI-env=quantifier-npi=any-crucial_item=a lot of-licensor=0-scope=1-npi_present=0	1		a lot of girls who dropped by the banks discuss the gals .
experiment=NPI-env=quantifier-npi=any-crucial_item=a lot of-licensor=0-scope=0-npi_present=0	1		a lot of girls who dropped by banks discuss the gals .
experiment=NPI-env=quantifier-npi=any-crucial_item=all-licensor=1-scope=1-npi_present=1	1		all girls who dropped by any banks discuss the gals .
experiment=NPI-env=quantifier-npi=any-crucial_item=all-licensor=1-scope=0-npi_present=0	1		all girls who dropped by banks discuss the gals .
experiment=NPI-env=quantifier-npi=any-crucial_item=some-licensor=0-scope=1-npi_present=1	0		some patient who should leave any girls bought the shoes .
experiment=NPI-env=quantifier-npi=any-crucial_item=every-licensor=1-scope=0-npi_present=0	1		every patient who should leave girls bought the shoes .
experiment=NPI-env=quantifier-npi=any-crucial_item=some-licensor=0-scope=0-npi_present=0	1		some guest who watches cashiers listens to the humans .
experiment=NPI-env=quantifier-npi=any-crucial_item=every-licensor=1-scope=1-npi_present=0	1		every guest who watches the cashiers listens to humans .
experiment=NPI-env=quantifier-npi=any-crucial_item=every-licensor=1-scope=0-npi_present=1	0		every guest who watches cashiers listens to any humans .
experiment=NPI-env=quantifier-npi=any-crucial_item=the-licensor=0-scope=0-npi_present=1	0		the guys who will remember a lot of movies did bike to any grocery stores .
experiment=NPI-env=quantifier-npi=any-crucial_item=all-licensor=1-scope=0-npi_present=0	1		all guys who will remember a lot of movies did bike to the grocery stores .
experiment=NPI-env=quantifier-npi=any-crucial_item=every-licensor=1-scope=1-npi_present=1	1		every doctor who works with any waitresses might flee from more than three actresses .
experiment=NPI-env=quantifier-npi=any-crucial_item=some-licensor=0-scope=1-npi_present=0	1		some adult who had been at the grocery stores should watch many men .
experiment=NPI-env=quantifier-npi=any-crucial_item=some-licensor=0-scope=0-npi_present=1	0		some adult who had been at a lot of grocery stores should watch any men .
