experiment=NPI-env=adverbs-npi=ever-crucial_item=always-licensor=0-scope=0-npi_present=1	0		the doctors always say that a boy had ever yelled .
experiment=NPI-env=adverbs-npi=ever-crucial_item=seldom-licensor=1-scope=1-npi_present=0	1		the doctors seldom also say that a boy had yelled .
experiment=NPI-env=adverbs-npi=ever-crucial_item=seldom-licensor=1-scope=0-npi_present=1	0		the doctors seldom say that a boy had ever yelled .
experiment=NPI-env=adverbs-npi=ever-crucial_item=sometimes-licensor=0-scope=1-npi_present=0	1		a pedestrian sometimes also explains that a boy should shrug .
experiment=NPI-env=adverbs-npi=ever-crucial_item=sometimes-licensor=0-scope=0-npi_present=0	1		a pedestrian sometimes explains that a boy should also shrug .
experiment=NPI-env=adverbs-npi=ever-crucial_item=scarcely-licensor=1-scope=1-npi_present=1	1		a pedestrian scarcely ever explains that a boy should shrug .
experiment=NPI-env=adverbs-npi=ever-crucial_item=barely-licensor=1-scope=1-npi_present=0	1		the boy barely also thought that the guys pass the cafes .
experiment=NPI-env=adverbs-npi=ever-crucial_item=barely-licensor=1-scope=0-npi_present=1	0		the boy barely thought that the guys ever pass the cafes .
experiment=NPI-env=adverbs-npi=ever-crucial_item=barely-licensor=1-scope=0-npi_present=0	1		the boy barely thought that the guys also pass the cafes .
experiment=NPI-env=adverbs-npi=ever-crucial_item=always-licensor=0-scope=1-npi_present=0	1		the cashiers always also thought that the students had boasted .
experiment=NPI-env=adverbs-npi=ever-crucial_item=always-licensor=0-scope=0-npi_present=0	1		the cashiers always thought that the students had also boasted .
experiment=NPI-env=adverbs-npi=ever-crucial_item=hardly-licensor=1-scope=1-npi_present=0	1		the cashiers hardly also thought that the students had boasted .
experiment=NPI-env=adverbs-npi=ever-crucial_item=hardly-licensor=1-scope=0-npi_present=1	0		the cashiers hardly thought that the students had ever boasted .
experiment=NPI-env=adverbs-npi=ever-crucial_item=hardly-licensor=1-scope=0-npi_present=0	1		the cashiers hardly thought that the students had also boasted .
experiment=NPI-env=adverbs-npi=ever-crucial_item=sometimes-licensor=0-scope=0-npi_present=1	0		the student sometimes says that the child ever spins around .
experiment=NPI-env=adverbs-npi=ever-crucial_item=rarely-licensor=1-scope=1-npi_present=1	1		the student rarely ever says that the child spins around .
experiment=NPI-env=adverbs-npi=ever-crucial_item=rarely-licensor=1-scope=1-npi_present=0	1		the student rarely also says that the child spins around .
experiment=NPI-env=adverbs-npi=ever-crucial_item=rarely-licensor=1-scope=0-npi_present=1	0		the student rarely says that the child ever spins around .
experiment=NPI-env=adverbs-npi=ever-crucial_item=often-licensor=0-scope=0-npi_present=1	0		a patient often imagines that a boy ever talks about the art galleries .
experiment=NPI-env=adverbs-npi=ever-crucial_item=often-licensor=0-scope=0-npi_present=0	1		a patient often imagines that a boy also talks about the art galleries .
experiment=NPI-env=adverbs-npi=ever-crucial_item=rarely-licensor=1-scope=1-npi_present=0	1		a patient rarely also imagines that a boy talks about the art galleries .
experiment=NPI-env=adverbs-npi=ever-crucial_item=rarely-licensor=1-scope=0-npi_present=0	1		a patient rarely imagines that a boy also talks about the art galleries .
experiment=NPI-env=adverbs-npi=ever-crucial_item=sometimes-licensor=0-scope=1-npi_present=1	0		an actress sometimes ever thinks that the woman slumped over .
experiment=NPI-env=adverbs-npi=ever-crucial_item=barely-licensor=1-scope=0-npi_present=0	1		an actress barely thinks that the woman also slumped over .
experiment=NPI-env=adverbs-npi=ever-crucial_item=barely-licensor=1-scope=1-npi_present=1	1		a customer barely ever said that a patient chuckled .
experiment=NPI-env=adverbs-npi=ever-crucial_item=barely-licensor=1-scope=1-npi_present=0	1		a customer barely also said that a patient chuckled .
experiment=NPI-env=adverbs-npi=ever-crucial_item=barely-licensor=1-scope=0-npi_present=1	0		a customer barely said that a patient ever chuckled .
experiment=NPI-env=adverbs-npi=ever-crucial_item=seldom-licensor=1-scope=0-npi_present=0	1		the actresses seldom explain that the students also took the glass .
experiment=NPI-env=adverbs-npi=ever-crucial_item=hardly-licensor=1-scope=0-npi_present=1	0		a human hardly explained that a boy ever exited the banks .
experiment=NPI-env=adverbs-npi=ever-crucial_item=always-licensor=0-scope=0-npi_present=1	0		the children always explain that the teenager ever wept .
experiment=NPI-env=adverbs-npi=ever-crucial_item=often-licensor=0-scope=1-npi_present=1	0		the actor often ever explained that a man would speak up .
experiment=NPI-env=adverbs-npi=ever-crucial_item=scarcely-licensor=1-scope=1-npi_present=1	1		the actor scarcely ever explained that a man would speak up .
experiment=NPI-env=adverbs-npi=ever-crucial_item=sometimes-licensor=0-scope=1-npi_present=1	0		the boy sometimes ever explained that a boy might walk through the schools .
experiment=NPI-env=adverbs-npi=ever-crucial_item=rarely-licensor=1-scope=1-npi_present=1	1		the boy rarely ever explained that a boy might walk through the schools .
experiment=NPI-env=adverbs-npi=ever-crucial_item=always-licensor=0-scope=0-npi_present=0	1		a driver always said that the actresses also succeed .
experiment=NPI-env=adverbs-npi=ever-crucial_item=scarcely-licensor=1-scope=1-npi_present=0	1		a driver scarcely also said that the actresses succeed .
experiment=NPI-env=adverbs-npi=ever-crucial_item=scarcely-licensor=1-scope=0-npi_present=1	0		a driver scarcely said that the actresses ever succeed .
experiment=NPI-env=adverbs-npi=ever-crucial_item=rarely-licensor=1-scope=0-npi_present=0	1		the drivers rarely think that the men had also conspired .
experiment=NPI-env=adverbs-npi=ever-crucial_item=always-licensor=0-scope=1-npi_present=0	1		the actor always also explains that the man goes fishing .
experiment=NPI-env=adverbs-npi=ever-crucial_item=seldom-licensor=1-scope=0-npi_present=1	0		the actor seldom explains that the man ever goes fishing .
experiment=NPI-env=adverbs-npi=ever-crucial_item=scarcely-licensor=1-scope=1-npi_present=1	1		the patients scarcely ever imagine that the patients fight .
experiment=NPI-env=adverbs-npi=ever-crucial_item=scarcely-licensor=1-scope=0-npi_present=1	0		the patients scarcely imagine that the patients ever fight .
experiment=NPI-env=adverbs-npi=any-crucial_item=rarely-licensor=1-scope=1-npi_present=1	1		the women who had rarely loved any commentaries drop by college campuses .
experiment=NPI-env=adverbs-npi=any-crucial_item=rarely-licensor=1-scope=0-npi_present=0	1		the women who had rarely loved commentaries drop by the college campuses .
experiment=NPI-env=adverbs-npi=any-crucial_item=always-licensor=0-scope=1-npi_present=1	0		the student who has always ran around any grocery stores has brought glasses .
experiment=NPI-env=adverbs-npi=any-crucial_item=always-licensor=0-scope=1-npi_present=0	1		the student who has always ran around the grocery stores has brought glasses .
experiment=NPI-env=adverbs-npi=any-crucial_item=often-licensor=0-scope=1-npi_present=1	0		the actresses who often went to any grocery stores watch boys .
experiment=NPI-env=adverbs-npi=any-crucial_item=often-licensor=0-scope=1-npi_present=0	1		the actresses who often went to the grocery stores watch boys .
experiment=NPI-env=adverbs-npi=any-crucial_item=often-licensor=0-scope=0-npi_present=0	1		the actresses who often went to grocery stores watch the boys .
experiment=NPI-env=adverbs-npi=any-crucial_item=rarely-licensor=1-scope=0-npi_present=1	0		the actresses who rarely went to grocery stores watch any boys .
experiment=NPI-env=adverbs-npi=any-crucial_item=often-licensor=0-scope=1-npi_present=0	1		the waiters who often drop by the museums have criticized fish .
experiment=NPI-env=adverbs-npi=any-crucial_item=scarcely-licensor=1-scope=1-npi_present=1	1		the waiters who scarcely drop by any museums have criticized fish .
experiment=NPI-env=adverbs-npi=any-crucial_item=sometimes-licensor=0-scope=1-npi_present=0	1		the actress who sometimes leaves the college campuses has examined brochures .
experiment=NPI-env=adverbs-npi=any-crucial_item=sometimes-licensor=0-scope=0-npi_present=1	0		the actress who sometimes leaves college campuses has examined any brochures .
experiment=NPI-env=adverbs-npi=any-crucial_item=scarcely-licensor=1-scope=1-npi_present=0	1		the actress who scarcely leaves the college campuses has examined brochures .
experiment=NPI-env=adverbs-npi=any-crucial_item=scarcely-licensor=1-scope=0-npi_present=1	0		the actress who scarcely leaves college campuses has examined any brochures .
experiment=NPI-env=adverbs-npi=any-crucial_item=sometimes-licensor=0-scope=0-npi_present=1	0		the cashier who has sometimes attacked people has skated around any grocery stores .
experiment=NPI-env=adverbs-npi=any-crucial_item=sometimes-licensor=0-scope=0-npi_present=0	1		the cashier who has sometimes attacked people has skated around the grocery stores .
experiment=NPI-env=adverbs-npi=any-crucial_item=seldom-licensor=1-scope=1-npi_present=1	1		the cashier who has seldom attacked any people has skated around grocery stores .
experiment=NPI-env=adverbs-npi=any-crucial_item=seldom-licensor=1-scope=1-npi_present=0	1		the cashier who has seldom attacked the people has skated around grocery stores .
experiment=NPI-env=adverbs-npi=any-crucial_item=sometimes-licensor=0-scope=0-npi_present=0	1		the boys who had sometimes arrived at college campuses praised the children .
experiment=NPI-env=adverbs-npi=any-crucial_item=rarely-licensor=1-scope=1-npi_present=0	1		the boys who had rarely arrived at the college campuses praised children .
experiment=NPI-env=adverbs-npi=any-crucial_item=rarely-licensor=1-scope=0-npi_present=1	0		the boys who had rarely arrived at college campuses praised any children .
experiment=NPI-env=adverbs-npi=any-crucial_item=always-licensor=0-scope=1-npi_present=0	1		the actresses who always walked through the museums insult documentaries .
experiment=NPI-env=adverbs-npi=any-crucial_item=always-licensor=0-scope=0-npi_present=1	0		the actresses who always walked through museums insult any documentaries .
experiment=NPI-env=adverbs-npi=any-crucial_item=rarely-licensor=1-scope=1-npi_present=1	1		the actresses who rarely walked through any museums insult documentaries .
experiment=NPI-env=adverbs-npi=any-crucial_item=sometimes-licensor=0-scope=1-npi_present=1	0		the child who sometimes wore any shoes knew teachers .
experiment=NPI-env=adverbs-npi=any-crucial_item=barely-licensor=1-scope=0-npi_present=1	0		the child who barely wore shoes knew any teachers .
experiment=NPI-env=adverbs-npi=any-crucial_item=always-licensor=0-scope=1-npi_present=1	0		the ladies who can always see any cups could insult girls .
experiment=NPI-env=adverbs-npi=any-crucial_item=hardly-licensor=1-scope=0-npi_present=1	0		the ladies who can hardly see cups could insult any girls .
experiment=NPI-env=adverbs-npi=any-crucial_item=hardly-licensor=1-scope=1-npi_present=0	1		a lady who hardly criticizes the libraries skates around museums .
experiment=NPI-env=adverbs-npi=any-crucial_item=hardly-licensor=1-scope=0-npi_present=1	0		a lady who hardly criticizes libraries skates around any museums .
experiment=NPI-env=adverbs-npi=any-crucial_item=hardly-licensor=1-scope=0-npi_present=0	1		a lady who hardly criticizes libraries skates around the museums .
experiment=NPI-env=adverbs-npi=any-crucial_item=often-licensor=0-scope=1-npi_present=1	0		the gals who would often attack any girls have approached alumni .
experiment=NPI-env=adverbs-npi=any-crucial_item=often-licensor=0-scope=0-npi_present=1	0		the gals who would often attack girls have approached any alumni .
experiment=NPI-env=adverbs-npi=any-crucial_item=often-licensor=0-scope=0-npi_present=0	1		the gals who would often attack girls have approached the alumni .
experiment=NPI-env=adverbs-npi=any-crucial_item=hardly-licensor=1-scope=1-npi_present=1	1		the gals who would hardly attack any girls have approached alumni .
experiment=NPI-env=adverbs-npi=any-crucial_item=always-licensor=0-scope=1-npi_present=1	0		the man who could always clean any glasses could go to movie theaters .
experiment=NPI-env=adverbs-npi=any-crucial_item=always-licensor=0-scope=1-npi_present=0	1		the man who could always clean the glasses could go to movie theaters .
experiment=NPI-env=adverbs-npi=any-crucial_item=always-licensor=0-scope=0-npi_present=1	0		the man who could always clean glasses could go to any movie theaters .
experiment=NPI-env=adverbs-npi=any-crucial_item=barely-licensor=1-scope=0-npi_present=1	0		the man who could barely clean glasses could go to any movie theaters .
experiment=NPI-env=adverbs-npi=any-crucial_item=barely-licensor=1-scope=0-npi_present=0	1		the man who could barely clean glasses could go to the movie theaters .
experiment=NPI-env=adverbs-npi=any-crucial_item=sometimes-licensor=0-scope=1-npi_present=0	1		a guy who sometimes buys the brochures had left children .
experiment=NPI-env=adverbs-npi=any-crucial_item=sometimes-licensor=0-scope=0-npi_present=1	0		a guy who sometimes buys brochures had left any children .
experiment=NPI-env=adverbs-npi=any-crucial_item=scarcely-licensor=1-scope=1-npi_present=1	1		a guy who scarcely buys any brochures had left children .
experiment=NPI-env=adverbs-npi=any-crucial_item=scarcely-licensor=1-scope=0-npi_present=1	0		a guy who scarcely buys brochures had left any children .
experiment=NPI-env=adverbs-npi=any-crucial_item=scarcely-licensor=1-scope=0-npi_present=0	1		a guy who scarcely buys brochures had left the children .
experiment=NPI-env=adverbs-npi=any-crucial_item=seldom-licensor=1-scope=1-npi_present=0	1		the doctor who had seldom loved the ladies would skate around high schools .
experiment=NPI-env=adverbs-npi=any-crucial_item=seldom-licensor=1-scope=0-npi_present=0	1		the doctor who had seldom loved ladies would skate around the high schools .
experiment=NPI-env=adverbs-npi=any-crucial_item=always-licensor=0-scope=1-npi_present=1	0		the ladies who always return to any sheep drop by art galleries .
experiment=NPI-env=adverbs-npi=any-crucial_item=always-licensor=0-scope=0-npi_present=1	0		the ladies who always return to sheep drop by any art galleries .
experiment=NPI-env=adverbs-npi=any-crucial_item=always-licensor=0-scope=0-npi_present=0	1		the ladies who always return to sheep drop by the art galleries .
experiment=NPI-env=adverbs-npi=any-crucial_item=rarely-licensor=1-scope=1-npi_present=1	1		the ladies who rarely return to any sheep drop by art galleries .
experiment=NPI-env=adverbs-npi=any-crucial_item=rarely-licensor=1-scope=0-npi_present=0	1		the ladies who rarely return to sheep drop by the art galleries .
experiment=NPI-env=adverbs-npi=any-crucial_item=sometimes-licensor=0-scope=1-npi_present=1	0		the children who sometimes visited any lice have escaped from cashiers .
experiment=NPI-env=adverbs-npi=any-crucial_item=sometimes-licensor=0-scope=1-npi_present=0	1		the children who sometimes visited the lice have escaped from cashiers .
experiment=NPI-env=adverbs-npi=any-crucial_item=often-licensor=0-scope=1-npi_present=0	1		a customer who often helped the drivers tours restaurants .
experiment=NPI-env=adverbs-npi=any-crucial_item=barely-licensor=1-scope=1-npi_present=1	1		a customer who barely helped any drivers tours restaurants .
experiment=NPI-env=adverbs-npi=any-crucial_item=barely-licensor=1-scope=0-npi_present=1	0		a customer who barely helped drivers tours any restaurants .
experiment=NPI-env=adverbs-npi=any-crucial_item=barely-licensor=1-scope=0-npi_present=0	1		a customer who barely helped drivers tours the restaurants .
experiment=NPI-env=adverbs-npi=any-crucial_item=sometimes-licensor=0-scope=1-npi_present=1	0		the doctor who would sometimes arrive at any banks would love men .
experiment=NPI-env=adverbs-npi=any-crucial_item=sometimes-licensor=0-scope=1-npi_present=0	1		the doctor who would sometimes arrive at the banks would love men .
experiment=NPI-env=adverbs-npi=any-crucial_item=sometimes-licensor=0-scope=0-npi_present=1	0		the doctor who would sometimes arrive at banks would love any men .
experiment=NPI-env=adverbs-npi=any-crucial_item=seldom-licensor=1-scope=1-npi_present=0	1		the doctor who would seldom arrive at the banks would love men .
experiment=NPI-env=adverbs-npi=any-crucial_item=seldom-licensor=1-scope=0-npi_present=0	1		the doctor who would seldom arrive at banks would love the men .
experiment=NPI-env=adverbs-npi=any-crucial_item=hardly-licensor=1-scope=1-npi_present=1	1		a child who hardly praises any sheep can love guests .
experiment=NPI-env=adverbs-npi=any-crucial_item=hardly-licensor=1-scope=1-npi_present=0	1		a child who hardly praises the sheep can love guests .
experiment=NPI-env=adverbs-npi=any-crucial_item=hardly-licensor=1-scope=0-npi_present=1	0		a child who hardly praises sheep can love any guests .
experiment=NPI-env=adverbs-npi=any-crucial_item=hardly-licensor=1-scope=0-npi_present=0	1		a child who hardly praises sheep can love the guests .
experiment=NPI-env=adverbs-npi=any-crucial_item=barely-licensor=1-scope=1-npi_present=1	1		a guest who barely admires any gals drove to public parks .
experiment=NPI-env=adverbs-npi=any-crucial_item=barely-licensor=1-scope=0-npi_present=1	0		a guest who barely admires gals drove to any public parks .
experiment=NPI-env=adverbs-npi=any-crucial_item=always-licensor=0-scope=1-npi_present=0	1		the child who has always returned to the libraries might flee from malls .
experiment=NPI-env=adverbs-npi=any-crucial_item=always-licensor=0-scope=0-npi_present=0	1		the child who has always returned to libraries might flee from the malls .
experiment=NPI-env=adverbs-npi=any-crucial_item=hardly-licensor=1-scope=1-npi_present=1	1		the child who has hardly returned to any libraries might flee from malls .
experiment=NPI-env=adverbs-npi=any-crucial_item=always-licensor=0-scope=0-npi_present=0	1		a man who always did praise geese had gone to the banks .
experiment=NPI-env=adverbs-npi=any-crucial_item=seldom-licensor=1-scope=1-npi_present=1	1		a man who seldom did praise any geese had gone to banks .
experiment=NPI-env=adverbs-npi=any-crucial_item=seldom-licensor=1-scope=0-npi_present=1	0		a man who seldom did praise geese had gone to any banks .
experiment=NPI-env=adverbs-npi=any-crucial_item=often-licensor=0-scope=1-npi_present=1	0		the adult who often has any pamphlets had plates .
experiment=NPI-env=adverbs-npi=any-crucial_item=hardly-licensor=1-scope=0-npi_present=1	0		the adult who hardly has pamphlets had any plates .
experiment=NPI-env=adverbs-npi=any-crucial_item=hardly-licensor=1-scope=0-npi_present=0	1		the adult who hardly has pamphlets had the plates .
experiment=NPI-env=adverbs-npi=any-crucial_item=always-licensor=0-scope=0-npi_present=1	0		the teacher who always knows boys knows any oxen .
experiment=NPI-env=adverbs-npi=any-crucial_item=always-licensor=0-scope=0-npi_present=0	1		the teacher who always knows boys knows the oxen .
experiment=NPI-env=adverbs-npi=any-crucial_item=rarely-licensor=1-scope=1-npi_present=1	1		the teacher who rarely knows any boys knows oxen .
experiment=NPI-env=adverbs-npi=any-crucial_item=rarely-licensor=1-scope=1-npi_present=0	1		the teacher who rarely knows the boys knows oxen .
experiment=NPI-env=adverbs-npi=any-crucial_item=often-licensor=0-scope=1-npi_present=0	1		a student who often approaches the patients could listen to fish .
experiment=NPI-env=adverbs-npi=any-crucial_item=often-licensor=0-scope=0-npi_present=1	0		a student who often approaches patients could listen to any fish .
experiment=NPI-env=adverbs-npi=any-crucial_item=often-licensor=0-scope=0-npi_present=0	1		the waitresses who had often left children explored the hospitals .
experiment=NPI-env=adverbs-npi=any-crucial_item=rarely-licensor=1-scope=1-npi_present=1	1		the waitresses who had rarely left any children explored hospitals .
experiment=NPI-env=adverbs-npi=any-crucial_item=rarely-licensor=1-scope=1-npi_present=0	1		the waitresses who had rarely left the children explored hospitals .
experiment=NPI-env=adverbs-npi=any-crucial_item=rarely-licensor=1-scope=0-npi_present=1	0		the waitresses who had rarely left children explored any hospitals .
experiment=NPI-env=adverbs-npi=any-crucial_item=often-licensor=0-scope=1-npi_present=0	1		the adult who often cares for the waitresses had explored malls .
experiment=NPI-env=adverbs-npi=any-crucial_item=often-licensor=0-scope=0-npi_present=1	0		the adult who often cares for waitresses had explored any malls .
experiment=NPI-env=adverbs-npi=any-crucial_item=seldom-licensor=1-scope=0-npi_present=1	0		the adult who seldom cares for waitresses had explored any malls .
experiment=NPI-env=adverbs-npi=any-crucial_item=sometimes-licensor=0-scope=1-npi_present=1	0		the adults who would sometimes talk to any girls have described restaurants .
experiment=NPI-env=adverbs-npi=any-crucial_item=sometimes-licensor=0-scope=1-npi_present=0	1		the adults who would sometimes talk to the girls have described restaurants .
experiment=NPI-env=adverbs-npi=any-crucial_item=seldom-licensor=1-scope=0-npi_present=0	1		a doctor who seldom forgets girls bikes to the banks .
experiment=NPI-env=adverbs-npi=any-crucial_item=always-licensor=0-scope=0-npi_present=1	0		the waitresses who always attacked drivers boycott any schools .
experiment=NPI-env=adverbs-npi=any-crucial_item=barely-licensor=1-scope=1-npi_present=0	1		the waitresses who barely attacked the drivers boycott schools .
experiment=NPI-env=adverbs-npi=any-crucial_item=barely-licensor=1-scope=0-npi_present=0	1		the waitresses who barely attacked drivers boycott the schools .
experiment=NPI-env=adverbs-npi=any-crucial_item=scarcely-licensor=1-scope=0-npi_present=1	0		the drivers who scarcely investigated banks should like any pants .
experiment=NPI-env=adverbs-npi=any-crucial_item=barely-licensor=1-scope=0-npi_present=1	0		an actor who barely helps alumni has taken any couches .
experiment=NPI-env=adverbs-npi=any-crucial_item=rarely-licensor=1-scope=0-npi_present=1	0		a doctor who might rarely talk to ladies has bought any pants .
experiment=NPI-env=adverbs-npi=any-crucial_item=rarely-licensor=1-scope=0-npi_present=0	1		a doctor who might rarely talk to ladies has bought the pants .
experiment=NPI-env=adverbs-npi=any-crucial_item=always-licensor=0-scope=0-npi_present=1	0		a person who had always left libraries might like any girls .
experiment=NPI-env=adverbs-npi=any-crucial_item=always-licensor=0-scope=0-npi_present=0	1		a person who had always left libraries might like the girls .
experiment=NPI-env=adverbs-npi=any-crucial_item=barely-licensor=1-scope=1-npi_present=1	1		the actors who barely skate around any schools might hug people .
experiment=NPI-env=adverbs-npi=any-crucial_item=barely-licensor=1-scope=1-npi_present=0	1		the actors who barely skate around the schools might hug people .
experiment=NPI-env=adverbs-npi=any-crucial_item=barely-licensor=1-scope=0-npi_present=0	1		the actors who barely skate around schools might hug the people .
experiment=NPI-env=adverbs-npi=any-crucial_item=barely-licensor=1-scope=0-npi_present=1	0		the children who might barely talk to mice criticize any children .
experiment=NPI-env=adverbs-npi=any-crucial_item=often-licensor=0-scope=1-npi_present=1	0		the children who often observe any children should watch cashiers .
experiment=NPI-env=adverbs-npi=any-crucial_item=often-licensor=0-scope=0-npi_present=1	0		the children who often observe children should watch any cashiers .
experiment=NPI-env=adverbs-npi=any-crucial_item=rarely-licensor=1-scope=1-npi_present=1	1		the children who rarely observe any children should watch cashiers .
experiment=NPI-env=adverbs-npi=any-crucial_item=rarely-licensor=1-scope=0-npi_present=0	1		the children who rarely observe children should watch the cashiers .
experiment=NPI-env=adverbs-npi=any-crucial_item=always-licensor=0-scope=1-npi_present=1	0		a boy who has always talked about any hospitals watched doctors .
experiment=NPI-env=adverbs-npi=any-crucial_item=always-licensor=0-scope=0-npi_present=0	1		a boy who has always talked about hospitals watched the doctors .
experiment=NPI-env=adverbs-npi=any-crucial_item=always-licensor=0-scope=1-npi_present=0	1		the lady who always criticizes the malls had listened to mice .
experiment=NPI-env=adverbs-npi=any-crucial_item=always-licensor=0-scope=0-npi_present=1	0		the lady who always criticizes malls had listened to any mice .
experiment=NPI-env=adverbs-npi=any-crucial_item=rarely-licensor=1-scope=1-npi_present=1	1		the lady who rarely criticizes any malls had listened to mice .
experiment=NPI-env=adverbs-npi=any-crucial_item=rarely-licensor=1-scope=1-npi_present=0	1		the lady who rarely criticizes the malls had listened to mice .
experiment=NPI-env=adverbs-npi=any-crucial_item=rarely-licensor=1-scope=0-npi_present=1	0		the lady who rarely criticizes malls had listened to any mice .
experiment=NPI-env=adverbs-npi=any-crucial_item=often-licensor=0-scope=1-npi_present=1	0		the patients who often biked to any high schools had escaped from pedestrians .
experiment=NPI-env=adverbs-npi=any-crucial_item=often-licensor=0-scope=0-npi_present=1	0		the patients who often biked to high schools had escaped from any pedestrians .
experiment=NPI-env=adverbs-npi=any-crucial_item=scarcely-licensor=1-scope=0-npi_present=1	0		the patients who scarcely biked to high schools had escaped from any pedestrians .
experiment=NPI-env=adverbs-npi=any-crucial_item=scarcely-licensor=1-scope=0-npi_present=0	1		the patients who scarcely biked to high schools had escaped from the pedestrians .
experiment=NPI-env=adverbs-npi=any-crucial_item=always-licensor=0-scope=1-npi_present=0	1		an adult who always listened to the sheep can discuss hospitals .
