	experiment	environment	npi	crucial_item	licensor	scope	npi_present	paradigm	acceptability	blank	sentence	rand_int
1122	NPI	sentential_negation_biclausal	any	not	1	1	1	5604	1	NA	The teachers were not imagining that any actors are practicing.	99746
1128	NPI	questions	inyears	_	0	1	0	3193	1	NA	The children know that the waiters took the couches as well.	99745
1129	NPI	sentential_negation_biclausal	in years	really	0	1	1	3806	0	NA	The senators really thought that the guy has complained in years.	99745
1143	NPI	only	either	_	1	1	0	5045	1	NA	Only the women drank for a while at the bank.	99742
1147	NPI	questions	either	_	0	0	0	4353	1	NA	The senators know on occasion that the doctor went to the malls.	99741
1153	NPI	determiner_negation_monoclausal	ever	no	1	1	1	323	1	NA	No dancers might ever forget the waitresses.	99738
1160	NPI	questions	ever	_	0	0	0	826	1	NA	The guests obviously know that the girl works with the girls.	99738
1165	NPI	only	inyears	_	1	1	1	4306	0	NA	Only the guest had performed in years at the grocery store.	99737
1166	NPI	only	inyears	_	1	1	0	4501	1	NA	Only the senators ran around grocery stores as well at the movie theater.	99737
1175	NPI	determiner_negation_biclausal	either	some	0	0	1	4026	0	NA	The boy is saying either that some high schools can resemble the guy.	99734
1197	NPI	determiner_negation_biclausal	at all	some	0	1	1	2630	0	NA	Some actor was explaining that the guests had been at the hospitals at all.	99729
1204	NPI	sentential_negation_biclausal	in years	not	1	1	0	3874	1	NA	The child has not thought that the waitresses have attacked a man on weekends.	99728
1243	NPI	adverbs	inyears	always	0	0	1	3863	0	NA	The students who always won have drunk in years.	99716
1251	NPI	questions	either	_	1	1	0	4422	1	NA	The actors wonder whether the women are touring the museums for a while.	99715
1258	NPI	quantifier	atall		0	0	0	3342	1	NA	Ladies who had boycotted a lot of banks have praised a lot of students for a while.	99713
1273	NPI	determiner_negation_biclausal	ever	some	0	1	1	421	0	NA	Some guest was ever imagining that the stories disagree.	99709
1278	NPI	sentential_negation_biclausal	at all	really	0	0	1	2600	0	NA	The senators were explaining at all that the documentaries have really won.	99709
1283	NPI	determiner_negation_monoclausal	either	some	0	1	1	4118	0	NA	Some adult had hated the dancers either.	99707
1298	NPI	quantifier	inyears	some	0	0	1	4470	0	NA	Some students who admired many gloves have passed banks in years.	99704
1389	NPI	only	either	_	1	0	1	5824	0	NA	The girl is muttering either only at the public park.	99684
1409	NPI	adverbs	either	barely	1	1	1	4841	1	NA	The cashiers who had barely telephoned either slump over.	99679
1439	NPI	determiner_negation_biclausal	yet	some	0	1	1	1253	0	NA	Some girls have said that the cars resemble the ladies yet.	99673
1524	NPI	questions	atall	_	1	1	1	2883	1	NA	The drivers wonder whether the child is being at museums at all.	99650
1548	NPI	quantifier	any		0	1	0	406	1	NA	Actors who are returning to the girls had returned to some boys.	99644
1592	NPI	determiner_negation_monoclausal	yet	some	0	0	1	1374	0	NA	A teacher had kissed the guests yet at some cafes.	99633
1597	NPI	sentential_negation_biclausal	any	not	1	1	0	5462	1	NA	The adults should not think that the cars should resemble the dish.	99632
1655	NPI	quantifier	atall	every	1	1	1	3205	1	NA	Every child who has loved more than three plays at all observes some men.	99618
1666	NPI	adverbs	either	barely	1	0	1	4391	0	NA	The students who barely described art galleries talked to children either.	99615
1705	NPI	superlative	any	bad	0	0	0	1742	1	NA	These drivers know the bad teenagers that waitresses had disliked.	99607
1729	NPI	questions	inyears	_	0	0	1	3748	0	NA	The pedestrians know in years that the patients have driven to the banks.	99601
1756	NPI	determiner_negation_monoclausal	at all	no	1	0	0	2973	1	NA	An adult is discussing the guys on weekends at no college campuses.	99596
1777	NPI	conditional	any	_	0	0	1	1736	0	NA	While the patient been at the high schools, the girl flees from any pedestrians.	99592
1791	NPI	superlative	inyears	bad	0	0	1	4563	0	NA	The adults who talked to the bad boy admire ladies in years.	99590
2035	NPI	conditional	either	_	0	0	0	5221	1	NA	While the guests talked about the students, the guests should have the students on weekends.	99537
2056	NPI	simplequestions	atall	_	0	1	1	3044	0	NA	The person would flee from the guys at all.	99535
2222	NPI	conditional	any	_	1	0	1	1480	0	NA	If the doctors worked with the customers, the girls can leave any children.	99493
12999	NPI	questions	any	_	1	0	1	1000	0	NA	Any boys wonder whether the driver will admire newspaper articles.	97016
27624	NPI	questions	any	_	0	0	1	1000	0	NA	The boys any know that the driver will admire the newspaper articles.	93757
60673	NPI	questions	any	_	0	1	1	1000	0	NA	The boys know that the driver will admire any newspaper articles.	86330
224085	NPI	questions	any	_	1	0	0	1000	1	NA	The boys wonder whether the driver will admire newspaper articles.	49396
253977	NPI	questions	any	_	1	1	1	1000	1	NA	The boys wonder whether the driver will admire any newspaper articles.	42609
294630	NPI	questions	any	_	0	1	0	1000	1	NA	The boys know that the driver will admire the newspaper articles.	33416
324570	NPI	questions	any	_	0	0	0	1000	1	NA	The boys know that the driver will admire the newspaper articles.	26660
359131	NPI	questions	any	_	1	1	0	1000	1	NA	The boys wonder whether the driver will admire the newspaper articles.	18854
